caseref,caseid,casesystemid,namedindividual,accusedref,casestart_date,casestart_date_as_date,case_date,case_date_as_date,age_at_case,casecommonname,commission,complaint,correspondence,chronicle,other,suspects_text,unorthodoxrelpract_p,unorthodoxrelpract_s,consulting_p,consulting_s,demonic_p,demonic_s,demonic_possess_p,demonic_possess_s,fairies_p,fairies_s,folk_healing_p,folk_healing_s,maleficium_p,maleficium_s,midwifery_p,midwifery_s,implicatedbyanother_p,implicatedbyanother_s,neighbhd_dispute_p,neighbhd_dispute_s,politicalmotive_p,politicalmotive_s,propertymotive_p,propertymotive_s,refusedcharity_p,refusedcharity_s,treason_p,treason_s,other_p,other_s,e_chr,othertext,notenoughinfo_p,notenoughinfo_s,whitemagic_p,whitemagic_s,whitemagic_c,charnotes,demonicpact,devilnotes,witchesmeeting,meetingname,devilpresent,maleficium,communalsex,devilworship,foodanddrink,dancing,singing,singingtext,otherpractices,meetingnotes,elphane_fairyland,food_drink,specificverbalformulae,specificritualacts,familiars,shape_changing,dreams_visions,unorthodoxreligiouspractice,sympatheticmagic,ridingdead,folknotes,humanillness,humandeath,animalillness,animaldeath,femaleinfertility,maleimpotence,aggravatingdisease,transferringdisease,layingon,removalbewitchment,quarreling,cursing,poisoning,rechealer,healinghumans,healinganimals,midwifery,diseasenotes,propertydamage,weathermodification,othermaleficianotes,otherchargesnotes,claimedbewitched,claimedpossessed,admitlessercharge,claimednaturalcauses,nodefence,defensenotes,casenotes,createdby,createdate,lastupdatedby,lastupdatedon
C/EGD/10,10,EGD,0,,2/8/1649,2049-08-02T00:00:00,2/8/1649,2049-08-02T00:00:00,,3 unnamed witches,commission for execution,,,,,3,FALSE,FALSE,FALSE,FALSE,FALSE,FALSE,FALSE,FALSE,FALSE,FALSE,FALSE,FALSE,FALSE,FALSE,FALSE,FALSE,FALSE,FALSE,FALSE,FALSE,FALSE,FALSE,FALSE,FALSE,FALSE,FALSE,FALSE,FALSE,FALSE,FALSE,0,,TRUE,TRUE,FALSE,FALSE,0,,FALSE,,FALSE,,FALSE,FALSE,FALSE,FALSE,FALSE,FALSE,FALSE,,,,FALSE,FALSE,FALSE,FALSE,FALSE,FALSE,FALSE,FALSE,FALSE,FALSE,,FALSE,FALSE,FALSE,FALSE,FALSE,FALSE,FALSE,FALSE,FALSE,FALSE,FALSE,FALSE,FALSE,FALSE,FALSE,FALSE,FALSE,,FALSE,FALSE,,,FALSE,FALSE,FALSE,FALSE,FALSE,,certain persons from Haymouth.,SMD,2001-05-15T17:00:16,jhm,2002-07-30T15:32:43
C/EGD/100,100,EGD,-1,A/EGD/89,27/1/1591,1991-01-27T00:00:00,8/5/1591,1991-05-08T00:00:00,,"Kerington,Cristine",,,,,,,FALSE,FALSE,FALSE,FALSE,FALSE,FALSE,FALSE,FALSE,FALSE,FALSE,FALSE,FALSE,FALSE,FALSE,FALSE,FALSE,FALSE,TRUE,FALSE,FALSE,FALSE,FALSE,FALSE,FALSE,FALSE,FALSE,FALSE,FALSE,FALSE,FALSE,1,,TRUE,TRUE,FALSE,FALSE,0,"Part of the North Berwick witch hunt.  It involved many people and many accustions about witches meetings, specifically two separate attempts to sink the royal ships.  The first to sink Queen Anne on her way home, second to trouble King James after he went to get her in Denmark.",FALSE,Said by others to have met the devil as a 'mekle black man',FALSE,,FALSE,FALSE,FALSE,FALSE,FALSE,FALSE,FALSE,,,"See Agnes Sampson's case for description of North Berwick meeting (c/egd/63).  See also Napier (c/egd/103) for more details about the North Berwick meeting. Meeting said to have taken place at the kirk at North Berwick, and a trump was played as a musical instrument.",FALSE,FALSE,FALSE,FALSE,FALSE,FALSE,FALSE,FALSE,FALSE,FALSE,"In other accused's confession it was said that they had used corpse and corpse powder, and had met at halloween.",FALSE,FALSE,FALSE,FALSE,FALSE,FALSE,FALSE,FALSE,FALSE,FALSE,FALSE,FALSE,FALSE,FALSE,FALSE,FALSE,FALSE,,FALSE,FALSE,,,FALSE,FALSE,FALSE,FALSE,FALSE,,,SMD,2001-05-15T17:00:16,jhm,2002-10-10T14:51:54
C/EGD/1000,1000,EGD,-1,A/EGD/989,6/5/1627,2027-05-06T00:00:00,6/5/1627,2027-05-06T00:00:00,,"Craig,Christiane",,,,,,,FALSE,FALSE,FALSE,FALSE,FALSE,FALSE,FALSE,FALSE,FALSE,FALSE,FALSE,FALSE,FALSE,FALSE,FALSE,FALSE,FALSE,FALSE,FALSE,FALSE,FALSE,FALSE,FALSE,FALSE,FALSE,FALSE,FALSE,FALSE,FALSE,FALSE,0,,TRUE,TRUE,FALSE,FALSE,0,,FALSE,,FALSE,,FALSE,FALSE,FALSE,FALSE,FALSE,FALSE,FALSE,,,,FALSE,FALSE,FALSE,FALSE,FALSE,FALSE,FALSE,FALSE,FALSE,FALSE,,FALSE,FALSE,FALSE,FALSE,FALSE,FALSE,FALSE,FALSE,FALSE,FALSE,FALSE,FALSE,FALSE,FALSE,FALSE,FALSE,FALSE,,FALSE,FALSE,,,FALSE,FALSE,FALSE,FALSE,FALSE,,,SMD,2001-05-15T17:00:16,jhm,2002-10-09T15:52:09
C/EGD/1001,1001,EGD,-1,A/EGD/990,,,25/4/1627,2027-04-25T00:00:00,,"Ronaldson,Margaret",,,,,,,FALSE,FALSE,FALSE,FALSE,FALSE,FALSE,FALSE,FALSE,FALSE,FALSE,FALSE,FALSE,FALSE,FALSE,FALSE,FALSE,FALSE,FALSE,FALSE,FALSE,FALSE,FALSE,FALSE,FALSE,FALSE,FALSE,FALSE,FALSE,FALSE,FALSE,0,,TRUE,TRUE,FALSE,FALSE,0,,FALSE,,FALSE,,FALSE,FALSE,FALSE,FALSE,FALSE,FALSE,FALSE,,,,FALSE,FALSE,FALSE,FALSE,FALSE,FALSE,FALSE,FALSE,FALSE,FALSE,,FALSE,FALSE,FALSE,FALSE,FALSE,FALSE,FALSE,FALSE,FALSE,FALSE,FALSE,FALSE,FALSE,FALSE,FALSE,FALSE,FALSE,,FALSE,FALSE,,,FALSE,FALSE,FALSE,FALSE,FALSE,,,SMD,2001-05-15T17:00:16,jhm,2002-09-18T15:23:08
C/EGD/1002,1002,EGD,-1,A/EGD/991,,,3/5/1627,2027-05-03T00:00:00,,"Broun,Bessie",,,,,,,FALSE,FALSE,FALSE,FALSE,FALSE,FALSE,FALSE,FALSE,FALSE,FALSE,FALSE,FALSE,FALSE,FALSE,FALSE,FALSE,FALSE,FALSE,FALSE,FALSE,FALSE,FALSE,FALSE,FALSE,FALSE,FALSE,FALSE,FALSE,FALSE,FALSE,0,,TRUE,TRUE,FALSE,FALSE,0,,FALSE,,FALSE,,FALSE,FALSE,FALSE,FALSE,FALSE,FALSE,FALSE,,,,FALSE,FALSE,FALSE,FALSE,FALSE,FALSE,FALSE,FALSE,FALSE,FALSE,,FALSE,FALSE,FALSE,FALSE,FALSE,FALSE,FALSE,FALSE,FALSE,FALSE,FALSE,FALSE,FALSE,FALSE,FALSE,FALSE,FALSE,,FALSE,FALSE,,,FALSE,FALSE,FALSE,FALSE,FALSE,,,SMD,2001-05-15T17:00:16,jhm,2002-11-13T13:59:41
C/EGD/1003,1003,EGD,-1,A/EGD/992,,,17/5/1627,2027-05-17T00:00:00,,"Hendersoune,Margaret",,,,,,,FALSE,FALSE,FALSE,FALSE,FALSE,TRUE,FALSE,FALSE,FALSE,FALSE,FALSE,FALSE,FALSE,FALSE,FALSE,FALSE,FALSE,TRUE,FALSE,FALSE,FALSE,FALSE,FALSE,FALSE,FALSE,FALSE,FALSE,FALSE,FALSE,FALSE,2,,TRUE,TRUE,FALSE,FALSE,0,,FALSE,Conversing with the Devil,FALSE,,FALSE,FALSE,FALSE,FALSE,FALSE,FALSE,FALSE,,,,FALSE,FALSE,FALSE,FALSE,FALSE,FALSE,FALSE,FALSE,FALSE,FALSE,,FALSE,FALSE,FALSE,FALSE,FALSE,FALSE,FALSE,FALSE,FALSE,FALSE,FALSE,FALSE,FALSE,FALSE,FALSE,FALSE,FALSE,,FALSE,FALSE,,,FALSE,FALSE,FALSE,FALSE,FALSE,,,SMD,2001-05-15T17:00:16,jhm,2002-10-01T10:13:17
C/EGD/1005,1005,EGD,-1,A/EGD/994,17/11/1627,2027-11-17T00:00:00,11/11/1630,2030-11-11T00:00:00,,"Crystie,Katherene",,,,,,,FALSE,FALSE,FALSE,FALSE,FALSE,FALSE,FALSE,FALSE,FALSE,FALSE,FALSE,FALSE,FALSE,FALSE,FALSE,FALSE,FALSE,FALSE,FALSE,FALSE,FALSE,TRUE,FALSE,FALSE,FALSE,FALSE,FALSE,FALSE,FALSE,FALSE,1,,TRUE,TRUE,FALSE,FALSE,0,,FALSE,,FALSE,,FALSE,FALSE,FALSE,FALSE,FALSE,FALSE,FALSE,,,,FALSE,FALSE,FALSE,FALSE,FALSE,FALSE,FALSE,FALSE,FALSE,FALSE,,FALSE,FALSE,FALSE,FALSE,FALSE,FALSE,FALSE,FALSE,FALSE,FALSE,FALSE,FALSE,FALSE,FALSE,FALSE,FALSE,FALSE,,FALSE,FALSE,,,FALSE,FALSE,FALSE,FALSE,FALSE,,"A very complicated case that moved back and forth from Edinburgh to Dysart during the course ofher two trials.  Definite factional politics at play amongst the bailies and ministers of Dysart. There is a source listed by MacDonald that we have not checked, which records a date of 30/8/1643.",SMD,2001-05-15T17:00:16,jhm,2002-10-01T10:35:52
C/EGD/1006,1006,EGD,-1,A/EGD/995,,,23/4/1628,2028-04-23T00:00:00,,"Reany,Jonnat",,,,,,,FALSE,FALSE,FALSE,FALSE,FALSE,FALSE,FALSE,FALSE,FALSE,FALSE,FALSE,FALSE,FALSE,FALSE,FALSE,FALSE,FALSE,FALSE,FALSE,FALSE,FALSE,FALSE,FALSE,FALSE,FALSE,FALSE,FALSE,FALSE,FALSE,FALSE,0,,TRUE,TRUE,FALSE,FALSE,0,,FALSE,,FALSE,,FALSE,FALSE,FALSE,FALSE,FALSE,FALSE,FALSE,,,,FALSE,FALSE,FALSE,FALSE,FALSE,FALSE,FALSE,FALSE,FALSE,FALSE,,FALSE,FALSE,FALSE,FALSE,FALSE,FALSE,FALSE,FALSE,FALSE,FALSE,FALSE,FALSE,FALSE,FALSE,FALSE,FALSE,FALSE,,FALSE,FALSE,,,FALSE,FALSE,FALSE,FALSE,FALSE,,,SMD,2001-05-15T17:00:16,jhm,2002-10-01T10:25:15
C/EGD/1007,1007,EGD,-1,A/EGD/996,5/6/1628,2028-06-05T00:00:00,5/6/1628,2028-06-05T00:00:00,,"Stowane,Mawsie",,,,,,,FALSE,FALSE,FALSE,FALSE,FALSE,FALSE,FALSE,FALSE,FALSE,FALSE,FALSE,FALSE,FALSE,FALSE,FALSE,FALSE,FALSE,FALSE,FALSE,FALSE,FALSE,FALSE,FALSE,FALSE,FALSE,FALSE,FALSE,FALSE,FALSE,FALSE,0,,TRUE,TRUE,FALSE,FALSE,0,,FALSE,,FALSE,,FALSE,FALSE,FALSE,FALSE,FALSE,FALSE,FALSE,,,,FALSE,FALSE,FALSE,FALSE,FALSE,FALSE,FALSE,FALSE,FALSE,FALSE,,FALSE,FALSE,FALSE,FALSE,FALSE,FALSE,FALSE,FALSE,FALSE,FALSE,FALSE,FALSE,FALSE,FALSE,FALSE,FALSE,FALSE,,FALSE,FALSE,,,FALSE,FALSE,FALSE,FALSE,FALSE,,,SMD,2001-05-15T17:00:16,jhm,2002-10-01T10:30:25
C/EGD/1008,1008,EGD,-1,A/EGD/997,6/5/1628,2028-05-06T00:00:00,6/5/1628,2028-05-06T00:00:00,,"Charters,Agnes",,,,,,,FALSE,FALSE,FALSE,FALSE,FALSE,FALSE,FALSE,FALSE,FALSE,FALSE,FALSE,FALSE,FALSE,FALSE,FALSE,FALSE,FALSE,FALSE,FALSE,FALSE,FALSE,FALSE,FALSE,FALSE,FALSE,FALSE,FALSE,FALSE,FALSE,FALSE,0,,TRUE,TRUE,FALSE,FALSE,0,,FALSE,,FALSE,,FALSE,FALSE,FALSE,FALSE,FALSE,FALSE,FALSE,,,,FALSE,FALSE,FALSE,FALSE,FALSE,FALSE,FALSE,FALSE,FALSE,FALSE,,FALSE,FALSE,FALSE,FALSE,FALSE,FALSE,FALSE,FALSE,FALSE,FALSE,FALSE,FALSE,FALSE,FALSE,FALSE,FALSE,FALSE,,FALSE,FALSE,,,FALSE,FALSE,FALSE,FALSE,FALSE,,,SMD,2001-05-15T17:00:16,jhm,2002-10-01T10:30:16
C/EGD/1009,1009,EGD,-1,A/EGD/998,6/5/1628,2028-05-06T00:00:00,6/5/1628,2028-05-06T00:00:00,,"Dungalson,Agnes",,,,,,,FALSE,FALSE,FALSE,FALSE,FALSE,FALSE,FALSE,FALSE,FALSE,FALSE,FALSE,FALSE,FALSE,FALSE,FALSE,FALSE,FALSE,FALSE,FALSE,FALSE,FALSE,FALSE,FALSE,FALSE,FALSE,FALSE,FALSE,FALSE,FALSE,FALSE,0,,TRUE,TRUE,FALSE,FALSE,0,,FALSE,,FALSE,,FALSE,FALSE,FALSE,FALSE,FALSE,FALSE,FALSE,,,,FALSE,FALSE,FALSE,FALSE,FALSE,FALSE,FALSE,FALSE,FALSE,FALSE,,FALSE,FALSE,FALSE,FALSE,FALSE,FALSE,FALSE,FALSE,FALSE,FALSE,FALSE,FALSE,FALSE,FALSE,FALSE,FALSE,FALSE,,FALSE,FALSE,,,FALSE,FALSE,FALSE,FALSE,FALSE,,,SMD,2001-05-15T17:00:16,jhm,2002-10-01T10:37:25
C/EGD/101,101,EGD,-1,A/EGD/90,27/1/1591,1991-01-27T00:00:00,27/1/1591,1991-01-27T00:00:00,,"Dun,Meg",,,,,,,FALSE,FALSE,FALSE,FALSE,FALSE,FALSE,FALSE,FALSE,FALSE,FALSE,FALSE,FALSE,FALSE,TRUE,FALSE,FALSE,FALSE,TRUE,FALSE,FALSE,FALSE,FALSE,FALSE,FALSE,FALSE,FALSE,FALSE,TRUE,FALSE,FALSE,3,,TRUE,TRUE,FALSE,FALSE,0,"Part of the North Berwick witch hunt.  It involved many people and many accustions about witches meetings, specifically two separate attempts to sink the royal ships.  The first to sink Queen Anne on her way home, the second to trouble King James after he went to get her in Denmark.",FALSE,,FALSE,,FALSE,FALSE,FALSE,FALSE,FALSE,FALSE,FALSE,,,Claimed by others that she was part of the planning of the conspiracy to sink Queen Anne'sI ships on the way from Denmark.  Said to have been at meetings at Beigis Tod's house and the salt pans. See Agnes Sampson's case for description of North Berwick meeting (c/egd/63).  She was supposedly part of the baptism of a cat.,FALSE,FALSE,FALSE,FALSE,FALSE,FALSE,FALSE,FALSE,FALSE,FALSE,She was included in the ritual to tie joints to the feet of a cat and then cast it into the sea to raise storms.,FALSE,FALSE,FALSE,FALSE,FALSE,FALSE,FALSE,FALSE,FALSE,FALSE,FALSE,FALSE,FALSE,FALSE,FALSE,FALSE,FALSE,,FALSE,FALSE,Said to have been part of the plot to sink the ships of James VI and his wife Anne of Denmark. Claimed by others that they raised storms and winds.,,FALSE,FALSE,FALSE,FALSE,FALSE,,,SMD,2001-05-15T17:00:16,LEM,2002-10-10T16:10:30
C/EGD/1010,1010,EGD,-1,A/EGD/999,6/5/1628,2028-05-06T00:00:00,6/5/1628,2028-05-06T00:00:00,,"Blaik,Helen",,,,,,,FALSE,FALSE,FALSE,FALSE,FALSE,FALSE,FALSE,FALSE,FALSE,FALSE,FALSE,FALSE,FALSE,FALSE,FALSE,FALSE,FALSE,FALSE,FALSE,FALSE,FALSE,FALSE,FALSE,FALSE,FALSE,FALSE,FALSE,FALSE,FALSE,FALSE,0,,TRUE,TRUE,FALSE,FALSE,0,,FALSE,,FALSE,,FALSE,FALSE,FALSE,FALSE,FALSE,FALSE,FALSE,,,,FALSE,FALSE,FALSE,FALSE,FALSE,FALSE,FALSE,FALSE,FALSE,FALSE,,FALSE,FALSE,FALSE,FALSE,FALSE,FALSE,FALSE,FALSE,FALSE,FALSE,FALSE,FALSE,FALSE,FALSE,FALSE,FALSE,FALSE,,FALSE,FALSE,,,FALSE,FALSE,FALSE,FALSE,FALSE,,,SMD,2001-05-15T17:00:16,jhm,2002-10-01T10:47:04
C/EGD/1011,1011,EGD,-1,A/EGD/1000,6/5/1628,2028-05-06T00:00:00,6/5/1628,2028-05-06T00:00:00,,"Aitkenhead,Christian",,,,,,,FALSE,FALSE,FALSE,FALSE,FALSE,FALSE,FALSE,FALSE,FALSE,FALSE,FALSE,FALSE,FALSE,FALSE,FALSE,FALSE,FALSE,FALSE,FALSE,FALSE,FALSE,FALSE,FALSE,FALSE,FALSE,FALSE,FALSE,FALSE,FALSE,FALSE,0,,TRUE,TRUE,FALSE,FALSE,0,,FALSE,,FALSE,,FALSE,FALSE,FALSE,FALSE,FALSE,FALSE,FALSE,,,,FALSE,FALSE,FALSE,FALSE,FALSE,FALSE,FALSE,FALSE,FALSE,FALSE,,FALSE,FALSE,FALSE,FALSE,FALSE,FALSE,FALSE,FALSE,FALSE,FALSE,FALSE,FALSE,FALSE,FALSE,FALSE,FALSE,FALSE,,FALSE,FALSE,,,FALSE,FALSE,FALSE,FALSE,FALSE,,,SMD,2001-05-15T17:00:16,jhm,2002-10-01T10:48:12
C/EGD/1012,1012,EGD,-1,A/EGD/1001,6/5/1628,2028-05-06T00:00:00,6/5/1628,2028-05-06T00:00:00,,"Ireland,Janet",,,,,,,FALSE,FALSE,FALSE,FALSE,FALSE,FALSE,FALSE,FALSE,FALSE,FALSE,FALSE,FALSE,FALSE,FALSE,FALSE,FALSE,FALSE,FALSE,FALSE,FALSE,FALSE,FALSE,FALSE,FALSE,FALSE,FALSE,FALSE,FALSE,FALSE,FALSE,0,,TRUE,TRUE,FALSE,FALSE,0,,FALSE,,FALSE,,FALSE,FALSE,FALSE,FALSE,FALSE,FALSE,FALSE,,,,FALSE,FALSE,FALSE,FALSE,FALSE,FALSE,FALSE,FALSE,FALSE,FALSE,,FALSE,FALSE,FALSE,FALSE,FALSE,FALSE,FALSE,FALSE,FALSE,FALSE,FALSE,FALSE,FALSE,FALSE,FALSE,FALSE,FALSE,,FALSE,FALSE,,,FALSE,FALSE,FALSE,FALSE,FALSE,,,SMD,2001-05-15T17:00:16,jhm,2002-10-01T10:49:00
C/EGD/1013,1013,EGD,-1,A/EGD/1002,3/7/1628,2028-07-03T00:00:00,3/7/1628,2028-07-03T00:00:00,,"Hendersoun,Agnes",,,,,,,FALSE,FALSE,FALSE,FALSE,FALSE,FALSE,FALSE,FALSE,FALSE,FALSE,FALSE,FALSE,FALSE,FALSE,FALSE,FALSE,FALSE,FALSE,FALSE,FALSE,FALSE,FALSE,FALSE,FALSE,FALSE,FALSE,FALSE,FALSE,FALSE,FALSE,0,,TRUE,TRUE,FALSE,FALSE,0,,FALSE,,FALSE,,FALSE,FALSE,FALSE,FALSE,FALSE,FALSE,FALSE,,,,FALSE,FALSE,FALSE,FALSE,FALSE,FALSE,FALSE,FALSE,FALSE,FALSE,,FALSE,FALSE,FALSE,FALSE,FALSE,FALSE,FALSE,FALSE,FALSE,FALSE,FALSE,FALSE,FALSE,FALSE,FALSE,FALSE,FALSE,,FALSE,FALSE,,,FALSE,FALSE,FALSE,FALSE,FALSE,,,SMD,2001-05-15T17:00:16,jhm,2002-10-01T10:50:07
C/EGD/1014,1014,EGD,-1,A/EGD/1003,3/7/1628,2028-07-03T00:00:00,3/7/1628,2028-07-03T00:00:00,,"Young,Margaret",,,,,,,FALSE,FALSE,FALSE,FALSE,FALSE,FALSE,FALSE,FALSE,FALSE,FALSE,FALSE,FALSE,FALSE,FALSE,FALSE,FALSE,FALSE,FALSE,FALSE,FALSE,FALSE,FALSE,FALSE,FALSE,FALSE,FALSE,FALSE,FALSE,FALSE,FALSE,0,,TRUE,TRUE,FALSE,FALSE,0,,FALSE,,FALSE,,FALSE,FALSE,FALSE,FALSE,FALSE,FALSE,FALSE,,,,FALSE,FALSE,FALSE,FALSE,FALSE,FALSE,FALSE,FALSE,FALSE,FALSE,,FALSE,FALSE,FALSE,FALSE,FALSE,FALSE,FALSE,FALSE,FALSE,FALSE,FALSE,FALSE,FALSE,FALSE,FALSE,FALSE,FALSE,,FALSE,FALSE,,,FALSE,FALSE,FALSE,FALSE,FALSE,,,SMD,2001-05-15T17:00:16,jhm,2002-10-01T10:51:51
C/EGD/1015,1015,EGD,-1,A/EGD/1004,3/7/1628,2028-07-03T00:00:00,3/7/1628,2028-07-03T00:00:00,,"Ridpeth,Margaret",,,,,,,FALSE,FALSE,FALSE,FALSE,FALSE,FALSE,FALSE,FALSE,FALSE,FALSE,FALSE,FALSE,FALSE,FALSE,FALSE,FALSE,FALSE,FALSE,FALSE,FALSE,FALSE,FALSE,FALSE,FALSE,FALSE,FALSE,FALSE,FALSE,FALSE,FALSE,0,,TRUE,TRUE,FALSE,FALSE,0,,FALSE,,FALSE,,FALSE,FALSE,FALSE,FALSE,FALSE,FALSE,FALSE,,,,FALSE,FALSE,FALSE,FALSE,FALSE,FALSE,FALSE,FALSE,FALSE,FALSE,,FALSE,FALSE,FALSE,FALSE,FALSE,FALSE,FALSE,FALSE,FALSE,FALSE,FALSE,FALSE,FALSE,FALSE,FALSE,FALSE,FALSE,,FALSE,FALSE,,,FALSE,FALSE,FALSE,FALSE,FALSE,,,SMD,2001-05-15T17:00:16,jhm,2002-10-01T10:53:14
C/EGD/1016,1016,EGD,-1,A/EGD/1005,3/7/1628,2028-07-03T00:00:00,3/7/1628,2028-07-03T00:00:00,50,"Reid,Janet",,,,,,,FALSE,FALSE,FALSE,FALSE,FALSE,FALSE,FALSE,FALSE,FALSE,FALSE,FALSE,FALSE,FALSE,FALSE,FALSE,FALSE,FALSE,TRUE,FALSE,FALSE,FALSE,FALSE,FALSE,FALSE,FALSE,FALSE,FALSE,FALSE,FALSE,FALSE,1,,TRUE,TRUE,FALSE,FALSE,0,,FALSE,,FALSE,,FALSE,FALSE,FALSE,FALSE,FALSE,FALSE,FALSE,,,,FALSE,FALSE,FALSE,FALSE,FALSE,FALSE,FALSE,FALSE,FALSE,FALSE,,FALSE,FALSE,FALSE,FALSE,FALSE,FALSE,FALSE,FALSE,FALSE,FALSE,FALSE,FALSE,FALSE,FALSE,FALSE,FALSE,FALSE,,FALSE,FALSE,,,FALSE,FALSE,FALSE,FALSE,FALSE,,,SMD,2001-05-15T17:00:16,LEM,2002-10-10T14:32:10
C/EGD/1017,1017,EGD,-1,A/EGD/1006,3/7/1628,2028-07-03T00:00:00,3/7/1628,2028-07-03T00:00:00,,"Rankein,Agnes",,,,,,,FALSE,FALSE,FALSE,FALSE,FALSE,FALSE,FALSE,FALSE,FALSE,FALSE,FALSE,FALSE,FALSE,FALSE,FALSE,FALSE,FALSE,FALSE,FALSE,FALSE,FALSE,FALSE,FALSE,FALSE,FALSE,FALSE,FALSE,FALSE,FALSE,FALSE,0,,TRUE,TRUE,FALSE,FALSE,0,,FALSE,,FALSE,,FALSE,FALSE,FALSE,FALSE,FALSE,FALSE,FALSE,,,,FALSE,FALSE,FALSE,FALSE,FALSE,FALSE,FALSE,FALSE,FALSE,FALSE,,FALSE,FALSE,FALSE,FALSE,FALSE,FALSE,FALSE,FALSE,FALSE,FALSE,FALSE,FALSE,FALSE,FALSE,FALSE,FALSE,FALSE,,FALSE,FALSE,,,FALSE,FALSE,FALSE,FALSE,FALSE,,,SMD,2001-05-15T17:00:16,jhm,2002-10-01T10:56:12
C/EGD/1018,1018,EGD,-1,A/EGD/1007,10/7/1628,2028-07-10T00:00:00,10/7/1628,2028-07-10T00:00:00,,"Mitchell,Marion",,,,,,,FALSE,FALSE,FALSE,FALSE,FALSE,FALSE,FALSE,FALSE,FALSE,FALSE,FALSE,FALSE,FALSE,FALSE,FALSE,FALSE,FALSE,TRUE,FALSE,FALSE,FALSE,FALSE,FALSE,FALSE,FALSE,FALSE,FALSE,FALSE,FALSE,FALSE,1,,TRUE,TRUE,FALSE,FALSE,0,,FALSE,,FALSE,,FALSE,FALSE,FALSE,FALSE,FALSE,FALSE,FALSE,,,,FALSE,FALSE,FALSE,FALSE,FALSE,FALSE,FALSE,FALSE,FALSE,FALSE,,FALSE,FALSE,FALSE,FALSE,FALSE,FALSE,FALSE,FALSE,FALSE,FALSE,FALSE,FALSE,FALSE,FALSE,FALSE,FALSE,FALSE,,FALSE,FALSE,,,FALSE,FALSE,FALSE,FALSE,FALSE,,,SMD,2001-05-15T17:00:16,LEM,2002-10-10T16:20:50
C/EGD/1019,1019,EGD,-1,A/EGD/1008,15/7/1628,2028-07-15T00:00:00,15/7/1628,2028-07-15T00:00:00,,"Liddell,Agnes",,,,,,,FALSE,FALSE,FALSE,FALSE,FALSE,FALSE,FALSE,FALSE,FALSE,FALSE,FALSE,FALSE,FALSE,FALSE,FALSE,FALSE,FALSE,FALSE,FALSE,FALSE,FALSE,FALSE,FALSE,FALSE,FALSE,FALSE,FALSE,FALSE,FALSE,FALSE,0,,TRUE,TRUE,FALSE,FALSE,0,,FALSE,,FALSE,,FALSE,FALSE,FALSE,FALSE,FALSE,FALSE,FALSE,,,,FALSE,FALSE,FALSE,FALSE,FALSE,FALSE,FALSE,FALSE,FALSE,FALSE,,FALSE,FALSE,FALSE,FALSE,FALSE,FALSE,FALSE,FALSE,FALSE,FALSE,FALSE,FALSE,FALSE,FALSE,FALSE,FALSE,FALSE,,FALSE,FALSE,,,FALSE,FALSE,FALSE,FALSE,FALSE,,,SMD,2001-05-15T17:00:16,jhm,2002-10-01T11:01:59
C/EGD/102,102,EGD,-1,A/EGD/91,27/1/1591,1991-01-27T00:00:00,8/5/1591,1991-05-08T00:00:00,,"McGillis,Catherine",,,,,,,FALSE,FALSE,FALSE,FALSE,FALSE,FALSE,FALSE,FALSE,FALSE,FALSE,FALSE,FALSE,FALSE,FALSE,FALSE,FALSE,FALSE,TRUE,FALSE,FALSE,FALSE,FALSE,FALSE,FALSE,FALSE,FALSE,FALSE,FALSE,FALSE,FALSE,1,,TRUE,TRUE,FALSE,FALSE,0,"Part of the North Berwick witch hunt.  It involved many people and many accustions about witches meetings, specifically two separate attempts to sink the royal ships.  The first to sink Queen Anne on her way home, second to trouble King James after he went to get her in Denmark.",FALSE,Others confessed that she met the devil as a 'mekle black man'.,FALSE,,FALSE,FALSE,FALSE,FALSE,FALSE,FALSE,FALSE,,,See Agnes Sampson's case for description of North Berwick meeting (c/egd/63).  See also Napier (c/egd/103) for more details about the North Berwick meeting. Claimed that she attended meeting at the kirk in North Berwick and that a trump was played.,FALSE,FALSE,FALSE,FALSE,FALSE,FALSE,FALSE,FALSE,FALSE,FALSE,Claimed by others that she was involved in using a corpse and powder from a corpse and attended meetings at Halloween.,FALSE,FALSE,FALSE,FALSE,FALSE,FALSE,FALSE,FALSE,FALSE,FALSE,FALSE,FALSE,FALSE,FALSE,FALSE,FALSE,FALSE,,FALSE,FALSE,,,FALSE,FALSE,FALSE,FALSE,FALSE,,,SMD,2001-05-15T17:00:16,jhm,2002-10-10T15:03:01
C/EGD/1020,1020,EGD,-1,A/EGD/1009,15/7/1628,2028-07-15T00:00:00,15/7/1628,2028-07-15T00:00:00,,"Oliver,Margaret",,,,,,,FALSE,FALSE,FALSE,FALSE,FALSE,FALSE,FALSE,FALSE,FALSE,FALSE,FALSE,FALSE,FALSE,FALSE,FALSE,FALSE,FALSE,FALSE,FALSE,FALSE,FALSE,FALSE,FALSE,FALSE,FALSE,FALSE,FALSE,FALSE,FALSE,FALSE,0,,TRUE,TRUE,FALSE,FALSE,0,,FALSE,,FALSE,,FALSE,FALSE,FALSE,FALSE,FALSE,FALSE,FALSE,,,,FALSE,FALSE,FALSE,FALSE,FALSE,FALSE,FALSE,FALSE,FALSE,FALSE,,FALSE,FALSE,FALSE,FALSE,FALSE,FALSE,FALSE,FALSE,FALSE,FALSE,FALSE,FALSE,FALSE,FALSE,FALSE,FALSE,FALSE,,FALSE,FALSE,,,FALSE,FALSE,FALSE,FALSE,FALSE,,,SMD,2001-05-15T17:00:16,jhm,2002-10-01T11:11:22
C/EGD/1021,1021,EGD,-1,A/EGD/1010,15/7/1628,2028-07-15T00:00:00,15/7/1628,2028-07-15T00:00:00,,"Mathie,Barbara",,,,,,,FALSE,FALSE,FALSE,FALSE,FALSE,FALSE,FALSE,FALSE,FALSE,FALSE,FALSE,FALSE,FALSE,FALSE,FALSE,FALSE,FALSE,FALSE,FALSE,FALSE,FALSE,FALSE,FALSE,FALSE,FALSE,FALSE,FALSE,FALSE,FALSE,FALSE,0,,TRUE,TRUE,FALSE,FALSE,0,,FALSE,,FALSE,,FALSE,FALSE,FALSE,FALSE,FALSE,FALSE,FALSE,,,,FALSE,FALSE,FALSE,FALSE,FALSE,FALSE,FALSE,FALSE,FALSE,FALSE,,FALSE,FALSE,FALSE,FALSE,FALSE,FALSE,FALSE,FALSE,FALSE,FALSE,FALSE,FALSE,FALSE,FALSE,FALSE,FALSE,FALSE,,FALSE,FALSE,,,FALSE,FALSE,FALSE,FALSE,FALSE,,,SMD,2001-05-15T17:00:16,jhm,2002-10-01T11:13:16
C/EGD/1022,1022,EGD,-1,A/EGD/1011,15/7/1628,2028-07-15T00:00:00,15/7/1628,2028-07-15T00:00:00,,"Riddell,Bessie",,,,,,,FALSE,FALSE,FALSE,FALSE,FALSE,FALSE,FALSE,FALSE,FALSE,FALSE,FALSE,FALSE,FALSE,FALSE,FALSE,FALSE,FALSE,FALSE,FALSE,FALSE,FALSE,FALSE,FALSE,FALSE,FALSE,FALSE,FALSE,FALSE,FALSE,FALSE,0,,TRUE,TRUE,FALSE,FALSE,0,,FALSE,,FALSE,,FALSE,FALSE,FALSE,FALSE,FALSE,FALSE,FALSE,,,,FALSE,FALSE,FALSE,FALSE,FALSE,FALSE,FALSE,FALSE,FALSE,FALSE,,FALSE,FALSE,FALSE,FALSE,FALSE,FALSE,FALSE,FALSE,FALSE,FALSE,FALSE,FALSE,FALSE,FALSE,FALSE,FALSE,FALSE,,FALSE,FALSE,,,FALSE,FALSE,FALSE,FALSE,FALSE,,,SMD,2001-05-15T17:00:16,jhm,2002-10-01T11:14:21
C/EGD/1023,1023,EGD,-1,A/EGD/1012,15/7/1628,2028-07-15T00:00:00,15/7/1628,2028-07-15T00:00:00,,"Dempstar,Agnes",,,,,,,FALSE,FALSE,FALSE,FALSE,FALSE,FALSE,FALSE,FALSE,FALSE,FALSE,FALSE,FALSE,FALSE,FALSE,FALSE,FALSE,FALSE,FALSE,FALSE,FALSE,FALSE,FALSE,FALSE,FALSE,FALSE,FALSE,FALSE,FALSE,FALSE,FALSE,0,,TRUE,TRUE,FALSE,FALSE,0,,FALSE,,FALSE,,FALSE,FALSE,FALSE,FALSE,FALSE,FALSE,FALSE,,,,FALSE,FALSE,FALSE,FALSE,FALSE,FALSE,FALSE,FALSE,FALSE,FALSE,,FALSE,FALSE,FALSE,FALSE,FALSE,FALSE,FALSE,FALSE,FALSE,FALSE,FALSE,FALSE,FALSE,FALSE,FALSE,FALSE,FALSE,,FALSE,FALSE,,,FALSE,FALSE,FALSE,FALSE,FALSE,,,SMD,2001-05-15T17:00:16,jhm,2002-10-01T11:15:28
C/EGD/1025,1025,EGD,-1,A/EGD/1014,26/4/1626,2026-04-26T00:00:00,22/10/1628,2028-10-22T00:00:00,42,"Wright,Bessie",,,,,,,FALSE,FALSE,FALSE,FALSE,FALSE,FALSE,FALSE,FALSE,FALSE,FALSE,TRUE,TRUE,FALSE,TRUE,FALSE,FALSE,FALSE,FALSE,FALSE,FALSE,FALSE,FALSE,FALSE,FALSE,FALSE,FALSE,FALSE,FALSE,FALSE,FALSE,3,,FALSE,FALSE,FALSE,FALSE,0,The main accusations appear to relate to healing rituals and advice that did not work and the patients died rather than death as a result of maleficium. No demonic features.,FALSE,,FALSE,,FALSE,FALSE,FALSE,FALSE,FALSE,FALSE,FALSE,,,,FALSE,FALSE,FALSE,FALSE,FALSE,FALSE,FALSE,FALSE,FALSE,FALSE,"This case has some interesting details about the herbs and other ingredients that she used in salves. These included rippell grasse (ripple grass or robwort plantain), waffron leaf(?), plantain feather(?), finglie (?finkle or fennel), and hyssop(?). She denied she had used foxtree leaves (foxglove). She also claimed that she had her skill from the possession of a book, that had belonged to her father and grandfather. She said it was a 1000 years old but as she could not read it her son, Adam Bell, would read out bits to her. The book was taken from her during the ministry of William Couper who was minister between 1595 and 1612.",TRUE,TRUE,FALSE,FALSE,FALSE,FALSE,FALSE,FALSE,FALSE,FALSE,FALSE,FALSE,FALSE,TRUE,TRUE,FALSE,FALSE,"Main accusations were about healing rituals which did not work but one witness (male) seems to have had a number of grudges (ale spoilt, pains in his limbs, social insult). Said she could cure the bairn bed (?childbirth), gravel, the liver and migraine.",TRUE,FALSE,,,FALSE,FALSE,FALSE,FALSE,FALSE,,"In 1626 she promised the presbytery she would refrain from using her cures, especially in the burgh of Perth. The 1628 accusations were in part a result of her infringement of this promise.",SMD,2001-05-15T17:00:16,jhm,2002-11-13T15:48:14
C/EGD/1026,1026,EGD,-1,A/EGD/1015,8/8/1628,2028-08-08T00:00:00,8/8/1628,2028-08-08T00:00:00,,"Strauchane,Janet",,,,,,,FALSE,FALSE,FALSE,FALSE,FALSE,TRUE,FALSE,FALSE,FALSE,FALSE,FALSE,FALSE,FALSE,FALSE,FALSE,FALSE,FALSE,FALSE,FALSE,FALSE,FALSE,FALSE,FALSE,FALSE,FALSE,FALSE,FALSE,FALSE,FALSE,FALSE,1,,TRUE,TRUE,FALSE,FALSE,0,,FALSE,,FALSE,,FALSE,FALSE,FALSE,FALSE,FALSE,FALSE,FALSE,,,,FALSE,FALSE,FALSE,FALSE,FALSE,FALSE,FALSE,FALSE,FALSE,FALSE,,FALSE,FALSE,FALSE,FALSE,FALSE,FALSE,FALSE,FALSE,FALSE,FALSE,FALSE,FALSE,FALSE,FALSE,FALSE,FALSE,FALSE,,FALSE,FALSE,,,FALSE,FALSE,FALSE,FALSE,FALSE,,,SMD,2001-05-15T17:00:16,jhm,2002-10-01T11:20:49
C/EGD/1027,1027,EGD,-1,A/EGD/1016,4/12/1628,2028-12-04T00:00:00,4/12/1628,2028-12-04T00:00:00,,"Davidson,William",,,,,,,FALSE,FALSE,FALSE,FALSE,FALSE,FALSE,FALSE,FALSE,FALSE,FALSE,FALSE,FALSE,FALSE,FALSE,FALSE,FALSE,FALSE,FALSE,FALSE,FALSE,FALSE,FALSE,FALSE,FALSE,FALSE,FALSE,FALSE,FALSE,FALSE,FALSE,0,,TRUE,TRUE,FALSE,FALSE,0,,FALSE,,FALSE,,FALSE,FALSE,FALSE,FALSE,FALSE,FALSE,FALSE,,,,FALSE,FALSE,FALSE,FALSE,FALSE,FALSE,FALSE,FALSE,FALSE,FALSE,,FALSE,FALSE,FALSE,FALSE,FALSE,FALSE,FALSE,FALSE,FALSE,FALSE,FALSE,FALSE,FALSE,FALSE,FALSE,FALSE,FALSE,,FALSE,FALSE,,,FALSE,FALSE,FALSE,FALSE,FALSE,,,SMD,2001-05-15T17:00:16,jhm,2002-10-01T11:22:12
C/EGD/1028,1028,EGD,-1,A/EGD/1017,8/8/1628,2028-08-08T00:00:00,8/8/1628,2028-08-08T00:00:00,,"Cuthbertson,Beatrix",,,,,,,FALSE,FALSE,FALSE,FALSE,FALSE,TRUE,FALSE,FALSE,FALSE,FALSE,FALSE,FALSE,FALSE,FALSE,FALSE,FALSE,FALSE,FALSE,FALSE,FALSE,FALSE,FALSE,FALSE,FALSE,FALSE,FALSE,FALSE,FALSE,FALSE,FALSE,1,,TRUE,TRUE,FALSE,FALSE,0,,FALSE,,FALSE,,FALSE,FALSE,FALSE,FALSE,FALSE,FALSE,FALSE,,,,FALSE,FALSE,FALSE,FALSE,FALSE,FALSE,FALSE,FALSE,FALSE,FALSE,,FALSE,FALSE,FALSE,FALSE,FALSE,FALSE,FALSE,FALSE,FALSE,FALSE,FALSE,FALSE,FALSE,FALSE,FALSE,FALSE,FALSE,,FALSE,FALSE,,,FALSE,FALSE,FALSE,FALSE,FALSE,,,SMD,2001-05-15T17:00:16,jhm,2002-10-01T11:23:33
C/EGD/1029,1029,EGD,-1,A/EGD/1018,28/7/1628,2028-07-28T00:00:00,28/7/1628,2028-07-28T00:00:00,43,"Wright,Janet",,,,,,,FALSE,FALSE,FALSE,FALSE,FALSE,TRUE,FALSE,FALSE,FALSE,FALSE,FALSE,FALSE,FALSE,FALSE,FALSE,FALSE,FALSE,FALSE,FALSE,FALSE,FALSE,FALSE,FALSE,FALSE,FALSE,FALSE,FALSE,FALSE,FALSE,FALSE,1,,TRUE,TRUE,FALSE,FALSE,0,,FALSE,,FALSE,,FALSE,FALSE,FALSE,FALSE,FALSE,FALSE,FALSE,,,,FALSE,FALSE,FALSE,FALSE,FALSE,FALSE,FALSE,FALSE,FALSE,FALSE,,FALSE,FALSE,FALSE,FALSE,FALSE,FALSE,FALSE,FALSE,FALSE,FALSE,FALSE,FALSE,FALSE,FALSE,FALSE,FALSE,FALSE,,FALSE,FALSE,,,FALSE,FALSE,FALSE,FALSE,FALSE,,,SMD,2001-05-15T17:00:16,jhm,2002-10-01T11:28:34
C/EGD/103,103,EGD,-1,A/EGD/92,27/1/1591,1991-01-27T00:00:00,10/5/1591,1991-05-10T00:00:00,,"Napier,Barbara",,,,,,,FALSE,FALSE,FALSE,TRUE,FALSE,TRUE,FALSE,FALSE,FALSE,FALSE,FALSE,FALSE,FALSE,FALSE,FALSE,FALSE,FALSE,TRUE,FALSE,FALSE,FALSE,FALSE,FALSE,FALSE,FALSE,FALSE,TRUE,TRUE,FALSE,FALSE,5,,FALSE,TRUE,FALSE,TRUE,1,"Part of the North Berwick witch hunt.  It involved many people and many accustions about witches meetings, specifically two separate attempts to sink the royal ships.  The first to sink Queen Anne on her way home, second to trouble King James after he went to get her in Denmark.",FALSE,Baptised a cat.,TRUE,,TRUE,TRUE,FALSE,TRUE,FALSE,TRUE,TRUE,,,"Prior to the North Berwick description there is a detailed account of who was supposed to do what in preparation for the meeting.  They supposedly made potions with weird things, got bed linen from the King, sent people off to do things.  A very organised plan.  See Agnes Sampson (c/egd/63) for basic description of the North Berwick meeting.  Napier's additions include - meeting at Halloween, there was a goat bird there.  Napier and McCalyean were in charge of making wax images of the king but they were no't ready yet.  They weren't supposed to use their real names at the meeting.",FALSE,FALSE,FALSE,TRUE,FALSE,FALSE,FALSE,FALSE,TRUE,FALSE,"Not the typical love magic, this was done to get Dame Jeane Lyoune Lady Angus to love her, by which I think they mean to show her favour?  She paid Agnes Sampson a ring and a head scarf.  She was also accused of consulting Rychard Grahame as to whether or not the king would come home from Denmark.  She was acquitted of making wax images and of being at the North Berwick meeting.  Extended description of potions made out of strange materials.",FALSE,FALSE,FALSE,FALSE,FALSE,FALSE,FALSE,FALSE,FALSE,FALSE,FALSE,FALSE,FALSE,FALSE,FALSE,FALSE,FALSE,She supposedly hired Agnes Sampson for a friend who was vommiting after child birth.,FALSE,FALSE,,,FALSE,FALSE,FALSE,FALSE,FALSE,,,SMD,2001-05-15T17:00:16,LEM,2002-11-11T11:37:05
C/EGD/1030,1030,EGD,-1,A/EGD/1019,27/9/1628,2028-09-27T00:00:00,20/11/1628,2028-11-20T00:00:00,,"Barrowman,Margaret",,,,,,,FALSE,FALSE,FALSE,FALSE,FALSE,TRUE,FALSE,FALSE,FALSE,FALSE,FALSE,FALSE,FALSE,FALSE,FALSE,FALSE,FALSE,FALSE,FALSE,FALSE,FALSE,FALSE,FALSE,FALSE,FALSE,FALSE,FALSE,FALSE,FALSE,FALSE,1,,TRUE,TRUE,FALSE,FALSE,0,Likely to be demonic but not enough information.,FALSE,No details of pact.,FALSE,,FALSE,FALSE,FALSE,FALSE,FALSE,FALSE,FALSE,,,,FALSE,FALSE,FALSE,FALSE,FALSE,FALSE,FALSE,FALSE,FALSE,FALSE,,FALSE,FALSE,FALSE,FALSE,FALSE,FALSE,FALSE,FALSE,FALSE,FALSE,FALSE,FALSE,FALSE,FALSE,FALSE,FALSE,FALSE,,FALSE,FALSE,,,FALSE,FALSE,FALSE,FALSE,FALSE,,Listed with 7 others accused of witchcraft.,SMD,2001-05-15T17:00:16,jhm,2002-10-01T12:46:26
C/EGD/1031,1031,EGD,-1,A/EGD/1020,27/9/1628,2028-09-27T00:00:00,20/11/1628,2028-11-20T00:00:00,,"Duncan,Elspitt",,,,,,,FALSE,FALSE,FALSE,FALSE,FALSE,TRUE,FALSE,FALSE,FALSE,FALSE,FALSE,FALSE,FALSE,FALSE,FALSE,FALSE,FALSE,FALSE,FALSE,FALSE,FALSE,FALSE,FALSE,FALSE,FALSE,FALSE,FALSE,FALSE,FALSE,FALSE,1,,TRUE,TRUE,FALSE,FALSE,0,Demonic pact and charming confessed so included but few details.,FALSE,No pact details,FALSE,,FALSE,FALSE,FALSE,FALSE,FALSE,FALSE,FALSE,,,,FALSE,FALSE,FALSE,FALSE,FALSE,FALSE,FALSE,FALSE,FALSE,FALSE,,FALSE,FALSE,FALSE,FALSE,FALSE,FALSE,FALSE,FALSE,FALSE,FALSE,FALSE,FALSE,FALSE,FALSE,FALSE,FALSE,FALSE,,FALSE,FALSE,,,FALSE,FALSE,FALSE,FALSE,FALSE,,listed with 7 others.,SMD,2001-05-15T17:00:16,LEM,2002-12-05T12:56:59
C/EGD/1032,1032,EGD,-1,A/EGD/1021,27/9/1628,2028-09-27T00:00:00,20/11/1628,2028-11-20T00:00:00,,"Scheirar,Marioun",,,,,,,FALSE,FALSE,FALSE,FALSE,FALSE,TRUE,FALSE,FALSE,FALSE,FALSE,FALSE,FALSE,FALSE,FALSE,FALSE,FALSE,FALSE,FALSE,FALSE,FALSE,FALSE,FALSE,FALSE,FALSE,FALSE,FALSE,FALSE,FALSE,FALSE,FALSE,1,,TRUE,TRUE,FALSE,FALSE,0,Pact and charming confessed but few details.,FALSE,no details about pact recorded.,FALSE,,FALSE,FALSE,FALSE,FALSE,FALSE,FALSE,FALSE,,,,FALSE,FALSE,FALSE,FALSE,FALSE,FALSE,FALSE,FALSE,FALSE,FALSE,,FALSE,FALSE,FALSE,FALSE,FALSE,FALSE,FALSE,FALSE,FALSE,FALSE,FALSE,FALSE,FALSE,FALSE,FALSE,FALSE,FALSE,,FALSE,FALSE,,,FALSE,FALSE,FALSE,FALSE,FALSE,,Listed with 7 others.,SMD,2001-05-15T17:00:16,jhm,2002-10-01T12:46:09
C/EGD/1033,1033,EGD,-1,A/EGD/1022,27/9/1628,2028-09-27T00:00:00,20/11/1628,2028-11-20T00:00:00,25,"Smiberd,Janet",,,,,,,FALSE,FALSE,FALSE,FALSE,FALSE,TRUE,FALSE,FALSE,FALSE,FALSE,FALSE,FALSE,FALSE,FALSE,FALSE,FALSE,FALSE,FALSE,FALSE,FALSE,FALSE,FALSE,FALSE,FALSE,FALSE,FALSE,FALSE,FALSE,FALSE,FALSE,1,,TRUE,TRUE,FALSE,FALSE,0,Demonic pact and charming confessed but details scanty.,FALSE,paction confessed but no details.,FALSE,,FALSE,FALSE,FALSE,FALSE,FALSE,FALSE,FALSE,,,,FALSE,FALSE,FALSE,FALSE,FALSE,FALSE,FALSE,FALSE,FALSE,FALSE,,FALSE,FALSE,FALSE,FALSE,FALSE,FALSE,FALSE,FALSE,FALSE,FALSE,FALSE,FALSE,FALSE,FALSE,FALSE,FALSE,FALSE,,FALSE,FALSE,,,FALSE,FALSE,FALSE,FALSE,FALSE,,Listed with 7 others including her mother.,SMD,2001-05-15T17:00:16,jhm,2002-10-01T11:48:26
C/EGD/1034,1034,EGD,-1,A/EGD/1023,27/9/1628,2028-09-27T00:00:00,20/11/1628,2028-11-20T00:00:00,50,"Unes,Janet",,,,,,,FALSE,FALSE,FALSE,FALSE,FALSE,TRUE,FALSE,FALSE,FALSE,FALSE,FALSE,FALSE,FALSE,FALSE,FALSE,FALSE,FALSE,FALSE,FALSE,FALSE,FALSE,FALSE,FALSE,FALSE,FALSE,FALSE,FALSE,FALSE,FALSE,FALSE,1,,TRUE,TRUE,FALSE,FALSE,0,Demonic and charming confessed but not much detail.,FALSE,Pact confessed but no details.,FALSE,,FALSE,FALSE,FALSE,FALSE,FALSE,FALSE,FALSE,,,,FALSE,FALSE,FALSE,FALSE,FALSE,FALSE,FALSE,FALSE,FALSE,FALSE,,FALSE,FALSE,FALSE,FALSE,FALSE,FALSE,FALSE,FALSE,FALSE,FALSE,FALSE,FALSE,FALSE,FALSE,FALSE,FALSE,FALSE,,FALSE,FALSE,,,FALSE,FALSE,FALSE,FALSE,FALSE,,Listed with 7 others including her daughter.,SMD,2001-05-15T17:00:16,jhm,2002-10-01T12:46:01
C/EGD/1035,1035,EGD,-1,A/EGD/1024,28/8/1628,2028-08-28T00:00:00,4/9/1628,2028-09-04T00:00:00,,"Chapman,Alesoun",,,,,,,FALSE,FALSE,FALSE,FALSE,FALSE,TRUE,FALSE,FALSE,FALSE,FALSE,FALSE,FALSE,FALSE,FALSE,FALSE,FALSE,FALSE,FALSE,FALSE,FALSE,FALSE,FALSE,FALSE,FALSE,FALSE,FALSE,FALSE,FALSE,FALSE,FALSE,1,,TRUE,TRUE,FALSE,FALSE,0,No details about accusation or confession.,FALSE,Presbytery notes confessed paction with the devil.,FALSE,,FALSE,FALSE,FALSE,FALSE,FALSE,FALSE,FALSE,,,,FALSE,FALSE,FALSE,FALSE,FALSE,FALSE,FALSE,FALSE,FALSE,FALSE,,FALSE,FALSE,FALSE,FALSE,FALSE,FALSE,FALSE,FALSE,FALSE,FALSE,FALSE,FALSE,FALSE,FALSE,FALSE,FALSE,FALSE,,FALSE,FALSE,,,FALSE,FALSE,FALSE,FALSE,FALSE,,Accused with 2 others but very few details.,SMD,2001-05-15T17:00:16,jhm,2002-10-01T11:51:44
C/EGD/1036,1036,EGD,-1,A/EGD/1025,28/8/1628,2028-08-28T00:00:00,4/9/1628,2028-09-04T00:00:00,,"Tailyour,Christian",,,,,,,FALSE,FALSE,FALSE,FALSE,FALSE,TRUE,FALSE,FALSE,FALSE,FALSE,FALSE,FALSE,FALSE,FALSE,FALSE,FALSE,FALSE,FALSE,FALSE,FALSE,FALSE,FALSE,FALSE,FALSE,FALSE,FALSE,FALSE,FALSE,FALSE,FALSE,1,,TRUE,TRUE,FALSE,FALSE,0,Few details about accusations or confession although paction with the devil mentioned in presbytery minutes.,FALSE,Presbytery notes confessed paction with the devil.,FALSE,,FALSE,FALSE,FALSE,FALSE,FALSE,FALSE,FALSE,,,,FALSE,FALSE,FALSE,FALSE,FALSE,FALSE,FALSE,FALSE,FALSE,FALSE,,FALSE,FALSE,FALSE,FALSE,FALSE,FALSE,FALSE,FALSE,FALSE,FALSE,FALSE,FALSE,FALSE,FALSE,FALSE,FALSE,FALSE,,FALSE,FALSE,,,FALSE,FALSE,FALSE,FALSE,FALSE,,Accused with 2 others.,SMD,2001-05-15T17:00:16,jhm,2002-10-01T11:53:30
C/EGD/1037,1037,EGD,-1,A/EGD/1026,28/8/1628,2028-08-28T00:00:00,4/9/1628,2028-09-04T00:00:00,,"Thomsoun,Issobell",,,,,,,FALSE,FALSE,FALSE,FALSE,FALSE,TRUE,FALSE,FALSE,FALSE,FALSE,FALSE,FALSE,FALSE,FALSE,FALSE,FALSE,FALSE,FALSE,FALSE,FALSE,FALSE,FALSE,FALSE,FALSE,FALSE,FALSE,FALSE,FALSE,FALSE,FALSE,1,,TRUE,TRUE,FALSE,FALSE,0,Few details about accusation or confession.,FALSE,Few details but presbytery notes she confessed paction with the devil.,FALSE,,FALSE,FALSE,FALSE,FALSE,FALSE,FALSE,FALSE,,,,FALSE,FALSE,FALSE,FALSE,FALSE,FALSE,FALSE,FALSE,FALSE,FALSE,,FALSE,FALSE,FALSE,FALSE,FALSE,FALSE,FALSE,FALSE,FALSE,FALSE,FALSE,FALSE,FALSE,FALSE,FALSE,FALSE,FALSE,,FALSE,FALSE,,,FALSE,FALSE,FALSE,FALSE,FALSE,,Accused with 2 others.,SMD,2001-05-15T17:00:16,jhm,2002-10-01T11:54:43
C/EGD/1038,1038,EGD,-1,A/EGD/1027,27/9/1628,2028-09-27T00:00:00,27/9/1628,2028-09-27T00:00:00,,"Hislop,Elspitt",,,,,,,FALSE,FALSE,FALSE,FALSE,FALSE,FALSE,FALSE,FALSE,FALSE,FALSE,FALSE,FALSE,FALSE,FALSE,FALSE,FALSE,FALSE,FALSE,FALSE,FALSE,FALSE,FALSE,FALSE,FALSE,FALSE,FALSE,FALSE,FALSE,FALSE,FALSE,0,,TRUE,TRUE,FALSE,FALSE,0,,FALSE,,FALSE,,FALSE,FALSE,FALSE,FALSE,FALSE,FALSE,FALSE,,,,FALSE,FALSE,FALSE,FALSE,FALSE,FALSE,FALSE,FALSE,FALSE,FALSE,,FALSE,FALSE,FALSE,FALSE,FALSE,FALSE,FALSE,FALSE,FALSE,FALSE,FALSE,FALSE,FALSE,FALSE,FALSE,FALSE,FALSE,,FALSE,FALSE,,,FALSE,FALSE,FALSE,FALSE,FALSE,,,SMD,2001-05-15T17:00:16,jhm,2002-10-01T11:56:22
C/EGD/1039,1039,EGD,-1,A/EGD/1028,8/8/1628,2028-08-08T00:00:00,8/8/1628,2028-08-08T00:00:00,,"Darling,Janet",,,,,,,FALSE,FALSE,FALSE,FALSE,FALSE,TRUE,FALSE,FALSE,FALSE,FALSE,FALSE,FALSE,FALSE,FALSE,FALSE,FALSE,FALSE,FALSE,FALSE,FALSE,FALSE,FALSE,FALSE,FALSE,FALSE,FALSE,FALSE,FALSE,FALSE,FALSE,1,,TRUE,TRUE,FALSE,FALSE,0,,FALSE,,FALSE,,FALSE,FALSE,FALSE,FALSE,FALSE,FALSE,FALSE,,,,FALSE,FALSE,FALSE,FALSE,FALSE,FALSE,FALSE,FALSE,FALSE,FALSE,,FALSE,FALSE,FALSE,FALSE,FALSE,FALSE,FALSE,FALSE,FALSE,FALSE,FALSE,FALSE,FALSE,FALSE,FALSE,FALSE,FALSE,,FALSE,FALSE,,,FALSE,FALSE,FALSE,FALSE,FALSE,,,SMD,2001-05-15T17:00:16,jhm,2002-10-01T11:57:29
C/EGD/104,104,EGD,-1,A/EGD/93,27/1/1591,1991-01-27T00:00:00,15/6/1591,1991-06-15T00:00:00,,"Makcalzene,Ewfame",,,,,,,FALSE,FALSE,FALSE,TRUE,FALSE,TRUE,FALSE,FALSE,FALSE,TRUE,FALSE,FALSE,FALSE,TRUE,FALSE,FALSE,FALSE,TRUE,FALSE,FALSE,FALSE,FALSE,FALSE,TRUE,FALSE,FALSE,TRUE,TRUE,FALSE,FALSE,8,,FALSE,TRUE,FALSE,TRUE,1,"Part of the North Berwick witch hunt.  It involved many people and many accustions about witches meetings, specifically two separate attempts to sink the royal ships.  The first to sink Queen Anne on her way home, second to trouble King James after he went to get her in Denmark.  In her own trial she was accused of trying to kill her husband and other family members (ie for her own political gain), and for consulting with lots of witches.",FALSE,Her servant saw a vision of a man in a white shirt with a tail.,TRUE,,TRUE,TRUE,FALSE,TRUE,FALSE,TRUE,TRUE,,,She was accused of wanting to get her father-in-law.  See c/egd/63 and c/egd/103 for a description of the North Berwick meeting.  Her trial outlines at least four witches' meetings.  She was accused of trying to destroy the King and Queen,TRUE,FALSE,TRUE,TRUE,FALSE,FALSE,FALSE,FALSE,TRUE,FALSE,"The bowl was described as a great bikar that was put around her head and neck to inaugurate her into the craft (perhaps the impetus for the cauldron myths?).  Description of a bewitching using materials left in a window (magical use of boundaries).  She was accused of using her servants to deliver materials to and from other witches, and those servants seemed to have betrayed her in court by testifying against her.",TRUE,TRUE,TRUE,FALSE,FALSE,FALSE,FALSE,TRUE,FALSE,FALSE,TRUE,TRUE,TRUE,FALSE,FALSE,FALSE,FALSE,"Her childbirth pains for two births were transferred, first to a dog and then to a cat.",TRUE,TRUE,,,FALSE,FALSE,FALSE,FALSE,FALSE,,Brought into the North Berwick stuff.,SMD,2001-05-15T17:00:16,jhm,2002-11-13T16:21:22
C/EGD/1041,1041,EGD,-1,A/EGD/1030,,,27/9/1628,2028-09-27T00:00:00,,"Cowane,Margaret",,,,,,,FALSE,FALSE,FALSE,FALSE,FALSE,FALSE,FALSE,FALSE,FALSE,FALSE,FALSE,FALSE,FALSE,FALSE,FALSE,FALSE,FALSE,FALSE,FALSE,FALSE,FALSE,FALSE,FALSE,FALSE,FALSE,FALSE,FALSE,FALSE,FALSE,FALSE,0,,TRUE,TRUE,FALSE,FALSE,0,,FALSE,,FALSE,,FALSE,FALSE,FALSE,FALSE,FALSE,FALSE,FALSE,,,,FALSE,FALSE,FALSE,FALSE,FALSE,FALSE,FALSE,FALSE,FALSE,FALSE,,FALSE,FALSE,FALSE,FALSE,FALSE,FALSE,FALSE,FALSE,FALSE,FALSE,FALSE,FALSE,FALSE,FALSE,FALSE,FALSE,FALSE,,FALSE,FALSE,,,FALSE,FALSE,FALSE,FALSE,FALSE,,,SMD,2001-05-15T17:00:16,jhm,2002-11-13T14:16:14
C/EGD/1042,1042,EGD,-1,A/EGD/1031,10/7/1628,2028-07-10T00:00:00,27/9/1628,2028-09-27T00:00:00,,"Dempstar,Alesoun",,,,,,,FALSE,FALSE,FALSE,FALSE,FALSE,FALSE,FALSE,FALSE,FALSE,FALSE,FALSE,FALSE,FALSE,FALSE,FALSE,FALSE,FALSE,TRUE,FALSE,FALSE,FALSE,FALSE,FALSE,FALSE,FALSE,FALSE,FALSE,FALSE,FALSE,FALSE,1,,TRUE,TRUE,FALSE,FALSE,0,Marioun Mitchell (c/egd/1018) supposedly named her as a witch because Dempstar once called her a witch.  A revenge naming?,FALSE,,FALSE,,FALSE,FALSE,FALSE,FALSE,FALSE,FALSE,FALSE,,,,FALSE,FALSE,FALSE,FALSE,FALSE,FALSE,FALSE,FALSE,FALSE,FALSE,,FALSE,FALSE,FALSE,FALSE,FALSE,FALSE,FALSE,FALSE,FALSE,FALSE,FALSE,FALSE,FALSE,FALSE,FALSE,FALSE,FALSE,,FALSE,FALSE,,,FALSE,FALSE,FALSE,FALSE,FALSE,,,SMD,2001-05-15T17:00:16,LEM,2002-12-06T12:18:09
C/EGD/1043,1043,EGD,-1,A/EGD/1032,27/9/1628,2028-09-27T00:00:00,27/9/1628,2028-09-27T00:00:00,,"Miller,Issobell",,,,,,,FALSE,FALSE,FALSE,FALSE,FALSE,FALSE,FALSE,FALSE,FALSE,FALSE,FALSE,FALSE,FALSE,FALSE,FALSE,FALSE,FALSE,FALSE,FALSE,FALSE,FALSE,FALSE,FALSE,FALSE,FALSE,FALSE,FALSE,FALSE,FALSE,FALSE,0,,TRUE,TRUE,FALSE,FALSE,0,,FALSE,,FALSE,,FALSE,FALSE,FALSE,FALSE,FALSE,FALSE,FALSE,,,,FALSE,FALSE,FALSE,FALSE,FALSE,FALSE,FALSE,FALSE,FALSE,FALSE,,FALSE,FALSE,FALSE,FALSE,FALSE,FALSE,FALSE,FALSE,FALSE,FALSE,FALSE,FALSE,FALSE,FALSE,FALSE,FALSE,FALSE,,FALSE,FALSE,,,FALSE,FALSE,FALSE,FALSE,FALSE,,,SMD,2001-05-15T17:00:16,jhm,2002-10-01T12:07:26
C/EGD/1044,1044,EGD,-1,A/EGD/1033,27/9/1628,2028-09-27T00:00:00,27/9/1628,2028-09-27T00:00:00,,"Howatsoun,Issobell",,,,,,,FALSE,FALSE,FALSE,FALSE,FALSE,FALSE,FALSE,FALSE,FALSE,FALSE,FALSE,FALSE,FALSE,FALSE,FALSE,FALSE,FALSE,FALSE,FALSE,FALSE,FALSE,FALSE,FALSE,FALSE,FALSE,FALSE,FALSE,FALSE,FALSE,FALSE,0,,TRUE,TRUE,FALSE,FALSE,0,,FALSE,,FALSE,,FALSE,FALSE,FALSE,FALSE,FALSE,FALSE,FALSE,,,,FALSE,FALSE,FALSE,FALSE,FALSE,FALSE,FALSE,FALSE,FALSE,FALSE,,FALSE,FALSE,FALSE,FALSE,FALSE,FALSE,FALSE,FALSE,FALSE,FALSE,FALSE,FALSE,FALSE,FALSE,FALSE,FALSE,FALSE,,FALSE,FALSE,,,FALSE,FALSE,FALSE,FALSE,FALSE,,,SMD,2001-05-15T17:00:16,jhm,2002-10-01T12:08:35
C/EGD/1045,1045,EGD,-1,A/EGD/1034,20/3/1628,2028-03-20T00:00:00,3/7/1628,2028-07-03T00:00:00,,"Malcome,Steven",,,,,,,FALSE,TRUE,FALSE,FALSE,FALSE,FALSE,FALSE,FALSE,FALSE,TRUE,TRUE,TRUE,FALSE,FALSE,FALSE,FALSE,FALSE,FALSE,FALSE,FALSE,FALSE,FALSE,FALSE,FALSE,FALSE,FALSE,FALSE,FALSE,FALSE,FALSE,4,,FALSE,TRUE,FALSE,TRUE,1,"Seems to have been a recognised healer as people from several parishes described how he had healed their sicknesses, including St Ninian's, Logie, Kippen and Gargunnock.",FALSE,Confessed that he had seen the fairies in different forms but did not describe them.,FALSE,,FALSE,FALSE,FALSE,FALSE,FALSE,FALSE,FALSE,,,,TRUE,FALSE,TRUE,TRUE,FALSE,FALSE,FALSE,TRUE,TRUE,FALSE,"Described several rituals for healing, which he claimed he had learned from the fairy folk. They had appeared to him in several forms at several different places. Used water (south running) to heal. Would charm sarks with water and words. Carried a sick child over a dyke to cure it. Told a father his child had taken a 'fray in the night'. Told to take it outside at 11 or 12 o'clock, lay his hands on the child and shake his drawn sword over it, as the fairies would not come when they saw a drawn sword. Identified where a woman got sick and told her to go there and seek her health in God's name.",FALSE,FALSE,FALSE,FALSE,FALSE,FALSE,FALSE,FALSE,FALSE,TRUE,FALSE,FALSE,FALSE,TRUE,TRUE,TRUE,FALSE,,FALSE,FALSE,,The details in the presbytery records are all about charming. Witchcraft is not mentioned.,FALSE,FALSE,FALSE,FALSE,FALSE,,,SMD,2001-05-15T17:00:16,LEM,2002-11-11T11:45:24
C/EGD/1046,1046,EGD,-1,A/EGD/1035,27/9/1628,2028-09-27T00:00:00,27/9/1628,2028-09-27T00:00:00,,"Leithame,Katharine",,,,,,,FALSE,FALSE,FALSE,FALSE,FALSE,FALSE,FALSE,FALSE,FALSE,FALSE,FALSE,FALSE,FALSE,FALSE,FALSE,FALSE,FALSE,FALSE,FALSE,FALSE,FALSE,FALSE,FALSE,FALSE,FALSE,FALSE,FALSE,FALSE,FALSE,FALSE,0,,TRUE,TRUE,FALSE,FALSE,0,,FALSE,,FALSE,,FALSE,FALSE,FALSE,FALSE,FALSE,FALSE,FALSE,,,,FALSE,FALSE,FALSE,FALSE,FALSE,FALSE,FALSE,FALSE,FALSE,FALSE,,FALSE,FALSE,FALSE,FALSE,FALSE,FALSE,FALSE,FALSE,FALSE,FALSE,FALSE,FALSE,FALSE,FALSE,FALSE,FALSE,FALSE,,FALSE,FALSE,,,FALSE,FALSE,FALSE,FALSE,FALSE,,,SMD,2001-05-15T17:00:16,jhm,2002-10-01T12:13:57
C/EGD/1047,1047,EGD,-1,A/EGD/1036,11/11/1628,2028-11-11T00:00:00,20/11/1628,2028-11-20T00:00:00,,"Muirhead,Margaret",,,,,,,FALSE,FALSE,FALSE,FALSE,FALSE,TRUE,FALSE,FALSE,FALSE,FALSE,FALSE,FALSE,FALSE,FALSE,FALSE,FALSE,FALSE,FALSE,FALSE,FALSE,FALSE,FALSE,FALSE,FALSE,FALSE,FALSE,FALSE,FALSE,FALSE,FALSE,1,,TRUE,TRUE,FALSE,FALSE,0,Confessed to demonic pact and charming but no details of accusations.,FALSE,"Dalkeith presbytery note the accused confessed to paction, witchcraft and charming.",FALSE,,FALSE,FALSE,FALSE,FALSE,FALSE,FALSE,FALSE,,,,FALSE,FALSE,FALSE,FALSE,FALSE,FALSE,FALSE,FALSE,FALSE,FALSE,,FALSE,FALSE,FALSE,FALSE,FALSE,FALSE,FALSE,FALSE,FALSE,FALSE,FALSE,FALSE,FALSE,FALSE,FALSE,FALSE,FALSE,,FALSE,FALSE,,,FALSE,FALSE,FALSE,FALSE,FALSE,,listed with 7 other accused.,SMD,2001-05-15T17:00:16,jhm,2002-10-01T12:45:29
C/EGD/1048,1048,EGD,-1,A/EGD/1037,11/11/1628,2028-11-11T00:00:00,20/11/1628,2028-11-20T00:00:00,,"Watt,William",,,,,,,FALSE,FALSE,FALSE,FALSE,FALSE,TRUE,FALSE,FALSE,FALSE,FALSE,FALSE,FALSE,FALSE,FALSE,FALSE,FALSE,FALSE,FALSE,FALSE,FALSE,FALSE,FALSE,FALSE,FALSE,FALSE,FALSE,FALSE,FALSE,FALSE,FALSE,1,,TRUE,TRUE,FALSE,FALSE,0,Confession of pact and charming but no details of accusations.,FALSE,No details of pact.,FALSE,,FALSE,FALSE,FALSE,FALSE,FALSE,FALSE,FALSE,,,,FALSE,FALSE,FALSE,FALSE,FALSE,FALSE,FALSE,FALSE,FALSE,FALSE,,FALSE,FALSE,FALSE,FALSE,FALSE,FALSE,FALSE,FALSE,FALSE,FALSE,FALSE,FALSE,FALSE,FALSE,FALSE,FALSE,FALSE,,FALSE,FALSE,,,FALSE,FALSE,FALSE,FALSE,FALSE,,listed with 7 other accused.,SMD,2001-05-15T17:00:16,jhm,2002-10-01T12:45:24
C/EGD/1049,1049,EGD,-1,A/EGD/1038,11/11/1628,2028-11-11T00:00:00,20/11/1628,2028-11-20T00:00:00,,"Turnour,Malie",,,,,,,FALSE,FALSE,FALSE,FALSE,FALSE,TRUE,FALSE,FALSE,FALSE,FALSE,FALSE,FALSE,FALSE,FALSE,FALSE,FALSE,FALSE,FALSE,FALSE,FALSE,FALSE,FALSE,FALSE,FALSE,FALSE,FALSE,FALSE,FALSE,FALSE,FALSE,1,,TRUE,TRUE,FALSE,FALSE,0,Confessed pact and charming but not many details.,FALSE,No details of pact.,FALSE,,FALSE,FALSE,FALSE,FALSE,FALSE,FALSE,FALSE,,,,FALSE,FALSE,FALSE,FALSE,FALSE,FALSE,FALSE,FALSE,FALSE,FALSE,,FALSE,FALSE,FALSE,FALSE,FALSE,FALSE,FALSE,FALSE,FALSE,FALSE,FALSE,FALSE,FALSE,FALSE,FALSE,FALSE,FALSE,,FALSE,FALSE,,,FALSE,FALSE,FALSE,FALSE,FALSE,,Accused with 7 others.,SMD,2001-05-15T17:00:16,jhm,2002-10-01T12:42:02
C/EGD/1050,1050,EGD,-1,A/EGD/1039,18/11/1628,2028-11-18T00:00:00,18/11/1628,2028-11-18T00:00:00,,"Simsoun,Elspeth",,,,,,,FALSE,FALSE,FALSE,FALSE,FALSE,FALSE,FALSE,FALSE,FALSE,FALSE,FALSE,FALSE,FALSE,FALSE,FALSE,FALSE,FALSE,FALSE,FALSE,FALSE,FALSE,FALSE,FALSE,FALSE,FALSE,FALSE,FALSE,FALSE,FALSE,FALSE,0,,TRUE,TRUE,FALSE,FALSE,0,,FALSE,,FALSE,,FALSE,FALSE,FALSE,FALSE,FALSE,FALSE,FALSE,,,,FALSE,FALSE,FALSE,FALSE,FALSE,FALSE,FALSE,FALSE,FALSE,FALSE,,FALSE,FALSE,FALSE,FALSE,FALSE,FALSE,FALSE,FALSE,FALSE,FALSE,FALSE,FALSE,FALSE,FALSE,FALSE,FALSE,FALSE,,FALSE,FALSE,,,FALSE,FALSE,FALSE,FALSE,FALSE,,,SMD,2001-05-15T17:00:16,jhm,2002-10-01T12:42:35
C/EGD/1051,1051,EGD,-1,A/EGD/1040,18/11/1628,2028-11-18T00:00:00,18/11/1628,2028-11-18T00:00:00,,"Gillimichaell,Marion nein",,,,,,,FALSE,FALSE,FALSE,FALSE,FALSE,FALSE,FALSE,FALSE,FALSE,FALSE,FALSE,FALSE,FALSE,FALSE,FALSE,FALSE,FALSE,FALSE,FALSE,FALSE,FALSE,FALSE,FALSE,FALSE,FALSE,FALSE,FALSE,FALSE,FALSE,FALSE,0,,TRUE,TRUE,FALSE,FALSE,0,,FALSE,,FALSE,,FALSE,FALSE,FALSE,FALSE,FALSE,FALSE,FALSE,,,,FALSE,FALSE,FALSE,FALSE,FALSE,FALSE,FALSE,FALSE,FALSE,FALSE,,FALSE,FALSE,FALSE,FALSE,FALSE,FALSE,FALSE,FALSE,FALSE,FALSE,FALSE,FALSE,FALSE,FALSE,FALSE,FALSE,FALSE,,FALSE,FALSE,,,FALSE,FALSE,FALSE,FALSE,FALSE,,,SMD,2001-05-15T17:00:16,jhm,2002-10-01T12:44:47
C/EGD/1052,1052,EGD,-1,A/EGD/1041,18/11/1628,2028-11-18T00:00:00,18/11/1628,2028-11-18T00:00:00,,"Donald,Agnes nein",,,,,,,FALSE,FALSE,FALSE,FALSE,FALSE,FALSE,FALSE,FALSE,FALSE,FALSE,FALSE,FALSE,FALSE,FALSE,FALSE,FALSE,FALSE,FALSE,FALSE,FALSE,FALSE,FALSE,FALSE,FALSE,FALSE,FALSE,FALSE,FALSE,FALSE,FALSE,0,,TRUE,TRUE,FALSE,FALSE,0,,FALSE,,FALSE,,FALSE,FALSE,FALSE,FALSE,FALSE,FALSE,FALSE,,,,FALSE,FALSE,FALSE,FALSE,FALSE,FALSE,FALSE,FALSE,FALSE,FALSE,,FALSE,FALSE,FALSE,FALSE,FALSE,FALSE,FALSE,FALSE,FALSE,FALSE,FALSE,FALSE,FALSE,FALSE,FALSE,FALSE,FALSE,,FALSE,FALSE,,,FALSE,FALSE,FALSE,FALSE,FALSE,,,SMD,2001-05-15T17:00:16,jhm,2002-10-01T14:22:24
C/EGD/1053,1053,EGD,-1,A/EGD/1042,18/11/1628,2028-11-18T00:00:00,18/11/1628,2028-11-18T00:00:00,,"Gow,Helen",,,,,,,FALSE,FALSE,FALSE,FALSE,FALSE,FALSE,FALSE,FALSE,FALSE,FALSE,FALSE,FALSE,FALSE,FALSE,FALSE,FALSE,FALSE,FALSE,FALSE,FALSE,FALSE,FALSE,FALSE,FALSE,FALSE,FALSE,FALSE,FALSE,FALSE,FALSE,0,,TRUE,TRUE,FALSE,FALSE,0,,FALSE,,FALSE,,FALSE,FALSE,FALSE,FALSE,FALSE,FALSE,FALSE,,,,FALSE,FALSE,FALSE,FALSE,FALSE,FALSE,FALSE,FALSE,FALSE,FALSE,,FALSE,FALSE,FALSE,FALSE,FALSE,FALSE,FALSE,FALSE,FALSE,FALSE,FALSE,FALSE,FALSE,FALSE,FALSE,FALSE,FALSE,,FALSE,FALSE,,,FALSE,FALSE,FALSE,FALSE,FALSE,,,SMD,2001-05-15T17:00:16,jhm,2002-10-01T14:23:32
C/EGD/1054,1054,EGD,-1,A/EGD/1043,30/10/1628,2028-10-30T00:00:00,13/1/1629,2029-01-13T00:00:00,,"Boyd,Janet",,,,,,,FALSE,FALSE,FALSE,FALSE,FALSE,TRUE,FALSE,FALSE,FALSE,FALSE,FALSE,FALSE,FALSE,TRUE,FALSE,FALSE,FALSE,FALSE,FALSE,FALSE,FALSE,FALSE,FALSE,FALSE,FALSE,FALSE,FALSE,FALSE,FALSE,FALSE,2,,TRUE,TRUE,FALSE,FALSE,0,,FALSE,Devil gave her the power to heal.,FALSE,,FALSE,FALSE,FALSE,FALSE,FALSE,FALSE,FALSE,,,,FALSE,FALSE,FALSE,FALSE,FALSE,FALSE,FALSE,FALSE,FALSE,FALSE,,TRUE,FALSE,FALSE,FALSE,FALSE,FALSE,FALSE,FALSE,FALSE,FALSE,FALSE,FALSE,FALSE,FALSE,FALSE,FALSE,FALSE,Confessed to having caused harm,FALSE,FALSE,,,FALSE,FALSE,FALSE,FALSE,FALSE,,,SMD,2001-05-15T17:00:16,LEM,2002-11-11T12:27:36
C/EGD/1055,1055,EGD,-1,A/EGD/1044,25/11/1628,2028-11-25T00:00:00,25/11/1628,2028-11-25T00:00:00,,"Dageris,William",,,,,,,FALSE,FALSE,FALSE,FALSE,FALSE,FALSE,FALSE,FALSE,FALSE,FALSE,FALSE,FALSE,FALSE,FALSE,FALSE,FALSE,FALSE,FALSE,FALSE,FALSE,FALSE,FALSE,FALSE,FALSE,FALSE,FALSE,FALSE,FALSE,FALSE,FALSE,0,,TRUE,TRUE,FALSE,FALSE,0,,FALSE,,FALSE,,FALSE,FALSE,FALSE,FALSE,FALSE,FALSE,FALSE,,,,FALSE,FALSE,FALSE,FALSE,FALSE,FALSE,FALSE,FALSE,FALSE,FALSE,,FALSE,FALSE,FALSE,FALSE,FALSE,FALSE,FALSE,FALSE,FALSE,FALSE,FALSE,FALSE,FALSE,FALSE,FALSE,FALSE,FALSE,,FALSE,FALSE,,,FALSE,FALSE,FALSE,FALSE,FALSE,,,SMD,2001-05-15T17:00:16,jhm,2002-10-01T14:29:17
C/EGD/1056,1056,EGD,-1,A/EGD/1045,25/11/1628,2028-11-25T00:00:00,25/11/1628,2028-11-25T00:00:00,,"Stewart,Kathrene",,,,,,,FALSE,FALSE,FALSE,FALSE,FALSE,FALSE,FALSE,FALSE,FALSE,FALSE,FALSE,FALSE,FALSE,FALSE,FALSE,FALSE,FALSE,FALSE,FALSE,FALSE,FALSE,FALSE,FALSE,FALSE,FALSE,FALSE,FALSE,FALSE,FALSE,FALSE,0,,TRUE,TRUE,FALSE,FALSE,0,,FALSE,,FALSE,,FALSE,FALSE,FALSE,FALSE,FALSE,FALSE,FALSE,,,,FALSE,FALSE,FALSE,FALSE,FALSE,FALSE,FALSE,FALSE,FALSE,FALSE,,FALSE,FALSE,FALSE,FALSE,FALSE,FALSE,FALSE,FALSE,FALSE,FALSE,FALSE,FALSE,FALSE,FALSE,FALSE,FALSE,FALSE,,FALSE,FALSE,,,FALSE,FALSE,FALSE,FALSE,FALSE,,,SMD,2001-05-15T17:00:16,jhm,2002-10-01T14:30:06
C/EGD/1057,1057,EGD,-1,A/EGD/1046,9/1628,2028-09-01T00:00:00,25/11/1628,2028-11-25T00:00:00,,"Jo,Margaret",,,,,,,FALSE,FALSE,FALSE,FALSE,FALSE,FALSE,FALSE,FALSE,FALSE,FALSE,FALSE,FALSE,FALSE,FALSE,FALSE,FALSE,FALSE,FALSE,FALSE,FALSE,FALSE,FALSE,FALSE,FALSE,FALSE,FALSE,FALSE,FALSE,FALSE,FALSE,0,,TRUE,TRUE,FALSE,FALSE,0,,FALSE,,FALSE,,FALSE,FALSE,FALSE,FALSE,FALSE,FALSE,FALSE,,,,FALSE,FALSE,FALSE,FALSE,FALSE,FALSE,FALSE,FALSE,FALSE,FALSE,,FALSE,FALSE,FALSE,FALSE,FALSE,FALSE,FALSE,FALSE,FALSE,FALSE,FALSE,FALSE,FALSE,FALSE,FALSE,FALSE,FALSE,,FALSE,FALSE,,,FALSE,FALSE,FALSE,FALSE,FALSE,,,SMD,2001-05-15T17:00:16,jhm,2002-11-13T14:06:54
C/EGD/1058,1058,EGD,-1,A/EGD/1047,25/11/1628,2028-11-25T00:00:00,27/1/1629,2029-01-27T00:00:00,50,"Burges,Margaret",,,,,,,FALSE,FALSE,FALSE,FALSE,FALSE,TRUE,FALSE,FALSE,FALSE,FALSE,FALSE,FALSE,FALSE,TRUE,FALSE,FALSE,FALSE,TRUE,TRUE,TRUE,FALSE,FALSE,FALSE,FALSE,FALSE,FALSE,FALSE,FALSE,FALSE,FALSE,5,,FALSE,FALSE,FALSE,FALSE,0,"The main accusations against her involved fall out from work, cloth, rent payment, debt, etc.  Her thirteen year old female servant was questioned about whether or not Margaret had kissed her.  She said yes, many times and she had kissed back.  Not sure exactly what was meant by this line of questioning?  The investigation and trial resulted from a backfire of Margaret's attempt to clear her name of witchcraft with slander litigation.  The kirk session hearing the case decided there was enough evidence to petition the privy council for a commission of justiciary.  She was also implicated, on 3 October 1628, by Elspeth Baird, burnt for witchcraft in Leith.",FALSE,,FALSE,,FALSE,FALSE,FALSE,FALSE,FALSE,FALSE,FALSE,,,,FALSE,FALSE,FALSE,FALSE,FALSE,FALSE,FALSE,FALSE,FALSE,FALSE,A woman diagnosed Margaret as the cause of a bewitchment.,TRUE,FALSE,TRUE,TRUE,FALSE,FALSE,FALSE,FALSE,FALSE,FALSE,TRUE,TRUE,FALSE,FALSE,FALSE,FALSE,FALSE,These were in revenge for quarrels.,FALSE,FALSE,,,FALSE,FALSE,FALSE,FALSE,FALSE,,"A funny note:  Margaret claimed that her lease had been eaten by a dog.  Her case seems to have resulted from a backfire from Margaret's pursuit of a slander case after she had been called a witch. The Kirk session of Cramond was convinced by the evidence of the defendants (i.e. the 'slanderers'), and decided to apply for a commission of justiciary from the Privy Council, which they received.",SMD,2001-05-15T17:00:16,jhm,2002-10-01T14:39:36
C/EGD/1059,1059,EGD,-1,A/EGD/1048,25/11/1628,2028-11-25T00:00:00,25/11/1628,2028-11-25T00:00:00,,"Baird,Elspeth",,,,,,,FALSE,FALSE,FALSE,FALSE,FALSE,FALSE,FALSE,FALSE,FALSE,FALSE,FALSE,FALSE,FALSE,FALSE,FALSE,FALSE,FALSE,FALSE,FALSE,FALSE,FALSE,FALSE,FALSE,FALSE,FALSE,FALSE,FALSE,FALSE,FALSE,FALSE,0,,TRUE,TRUE,FALSE,FALSE,0,"Wyfe of Totmuir was possibly an unwitcher, but not enough information to actually tick any of the boxes.",FALSE,,FALSE,,FALSE,FALSE,FALSE,FALSE,FALSE,FALSE,FALSE,,,,FALSE,FALSE,FALSE,FALSE,FALSE,FALSE,FALSE,FALSE,FALSE,FALSE,Wyfe of Totmuir designated Margaret Burges as her bewitcher.,FALSE,FALSE,FALSE,FALSE,FALSE,FALSE,FALSE,FALSE,FALSE,FALSE,FALSE,FALSE,FALSE,FALSE,FALSE,FALSE,FALSE,"Wyfe of Totmuir was possibly an unwitcher, but not enough information to actually tick any of the boxes.",FALSE,FALSE,,,FALSE,FALSE,FALSE,FALSE,FALSE,,Elspeth Baird was mentioned in documents pertaining to Margaret Burges.  I think Baird is also a woman referred to as 'the wyfe of Totmuir'.  Need to check where Totmuir is?  Possibly the same as 'Elizabeth the spae wife' (c/la/3126) mentioned by Margaret Clerk from N. Leith in 1643 (c/egd/184).,SMD,2001-05-15T17:00:16,jhm,2002-10-01T14:45:44
C/EGD/1060,1060,EGD,-1,A/EGD/1049,4/12/1628,2028-12-04T00:00:00,4/12/1628,2028-12-04T00:00:00,,"Littil,Bessie",,,,,,,FALSE,FALSE,FALSE,FALSE,FALSE,FALSE,FALSE,FALSE,FALSE,FALSE,FALSE,FALSE,FALSE,FALSE,FALSE,FALSE,FALSE,FALSE,FALSE,FALSE,FALSE,FALSE,FALSE,FALSE,FALSE,FALSE,FALSE,FALSE,FALSE,FALSE,0,,TRUE,TRUE,FALSE,FALSE,0,,FALSE,,FALSE,,FALSE,FALSE,FALSE,FALSE,FALSE,FALSE,FALSE,,,,FALSE,FALSE,FALSE,FALSE,FALSE,FALSE,FALSE,FALSE,FALSE,FALSE,,FALSE,FALSE,FALSE,FALSE,FALSE,FALSE,FALSE,FALSE,FALSE,FALSE,FALSE,FALSE,FALSE,FALSE,FALSE,FALSE,FALSE,,FALSE,FALSE,,,FALSE,FALSE,FALSE,FALSE,FALSE,,,SMD,2001-05-15T17:00:16,jhm,2002-10-01T14:46:46
C/EGD/1061,1061,EGD,-1,A/EGD/1050,4/12/1628,2028-12-04T00:00:00,4/12/1628,2028-12-04T00:00:00,,"Baine,Margaret",,,,,,,FALSE,FALSE,FALSE,FALSE,FALSE,FALSE,FALSE,FALSE,FALSE,FALSE,FALSE,FALSE,FALSE,FALSE,FALSE,FALSE,FALSE,FALSE,FALSE,FALSE,FALSE,FALSE,FALSE,FALSE,FALSE,FALSE,FALSE,FALSE,FALSE,FALSE,0,,TRUE,TRUE,FALSE,FALSE,0,,FALSE,,FALSE,,FALSE,FALSE,FALSE,FALSE,FALSE,FALSE,FALSE,,,,FALSE,FALSE,FALSE,FALSE,FALSE,FALSE,FALSE,FALSE,FALSE,FALSE,,FALSE,FALSE,FALSE,FALSE,FALSE,FALSE,FALSE,FALSE,FALSE,FALSE,FALSE,FALSE,FALSE,FALSE,FALSE,FALSE,FALSE,,FALSE,FALSE,,,FALSE,FALSE,FALSE,FALSE,FALSE,,,SMD,2001-05-15T17:00:16,jhm,2002-10-01T14:48:29
C/EGD/1062,1062,EGD,-1,A/EGD/1051,4/12/1628,2028-12-04T00:00:00,4/12/1628,2028-12-04T00:00:00,,"McReadie,John",,,,,,,FALSE,FALSE,FALSE,FALSE,FALSE,FALSE,FALSE,FALSE,FALSE,FALSE,FALSE,FALSE,FALSE,FALSE,FALSE,FALSE,FALSE,FALSE,FALSE,FALSE,FALSE,FALSE,FALSE,FALSE,FALSE,FALSE,FALSE,FALSE,FALSE,FALSE,0,,TRUE,TRUE,FALSE,FALSE,0,,FALSE,,FALSE,,FALSE,FALSE,FALSE,FALSE,FALSE,FALSE,FALSE,,,,FALSE,FALSE,FALSE,FALSE,FALSE,FALSE,FALSE,FALSE,FALSE,FALSE,,FALSE,FALSE,FALSE,FALSE,FALSE,FALSE,FALSE,FALSE,FALSE,FALSE,FALSE,FALSE,FALSE,FALSE,FALSE,FALSE,FALSE,,FALSE,FALSE,,Incest with his mother and sister for two years,FALSE,FALSE,FALSE,FALSE,FALSE,,McReadie supposedly denounced a few people who were later investigated in 1630.,SMD,2001-05-15T17:00:16,LEM,2002-11-18T16:13:20
C/EGD/1063,1063,EGD,-1,A/EGD/1052,4/12/1628,2028-12-04T00:00:00,4/12/1628,2028-12-04T00:00:00,,"Mosse,Katherine",,,,,,,FALSE,FALSE,FALSE,FALSE,FALSE,FALSE,FALSE,FALSE,FALSE,FALSE,FALSE,FALSE,FALSE,FALSE,FALSE,FALSE,FALSE,FALSE,FALSE,FALSE,FALSE,FALSE,FALSE,FALSE,FALSE,FALSE,FALSE,FALSE,FALSE,FALSE,0,,TRUE,TRUE,FALSE,FALSE,0,,FALSE,,FALSE,,FALSE,FALSE,FALSE,FALSE,FALSE,FALSE,FALSE,,,,FALSE,FALSE,FALSE,FALSE,FALSE,FALSE,FALSE,FALSE,FALSE,FALSE,,FALSE,FALSE,FALSE,FALSE,FALSE,FALSE,FALSE,FALSE,FALSE,FALSE,FALSE,FALSE,FALSE,FALSE,FALSE,FALSE,FALSE,,FALSE,FALSE,,,FALSE,FALSE,FALSE,FALSE,FALSE,,,SMD,2001-05-15T17:00:16,jhm,2002-10-01T14:51:01
C/EGD/1064,1064,EGD,-1,A/EGD/1053,4/12/1628,2028-12-04T00:00:00,4/12/1628,2028-12-04T00:00:00,,"Browne,Katherine",,,,,,,FALSE,FALSE,FALSE,FALSE,FALSE,FALSE,FALSE,FALSE,FALSE,FALSE,FALSE,FALSE,FALSE,FALSE,FALSE,FALSE,FALSE,FALSE,FALSE,FALSE,FALSE,FALSE,FALSE,FALSE,FALSE,FALSE,FALSE,FALSE,FALSE,FALSE,0,,TRUE,TRUE,FALSE,FALSE,0,,FALSE,,FALSE,,FALSE,FALSE,FALSE,FALSE,FALSE,FALSE,FALSE,,,,FALSE,FALSE,FALSE,FALSE,FALSE,FALSE,FALSE,FALSE,FALSE,FALSE,,FALSE,FALSE,FALSE,FALSE,FALSE,FALSE,FALSE,FALSE,FALSE,FALSE,FALSE,FALSE,FALSE,FALSE,FALSE,FALSE,FALSE,,FALSE,FALSE,,,FALSE,FALSE,FALSE,FALSE,FALSE,,,SMD,2001-05-15T17:00:16,jhm,2002-10-01T14:52:17
C/EGD/1065,1065,EGD,-1,A/EGD/1054,4/12/1628,2028-12-04T00:00:00,4/12/1628,2028-12-04T00:00:00,,"Blyth,George",,,,,,,FALSE,FALSE,FALSE,FALSE,FALSE,FALSE,FALSE,FALSE,FALSE,FALSE,FALSE,FALSE,FALSE,FALSE,FALSE,FALSE,FALSE,FALSE,FALSE,FALSE,FALSE,FALSE,FALSE,FALSE,FALSE,FALSE,FALSE,FALSE,FALSE,FALSE,0,,TRUE,TRUE,FALSE,FALSE,0,,FALSE,,FALSE,,FALSE,FALSE,FALSE,FALSE,FALSE,FALSE,FALSE,,,,FALSE,FALSE,FALSE,FALSE,FALSE,FALSE,FALSE,FALSE,FALSE,FALSE,,FALSE,FALSE,FALSE,FALSE,FALSE,FALSE,FALSE,FALSE,FALSE,FALSE,FALSE,FALSE,FALSE,FALSE,FALSE,FALSE,FALSE,,FALSE,FALSE,,,FALSE,FALSE,FALSE,FALSE,FALSE,,,SMD,2001-05-15T17:00:16,jhm,2002-10-01T14:53:00
C/EGD/1066,1066,EGD,-1,A/EGD/1055,9/12/1628,2028-12-09T00:00:00,9/12/1628,2028-12-09T00:00:00,,"Tailyeour,Alesoun",,,,,,,FALSE,FALSE,FALSE,FALSE,FALSE,FALSE,FALSE,FALSE,FALSE,FALSE,FALSE,FALSE,FALSE,FALSE,FALSE,FALSE,FALSE,FALSE,FALSE,FALSE,FALSE,FALSE,FALSE,FALSE,FALSE,FALSE,FALSE,FALSE,FALSE,FALSE,0,,TRUE,TRUE,FALSE,FALSE,0,,FALSE,,FALSE,,FALSE,FALSE,FALSE,FALSE,FALSE,FALSE,FALSE,,,,FALSE,FALSE,FALSE,FALSE,FALSE,FALSE,FALSE,FALSE,FALSE,FALSE,,FALSE,FALSE,FALSE,FALSE,FALSE,FALSE,FALSE,FALSE,FALSE,FALSE,FALSE,FALSE,FALSE,FALSE,FALSE,FALSE,FALSE,,FALSE,FALSE,,,FALSE,FALSE,FALSE,FALSE,FALSE,,,SMD,2001-05-15T17:00:16,jhm,2002-10-01T14:54:07
C/EGD/1067,1067,EGD,-1,A/EGD/1056,9/12/1628,2028-12-09T00:00:00,20/1/1630,2030-01-20T00:00:00,,"Keyth,Sara",,,,,,,FALSE,FALSE,FALSE,FALSE,FALSE,FALSE,FALSE,FALSE,FALSE,FALSE,FALSE,FALSE,FALSE,FALSE,FALSE,FALSE,FALSE,FALSE,FALSE,FALSE,FALSE,FALSE,FALSE,FALSE,FALSE,FALSE,FALSE,FALSE,FALSE,FALSE,0,,TRUE,TRUE,FALSE,FALSE,0,,FALSE,,FALSE,,FALSE,FALSE,FALSE,FALSE,FALSE,FALSE,FALSE,,,,FALSE,FALSE,FALSE,FALSE,FALSE,FALSE,FALSE,FALSE,FALSE,FALSE,,FALSE,FALSE,FALSE,FALSE,FALSE,FALSE,FALSE,FALSE,FALSE,FALSE,FALSE,FALSE,FALSE,FALSE,FALSE,FALSE,FALSE,,FALSE,FALSE,,,FALSE,FALSE,FALSE,FALSE,FALSE,,,SMD,2001-05-15T17:00:16,jhm,2002-10-01T14:55:40
C/EGD/1068,1068,EGD,-1,A/EGD/2534,18/12/1628,2028-12-18T00:00:00,13/1/1629,2029-01-13T00:00:00,50,"Young,Unknown",,,,,,,FALSE,FALSE,FALSE,FALSE,FALSE,FALSE,FALSE,FALSE,FALSE,FALSE,FALSE,FALSE,FALSE,FALSE,FALSE,FALSE,FALSE,FALSE,FALSE,FALSE,FALSE,FALSE,FALSE,FALSE,FALSE,FALSE,FALSE,FALSE,FALSE,FALSE,0,,TRUE,TRUE,FALSE,FALSE,0,,FALSE,,FALSE,,FALSE,FALSE,FALSE,FALSE,FALSE,FALSE,FALSE,,,,FALSE,FALSE,FALSE,FALSE,FALSE,FALSE,FALSE,FALSE,FALSE,FALSE,,FALSE,FALSE,FALSE,FALSE,FALSE,FALSE,FALSE,FALSE,FALSE,FALSE,FALSE,FALSE,FALSE,FALSE,FALSE,FALSE,FALSE,,FALSE,FALSE,,,FALSE,FALSE,FALSE,FALSE,FALSE,,,SMD,2001-05-15T17:00:16,jhm,2002-11-21T13:58:25
C/EGD/1069,1069,EGD,-1,A/EGD/1057,19/12/1628,2028-12-19T00:00:00,17/3/1629,2029-03-17T00:00:00,,"Thomesone,Isobel",,,,,,,FALSE,FALSE,FALSE,FALSE,FALSE,FALSE,FALSE,FALSE,FALSE,FALSE,FALSE,FALSE,FALSE,FALSE,FALSE,FALSE,FALSE,FALSE,FALSE,FALSE,FALSE,FALSE,FALSE,FALSE,FALSE,FALSE,FALSE,FALSE,FALSE,FALSE,0,,TRUE,TRUE,FALSE,FALSE,0,,FALSE,,FALSE,,FALSE,FALSE,FALSE,FALSE,FALSE,FALSE,FALSE,,,,FALSE,FALSE,FALSE,FALSE,FALSE,FALSE,FALSE,FALSE,FALSE,FALSE,,FALSE,FALSE,FALSE,FALSE,FALSE,FALSE,FALSE,FALSE,FALSE,FALSE,FALSE,FALSE,FALSE,FALSE,FALSE,FALSE,FALSE,,FALSE,FALSE,,,FALSE,FALSE,FALSE,FALSE,FALSE,,,SMD,2001-05-15T17:00:16,jhm,2002-10-01T14:58:46
C/EGD/107,107,EGD,-1,A/EGD/96,1/5/1591,1991-05-01T00:00:00,19/9/1591,1991-09-19T00:00:00,,"Straton,Jonet",,,,,,,FALSE,TRUE,FALSE,FALSE,FALSE,TRUE,FALSE,FALSE,FALSE,FALSE,FALSE,FALSE,FALSE,FALSE,FALSE,FALSE,FALSE,TRUE,FALSE,FALSE,FALSE,FALSE,FALSE,FALSE,FALSE,FALSE,FALSE,TRUE,FALSE,FALSE,4,,TRUE,TRUE,FALSE,FALSE,0,"Part of the North Berwick witch hunt.  It involved many people and many accustions about witches meetings, specifically two separate attempts to sink the royal ships.  The first to sink Queen Anne on her way home, second to trouble King James after he went to get her in Denmark.",FALSE,Denounced Bothwell.  She said the devil would kill the king for Lord Bothwell's sake.,TRUE,,TRUE,FALSE,FALSE,FALSE,FALSE,FALSE,FALSE,,,"See Sampson c/egd/63 and Napier c/egd/103 for details of the meeting.  Said that Agnes Sampson approached them with a job to wreck a man in 1589, but they didn't know who it was.  Named 9 people and said that 60 were involved.  She also said that the Earl of Angus' wife called Lyon sent Barbara Napier to Agnes Sampson.  She later denied seeing Makcalyean at witches' meetings.",FALSE,FALSE,TRUE,TRUE,FALSE,FALSE,FALSE,TRUE,TRUE,FALSE,"Detailed description of preparation for the North Berwick meetings that she was supposedly at according to Napier's dittay.  Used a sark.  She was present when Agnes Sampson melted a toad over a fire and did something with the drippings as part of the attempt to wreck a man (they later found out it was the King).  The toad was then sent to Edinburgh to the women who would use it there.  Then Sampson called her master three times.  They then had the wax image, said words and walked widdershins with it.",FALSE,FALSE,FALSE,FALSE,FALSE,FALSE,FALSE,FALSE,FALSE,FALSE,FALSE,FALSE,FALSE,FALSE,FALSE,FALSE,FALSE,,FALSE,FALSE,,,FALSE,FALSE,FALSE,FALSE,FALSE,,She was personally interrogated by King James VI.,SMD,2001-05-15T17:00:16,jhm,2002-10-10T14:26:31
C/EGD/1070,1070,EGD,-1,A/EGD/1058,19/12/1628,2028-12-19T00:00:00,19/12/1628,2028-12-19T00:00:00,,"Bathcat,Marion",,,,,,,FALSE,FALSE,FALSE,FALSE,FALSE,FALSE,FALSE,FALSE,FALSE,FALSE,FALSE,FALSE,FALSE,FALSE,FALSE,FALSE,FALSE,FALSE,FALSE,FALSE,FALSE,FALSE,FALSE,FALSE,FALSE,FALSE,FALSE,FALSE,FALSE,FALSE,0,,TRUE,TRUE,FALSE,FALSE,0,,FALSE,,FALSE,,FALSE,FALSE,FALSE,FALSE,FALSE,FALSE,FALSE,,,,FALSE,FALSE,FALSE,FALSE,FALSE,FALSE,FALSE,FALSE,FALSE,FALSE,,FALSE,FALSE,FALSE,FALSE,FALSE,FALSE,FALSE,FALSE,FALSE,FALSE,FALSE,FALSE,FALSE,FALSE,FALSE,FALSE,FALSE,,FALSE,FALSE,,,FALSE,FALSE,FALSE,FALSE,FALSE,,,SMD,2001-05-15T17:00:16,jhm,2002-10-01T15:16:29
C/EGD/1071,1071,EGD,-1,A/EGD/1059,19/12/1628,2028-12-19T00:00:00,19/12/1628,2028-12-19T00:00:00,,"Baxter,Margaret",,,,,,,FALSE,FALSE,FALSE,FALSE,FALSE,FALSE,FALSE,FALSE,FALSE,FALSE,FALSE,FALSE,FALSE,FALSE,FALSE,FALSE,FALSE,FALSE,FALSE,FALSE,FALSE,FALSE,FALSE,FALSE,FALSE,FALSE,FALSE,FALSE,FALSE,FALSE,0,,TRUE,TRUE,FALSE,FALSE,0,,FALSE,,FALSE,,FALSE,FALSE,FALSE,FALSE,FALSE,FALSE,FALSE,,,,FALSE,FALSE,FALSE,FALSE,FALSE,FALSE,FALSE,FALSE,FALSE,FALSE,,FALSE,FALSE,FALSE,FALSE,FALSE,FALSE,FALSE,FALSE,FALSE,FALSE,FALSE,FALSE,FALSE,FALSE,FALSE,FALSE,FALSE,,FALSE,FALSE,,,FALSE,FALSE,FALSE,FALSE,FALSE,,,SMD,2001-05-15T17:00:16,jhm,2002-10-01T15:17:31
C/EGD/1073,1073,EGD,-1,A/EGD/1061,23/12/1628,2028-12-23T00:00:00,23/12/1628,2028-12-23T00:00:00,,"Carrilie,Bessie",,,,,,,FALSE,FALSE,FALSE,FALSE,FALSE,FALSE,FALSE,FALSE,FALSE,FALSE,FALSE,FALSE,FALSE,FALSE,FALSE,FALSE,FALSE,FALSE,FALSE,FALSE,FALSE,FALSE,FALSE,FALSE,FALSE,FALSE,FALSE,FALSE,FALSE,FALSE,0,,TRUE,TRUE,FALSE,FALSE,0,,FALSE,,FALSE,,FALSE,FALSE,FALSE,FALSE,FALSE,FALSE,FALSE,,,,FALSE,FALSE,FALSE,FALSE,FALSE,FALSE,FALSE,FALSE,FALSE,FALSE,,FALSE,FALSE,FALSE,FALSE,FALSE,FALSE,FALSE,FALSE,FALSE,FALSE,FALSE,FALSE,FALSE,FALSE,FALSE,FALSE,FALSE,,FALSE,FALSE,,,FALSE,FALSE,FALSE,FALSE,FALSE,,,SMD,2001-05-15T17:00:16,jhm,2002-10-01T15:18:30
C/EGD/1075,1075,EGD,-1,A/EGD/1063,20/1/1629,2029-01-20T00:00:00,14/3/1629,2029-03-14T00:00:00,,"Hardie,Marion",,,,,,,FALSE,FALSE,FALSE,FALSE,FALSE,FALSE,FALSE,FALSE,FALSE,FALSE,FALSE,FALSE,FALSE,FALSE,FALSE,FALSE,FALSE,TRUE,FALSE,FALSE,FALSE,FALSE,FALSE,FALSE,FALSE,FALSE,FALSE,FALSE,FALSE,FALSE,1,,TRUE,TRUE,FALSE,FALSE,0,Implicated by Cristian Wilson (c/la/2689) and Jonet Wilson (c/la/3019) who were denounced by Alexander Hammilton (c/egd/166).,FALSE,,FALSE,,FALSE,FALSE,FALSE,FALSE,FALSE,FALSE,FALSE,,,Another person claimed she was seen at a meeting at a yard.,FALSE,FALSE,FALSE,FALSE,FALSE,FALSE,FALSE,FALSE,FALSE,FALSE,,FALSE,FALSE,FALSE,FALSE,FALSE,FALSE,FALSE,FALSE,FALSE,FALSE,FALSE,FALSE,FALSE,FALSE,FALSE,FALSE,FALSE,,FALSE,FALSE,,,FALSE,FALSE,FALSE,FALSE,FALSE,,,SMD,2001-05-15T17:00:16,jhm,2002-10-01T15:22:12
C/EGD/1076,1076,EGD,-1,A/EGD/1064,21/1/1629,2029-01-21T00:00:00,20/1/1629,2029-01-20T00:00:00,,"Neinchat,Gradoch",,,,,,,FALSE,FALSE,FALSE,FALSE,FALSE,FALSE,FALSE,FALSE,FALSE,FALSE,FALSE,FALSE,FALSE,FALSE,FALSE,FALSE,FALSE,FALSE,FALSE,FALSE,FALSE,FALSE,FALSE,FALSE,FALSE,FALSE,FALSE,FALSE,FALSE,FALSE,0,,TRUE,TRUE,FALSE,FALSE,0,,FALSE,,FALSE,,FALSE,FALSE,FALSE,FALSE,FALSE,FALSE,FALSE,,,,FALSE,FALSE,FALSE,FALSE,FALSE,FALSE,FALSE,FALSE,FALSE,FALSE,,FALSE,FALSE,FALSE,FALSE,FALSE,FALSE,FALSE,FALSE,FALSE,FALSE,FALSE,FALSE,FALSE,FALSE,FALSE,FALSE,FALSE,,FALSE,FALSE,,,FALSE,FALSE,FALSE,FALSE,FALSE,,,SMD,2001-05-15T17:00:16,jhm,2002-10-01T15:23:17
C/EGD/1077,1077,EGD,-1,A/EGD/1065,20/1/1629,2029-01-20T00:00:00,20/1/1629,2029-01-20T00:00:00,,"Memphersoun,Katherine",,,,,,,FALSE,FALSE,FALSE,FALSE,FALSE,FALSE,FALSE,FALSE,FALSE,FALSE,FALSE,FALSE,FALSE,FALSE,FALSE,FALSE,FALSE,FALSE,FALSE,FALSE,FALSE,FALSE,FALSE,FALSE,FALSE,FALSE,FALSE,FALSE,FALSE,FALSE,0,,TRUE,TRUE,FALSE,FALSE,0,,FALSE,,FALSE,,FALSE,FALSE,FALSE,FALSE,FALSE,FALSE,FALSE,,,,FALSE,FALSE,FALSE,FALSE,FALSE,FALSE,FALSE,FALSE,FALSE,FALSE,,FALSE,FALSE,FALSE,FALSE,FALSE,FALSE,FALSE,FALSE,FALSE,FALSE,FALSE,FALSE,FALSE,FALSE,FALSE,FALSE,FALSE,,FALSE,FALSE,,,FALSE,FALSE,FALSE,FALSE,FALSE,,,SMD,2001-05-15T17:00:16,jhm,2002-10-01T15:24:31
C/EGD/1078,1078,EGD,-1,A/EGD/1066,20/1/1629,2029-01-20T00:00:00,20/1/1629,2029-01-20T00:00:00,,"Eir,Marie nein eane",,,,,,,FALSE,FALSE,FALSE,FALSE,FALSE,FALSE,FALSE,FALSE,FALSE,FALSE,FALSE,FALSE,FALSE,FALSE,FALSE,FALSE,FALSE,FALSE,FALSE,FALSE,FALSE,FALSE,FALSE,FALSE,FALSE,FALSE,FALSE,FALSE,FALSE,FALSE,0,,TRUE,TRUE,FALSE,FALSE,0,,FALSE,,FALSE,,FALSE,FALSE,FALSE,FALSE,FALSE,FALSE,FALSE,,,,FALSE,FALSE,FALSE,FALSE,FALSE,FALSE,FALSE,FALSE,FALSE,FALSE,,FALSE,FALSE,FALSE,FALSE,FALSE,FALSE,FALSE,FALSE,FALSE,FALSE,FALSE,FALSE,FALSE,FALSE,FALSE,FALSE,FALSE,,FALSE,FALSE,,,FALSE,FALSE,FALSE,FALSE,FALSE,,,SMD,2001-05-15T17:00:16,jhm,2002-10-01T15:25:21
C/EGD/1079,1079,EGD,-1,A/EGD/1067,20/1/1629,2029-01-20T00:00:00,20/1/1629,2029-01-20T00:00:00,,"Aunchtie,Katherine nein rob",,,,,,,FALSE,FALSE,FALSE,FALSE,FALSE,FALSE,FALSE,FALSE,FALSE,FALSE,FALSE,FALSE,FALSE,FALSE,FALSE,FALSE,FALSE,FALSE,FALSE,FALSE,FALSE,FALSE,FALSE,FALSE,FALSE,FALSE,FALSE,FALSE,FALSE,FALSE,0,,TRUE,TRUE,FALSE,FALSE,0,,FALSE,,FALSE,,FALSE,FALSE,FALSE,FALSE,FALSE,FALSE,FALSE,,,,FALSE,FALSE,FALSE,FALSE,FALSE,FALSE,FALSE,FALSE,FALSE,FALSE,,FALSE,FALSE,FALSE,FALSE,FALSE,FALSE,FALSE,FALSE,FALSE,FALSE,FALSE,FALSE,FALSE,FALSE,FALSE,FALSE,FALSE,,FALSE,FALSE,,,FALSE,FALSE,FALSE,FALSE,FALSE,,,SMD,2001-05-15T17:00:16,jhm,2002-10-01T15:26:22
C/EGD/108,108,EGD,-1,A/EGD/97,8/5/1591,1991-05-08T00:00:00,19/9/1591,1991-09-19T00:00:00,60,"Robinson,Donald",,,,,,,FALSE,FALSE,FALSE,FALSE,FALSE,TRUE,FALSE,FALSE,FALSE,FALSE,FALSE,FALSE,FALSE,FALSE,FALSE,FALSE,FALSE,TRUE,FALSE,FALSE,FALSE,FALSE,FALSE,FALSE,FALSE,FALSE,FALSE,TRUE,FALSE,FALSE,3,,TRUE,TRUE,FALSE,FALSE,0,"Part of the North Berwick witch hunt.  It involved many people and many accustions about witches meetings, specifically two separate attempts to sink the royal ships.  The first to sink Queen Anne on her way home, second to trouble King James after he went to get her in Denmark.",FALSE,,TRUE,,TRUE,FALSE,FALSE,FALSE,FALSE,FALSE,FALSE,,,"Asked if he was at North Berwick Kirk or at Acheson's haven, denied all of it.  Preparation for North Berwick meeting.  Agnes Sampson spoke to him about the destruction of the King.  Said the whole thing was ordered by Bothwell.  At the the Acheson's haven meeting they passed a wax image of James VI between them and chanted his name, they were promised gold, silver and victual from Bothwell (according to Sampson).",FALSE,FALSE,TRUE,TRUE,FALSE,FALSE,FALSE,FALSE,TRUE,FALSE,,FALSE,FALSE,FALSE,FALSE,FALSE,FALSE,FALSE,FALSE,FALSE,FALSE,FALSE,FALSE,FALSE,FALSE,FALSE,FALSE,FALSE,,FALSE,FALSE,,,FALSE,FALSE,FALSE,FALSE,FALSE,,,SMD,2001-05-15T17:00:16,jhm,2002-10-01T15:29:57
C/EGD/1080,1080,EGD,-1,A/EGD/1068,20/1/1629,2029-01-20T00:00:00,20/1/1629,2029-01-20T00:00:00,,"Make,Bessie",,,,,,,FALSE,FALSE,FALSE,FALSE,FALSE,FALSE,FALSE,FALSE,FALSE,FALSE,FALSE,FALSE,FALSE,FALSE,FALSE,FALSE,FALSE,FALSE,FALSE,FALSE,FALSE,FALSE,FALSE,FALSE,FALSE,FALSE,FALSE,FALSE,FALSE,FALSE,0,,TRUE,TRUE,FALSE,FALSE,0,,FALSE,,FALSE,,FALSE,FALSE,FALSE,FALSE,FALSE,FALSE,FALSE,,,,FALSE,FALSE,FALSE,FALSE,FALSE,FALSE,FALSE,FALSE,FALSE,FALSE,,FALSE,FALSE,FALSE,FALSE,FALSE,FALSE,FALSE,FALSE,FALSE,FALSE,FALSE,FALSE,FALSE,FALSE,FALSE,FALSE,FALSE,,FALSE,FALSE,,,FALSE,FALSE,FALSE,FALSE,FALSE,,,SMD,2001-05-15T17:00:16,jhm,2002-10-01T15:37:59
C/EGD/1081,1081,EGD,-1,A/EGD/1069,20/1/1629,2029-01-20T00:00:00,20/1/1629,2029-01-20T00:00:00,,"Wallace,Agnes",,,,,,,FALSE,FALSE,FALSE,FALSE,FALSE,FALSE,FALSE,FALSE,FALSE,FALSE,FALSE,FALSE,FALSE,FALSE,FALSE,FALSE,FALSE,FALSE,FALSE,FALSE,FALSE,FALSE,FALSE,FALSE,FALSE,FALSE,FALSE,FALSE,FALSE,FALSE,0,,TRUE,TRUE,FALSE,FALSE,0,,FALSE,,FALSE,,FALSE,FALSE,FALSE,FALSE,FALSE,FALSE,FALSE,,,,FALSE,FALSE,FALSE,FALSE,FALSE,FALSE,FALSE,FALSE,FALSE,FALSE,,FALSE,FALSE,FALSE,FALSE,FALSE,FALSE,FALSE,FALSE,FALSE,FALSE,FALSE,FALSE,FALSE,FALSE,FALSE,FALSE,FALSE,,FALSE,FALSE,,,FALSE,FALSE,FALSE,FALSE,FALSE,,,SMD,2001-05-15T17:00:16,jhm,2002-10-01T15:38:50
C/EGD/1082,1082,EGD,-1,A/EGD/1070,27/9/1628,2028-09-27T00:00:00,3/2/1629,2029-02-03T00:00:00,,"Young,Kathrene",,,,,,,FALSE,FALSE,FALSE,FALSE,FALSE,FALSE,FALSE,FALSE,FALSE,FALSE,FALSE,FALSE,FALSE,FALSE,FALSE,FALSE,FALSE,FALSE,FALSE,FALSE,FALSE,FALSE,FALSE,FALSE,FALSE,FALSE,FALSE,FALSE,FALSE,FALSE,0,,TRUE,TRUE,FALSE,FALSE,0,,FALSE,,FALSE,,FALSE,FALSE,FALSE,FALSE,FALSE,FALSE,FALSE,,,,FALSE,FALSE,FALSE,FALSE,FALSE,FALSE,FALSE,FALSE,FALSE,FALSE,,FALSE,FALSE,FALSE,FALSE,FALSE,FALSE,FALSE,FALSE,FALSE,FALSE,FALSE,FALSE,FALSE,FALSE,FALSE,FALSE,FALSE,,FALSE,FALSE,,,FALSE,FALSE,FALSE,FALSE,FALSE,,,SMD,2001-05-15T17:00:16,jhm,2002-10-01T15:39:26
C/EGD/1083,1083,EGD,-1,A/EGD/1071,3/2/1629,2029-02-03T00:00:00,3/2/1629,2029-02-03T00:00:00,,"Grige,Marion",,,,,,,FALSE,FALSE,FALSE,FALSE,FALSE,FALSE,FALSE,FALSE,FALSE,FALSE,FALSE,FALSE,FALSE,FALSE,FALSE,FALSE,FALSE,FALSE,FALSE,FALSE,FALSE,FALSE,FALSE,FALSE,FALSE,FALSE,FALSE,FALSE,FALSE,FALSE,0,,TRUE,TRUE,FALSE,FALSE,0,,FALSE,,FALSE,,FALSE,FALSE,FALSE,FALSE,FALSE,FALSE,FALSE,,,,FALSE,FALSE,FALSE,FALSE,FALSE,FALSE,FALSE,FALSE,FALSE,FALSE,,FALSE,FALSE,FALSE,FALSE,FALSE,FALSE,FALSE,FALSE,FALSE,FALSE,FALSE,FALSE,FALSE,FALSE,FALSE,FALSE,FALSE,,FALSE,FALSE,,,FALSE,FALSE,FALSE,FALSE,FALSE,,,SMD,2001-05-15T17:00:16,LEM,2002-12-06T12:11:16
C/EGD/1084,1084,EGD,-1,A/EGD/1072,3/2/1629,2029-02-03T00:00:00,3/2/1629,2029-02-03T00:00:00,,"Rutherfurde,Isobel",,,,,,,FALSE,FALSE,FALSE,FALSE,FALSE,FALSE,FALSE,FALSE,FALSE,FALSE,FALSE,FALSE,FALSE,FALSE,FALSE,FALSE,FALSE,FALSE,FALSE,FALSE,FALSE,FALSE,FALSE,FALSE,FALSE,FALSE,FALSE,FALSE,FALSE,FALSE,0,,TRUE,TRUE,FALSE,FALSE,0,,FALSE,,FALSE,,FALSE,FALSE,FALSE,FALSE,FALSE,FALSE,FALSE,,,,FALSE,FALSE,FALSE,FALSE,FALSE,FALSE,FALSE,FALSE,FALSE,FALSE,,FALSE,FALSE,FALSE,FALSE,FALSE,FALSE,FALSE,FALSE,FALSE,FALSE,FALSE,FALSE,FALSE,FALSE,FALSE,FALSE,FALSE,,FALSE,FALSE,,,FALSE,FALSE,FALSE,FALSE,FALSE,,,SMD,2001-05-15T17:00:16,jhm,2002-10-01T15:42:27
C/EGD/1085,1085,EGD,-1,A/EGD/1073,19/2/1629,2029-02-19T00:00:00,19/3/1629,2029-03-19T00:00:00,,"Neill,Jonet",,,,,,,FALSE,FALSE,FALSE,FALSE,FALSE,FALSE,FALSE,FALSE,FALSE,FALSE,FALSE,FALSE,FALSE,FALSE,FALSE,FALSE,FALSE,FALSE,FALSE,FALSE,FALSE,FALSE,FALSE,FALSE,FALSE,FALSE,FALSE,FALSE,FALSE,FALSE,0,,TRUE,TRUE,FALSE,FALSE,0,,FALSE,,FALSE,,FALSE,FALSE,FALSE,FALSE,FALSE,FALSE,FALSE,,,,FALSE,FALSE,FALSE,FALSE,FALSE,FALSE,FALSE,FALSE,FALSE,FALSE,,FALSE,FALSE,FALSE,FALSE,FALSE,FALSE,FALSE,FALSE,FALSE,FALSE,FALSE,FALSE,FALSE,FALSE,FALSE,FALSE,FALSE,,FALSE,FALSE,,,FALSE,FALSE,FALSE,FALSE,FALSE,,,SMD,2001-05-15T17:00:16,LEM,2002-11-11T12:27:53
C/EGD/1086,1086,EGD,-1,A/EGD/1074,24/2/1629,2029-02-24T00:00:00,24/2/1629,2029-02-24T00:00:00,,"Meyne,Bessie",,,,,,,FALSE,FALSE,FALSE,FALSE,FALSE,FALSE,FALSE,FALSE,FALSE,FALSE,FALSE,FALSE,FALSE,FALSE,FALSE,FALSE,FALSE,FALSE,FALSE,FALSE,FALSE,FALSE,FALSE,FALSE,FALSE,FALSE,FALSE,FALSE,FALSE,FALSE,0,,TRUE,TRUE,FALSE,FALSE,0,,FALSE,,FALSE,,FALSE,FALSE,FALSE,FALSE,FALSE,FALSE,FALSE,,,,FALSE,FALSE,FALSE,FALSE,FALSE,FALSE,FALSE,FALSE,FALSE,FALSE,,FALSE,FALSE,FALSE,FALSE,FALSE,FALSE,FALSE,FALSE,FALSE,FALSE,FALSE,FALSE,FALSE,FALSE,FALSE,FALSE,FALSE,,FALSE,FALSE,,,FALSE,FALSE,FALSE,FALSE,FALSE,,,SMD,2001-05-15T17:00:16,jhm,2002-10-01T15:46:22
C/EGD/1087,1087,EGD,-1,A/EGD/1075,24/1/1629,2029-01-24T00:00:00,24/2/1629,2029-02-24T00:00:00,,"Minto,Janet",,,,,,,FALSE,FALSE,FALSE,FALSE,FALSE,FALSE,FALSE,FALSE,FALSE,FALSE,FALSE,FALSE,FALSE,FALSE,FALSE,FALSE,FALSE,FALSE,FALSE,FALSE,FALSE,FALSE,FALSE,FALSE,FALSE,FALSE,FALSE,FALSE,FALSE,FALSE,0,,TRUE,TRUE,FALSE,FALSE,0,,FALSE,,FALSE,,FALSE,FALSE,FALSE,FALSE,FALSE,FALSE,FALSE,,,,FALSE,FALSE,FALSE,FALSE,FALSE,FALSE,FALSE,FALSE,FALSE,FALSE,,FALSE,FALSE,FALSE,FALSE,FALSE,FALSE,FALSE,FALSE,FALSE,FALSE,FALSE,FALSE,FALSE,FALSE,FALSE,FALSE,FALSE,,FALSE,FALSE,,,FALSE,FALSE,FALSE,FALSE,FALSE,,,SMD,2001-05-15T17:00:16,jhm,2002-10-01T15:47:18
C/EGD/1088,1088,EGD,-1,A/EGD/1076,24/1/1629,2029-01-24T00:00:00,24/2/1629,2029-02-24T00:00:00,,"Hendersoun,Janet",,,,,,,FALSE,FALSE,FALSE,FALSE,FALSE,FALSE,FALSE,FALSE,FALSE,FALSE,FALSE,FALSE,FALSE,FALSE,FALSE,FALSE,FALSE,FALSE,FALSE,FALSE,FALSE,FALSE,FALSE,FALSE,FALSE,FALSE,FALSE,FALSE,FALSE,FALSE,0,,TRUE,TRUE,FALSE,FALSE,0,,FALSE,,FALSE,,FALSE,FALSE,FALSE,FALSE,FALSE,FALSE,FALSE,,,,FALSE,FALSE,FALSE,FALSE,FALSE,FALSE,FALSE,FALSE,FALSE,FALSE,,FALSE,FALSE,FALSE,FALSE,FALSE,FALSE,FALSE,FALSE,FALSE,FALSE,FALSE,FALSE,FALSE,FALSE,FALSE,FALSE,FALSE,,FALSE,FALSE,,,FALSE,FALSE,FALSE,FALSE,FALSE,,,SMD,2001-05-15T17:00:16,jhm,2002-10-01T15:47:59
C/EGD/1089,1089,EGD,-1,A/EGD/1077,24/1/1629,2029-01-24T00:00:00,24/2/1629,2029-02-24T00:00:00,,"Cumroy,Bessie",,,,,,,FALSE,FALSE,FALSE,FALSE,FALSE,FALSE,FALSE,FALSE,FALSE,FALSE,FALSE,FALSE,FALSE,FALSE,FALSE,FALSE,FALSE,FALSE,FALSE,FALSE,FALSE,FALSE,FALSE,FALSE,FALSE,FALSE,FALSE,FALSE,FALSE,FALSE,0,,TRUE,TRUE,FALSE,FALSE,0,,FALSE,,FALSE,,FALSE,FALSE,FALSE,FALSE,FALSE,FALSE,FALSE,,,,FALSE,FALSE,FALSE,FALSE,FALSE,FALSE,FALSE,FALSE,FALSE,FALSE,,FALSE,FALSE,FALSE,FALSE,FALSE,FALSE,FALSE,FALSE,FALSE,FALSE,FALSE,FALSE,FALSE,FALSE,FALSE,FALSE,FALSE,,FALSE,FALSE,,,FALSE,FALSE,FALSE,FALSE,FALSE,,,SMD,2001-05-15T17:00:16,jhm,2002-10-01T15:49:12
C/EGD/109,109,EGD,-1,A/EGD/98,1591,1991-06-01T00:00:00,1591,1991-06-01T00:00:00,,"Wat,Charles",,,,,,,FALSE,FALSE,FALSE,FALSE,FALSE,FALSE,FALSE,FALSE,FALSE,FALSE,FALSE,FALSE,FALSE,FALSE,FALSE,FALSE,FALSE,FALSE,FALSE,FALSE,FALSE,FALSE,FALSE,FALSE,FALSE,FALSE,FALSE,FALSE,FALSE,FALSE,0,,TRUE,TRUE,FALSE,FALSE,0,,FALSE,,FALSE,,FALSE,FALSE,FALSE,FALSE,FALSE,FALSE,FALSE,,,,FALSE,FALSE,FALSE,FALSE,FALSE,FALSE,FALSE,FALSE,FALSE,FALSE,,FALSE,FALSE,FALSE,FALSE,FALSE,FALSE,FALSE,FALSE,FALSE,FALSE,FALSE,FALSE,FALSE,FALSE,FALSE,FALSE,FALSE,,FALSE,FALSE,,,FALSE,FALSE,FALSE,FALSE,FALSE,,"Was listed in Larner, but did not find this case!",SMD,2001-05-15T17:00:16,jhm,2002-10-01T15:50:18
C/EGD/1090,1090,EGD,-1,A/EGD/1078,24/2/1629,2029-02-24T00:00:00,24/2/1629,2029-02-24T00:00:00,,"Wright,Isobel",,,,,,,FALSE,FALSE,FALSE,FALSE,FALSE,FALSE,FALSE,FALSE,FALSE,FALSE,FALSE,FALSE,FALSE,FALSE,FALSE,FALSE,FALSE,FALSE,FALSE,FALSE,FALSE,FALSE,FALSE,FALSE,FALSE,FALSE,FALSE,FALSE,FALSE,FALSE,0,,TRUE,TRUE,FALSE,FALSE,0,,FALSE,,FALSE,,FALSE,FALSE,FALSE,FALSE,FALSE,FALSE,FALSE,,,,FALSE,FALSE,FALSE,FALSE,FALSE,FALSE,FALSE,FALSE,FALSE,FALSE,,FALSE,FALSE,FALSE,FALSE,FALSE,FALSE,FALSE,FALSE,FALSE,FALSE,FALSE,FALSE,FALSE,FALSE,FALSE,FALSE,FALSE,,FALSE,FALSE,,,FALSE,FALSE,FALSE,FALSE,FALSE,,,SMD,2001-05-15T17:00:16,jhm,2002-10-01T15:50:47
C/EGD/1091,1091,EGD,-1,A/EGD/1079,19/2/1629,2029-02-19T00:00:00,10/4/1629,2029-04-10T00:00:00,,"Hunter,Margaret",,,,,,,FALSE,FALSE,FALSE,FALSE,FALSE,FALSE,FALSE,FALSE,FALSE,FALSE,FALSE,FALSE,FALSE,FALSE,FALSE,FALSE,FALSE,FALSE,FALSE,FALSE,FALSE,FALSE,FALSE,FALSE,FALSE,FALSE,FALSE,FALSE,FALSE,FALSE,0,,TRUE,TRUE,FALSE,FALSE,0,,FALSE,,FALSE,,FALSE,FALSE,FALSE,FALSE,FALSE,FALSE,FALSE,,,,FALSE,FALSE,FALSE,FALSE,FALSE,FALSE,FALSE,FALSE,FALSE,FALSE,,FALSE,FALSE,FALSE,FALSE,FALSE,FALSE,FALSE,FALSE,FALSE,FALSE,FALSE,FALSE,FALSE,FALSE,FALSE,FALSE,FALSE,,FALSE,FALSE,,,FALSE,FALSE,FALSE,FALSE,FALSE,,,SMD,2001-05-15T17:00:16,LEM,2002-11-11T12:28:07
C/EGD/1092,1092,EGD,-1,A/EGD/1080,19/6/1629,2029-06-19T00:00:00,10/4/1629,2029-04-10T00:00:00,,"Donald,Janet",,,,,,,FALSE,FALSE,FALSE,FALSE,FALSE,FALSE,FALSE,FALSE,FALSE,FALSE,FALSE,FALSE,FALSE,FALSE,FALSE,FALSE,FALSE,FALSE,FALSE,FALSE,FALSE,FALSE,FALSE,FALSE,FALSE,FALSE,FALSE,FALSE,FALSE,FALSE,0,,TRUE,TRUE,FALSE,FALSE,0,,FALSE,,FALSE,,FALSE,FALSE,FALSE,FALSE,FALSE,FALSE,FALSE,,,,FALSE,FALSE,FALSE,FALSE,FALSE,FALSE,FALSE,FALSE,FALSE,FALSE,,FALSE,FALSE,FALSE,FALSE,FALSE,FALSE,FALSE,FALSE,FALSE,FALSE,FALSE,FALSE,FALSE,FALSE,FALSE,FALSE,FALSE,,FALSE,FALSE,,,FALSE,FALSE,FALSE,FALSE,FALSE,,,SMD,2001-05-15T17:00:16,LEM,2002-11-11T12:28:18
C/EGD/1093,1093,EGD,-1,A/EGD/1081,17/3/1629,2029-03-17T00:00:00,17/3/1629,2029-03-17T00:00:00,,"Melros,Janet",,,,,,,FALSE,FALSE,FALSE,FALSE,FALSE,FALSE,FALSE,FALSE,FALSE,FALSE,FALSE,FALSE,FALSE,FALSE,FALSE,FALSE,FALSE,FALSE,FALSE,FALSE,FALSE,FALSE,FALSE,FALSE,FALSE,FALSE,FALSE,FALSE,FALSE,FALSE,0,,TRUE,TRUE,FALSE,FALSE,0,,FALSE,,FALSE,,FALSE,FALSE,FALSE,FALSE,FALSE,FALSE,FALSE,,,,FALSE,FALSE,FALSE,FALSE,FALSE,FALSE,FALSE,FALSE,FALSE,FALSE,,FALSE,FALSE,FALSE,FALSE,FALSE,FALSE,FALSE,FALSE,FALSE,FALSE,FALSE,FALSE,FALSE,FALSE,FALSE,FALSE,FALSE,,FALSE,FALSE,,,FALSE,FALSE,FALSE,FALSE,FALSE,,,SMD,2001-05-15T17:00:16,jhm,2002-10-01T15:55:35
C/EGD/1094,1094,EGD,-1,A/EGD/1082,31/5/1624,2024-05-31T00:00:00,11/7/1629,2029-07-11T00:00:00,75,"Drummond,Alexander",,,,,,,FALSE,TRUE,FALSE,FALSE,FALSE,TRUE,FALSE,FALSE,FALSE,FALSE,TRUE,TRUE,FALSE,FALSE,FALSE,FALSE,FALSE,FALSE,FALSE,FALSE,FALSE,FALSE,FALSE,FALSE,FALSE,FALSE,FALSE,FALSE,FALSE,FALSE,4,,FALSE,FALSE,FALSE,TRUE,1,It is all about folk healing (charming).  He was being paid.  It was said that he could cure all but present death.  He made a direct challenge to the church saying he was more powerful than ministers because he could give people health (JC26/9 item 21). Maybe the mention of his familiar spirit was what shifted the case into witchcraft.  The demonic consisted of hearsay rumours that his mother had given him to the Devil.  The JC26/9 bundle has loads of information on specific words and cures used.,FALSE,Had a 'familiar spreit'.  Hearsay evidence given in by a woman who said she heard Alexander say that his mother had given him over to the Devil (JC26/9 item 20).,FALSE,,FALSE,FALSE,FALSE,FALSE,FALSE,FALSE,FALSE,,,,FALSE,FALSE,TRUE,TRUE,TRUE,FALSE,FALSE,TRUE,FALSE,FALSE,"Used a sick man's shirt for diagnosis of bewitchment.  Healing for money.  Used part of a root under a man's head for failed healing attempt.  Told some sick people to seek their health from the suspected bewitcher 'for God's sake'.  He performed an unauthorised exorcism, he said he would save the boy's soul.  He gave the boy a leather pouch filled with rusty nail, bits of stick and roots.  Used south running water, powders to make drinks.  Told people not to eat meat on Fridays.  Said to use water where 'ane Christian King had ridden over' to wash a shirt for healing.  He kept a book of cures and had 3 special stones called 'slake stanes'.  Drummond called his healing words 'holy orations'.",FALSE,FALSE,FALSE,FALSE,FALSE,FALSE,FALSE,TRUE,FALSE,TRUE,FALSE,FALSE,FALSE,TRUE,TRUE,FALSE,FALSE,"He could cure frenaters, madness, the falling evil, destraction, apparitions, st. anthony's fire, noli me cangre, canceris wormes, glengores.  Use of shirt.  Wide range of healing.",FALSE,FALSE,,charged with charming in RPC p. 104,FALSE,FALSE,FALSE,FALSE,FALSE,,He was first denounced as a rebel on May 1624 in Perth.  He was investigated by the minsters at Dunfermline on 31 May 1624.  The Presbytery of Auchterarder (Muthill) could not break him and he had a lot of support locally.  So the request was granted and he was transported to Edinburgh and tried there.  Three RPC entries discuss this.  There was a posthumous campaign to clear his name as 'ane notable Christian and did all his wondrous cures by lawfull meanes' (JC26/9 item 5).,SMD,2001-05-15T17:00:16,LEM,2002-11-11T11:48:22
C/EGD/1095,1095,EGD,-1,A/EGD/1083,24/3/1629,2029-03-24T00:00:00,24/3/1629,2029-03-24T00:00:00,,"Gray,Isobel",,,,,,,FALSE,FALSE,FALSE,FALSE,FALSE,FALSE,FALSE,FALSE,FALSE,FALSE,FALSE,FALSE,FALSE,FALSE,FALSE,FALSE,FALSE,FALSE,FALSE,FALSE,FALSE,FALSE,FALSE,FALSE,FALSE,FALSE,FALSE,FALSE,FALSE,FALSE,0,,TRUE,TRUE,FALSE,FALSE,0,,FALSE,,FALSE,,FALSE,FALSE,FALSE,FALSE,FALSE,FALSE,FALSE,,,,FALSE,FALSE,FALSE,FALSE,FALSE,FALSE,FALSE,FALSE,FALSE,FALSE,,FALSE,FALSE,FALSE,FALSE,FALSE,FALSE,FALSE,FALSE,FALSE,FALSE,FALSE,FALSE,FALSE,FALSE,FALSE,FALSE,FALSE,,FALSE,FALSE,,,FALSE,FALSE,FALSE,FALSE,FALSE,,"She denounced 16 people, they are c/egd/1099 through to c/egd/1114.",SMD,2001-05-15T17:00:16,jhm,2002-10-02T09:33:00
C/EGD/1096,1096,EGD,-1,A/EGD/1084,24/3/1629,2029-03-24T00:00:00,24/3/1629,2029-03-24T00:00:00,,"Hunter,Alexander",,,,,,,FALSE,FALSE,FALSE,FALSE,FALSE,FALSE,FALSE,FALSE,FALSE,FALSE,FALSE,FALSE,FALSE,FALSE,FALSE,FALSE,FALSE,FALSE,FALSE,FALSE,FALSE,FALSE,FALSE,FALSE,FALSE,FALSE,FALSE,FALSE,FALSE,FALSE,0,,TRUE,TRUE,FALSE,FALSE,0,,FALSE,,FALSE,,FALSE,FALSE,FALSE,FALSE,FALSE,FALSE,FALSE,,,,FALSE,FALSE,FALSE,FALSE,FALSE,FALSE,FALSE,FALSE,FALSE,FALSE,,FALSE,FALSE,FALSE,FALSE,FALSE,FALSE,FALSE,FALSE,FALSE,FALSE,FALSE,FALSE,FALSE,FALSE,FALSE,FALSE,FALSE,,FALSE,FALSE,,,FALSE,FALSE,FALSE,FALSE,FALSE,,,SMD,2001-05-15T17:00:16,jhm,2002-10-02T09:58:29
C/EGD/1097,1097,EGD,-1,A/EGD/1085,31/1/1629,2029-01-31T00:00:00,31/3/1629,2029-03-31T00:00:00,,"Widdrow,Janet",,,,,,,FALSE,FALSE,FALSE,FALSE,FALSE,FALSE,FALSE,FALSE,FALSE,FALSE,FALSE,FALSE,FALSE,FALSE,FALSE,FALSE,FALSE,FALSE,FALSE,FALSE,FALSE,FALSE,FALSE,FALSE,FALSE,FALSE,FALSE,FALSE,FALSE,FALSE,0,,TRUE,TRUE,FALSE,FALSE,0,,FALSE,,FALSE,,FALSE,FALSE,FALSE,FALSE,FALSE,FALSE,FALSE,,,,FALSE,FALSE,FALSE,FALSE,FALSE,FALSE,FALSE,FALSE,FALSE,FALSE,,FALSE,FALSE,FALSE,FALSE,FALSE,FALSE,FALSE,FALSE,FALSE,FALSE,FALSE,FALSE,FALSE,FALSE,FALSE,FALSE,FALSE,,FALSE,FALSE,,,FALSE,FALSE,FALSE,FALSE,FALSE,,,SMD,2001-05-15T17:00:16,jhm,2002-10-02T10:00:22
C/EGD/1098,1098,EGD,-1,A/EGD/1086,17/3/1629,2029-03-17T00:00:00,17/3/1629,2029-03-17T00:00:00,,"Wallace,Margaret",,,,,,,FALSE,FALSE,FALSE,FALSE,FALSE,FALSE,FALSE,FALSE,FALSE,FALSE,FALSE,FALSE,FALSE,FALSE,FALSE,FALSE,FALSE,FALSE,FALSE,FALSE,FALSE,FALSE,FALSE,FALSE,FALSE,FALSE,FALSE,FALSE,FALSE,FALSE,0,,TRUE,TRUE,FALSE,FALSE,0,,FALSE,,FALSE,,FALSE,FALSE,FALSE,FALSE,FALSE,FALSE,FALSE,,,,FALSE,FALSE,FALSE,FALSE,FALSE,FALSE,FALSE,FALSE,FALSE,FALSE,,FALSE,FALSE,FALSE,FALSE,FALSE,FALSE,FALSE,FALSE,FALSE,FALSE,FALSE,FALSE,FALSE,FALSE,FALSE,FALSE,FALSE,,FALSE,FALSE,,,FALSE,FALSE,FALSE,FALSE,FALSE,,,SMD,2001-05-15T17:00:16,jhm,2002-10-02T10:01:14
C/EGD/1099,1099,EGD,-1,A/EGD/1087,24/3/1629,2029-03-24T00:00:00,15/4/1629,2029-04-15T00:00:00,,"Cleilland,Jean",,,,,,,FALSE,FALSE,FALSE,FALSE,FALSE,FALSE,FALSE,FALSE,FALSE,FALSE,FALSE,FALSE,FALSE,FALSE,FALSE,FALSE,FALSE,TRUE,FALSE,FALSE,FALSE,FALSE,FALSE,FALSE,FALSE,FALSE,FALSE,FALSE,FALSE,FALSE,1,,TRUE,TRUE,FALSE,FALSE,0,,FALSE,,FALSE,,FALSE,FALSE,FALSE,FALSE,FALSE,FALSE,FALSE,,,,FALSE,FALSE,FALSE,FALSE,FALSE,FALSE,FALSE,FALSE,FALSE,FALSE,,FALSE,FALSE,FALSE,FALSE,FALSE,FALSE,FALSE,FALSE,FALSE,FALSE,FALSE,FALSE,FALSE,FALSE,FALSE,FALSE,FALSE,,FALSE,FALSE,,,FALSE,FALSE,FALSE,FALSE,FALSE,,,SMD,2001-05-15T17:00:16,jhm,2002-10-02T10:02:52
C/EGD/11,11,EGD,0,,2/8/1649,2049-08-02T00:00:00,2/8/1649,2049-08-02T00:00:00,,6 unnamed witches,commission for execution,,,,,6,FALSE,FALSE,FALSE,FALSE,FALSE,FALSE,FALSE,FALSE,FALSE,FALSE,FALSE,FALSE,FALSE,FALSE,FALSE,FALSE,FALSE,FALSE,FALSE,FALSE,FALSE,FALSE,FALSE,FALSE,FALSE,FALSE,FALSE,FALSE,FALSE,FALSE,0,,TRUE,TRUE,FALSE,FALSE,0,,FALSE,,FALSE,,FALSE,FALSE,FALSE,FALSE,FALSE,FALSE,FALSE,,,,FALSE,FALSE,FALSE,FALSE,FALSE,FALSE,FALSE,FALSE,FALSE,FALSE,,FALSE,FALSE,FALSE,FALSE,FALSE,FALSE,FALSE,FALSE,FALSE,FALSE,FALSE,FALSE,FALSE,FALSE,FALSE,FALSE,FALSE,,FALSE,FALSE,,,FALSE,FALSE,FALSE,FALSE,FALSE,,"Certain persons to be executed from Dirleton and Haddington. Number calculated as 6, 3 from each parish.",SMD,2001-05-15T17:00:16,jhm,2002-10-02T10:04:12
C/EGD/110,110,EGD,-1,A/EGD/99,27/1/1591,1991-01-27T00:00:00,8/5/1591,1991-05-08T00:00:00,,"Duncan,Gelie",,,,,,,FALSE,TRUE,FALSE,FALSE,FALSE,TRUE,FALSE,FALSE,FALSE,FALSE,FALSE,FALSE,FALSE,TRUE,FALSE,FALSE,FALSE,TRUE,FALSE,FALSE,FALSE,FALSE,FALSE,FALSE,FALSE,FALSE,TRUE,TRUE,FALSE,FALSE,6,,FALSE,TRUE,FALSE,FALSE,0,"Part of the North Berwick witch hunt.  It involved many people and many accustions about witches meetings, specifically two separate attempts to sink the royal ships.  The first to sink Queen Anne on her way home, second to trouble King James after he went to get her in Denmark.  We have her confessions and she denounced Bothwell.",FALSE,"She said she heard Bothwell talking about plans, but never saw him.",TRUE,,TRUE,FALSE,FALSE,FALSE,TRUE,TRUE,FALSE,,,"She confessed to having a meeting with Agnes Sampson and others where they ate sweat meats, roasted fowl and drank by the sea.  She was described as dancing and playing the trump for the rest of the gathering.  part of the planning of the conspiracy to sink Queen Anne's ships on the way from Denmark.  See Agnes Sampson's case for description of North Berwick meeting (c/egd/63).  See napier (c/egd/103) for description of preparation for North Berwick.  See also Napier (c/egd/103) for more details about the North Berwick meeting.  She said they were paid gold, silver and victual for Sampson and her children.  She confessed about the destroying of a ship and taking all the wealth, they were 'crabit' because Grierson got all the 'wrake'.",FALSE,FALSE,FALSE,TRUE,FALSE,FALSE,FALSE,TRUE,TRUE,FALSE,Detailed ritual with four joints tied to the feet of a cat and cast into the sea to raise a wind.  She handled the cloth and clay pictures.,FALSE,FALSE,TRUE,FALSE,FALSE,FALSE,FALSE,TRUE,FALSE,FALSE,FALSE,FALSE,FALSE,FALSE,TRUE,FALSE,FALSE,Transferred illness from a man to a dog.,TRUE,TRUE,,,FALSE,FALSE,FALSE,FALSE,FALSE,,,SMD,2001-05-15T17:00:16,LEM,2002-11-11T11:45:49
C/EGD/1100,1100,EGD,-1,A/EGD/1088,24/3/1629,2029-03-24T00:00:00,1/8/1629,2029-08-01T00:00:00,,"Haistie,Margaret",,,,,,,FALSE,FALSE,FALSE,FALSE,FALSE,FALSE,FALSE,FALSE,FALSE,FALSE,FALSE,FALSE,FALSE,FALSE,FALSE,FALSE,FALSE,TRUE,FALSE,FALSE,FALSE,FALSE,FALSE,FALSE,FALSE,FALSE,FALSE,FALSE,FALSE,FALSE,1,,TRUE,TRUE,FALSE,FALSE,0,,FALSE,,FALSE,,FALSE,FALSE,FALSE,FALSE,FALSE,FALSE,FALSE,,,,FALSE,FALSE,FALSE,FALSE,FALSE,FALSE,FALSE,FALSE,FALSE,FALSE,,FALSE,FALSE,FALSE,FALSE,FALSE,FALSE,FALSE,FALSE,FALSE,FALSE,FALSE,FALSE,FALSE,FALSE,FALSE,FALSE,FALSE,,FALSE,FALSE,,,FALSE,FALSE,FALSE,FALSE,FALSE,,,SMD,2001-05-15T17:00:16,jhm,2002-10-02T10:18:05
C/EGD/1101,1101,EGD,-1,A/EGD/1089,,,15/4/1629,2029-04-15T00:00:00,,"Frame,James",,,,,,,FALSE,FALSE,FALSE,FALSE,FALSE,FALSE,FALSE,FALSE,FALSE,FALSE,FALSE,FALSE,FALSE,FALSE,FALSE,FALSE,FALSE,TRUE,FALSE,FALSE,FALSE,FALSE,FALSE,FALSE,FALSE,FALSE,FALSE,FALSE,FALSE,FALSE,1,,TRUE,TRUE,FALSE,FALSE,0,,FALSE,,FALSE,,FALSE,FALSE,FALSE,FALSE,FALSE,FALSE,FALSE,,,,FALSE,FALSE,FALSE,FALSE,FALSE,FALSE,FALSE,FALSE,FALSE,FALSE,,FALSE,FALSE,FALSE,FALSE,FALSE,FALSE,FALSE,FALSE,FALSE,FALSE,FALSE,FALSE,FALSE,FALSE,FALSE,FALSE,FALSE,,FALSE,FALSE,,,FALSE,FALSE,FALSE,FALSE,FALSE,,,SMD,2001-05-15T17:00:16,jhm,2002-10-02T14:27:28
C/EGD/1102,1102,EGD,-1,A/EGD/1090,24/3/1629,2029-03-24T00:00:00,15/4/1629,2029-04-15T00:00:00,,"Wilson,Margaret",,,,,,,FALSE,FALSE,FALSE,FALSE,FALSE,FALSE,FALSE,FALSE,FALSE,FALSE,FALSE,FALSE,FALSE,FALSE,FALSE,FALSE,FALSE,TRUE,FALSE,FALSE,FALSE,FALSE,FALSE,FALSE,FALSE,FALSE,FALSE,FALSE,FALSE,FALSE,1,,TRUE,TRUE,FALSE,FALSE,0,,FALSE,,FALSE,,FALSE,FALSE,FALSE,FALSE,FALSE,FALSE,FALSE,,,,FALSE,FALSE,FALSE,FALSE,FALSE,FALSE,FALSE,FALSE,FALSE,FALSE,,FALSE,FALSE,FALSE,FALSE,FALSE,FALSE,FALSE,FALSE,FALSE,FALSE,FALSE,FALSE,FALSE,FALSE,FALSE,FALSE,FALSE,,FALSE,FALSE,,,FALSE,FALSE,FALSE,FALSE,FALSE,,,SMD,2001-05-15T17:00:16,jhm,2002-10-02T10:22:09
C/EGD/1103,1103,EGD,-1,A/EGD/1091,24/3/1629,2029-03-24T00:00:00,15/4/1629,2029-04-15T00:00:00,,"Hutchesoun,Margaret",,,,,,,FALSE,FALSE,FALSE,FALSE,FALSE,FALSE,FALSE,FALSE,FALSE,FALSE,FALSE,FALSE,FALSE,FALSE,FALSE,FALSE,FALSE,TRUE,FALSE,FALSE,FALSE,FALSE,FALSE,FALSE,FALSE,FALSE,FALSE,FALSE,FALSE,FALSE,1,,TRUE,TRUE,FALSE,FALSE,0,,FALSE,,FALSE,,FALSE,FALSE,FALSE,FALSE,FALSE,FALSE,FALSE,,,,FALSE,FALSE,FALSE,FALSE,FALSE,FALSE,FALSE,FALSE,FALSE,FALSE,,FALSE,FALSE,FALSE,FALSE,FALSE,FALSE,FALSE,FALSE,FALSE,FALSE,FALSE,FALSE,FALSE,FALSE,FALSE,FALSE,FALSE,,FALSE,FALSE,,,FALSE,FALSE,FALSE,FALSE,FALSE,,,SMD,2001-05-15T17:00:16,jhm,2002-10-02T10:23:19
C/EGD/1104,1104,EGD,-1,A/EGD/1092,24/3/1629,2029-03-24T00:00:00,15/4/1629,2029-04-15T00:00:00,,"Weir,Janet",,,,,,,FALSE,FALSE,FALSE,FALSE,FALSE,FALSE,FALSE,FALSE,FALSE,FALSE,FALSE,FALSE,FALSE,FALSE,FALSE,FALSE,FALSE,TRUE,FALSE,FALSE,FALSE,FALSE,FALSE,FALSE,FALSE,FALSE,FALSE,FALSE,FALSE,FALSE,1,,TRUE,TRUE,FALSE,FALSE,0,,FALSE,,FALSE,,FALSE,FALSE,FALSE,FALSE,FALSE,FALSE,FALSE,,,,FALSE,FALSE,FALSE,FALSE,FALSE,FALSE,FALSE,FALSE,FALSE,FALSE,,FALSE,FALSE,FALSE,FALSE,FALSE,FALSE,FALSE,FALSE,FALSE,FALSE,FALSE,FALSE,FALSE,FALSE,FALSE,FALSE,FALSE,,FALSE,FALSE,,,FALSE,FALSE,FALSE,FALSE,FALSE,,,SMD,2001-05-15T17:00:16,jhm,2002-10-02T10:24:28
C/EGD/1105,1105,EGD,-1,A/EGD/1093,24/3/1629,2029-03-24T00:00:00,15/4/1629,2029-04-15T00:00:00,,"Schailer,Marion",,,,,,,FALSE,FALSE,FALSE,FALSE,FALSE,FALSE,FALSE,FALSE,FALSE,FALSE,FALSE,FALSE,FALSE,FALSE,FALSE,FALSE,FALSE,TRUE,FALSE,FALSE,FALSE,FALSE,FALSE,FALSE,FALSE,FALSE,FALSE,FALSE,FALSE,FALSE,1,,TRUE,TRUE,FALSE,FALSE,0,,FALSE,,FALSE,,FALSE,FALSE,FALSE,FALSE,FALSE,FALSE,FALSE,,,,FALSE,FALSE,FALSE,FALSE,FALSE,FALSE,FALSE,FALSE,FALSE,FALSE,,FALSE,FALSE,FALSE,FALSE,FALSE,FALSE,FALSE,FALSE,FALSE,FALSE,FALSE,FALSE,FALSE,FALSE,FALSE,FALSE,FALSE,,FALSE,FALSE,,,FALSE,FALSE,FALSE,FALSE,FALSE,,,SMD,2001-05-15T17:00:16,jhm,2002-10-02T10:25:47
C/EGD/1106,1106,EGD,-1,A/EGD/1094,24/3/1629,2029-03-24T00:00:00,15/4/1629,2029-04-15T00:00:00,,"Scot,Jonet",,,,,,,FALSE,FALSE,FALSE,FALSE,FALSE,FALSE,FALSE,FALSE,FALSE,FALSE,FALSE,FALSE,FALSE,FALSE,FALSE,FALSE,FALSE,TRUE,FALSE,FALSE,FALSE,FALSE,FALSE,FALSE,FALSE,FALSE,FALSE,FALSE,FALSE,FALSE,1,,TRUE,TRUE,FALSE,FALSE,0,,FALSE,,FALSE,,FALSE,FALSE,FALSE,FALSE,FALSE,FALSE,FALSE,,,,FALSE,FALSE,FALSE,FALSE,FALSE,FALSE,FALSE,FALSE,FALSE,FALSE,,FALSE,FALSE,FALSE,FALSE,FALSE,FALSE,FALSE,FALSE,FALSE,FALSE,FALSE,FALSE,FALSE,FALSE,FALSE,FALSE,FALSE,,FALSE,FALSE,,,FALSE,FALSE,FALSE,FALSE,FALSE,,,SMD,2001-05-15T17:00:16,jhm,2002-10-02T10:26:52
C/EGD/1107,1107,EGD,-1,A/EGD/1095,24/3/1629,2029-03-24T00:00:00,15/4/1629,2029-04-15T00:00:00,,"Semphill,Margaret",,,,,,,FALSE,FALSE,FALSE,FALSE,FALSE,FALSE,FALSE,FALSE,FALSE,FALSE,FALSE,FALSE,FALSE,FALSE,FALSE,FALSE,FALSE,TRUE,FALSE,FALSE,FALSE,FALSE,FALSE,FALSE,FALSE,FALSE,FALSE,FALSE,FALSE,FALSE,1,,TRUE,TRUE,FALSE,FALSE,0,,FALSE,,FALSE,,FALSE,FALSE,FALSE,FALSE,FALSE,FALSE,FALSE,,,,FALSE,FALSE,FALSE,FALSE,FALSE,FALSE,FALSE,FALSE,FALSE,FALSE,,FALSE,FALSE,FALSE,FALSE,FALSE,FALSE,FALSE,FALSE,FALSE,FALSE,FALSE,FALSE,FALSE,FALSE,FALSE,FALSE,FALSE,,FALSE,FALSE,,,FALSE,FALSE,FALSE,FALSE,FALSE,,,SMD,2001-05-15T17:00:16,jhm,2002-10-02T10:28:04
C/EGD/1108,1108,EGD,-1,A/EGD/1096,24/3/1629,2029-03-24T00:00:00,15/4/1629,2029-04-15T00:00:00,,"Clerksoun,Janet",,,,,,,FALSE,FALSE,FALSE,FALSE,FALSE,FALSE,FALSE,FALSE,FALSE,FALSE,FALSE,FALSE,FALSE,FALSE,FALSE,FALSE,FALSE,TRUE,FALSE,FALSE,FALSE,FALSE,FALSE,FALSE,FALSE,FALSE,FALSE,FALSE,FALSE,FALSE,1,,TRUE,TRUE,FALSE,FALSE,0,,FALSE,,FALSE,,FALSE,FALSE,FALSE,FALSE,FALSE,FALSE,FALSE,,,,FALSE,FALSE,FALSE,FALSE,FALSE,FALSE,FALSE,FALSE,FALSE,FALSE,,FALSE,FALSE,FALSE,FALSE,FALSE,FALSE,FALSE,FALSE,FALSE,FALSE,FALSE,FALSE,FALSE,FALSE,FALSE,FALSE,FALSE,,FALSE,FALSE,,,FALSE,FALSE,FALSE,FALSE,FALSE,,,SMD,2001-05-15T17:00:16,jhm,2002-10-02T10:29:12
C/EGD/1109,1109,EGD,-1,A/EGD/1097,24/3/1629,2029-03-24T00:00:00,1/8/1629,2029-08-01T00:00:00,,"Greinscheills,John",,,,,,,FALSE,FALSE,FALSE,FALSE,FALSE,FALSE,FALSE,FALSE,FALSE,FALSE,FALSE,FALSE,FALSE,FALSE,FALSE,FALSE,FALSE,TRUE,FALSE,FALSE,FALSE,FALSE,FALSE,FALSE,FALSE,FALSE,FALSE,FALSE,FALSE,FALSE,1,,TRUE,TRUE,FALSE,FALSE,0,,FALSE,,FALSE,,FALSE,FALSE,FALSE,FALSE,FALSE,FALSE,FALSE,,,,FALSE,FALSE,FALSE,FALSE,FALSE,FALSE,FALSE,FALSE,FALSE,FALSE,,FALSE,FALSE,FALSE,FALSE,FALSE,FALSE,FALSE,FALSE,FALSE,FALSE,FALSE,FALSE,FALSE,FALSE,FALSE,FALSE,FALSE,,FALSE,FALSE,,,FALSE,FALSE,FALSE,FALSE,FALSE,,,SMD,2001-05-15T17:00:16,jhm,2002-10-02T10:30:31
C/EGD/111,111,EGD,-1,A/EGD/100,1591,1991-06-01T00:00:00,1591,1991-06-01T00:00:00,,"Cockburn,Thom",,,,,,,FALSE,FALSE,FALSE,FALSE,FALSE,FALSE,FALSE,FALSE,FALSE,FALSE,FALSE,FALSE,FALSE,FALSE,FALSE,FALSE,FALSE,TRUE,FALSE,FALSE,FALSE,FALSE,FALSE,FALSE,FALSE,FALSE,FALSE,FALSE,FALSE,FALSE,1,,TRUE,TRUE,FALSE,FALSE,0,,FALSE,,FALSE,,FALSE,FALSE,FALSE,FALSE,FALSE,FALSE,FALSE,,,,FALSE,FALSE,FALSE,FALSE,FALSE,FALSE,FALSE,FALSE,FALSE,FALSE,,FALSE,FALSE,FALSE,FALSE,FALSE,FALSE,FALSE,FALSE,FALSE,FALSE,FALSE,FALSE,FALSE,FALSE,FALSE,FALSE,FALSE,,FALSE,FALSE,,,FALSE,FALSE,FALSE,FALSE,FALSE,,,SMD,2001-05-15T17:00:16,jhm,2002-10-02T10:32:51
C/EGD/1110,1110,EGD,-1,A/EGD/1098,24/3/1629,2029-03-24T00:00:00,1/8/1629,2029-08-01T00:00:00,,"Fischer,Margrat",,,,,,,FALSE,FALSE,FALSE,FALSE,FALSE,FALSE,FALSE,FALSE,FALSE,FALSE,FALSE,FALSE,FALSE,FALSE,FALSE,FALSE,FALSE,TRUE,FALSE,FALSE,FALSE,FALSE,FALSE,FALSE,FALSE,FALSE,FALSE,FALSE,FALSE,FALSE,1,,TRUE,TRUE,FALSE,FALSE,0,,FALSE,,FALSE,,FALSE,FALSE,FALSE,FALSE,FALSE,FALSE,FALSE,,,,FALSE,FALSE,FALSE,FALSE,FALSE,FALSE,FALSE,FALSE,FALSE,FALSE,,FALSE,FALSE,FALSE,FALSE,FALSE,FALSE,FALSE,FALSE,FALSE,FALSE,FALSE,FALSE,FALSE,FALSE,FALSE,FALSE,FALSE,,FALSE,FALSE,,,FALSE,FALSE,FALSE,FALSE,FALSE,,,SMD,2001-05-15T17:00:16,jhm,2002-10-02T10:36:49
C/EGD/1111,1111,EGD,-1,A/EGD/1099,24/3/1629,2029-03-24T00:00:00,15/4/1629,2029-04-15T00:00:00,,"Crichtoun,Beatrix",,,,,,,FALSE,FALSE,FALSE,FALSE,FALSE,FALSE,FALSE,FALSE,FALSE,FALSE,FALSE,FALSE,FALSE,FALSE,FALSE,FALSE,FALSE,TRUE,FALSE,FALSE,FALSE,FALSE,FALSE,FALSE,FALSE,FALSE,FALSE,FALSE,FALSE,FALSE,1,,TRUE,TRUE,FALSE,FALSE,0,,FALSE,,FALSE,,FALSE,FALSE,FALSE,FALSE,FALSE,FALSE,FALSE,,,,FALSE,FALSE,FALSE,FALSE,FALSE,FALSE,FALSE,FALSE,FALSE,FALSE,,FALSE,FALSE,FALSE,FALSE,FALSE,FALSE,FALSE,FALSE,FALSE,FALSE,FALSE,FALSE,FALSE,FALSE,FALSE,FALSE,FALSE,,FALSE,FALSE,,,FALSE,FALSE,FALSE,FALSE,FALSE,,,SMD,2001-05-15T17:00:16,jhm,2002-10-02T10:38:50
C/EGD/1112,1112,EGD,-1,A/EGD/1100,24/3/1629,2029-03-24T00:00:00,1/8/1629,2029-08-01T00:00:00,,"Quhyte,Isobel",,,,,,,FALSE,FALSE,FALSE,FALSE,FALSE,FALSE,FALSE,FALSE,FALSE,FALSE,FALSE,FALSE,FALSE,FALSE,FALSE,FALSE,FALSE,TRUE,FALSE,FALSE,FALSE,FALSE,FALSE,FALSE,FALSE,FALSE,FALSE,FALSE,FALSE,FALSE,1,,TRUE,TRUE,FALSE,FALSE,0,,FALSE,,FALSE,,FALSE,FALSE,FALSE,FALSE,FALSE,FALSE,FALSE,,,,FALSE,FALSE,FALSE,FALSE,FALSE,FALSE,FALSE,FALSE,FALSE,FALSE,,FALSE,FALSE,FALSE,FALSE,FALSE,FALSE,FALSE,FALSE,FALSE,FALSE,FALSE,FALSE,FALSE,FALSE,FALSE,FALSE,FALSE,,FALSE,FALSE,,,FALSE,FALSE,FALSE,FALSE,FALSE,,,SMD,2001-05-15T17:00:16,jhm,2002-10-02T10:39:50
C/EGD/1113,1113,EGD,-1,A/EGD/1101,24/3/1629,2029-03-24T00:00:00,1/8/1629,2029-08-01T00:00:00,,"Adam,Agnes",,,,,,,FALSE,FALSE,FALSE,FALSE,FALSE,FALSE,FALSE,FALSE,FALSE,FALSE,FALSE,FALSE,FALSE,FALSE,FALSE,FALSE,FALSE,TRUE,FALSE,FALSE,FALSE,FALSE,FALSE,FALSE,FALSE,FALSE,FALSE,FALSE,FALSE,FALSE,1,,TRUE,TRUE,FALSE,FALSE,0,,FALSE,,FALSE,,FALSE,FALSE,FALSE,FALSE,FALSE,FALSE,FALSE,,,,FALSE,FALSE,FALSE,FALSE,FALSE,FALSE,FALSE,FALSE,FALSE,FALSE,,FALSE,FALSE,FALSE,FALSE,FALSE,FALSE,FALSE,FALSE,FALSE,FALSE,FALSE,FALSE,FALSE,FALSE,FALSE,FALSE,FALSE,,FALSE,FALSE,,,FALSE,FALSE,FALSE,FALSE,FALSE,,,SMD,2001-05-15T17:00:16,jhm,2002-10-02T10:41:02
C/EGD/1114,1114,EGD,-1,A/EGD/1102,24/3/1629,2029-03-24T00:00:00,15/4/1629,2029-04-15T00:00:00,,"Simsoun,Helene",,,,,,,FALSE,FALSE,FALSE,FALSE,FALSE,FALSE,FALSE,FALSE,FALSE,FALSE,FALSE,FALSE,FALSE,FALSE,FALSE,FALSE,FALSE,TRUE,FALSE,FALSE,FALSE,FALSE,FALSE,FALSE,FALSE,FALSE,FALSE,FALSE,FALSE,FALSE,1,,TRUE,TRUE,FALSE,FALSE,0,,FALSE,,FALSE,,FALSE,FALSE,FALSE,FALSE,FALSE,FALSE,FALSE,,,,FALSE,FALSE,FALSE,FALSE,FALSE,FALSE,FALSE,FALSE,FALSE,FALSE,,FALSE,FALSE,FALSE,FALSE,FALSE,FALSE,FALSE,FALSE,FALSE,FALSE,FALSE,FALSE,FALSE,FALSE,FALSE,FALSE,FALSE,,FALSE,FALSE,,,FALSE,FALSE,FALSE,FALSE,FALSE,,,SMD,2001-05-15T17:00:16,jhm,2002-10-02T10:41:59
C/EGD/1115,1115,EGD,-1,A/EGD/1103,2/6/1629,2029-06-02T00:00:00,12/7/1629,2029-07-12T00:00:00,,"Pursell,Janet",,,,,,,FALSE,FALSE,FALSE,FALSE,FALSE,FALSE,FALSE,FALSE,FALSE,FALSE,FALSE,FALSE,FALSE,FALSE,FALSE,FALSE,FALSE,FALSE,FALSE,FALSE,FALSE,FALSE,FALSE,FALSE,FALSE,FALSE,FALSE,FALSE,FALSE,FALSE,0,,TRUE,TRUE,FALSE,FALSE,0,,FALSE,,FALSE,,FALSE,FALSE,FALSE,FALSE,FALSE,FALSE,FALSE,,,,FALSE,FALSE,FALSE,FALSE,FALSE,FALSE,FALSE,FALSE,FALSE,FALSE,,FALSE,FALSE,FALSE,FALSE,FALSE,FALSE,FALSE,FALSE,FALSE,FALSE,FALSE,FALSE,FALSE,FALSE,FALSE,FALSE,FALSE,,FALSE,FALSE,,,FALSE,FALSE,FALSE,FALSE,FALSE,,listed with 2 others.,SMD,2001-05-15T17:00:16,jhm,2002-10-02T10:43:17
C/EGD/1116,1116,EGD,-1,A/EGD/1104,2/6/1629,2029-06-02T00:00:00,12/7/1629,2029-07-12T00:00:00,,"Scherar,Janet",,,,,,,FALSE,FALSE,FALSE,FALSE,FALSE,FALSE,FALSE,FALSE,FALSE,FALSE,FALSE,FALSE,FALSE,FALSE,FALSE,FALSE,FALSE,FALSE,FALSE,FALSE,FALSE,FALSE,FALSE,FALSE,FALSE,FALSE,FALSE,FALSE,FALSE,FALSE,0,,TRUE,TRUE,FALSE,FALSE,0,,FALSE,,FALSE,,FALSE,FALSE,FALSE,FALSE,FALSE,FALSE,FALSE,,,,FALSE,FALSE,FALSE,FALSE,FALSE,FALSE,FALSE,FALSE,FALSE,FALSE,,FALSE,FALSE,FALSE,FALSE,FALSE,FALSE,FALSE,FALSE,FALSE,FALSE,FALSE,FALSE,FALSE,FALSE,FALSE,FALSE,FALSE,,FALSE,FALSE,,,FALSE,FALSE,FALSE,FALSE,FALSE,,Listed with 2 others.,SMD,2001-05-15T17:00:16,jhm,2002-10-02T10:44:56
C/EGD/1117,1117,EGD,-1,A/EGD/1105,2/6/1629,2029-06-02T00:00:00,12/7/1629,2029-07-12T00:00:00,,"Hill,Janet",,,,,,,FALSE,FALSE,FALSE,FALSE,FALSE,FALSE,FALSE,FALSE,FALSE,FALSE,FALSE,FALSE,FALSE,FALSE,FALSE,FALSE,FALSE,FALSE,FALSE,FALSE,FALSE,FALSE,FALSE,FALSE,FALSE,FALSE,FALSE,FALSE,FALSE,FALSE,0,,TRUE,TRUE,FALSE,FALSE,0,,FALSE,,FALSE,,FALSE,FALSE,FALSE,FALSE,FALSE,FALSE,FALSE,,,,FALSE,FALSE,FALSE,FALSE,FALSE,FALSE,FALSE,FALSE,FALSE,FALSE,,FALSE,FALSE,FALSE,FALSE,FALSE,FALSE,FALSE,FALSE,FALSE,FALSE,FALSE,FALSE,FALSE,FALSE,FALSE,FALSE,FALSE,,FALSE,FALSE,,,FALSE,FALSE,FALSE,FALSE,FALSE,,Listed with 2 others.,SMD,2001-05-15T17:00:16,jhm,2002-10-02T10:46:15
C/EGD/1118,1118,EGD,-1,A/EGD/1106,1/8/1629,2029-08-01T00:00:00,1/8/1629,2029-08-01T00:00:00,,"Scott,Helen",,,,,,,FALSE,FALSE,FALSE,FALSE,FALSE,FALSE,FALSE,FALSE,FALSE,FALSE,FALSE,FALSE,FALSE,FALSE,FALSE,FALSE,FALSE,FALSE,FALSE,FALSE,FALSE,FALSE,FALSE,FALSE,FALSE,FALSE,FALSE,FALSE,FALSE,FALSE,0,,TRUE,TRUE,FALSE,FALSE,0,,FALSE,,FALSE,,FALSE,FALSE,FALSE,FALSE,FALSE,FALSE,FALSE,,,,FALSE,FALSE,FALSE,FALSE,FALSE,FALSE,FALSE,FALSE,FALSE,FALSE,,FALSE,FALSE,FALSE,FALSE,FALSE,FALSE,FALSE,FALSE,FALSE,FALSE,FALSE,FALSE,FALSE,FALSE,FALSE,FALSE,FALSE,,FALSE,FALSE,,,FALSE,FALSE,FALSE,FALSE,FALSE,,,SMD,2001-05-15T17:00:16,jhm,2002-10-02T10:47:42
C/EGD/1119,1119,EGD,-1,A/EGD/1107,1/8/1629,2029-08-01T00:00:00,1/8/1629,2029-08-01T00:00:00,,"Gastoun,Helene",,,,,,,FALSE,FALSE,FALSE,FALSE,FALSE,FALSE,FALSE,FALSE,FALSE,FALSE,FALSE,FALSE,FALSE,FALSE,FALSE,FALSE,FALSE,FALSE,FALSE,FALSE,FALSE,FALSE,FALSE,FALSE,FALSE,FALSE,FALSE,FALSE,FALSE,FALSE,0,,TRUE,TRUE,FALSE,FALSE,0,,FALSE,,FALSE,,FALSE,FALSE,FALSE,FALSE,FALSE,FALSE,FALSE,,,,FALSE,FALSE,FALSE,FALSE,FALSE,FALSE,FALSE,FALSE,FALSE,FALSE,,FALSE,FALSE,FALSE,FALSE,FALSE,FALSE,FALSE,FALSE,FALSE,FALSE,FALSE,FALSE,FALSE,FALSE,FALSE,FALSE,FALSE,,FALSE,FALSE,,,FALSE,FALSE,FALSE,FALSE,FALSE,,,SMD,2001-05-15T17:00:16,jhm,2002-10-02T11:37:14
C/EGD/1120,1120,EGD,-1,A/EGD/1108,1/8/1629,2029-08-01T00:00:00,1/8/1629,2029-08-01T00:00:00,,"Patersoun,Margaret",,,,,,,FALSE,FALSE,FALSE,FALSE,FALSE,FALSE,FALSE,FALSE,FALSE,FALSE,FALSE,FALSE,FALSE,FALSE,FALSE,FALSE,FALSE,FALSE,FALSE,FALSE,FALSE,FALSE,FALSE,FALSE,FALSE,FALSE,FALSE,FALSE,FALSE,FALSE,0,,TRUE,TRUE,FALSE,FALSE,0,,FALSE,,FALSE,,FALSE,FALSE,FALSE,FALSE,FALSE,FALSE,FALSE,,,,FALSE,FALSE,FALSE,FALSE,FALSE,FALSE,FALSE,FALSE,FALSE,FALSE,,FALSE,FALSE,FALSE,FALSE,FALSE,FALSE,FALSE,FALSE,FALSE,FALSE,FALSE,FALSE,FALSE,FALSE,FALSE,FALSE,FALSE,,FALSE,FALSE,,,FALSE,FALSE,FALSE,FALSE,FALSE,,,SMD,2001-05-15T17:00:16,jhm,2002-10-02T10:49:22
C/EGD/1121,1121,EGD,-1,A/EGD/1109,1/8/1629,2029-08-01T00:00:00,1/8/1629,2029-08-01T00:00:00,,"Strudgeoun,Margaret",,,,,,,FALSE,FALSE,FALSE,FALSE,FALSE,FALSE,FALSE,FALSE,FALSE,FALSE,FALSE,FALSE,FALSE,FALSE,FALSE,FALSE,FALSE,FALSE,FALSE,FALSE,FALSE,FALSE,FALSE,FALSE,FALSE,FALSE,FALSE,FALSE,FALSE,FALSE,0,,TRUE,TRUE,FALSE,FALSE,0,,FALSE,,FALSE,,FALSE,FALSE,FALSE,FALSE,FALSE,FALSE,FALSE,,,,FALSE,FALSE,FALSE,FALSE,FALSE,FALSE,FALSE,FALSE,FALSE,FALSE,,FALSE,FALSE,FALSE,FALSE,FALSE,FALSE,FALSE,FALSE,FALSE,FALSE,FALSE,FALSE,FALSE,FALSE,FALSE,FALSE,FALSE,,FALSE,FALSE,,,FALSE,FALSE,FALSE,FALSE,FALSE,,,SMD,2001-05-15T17:00:16,jhm,2002-10-02T10:50:55
C/EGD/1122,1122,EGD,-1,A/EGD/1110,1/8/1629,2029-08-01T00:00:00,1/8/1629,2029-08-01T00:00:00,,"Carfa,Bessie",,,,,,,FALSE,FALSE,FALSE,FALSE,FALSE,FALSE,FALSE,FALSE,FALSE,FALSE,FALSE,FALSE,FALSE,TRUE,FALSE,FALSE,FALSE,FALSE,FALSE,FALSE,FALSE,FALSE,FALSE,FALSE,FALSE,FALSE,FALSE,FALSE,FALSE,FALSE,1,,TRUE,TRUE,FALSE,FALSE,0,,FALSE,,FALSE,,FALSE,FALSE,FALSE,FALSE,FALSE,FALSE,FALSE,,,,FALSE,FALSE,FALSE,FALSE,FALSE,FALSE,FALSE,FALSE,FALSE,FALSE,,FALSE,TRUE,FALSE,FALSE,FALSE,FALSE,FALSE,FALSE,FALSE,FALSE,FALSE,FALSE,FALSE,FALSE,FALSE,FALSE,FALSE,,FALSE,FALSE,,,FALSE,FALSE,FALSE,FALSE,FALSE,,,SMD,2001-05-15T17:00:16,jhm,2002-10-02T11:22:43
C/EGD/1123,1123,EGD,-1,A/EGD/1111,1/8/1629,2029-08-01T00:00:00,1/8/1629,2029-08-01T00:00:00,,"Carfra,Thomas",,,,,,,FALSE,FALSE,FALSE,TRUE,FALSE,FALSE,FALSE,FALSE,FALSE,FALSE,FALSE,FALSE,FALSE,FALSE,FALSE,FALSE,FALSE,FALSE,FALSE,FALSE,FALSE,FALSE,FALSE,FALSE,FALSE,FALSE,FALSE,FALSE,FALSE,FALSE,1,,TRUE,TRUE,FALSE,FALSE,0,,FALSE,,FALSE,,FALSE,FALSE,FALSE,FALSE,FALSE,FALSE,FALSE,,,,FALSE,FALSE,FALSE,FALSE,FALSE,FALSE,FALSE,FALSE,FALSE,FALSE,,FALSE,FALSE,FALSE,FALSE,FALSE,FALSE,FALSE,FALSE,FALSE,FALSE,FALSE,FALSE,FALSE,FALSE,FALSE,FALSE,FALSE,,FALSE,FALSE,,,FALSE,FALSE,FALSE,FALSE,FALSE,,,SMD,2001-05-15T17:00:16,jhm,2002-10-02T11:24:15
C/EGD/1124,1124,EGD,-1,A/EGD/1112,1/8/1629,2029-08-01T00:00:00,1/8/1629,2029-08-01T00:00:00,,"Borthuick,Alison",,,,,,,FALSE,FALSE,FALSE,TRUE,FALSE,FALSE,FALSE,FALSE,FALSE,FALSE,FALSE,FALSE,FALSE,FALSE,FALSE,FALSE,FALSE,FALSE,FALSE,FALSE,FALSE,FALSE,FALSE,FALSE,FALSE,FALSE,FALSE,FALSE,FALSE,FALSE,1,,TRUE,TRUE,FALSE,FALSE,0,,FALSE,,FALSE,,FALSE,FALSE,FALSE,FALSE,FALSE,FALSE,FALSE,,,,FALSE,FALSE,FALSE,FALSE,FALSE,FALSE,FALSE,FALSE,FALSE,FALSE,,FALSE,FALSE,FALSE,FALSE,FALSE,FALSE,FALSE,FALSE,FALSE,FALSE,FALSE,FALSE,FALSE,FALSE,FALSE,FALSE,FALSE,,FALSE,FALSE,,,FALSE,FALSE,FALSE,FALSE,FALSE,,,SMD,2001-05-15T17:00:16,jhm,2002-10-02T11:24:57
C/EGD/1125,1125,EGD,-1,A/EGD/1113,1/8/1629,2029-08-01T00:00:00,1/8/1629,2029-08-01T00:00:00,,"Carfa,John",,,,,,,FALSE,FALSE,FALSE,TRUE,FALSE,FALSE,FALSE,FALSE,FALSE,FALSE,FALSE,FALSE,FALSE,FALSE,FALSE,FALSE,FALSE,FALSE,FALSE,FALSE,FALSE,FALSE,FALSE,FALSE,FALSE,FALSE,FALSE,FALSE,FALSE,FALSE,1,,TRUE,TRUE,FALSE,FALSE,0,,FALSE,,FALSE,,FALSE,FALSE,FALSE,FALSE,FALSE,FALSE,FALSE,,,,FALSE,FALSE,FALSE,FALSE,FALSE,FALSE,FALSE,FALSE,FALSE,FALSE,,FALSE,FALSE,FALSE,FALSE,FALSE,FALSE,FALSE,FALSE,FALSE,FALSE,FALSE,FALSE,FALSE,FALSE,FALSE,FALSE,FALSE,,FALSE,FALSE,,,FALSE,FALSE,FALSE,FALSE,FALSE,,,SMD,2001-05-15T17:00:16,jhm,2002-10-02T11:26:25
C/EGD/1126,1126,EGD,-1,A/EGD/1114,21/8/1629,2029-08-21T00:00:00,21/8/1629,2029-08-21T00:00:00,,"Wallace,Beigs",,,,,,,FALSE,FALSE,FALSE,FALSE,FALSE,FALSE,FALSE,FALSE,FALSE,FALSE,FALSE,FALSE,FALSE,FALSE,FALSE,FALSE,FALSE,TRUE,FALSE,FALSE,FALSE,FALSE,FALSE,FALSE,FALSE,FALSE,FALSE,FALSE,FALSE,FALSE,1,,TRUE,TRUE,FALSE,FALSE,0,,FALSE,,FALSE,,FALSE,FALSE,FALSE,FALSE,FALSE,FALSE,FALSE,,,,FALSE,FALSE,FALSE,FALSE,FALSE,FALSE,FALSE,FALSE,FALSE,FALSE,,FALSE,FALSE,FALSE,FALSE,FALSE,FALSE,FALSE,FALSE,FALSE,FALSE,FALSE,FALSE,FALSE,FALSE,FALSE,FALSE,FALSE,,FALSE,FALSE,,,FALSE,FALSE,FALSE,FALSE,FALSE,,,SMD,2001-05-15T17:00:16,LEM,2002-10-10T14:25:37
C/EGD/1127,1127,EGD,-1,A/EGD/1115,21/8/1629,2029-08-21T00:00:00,21/8/1629,2029-08-21T00:00:00,,"Mathesoun,Margaret",,,,,,,FALSE,FALSE,FALSE,FALSE,FALSE,FALSE,FALSE,FALSE,FALSE,FALSE,FALSE,FALSE,FALSE,FALSE,FALSE,FALSE,FALSE,TRUE,FALSE,FALSE,FALSE,FALSE,FALSE,FALSE,FALSE,FALSE,FALSE,FALSE,FALSE,FALSE,1,,TRUE,TRUE,FALSE,FALSE,0,,FALSE,,FALSE,,FALSE,FALSE,FALSE,FALSE,FALSE,FALSE,FALSE,,,,FALSE,FALSE,FALSE,FALSE,FALSE,FALSE,FALSE,FALSE,FALSE,FALSE,,FALSE,FALSE,FALSE,FALSE,FALSE,FALSE,FALSE,FALSE,FALSE,FALSE,FALSE,FALSE,FALSE,FALSE,FALSE,FALSE,FALSE,,FALSE,FALSE,,,FALSE,FALSE,FALSE,FALSE,FALSE,,She was mentioned by Wallace's daughter in 1649.,SMD,2001-05-15T17:00:16,LEM,2002-10-10T14:27:35
C/EGD/1128,1128,EGD,-1,A/EGD/1116,5/9/1629,2029-09-05T00:00:00,17/9/1629,2029-09-17T00:00:00,,"Thomesoun,Christian",,,,,,,FALSE,FALSE,FALSE,FALSE,FALSE,FALSE,FALSE,FALSE,FALSE,FALSE,FALSE,FALSE,FALSE,FALSE,FALSE,FALSE,FALSE,FALSE,FALSE,FALSE,FALSE,FALSE,FALSE,FALSE,FALSE,FALSE,FALSE,FALSE,FALSE,FALSE,0,,TRUE,TRUE,FALSE,FALSE,0,,FALSE,,FALSE,,FALSE,FALSE,FALSE,FALSE,FALSE,FALSE,FALSE,,,,FALSE,FALSE,FALSE,FALSE,FALSE,FALSE,FALSE,FALSE,FALSE,FALSE,,FALSE,FALSE,FALSE,FALSE,FALSE,FALSE,FALSE,FALSE,FALSE,FALSE,FALSE,FALSE,FALSE,FALSE,FALSE,FALSE,FALSE,,FALSE,FALSE,,,FALSE,FALSE,FALSE,FALSE,FALSE,,Listed with 2 others.,SMD,2001-05-15T17:00:16,jhm,2002-10-02T11:39:19
C/EGD/1129,1129,EGD,-1,A/EGD/1117,5/9/1629,2029-09-05T00:00:00,17/9/1629,2029-09-17T00:00:00,,"Small,Margaret",,,,,,,FALSE,FALSE,FALSE,FALSE,FALSE,FALSE,FALSE,FALSE,FALSE,FALSE,FALSE,FALSE,FALSE,FALSE,FALSE,FALSE,FALSE,FALSE,FALSE,FALSE,FALSE,FALSE,FALSE,FALSE,FALSE,FALSE,FALSE,FALSE,FALSE,FALSE,0,,TRUE,TRUE,FALSE,FALSE,0,,FALSE,,FALSE,,FALSE,FALSE,FALSE,FALSE,FALSE,FALSE,FALSE,,,,FALSE,FALSE,FALSE,FALSE,FALSE,FALSE,FALSE,FALSE,FALSE,FALSE,,FALSE,FALSE,FALSE,FALSE,FALSE,FALSE,FALSE,FALSE,FALSE,FALSE,FALSE,FALSE,FALSE,FALSE,FALSE,FALSE,FALSE,,FALSE,FALSE,,,FALSE,FALSE,FALSE,FALSE,FALSE,,Listed with 2 others.,SMD,2001-05-15T17:00:16,jhm,2002-10-02T11:40:21
C/EGD/113,113,EGD,-1,A/EGD/102,6/3/1591,1991-03-06T00:00:00,24/5/1591,1991-05-24T00:00:00,,"Chirneyside,Niniane",,,,,,,FALSE,FALSE,FALSE,FALSE,FALSE,FALSE,FALSE,FALSE,FALSE,FALSE,FALSE,FALSE,FALSE,FALSE,FALSE,FALSE,FALSE,FALSE,FALSE,FALSE,FALSE,FALSE,FALSE,FALSE,FALSE,FALSE,FALSE,FALSE,FALSE,FALSE,0,,TRUE,TRUE,FALSE,FALSE,0,He and his servant unknown Nesbitt were denounced as rebels for failing to appear at a hearing regarding their treason and witchcraft charges.,FALSE,,FALSE,,FALSE,FALSE,FALSE,FALSE,FALSE,FALSE,FALSE,,,,FALSE,FALSE,FALSE,FALSE,FALSE,FALSE,FALSE,FALSE,FALSE,FALSE,,FALSE,FALSE,FALSE,FALSE,FALSE,FALSE,FALSE,FALSE,FALSE,FALSE,FALSE,FALSE,FALSE,FALSE,FALSE,FALSE,FALSE,,FALSE,FALSE,,,FALSE,FALSE,FALSE,FALSE,FALSE,,"No trial process, he and his servant, unknown Nesbitt, failed to appear personally before king James VI at Holyrood palace on 6 March 1591 to answer charges of witchcraft and treason.",SMD,2001-05-15T17:00:16,jhm,2002-10-02T11:41:54
C/EGD/1130,1130,EGD,-1,A/EGD/1118,5/9/1629,2029-09-05T00:00:00,17/9/1629,2029-09-17T00:00:00,,"Dryburgh,Isabel",,,,,,,FALSE,FALSE,FALSE,FALSE,FALSE,FALSE,FALSE,FALSE,FALSE,FALSE,FALSE,FALSE,FALSE,FALSE,FALSE,FALSE,FALSE,FALSE,FALSE,FALSE,FALSE,FALSE,FALSE,FALSE,FALSE,FALSE,FALSE,FALSE,FALSE,FALSE,0,,TRUE,TRUE,FALSE,FALSE,0,,FALSE,,FALSE,,FALSE,FALSE,FALSE,FALSE,FALSE,FALSE,FALSE,,,,FALSE,FALSE,FALSE,FALSE,FALSE,FALSE,FALSE,FALSE,FALSE,FALSE,,FALSE,FALSE,FALSE,FALSE,FALSE,FALSE,FALSE,FALSE,FALSE,FALSE,FALSE,FALSE,FALSE,FALSE,FALSE,FALSE,FALSE,,FALSE,FALSE,,,FALSE,FALSE,FALSE,FALSE,FALSE,,Listed with 2 others.,SMD,2001-05-15T17:00:16,jhm,2002-10-02T11:43:12
C/EGD/1131,1131,EGD,-1,A/EGD/1119,5/9/1629,2029-09-05T00:00:00,5/9/1629,2029-09-05T00:00:00,,"Aitkine,Bessie",,,,,,,FALSE,FALSE,FALSE,FALSE,FALSE,FALSE,FALSE,FALSE,FALSE,FALSE,FALSE,FALSE,FALSE,FALSE,FALSE,FALSE,FALSE,FALSE,FALSE,FALSE,FALSE,FALSE,FALSE,FALSE,FALSE,FALSE,FALSE,FALSE,FALSE,FALSE,0,,TRUE,TRUE,FALSE,FALSE,0,,FALSE,,FALSE,,FALSE,FALSE,FALSE,FALSE,FALSE,FALSE,FALSE,,,,FALSE,FALSE,FALSE,FALSE,FALSE,FALSE,FALSE,FALSE,FALSE,FALSE,,FALSE,FALSE,FALSE,FALSE,FALSE,FALSE,FALSE,FALSE,FALSE,FALSE,FALSE,FALSE,FALSE,FALSE,FALSE,FALSE,FALSE,,FALSE,FALSE,,,FALSE,FALSE,FALSE,FALSE,FALSE,,,SMD,2001-05-15T17:00:16,jhm,2002-10-02T11:44:25
C/EGD/1132,1132,EGD,-1,A/EGD/1120,5/9/1629,2029-09-05T00:00:00,5/9/1629,2029-09-05T00:00:00,,"Nisbett,David",,,,,,,FALSE,FALSE,FALSE,FALSE,FALSE,FALSE,FALSE,FALSE,FALSE,FALSE,FALSE,FALSE,FALSE,FALSE,FALSE,FALSE,FALSE,FALSE,FALSE,FALSE,FALSE,FALSE,FALSE,FALSE,FALSE,FALSE,FALSE,FALSE,FALSE,FALSE,0,,TRUE,TRUE,FALSE,FALSE,0,,FALSE,,FALSE,,FALSE,FALSE,FALSE,FALSE,FALSE,FALSE,FALSE,,,,FALSE,FALSE,FALSE,FALSE,FALSE,FALSE,FALSE,FALSE,FALSE,FALSE,,FALSE,FALSE,FALSE,FALSE,FALSE,FALSE,FALSE,FALSE,FALSE,FALSE,FALSE,FALSE,FALSE,FALSE,FALSE,FALSE,FALSE,,FALSE,FALSE,,,FALSE,FALSE,FALSE,FALSE,FALSE,,,SMD,2001-05-15T17:00:16,jhm,2002-10-02T11:45:27
C/EGD/1133,1133,EGD,-1,A/EGD/1121,16/7/1629,2029-07-16T00:00:00,5/9/1629,2029-09-05T00:00:00,,"Liddel,Janet",,,,,,,FALSE,FALSE,FALSE,FALSE,FALSE,FALSE,FALSE,FALSE,FALSE,FALSE,FALSE,FALSE,FALSE,FALSE,FALSE,FALSE,FALSE,TRUE,FALSE,FALSE,FALSE,FALSE,FALSE,FALSE,FALSE,FALSE,FALSE,FALSE,FALSE,FALSE,1,,TRUE,TRUE,FALSE,FALSE,0,Implicated by Margaret Loche (c/egd/674)  and Jonet Wilson (c/la/3019) who were implicated by Alexander Hammilton (c/egd/166).,FALSE,,FALSE,,FALSE,FALSE,FALSE,FALSE,FALSE,FALSE,FALSE,,,Accused of being at two meetings (at the shore at Eyemouth and in a yard) by another accused witch.,FALSE,FALSE,FALSE,FALSE,FALSE,FALSE,FALSE,FALSE,FALSE,FALSE,,FALSE,FALSE,FALSE,FALSE,FALSE,FALSE,FALSE,FALSE,FALSE,FALSE,FALSE,FALSE,FALSE,FALSE,FALSE,FALSE,FALSE,,FALSE,FALSE,Claimed by other confessing witches that she burned down the Mill; destroyed ships during a herring drove,,FALSE,FALSE,FALSE,FALSE,FALSE,,,SMD,2001-05-15T17:00:16,LEM,2002-10-10T14:15:53
C/EGD/1135,1135,EGD,-1,A/EGD/1123,16/7/1629,2029-07-16T00:00:00,5/9/1629,2029-09-05T00:00:00,,"Falconer,Agnes",,,,,,,FALSE,FALSE,FALSE,FALSE,FALSE,FALSE,FALSE,FALSE,FALSE,FALSE,FALSE,FALSE,FALSE,FALSE,FALSE,FALSE,FALSE,TRUE,FALSE,FALSE,FALSE,FALSE,FALSE,FALSE,FALSE,FALSE,FALSE,FALSE,FALSE,FALSE,1,,TRUE,TRUE,FALSE,FALSE,0,Implicated by Margaret Loche (c/egd/674)  and Jonet Wilson (c/la/3019) who were implicated by Alexander Hammilton (c/egd/166).,FALSE,,FALSE,,FALSE,FALSE,FALSE,FALSE,FALSE,FALSE,FALSE,,,Accused of being at two meetings (at the shore at Eyemouth and at a yard) by another accused witch.,FALSE,FALSE,FALSE,FALSE,FALSE,FALSE,FALSE,FALSE,FALSE,FALSE,,FALSE,FALSE,FALSE,FALSE,FALSE,FALSE,FALSE,FALSE,FALSE,FALSE,FALSE,FALSE,FALSE,FALSE,FALSE,FALSE,FALSE,,FALSE,FALSE,Claimed by another confessing witch that she burned down a mill; destroyed ships during a herring drove,,FALSE,FALSE,FALSE,FALSE,FALSE,,,SMD,2001-05-15T17:00:16,LEM,2002-10-10T14:17:25
C/EGD/1136,1136,EGD,-1,A/EGD/1124,3/11/1629,2029-11-03T00:00:00,3/2/1630,2030-02-03T00:00:00,,"Alexander,Margaret",,,,,,,FALSE,FALSE,FALSE,FALSE,FALSE,FALSE,FALSE,FALSE,FALSE,FALSE,FALSE,FALSE,FALSE,FALSE,FALSE,FALSE,FALSE,TRUE,FALSE,FALSE,FALSE,FALSE,FALSE,FALSE,FALSE,FALSE,FALSE,FALSE,FALSE,FALSE,1,,TRUE,TRUE,FALSE,FALSE,0,Not enough information recorded apart from accusation by Alexander Hamilton.,FALSE,,FALSE,,FALSE,FALSE,FALSE,FALSE,FALSE,FALSE,FALSE,,,,FALSE,FALSE,FALSE,FALSE,FALSE,FALSE,FALSE,FALSE,FALSE,FALSE,,FALSE,FALSE,FALSE,FALSE,FALSE,FALSE,FALSE,FALSE,FALSE,FALSE,FALSE,FALSE,FALSE,FALSE,FALSE,FALSE,FALSE,,FALSE,FALSE,,,FALSE,FALSE,FALSE,FALSE,FALSE,,,SMD,2001-05-15T17:00:16,jhm,2002-10-02T12:01:17
C/EGD/1137,1137,EGD,-1,A/EGD/1125,3/11/1629,2029-11-03T00:00:00,1/4/1630,2030-04-01T00:00:00,,"Sinclare,Agnes",,,,,,,FALSE,FALSE,FALSE,FALSE,FALSE,FALSE,FALSE,FALSE,FALSE,FALSE,FALSE,FALSE,FALSE,FALSE,FALSE,FALSE,FALSE,TRUE,FALSE,FALSE,FALSE,FALSE,FALSE,FALSE,FALSE,FALSE,FALSE,FALSE,FALSE,FALSE,1,,TRUE,TRUE,FALSE,FALSE,0,No enough information in RPC about charges brought against Sinclare apart from being named by Alexander Hamilton.,FALSE,,FALSE,,FALSE,FALSE,FALSE,FALSE,FALSE,FALSE,FALSE,,,,FALSE,FALSE,FALSE,FALSE,FALSE,FALSE,FALSE,FALSE,FALSE,FALSE,,FALSE,FALSE,FALSE,FALSE,FALSE,FALSE,FALSE,FALSE,FALSE,FALSE,FALSE,FALSE,FALSE,FALSE,FALSE,FALSE,FALSE,,FALSE,FALSE,,,FALSE,FALSE,FALSE,FALSE,FALSE,,,SMD,2001-05-15T17:00:16,jhm,2002-10-02T12:05:19
C/EGD/1138,1138,EGD,-1,A/EGD/1126,3/11/1629,2029-11-03T00:00:00,1/4/1630,2030-04-01T00:00:00,,"Lawder,Bessie",,,,,,,FALSE,FALSE,FALSE,FALSE,FALSE,FALSE,FALSE,FALSE,FALSE,FALSE,FALSE,FALSE,FALSE,FALSE,FALSE,FALSE,FALSE,TRUE,FALSE,FALSE,FALSE,FALSE,FALSE,FALSE,FALSE,FALSE,FALSE,FALSE,FALSE,FALSE,1,,TRUE,TRUE,FALSE,FALSE,0,Not enough information recorded in RPC about specific details of accusations other than being named by Alexander Hamilton.,FALSE,,FALSE,,FALSE,FALSE,FALSE,FALSE,FALSE,FALSE,FALSE,,,,FALSE,FALSE,FALSE,FALSE,FALSE,FALSE,FALSE,FALSE,FALSE,FALSE,,FALSE,FALSE,FALSE,FALSE,FALSE,FALSE,FALSE,FALSE,FALSE,FALSE,FALSE,FALSE,FALSE,FALSE,FALSE,FALSE,FALSE,,FALSE,FALSE,,,FALSE,FALSE,FALSE,FALSE,FALSE,,,SMD,2001-05-15T17:00:16,jhm,2002-10-02T12:07:24
C/EGD/1139,1139,EGD,-1,A/EGD/1127,3/11/1629,2029-11-03T00:00:00,2/7/1630,2030-07-02T00:00:00,,"Lawder,Katherine",,,,,,,FALSE,FALSE,FALSE,FALSE,FALSE,FALSE,FALSE,FALSE,FALSE,FALSE,FALSE,FALSE,FALSE,FALSE,FALSE,FALSE,FALSE,TRUE,FALSE,FALSE,FALSE,FALSE,FALSE,FALSE,FALSE,FALSE,FALSE,FALSE,FALSE,FALSE,1,,TRUE,TRUE,FALSE,FALSE,0,Denounced by Alexander Hammilton (c/egd/166).,FALSE,,FALSE,,FALSE,FALSE,FALSE,FALSE,FALSE,FALSE,FALSE,,,,FALSE,FALSE,FALSE,FALSE,FALSE,FALSE,FALSE,FALSE,FALSE,FALSE,,FALSE,FALSE,FALSE,FALSE,FALSE,FALSE,FALSE,FALSE,FALSE,FALSE,FALSE,FALSE,FALSE,FALSE,FALSE,FALSE,FALSE,,FALSE,FALSE,,,FALSE,FALSE,FALSE,FALSE,FALSE,"Appealed to Privy Council to change the location of their trial to Edinburgh, rather than Haddington. Questioned the competency of the local commissioners. Appeal denied.",,SMD,2001-05-15T17:00:16,jhm,2002-10-02T12:10:11
C/EGD/114,114,EGD,-1,A/EGD/103,1591,1991-06-01T00:00:00,1591,1991-06-01T00:00:00,,"Drummond,Jonat",,,,,,,FALSE,FALSE,FALSE,FALSE,FALSE,FALSE,FALSE,FALSE,FALSE,FALSE,FALSE,FALSE,FALSE,FALSE,FALSE,FALSE,FALSE,FALSE,FALSE,FALSE,FALSE,FALSE,FALSE,FALSE,FALSE,FALSE,FALSE,FALSE,FALSE,FALSE,0,,TRUE,TRUE,FALSE,FALSE,0,,FALSE,,FALSE,,FALSE,FALSE,FALSE,FALSE,FALSE,FALSE,FALSE,,,,FALSE,FALSE,FALSE,FALSE,FALSE,FALSE,FALSE,FALSE,FALSE,FALSE,,FALSE,FALSE,FALSE,FALSE,FALSE,FALSE,FALSE,FALSE,FALSE,FALSE,FALSE,FALSE,FALSE,FALSE,FALSE,FALSE,FALSE,,FALSE,FALSE,,,FALSE,FALSE,FALSE,FALSE,FALSE,,,SMD,2001-05-15T17:00:16,jhm,2002-10-02T12:14:12
C/EGD/1140,1140,EGD,-1,A/EGD/1128,3/11/1629,2029-11-03T00:00:00,2/7/1630,2030-07-02T00:00:00,,"Duncan,Bessie",,,,,,,FALSE,FALSE,FALSE,FALSE,FALSE,FALSE,FALSE,FALSE,FALSE,FALSE,FALSE,FALSE,FALSE,FALSE,FALSE,FALSE,FALSE,TRUE,FALSE,FALSE,FALSE,FALSE,FALSE,FALSE,FALSE,FALSE,FALSE,FALSE,FALSE,FALSE,1,,TRUE,TRUE,FALSE,FALSE,0,Named by Alexander Hamilton but no details about her crimes found.,FALSE,,FALSE,,FALSE,FALSE,FALSE,FALSE,FALSE,FALSE,FALSE,,,,FALSE,FALSE,FALSE,FALSE,FALSE,FALSE,FALSE,FALSE,FALSE,FALSE,,FALSE,FALSE,FALSE,FALSE,FALSE,FALSE,FALSE,FALSE,FALSE,FALSE,FALSE,FALSE,FALSE,FALSE,FALSE,FALSE,FALSE,,FALSE,FALSE,,,FALSE,FALSE,FALSE,FALSE,FALSE,,,SMD,2001-05-15T17:00:16,jhm,2002-10-02T12:14:35
C/EGD/1141,1141,EGD,-1,A/EGD/1129,3/11/1629,2029-11-03T00:00:00,1/4/1630,2030-04-01T00:00:00,,"Mitchell,Margaret",,,,,,,FALSE,FALSE,FALSE,FALSE,FALSE,FALSE,FALSE,FALSE,FALSE,FALSE,FALSE,FALSE,FALSE,FALSE,FALSE,FALSE,FALSE,TRUE,FALSE,FALSE,FALSE,FALSE,FALSE,FALSE,FALSE,FALSE,FALSE,FALSE,FALSE,FALSE,1,,TRUE,TRUE,FALSE,FALSE,0,No specific information recorded about accusations apart from being named by Alexander Hamilton.,FALSE,,FALSE,,FALSE,FALSE,FALSE,FALSE,FALSE,FALSE,FALSE,,,,FALSE,FALSE,FALSE,FALSE,FALSE,FALSE,FALSE,FALSE,FALSE,FALSE,,FALSE,FALSE,FALSE,FALSE,FALSE,FALSE,FALSE,FALSE,FALSE,FALSE,FALSE,FALSE,FALSE,FALSE,FALSE,FALSE,FALSE,,FALSE,FALSE,,,FALSE,FALSE,FALSE,FALSE,FALSE,,,SMD,2001-05-15T17:00:16,jhm,2002-10-02T12:17:16
C/EGD/1142,1142,EGD,-1,A/EGD/1130,3/11/1629,2029-11-03T00:00:00,2/7/1630,2030-07-02T00:00:00,,"Carrick,Alesoun",,,,,,,FALSE,FALSE,FALSE,FALSE,FALSE,FALSE,FALSE,FALSE,FALSE,FALSE,FALSE,FALSE,FALSE,FALSE,FALSE,FALSE,FALSE,TRUE,FALSE,FALSE,FALSE,FALSE,FALSE,FALSE,FALSE,FALSE,FALSE,FALSE,FALSE,FALSE,1,,TRUE,TRUE,FALSE,FALSE,0,Named by Alexander Hamilton but no details about her crimes recorded.,FALSE,,FALSE,,FALSE,FALSE,FALSE,FALSE,FALSE,FALSE,FALSE,,,,FALSE,FALSE,FALSE,FALSE,FALSE,FALSE,FALSE,FALSE,FALSE,FALSE,,FALSE,FALSE,FALSE,FALSE,FALSE,FALSE,FALSE,FALSE,FALSE,FALSE,FALSE,FALSE,FALSE,FALSE,FALSE,FALSE,FALSE,,FALSE,FALSE,,,FALSE,FALSE,FALSE,FALSE,FALSE,,,SMD,2001-05-15T17:00:16,jhm,2002-10-02T12:18:45
C/EGD/1143,1143,EGD,-1,A/EGD/1131,3/11/1629,2029-11-03T00:00:00,2/7/1630,2030-07-02T00:00:00,,"Kirktoun,Katherine",,,,,,,FALSE,FALSE,FALSE,FALSE,FALSE,FALSE,FALSE,FALSE,FALSE,FALSE,FALSE,FALSE,FALSE,FALSE,FALSE,FALSE,FALSE,TRUE,FALSE,FALSE,FALSE,FALSE,FALSE,FALSE,FALSE,FALSE,FALSE,FALSE,FALSE,FALSE,1,,TRUE,TRUE,FALSE,FALSE,0,Implicated by Alexander Hamilton but no other details about her crime.,FALSE,,FALSE,,FALSE,FALSE,FALSE,FALSE,FALSE,FALSE,FALSE,,,,FALSE,FALSE,FALSE,FALSE,FALSE,FALSE,FALSE,FALSE,FALSE,FALSE,,FALSE,FALSE,FALSE,FALSE,FALSE,FALSE,FALSE,FALSE,FALSE,FALSE,FALSE,FALSE,FALSE,FALSE,FALSE,FALSE,FALSE,,FALSE,FALSE,,,FALSE,FALSE,FALSE,FALSE,FALSE,,,SMD,2001-05-15T17:00:16,jhm,2002-10-07T12:36:55
C/EGD/1144,1144,EGD,-1,A/EGD/1132,3/11/1629,2029-11-03T00:00:00,1/6/1630,2030-06-01T00:00:00,50,"Hepburne,Bessie",,,,,,,FALSE,FALSE,FALSE,FALSE,FALSE,FALSE,FALSE,FALSE,FALSE,FALSE,FALSE,FALSE,FALSE,FALSE,FALSE,FALSE,FALSE,TRUE,FALSE,FALSE,FALSE,FALSE,FALSE,FALSE,FALSE,FALSE,FALSE,FALSE,FALSE,FALSE,1,,TRUE,TRUE,FALSE,FALSE,0,Implicated by Alexander Hamilton but no details of charges brought against her.,FALSE,,FALSE,,FALSE,FALSE,FALSE,FALSE,FALSE,FALSE,FALSE,,,,FALSE,FALSE,FALSE,FALSE,FALSE,FALSE,FALSE,FALSE,FALSE,FALSE,,FALSE,FALSE,FALSE,FALSE,FALSE,FALSE,FALSE,FALSE,FALSE,FALSE,FALSE,FALSE,FALSE,FALSE,FALSE,FALSE,FALSE,,FALSE,FALSE,,,FALSE,FALSE,FALSE,FALSE,FALSE,,,SMD,2001-05-15T17:00:16,jhm,2002-10-02T12:24:29
C/EGD/1145,1145,EGD,-1,A/EGD/1133,6/11/1629,2029-11-06T00:00:00,6/11/1629,2029-11-06T00:00:00,,"Wod,Barbara",,,,,,,FALSE,FALSE,FALSE,FALSE,FALSE,FALSE,FALSE,FALSE,FALSE,FALSE,FALSE,FALSE,FALSE,FALSE,FALSE,FALSE,FALSE,FALSE,FALSE,FALSE,FALSE,FALSE,FALSE,FALSE,FALSE,FALSE,FALSE,FALSE,FALSE,FALSE,0,,TRUE,TRUE,FALSE,FALSE,0,,FALSE,,FALSE,,FALSE,FALSE,FALSE,FALSE,FALSE,FALSE,FALSE,,,,FALSE,FALSE,FALSE,FALSE,FALSE,FALSE,FALSE,FALSE,FALSE,FALSE,,FALSE,FALSE,FALSE,FALSE,FALSE,FALSE,FALSE,FALSE,FALSE,FALSE,FALSE,FALSE,FALSE,FALSE,FALSE,FALSE,FALSE,,FALSE,FALSE,,,FALSE,FALSE,FALSE,FALSE,FALSE,,,SMD,2001-05-15T17:00:16,jhm,2002-10-02T12:26:35
C/EGD/1146,1146,EGD,-1,A/EGD/1134,17/10/1629,2029-10-17T00:00:00,6/11/1629,2029-11-06T00:00:00,,"Skaitsone,Susanna",,,,,,,FALSE,FALSE,FALSE,FALSE,FALSE,FALSE,FALSE,FALSE,FALSE,FALSE,FALSE,FALSE,FALSE,FALSE,FALSE,FALSE,FALSE,FALSE,FALSE,FALSE,FALSE,FALSE,FALSE,FALSE,FALSE,FALSE,FALSE,FALSE,FALSE,FALSE,0,,TRUE,TRUE,FALSE,FALSE,0,,FALSE,,FALSE,,FALSE,FALSE,FALSE,FALSE,FALSE,FALSE,FALSE,,,,FALSE,FALSE,FALSE,FALSE,FALSE,FALSE,FALSE,FALSE,FALSE,FALSE,,FALSE,FALSE,FALSE,FALSE,FALSE,FALSE,FALSE,FALSE,FALSE,FALSE,FALSE,FALSE,FALSE,FALSE,FALSE,FALSE,FALSE,,FALSE,FALSE,,,FALSE,FALSE,FALSE,FALSE,FALSE,,Accused with 1 other.,SMD,2001-05-15T17:00:16,jhm,2002-10-02T12:28:22
C/EGD/1147,1147,EGD,-1,A/EGD/1135,15/10/1629,2029-10-15T00:00:00,6/11/1629,2029-11-06T00:00:00,,"Rannick,Agnes",,,,,,,FALSE,FALSE,FALSE,FALSE,FALSE,FALSE,FALSE,FALSE,FALSE,FALSE,FALSE,FALSE,FALSE,FALSE,FALSE,FALSE,FALSE,FALSE,FALSE,FALSE,FALSE,FALSE,FALSE,FALSE,FALSE,FALSE,FALSE,FALSE,FALSE,FALSE,0,,TRUE,TRUE,FALSE,FALSE,0,,FALSE,,FALSE,,FALSE,FALSE,FALSE,FALSE,FALSE,FALSE,FALSE,,,,FALSE,FALSE,FALSE,FALSE,FALSE,FALSE,FALSE,FALSE,FALSE,FALSE,,FALSE,FALSE,FALSE,FALSE,FALSE,FALSE,FALSE,FALSE,FALSE,FALSE,FALSE,FALSE,FALSE,FALSE,FALSE,FALSE,FALSE,,FALSE,FALSE,,,FALSE,FALSE,FALSE,FALSE,FALSE,,Accused with 1 other.,SMD,2001-05-15T17:00:16,jhm,2002-10-02T12:30:02
C/EGD/1148,1148,EGD,-1,A/EGD/1136,6/11/1629,2029-11-06T00:00:00,6/11/1629,2029-11-06T00:00:00,,"Tailzefeir,Marioun",,,,,,,FALSE,FALSE,FALSE,FALSE,FALSE,FALSE,FALSE,FALSE,FALSE,FALSE,FALSE,FALSE,FALSE,FALSE,FALSE,FALSE,FALSE,FALSE,FALSE,FALSE,FALSE,FALSE,FALSE,FALSE,FALSE,FALSE,FALSE,FALSE,FALSE,FALSE,0,,TRUE,TRUE,FALSE,FALSE,0,,FALSE,,FALSE,,FALSE,FALSE,FALSE,FALSE,FALSE,FALSE,FALSE,,,,FALSE,FALSE,FALSE,FALSE,FALSE,FALSE,FALSE,FALSE,FALSE,FALSE,,FALSE,FALSE,FALSE,FALSE,FALSE,FALSE,FALSE,FALSE,FALSE,FALSE,FALSE,FALSE,FALSE,FALSE,FALSE,FALSE,FALSE,,FALSE,FALSE,,,FALSE,FALSE,FALSE,FALSE,FALSE,,,SMD,2001-05-15T17:00:16,jhm,2002-10-02T12:31:13
C/EGD/1149,1149,EGD,-1,A/EGD/1137,6/11/1629,2029-11-06T00:00:00,6/11/1629,2029-11-06T00:00:00,,"Allane,Janet",,,,,,,FALSE,FALSE,FALSE,FALSE,FALSE,FALSE,FALSE,FALSE,FALSE,FALSE,FALSE,FALSE,FALSE,FALSE,FALSE,FALSE,FALSE,FALSE,FALSE,FALSE,FALSE,FALSE,FALSE,FALSE,FALSE,FALSE,FALSE,FALSE,FALSE,FALSE,0,,TRUE,TRUE,FALSE,FALSE,0,,FALSE,,FALSE,,FALSE,FALSE,FALSE,FALSE,FALSE,FALSE,FALSE,,,,FALSE,FALSE,FALSE,FALSE,FALSE,FALSE,FALSE,FALSE,FALSE,FALSE,,FALSE,FALSE,FALSE,FALSE,FALSE,FALSE,FALSE,FALSE,FALSE,FALSE,FALSE,FALSE,FALSE,FALSE,FALSE,FALSE,FALSE,,FALSE,FALSE,,,FALSE,FALSE,FALSE,FALSE,FALSE,,,SMD,2001-05-15T17:00:16,LEM,2002-12-06T12:25:51
C/EGD/115,115,EGD,-1,A/EGD/104,1591,1991-06-01T00:00:00,1591,1991-06-01T00:00:00,,"Farquhars,Archie",,,,,,,FALSE,FALSE,FALSE,FALSE,FALSE,FALSE,FALSE,FALSE,FALSE,FALSE,FALSE,FALSE,FALSE,FALSE,FALSE,FALSE,FALSE,FALSE,FALSE,FALSE,FALSE,FALSE,FALSE,FALSE,FALSE,FALSE,FALSE,FALSE,FALSE,FALSE,0,,TRUE,TRUE,FALSE,FALSE,0,,FALSE,,FALSE,,FALSE,FALSE,FALSE,FALSE,FALSE,FALSE,FALSE,,,,FALSE,FALSE,FALSE,FALSE,FALSE,FALSE,FALSE,FALSE,FALSE,FALSE,,FALSE,FALSE,FALSE,FALSE,FALSE,FALSE,FALSE,FALSE,FALSE,FALSE,FALSE,FALSE,FALSE,FALSE,FALSE,FALSE,FALSE,,FALSE,FALSE,,,FALSE,FALSE,FALSE,FALSE,FALSE,,,SMD,2001-05-15T17:00:16,jhm,2002-10-02T12:32:47
C/EGD/1150,1150,EGD,-1,A/EGD/1138,6/11/1629,2029-11-06T00:00:00,6/11/1629,2029-11-06T00:00:00,,"Porteous,Marion",,,,,,,FALSE,FALSE,FALSE,FALSE,FALSE,FALSE,FALSE,FALSE,FALSE,FALSE,FALSE,FALSE,FALSE,FALSE,FALSE,FALSE,FALSE,FALSE,FALSE,FALSE,FALSE,FALSE,FALSE,FALSE,FALSE,FALSE,FALSE,FALSE,FALSE,FALSE,0,,TRUE,TRUE,FALSE,FALSE,0,,FALSE,,FALSE,,FALSE,FALSE,FALSE,FALSE,FALSE,FALSE,FALSE,,,,FALSE,FALSE,FALSE,FALSE,FALSE,FALSE,FALSE,FALSE,FALSE,FALSE,,FALSE,FALSE,FALSE,FALSE,FALSE,FALSE,FALSE,FALSE,FALSE,FALSE,FALSE,FALSE,FALSE,FALSE,FALSE,FALSE,FALSE,,FALSE,FALSE,,,FALSE,FALSE,FALSE,FALSE,FALSE,,,SMD,2001-05-15T17:00:16,jhm,2002-10-02T12:33:17
C/EGD/1151,1151,EGD,-1,A/EGD/1139,6/11/1629,2029-11-06T00:00:00,6/11/1629,2029-11-06T00:00:00,,"Purdie,Annie",,,,,,,FALSE,FALSE,FALSE,FALSE,FALSE,FALSE,FALSE,FALSE,FALSE,FALSE,FALSE,FALSE,FALSE,FALSE,FALSE,FALSE,FALSE,FALSE,FALSE,FALSE,FALSE,FALSE,FALSE,FALSE,FALSE,FALSE,FALSE,FALSE,FALSE,FALSE,0,,TRUE,TRUE,FALSE,FALSE,0,,FALSE,,FALSE,,FALSE,FALSE,FALSE,FALSE,FALSE,FALSE,FALSE,,,,FALSE,FALSE,FALSE,FALSE,FALSE,FALSE,FALSE,FALSE,FALSE,FALSE,,FALSE,FALSE,FALSE,FALSE,FALSE,FALSE,FALSE,FALSE,FALSE,FALSE,FALSE,FALSE,FALSE,FALSE,FALSE,FALSE,FALSE,,FALSE,FALSE,,,FALSE,FALSE,FALSE,FALSE,FALSE,,,SMD,2001-05-15T17:00:16,jhm,2002-10-02T12:34:11
C/EGD/1153,1153,EGD,-1,A/EGD/1141,7/11/1629,2029-11-07T00:00:00,26/11/1629,2029-11-26T00:00:00,,"Hog,Jon",,,,,,,FALSE,FALSE,FALSE,FALSE,FALSE,FALSE,FALSE,FALSE,FALSE,FALSE,FALSE,FALSE,FALSE,TRUE,FALSE,FALSE,FALSE,TRUE,FALSE,TRUE,FALSE,FALSE,FALSE,FALSE,FALSE,FALSE,FALSE,FALSE,FALSE,FALSE,3,,TRUE,TRUE,FALSE,FALSE,0,They were clearly the victims of a quest for suspects from Alexander Hammilton.  There is some evidence of neighbourhood disputes -  especially around a horse that went mad and a possibly suspicious healing done on John Hog where the disease may have transferred to a neighbour's baby.  But this healing was done on John Hog not by him or his wife.  Their family was also questioned.  Hog was accused of trying to seduce his neighbour's wife.,FALSE,"Lots of accusations regarding the Devil in depositions given in by Hammilton, but did not include them here because he retracted them and Hog and wife never confessed.  Both Hog and his wife made an oath on their knees denying everything in Hammilton's depositions.",FALSE,,FALSE,FALSE,FALSE,FALSE,FALSE,FALSE,FALSE,,,,FALSE,FALSE,FALSE,FALSE,FALSE,FALSE,FALSE,FALSE,FALSE,FALSE,There is a description of a possible unwitching episode that was attempted on John Hog where a disease was transferred to a newly born baby.  Lots of information about this event in JC26/9 item 7.  There is something about a strange cat found in Margaret's house and a din of cats that was seen and heard at her neighbour's around Michaelmas.,FALSE,FALSE,TRUE,FALSE,FALSE,FALSE,FALSE,TRUE,FALSE,FALSE,TRUE,FALSE,FALSE,FALSE,FALSE,FALSE,FALSE,,FALSE,FALSE,,,FALSE,FALSE,FALSE,FALSE,FALSE,,"Denounced by Hammilton, investigated and dropped.  Lots of detail in the JC26/9, his wife was quarrelling with lots of people and he was accused of trying to seduce his neighbour's wife.  Witness statements from 7 November 1629 through to 23 November 1629 - intensive questioning of neighbours and family members by Colville and the Bishop of Dunblane.  Hammilton was known to beg at their house.",SMD,2001-05-15T17:00:16,LEM,2002-11-11T13:01:08
C/EGD/1154,1154,EGD,-1,A/EGD/1142,12/11/1629,2029-11-12T00:00:00,9/2/1630,2030-02-09T00:00:00,,"Thomesone,Jean",,,,,,,FALSE,FALSE,FALSE,FALSE,FALSE,FALSE,FALSE,FALSE,FALSE,FALSE,FALSE,FALSE,FALSE,TRUE,FALSE,FALSE,FALSE,TRUE,FALSE,FALSE,FALSE,TRUE,FALSE,FALSE,FALSE,FALSE,FALSE,FALSE,FALSE,FALSE,3,,TRUE,TRUE,FALSE,FALSE,0,,FALSE,,FALSE,,FALSE,FALSE,FALSE,FALSE,FALSE,FALSE,FALSE,,,,FALSE,FALSE,FALSE,FALSE,FALSE,FALSE,FALSE,FALSE,FALSE,FALSE,,FALSE,TRUE,FALSE,FALSE,FALSE,FALSE,FALSE,FALSE,FALSE,FALSE,FALSE,FALSE,FALSE,FALSE,FALSE,FALSE,FALSE,,FALSE,FALSE,,,FALSE,FALSE,FALSE,FALSE,FALSE,,She and her mother were accused by her brother in law of killing her husband.,SMD,2001-05-15T17:00:16,jhm,2002-10-10T14:07:08
C/EGD/1155,1155,EGD,-1,A/EGD/1143,12/11/1629,2029-11-12T00:00:00,9/2/1630,2030-02-09T00:00:00,50,"Maxwell,Margaret",,,,,,,FALSE,FALSE,FALSE,FALSE,FALSE,FALSE,FALSE,FALSE,FALSE,FALSE,FALSE,FALSE,FALSE,TRUE,FALSE,FALSE,FALSE,TRUE,FALSE,FALSE,FALSE,TRUE,FALSE,FALSE,FALSE,FALSE,FALSE,FALSE,FALSE,FALSE,3,,TRUE,TRUE,FALSE,FALSE,0,,FALSE,,FALSE,,FALSE,FALSE,FALSE,FALSE,FALSE,FALSE,FALSE,,,,FALSE,FALSE,FALSE,FALSE,FALSE,FALSE,FALSE,FALSE,FALSE,FALSE,,FALSE,TRUE,FALSE,FALSE,FALSE,FALSE,FALSE,FALSE,FALSE,FALSE,FALSE,FALSE,FALSE,FALSE,FALSE,FALSE,FALSE,,FALSE,FALSE,,,FALSE,FALSE,FALSE,FALSE,FALSE,,She and her daughter were accused by the daughter's husband's brother of killing the daughter's husband.,SMD,2001-05-15T17:00:16,jhm,2002-10-10T14:07:48
C/EGD/1156,1156,EGD,-1,A/EGD/1144,7/10/1617,2017-10-07T00:00:00,24/11/1629,2029-11-24T00:00:00,,"Campbell,Agnes",,,,,,,FALSE,FALSE,FALSE,FALSE,FALSE,FALSE,FALSE,FALSE,FALSE,FALSE,FALSE,FALSE,FALSE,FALSE,FALSE,FALSE,FALSE,FALSE,FALSE,FALSE,FALSE,FALSE,FALSE,FALSE,FALSE,FALSE,FALSE,FALSE,FALSE,FALSE,0,,TRUE,TRUE,FALSE,FALSE,0,,FALSE,,FALSE,,FALSE,FALSE,FALSE,FALSE,FALSE,FALSE,FALSE,,,,FALSE,FALSE,FALSE,FALSE,FALSE,FALSE,FALSE,FALSE,FALSE,FALSE,,FALSE,FALSE,FALSE,FALSE,FALSE,FALSE,FALSE,FALSE,FALSE,FALSE,FALSE,FALSE,FALSE,FALSE,FALSE,FALSE,FALSE,,FALSE,FALSE,,In trouble in 1617 charged with adultery.,FALSE,FALSE,FALSE,FALSE,FALSE,,,SMD,2001-05-15T17:00:16,jhm,2002-10-02T12:42:42
C/EGD/1157,1157,EGD,-1,A/EGD/1145,24/11/1629,2029-11-24T00:00:00,24/11/1629,2029-11-24T00:00:00,,"Sandersoun,Marion",,,,,,,FALSE,FALSE,FALSE,FALSE,FALSE,FALSE,FALSE,FALSE,FALSE,FALSE,FALSE,FALSE,FALSE,FALSE,FALSE,FALSE,FALSE,FALSE,FALSE,FALSE,FALSE,FALSE,FALSE,FALSE,FALSE,FALSE,FALSE,FALSE,FALSE,FALSE,0,,TRUE,TRUE,FALSE,FALSE,0,,FALSE,,FALSE,,FALSE,FALSE,FALSE,FALSE,FALSE,FALSE,FALSE,,,,FALSE,FALSE,FALSE,FALSE,FALSE,FALSE,FALSE,FALSE,FALSE,FALSE,,FALSE,FALSE,FALSE,FALSE,FALSE,FALSE,FALSE,FALSE,FALSE,FALSE,FALSE,FALSE,FALSE,FALSE,FALSE,FALSE,FALSE,,FALSE,FALSE,,,FALSE,FALSE,FALSE,FALSE,FALSE,,,SMD,2001-05-15T17:00:16,jhm,2002-10-02T12:43:59
C/EGD/1158,1158,EGD,-1,A/EGD/1146,3/12/1629,2029-12-03T00:00:00,3/12/1629,2029-12-03T00:00:00,,"Miller,Janet",,,,,,,FALSE,FALSE,FALSE,FALSE,FALSE,FALSE,FALSE,FALSE,FALSE,FALSE,FALSE,FALSE,FALSE,FALSE,FALSE,FALSE,FALSE,FALSE,FALSE,FALSE,FALSE,FALSE,FALSE,FALSE,FALSE,FALSE,FALSE,FALSE,FALSE,FALSE,0,,TRUE,TRUE,FALSE,FALSE,0,,FALSE,,FALSE,,FALSE,FALSE,FALSE,FALSE,FALSE,FALSE,FALSE,,,,FALSE,FALSE,FALSE,FALSE,FALSE,FALSE,FALSE,FALSE,FALSE,FALSE,,FALSE,FALSE,FALSE,FALSE,FALSE,FALSE,FALSE,FALSE,FALSE,FALSE,FALSE,FALSE,FALSE,FALSE,FALSE,FALSE,FALSE,,FALSE,FALSE,,,FALSE,FALSE,FALSE,FALSE,FALSE,,,SMD,2001-05-15T17:00:16,jhm,2002-10-02T12:44:45
C/EGD/1159,1159,EGD,-1,A/EGD/1147,3/12/1629,2029-12-03T00:00:00,3/12/1629,2029-12-03T00:00:00,,"Boill,Grissell",,,,,,,FALSE,FALSE,FALSE,FALSE,FALSE,FALSE,FALSE,FALSE,FALSE,FALSE,FALSE,FALSE,FALSE,FALSE,FALSE,FALSE,FALSE,FALSE,FALSE,FALSE,FALSE,FALSE,FALSE,FALSE,FALSE,FALSE,FALSE,FALSE,FALSE,FALSE,0,,TRUE,TRUE,FALSE,FALSE,0,,FALSE,,FALSE,,FALSE,FALSE,FALSE,FALSE,FALSE,FALSE,FALSE,,,,FALSE,FALSE,FALSE,FALSE,FALSE,FALSE,FALSE,FALSE,FALSE,FALSE,,FALSE,FALSE,FALSE,FALSE,FALSE,FALSE,FALSE,FALSE,FALSE,FALSE,FALSE,FALSE,FALSE,FALSE,FALSE,FALSE,FALSE,,FALSE,FALSE,,,FALSE,FALSE,FALSE,FALSE,FALSE,,,SMD,2001-05-15T17:00:16,jhm,2002-10-02T12:46:06
C/EGD/116,116,EGD,-1,A/EGD/105,1591,1991-06-01T00:00:00,1591,1991-06-01T00:00:00,,"Fairlie,Jonet",,,,,,,FALSE,FALSE,FALSE,FALSE,FALSE,FALSE,FALSE,FALSE,FALSE,FALSE,FALSE,FALSE,FALSE,FALSE,FALSE,FALSE,FALSE,TRUE,FALSE,FALSE,FALSE,FALSE,FALSE,FALSE,FALSE,FALSE,FALSE,FALSE,FALSE,FALSE,1,,TRUE,TRUE,FALSE,FALSE,0,,FALSE,,FALSE,,FALSE,FALSE,FALSE,FALSE,FALSE,FALSE,FALSE,,,Supposedly part of throwing a cat into the sea at North Berwick.,FALSE,FALSE,FALSE,FALSE,FALSE,FALSE,FALSE,FALSE,FALSE,FALSE,,FALSE,FALSE,FALSE,FALSE,FALSE,FALSE,FALSE,FALSE,FALSE,FALSE,FALSE,FALSE,FALSE,FALSE,FALSE,FALSE,FALSE,,FALSE,FALSE,,,FALSE,FALSE,FALSE,FALSE,FALSE,,,SMD,2001-05-15T17:00:16,jhm,2002-10-02T12:47:59
C/EGD/1160,1160,EGD,-1,A/EGD/1148,3/12/1629,2029-12-03T00:00:00,24/12/1629,2029-12-24T00:00:00,,"Bishop,Janet",,,,,,,FALSE,FALSE,FALSE,FALSE,FALSE,FALSE,FALSE,FALSE,FALSE,FALSE,FALSE,FALSE,FALSE,FALSE,FALSE,FALSE,FALSE,FALSE,FALSE,FALSE,FALSE,FALSE,FALSE,FALSE,FALSE,FALSE,FALSE,FALSE,FALSE,FALSE,0,,TRUE,TRUE,FALSE,FALSE,0,,FALSE,,FALSE,,FALSE,FALSE,FALSE,FALSE,FALSE,FALSE,FALSE,,,,FALSE,FALSE,FALSE,FALSE,FALSE,FALSE,FALSE,FALSE,FALSE,FALSE,,FALSE,FALSE,FALSE,FALSE,FALSE,FALSE,FALSE,FALSE,FALSE,FALSE,FALSE,FALSE,FALSE,FALSE,FALSE,FALSE,FALSE,,FALSE,FALSE,,,FALSE,FALSE,FALSE,FALSE,FALSE,,Listed with 1 other in RPC but executed with 2 others.,SMD,2001-05-15T17:00:16,jhm,2002-10-02T12:49:21
C/EGD/1161,1161,EGD,-1,A/EGD/1149,3/12/1629,2029-12-03T00:00:00,24/12/1629,2029-12-24T00:00:00,,"Cuthbertson,Margaret",,,,,,,FALSE,FALSE,FALSE,FALSE,FALSE,FALSE,FALSE,FALSE,FALSE,FALSE,FALSE,FALSE,FALSE,FALSE,FALSE,FALSE,FALSE,FALSE,FALSE,FALSE,FALSE,FALSE,FALSE,FALSE,FALSE,FALSE,FALSE,FALSE,FALSE,FALSE,0,,TRUE,TRUE,FALSE,FALSE,0,,FALSE,,FALSE,,FALSE,FALSE,FALSE,FALSE,FALSE,FALSE,FALSE,,,,FALSE,FALSE,FALSE,FALSE,FALSE,FALSE,FALSE,FALSE,FALSE,FALSE,,FALSE,FALSE,FALSE,FALSE,FALSE,FALSE,FALSE,FALSE,FALSE,FALSE,FALSE,FALSE,FALSE,FALSE,FALSE,FALSE,FALSE,,FALSE,FALSE,,,FALSE,FALSE,FALSE,FALSE,FALSE,,named in commission with 1 other but executed with 2 others.,SMD,2001-05-15T17:00:16,jhm,2002-10-02T12:51:03
C/EGD/1162,1162,EGD,-1,A/EGD/1150,3/12/1629,2029-12-03T00:00:00,3/12/1629,2029-12-03T00:00:00,,"Miller,Jean",,,,,,,FALSE,FALSE,FALSE,FALSE,FALSE,FALSE,FALSE,FALSE,FALSE,FALSE,FALSE,FALSE,FALSE,FALSE,FALSE,FALSE,FALSE,FALSE,FALSE,FALSE,FALSE,FALSE,FALSE,FALSE,FALSE,FALSE,FALSE,FALSE,FALSE,FALSE,0,,TRUE,TRUE,FALSE,FALSE,0,,FALSE,,FALSE,,FALSE,FALSE,FALSE,FALSE,FALSE,FALSE,FALSE,,,,FALSE,FALSE,FALSE,FALSE,FALSE,FALSE,FALSE,FALSE,FALSE,FALSE,,FALSE,FALSE,FALSE,FALSE,FALSE,FALSE,FALSE,FALSE,FALSE,FALSE,FALSE,FALSE,FALSE,FALSE,FALSE,FALSE,FALSE,,FALSE,FALSE,,,FALSE,FALSE,FALSE,FALSE,FALSE,,,SMD,2001-05-15T17:00:16,jhm,2002-10-02T12:52:19
C/EGD/1163,1163,EGD,-1,A/EGD/1151,3/12/1629,2029-12-03T00:00:00,2/2/1630,2030-02-02T00:00:00,,"Manderstoun (Arnot),Helen",,,,,,,FALSE,FALSE,FALSE,FALSE,FALSE,FALSE,FALSE,FALSE,FALSE,FALSE,FALSE,FALSE,FALSE,FALSE,FALSE,FALSE,FALSE,TRUE,FALSE,FALSE,FALSE,FALSE,FALSE,FALSE,FALSE,FALSE,FALSE,FALSE,FALSE,FALSE,1,,TRUE,TRUE,FALSE,FALSE,0,,FALSE,,FALSE,,FALSE,FALSE,FALSE,FALSE,FALSE,FALSE,FALSE,,,,FALSE,FALSE,FALSE,FALSE,FALSE,FALSE,FALSE,FALSE,FALSE,FALSE,,FALSE,FALSE,FALSE,FALSE,FALSE,FALSE,FALSE,FALSE,FALSE,FALSE,FALSE,FALSE,FALSE,FALSE,FALSE,FALSE,FALSE,,FALSE,FALSE,,,FALSE,FALSE,FALSE,FALSE,FALSE,,Accused by Hammilton (after pressure from her husband?) of having used witchcraft to damage the life and estate of Sir George Home of Manderston.  Hammilton retracted her confession and she was set free.  William Mowat and Patrick Abernathy were prosecuted for taking false testimony against her.,SMD,2001-05-15T17:00:16,jhm,2002-10-02T12:55:40
C/EGD/1165,1165,EGD,-1,A/EGD/1153,10/12/1629,2029-12-10T00:00:00,18/12/1629,2029-12-18T00:00:00,50,"Stevinsoun,William",,,,,,,FALSE,FALSE,FALSE,FALSE,FALSE,FALSE,FALSE,FALSE,FALSE,FALSE,FALSE,FALSE,FALSE,FALSE,FALSE,FALSE,FALSE,FALSE,FALSE,FALSE,FALSE,FALSE,FALSE,FALSE,FALSE,FALSE,FALSE,FALSE,FALSE,FALSE,0,,TRUE,TRUE,FALSE,FALSE,0,,FALSE,,FALSE,,FALSE,FALSE,FALSE,FALSE,FALSE,FALSE,FALSE,,,,FALSE,FALSE,FALSE,FALSE,FALSE,FALSE,FALSE,FALSE,FALSE,FALSE,,FALSE,FALSE,FALSE,FALSE,FALSE,FALSE,FALSE,FALSE,FALSE,FALSE,FALSE,FALSE,FALSE,FALSE,FALSE,FALSE,FALSE,,FALSE,FALSE,,,FALSE,FALSE,FALSE,FALSE,FALSE,,,SMD,2001-05-15T17:00:16,jhm,2002-10-02T13:02:53
C/EGD/1166,1166,EGD,-1,A/EGD/1154,10/12/1629,2029-12-10T00:00:00,18/12/1629,2029-12-18T00:00:00,,"Pringill,Alisoun",,,,,,,FALSE,FALSE,FALSE,FALSE,FALSE,FALSE,FALSE,FALSE,FALSE,FALSE,FALSE,FALSE,FALSE,FALSE,FALSE,FALSE,FALSE,FALSE,FALSE,FALSE,FALSE,FALSE,FALSE,FALSE,FALSE,FALSE,FALSE,FALSE,FALSE,FALSE,0,,TRUE,TRUE,FALSE,FALSE,0,,FALSE,,FALSE,,FALSE,FALSE,FALSE,FALSE,FALSE,FALSE,FALSE,,,,FALSE,FALSE,FALSE,FALSE,FALSE,FALSE,FALSE,FALSE,FALSE,FALSE,,FALSE,FALSE,FALSE,FALSE,FALSE,FALSE,FALSE,FALSE,FALSE,FALSE,FALSE,FALSE,FALSE,FALSE,FALSE,FALSE,FALSE,,FALSE,FALSE,,,FALSE,FALSE,FALSE,FALSE,FALSE,,,SMD,2001-05-15T17:00:16,jhm,2002-10-02T13:02:39
C/EGD/1167,1167,EGD,-1,A/EGD/1155,6/11/1629,2029-11-06T00:00:00,18/12/1629,2029-12-18T00:00:00,,"Robson,Gellie",,,,,,,FALSE,FALSE,FALSE,FALSE,FALSE,FALSE,FALSE,FALSE,FALSE,FALSE,FALSE,FALSE,FALSE,TRUE,FALSE,FALSE,FALSE,FALSE,FALSE,FALSE,FALSE,TRUE,FALSE,FALSE,FALSE,FALSE,FALSE,FALSE,FALSE,FALSE,2,,TRUE,TRUE,FALSE,FALSE,0,,FALSE,,FALSE,,FALSE,FALSE,FALSE,FALSE,FALSE,FALSE,FALSE,,,,FALSE,FALSE,FALSE,FALSE,FALSE,FALSE,FALSE,FALSE,FALSE,FALSE,,FALSE,TRUE,FALSE,FALSE,FALSE,FALSE,FALSE,FALSE,FALSE,FALSE,FALSE,FALSE,FALSE,FALSE,FALSE,FALSE,FALSE,,FALSE,FALSE,,,FALSE,FALSE,FALSE,FALSE,FALSE,,,SMD,2001-05-15T17:00:16,jhm,2002-10-02T14:35:15
C/EGD/1168,1168,EGD,-1,A/EGD/1156,16/7/1629,2029-07-16T00:00:00,5/9/1629,2029-09-05T00:00:00,,"Ballame (Baleny),Margaret",,,,,,,FALSE,FALSE,FALSE,FALSE,FALSE,FALSE,FALSE,FALSE,FALSE,FALSE,FALSE,FALSE,FALSE,TRUE,FALSE,FALSE,FALSE,TRUE,FALSE,FALSE,FALSE,FALSE,FALSE,FALSE,FALSE,FALSE,FALSE,FALSE,FALSE,FALSE,2,,TRUE,TRUE,FALSE,FALSE,0,Implicated by Margaret Loche (c/egd/674) who was herself implicated by Alexander Hammilton (c/egd/166).,FALSE,,FALSE,,FALSE,FALSE,FALSE,FALSE,FALSE,FALSE,FALSE,,,Accused of burning down a mill,FALSE,FALSE,FALSE,FALSE,FALSE,FALSE,FALSE,FALSE,FALSE,FALSE,,FALSE,FALSE,FALSE,FALSE,FALSE,FALSE,FALSE,FALSE,FALSE,FALSE,FALSE,FALSE,FALSE,FALSE,FALSE,FALSE,FALSE,,TRUE,FALSE,,,FALSE,FALSE,FALSE,FALSE,FALSE,,,SMD,2001-05-15T17:00:16,LEM,2002-10-10T14:15:17
C/EGD/1169,1169,EGD,-1,A/EGD/1157,26/11/1633,2033-11-26T00:00:00,9/12/1633,2033-12-09T00:00:00,,"Wilson,Alison",,,,,,,FALSE,FALSE,FALSE,FALSE,FALSE,FALSE,FALSE,FALSE,FALSE,FALSE,FALSE,FALSE,FALSE,FALSE,FALSE,FALSE,FALSE,TRUE,FALSE,FALSE,FALSE,FALSE,FALSE,FALSE,FALSE,FALSE,FALSE,FALSE,FALSE,FALSE,1,,TRUE,TRUE,FALSE,FALSE,0,,FALSE,,FALSE,,FALSE,FALSE,FALSE,FALSE,FALSE,FALSE,FALSE,,,,FALSE,FALSE,FALSE,FALSE,FALSE,FALSE,FALSE,FALSE,FALSE,FALSE,,FALSE,FALSE,FALSE,FALSE,FALSE,FALSE,FALSE,FALSE,FALSE,FALSE,FALSE,FALSE,FALSE,FALSE,FALSE,FALSE,FALSE,,FALSE,FALSE,,,FALSE,FALSE,FALSE,FALSE,FALSE,,,SMD,2001-05-15T17:00:16,LEM,2002-10-10T12:47:59
C/EGD/1170,1170,EGD,-1,A/EGD/1158,26/11/1633,2033-11-26T00:00:00,9/12/1633,2033-12-09T00:00:00,,"Wilson,Agnes",,,,,,,FALSE,FALSE,FALSE,FALSE,FALSE,FALSE,FALSE,FALSE,FALSE,FALSE,FALSE,FALSE,FALSE,FALSE,FALSE,FALSE,FALSE,TRUE,FALSE,FALSE,FALSE,FALSE,FALSE,FALSE,FALSE,FALSE,FALSE,FALSE,FALSE,FALSE,1,,TRUE,TRUE,FALSE,FALSE,0,,FALSE,,TRUE,,TRUE,FALSE,FALSE,FALSE,FALSE,FALSE,FALSE,,,,FALSE,FALSE,FALSE,FALSE,FALSE,FALSE,FALSE,FALSE,FALSE,FALSE,,FALSE,FALSE,FALSE,FALSE,FALSE,FALSE,FALSE,FALSE,FALSE,FALSE,FALSE,FALSE,FALSE,FALSE,FALSE,FALSE,FALSE,,FALSE,FALSE,,,FALSE,FALSE,FALSE,FALSE,FALSE,,,SMD,2001-05-15T17:00:16,LEM,2002-10-10T12:42:56
C/EGD/1171,1171,EGD,-1,A/EGD/1159,7/1/1630,2030-01-07T00:00:00,7/1/1630,2030-01-07T00:00:00,,"Mitchell,Janet",,,,,,,FALSE,FALSE,FALSE,FALSE,FALSE,FALSE,FALSE,FALSE,FALSE,FALSE,FALSE,FALSE,FALSE,FALSE,FALSE,FALSE,FALSE,FALSE,FALSE,FALSE,FALSE,FALSE,FALSE,FALSE,FALSE,FALSE,FALSE,FALSE,FALSE,FALSE,0,,TRUE,TRUE,FALSE,FALSE,0,,FALSE,,FALSE,,FALSE,FALSE,FALSE,FALSE,FALSE,FALSE,FALSE,,,,FALSE,FALSE,FALSE,FALSE,FALSE,FALSE,FALSE,FALSE,FALSE,FALSE,,FALSE,FALSE,FALSE,FALSE,FALSE,FALSE,FALSE,FALSE,FALSE,FALSE,FALSE,FALSE,FALSE,FALSE,FALSE,FALSE,FALSE,,FALSE,FALSE,,,FALSE,FALSE,FALSE,FALSE,FALSE,,,SMD,2001-05-15T17:00:16,LEM,2002-11-11T12:28:40
C/EGD/1172,1172,EGD,-1,A/EGD/1160,10/1629,2029-10-01T00:00:00,12/1/1630,2030-01-12T00:00:00,45,"Abel,Andrew",,,,,,,FALSE,FALSE,FALSE,FALSE,FALSE,FALSE,FALSE,FALSE,FALSE,FALSE,FALSE,FALSE,FALSE,FALSE,FALSE,FALSE,FALSE,FALSE,FALSE,FALSE,FALSE,FALSE,FALSE,FALSE,FALSE,FALSE,FALSE,FALSE,FALSE,FALSE,0,,TRUE,TRUE,FALSE,FALSE,0,,FALSE,,FALSE,,FALSE,FALSE,FALSE,FALSE,FALSE,FALSE,FALSE,,,,FALSE,FALSE,FALSE,FALSE,FALSE,FALSE,FALSE,FALSE,FALSE,FALSE,,FALSE,FALSE,FALSE,FALSE,FALSE,FALSE,FALSE,FALSE,FALSE,FALSE,FALSE,FALSE,FALSE,FALSE,FALSE,FALSE,FALSE,,FALSE,FALSE,,,FALSE,FALSE,FALSE,FALSE,FALSE,,,SMD,2001-05-15T17:00:16,jhm,2002-10-02T14:43:46
C/EGD/1173,1173,EGD,-1,A/EGD/1161,21/1/1630,2030-01-21T00:00:00,21/1/1630,2030-01-21T00:00:00,,"Callander,Margaret",,,,,,,FALSE,FALSE,FALSE,FALSE,FALSE,FALSE,FALSE,FALSE,FALSE,FALSE,FALSE,FALSE,FALSE,FALSE,FALSE,FALSE,FALSE,FALSE,FALSE,FALSE,FALSE,FALSE,FALSE,FALSE,FALSE,FALSE,FALSE,FALSE,FALSE,FALSE,0,,TRUE,TRUE,FALSE,FALSE,0,,FALSE,,FALSE,,FALSE,FALSE,FALSE,FALSE,FALSE,FALSE,FALSE,,,,FALSE,FALSE,FALSE,FALSE,FALSE,FALSE,FALSE,FALSE,FALSE,FALSE,,FALSE,FALSE,FALSE,FALSE,FALSE,FALSE,FALSE,FALSE,FALSE,FALSE,FALSE,FALSE,FALSE,FALSE,FALSE,FALSE,FALSE,,FALSE,FALSE,,,FALSE,FALSE,FALSE,FALSE,FALSE,,,SMD,2001-05-15T17:00:16,jhm,2002-10-02T14:44:44
C/EGD/1174,1174,EGD,-1,A/EGD/1162,21/1/1630,2030-01-21T00:00:00,21/1/1630,2030-01-21T00:00:00,,"Rid,Margaret",,,,,,,FALSE,FALSE,FALSE,FALSE,FALSE,FALSE,FALSE,FALSE,FALSE,FALSE,FALSE,FALSE,FALSE,FALSE,FALSE,FALSE,FALSE,FALSE,FALSE,FALSE,FALSE,FALSE,FALSE,FALSE,FALSE,FALSE,FALSE,FALSE,FALSE,FALSE,0,,TRUE,TRUE,FALSE,FALSE,0,,FALSE,,FALSE,,FALSE,FALSE,FALSE,FALSE,FALSE,FALSE,FALSE,,,,FALSE,FALSE,FALSE,FALSE,FALSE,FALSE,FALSE,FALSE,FALSE,FALSE,,FALSE,FALSE,FALSE,FALSE,FALSE,FALSE,FALSE,FALSE,FALSE,FALSE,FALSE,FALSE,FALSE,FALSE,FALSE,FALSE,FALSE,,FALSE,FALSE,,,FALSE,FALSE,FALSE,FALSE,FALSE,,,SMD,2001-05-15T17:00:16,jhm,2002-10-02T14:45:43
C/EGD/1175,1175,EGD,-1,A/EGD/1163,21/1/1630,2030-01-21T00:00:00,21/1/1630,2030-01-21T00:00:00,,"Currie,Janet",,,,,,,FALSE,FALSE,FALSE,FALSE,FALSE,FALSE,FALSE,FALSE,FALSE,FALSE,FALSE,FALSE,FALSE,FALSE,FALSE,FALSE,FALSE,FALSE,FALSE,FALSE,FALSE,FALSE,FALSE,FALSE,FALSE,FALSE,FALSE,FALSE,FALSE,FALSE,0,,TRUE,TRUE,FALSE,FALSE,0,,FALSE,,FALSE,,FALSE,FALSE,FALSE,FALSE,FALSE,FALSE,FALSE,,,,FALSE,FALSE,FALSE,FALSE,FALSE,FALSE,FALSE,FALSE,FALSE,FALSE,,FALSE,FALSE,FALSE,FALSE,FALSE,FALSE,FALSE,FALSE,FALSE,FALSE,FALSE,FALSE,FALSE,FALSE,FALSE,FALSE,FALSE,,FALSE,FALSE,,,FALSE,FALSE,FALSE,FALSE,FALSE,,,SMD,2001-05-15T17:00:16,jhm,2002-10-02T14:46:21
C/EGD/1176,1176,EGD,-1,A/EGD/1164,4/2/1630,2030-02-04T00:00:00,14/5/1650,1950-05-14T00:00:00,,"Smaillie,Jonet",,,,,,,FALSE,FALSE,FALSE,FALSE,FALSE,FALSE,FALSE,FALSE,FALSE,FALSE,FALSE,FALSE,FALSE,FALSE,FALSE,FALSE,FALSE,FALSE,FALSE,FALSE,FALSE,FALSE,FALSE,FALSE,FALSE,FALSE,FALSE,FALSE,FALSE,FALSE,0,,TRUE,TRUE,FALSE,FALSE,0,,FALSE,,FALSE,,FALSE,FALSE,FALSE,FALSE,FALSE,FALSE,FALSE,,,,FALSE,FALSE,FALSE,FALSE,FALSE,FALSE,FALSE,FALSE,FALSE,FALSE,,FALSE,FALSE,FALSE,FALSE,FALSE,FALSE,FALSE,FALSE,FALSE,FALSE,FALSE,FALSE,FALSE,FALSE,FALSE,FALSE,FALSE,,FALSE,FALSE,,,FALSE,FALSE,FALSE,FALSE,FALSE,,,SMD,2001-05-15T17:00:16,jhm,2002-11-11T16:35:49
C/EGD/1177,1177,EGD,-1,A/EGD/1165,4/2/1630,2030-02-04T00:00:00,4/2/1630,2030-02-04T00:00:00,,"Reid,Jonnet",,,,,,,FALSE,FALSE,FALSE,FALSE,FALSE,FALSE,FALSE,FALSE,FALSE,FALSE,FALSE,FALSE,FALSE,FALSE,FALSE,FALSE,FALSE,FALSE,FALSE,FALSE,FALSE,FALSE,FALSE,FALSE,FALSE,FALSE,FALSE,FALSE,FALSE,FALSE,0,,TRUE,TRUE,FALSE,FALSE,0,,FALSE,,FALSE,,FALSE,FALSE,FALSE,FALSE,FALSE,FALSE,FALSE,,,,FALSE,FALSE,FALSE,FALSE,FALSE,FALSE,FALSE,FALSE,FALSE,FALSE,,FALSE,FALSE,FALSE,FALSE,FALSE,FALSE,FALSE,FALSE,FALSE,FALSE,FALSE,FALSE,FALSE,FALSE,FALSE,FALSE,FALSE,,FALSE,FALSE,,,FALSE,FALSE,FALSE,FALSE,FALSE,,,SMD,2001-05-15T17:00:16,jhm,2002-10-02T14:52:28
C/EGD/1178,1178,EGD,-1,A/EGD/1166,4/2/1630,2030-02-04T00:00:00,4/2/1630,2030-02-04T00:00:00,,"Hannay,Marion",,,,,,,FALSE,FALSE,FALSE,FALSE,FALSE,FALSE,FALSE,FALSE,FALSE,FALSE,FALSE,FALSE,FALSE,FALSE,FALSE,FALSE,FALSE,TRUE,FALSE,FALSE,FALSE,FALSE,FALSE,FALSE,FALSE,FALSE,FALSE,FALSE,FALSE,FALSE,1,,TRUE,TRUE,FALSE,FALSE,0,,FALSE,,FALSE,,FALSE,FALSE,FALSE,FALSE,FALSE,FALSE,FALSE,,,,FALSE,FALSE,FALSE,FALSE,FALSE,FALSE,FALSE,FALSE,FALSE,FALSE,,FALSE,FALSE,FALSE,FALSE,FALSE,FALSE,FALSE,FALSE,FALSE,FALSE,FALSE,FALSE,FALSE,FALSE,FALSE,FALSE,FALSE,,FALSE,FALSE,,,FALSE,FALSE,FALSE,FALSE,FALSE,,,SMD,2001-05-15T17:00:16,LEM,2002-10-10T14:33:23
C/EGD/1179,1179,EGD,-1,A/EGD/1167,4/2/1630,2030-02-04T00:00:00,4/2/1630,2030-02-04T00:00:00,,"McCheyne,Katherine",,,,,,,FALSE,FALSE,FALSE,FALSE,FALSE,FALSE,FALSE,FALSE,FALSE,FALSE,FALSE,FALSE,FALSE,FALSE,FALSE,FALSE,FALSE,FALSE,FALSE,FALSE,FALSE,FALSE,FALSE,FALSE,FALSE,FALSE,FALSE,FALSE,FALSE,FALSE,0,,TRUE,TRUE,FALSE,FALSE,0,,FALSE,,FALSE,,FALSE,FALSE,FALSE,FALSE,FALSE,FALSE,FALSE,,,,FALSE,FALSE,FALSE,FALSE,FALSE,FALSE,FALSE,FALSE,FALSE,FALSE,,FALSE,FALSE,FALSE,FALSE,FALSE,FALSE,FALSE,FALSE,FALSE,FALSE,FALSE,FALSE,FALSE,FALSE,FALSE,FALSE,FALSE,,FALSE,FALSE,,,FALSE,FALSE,FALSE,FALSE,FALSE,,,SMD,2001-05-15T17:00:16,jhm,2002-10-02T14:57:45
C/EGD/118,118,EGD,-1,A/EGD/107,1591,1991-06-01T00:00:00,1591,1991-06-01T00:00:00,,"Nairn,Ane",,,,,,,FALSE,FALSE,FALSE,FALSE,FALSE,FALSE,FALSE,FALSE,FALSE,FALSE,FALSE,FALSE,FALSE,FALSE,FALSE,FALSE,FALSE,FALSE,FALSE,FALSE,FALSE,FALSE,FALSE,FALSE,FALSE,FALSE,FALSE,FALSE,FALSE,FALSE,0,,TRUE,TRUE,FALSE,FALSE,0,,FALSE,,FALSE,,FALSE,FALSE,FALSE,FALSE,FALSE,FALSE,FALSE,,,,FALSE,FALSE,FALSE,FALSE,FALSE,FALSE,FALSE,FALSE,FALSE,FALSE,,FALSE,FALSE,FALSE,FALSE,FALSE,FALSE,FALSE,FALSE,FALSE,FALSE,FALSE,FALSE,FALSE,FALSE,FALSE,FALSE,FALSE,,FALSE,FALSE,,,FALSE,FALSE,FALSE,FALSE,FALSE,,,SMD,2001-05-15T17:00:16,jhm,2002-10-02T14:58:20
C/EGD/1180,1180,EGD,-1,A/EGD/1168,4/2/1630,2030-02-04T00:00:00,4/2/1630,2030-02-04T00:00:00,,"Johnstoun,Marioun",,,,,,,FALSE,FALSE,FALSE,FALSE,FALSE,FALSE,FALSE,FALSE,FALSE,FALSE,FALSE,FALSE,FALSE,FALSE,FALSE,FALSE,FALSE,FALSE,FALSE,FALSE,FALSE,FALSE,FALSE,FALSE,FALSE,FALSE,FALSE,FALSE,FALSE,FALSE,0,,TRUE,TRUE,FALSE,FALSE,0,,FALSE,,FALSE,,FALSE,FALSE,FALSE,FALSE,FALSE,FALSE,FALSE,,,,FALSE,FALSE,FALSE,FALSE,FALSE,FALSE,FALSE,FALSE,FALSE,FALSE,,FALSE,FALSE,FALSE,FALSE,FALSE,FALSE,FALSE,FALSE,FALSE,FALSE,FALSE,FALSE,FALSE,FALSE,FALSE,FALSE,FALSE,,FALSE,FALSE,,,FALSE,FALSE,FALSE,FALSE,FALSE,,,SMD,2001-05-15T17:00:16,jhm,2002-10-02T14:59:10
C/EGD/1181,1181,EGD,-1,A/EGD/1169,4/2/1630,2030-02-04T00:00:00,4/2/1630,2030-02-04T00:00:00,,"Affleck,Margaret",,,,,,,FALSE,FALSE,FALSE,FALSE,FALSE,FALSE,FALSE,FALSE,FALSE,FALSE,FALSE,FALSE,FALSE,FALSE,FALSE,FALSE,FALSE,FALSE,FALSE,FALSE,FALSE,FALSE,FALSE,FALSE,FALSE,FALSE,FALSE,FALSE,FALSE,FALSE,0,,TRUE,TRUE,FALSE,FALSE,0,,FALSE,,FALSE,,FALSE,FALSE,FALSE,FALSE,FALSE,FALSE,FALSE,,,,FALSE,FALSE,FALSE,FALSE,FALSE,FALSE,FALSE,FALSE,FALSE,FALSE,,FALSE,FALSE,FALSE,FALSE,FALSE,FALSE,FALSE,FALSE,FALSE,FALSE,FALSE,FALSE,FALSE,FALSE,FALSE,FALSE,FALSE,,FALSE,FALSE,,,FALSE,FALSE,FALSE,FALSE,FALSE,,,SMD,2001-05-15T17:00:16,jhm,2002-10-02T15:00:08
C/EGD/1182,1182,EGD,-1,A/EGD/1170,4/2/1630,2030-02-04T00:00:00,4/2/1630,2030-02-04T00:00:00,,"Martine,Marion",,,,,,,FALSE,FALSE,FALSE,FALSE,FALSE,FALSE,FALSE,FALSE,FALSE,FALSE,FALSE,FALSE,FALSE,FALSE,FALSE,FALSE,FALSE,FALSE,FALSE,FALSE,FALSE,FALSE,FALSE,FALSE,FALSE,FALSE,FALSE,FALSE,FALSE,FALSE,0,,TRUE,TRUE,FALSE,FALSE,0,,FALSE,,FALSE,,FALSE,FALSE,FALSE,FALSE,FALSE,FALSE,FALSE,,,,FALSE,FALSE,FALSE,FALSE,FALSE,FALSE,FALSE,FALSE,FALSE,FALSE,,FALSE,FALSE,FALSE,FALSE,FALSE,FALSE,FALSE,FALSE,FALSE,FALSE,FALSE,FALSE,FALSE,FALSE,FALSE,FALSE,FALSE,,FALSE,FALSE,,,FALSE,FALSE,FALSE,FALSE,FALSE,,,SMD,2001-05-15T17:00:16,jhm,2002-10-02T15:01:20
C/EGD/1183,1183,EGD,-1,A/EGD/1171,4/2/1630,2030-02-04T00:00:00,4/2/1630,2030-02-04T00:00:00,,"Clerk,Jonet",,,,,,,FALSE,FALSE,FALSE,FALSE,FALSE,FALSE,FALSE,FALSE,FALSE,FALSE,FALSE,FALSE,FALSE,FALSE,FALSE,FALSE,FALSE,FALSE,FALSE,FALSE,FALSE,FALSE,FALSE,FALSE,FALSE,FALSE,FALSE,FALSE,FALSE,FALSE,0,,TRUE,TRUE,FALSE,FALSE,0,,FALSE,,FALSE,,FALSE,FALSE,FALSE,FALSE,FALSE,FALSE,FALSE,,,,FALSE,FALSE,FALSE,FALSE,FALSE,FALSE,FALSE,FALSE,FALSE,FALSE,,FALSE,FALSE,FALSE,FALSE,FALSE,FALSE,FALSE,FALSE,FALSE,FALSE,FALSE,FALSE,FALSE,FALSE,FALSE,FALSE,FALSE,,FALSE,FALSE,,,FALSE,FALSE,FALSE,FALSE,FALSE,,,SMD,2001-05-15T17:00:16,jhm,2002-10-02T15:02:03
C/EGD/1184,1184,EGD,-1,A/EGD/1172,4/2/1630,2030-02-04T00:00:00,4/2/1630,2030-02-04T00:00:00,,"Kirkpatrick,Agnes",,,,,,,FALSE,FALSE,FALSE,FALSE,FALSE,FALSE,FALSE,FALSE,FALSE,FALSE,FALSE,FALSE,FALSE,FALSE,FALSE,FALSE,FALSE,FALSE,FALSE,FALSE,FALSE,FALSE,FALSE,FALSE,FALSE,FALSE,FALSE,FALSE,FALSE,FALSE,0,,TRUE,TRUE,FALSE,FALSE,0,,FALSE,,FALSE,,FALSE,FALSE,FALSE,FALSE,FALSE,FALSE,FALSE,,,,FALSE,FALSE,FALSE,FALSE,FALSE,FALSE,FALSE,FALSE,FALSE,FALSE,,FALSE,FALSE,FALSE,FALSE,FALSE,FALSE,FALSE,FALSE,FALSE,FALSE,FALSE,FALSE,FALSE,FALSE,FALSE,FALSE,FALSE,,FALSE,FALSE,,,FALSE,FALSE,FALSE,FALSE,FALSE,,,SMD,2001-05-15T17:00:16,jhm,2002-10-02T15:03:41
C/EGD/1185,1185,EGD,-1,A/EGD/1173,4/2/1630,2030-02-04T00:00:00,4/2/1630,2030-02-04T00:00:00,,"Robsoun,Janet",,,,,,,FALSE,FALSE,FALSE,FALSE,FALSE,FALSE,FALSE,FALSE,FALSE,FALSE,FALSE,FALSE,FALSE,FALSE,FALSE,FALSE,FALSE,FALSE,FALSE,FALSE,FALSE,FALSE,FALSE,FALSE,FALSE,FALSE,FALSE,FALSE,FALSE,FALSE,0,,TRUE,TRUE,FALSE,FALSE,0,,FALSE,,FALSE,,FALSE,FALSE,FALSE,FALSE,FALSE,FALSE,FALSE,,,,FALSE,FALSE,FALSE,FALSE,FALSE,FALSE,FALSE,FALSE,FALSE,FALSE,,FALSE,FALSE,FALSE,FALSE,FALSE,FALSE,FALSE,FALSE,FALSE,FALSE,FALSE,FALSE,FALSE,FALSE,FALSE,FALSE,FALSE,,FALSE,FALSE,,,FALSE,FALSE,FALSE,FALSE,FALSE,,,SMD,2001-05-15T17:00:16,jhm,2002-10-02T15:04:20
C/EGD/1187,1187,EGD,-1,A/EGD/1175,9/2/1630,2030-02-09T00:00:00,9/2/1630,2030-02-09T00:00:00,,"Aslownae,Mawsie",,,,,,,FALSE,FALSE,FALSE,FALSE,FALSE,FALSE,FALSE,FALSE,FALSE,FALSE,FALSE,FALSE,FALSE,FALSE,FALSE,FALSE,FALSE,FALSE,FALSE,FALSE,FALSE,FALSE,FALSE,FALSE,FALSE,FALSE,FALSE,FALSE,FALSE,FALSE,0,,TRUE,TRUE,FALSE,FALSE,0,,FALSE,,FALSE,,FALSE,FALSE,FALSE,FALSE,FALSE,FALSE,FALSE,,,,FALSE,FALSE,FALSE,FALSE,FALSE,FALSE,FALSE,FALSE,FALSE,FALSE,,FALSE,FALSE,FALSE,FALSE,FALSE,FALSE,FALSE,FALSE,FALSE,FALSE,FALSE,FALSE,FALSE,FALSE,FALSE,FALSE,FALSE,,FALSE,FALSE,,,FALSE,FALSE,FALSE,FALSE,FALSE,,,SMD,2001-05-15T17:00:16,jhm,2002-10-02T15:05:15
C/EGD/1188,1188,EGD,-1,A/EGD/1176,11/2/1630,2030-02-11T00:00:00,11/2/1630,2030-02-11T00:00:00,,"Bladderstouns,Elspet",,,,,,,FALSE,FALSE,FALSE,FALSE,FALSE,FALSE,FALSE,FALSE,FALSE,FALSE,FALSE,FALSE,FALSE,FALSE,FALSE,FALSE,FALSE,FALSE,FALSE,FALSE,FALSE,FALSE,FALSE,FALSE,FALSE,FALSE,FALSE,FALSE,FALSE,FALSE,0,,TRUE,TRUE,FALSE,FALSE,0,,FALSE,,FALSE,,FALSE,FALSE,FALSE,FALSE,FALSE,FALSE,FALSE,,,,FALSE,FALSE,FALSE,FALSE,FALSE,FALSE,FALSE,FALSE,FALSE,FALSE,,FALSE,FALSE,FALSE,FALSE,FALSE,FALSE,FALSE,FALSE,FALSE,FALSE,FALSE,FALSE,FALSE,FALSE,FALSE,FALSE,FALSE,,FALSE,FALSE,,,FALSE,FALSE,FALSE,FALSE,FALSE,,,SMD,2001-05-15T17:00:16,jhm,2002-10-02T15:08:09
C/EGD/1189,1189,EGD,-1,A/EGD/1177,25/1/1630,2030-01-25T00:00:00,25/2/1630,2030-02-25T00:00:00,,"Andersoun,Margaret",,,,,,,FALSE,FALSE,FALSE,FALSE,FALSE,FALSE,FALSE,FALSE,FALSE,FALSE,FALSE,FALSE,FALSE,FALSE,FALSE,FALSE,FALSE,FALSE,FALSE,FALSE,FALSE,FALSE,FALSE,FALSE,FALSE,FALSE,FALSE,FALSE,FALSE,FALSE,0,,TRUE,TRUE,FALSE,FALSE,0,,FALSE,,FALSE,,FALSE,FALSE,FALSE,FALSE,FALSE,FALSE,FALSE,,,,FALSE,FALSE,FALSE,FALSE,FALSE,FALSE,FALSE,FALSE,FALSE,FALSE,,FALSE,FALSE,FALSE,FALSE,FALSE,FALSE,FALSE,FALSE,FALSE,FALSE,FALSE,FALSE,FALSE,FALSE,FALSE,FALSE,FALSE,,FALSE,FALSE,,,FALSE,FALSE,FALSE,FALSE,FALSE,,,SMD,2001-05-15T17:00:16,jhm,2002-10-02T15:08:51
C/EGD/119,119,EGD,-1,A/EGD/108,1591,1991-06-01T00:00:00,1591,1991-06-01T00:00:00,,"Ranking,Marion",,,,,,,FALSE,FALSE,FALSE,FALSE,FALSE,FALSE,FALSE,FALSE,FALSE,FALSE,FALSE,FALSE,FALSE,FALSE,FALSE,FALSE,FALSE,TRUE,FALSE,FALSE,FALSE,FALSE,FALSE,FALSE,FALSE,FALSE,FALSE,FALSE,FALSE,FALSE,1,,TRUE,TRUE,FALSE,FALSE,0,,FALSE,,FALSE,,FALSE,FALSE,FALSE,FALSE,FALSE,FALSE,FALSE,,,,FALSE,FALSE,FALSE,FALSE,FALSE,FALSE,FALSE,FALSE,FALSE,FALSE,,FALSE,FALSE,FALSE,FALSE,FALSE,FALSE,FALSE,FALSE,FALSE,FALSE,FALSE,FALSE,FALSE,FALSE,FALSE,FALSE,FALSE,,FALSE,FALSE,,,FALSE,FALSE,FALSE,FALSE,FALSE,,,SMD,2001-05-15T17:00:16,jhm,2002-10-02T15:09:40
C/EGD/1190,1190,EGD,-1,A/EGD/1178,25/2/1630,2030-02-25T00:00:00,25/2/1630,2030-02-25T00:00:00,,"Grig,Thomas",,,,,,,FALSE,FALSE,FALSE,FALSE,FALSE,FALSE,FALSE,FALSE,FALSE,FALSE,FALSE,FALSE,FALSE,FALSE,FALSE,FALSE,FALSE,FALSE,FALSE,FALSE,FALSE,FALSE,FALSE,FALSE,FALSE,FALSE,FALSE,FALSE,FALSE,FALSE,0,,TRUE,TRUE,FALSE,FALSE,0,,FALSE,,FALSE,,FALSE,FALSE,FALSE,FALSE,FALSE,FALSE,FALSE,,,,FALSE,FALSE,FALSE,FALSE,FALSE,FALSE,FALSE,FALSE,FALSE,FALSE,,FALSE,FALSE,FALSE,FALSE,FALSE,FALSE,FALSE,FALSE,FALSE,FALSE,FALSE,FALSE,FALSE,FALSE,FALSE,FALSE,FALSE,,FALSE,FALSE,,,FALSE,FALSE,FALSE,FALSE,FALSE,,,SMD,2001-05-15T17:00:16,LEM,2002-12-06T12:11:24
C/EGD/1191,1191,EGD,-1,A/EGD/1179,11/3/1630,2030-03-11T00:00:00,11/3/1630,2030-03-11T00:00:00,,"Ker,Jonet",,,,,,,FALSE,FALSE,FALSE,FALSE,FALSE,FALSE,FALSE,FALSE,FALSE,FALSE,FALSE,FALSE,FALSE,FALSE,FALSE,FALSE,FALSE,FALSE,FALSE,FALSE,FALSE,FALSE,FALSE,FALSE,FALSE,FALSE,FALSE,FALSE,FALSE,FALSE,0,,TRUE,TRUE,FALSE,FALSE,0,,FALSE,,FALSE,,FALSE,FALSE,FALSE,FALSE,FALSE,FALSE,FALSE,,,,FALSE,FALSE,FALSE,FALSE,FALSE,FALSE,FALSE,FALSE,FALSE,FALSE,,FALSE,FALSE,FALSE,FALSE,FALSE,FALSE,FALSE,FALSE,FALSE,FALSE,FALSE,FALSE,FALSE,FALSE,FALSE,FALSE,FALSE,,FALSE,FALSE,,,FALSE,FALSE,FALSE,FALSE,FALSE,,,SMD,2001-05-15T17:00:16,jhm,2002-10-02T15:12:39
C/EGD/1192,1192,EGD,-1,A/EGD/1180,11/3/1630,2030-03-11T00:00:00,11/3/1630,2030-03-11T00:00:00,,"Nisbitt,Bessie",,,,,,,FALSE,FALSE,FALSE,FALSE,FALSE,FALSE,FALSE,FALSE,FALSE,FALSE,FALSE,FALSE,FALSE,FALSE,FALSE,FALSE,FALSE,FALSE,FALSE,FALSE,FALSE,FALSE,FALSE,FALSE,FALSE,FALSE,FALSE,FALSE,FALSE,FALSE,0,,TRUE,TRUE,FALSE,FALSE,0,,FALSE,,FALSE,,FALSE,FALSE,FALSE,FALSE,FALSE,FALSE,FALSE,,,,FALSE,FALSE,FALSE,FALSE,FALSE,FALSE,FALSE,FALSE,FALSE,FALSE,,FALSE,FALSE,FALSE,FALSE,FALSE,FALSE,FALSE,FALSE,FALSE,FALSE,FALSE,FALSE,FALSE,FALSE,FALSE,FALSE,FALSE,,FALSE,FALSE,,,FALSE,FALSE,FALSE,FALSE,FALSE,,,SMD,2001-05-15T17:00:16,jhm,2002-10-02T15:13:55
C/EGD/1193,1193,EGD,-1,A/EGD/1181,15/4/1629,2029-04-15T00:00:00,11/3/1630,2030-03-11T00:00:00,,"Scot,Janet",,,,,,,FALSE,FALSE,FALSE,FALSE,FALSE,FALSE,FALSE,FALSE,FALSE,FALSE,FALSE,FALSE,FALSE,FALSE,FALSE,FALSE,FALSE,TRUE,FALSE,FALSE,FALSE,FALSE,FALSE,FALSE,FALSE,FALSE,FALSE,FALSE,FALSE,FALSE,1,,TRUE,TRUE,FALSE,FALSE,0,,FALSE,,FALSE,,FALSE,FALSE,FALSE,FALSE,FALSE,FALSE,FALSE,,,,FALSE,FALSE,FALSE,FALSE,FALSE,FALSE,FALSE,FALSE,FALSE,FALSE,,FALSE,FALSE,FALSE,FALSE,FALSE,FALSE,FALSE,FALSE,TRUE,FALSE,FALSE,FALSE,FALSE,FALSE,FALSE,FALSE,FALSE,,FALSE,FALSE,,,FALSE,FALSE,FALSE,FALSE,FALSE,,,SMD,2001-05-15T17:00:16,jhm,2002-10-02T15:14:52
C/EGD/1194,1194,EGD,-1,A/EGD/1182,11/3/1630,2030-03-11T00:00:00,11/3/1630,2030-03-11T00:00:00,,"Galbraith,Janet",,,,,,,FALSE,FALSE,FALSE,FALSE,FALSE,FALSE,FALSE,FALSE,FALSE,FALSE,FALSE,FALSE,FALSE,FALSE,FALSE,FALSE,FALSE,FALSE,FALSE,FALSE,FALSE,FALSE,FALSE,FALSE,FALSE,FALSE,FALSE,FALSE,FALSE,FALSE,0,,TRUE,TRUE,FALSE,FALSE,0,,FALSE,,FALSE,,FALSE,FALSE,FALSE,FALSE,FALSE,FALSE,FALSE,,,,FALSE,FALSE,FALSE,FALSE,FALSE,FALSE,FALSE,FALSE,FALSE,FALSE,,FALSE,FALSE,FALSE,FALSE,FALSE,FALSE,FALSE,FALSE,FALSE,FALSE,FALSE,FALSE,FALSE,FALSE,FALSE,FALSE,FALSE,,FALSE,FALSE,,,FALSE,FALSE,FALSE,FALSE,FALSE,,,SMD,2001-05-15T17:00:16,jhm,2002-10-02T15:16:43
C/EGD/1195,1195,EGD,-1,A/EGD/1183,11/3/1630,2030-03-11T00:00:00,11/3/1630,2030-03-11T00:00:00,,"Broun,William",,,,,,,FALSE,FALSE,FALSE,FALSE,FALSE,FALSE,FALSE,FALSE,FALSE,FALSE,FALSE,FALSE,FALSE,FALSE,FALSE,FALSE,FALSE,FALSE,FALSE,FALSE,FALSE,FALSE,FALSE,FALSE,FALSE,FALSE,FALSE,FALSE,FALSE,FALSE,0,,TRUE,TRUE,FALSE,FALSE,0,,FALSE,,FALSE,,FALSE,FALSE,FALSE,FALSE,FALSE,FALSE,FALSE,,,,FALSE,FALSE,FALSE,FALSE,FALSE,FALSE,FALSE,FALSE,FALSE,FALSE,,FALSE,FALSE,FALSE,FALSE,FALSE,FALSE,FALSE,FALSE,FALSE,FALSE,FALSE,FALSE,FALSE,FALSE,FALSE,FALSE,FALSE,,FALSE,FALSE,,,FALSE,FALSE,FALSE,FALSE,FALSE,,,SMD,2001-05-15T17:00:16,jhm,2002-10-02T15:17:25
C/EGD/1196,1196,EGD,-1,A/EGD/1184,11/3/1630,2030-03-11T00:00:00,11/3/1630,2030-03-11T00:00:00,,"Bissat,Helen",,,,,,,FALSE,FALSE,FALSE,FALSE,FALSE,FALSE,FALSE,FALSE,FALSE,FALSE,FALSE,FALSE,FALSE,FALSE,FALSE,FALSE,FALSE,FALSE,FALSE,FALSE,FALSE,FALSE,FALSE,FALSE,FALSE,FALSE,FALSE,FALSE,FALSE,FALSE,0,,TRUE,TRUE,FALSE,FALSE,0,,FALSE,,FALSE,,FALSE,FALSE,FALSE,FALSE,FALSE,FALSE,FALSE,,,,FALSE,FALSE,FALSE,FALSE,FALSE,FALSE,FALSE,FALSE,FALSE,FALSE,,FALSE,FALSE,FALSE,FALSE,FALSE,FALSE,FALSE,FALSE,FALSE,FALSE,FALSE,FALSE,FALSE,FALSE,FALSE,FALSE,FALSE,,FALSE,FALSE,,,FALSE,FALSE,FALSE,FALSE,FALSE,,,SMD,2001-05-15T17:00:16,jhm,2002-10-02T15:18:28
C/EGD/1197,1197,EGD,-1,A/EGD/1185,11/3/1630,2030-03-11T00:00:00,11/3/1630,2030-03-11T00:00:00,,"Guiddale,Bessie",,,,,,,FALSE,FALSE,FALSE,FALSE,FALSE,FALSE,FALSE,FALSE,FALSE,FALSE,FALSE,FALSE,FALSE,FALSE,FALSE,FALSE,FALSE,FALSE,FALSE,FALSE,FALSE,FALSE,FALSE,FALSE,FALSE,FALSE,FALSE,FALSE,FALSE,FALSE,0,,TRUE,TRUE,FALSE,FALSE,0,,FALSE,,FALSE,,FALSE,FALSE,FALSE,FALSE,FALSE,FALSE,FALSE,,,,FALSE,FALSE,FALSE,FALSE,FALSE,FALSE,FALSE,FALSE,FALSE,FALSE,,FALSE,FALSE,FALSE,FALSE,FALSE,FALSE,FALSE,FALSE,FALSE,FALSE,FALSE,FALSE,FALSE,FALSE,FALSE,FALSE,FALSE,,FALSE,FALSE,,,FALSE,FALSE,FALSE,FALSE,FALSE,,,SMD,2001-05-15T17:00:16,jhm,2002-10-02T15:19:16
C/EGD/1199,1199,EGD,-1,A/EGD/1187,20/3/1630,2030-03-20T00:00:00,20/3/1630,2030-03-20T00:00:00,,"Wilkie,Janet",,,,,,,FALSE,FALSE,FALSE,FALSE,FALSE,FALSE,FALSE,FALSE,FALSE,FALSE,FALSE,FALSE,FALSE,FALSE,FALSE,FALSE,FALSE,FALSE,FALSE,FALSE,FALSE,FALSE,FALSE,FALSE,FALSE,FALSE,FALSE,FALSE,FALSE,FALSE,0,,TRUE,TRUE,FALSE,FALSE,0,,FALSE,,FALSE,,FALSE,FALSE,FALSE,FALSE,FALSE,FALSE,FALSE,,,,FALSE,FALSE,FALSE,FALSE,FALSE,FALSE,FALSE,FALSE,FALSE,FALSE,,FALSE,FALSE,FALSE,FALSE,FALSE,FALSE,FALSE,FALSE,FALSE,FALSE,FALSE,FALSE,FALSE,FALSE,FALSE,FALSE,FALSE,,FALSE,FALSE,,,FALSE,FALSE,FALSE,FALSE,FALSE,,,SMD,2001-05-15T17:00:16,jhm,2002-10-02T15:20:17
C/EGD/12,12,EGD,0,,7/9/1649,2049-09-07T00:00:00,7/9/1649,2049-09-07T00:00:00,,9 unnamed witches,commission for trial and execution,,,,,9,FALSE,FALSE,FALSE,FALSE,FALSE,FALSE,FALSE,FALSE,FALSE,FALSE,FALSE,FALSE,FALSE,FALSE,FALSE,FALSE,FALSE,FALSE,FALSE,FALSE,FALSE,FALSE,FALSE,FALSE,FALSE,FALSE,FALSE,FALSE,FALSE,FALSE,0,,TRUE,TRUE,FALSE,FALSE,0,,FALSE,,FALSE,,FALSE,FALSE,FALSE,FALSE,FALSE,FALSE,FALSE,,,,FALSE,FALSE,FALSE,FALSE,FALSE,FALSE,FALSE,FALSE,FALSE,FALSE,,FALSE,FALSE,FALSE,FALSE,FALSE,FALSE,FALSE,FALSE,FALSE,FALSE,FALSE,FALSE,FALSE,FALSE,FALSE,FALSE,FALSE,,FALSE,FALSE,,,FALSE,FALSE,FALSE,FALSE,FALSE,,"(certain people) The commission was for people from Aberdour, Inverkeithing and Ormiston. It  probably includes 3 people from Inverkeithing (C/EGD/2612, C/EGD/2613 and C/EGD/2614) who have their own personal records.",SMD,2001-05-15T17:00:16,jhm,2002-07-30T15:56:36
C/EGD/120,120,EGD,-1,A/EGD/109,1/5/1590,1990-05-01T00:00:00,27/1/1591,1991-01-27T00:00:00,,"Thompson,Bessie",,,,,,,FALSE,FALSE,FALSE,FALSE,FALSE,TRUE,FALSE,FALSE,FALSE,FALSE,FALSE,FALSE,FALSE,TRUE,FALSE,FALSE,FALSE,TRUE,FALSE,FALSE,FALSE,FALSE,FALSE,FALSE,FALSE,FALSE,FALSE,TRUE,FALSE,FALSE,4,,TRUE,TRUE,FALSE,FALSE,0,"Part of the North Berwick witch hunt.  It involved many people and many accustions about witches meetings, specifically two separate attempts to sink the royal ships.  The first to sink Queen Anne on her way home, second to trouble King James after he went to get her in Denmark.",FALSE,,TRUE,,FALSE,TRUE,FALSE,FALSE,FALSE,FALSE,FALSE,,,Meeting described as having 9 people.  Questioned about the meeting at Newhaven with a wax image.  Confessed that she was present at the corpse raising in North Berwick.,FALSE,FALSE,FALSE,TRUE,FALSE,FALSE,FALSE,FALSE,FALSE,FALSE,,FALSE,FALSE,FALSE,FALSE,FALSE,FALSE,FALSE,FALSE,FALSE,FALSE,FALSE,FALSE,FALSE,FALSE,FALSE,FALSE,FALSE,,FALSE,FALSE,,,FALSE,FALSE,FALSE,FALSE,FALSE,,,SMD,2001-05-15T17:00:16,jhm,2002-10-10T14:59:48
C/EGD/1200,1200,EGD,-1,A/EGD/1188,1/4/1630,2030-04-01T00:00:00,1/4/1630,2030-04-01T00:00:00,,"Borthuick,Margaret",,,,,,,FALSE,FALSE,FALSE,FALSE,FALSE,FALSE,FALSE,FALSE,FALSE,FALSE,FALSE,FALSE,FALSE,FALSE,FALSE,FALSE,FALSE,TRUE,FALSE,FALSE,FALSE,FALSE,FALSE,FALSE,FALSE,FALSE,FALSE,FALSE,FALSE,FALSE,1,,TRUE,TRUE,FALSE,FALSE,0,,FALSE,,FALSE,,FALSE,FALSE,FALSE,FALSE,FALSE,FALSE,FALSE,,,,FALSE,FALSE,FALSE,FALSE,FALSE,FALSE,FALSE,FALSE,FALSE,FALSE,,FALSE,FALSE,FALSE,FALSE,FALSE,FALSE,FALSE,FALSE,FALSE,FALSE,FALSE,FALSE,FALSE,FALSE,FALSE,FALSE,FALSE,,FALSE,FALSE,,,FALSE,FALSE,FALSE,FALSE,FALSE,,,SMD,2001-05-15T17:00:16,jhm,2002-10-02T15:24:30
C/EGD/1201,1201,EGD,-1,A/EGD/1189,1/4/1630,2030-04-01T00:00:00,1/4/1630,2030-04-01T00:00:00,,"Selkirk,Elizabeth",,,,,,,FALSE,FALSE,FALSE,FALSE,FALSE,FALSE,FALSE,FALSE,FALSE,FALSE,FALSE,FALSE,FALSE,FALSE,FALSE,FALSE,FALSE,FALSE,FALSE,FALSE,FALSE,FALSE,FALSE,FALSE,FALSE,FALSE,FALSE,FALSE,FALSE,FALSE,0,,TRUE,TRUE,FALSE,FALSE,0,,FALSE,,FALSE,,FALSE,FALSE,FALSE,FALSE,FALSE,FALSE,FALSE,,,,FALSE,FALSE,FALSE,FALSE,FALSE,FALSE,FALSE,FALSE,FALSE,FALSE,,FALSE,FALSE,FALSE,FALSE,FALSE,FALSE,FALSE,FALSE,FALSE,FALSE,FALSE,FALSE,FALSE,FALSE,FALSE,FALSE,FALSE,,FALSE,FALSE,,,FALSE,FALSE,FALSE,FALSE,FALSE,,,SMD,2001-05-15T17:00:16,jhm,2002-10-02T15:27:17
C/EGD/1202,1202,EGD,-1,A/EGD/1190,21/4/1630,2030-04-21T00:00:00,21/4/1630,2030-04-21T00:00:00,,"Veitche,Margaret",,,,,,,FALSE,FALSE,FALSE,FALSE,FALSE,FALSE,FALSE,FALSE,FALSE,FALSE,FALSE,FALSE,FALSE,FALSE,FALSE,FALSE,FALSE,FALSE,FALSE,FALSE,FALSE,FALSE,FALSE,FALSE,FALSE,FALSE,FALSE,FALSE,FALSE,FALSE,0,,TRUE,TRUE,FALSE,FALSE,0,,FALSE,,FALSE,,FALSE,FALSE,FALSE,FALSE,FALSE,FALSE,FALSE,,,,FALSE,FALSE,FALSE,FALSE,FALSE,FALSE,FALSE,FALSE,FALSE,FALSE,,FALSE,FALSE,FALSE,FALSE,FALSE,FALSE,FALSE,FALSE,FALSE,FALSE,FALSE,FALSE,FALSE,FALSE,FALSE,FALSE,FALSE,,FALSE,FALSE,,,FALSE,FALSE,FALSE,FALSE,FALSE,,,SMD,2001-05-15T17:00:16,jhm,2002-10-02T15:26:14
C/EGD/1203,1203,EGD,-1,A/EGD/1191,21/4/1630,2030-04-21T00:00:00,21/4/1630,2030-04-21T00:00:00,,"Patersoun,Janet",,,,,,,FALSE,FALSE,FALSE,FALSE,FALSE,FALSE,FALSE,FALSE,FALSE,FALSE,FALSE,FALSE,FALSE,FALSE,FALSE,FALSE,FALSE,FALSE,FALSE,FALSE,FALSE,FALSE,FALSE,FALSE,FALSE,FALSE,FALSE,FALSE,FALSE,FALSE,0,,TRUE,TRUE,FALSE,FALSE,0,,FALSE,,FALSE,,FALSE,FALSE,FALSE,FALSE,FALSE,FALSE,FALSE,,,,FALSE,FALSE,FALSE,FALSE,FALSE,FALSE,FALSE,FALSE,FALSE,FALSE,,FALSE,FALSE,FALSE,FALSE,FALSE,FALSE,FALSE,FALSE,FALSE,FALSE,FALSE,FALSE,FALSE,FALSE,FALSE,FALSE,FALSE,,FALSE,FALSE,,,FALSE,FALSE,FALSE,FALSE,FALSE,,,SMD,2001-05-15T17:00:16,jhm,2002-10-02T15:29:02
C/EGD/1205,1205,EGD,-1,A/EGD/1193,21/4/1630,2030-04-21T00:00:00,21/4/1630,2030-04-21T00:00:00,,"Heriot,Margaret",,,,,,,FALSE,FALSE,FALSE,FALSE,FALSE,FALSE,FALSE,FALSE,FALSE,FALSE,FALSE,FALSE,FALSE,FALSE,FALSE,FALSE,FALSE,FALSE,FALSE,FALSE,FALSE,FALSE,FALSE,FALSE,FALSE,FALSE,FALSE,FALSE,FALSE,FALSE,0,,TRUE,TRUE,FALSE,FALSE,0,,FALSE,,FALSE,,FALSE,FALSE,FALSE,FALSE,FALSE,FALSE,FALSE,,,,FALSE,FALSE,FALSE,FALSE,FALSE,FALSE,FALSE,FALSE,FALSE,FALSE,,FALSE,FALSE,FALSE,FALSE,FALSE,FALSE,FALSE,FALSE,FALSE,FALSE,FALSE,FALSE,FALSE,FALSE,FALSE,FALSE,FALSE,,FALSE,FALSE,,,FALSE,FALSE,FALSE,FALSE,FALSE,,,SMD,2001-05-15T17:00:16,jhm,2002-10-02T15:34:32
C/EGD/1206,1206,EGD,-1,A/EGD/1194,21/4/1630,2030-04-21T00:00:00,21/4/1630,2030-04-21T00:00:00,,"Beverage,Janet",,,,,,,FALSE,FALSE,FALSE,FALSE,FALSE,FALSE,FALSE,FALSE,FALSE,FALSE,FALSE,FALSE,FALSE,FALSE,FALSE,FALSE,FALSE,FALSE,FALSE,FALSE,FALSE,FALSE,FALSE,FALSE,FALSE,FALSE,FALSE,FALSE,FALSE,FALSE,0,,TRUE,TRUE,FALSE,FALSE,0,,FALSE,,FALSE,,FALSE,FALSE,FALSE,FALSE,FALSE,FALSE,FALSE,,,,FALSE,FALSE,FALSE,FALSE,FALSE,FALSE,FALSE,FALSE,FALSE,FALSE,,FALSE,FALSE,FALSE,FALSE,FALSE,FALSE,FALSE,FALSE,FALSE,FALSE,FALSE,FALSE,FALSE,FALSE,FALSE,FALSE,FALSE,,FALSE,FALSE,,,FALSE,FALSE,FALSE,FALSE,FALSE,,,SMD,2001-05-15T17:00:16,jhm,2002-10-02T15:35:29
C/EGD/1207,1207,EGD,-1,A/EGD/1195,21/4/1630,2030-04-21T00:00:00,21/4/1630,2030-04-21T00:00:00,,"Neving,Alison",,,,,,,FALSE,FALSE,FALSE,FALSE,FALSE,FALSE,FALSE,FALSE,FALSE,FALSE,FALSE,FALSE,FALSE,FALSE,FALSE,FALSE,FALSE,FALSE,FALSE,FALSE,FALSE,FALSE,FALSE,FALSE,FALSE,FALSE,FALSE,FALSE,FALSE,FALSE,0,,TRUE,TRUE,FALSE,FALSE,0,,FALSE,,FALSE,,FALSE,FALSE,FALSE,FALSE,FALSE,FALSE,FALSE,,,,FALSE,FALSE,FALSE,FALSE,FALSE,FALSE,FALSE,FALSE,FALSE,FALSE,,FALSE,FALSE,FALSE,FALSE,FALSE,FALSE,FALSE,FALSE,FALSE,FALSE,FALSE,FALSE,FALSE,FALSE,FALSE,FALSE,FALSE,,FALSE,FALSE,,,FALSE,FALSE,FALSE,FALSE,FALSE,,,SMD,2001-05-15T17:00:16,jhm,2002-12-06T12:22:46
C/EGD/1208,1208,EGD,-1,A/EGD/1196,21/4/1630,2030-04-21T00:00:00,21/4/1630,2030-04-21T00:00:00,,"Dasoun,Margaret",,,,,,,FALSE,FALSE,FALSE,FALSE,FALSE,FALSE,FALSE,FALSE,FALSE,FALSE,FALSE,FALSE,FALSE,FALSE,FALSE,FALSE,FALSE,FALSE,FALSE,FALSE,FALSE,FALSE,FALSE,FALSE,FALSE,FALSE,FALSE,FALSE,FALSE,FALSE,0,,TRUE,TRUE,FALSE,FALSE,0,,FALSE,,FALSE,,FALSE,FALSE,FALSE,FALSE,FALSE,FALSE,FALSE,,,,FALSE,FALSE,FALSE,FALSE,FALSE,FALSE,FALSE,FALSE,FALSE,FALSE,,FALSE,FALSE,FALSE,FALSE,FALSE,FALSE,FALSE,FALSE,FALSE,FALSE,FALSE,FALSE,FALSE,FALSE,FALSE,FALSE,FALSE,,FALSE,FALSE,,,FALSE,FALSE,FALSE,FALSE,FALSE,,,SMD,2001-05-15T17:00:16,jhm,2002-10-02T15:38:23
C/EGD/1209,1209,EGD,-1,A/EGD/1197,26/5/1630,2030-05-26T00:00:00,10/6/1630,2030-06-10T00:00:00,,Samuelston (Home),,,,,,,FALSE,FALSE,FALSE,FALSE,FALSE,FALSE,FALSE,FALSE,FALSE,FALSE,FALSE,FALSE,FALSE,TRUE,FALSE,FALSE,FALSE,TRUE,FALSE,FALSE,FALSE,FALSE,FALSE,FALSE,FALSE,FALSE,FALSE,FALSE,FALSE,FALSE,2,,TRUE,TRUE,FALSE,FALSE,0,,FALSE,,FALSE,,FALSE,FALSE,FALSE,FALSE,FALSE,FALSE,FALSE,,,,FALSE,FALSE,FALSE,FALSE,FALSE,FALSE,FALSE,FALSE,FALSE,FALSE,,FALSE,TRUE,FALSE,FALSE,FALSE,FALSE,FALSE,FALSE,FALSE,FALSE,FALSE,FALSE,FALSE,FALSE,FALSE,FALSE,FALSE,,FALSE,FALSE,,,FALSE,FALSE,FALSE,FALSE,FALSE,,,SMD,2001-05-15T17:00:16,LEM,2001-11-20T15:18:01
C/EGD/121,121,EGD,-1,A/EGD/110,26/12/1590,1990-12-26T00:00:00,8/5/1591,1991-05-08T00:00:00,,"Grierson,Robert",,,,,,,FALSE,FALSE,FALSE,FALSE,FALSE,FALSE,FALSE,FALSE,FALSE,FALSE,FALSE,FALSE,FALSE,FALSE,FALSE,FALSE,FALSE,TRUE,FALSE,FALSE,FALSE,FALSE,FALSE,FALSE,FALSE,FALSE,FALSE,FALSE,FALSE,FALSE,1,,TRUE,TRUE,FALSE,FALSE,0,"Part of the North Berwick witch hunt.  It involved many people and many accustions about witches meetings, specifically two separate attempts to sink the royal ships.  The first to sink Queen Anne on her way home, second to trouble King James after he went to get her in Denmark.",FALSE,,FALSE,,FALSE,FALSE,FALSE,FALSE,FALSE,FALSE,FALSE,,,The meeting was like a party at see with good wine and ale.  Part of the planning of the conspiracy to sink James VI ships on the way back from Denmark.  See Agnes Sampson's case for description of North Berwick meeting (c/egd/63).  See also Napier (c/egd/103) for more detials about the North Berwick meeting.  In Makcalyean's trial he was described as the captain of the ship they destroyed at sea.,FALSE,FALSE,FALSE,FALSE,FALSE,FALSE,FALSE,FALSE,FALSE,FALSE,,FALSE,FALSE,FALSE,FALSE,FALSE,FALSE,FALSE,FALSE,FALSE,FALSE,FALSE,FALSE,FALSE,FALSE,FALSE,FALSE,FALSE,,FALSE,FALSE,Part of the witches' crew that tried to kill Ann of Denmark.,,FALSE,FALSE,FALSE,FALSE,FALSE,,,SMD,2001-05-15T17:00:16,LEM,2002-10-11T10:11:34
C/EGD/1210,1210,EGD,-1,A/EGD/1198,26/5/1630,2030-05-26T00:00:00,10/6/1630,2030-06-10T00:00:00,50,"Bankes,Marion",,,,,,,FALSE,FALSE,FALSE,FALSE,FALSE,FALSE,FALSE,FALSE,FALSE,FALSE,FALSE,FALSE,FALSE,FALSE,FALSE,FALSE,FALSE,FALSE,FALSE,FALSE,FALSE,FALSE,FALSE,FALSE,FALSE,FALSE,FALSE,FALSE,FALSE,FALSE,0,,TRUE,TRUE,FALSE,FALSE,0,Little information but as all the accused came from the same settlement and include a family it is possible there is some form of local dispute behind the accusations.,FALSE,,FALSE,,FALSE,FALSE,FALSE,FALSE,FALSE,FALSE,FALSE,,,,FALSE,FALSE,FALSE,FALSE,FALSE,FALSE,FALSE,FALSE,FALSE,FALSE,,FALSE,FALSE,FALSE,FALSE,FALSE,FALSE,FALSE,FALSE,FALSE,FALSE,FALSE,FALSE,FALSE,FALSE,FALSE,FALSE,FALSE,,FALSE,FALSE,,,FALSE,FALSE,FALSE,FALSE,FALSE,,Listed with 6 others.,SMD,2001-05-15T17:00:16,jhm,2002-10-03T09:44:16
C/EGD/1211,1211,EGD,-1,A/EGD/1199,26/5/1630,2030-05-26T00:00:00,10/6/1630,2030-06-10T00:00:00,,"Andersoun,Marioun",,,,,,,FALSE,FALSE,FALSE,FALSE,FALSE,FALSE,FALSE,FALSE,FALSE,FALSE,FALSE,FALSE,FALSE,FALSE,FALSE,FALSE,FALSE,FALSE,FALSE,FALSE,FALSE,FALSE,FALSE,FALSE,FALSE,FALSE,FALSE,FALSE,FALSE,FALSE,0,,TRUE,TRUE,FALSE,FALSE,0,No specific details about accusation but as group all came from same settlement it is possible there was some sort of local dispute.,FALSE,,FALSE,,FALSE,FALSE,FALSE,FALSE,FALSE,FALSE,FALSE,,,,FALSE,FALSE,FALSE,FALSE,FALSE,FALSE,FALSE,FALSE,FALSE,FALSE,,FALSE,FALSE,FALSE,FALSE,FALSE,FALSE,FALSE,FALSE,FALSE,FALSE,FALSE,FALSE,FALSE,FALSE,FALSE,FALSE,FALSE,,FALSE,FALSE,,,FALSE,FALSE,FALSE,FALSE,FALSE,,Listed with 6 others.,SMD,2001-05-15T17:00:16,jhm,2002-10-03T09:44:25
C/EGD/1212,1212,EGD,-1,A/EGD/1200,26/5/1630,2030-05-26T00:00:00,8/7/1630,2030-07-08T00:00:00,50,"Phenick,John",,,,,,,FALSE,FALSE,FALSE,FALSE,FALSE,FALSE,FALSE,FALSE,FALSE,FALSE,FALSE,FALSE,FALSE,FALSE,FALSE,FALSE,FALSE,FALSE,FALSE,FALSE,FALSE,FALSE,FALSE,FALSE,FALSE,FALSE,FALSE,FALSE,FALSE,FALSE,0,,TRUE,TRUE,FALSE,FALSE,0,Very little information about accusations but involved group from same settlement and also a family it seems likely that there was some local dispute behind the accusations.,FALSE,,FALSE,,FALSE,FALSE,FALSE,FALSE,FALSE,FALSE,FALSE,,,,FALSE,FALSE,FALSE,FALSE,FALSE,FALSE,FALSE,FALSE,FALSE,FALSE,,FALSE,FALSE,FALSE,FALSE,FALSE,FALSE,FALSE,FALSE,FALSE,FALSE,FALSE,FALSE,FALSE,FALSE,FALSE,FALSE,FALSE,,FALSE,FALSE,,,FALSE,FALSE,FALSE,FALSE,FALSE,,Listed with 6 others.,SMD,2001-05-15T17:00:16,jhm,2002-10-08T14:06:20
C/EGD/1213,1213,EGD,-1,A/EGD/1201,26/5/1630,2030-05-26T00:00:00,10/6/1630,2030-06-10T00:00:00,,"Swintoun,Giles",,,,,,,FALSE,FALSE,FALSE,FALSE,FALSE,FALSE,FALSE,FALSE,FALSE,FALSE,FALSE,FALSE,FALSE,FALSE,FALSE,FALSE,FALSE,FALSE,FALSE,FALSE,FALSE,FALSE,FALSE,FALSE,FALSE,FALSE,FALSE,FALSE,FALSE,FALSE,0,,TRUE,TRUE,FALSE,FALSE,0,"No information about accusations, but as group all came from same settlement some form of local dispute is possible",FALSE,,FALSE,,FALSE,FALSE,FALSE,FALSE,FALSE,FALSE,FALSE,,,,FALSE,FALSE,FALSE,FALSE,FALSE,FALSE,FALSE,FALSE,FALSE,FALSE,,FALSE,FALSE,FALSE,FALSE,FALSE,FALSE,FALSE,FALSE,FALSE,FALSE,FALSE,FALSE,FALSE,FALSE,FALSE,FALSE,FALSE,,FALSE,FALSE,,,FALSE,FALSE,FALSE,FALSE,FALSE,,Listed with 6 others,SMD,2001-05-15T17:00:16,jhm,2002-10-03T09:44:42
C/EGD/1214,1214,EGD,-1,A/EGD/1202,26/5/1630,2030-05-26T00:00:00,10/6/1630,2030-06-10T00:00:00,,"Steill,Christian",,,,,,,FALSE,FALSE,FALSE,FALSE,FALSE,FALSE,FALSE,FALSE,FALSE,FALSE,FALSE,FALSE,FALSE,FALSE,FALSE,FALSE,FALSE,FALSE,FALSE,FALSE,FALSE,FALSE,FALSE,FALSE,FALSE,FALSE,FALSE,FALSE,FALSE,FALSE,0,,TRUE,TRUE,FALSE,FALSE,0,"Some sort of neighbourhood dispute possible as group came from same settlement, but no details of specific accusations or confession",FALSE,,FALSE,,FALSE,FALSE,FALSE,FALSE,FALSE,FALSE,FALSE,,,,FALSE,FALSE,FALSE,FALSE,FALSE,FALSE,FALSE,FALSE,FALSE,FALSE,,FALSE,FALSE,FALSE,FALSE,FALSE,FALSE,FALSE,FALSE,FALSE,FALSE,FALSE,FALSE,FALSE,FALSE,FALSE,FALSE,FALSE,,FALSE,FALSE,,,FALSE,FALSE,FALSE,FALSE,FALSE,,listed with 6 others,SMD,2001-05-15T17:00:16,jhm,2002-10-03T09:44:56
C/EGD/1215,1215,EGD,-1,A/EGD/1203,26/5/1630,2030-05-26T00:00:00,10/6/1630,2030-06-10T00:00:00,,"Richardson,Janet",,,,,,,FALSE,FALSE,FALSE,FALSE,FALSE,FALSE,FALSE,FALSE,FALSE,FALSE,FALSE,FALSE,FALSE,FALSE,FALSE,FALSE,FALSE,FALSE,FALSE,FALSE,FALSE,FALSE,FALSE,FALSE,FALSE,FALSE,FALSE,FALSE,FALSE,FALSE,0,,TRUE,TRUE,FALSE,FALSE,0,group accused all from same settlement which suggests there may be some local dispute behind the accusations. No other details.,FALSE,,FALSE,,FALSE,FALSE,FALSE,FALSE,FALSE,FALSE,FALSE,,,,FALSE,FALSE,FALSE,FALSE,FALSE,FALSE,FALSE,FALSE,FALSE,FALSE,,FALSE,FALSE,FALSE,FALSE,FALSE,FALSE,FALSE,FALSE,FALSE,FALSE,FALSE,FALSE,FALSE,FALSE,FALSE,FALSE,FALSE,,FALSE,FALSE,,,FALSE,FALSE,FALSE,FALSE,FALSE,,listed with 6 others,SMD,2001-05-15T17:00:16,jhm,2002-10-03T09:46:02
C/EGD/1216,1216,EGD,-1,A/EGD/1204,26/5/1630,2030-05-26T00:00:00,10/6/1630,2030-06-10T00:00:00,25,"Phenick,Agnes",,,,,,,FALSE,FALSE,FALSE,FALSE,FALSE,FALSE,FALSE,FALSE,FALSE,FALSE,FALSE,FALSE,FALSE,FALSE,FALSE,FALSE,FALSE,FALSE,FALSE,FALSE,FALSE,FALSE,FALSE,FALSE,FALSE,FALSE,FALSE,FALSE,FALSE,FALSE,0,,TRUE,TRUE,FALSE,FALSE,0,"Little information but as it is a group accusation, all from the same settlement, it is possible that there was some sort of local issue behind the accusations.",FALSE,,FALSE,,FALSE,FALSE,FALSE,FALSE,FALSE,FALSE,FALSE,,,,FALSE,FALSE,FALSE,FALSE,FALSE,FALSE,FALSE,FALSE,FALSE,FALSE,,FALSE,FALSE,FALSE,FALSE,FALSE,FALSE,FALSE,FALSE,FALSE,FALSE,FALSE,FALSE,FALSE,FALSE,FALSE,FALSE,FALSE,,FALSE,FALSE,,,FALSE,FALSE,FALSE,FALSE,FALSE,,listed with 6 others.,SMD,2001-05-15T17:00:16,jhm,2002-10-08T14:06:37
C/EGD/1217,1217,EGD,-1,A/EGD/1205,1/6/1630,2030-06-01T00:00:00,1/6/1630,2030-06-01T00:00:00,,"Sinclare,Janet",,,,,,,FALSE,FALSE,FALSE,FALSE,FALSE,FALSE,FALSE,FALSE,FALSE,FALSE,FALSE,FALSE,FALSE,FALSE,FALSE,FALSE,FALSE,FALSE,FALSE,FALSE,FALSE,FALSE,FALSE,FALSE,FALSE,FALSE,FALSE,FALSE,FALSE,FALSE,0,,TRUE,TRUE,FALSE,FALSE,0,,FALSE,,FALSE,,FALSE,FALSE,FALSE,FALSE,FALSE,FALSE,FALSE,,,,FALSE,FALSE,FALSE,FALSE,FALSE,FALSE,FALSE,FALSE,FALSE,FALSE,,FALSE,FALSE,FALSE,FALSE,FALSE,FALSE,FALSE,FALSE,FALSE,FALSE,FALSE,FALSE,FALSE,FALSE,FALSE,FALSE,FALSE,,FALSE,FALSE,,,FALSE,FALSE,FALSE,FALSE,FALSE,,,SMD,2001-05-15T17:00:16,jhm,2002-10-03T09:51:12
C/EGD/1218,1218,EGD,-1,A/EGD/1206,1/6/1630,2030-06-01T00:00:00,1/6/1630,2030-06-01T00:00:00,,"Ray,John",,,,,,,FALSE,FALSE,FALSE,FALSE,FALSE,FALSE,FALSE,FALSE,FALSE,FALSE,FALSE,FALSE,FALSE,FALSE,FALSE,FALSE,FALSE,FALSE,FALSE,FALSE,FALSE,FALSE,FALSE,FALSE,FALSE,FALSE,FALSE,FALSE,FALSE,FALSE,0,,TRUE,TRUE,FALSE,FALSE,0,,FALSE,,FALSE,,FALSE,FALSE,FALSE,FALSE,FALSE,FALSE,FALSE,,,,FALSE,FALSE,FALSE,FALSE,FALSE,FALSE,FALSE,FALSE,FALSE,FALSE,,FALSE,FALSE,FALSE,FALSE,FALSE,FALSE,FALSE,FALSE,FALSE,FALSE,FALSE,FALSE,FALSE,FALSE,FALSE,FALSE,FALSE,,FALSE,FALSE,,,FALSE,FALSE,FALSE,FALSE,FALSE,,,SMD,2001-05-15T17:00:16,jhm,2002-10-03T09:51:57
C/EGD/1219,1219,EGD,-1,A/EGD/1207,1/6/1630,2030-06-01T00:00:00,1/6/1630,2030-06-01T00:00:00,,"Weir,Agnes",,,,,,,FALSE,FALSE,FALSE,FALSE,FALSE,FALSE,FALSE,FALSE,FALSE,FALSE,FALSE,FALSE,FALSE,FALSE,FALSE,FALSE,FALSE,FALSE,FALSE,FALSE,FALSE,FALSE,FALSE,FALSE,FALSE,FALSE,FALSE,FALSE,FALSE,FALSE,0,,TRUE,TRUE,FALSE,FALSE,0,,FALSE,,FALSE,,FALSE,FALSE,FALSE,FALSE,FALSE,FALSE,FALSE,,,,FALSE,FALSE,FALSE,FALSE,FALSE,FALSE,FALSE,FALSE,FALSE,FALSE,,FALSE,FALSE,FALSE,FALSE,FALSE,FALSE,FALSE,FALSE,FALSE,FALSE,FALSE,FALSE,FALSE,FALSE,FALSE,FALSE,FALSE,,FALSE,FALSE,,,FALSE,FALSE,FALSE,FALSE,FALSE,,,SMD,2001-05-15T17:00:16,jhm,2002-10-03T09:52:42
C/EGD/1220,1220,EGD,-1,A/EGD/1208,1/6/1630,2030-06-01T00:00:00,1/6/1630,2030-06-01T00:00:00,,"Fergusson,Janet",,,,,,,FALSE,FALSE,FALSE,FALSE,FALSE,FALSE,FALSE,FALSE,FALSE,FALSE,FALSE,FALSE,FALSE,FALSE,FALSE,FALSE,FALSE,FALSE,FALSE,FALSE,FALSE,FALSE,FALSE,FALSE,FALSE,FALSE,FALSE,FALSE,FALSE,FALSE,0,,TRUE,TRUE,FALSE,FALSE,0,,FALSE,,FALSE,,FALSE,FALSE,FALSE,FALSE,FALSE,FALSE,FALSE,,,,FALSE,FALSE,FALSE,FALSE,FALSE,FALSE,FALSE,FALSE,FALSE,FALSE,,FALSE,FALSE,FALSE,FALSE,FALSE,FALSE,FALSE,FALSE,FALSE,FALSE,FALSE,FALSE,FALSE,FALSE,FALSE,FALSE,FALSE,,FALSE,FALSE,,,FALSE,FALSE,FALSE,FALSE,FALSE,,,SMD,2001-05-15T17:00:16,jhm,2002-10-03T09:53:19
C/EGD/1221,1221,EGD,-1,A/EGD/1209,1/6/1630,2030-06-01T00:00:00,1/6/1630,2030-06-01T00:00:00,,"Moffat,Isobel",,,,,,,FALSE,FALSE,FALSE,FALSE,FALSE,FALSE,FALSE,FALSE,FALSE,FALSE,FALSE,FALSE,FALSE,FALSE,FALSE,FALSE,FALSE,FALSE,FALSE,FALSE,FALSE,FALSE,FALSE,FALSE,FALSE,FALSE,FALSE,FALSE,FALSE,FALSE,0,,TRUE,TRUE,FALSE,FALSE,0,,FALSE,,FALSE,,FALSE,FALSE,FALSE,FALSE,FALSE,FALSE,FALSE,,,,FALSE,FALSE,FALSE,FALSE,FALSE,FALSE,FALSE,FALSE,FALSE,FALSE,,FALSE,FALSE,FALSE,FALSE,FALSE,FALSE,FALSE,FALSE,FALSE,FALSE,FALSE,FALSE,FALSE,FALSE,FALSE,FALSE,FALSE,,FALSE,FALSE,,,FALSE,FALSE,FALSE,FALSE,FALSE,,,SMD,2001-05-15T17:00:16,jhm,2002-10-03T09:54:08
C/EGD/1222,1222,EGD,-1,A/EGD/1210,1/6/1630,2030-06-01T00:00:00,1/6/1630,2030-06-01T00:00:00,,"Herries,Janet",,,,,,,FALSE,FALSE,FALSE,FALSE,FALSE,FALSE,FALSE,FALSE,FALSE,FALSE,FALSE,FALSE,FALSE,FALSE,FALSE,FALSE,FALSE,FALSE,FALSE,FALSE,FALSE,FALSE,FALSE,FALSE,FALSE,FALSE,FALSE,FALSE,FALSE,FALSE,0,,TRUE,TRUE,FALSE,FALSE,0,,FALSE,,FALSE,,FALSE,FALSE,FALSE,FALSE,FALSE,FALSE,FALSE,,,,FALSE,FALSE,FALSE,FALSE,FALSE,FALSE,FALSE,FALSE,FALSE,FALSE,,FALSE,FALSE,FALSE,FALSE,FALSE,FALSE,FALSE,FALSE,FALSE,FALSE,FALSE,FALSE,FALSE,FALSE,FALSE,FALSE,FALSE,,FALSE,FALSE,,,FALSE,FALSE,FALSE,FALSE,FALSE,,,SMD,2001-05-15T17:00:16,jhm,2002-10-03T09:55:17
C/EGD/1223,1223,EGD,-1,A/EGD/1211,8/6/1630,2030-06-08T00:00:00,8/6/1630,2030-06-08T00:00:00,,"Ritchie,Marion",,,,,,,FALSE,FALSE,FALSE,FALSE,FALSE,FALSE,FALSE,FALSE,FALSE,FALSE,FALSE,FALSE,FALSE,FALSE,FALSE,FALSE,FALSE,FALSE,FALSE,FALSE,FALSE,FALSE,FALSE,FALSE,FALSE,FALSE,FALSE,FALSE,FALSE,FALSE,0,,TRUE,TRUE,FALSE,FALSE,0,,FALSE,,FALSE,,FALSE,FALSE,FALSE,FALSE,FALSE,FALSE,FALSE,,,,FALSE,FALSE,FALSE,FALSE,FALSE,FALSE,FALSE,FALSE,FALSE,FALSE,,FALSE,FALSE,FALSE,FALSE,FALSE,FALSE,FALSE,FALSE,FALSE,FALSE,FALSE,FALSE,FALSE,FALSE,FALSE,FALSE,FALSE,,FALSE,FALSE,,,FALSE,FALSE,FALSE,FALSE,FALSE,,,SMD,2001-05-15T17:00:16,jhm,2002-10-03T09:55:59
C/EGD/1224,1224,EGD,-1,A/EGD/1212,22/6/1630,2030-06-22T00:00:00,5/7/1631,2031-07-05T00:00:00,,"Wilson,Katherine",,,,,,,FALSE,FALSE,FALSE,FALSE,FALSE,FALSE,FALSE,FALSE,FALSE,FALSE,FALSE,FALSE,FALSE,TRUE,FALSE,FALSE,FALSE,TRUE,TRUE,TRUE,FALSE,FALSE,FALSE,FALSE,FALSE,FALSE,FALSE,FALSE,FALSE,FALSE,4,,FALSE,TRUE,FALSE,FALSE,0,"She was implicated by Alexander Hammiltoun and persued by James Mowat, Sheriff clerk of Berwick.  She was accused of participating in a supposed conspiracy to kill Sir George Home of Manderston, and many other justice officials in the area.  The depositions against her were declared by the PC to be falsifications by Mowat.  That said, numerous neighbourhood witnesses came forward to testify to quarrels and curses followed by misfortunes.",FALSE,"It was alleged in her dittay that she had sex with the Devil behind the hills, and that he had sex with every other woman at the meeting.",TRUE,,TRUE,FALSE,FALSE,FALSE,FALSE,FALSE,FALSE,,,,FALSE,FALSE,FALSE,FALSE,FALSE,FALSE,FALSE,FALSE,FALSE,FALSE,"She was accused of being part of a conspiracy to kill Manderston by putting a dead bird in his barn and by leaving a dead hand in his path.  Investigators supposedly destroyed some material evidence, including a wax image of Mowat,  by burning.  The fire was described as unnaturally big.",TRUE,TRUE,FALSE,FALSE,FALSE,FALSE,FALSE,FALSE,FALSE,FALSE,TRUE,TRUE,FALSE,FALSE,FALSE,FALSE,FALSE,"lots of quarrels followed by illnesses following disputes over land, rent, and other daily dealings.  She seems particularly quarrlesome.",TRUE,TRUE,,,FALSE,FALSE,FALSE,FALSE,FALSE,,,SMD,2001-05-15T17:00:16,LEM,2002-11-18T16:02:45
C/EGD/1225,1225,EGD,-1,A/EGD/1213,7/8/1623,2023-08-07T00:00:00,13/7/1631,2031-07-13T00:00:00,44,"Smith,John",,,,,,,FALSE,FALSE,FALSE,FALSE,FALSE,FALSE,FALSE,FALSE,FALSE,FALSE,FALSE,FALSE,FALSE,TRUE,FALSE,FALSE,FALSE,TRUE,FALSE,FALSE,FALSE,FALSE,FALSE,FALSE,FALSE,FALSE,FALSE,FALSE,FALSE,FALSE,2,,TRUE,TRUE,FALSE,FALSE,0,"He was implicated by Alexander Hammiltoun and persued by James Mowat, Sheriff clerk of Berwick.   He was accused of being part of a conspiracy to kill Sir George Home of Manderston and other justice officials (a bailie, a clerk, and a minister's wife).  The depositions against him were declared by PC to be falsifications by Mowat.  A small bit about quarrels and misfortune, but his whole dittay was dominated by the supposed conspiracy.",FALSE,Smith supposedly witnessed the Devil having sex with all the women at the meeting and said it was 'behind lyk beistis ilk ane eftir uther'.  But he himself was not described as having a physical relationship with the Devil.,TRUE,,TRUE,FALSE,FALSE,FALSE,FALSE,TRUE,FALSE,,,"The meeting was populated with witches and fairies.  He was supposedly seen by a non-witch witness at the coldingham Law meeting.  The other witches and fairies disappeared leaving Smith there, the witness then followed him home and found him in bed.",FALSE,FALSE,FALSE,FALSE,FALSE,FALSE,FALSE,FALSE,TRUE,FALSE,"He was accused of consulting with the Devil to cure himself.  He was told to put his wet shirt in the doorway of a witch (presumably and unwitching strategy, the 'witch' in question being his supposed bewitcher). He was also accused of being part of the supposed conpiracy to kill Manderston by leaving a dead bird in his barn and a dead hand in his path.  He was also accused of stealing the shoe of Mowat and buring it as a way of harming him.",FALSE,FALSE,FALSE,FALSE,FALSE,FALSE,FALSE,FALSE,FALSE,TRUE,FALSE,FALSE,FALSE,FALSE,FALSE,FALSE,FALSE,He tried to remove his own bewitchment.,FALSE,TRUE,,,FALSE,FALSE,FALSE,FALSE,FALSE,,,SMD,2001-05-15T17:00:16,LEM,2002-11-18T16:36:52
C/EGD/1226,1226,EGD,-1,A/EGD/1214,15/7/1629,2029-07-15T00:00:00,22/6/1630,2030-06-22T00:00:00,,"Coline,Alesone",,,,,,,FALSE,FALSE,FALSE,FALSE,FALSE,FALSE,FALSE,FALSE,FALSE,FALSE,FALSE,FALSE,FALSE,FALSE,FALSE,FALSE,FALSE,TRUE,FALSE,FALSE,FALSE,FALSE,FALSE,FALSE,FALSE,FALSE,FALSE,FALSE,FALSE,FALSE,1,,TRUE,TRUE,FALSE,FALSE,0,"Denounced by Alexander Hammilton (c/egd/166).  Accused of being part of a supposed plot to kill Sir George Home of Manderston and other justice officials working with him to investigate witches.  The others includes James Mowat, writer to the Signet, a bailie and the minister's wife.  Also suspected of being involved in a plot devised by Lady Samuelston to kill her husband.",FALSE,"She supposedly had sex with the Devil behind some hills, and he had sex with every other woman there.",TRUE,,TRUE,FALSE,FALSE,FALSE,FALSE,FALSE,FALSE,,,,FALSE,FALSE,FALSE,FALSE,FALSE,FALSE,FALSE,FALSE,FALSE,FALSE,,FALSE,FALSE,FALSE,FALSE,FALSE,FALSE,FALSE,FALSE,FALSE,FALSE,FALSE,FALSE,FALSE,FALSE,FALSE,FALSE,FALSE,Hammilton said she wanted the power to kill people from the Devil.,FALSE,FALSE,,,FALSE,FALSE,FALSE,FALSE,FALSE,,"She is described as being the same person as Alisone Nisbet (c/egd/170) by a modern hand in JC26/10, but I do not think they were the same.  They are described as being from different places and the 'Coline' accusations differ from the 'Nisbet' ones.",SMD,2001-05-15T17:00:16,LEM,2002-11-18T16:28:58
C/EGD/1227,1227,EGD,-1,A/EGD/1215,17/6/1630,2030-06-17T00:00:00,17/6/1630,2030-06-17T00:00:00,,"Wilson,Janet",,,,,,,FALSE,FALSE,FALSE,FALSE,FALSE,FALSE,FALSE,FALSE,FALSE,FALSE,FALSE,FALSE,FALSE,FALSE,FALSE,FALSE,FALSE,FALSE,FALSE,FALSE,FALSE,FALSE,FALSE,FALSE,FALSE,FALSE,FALSE,FALSE,FALSE,FALSE,0,,TRUE,TRUE,FALSE,FALSE,0,,FALSE,,FALSE,,FALSE,FALSE,FALSE,FALSE,FALSE,FALSE,FALSE,,,,FALSE,FALSE,FALSE,FALSE,FALSE,FALSE,FALSE,FALSE,FALSE,FALSE,,FALSE,FALSE,FALSE,FALSE,FALSE,FALSE,FALSE,FALSE,FALSE,FALSE,FALSE,FALSE,FALSE,FALSE,FALSE,FALSE,FALSE,,FALSE,FALSE,,,FALSE,FALSE,FALSE,FALSE,FALSE,,,SMD,2001-05-15T17:00:16,jhm,2002-10-03T10:03:47
C/EGD/1228,1228,EGD,-1,A/EGD/1216,17/6/1630,2030-06-17T00:00:00,17/6/1630,2030-06-17T00:00:00,,"McNaught,Isobel",,,,,,,FALSE,FALSE,FALSE,FALSE,FALSE,FALSE,FALSE,FALSE,FALSE,FALSE,FALSE,FALSE,FALSE,FALSE,FALSE,FALSE,FALSE,FALSE,FALSE,FALSE,FALSE,FALSE,FALSE,FALSE,FALSE,FALSE,FALSE,FALSE,FALSE,FALSE,0,,TRUE,TRUE,FALSE,FALSE,0,,FALSE,,FALSE,,FALSE,FALSE,FALSE,FALSE,FALSE,FALSE,FALSE,,,,FALSE,FALSE,FALSE,FALSE,FALSE,FALSE,FALSE,FALSE,FALSE,FALSE,,FALSE,FALSE,FALSE,FALSE,FALSE,FALSE,FALSE,FALSE,FALSE,FALSE,FALSE,FALSE,FALSE,FALSE,FALSE,FALSE,FALSE,,FALSE,FALSE,,,FALSE,FALSE,FALSE,FALSE,FALSE,,,SMD,2001-05-15T17:00:16,jhm,2002-10-03T10:04:42
C/EGD/1229,1229,EGD,-1,A/EGD/1217,17/6/1630,2030-06-17T00:00:00,17/6/1630,2030-06-17T00:00:00,,"Major,Katharine",,,,,,,FALSE,FALSE,FALSE,FALSE,FALSE,FALSE,FALSE,FALSE,FALSE,FALSE,FALSE,FALSE,FALSE,FALSE,FALSE,FALSE,FALSE,FALSE,FALSE,FALSE,FALSE,FALSE,FALSE,FALSE,FALSE,FALSE,FALSE,FALSE,FALSE,FALSE,0,,TRUE,TRUE,FALSE,FALSE,0,,FALSE,,FALSE,,FALSE,FALSE,FALSE,FALSE,FALSE,FALSE,FALSE,,,,FALSE,FALSE,FALSE,FALSE,FALSE,FALSE,FALSE,FALSE,FALSE,FALSE,,FALSE,FALSE,FALSE,FALSE,FALSE,FALSE,FALSE,FALSE,FALSE,FALSE,FALSE,FALSE,FALSE,FALSE,FALSE,FALSE,FALSE,,FALSE,FALSE,,,FALSE,FALSE,FALSE,FALSE,FALSE,,,SMD,2001-05-15T17:00:16,jhm,2002-10-03T10:07:08
C/EGD/123,123,EGD,-1,A/EGD/112,1593,1993-06-01T00:00:00,1593,1993-06-01T00:00:00,,"Muirhead,Katherine",,,,,,,FALSE,FALSE,FALSE,FALSE,FALSE,FALSE,FALSE,FALSE,FALSE,FALSE,FALSE,FALSE,FALSE,FALSE,FALSE,FALSE,FALSE,FALSE,FALSE,FALSE,FALSE,FALSE,FALSE,FALSE,FALSE,FALSE,FALSE,FALSE,FALSE,FALSE,0,,TRUE,TRUE,FALSE,FALSE,0,,FALSE,,FALSE,,FALSE,FALSE,FALSE,FALSE,FALSE,FALSE,FALSE,,,,FALSE,FALSE,FALSE,FALSE,FALSE,FALSE,FALSE,FALSE,FALSE,FALSE,,FALSE,FALSE,FALSE,FALSE,FALSE,FALSE,FALSE,FALSE,FALSE,FALSE,FALSE,FALSE,FALSE,FALSE,FALSE,FALSE,FALSE,,FALSE,FALSE,,,FALSE,FALSE,FALSE,FALSE,FALSE,,,SMD,2001-05-15T17:00:16,LEM,2002-12-05T12:29:39
C/EGD/1230,1230,EGD,-1,A/EGD/1218,17/6/1630,2030-06-17T00:00:00,17/6/1630,2030-06-17T00:00:00,,"Haliday,Margaret",,,,,,,FALSE,FALSE,FALSE,FALSE,FALSE,FALSE,FALSE,FALSE,FALSE,FALSE,FALSE,FALSE,FALSE,FALSE,FALSE,FALSE,FALSE,FALSE,FALSE,FALSE,FALSE,FALSE,FALSE,FALSE,FALSE,FALSE,FALSE,FALSE,FALSE,FALSE,0,,TRUE,TRUE,FALSE,FALSE,0,,FALSE,,FALSE,,FALSE,FALSE,FALSE,FALSE,FALSE,FALSE,FALSE,,,,FALSE,FALSE,FALSE,FALSE,FALSE,FALSE,FALSE,FALSE,FALSE,FALSE,,FALSE,FALSE,FALSE,FALSE,FALSE,FALSE,FALSE,FALSE,FALSE,FALSE,FALSE,FALSE,FALSE,FALSE,FALSE,FALSE,FALSE,,FALSE,FALSE,,,FALSE,FALSE,FALSE,FALSE,FALSE,,,SMD,2001-05-15T17:00:16,jhm,2002-10-03T10:10:00
C/EGD/1231,1231,EGD,-1,A/EGD/1219,29/4/1630,2030-04-29T00:00:00,22/6/1630,2030-06-22T00:00:00,,"Mitchell,Bessie",,,,,,,FALSE,FALSE,FALSE,FALSE,FALSE,FALSE,FALSE,FALSE,FALSE,FALSE,FALSE,FALSE,FALSE,FALSE,FALSE,FALSE,FALSE,FALSE,FALSE,FALSE,FALSE,FALSE,FALSE,FALSE,FALSE,FALSE,FALSE,FALSE,FALSE,FALSE,0,,TRUE,TRUE,FALSE,FALSE,0,,FALSE,,FALSE,,FALSE,FALSE,FALSE,FALSE,FALSE,FALSE,FALSE,,,,FALSE,FALSE,FALSE,FALSE,FALSE,FALSE,FALSE,FALSE,FALSE,FALSE,,FALSE,FALSE,FALSE,FALSE,FALSE,FALSE,FALSE,FALSE,FALSE,FALSE,FALSE,FALSE,FALSE,FALSE,FALSE,FALSE,FALSE,,FALSE,FALSE,,,FALSE,FALSE,FALSE,FALSE,FALSE,,,SMD,2001-05-15T17:00:16,jhm,2002-10-03T10:10:24
C/EGD/1233,1233,EGD,-1,A/EGD/1221,6/5/1630,2030-05-06T00:00:00,6/7/1630,2030-07-06T00:00:00,,"Aroane,Marion",,,,,,,FALSE,FALSE,FALSE,FALSE,FALSE,FALSE,FALSE,FALSE,FALSE,FALSE,FALSE,FALSE,FALSE,FALSE,FALSE,FALSE,FALSE,FALSE,FALSE,FALSE,FALSE,FALSE,FALSE,FALSE,FALSE,FALSE,FALSE,FALSE,FALSE,FALSE,0,,TRUE,TRUE,FALSE,FALSE,0,,FALSE,,FALSE,,FALSE,FALSE,FALSE,FALSE,FALSE,FALSE,FALSE,,,,FALSE,FALSE,FALSE,FALSE,FALSE,FALSE,FALSE,FALSE,FALSE,FALSE,,FALSE,FALSE,FALSE,FALSE,FALSE,FALSE,FALSE,FALSE,FALSE,FALSE,FALSE,FALSE,FALSE,FALSE,FALSE,FALSE,FALSE,,FALSE,FALSE,,,FALSE,FALSE,FALSE,FALSE,FALSE,,,SMD,2001-05-15T17:00:16,jhm,2002-10-03T10:12:59
C/EGD/1234,1234,EGD,-1,A/EGD/1222,8/7/1630,2030-07-08T00:00:00,8/7/1630,2030-07-08T00:00:00,,"Watsoun,Elspet",,,,,,,FALSE,FALSE,FALSE,FALSE,FALSE,FALSE,FALSE,FALSE,FALSE,FALSE,FALSE,FALSE,FALSE,FALSE,FALSE,FALSE,FALSE,FALSE,FALSE,FALSE,FALSE,FALSE,FALSE,FALSE,FALSE,FALSE,FALSE,FALSE,FALSE,FALSE,0,,TRUE,TRUE,FALSE,FALSE,0,,FALSE,,FALSE,,FALSE,FALSE,FALSE,FALSE,FALSE,FALSE,FALSE,,,,FALSE,FALSE,FALSE,FALSE,FALSE,FALSE,FALSE,FALSE,FALSE,FALSE,,FALSE,FALSE,FALSE,FALSE,FALSE,FALSE,FALSE,FALSE,FALSE,FALSE,FALSE,FALSE,FALSE,FALSE,FALSE,FALSE,FALSE,,FALSE,FALSE,,,FALSE,FALSE,FALSE,FALSE,FALSE,,,SMD,2001-05-15T17:00:16,jhm,2002-10-03T10:13:56
C/EGD/1236,1236,EGD,-1,A/EGD/1224,9/8/1630,2030-08-09T00:00:00,9/8/1630,2030-08-09T00:00:00,,"Moir,Dod nine siacke",,,,,,,FALSE,FALSE,FALSE,FALSE,FALSE,FALSE,FALSE,FALSE,FALSE,FALSE,FALSE,FALSE,FALSE,FALSE,FALSE,FALSE,FALSE,FALSE,FALSE,FALSE,FALSE,FALSE,FALSE,FALSE,FALSE,FALSE,FALSE,FALSE,FALSE,FALSE,0,,TRUE,TRUE,FALSE,FALSE,0,,FALSE,,FALSE,,FALSE,FALSE,FALSE,FALSE,FALSE,FALSE,FALSE,,,,FALSE,FALSE,FALSE,FALSE,FALSE,FALSE,FALSE,FALSE,FALSE,FALSE,,FALSE,FALSE,FALSE,FALSE,FALSE,FALSE,FALSE,FALSE,FALSE,FALSE,FALSE,FALSE,FALSE,FALSE,FALSE,FALSE,FALSE,,FALSE,FALSE,,,FALSE,FALSE,FALSE,FALSE,FALSE,,,SMD,2001-05-15T17:00:16,LEM,2002-12-06T14:46:26
C/EGD/1237,1237,EGD,-1,A/EGD/1225,9/8/1630,2030-08-09T00:00:00,9/8/1630,2030-08-09T00:00:00,,"Moir,Janet",,,,,,,FALSE,FALSE,FALSE,FALSE,FALSE,FALSE,FALSE,FALSE,FALSE,FALSE,FALSE,FALSE,FALSE,FALSE,FALSE,FALSE,FALSE,FALSE,FALSE,FALSE,FALSE,FALSE,FALSE,FALSE,FALSE,FALSE,FALSE,FALSE,FALSE,FALSE,0,,TRUE,TRUE,FALSE,FALSE,0,,FALSE,,FALSE,,FALSE,FALSE,FALSE,FALSE,FALSE,FALSE,FALSE,,,,FALSE,FALSE,FALSE,FALSE,FALSE,FALSE,FALSE,FALSE,FALSE,FALSE,,FALSE,FALSE,FALSE,FALSE,FALSE,FALSE,FALSE,FALSE,FALSE,FALSE,FALSE,FALSE,FALSE,FALSE,FALSE,FALSE,FALSE,,FALSE,FALSE,,,FALSE,FALSE,FALSE,FALSE,FALSE,,,SMD,2001-05-15T17:00:16,LEM,2002-12-06T14:46:34
C/EGD/1238,1238,EGD,-1,A/EGD/1226,9/8/1630,2030-08-09T00:00:00,9/8/1630,2030-08-09T00:00:00,,"Wallace,Janet",,,,,,,FALSE,FALSE,FALSE,FALSE,FALSE,FALSE,FALSE,FALSE,FALSE,FALSE,FALSE,FALSE,FALSE,FALSE,FALSE,FALSE,FALSE,FALSE,FALSE,FALSE,FALSE,FALSE,FALSE,FALSE,FALSE,FALSE,FALSE,FALSE,FALSE,FALSE,0,,TRUE,TRUE,FALSE,FALSE,0,,FALSE,,FALSE,,FALSE,FALSE,FALSE,FALSE,FALSE,FALSE,FALSE,,,,FALSE,FALSE,FALSE,FALSE,FALSE,FALSE,FALSE,FALSE,FALSE,FALSE,,FALSE,FALSE,FALSE,FALSE,FALSE,FALSE,FALSE,FALSE,FALSE,FALSE,FALSE,FALSE,FALSE,FALSE,FALSE,FALSE,FALSE,,FALSE,FALSE,,,FALSE,FALSE,FALSE,FALSE,FALSE,,,SMD,2001-05-15T17:00:16,jhm,2002-10-03T10:17:01
C/EGD/1239,1239,EGD,-1,A/EGD/1227,9/8/1630,2030-08-09T00:00:00,9/8/1630,2030-08-09T00:00:00,,"McGillichoan,Janet",,,,,,,FALSE,FALSE,FALSE,FALSE,FALSE,FALSE,FALSE,FALSE,FALSE,FALSE,FALSE,FALSE,FALSE,FALSE,FALSE,FALSE,FALSE,FALSE,FALSE,FALSE,FALSE,FALSE,FALSE,FALSE,FALSE,FALSE,FALSE,FALSE,FALSE,FALSE,0,,TRUE,TRUE,FALSE,FALSE,0,,FALSE,,FALSE,,FALSE,FALSE,FALSE,FALSE,FALSE,FALSE,FALSE,,,,FALSE,FALSE,FALSE,FALSE,FALSE,FALSE,FALSE,FALSE,FALSE,FALSE,,FALSE,FALSE,FALSE,FALSE,FALSE,FALSE,FALSE,FALSE,FALSE,FALSE,FALSE,FALSE,FALSE,FALSE,FALSE,FALSE,FALSE,,FALSE,FALSE,,,FALSE,FALSE,FALSE,FALSE,FALSE,,,SMD,2001-05-15T17:00:16,jhm,2002-10-03T10:18:58
C/EGD/124,124,EGD,-1,A/EGD/113,23/5/1589,1989-05-23T00:00:00,10/8/1593,1993-08-10T00:00:00,,"Stewart, Earl of Bothwell,Francis",,,,,,,FALSE,FALSE,TRUE,TRUE,FALSE,FALSE,FALSE,FALSE,FALSE,FALSE,FALSE,FALSE,FALSE,TRUE,FALSE,FALSE,FALSE,TRUE,FALSE,FALSE,FALSE,TRUE,FALSE,FALSE,FALSE,FALSE,FALSE,TRUE,FALSE,FALSE,6,,FALSE,FALSE,FALSE,FALSE,0,He was charged with consulting Richard Graham and other witches.,FALSE,,FALSE,,FALSE,FALSE,FALSE,FALSE,FALSE,FALSE,FALSE,,,,FALSE,FALSE,FALSE,TRUE,FALSE,FALSE,FALSE,FALSE,FALSE,FALSE,"Accused of being involved in the use of wax images, poison and other means to kill King James.  The poison was made from flesh off the forehead of a newly calved foal and the skin of an adder.  Also accused of being part of incantations and triangle making to raise spirits to help him destroy the king.",FALSE,FALSE,FALSE,FALSE,FALSE,FALSE,FALSE,FALSE,FALSE,FALSE,FALSE,FALSE,FALSE,FALSE,FALSE,FALSE,FALSE,,FALSE,FALSE,,,FALSE,FALSE,FALSE,FALSE,FALSE,,"Charges went back to 1589, when it was claimed he led a band of 'broken men and borderers' against the king. The charges of treason were elaborated with those of necromancy and witchcraft later. He was in ward in Edinburgh Castle 15 April 1591 and escaped 21/6/1591.  He was linked to the North Bewick cases and was believed to have consulted with witches for the destruction of James VI.  Bothwell was stripped of lands.  He was forgiven all charges on 14/8/1593.  Charges against him were reopened again on 20/9/1594 when he joined with the Catholic lords",SMD,2001-05-15T17:00:16,LEM,2002-10-10T14:34:53
C/EGD/1241,1241,EGD,-1,A/EGD/1229,8/9/1630,2030-09-08T00:00:00,20/4/1631,2031-04-20T00:00:00,,"Cowper,Mallie",,,,,,,FALSE,FALSE,FALSE,FALSE,FALSE,TRUE,FALSE,FALSE,FALSE,FALSE,FALSE,FALSE,FALSE,TRUE,FALSE,FALSE,TRUE,TRUE,FALSE,FALSE,FALSE,FALSE,FALSE,FALSE,FALSE,FALSE,FALSE,FALSE,FALSE,FALSE,4,,FALSE,TRUE,FALSE,FALSE,0,,FALSE,,TRUE,,TRUE,FALSE,FALSE,FALSE,FALSE,FALSE,FALSE,,,"Marion Hardie (c/la/2876) confessed this whole group of witches cast a number of stones in the water mouth when a boat was coming in, in order to destroy it and its crew.",FALSE,FALSE,FALSE,TRUE,FALSE,FALSE,FALSE,FALSE,TRUE,FALSE,,FALSE,TRUE,FALSE,FALSE,FALSE,FALSE,FALSE,FALSE,FALSE,FALSE,FALSE,FALSE,FALSE,FALSE,FALSE,FALSE,FALSE,,TRUE,FALSE,Allegedly sunk a ship.,,FALSE,FALSE,FALSE,FALSE,FALSE,,,SMD,2001-05-15T17:00:16,jhm,2002-10-03T10:31:00
C/EGD/1242,1242,EGD,-1,A/EGD/1230,8/9/1630,2030-09-08T00:00:00,20/4/1631,2031-04-20T00:00:00,,"Rodgie,Marion",,,,,,,FALSE,FALSE,FALSE,FALSE,FALSE,TRUE,FALSE,FALSE,FALSE,FALSE,FALSE,FALSE,FALSE,TRUE,FALSE,FALSE,TRUE,TRUE,FALSE,FALSE,FALSE,FALSE,FALSE,FALSE,FALSE,FALSE,FALSE,FALSE,FALSE,FALSE,4,,FALSE,TRUE,FALSE,FALSE,0,,FALSE,,TRUE,,TRUE,FALSE,FALSE,FALSE,FALSE,FALSE,FALSE,,,"Marion Hardie (c/la/2876) confessed this whole group of witches cast a number of stones in the water mouth when a boat was coming in, in order to destroy it and its crew.",FALSE,FALSE,FALSE,TRUE,FALSE,FALSE,FALSE,FALSE,TRUE,FALSE,,FALSE,TRUE,FALSE,FALSE,FALSE,FALSE,FALSE,FALSE,FALSE,FALSE,FALSE,FALSE,FALSE,FALSE,FALSE,FALSE,FALSE,,TRUE,FALSE,,,FALSE,FALSE,FALSE,FALSE,FALSE,,,SMD,2001-05-15T17:00:16,LEM,2002-12-06T14:46:43
C/EGD/1243,1243,EGD,-1,A/EGD/1231,8/9/1630,2030-09-08T00:00:00,8/9/1630,2030-09-08T00:00:00,,"Lumsden,Margaret",,,,,,,FALSE,FALSE,FALSE,FALSE,FALSE,TRUE,FALSE,FALSE,FALSE,FALSE,FALSE,FALSE,FALSE,TRUE,FALSE,FALSE,TRUE,TRUE,FALSE,FALSE,FALSE,FALSE,FALSE,FALSE,FALSE,FALSE,FALSE,FALSE,FALSE,FALSE,4,,FALSE,TRUE,FALSE,FALSE,0,,FALSE,,TRUE,,TRUE,FALSE,FALSE,FALSE,FALSE,FALSE,FALSE,,,"Marion Hardie (c/la/2876) confessed this whole group of witches cast a number of stones in the water mouth when a boat was coming in, in order to destroy it and its crew.",FALSE,FALSE,FALSE,TRUE,FALSE,FALSE,FALSE,FALSE,TRUE,FALSE,,FALSE,TRUE,FALSE,FALSE,FALSE,FALSE,FALSE,FALSE,FALSE,FALSE,FALSE,FALSE,FALSE,FALSE,FALSE,FALSE,FALSE,,TRUE,FALSE,,,FALSE,FALSE,FALSE,FALSE,FALSE,,,SMD,2001-05-15T17:00:16,jhm,2002-10-03T10:37:08
C/EGD/1244,1244,EGD,-1,A/EGD/1232,8/9/1630,2030-09-08T00:00:00,8/9/1630,2030-09-08T00:00:00,,"Unknown,Unknown",,,,,,,FALSE,FALSE,FALSE,FALSE,FALSE,TRUE,FALSE,FALSE,FALSE,FALSE,FALSE,FALSE,FALSE,TRUE,FALSE,FALSE,TRUE,TRUE,FALSE,FALSE,FALSE,FALSE,FALSE,FALSE,FALSE,FALSE,FALSE,FALSE,FALSE,FALSE,4,,FALSE,TRUE,FALSE,FALSE,0,,FALSE,,TRUE,,TRUE,FALSE,FALSE,FALSE,FALSE,FALSE,FALSE,,,"Marion Hardie (c/la/2876) confessed this whole group of witches cast a number of stones in the water mouth when a boat was coming in, in order to destroy it and its crew.",FALSE,FALSE,FALSE,TRUE,FALSE,FALSE,FALSE,FALSE,TRUE,FALSE,,FALSE,TRUE,FALSE,FALSE,FALSE,FALSE,FALSE,FALSE,FALSE,FALSE,FALSE,FALSE,FALSE,FALSE,FALSE,FALSE,FALSE,,TRUE,FALSE,,,FALSE,FALSE,FALSE,FALSE,FALSE,,,SMD,2001-05-15T17:00:16,jhm,2002-11-21T14:01:41
C/EGD/1245,1245,EGD,-1,A/EGD/1233,8/9/1630,2030-09-08T00:00:00,8/9/1630,2030-09-08T00:00:00,,"Cowie,Unknown",,,,,,,FALSE,FALSE,FALSE,FALSE,FALSE,TRUE,FALSE,FALSE,FALSE,FALSE,FALSE,FALSE,FALSE,TRUE,FALSE,FALSE,TRUE,TRUE,FALSE,FALSE,FALSE,FALSE,FALSE,FALSE,FALSE,FALSE,FALSE,FALSE,FALSE,FALSE,4,,FALSE,TRUE,FALSE,FALSE,0,,FALSE,,TRUE,,TRUE,FALSE,FALSE,FALSE,FALSE,FALSE,FALSE,,,"Marion Hardie (c/la/2876) confessed this whole group of witches cast a number of stones in the water mouth when a boat was coming in, in order to destroy it and its crew.",FALSE,FALSE,FALSE,TRUE,FALSE,FALSE,FALSE,FALSE,TRUE,FALSE,,FALSE,TRUE,FALSE,FALSE,FALSE,FALSE,FALSE,FALSE,FALSE,FALSE,FALSE,FALSE,FALSE,FALSE,FALSE,FALSE,FALSE,,TRUE,FALSE,,,FALSE,FALSE,FALSE,FALSE,FALSE,,,SMD,2001-05-15T17:00:16,jhm,2002-11-21T13:49:42
C/EGD/1246,1246,EGD,-1,A/EGD/1234,8/9/1630,2030-09-08T00:00:00,8/9/1630,2030-09-08T00:00:00,,"Buchane,Margaret",,,,,,,FALSE,FALSE,FALSE,FALSE,FALSE,TRUE,FALSE,FALSE,FALSE,FALSE,FALSE,FALSE,FALSE,TRUE,FALSE,FALSE,TRUE,TRUE,FALSE,FALSE,FALSE,FALSE,FALSE,FALSE,FALSE,FALSE,FALSE,FALSE,FALSE,FALSE,4,,FALSE,TRUE,FALSE,FALSE,0,,FALSE,,TRUE,,TRUE,FALSE,FALSE,FALSE,FALSE,FALSE,FALSE,,,"Marion Hardie (c/la/2876) confessed this whole group of witches cast a number of stones in the water mouth when a boat was coming in, in order to destroy it and its crew.",FALSE,FALSE,FALSE,TRUE,FALSE,FALSE,FALSE,FALSE,TRUE,FALSE,,FALSE,TRUE,FALSE,FALSE,FALSE,FALSE,FALSE,FALSE,FALSE,FALSE,FALSE,FALSE,FALSE,FALSE,FALSE,FALSE,FALSE,,TRUE,FALSE,,,FALSE,FALSE,FALSE,FALSE,FALSE,,,SMD,2001-05-15T17:00:16,jhm,2002-10-03T10:38:19
C/EGD/1247,1247,EGD,-1,A/EGD/1235,8/9/1630,2030-09-08T00:00:00,8/9/1630,2030-09-08T00:00:00,,"Gilchrist,Margaret",,,,,,,FALSE,FALSE,FALSE,FALSE,FALSE,TRUE,FALSE,FALSE,FALSE,FALSE,FALSE,FALSE,FALSE,TRUE,FALSE,FALSE,TRUE,TRUE,FALSE,FALSE,FALSE,FALSE,FALSE,FALSE,FALSE,FALSE,FALSE,FALSE,FALSE,FALSE,4,,FALSE,TRUE,FALSE,FALSE,0,,FALSE,,TRUE,,TRUE,FALSE,FALSE,FALSE,FALSE,FALSE,FALSE,,,"Marion Hardie (c/la/2876) confessed this whole group of witches cast a number of stones in the water mouth when a boat was coming in, in order to destroy it and its crew.",FALSE,FALSE,FALSE,TRUE,FALSE,FALSE,FALSE,FALSE,TRUE,FALSE,,FALSE,TRUE,FALSE,FALSE,FALSE,FALSE,FALSE,FALSE,FALSE,FALSE,FALSE,FALSE,FALSE,FALSE,FALSE,FALSE,FALSE,,TRUE,FALSE,,,FALSE,FALSE,FALSE,FALSE,FALSE,,,SMD,2001-05-15T17:00:16,jhm,2002-10-03T10:40:16
C/EGD/1248,1248,EGD,-1,A/EGD/1236,8/9/1630,2030-09-08T00:00:00,8/9/1630,2030-09-08T00:00:00,,"Ritchie,Margaret",,,,,,,FALSE,FALSE,FALSE,FALSE,FALSE,TRUE,FALSE,FALSE,FALSE,FALSE,FALSE,FALSE,FALSE,TRUE,FALSE,FALSE,TRUE,TRUE,FALSE,FALSE,FALSE,FALSE,FALSE,FALSE,FALSE,FALSE,FALSE,FALSE,FALSE,FALSE,4,,FALSE,TRUE,FALSE,FALSE,0,,FALSE,,TRUE,,TRUE,FALSE,FALSE,FALSE,FALSE,FALSE,FALSE,,,"Marion Hardie (c/la/2876) confessed this whole group of witches cast a number of stones in the water mouth when a boat was coming in, in order to destroy it and its crew.",FALSE,FALSE,FALSE,TRUE,FALSE,FALSE,FALSE,FALSE,TRUE,FALSE,,FALSE,TRUE,FALSE,FALSE,FALSE,FALSE,FALSE,FALSE,FALSE,FALSE,FALSE,FALSE,FALSE,FALSE,FALSE,FALSE,FALSE,,TRUE,FALSE,,,FALSE,FALSE,FALSE,FALSE,FALSE,,,SMD,2001-05-15T17:00:16,jhm,2002-10-03T10:41:58
C/EGD/1249,1249,EGD,-1,A/EGD/1237,8/9/1630,2030-09-08T00:00:00,8/9/1630,2030-09-08T00:00:00,,"Buchan,Margaret",,,,,,,FALSE,FALSE,FALSE,FALSE,FALSE,TRUE,FALSE,FALSE,FALSE,FALSE,FALSE,FALSE,FALSE,TRUE,FALSE,FALSE,TRUE,TRUE,FALSE,FALSE,FALSE,FALSE,FALSE,FALSE,FALSE,FALSE,FALSE,FALSE,FALSE,FALSE,4,,FALSE,TRUE,FALSE,FALSE,0,,FALSE,,TRUE,,TRUE,FALSE,FALSE,FALSE,FALSE,FALSE,FALSE,,,"Marion Hardie (c/la/2876) confessed this whole group of witches cast a number of stones in the water mouth when a boat was coming in, in order to destroy it and its crew.",FALSE,FALSE,FALSE,TRUE,FALSE,FALSE,FALSE,FALSE,TRUE,FALSE,,FALSE,TRUE,FALSE,FALSE,FALSE,FALSE,FALSE,FALSE,FALSE,FALSE,FALSE,FALSE,FALSE,FALSE,FALSE,FALSE,FALSE,,TRUE,FALSE,,,FALSE,FALSE,FALSE,FALSE,FALSE,,,SMD,2001-05-15T17:00:16,jhm,2002-10-03T10:42:47
C/EGD/1250,1250,EGD,-1,A/EGD/1238,8/9/1630,2030-09-08T00:00:00,8/9/1630,2030-09-08T00:00:00,,"Small,Margaret",,,,,,,FALSE,FALSE,FALSE,FALSE,FALSE,TRUE,FALSE,FALSE,FALSE,FALSE,FALSE,FALSE,FALSE,TRUE,FALSE,FALSE,TRUE,TRUE,FALSE,FALSE,FALSE,FALSE,FALSE,FALSE,FALSE,FALSE,FALSE,FALSE,FALSE,FALSE,4,,FALSE,TRUE,FALSE,FALSE,0,,FALSE,,TRUE,,TRUE,FALSE,FALSE,FALSE,FALSE,FALSE,FALSE,,,"Marion Hardie (c/la/2876) confessed this whole group of witches cast a number of stones in the water mouth when a boat was coming in, in order to destroy it and its crew.",FALSE,FALSE,FALSE,TRUE,FALSE,FALSE,FALSE,FALSE,TRUE,FALSE,,FALSE,TRUE,FALSE,FALSE,FALSE,FALSE,FALSE,FALSE,FALSE,FALSE,FALSE,FALSE,FALSE,FALSE,FALSE,FALSE,FALSE,,TRUE,FALSE,,,FALSE,FALSE,FALSE,FALSE,FALSE,,,SMD,2001-05-15T17:00:16,jhm,2002-10-03T10:44:49
C/EGD/1251,1251,EGD,-1,A/EGD/1239,8/9/1630,2030-09-08T00:00:00,8/9/1630,2030-09-08T00:00:00,,"Whyte,Margaret",,,,,,,FALSE,FALSE,FALSE,FALSE,FALSE,TRUE,FALSE,FALSE,FALSE,FALSE,FALSE,FALSE,FALSE,TRUE,FALSE,FALSE,TRUE,TRUE,FALSE,FALSE,FALSE,FALSE,FALSE,FALSE,FALSE,FALSE,FALSE,FALSE,FALSE,FALSE,4,,FALSE,TRUE,FALSE,FALSE,0,,FALSE,,TRUE,,TRUE,FALSE,FALSE,FALSE,FALSE,FALSE,FALSE,,,"Marion Hardie (c/la/2876) confessed this whole group of witches cast a number of stones in the water mouth when a boat was coming in, in order to destroy it and its crew.",FALSE,FALSE,FALSE,TRUE,FALSE,FALSE,FALSE,FALSE,TRUE,FALSE,,FALSE,TRUE,FALSE,FALSE,FALSE,FALSE,FALSE,FALSE,FALSE,FALSE,FALSE,FALSE,FALSE,FALSE,FALSE,FALSE,FALSE,,TRUE,FALSE,,,FALSE,FALSE,FALSE,FALSE,FALSE,,,SMD,2001-05-15T17:00:16,jhm,2002-10-03T10:50:10
C/EGD/1252,1252,EGD,-1,A/EGD/1240,8/9/1630,2030-09-08T00:00:00,8/9/1630,2030-09-08T00:00:00,,"Fisher,Margaret",,,,,,,FALSE,FALSE,FALSE,FALSE,FALSE,TRUE,FALSE,FALSE,FALSE,FALSE,FALSE,FALSE,FALSE,TRUE,FALSE,FALSE,TRUE,TRUE,FALSE,FALSE,FALSE,FALSE,FALSE,FALSE,FALSE,FALSE,FALSE,FALSE,FALSE,FALSE,4,,FALSE,TRUE,FALSE,FALSE,0,,FALSE,,TRUE,,TRUE,FALSE,FALSE,FALSE,FALSE,FALSE,FALSE,,,"Marion Hardie (c/la/2876) confessed this whole group of witches cast a number of stones in the water mouth when a boat was coming in, in order to destroy it and its crew.",FALSE,FALSE,FALSE,TRUE,FALSE,FALSE,FALSE,FALSE,TRUE,FALSE,,FALSE,TRUE,FALSE,FALSE,FALSE,FALSE,FALSE,FALSE,FALSE,FALSE,FALSE,FALSE,FALSE,FALSE,FALSE,FALSE,FALSE,,TRUE,FALSE,,,FALSE,FALSE,FALSE,FALSE,FALSE,,,SMD,2001-05-15T17:00:16,jhm,2002-10-03T10:51:04
C/EGD/1253,1253,EGD,-1,A/EGD/1241,8/9/1630,2030-09-08T00:00:00,8/9/1630,2030-09-08T00:00:00,,"Tod,Patrick",,,,,,,FALSE,FALSE,FALSE,FALSE,FALSE,FALSE,FALSE,FALSE,FALSE,FALSE,FALSE,FALSE,FALSE,FALSE,FALSE,FALSE,FALSE,FALSE,FALSE,FALSE,FALSE,FALSE,FALSE,FALSE,FALSE,FALSE,FALSE,FALSE,FALSE,FALSE,0,,TRUE,TRUE,FALSE,FALSE,0,,FALSE,,FALSE,,FALSE,FALSE,FALSE,FALSE,FALSE,FALSE,FALSE,,,,FALSE,FALSE,FALSE,FALSE,FALSE,FALSE,FALSE,FALSE,FALSE,FALSE,,FALSE,FALSE,FALSE,FALSE,FALSE,FALSE,FALSE,FALSE,FALSE,FALSE,FALSE,FALSE,FALSE,FALSE,FALSE,FALSE,FALSE,,FALSE,FALSE,,,FALSE,FALSE,FALSE,FALSE,FALSE,,,SMD,2001-05-15T17:00:16,jhm,2002-10-03T10:53:04
C/EGD/1254,1254,EGD,-1,A/EGD/1242,2/11/1630,2030-11-02T00:00:00,14/12/1630,2030-12-14T00:00:00,,"Boyd,Agnes",,,,,,,FALSE,FALSE,FALSE,FALSE,FALSE,FALSE,FALSE,FALSE,FALSE,FALSE,FALSE,FALSE,FALSE,FALSE,FALSE,FALSE,FALSE,FALSE,FALSE,FALSE,FALSE,FALSE,FALSE,FALSE,FALSE,FALSE,FALSE,FALSE,FALSE,FALSE,0,,TRUE,TRUE,FALSE,FALSE,0,She appears to have claimed that Mr George Sempill taught her charming and the last entry in RPC notes that since she was only accused of charming they did not know what to do about her.,FALSE,,FALSE,,FALSE,FALSE,FALSE,FALSE,FALSE,FALSE,FALSE,,,,FALSE,FALSE,FALSE,FALSE,FALSE,FALSE,FALSE,FALSE,FALSE,FALSE,,FALSE,FALSE,FALSE,FALSE,FALSE,FALSE,FALSE,FALSE,FALSE,FALSE,FALSE,FALSE,FALSE,FALSE,FALSE,FALSE,FALSE,,FALSE,FALSE,,,FALSE,FALSE,FALSE,FALSE,FALSE,,,SMD,2001-05-15T17:00:16,jhm,2002-10-03T10:54:01
C/EGD/1255,1255,EGD,-1,A/EGD/1243,8/9/1630,2030-09-08T00:00:00,14/12/1630,2030-12-14T00:00:00,,"Sempill,George",,,,,,,FALSE,FALSE,FALSE,FALSE,FALSE,FALSE,FALSE,FALSE,FALSE,FALSE,FALSE,FALSE,FALSE,FALSE,FALSE,FALSE,FALSE,TRUE,FALSE,FALSE,FALSE,FALSE,FALSE,FALSE,FALSE,FALSE,FALSE,FALSE,FALSE,FALSE,1,,TRUE,TRUE,FALSE,FALSE,0,,FALSE,,FALSE,,FALSE,FALSE,FALSE,FALSE,FALSE,FALSE,FALSE,,,,FALSE,FALSE,FALSE,FALSE,FALSE,FALSE,FALSE,FALSE,FALSE,FALSE,,FALSE,FALSE,FALSE,FALSE,FALSE,FALSE,FALSE,FALSE,FALSE,FALSE,FALSE,FALSE,FALSE,FALSE,FALSE,FALSE,FALSE,,FALSE,FALSE,,,FALSE,FALSE,FALSE,FALSE,FALSE,,,SMD,2001-05-15T17:00:16,LEM,2002-11-13T11:30:34
C/EGD/1257,1257,EGD,-1,A/EGD/1245,11/1/1631,2031-01-11T00:00:00,11/1/1631,2031-01-11T00:00:00,50,"Purcell,Bessie",,,,,,,FALSE,FALSE,FALSE,FALSE,FALSE,FALSE,FALSE,FALSE,FALSE,FALSE,FALSE,FALSE,FALSE,FALSE,FALSE,FALSE,FALSE,FALSE,FALSE,FALSE,FALSE,FALSE,FALSE,FALSE,FALSE,FALSE,FALSE,FALSE,FALSE,FALSE,0,,TRUE,TRUE,FALSE,FALSE,0,,FALSE,,FALSE,,FALSE,FALSE,FALSE,FALSE,FALSE,FALSE,FALSE,,,,FALSE,FALSE,FALSE,FALSE,FALSE,FALSE,FALSE,FALSE,FALSE,FALSE,,FALSE,FALSE,FALSE,FALSE,FALSE,FALSE,FALSE,FALSE,FALSE,FALSE,FALSE,FALSE,FALSE,FALSE,FALSE,FALSE,FALSE,,FALSE,FALSE,,,FALSE,FALSE,FALSE,FALSE,FALSE,,,SMD,2001-05-15T17:00:16,jhm,2002-10-03T10:59:34
C/EGD/1258,1258,EGD,-1,A/EGD/1246,8/9/1630,2030-09-08T00:00:00,22/2/1631,2031-02-22T00:00:00,,"Philip,John",,,,,,,FALSE,FALSE,FALSE,FALSE,FALSE,FALSE,FALSE,FALSE,FALSE,TRUE,TRUE,TRUE,FALSE,FALSE,FALSE,FALSE,FALSE,FALSE,FALSE,FALSE,FALSE,FALSE,FALSE,FALSE,FALSE,FALSE,FALSE,FALSE,FALSE,FALSE,3,,FALSE,FALSE,FALSE,TRUE,1,Definitely a folk healer who refused to stop his trade after being rebuked and banished by many kirk sessions.,FALSE,,FALSE,,FALSE,FALSE,FALSE,FALSE,FALSE,FALSE,FALSE,,,,TRUE,FALSE,TRUE,TRUE,FALSE,FALSE,FALSE,FALSE,TRUE,FALSE,"He healed someone of the fever with the Queen of Fairy.  The belt had been put around the waist of a dead bairn before being used to cure a cow.  Used plaits of their hair.  'confessit he knew quhan weshing or charming [wes to be] useit and that weshing was not to be useit bot quhen there was bewitching.'  He was descibed as using 'Oriesounes' which means formal speech.  A later accusation against someone else detailed his cures - he used lax water from a south-running well in a white pitcher which was warmed on a fire.  The water was dumped outside where a cat ran across it, went mad and attacked a man standing nearby.  He taught them a charm for enhancing their crops.",FALSE,FALSE,FALSE,FALSE,FALSE,FALSE,FALSE,TRUE,FALSE,TRUE,FALSE,FALSE,FALSE,TRUE,TRUE,TRUE,FALSE,confessed to charming people in Fintray of the fevers.  He confessed to using potions,FALSE,FALSE,,,FALSE,FALSE,FALSE,FALSE,FALSE,,"good description of a local trial, gives the procedure.  He was a healer who worked in Fintray, Ava, Cullen, and all over the North East.",SMD,2001-05-15T17:00:16,jhm,2002-11-13T12:48:47
C/EGD/126,126,EGD,-1,A/EGD/115,24/6/1596,1996-06-24T00:00:00,24/6/1596,1996-06-24T00:00:00,,"Stewart,John",,,,,,,FALSE,FALSE,TRUE,TRUE,FALSE,FALSE,FALSE,FALSE,FALSE,FALSE,FALSE,FALSE,FALSE,TRUE,FALSE,FALSE,FALSE,FALSE,FALSE,FALSE,FALSE,TRUE,FALSE,FALSE,FALSE,FALSE,FALSE,FALSE,FALSE,FALSE,4,,FALSE,FALSE,FALSE,FALSE,0,He was accused of murdering his brother the Earl of Orkney by hiring Aleson Balfour.  The High Court index has him charged with 'consulting a witch'.,FALSE,,FALSE,,FALSE,FALSE,FALSE,FALSE,FALSE,FALSE,FALSE,,,,FALSE,FALSE,FALSE,FALSE,FALSE,FALSE,FALSE,FALSE,FALSE,FALSE,,FALSE,TRUE,FALSE,FALSE,FALSE,FALSE,FALSE,FALSE,FALSE,FALSE,FALSE,FALSE,FALSE,FALSE,FALSE,FALSE,FALSE,,FALSE,FALSE,,,FALSE,FALSE,FALSE,FALSE,FALSE,,"This is a typical dynastic struggle case where a witch was hired as one attempt of many to kill a rival claimant.  In this case it was his brother, and many others were accused of working with him to kill Patrick Earl of Orkney.",SMD,2001-05-15T17:00:16,jhm,2002-10-03T11:07:02
C/EGD/1260,1260,EGD,-1,A/EGD/1248,26/7/1631,2031-07-26T00:00:00,21/9/1631,2031-09-21T00:00:00,,"Paterson,Christian",,,,,,,FALSE,FALSE,FALSE,FALSE,FALSE,FALSE,FALSE,FALSE,FALSE,FALSE,FALSE,FALSE,FALSE,TRUE,FALSE,FALSE,FALSE,FALSE,FALSE,FALSE,FALSE,FALSE,FALSE,FALSE,FALSE,FALSE,FALSE,FALSE,FALSE,FALSE,1,,TRUE,TRUE,FALSE,FALSE,0,,FALSE,,FALSE,,FALSE,FALSE,FALSE,FALSE,FALSE,FALSE,FALSE,,,,FALSE,FALSE,FALSE,FALSE,FALSE,FALSE,FALSE,FALSE,FALSE,FALSE,,TRUE,TRUE,TRUE,TRUE,FALSE,FALSE,FALSE,FALSE,TRUE,FALSE,FALSE,FALSE,FALSE,FALSE,FALSE,FALSE,FALSE,,FALSE,FALSE,,,FALSE,FALSE,FALSE,FALSE,FALSE,,,SMD,2001-05-15T17:00:16,jhm,2002-10-03T11:09:06
C/EGD/1262,1262,EGD,-1,A/EGD/1250,10/1/1631,2031-01-10T00:00:00,23/2/1632,2032-02-23T00:00:00,,"Mure,Marion",,,,,,,FALSE,FALSE,FALSE,FALSE,FALSE,TRUE,FALSE,FALSE,FALSE,FALSE,FALSE,FALSE,FALSE,FALSE,FALSE,FALSE,FALSE,FALSE,FALSE,FALSE,FALSE,FALSE,FALSE,FALSE,FALSE,FALSE,FALSE,FALSE,FALSE,FALSE,1,,TRUE,TRUE,FALSE,FALSE,0,,FALSE,,FALSE,,FALSE,FALSE,FALSE,FALSE,FALSE,FALSE,FALSE,,,,FALSE,FALSE,FALSE,FALSE,FALSE,FALSE,FALSE,FALSE,FALSE,FALSE,,FALSE,FALSE,FALSE,FALSE,FALSE,FALSE,FALSE,FALSE,FALSE,FALSE,FALSE,FALSE,FALSE,FALSE,FALSE,FALSE,FALSE,,FALSE,FALSE,,,FALSE,FALSE,FALSE,FALSE,FALSE,A doctor testified that she had symptoms of 'hyprocondriack distraction',,SMD,2001-05-15T17:00:16,jhm,2002-10-03T11:09:49
C/EGD/1263,1263,EGD,-1,A/EGD/1251,28/2/1632,2032-02-28T00:00:00,9/3/1632,2032-03-09T00:00:00,,"Lumisden,Marioun",,,,,,,FALSE,FALSE,FALSE,FALSE,FALSE,FALSE,FALSE,FALSE,FALSE,FALSE,FALSE,FALSE,FALSE,FALSE,FALSE,FALSE,FALSE,TRUE,FALSE,FALSE,FALSE,FALSE,FALSE,FALSE,FALSE,FALSE,FALSE,FALSE,FALSE,FALSE,1,,TRUE,TRUE,FALSE,FALSE,0,,FALSE,,FALSE,,FALSE,FALSE,FALSE,FALSE,FALSE,FALSE,FALSE,,,,FALSE,FALSE,FALSE,FALSE,FALSE,FALSE,FALSE,FALSE,FALSE,FALSE,,FALSE,FALSE,FALSE,FALSE,FALSE,FALSE,FALSE,FALSE,FALSE,FALSE,FALSE,FALSE,FALSE,FALSE,FALSE,FALSE,FALSE,,FALSE,FALSE,,,FALSE,FALSE,FALSE,FALSE,FALSE,,,SMD,2001-05-15T17:00:16,jhm,2002-08-26T15:01:44
C/EGD/1264,1264,EGD,-1,A/EGD/1252,23/2/1632,2032-02-23T00:00:00,7/3/1632,2032-03-07T00:00:00,,"Hamiltoun,Helene",,,,,,,FALSE,FALSE,FALSE,FALSE,FALSE,FALSE,FALSE,FALSE,FALSE,FALSE,FALSE,FALSE,FALSE,FALSE,FALSE,FALSE,FALSE,TRUE,FALSE,FALSE,FALSE,FALSE,FALSE,FALSE,FALSE,FALSE,FALSE,FALSE,FALSE,FALSE,1,,TRUE,TRUE,FALSE,FALSE,0,,FALSE,,FALSE,,FALSE,FALSE,FALSE,FALSE,FALSE,FALSE,FALSE,,,,FALSE,FALSE,FALSE,FALSE,FALSE,FALSE,FALSE,FALSE,FALSE,FALSE,,FALSE,FALSE,FALSE,FALSE,FALSE,FALSE,FALSE,FALSE,FALSE,FALSE,FALSE,FALSE,FALSE,FALSE,FALSE,FALSE,FALSE,,FALSE,FALSE,,,FALSE,FALSE,FALSE,FALSE,FALSE,,,SMD,2001-05-15T17:00:16,jhm,2002-10-03T11:18:38
C/EGD/1265,1265,EGD,-1,A/EGD/1253,2/1632,2032-02-01T00:00:00,13/4/1632,2032-04-13T00:00:00,,"Widdrow,Helen",,,,,,,FALSE,FALSE,FALSE,FALSE,FALSE,FALSE,FALSE,FALSE,FALSE,FALSE,FALSE,FALSE,FALSE,FALSE,FALSE,FALSE,FALSE,FALSE,FALSE,FALSE,FALSE,FALSE,FALSE,FALSE,FALSE,FALSE,FALSE,FALSE,FALSE,FALSE,0,,TRUE,TRUE,FALSE,FALSE,0,,FALSE,,FALSE,,FALSE,FALSE,FALSE,FALSE,FALSE,FALSE,FALSE,,,,FALSE,FALSE,FALSE,FALSE,FALSE,FALSE,FALSE,FALSE,FALSE,FALSE,,FALSE,FALSE,FALSE,FALSE,FALSE,FALSE,FALSE,FALSE,FALSE,FALSE,FALSE,FALSE,FALSE,FALSE,FALSE,FALSE,FALSE,,FALSE,FALSE,,,FALSE,FALSE,FALSE,FALSE,FALSE,,,SMD,2001-05-15T17:00:16,jhm,2002-10-03T11:24:22
C/EGD/1440,1440,EGD,-1,A/EGD/1426,23/1/1662,1962-01-23T00:00:00,23/1/1662,1962-01-23T00:00:00,,"Philp,Margret",,,,,,,FALSE,FALSE,FALSE,FALSE,FALSE,FALSE,FALSE,FALSE,FALSE,FALSE,FALSE,FALSE,FALSE,FALSE,FALSE,FALSE,FALSE,FALSE,FALSE,FALSE,FALSE,FALSE,FALSE,FALSE,FALSE,FALSE,FALSE,FALSE,FALSE,FALSE,0,,TRUE,TRUE,FALSE,FALSE,0,Nothing about confession or accusations.,FALSE,,FALSE,,FALSE,FALSE,FALSE,FALSE,FALSE,FALSE,FALSE,,,,FALSE,FALSE,FALSE,FALSE,FALSE,FALSE,FALSE,FALSE,FALSE,FALSE,,FALSE,FALSE,FALSE,FALSE,FALSE,FALSE,FALSE,FALSE,FALSE,FALSE,FALSE,FALSE,FALSE,FALSE,FALSE,FALSE,FALSE,,FALSE,FALSE,,,FALSE,FALSE,FALSE,FALSE,FALSE,,,SMD,2001-05-15T17:00:16,jhm,2002-10-08T09:40:54
C/EGD/1441,1441,EGD,-1,A/EGD/1427,23/1/1662,1962-01-23T00:00:00,23/1/1662,1962-01-23T00:00:00,,"Anderson,Cristian",,,,,,,FALSE,FALSE,FALSE,FALSE,FALSE,FALSE,FALSE,FALSE,FALSE,FALSE,FALSE,FALSE,FALSE,FALSE,FALSE,FALSE,FALSE,FALSE,FALSE,FALSE,FALSE,FALSE,FALSE,FALSE,FALSE,FALSE,FALSE,FALSE,FALSE,FALSE,0,,TRUE,TRUE,FALSE,FALSE,0,Nothing about confession or accusations.,FALSE,,FALSE,,FALSE,FALSE,FALSE,FALSE,FALSE,FALSE,FALSE,,,,FALSE,FALSE,FALSE,FALSE,FALSE,FALSE,FALSE,FALSE,FALSE,FALSE,,FALSE,FALSE,FALSE,FALSE,FALSE,FALSE,FALSE,FALSE,FALSE,FALSE,FALSE,FALSE,FALSE,FALSE,FALSE,FALSE,FALSE,,FALSE,FALSE,,,FALSE,FALSE,FALSE,FALSE,FALSE,,,SMD,2001-05-15T17:00:16,jhm,2002-10-08T09:41:32
C/EGD/1442,1442,EGD,-1,A/EGD/1428,23/1/1662,1962-01-23T00:00:00,23/1/1662,1962-01-23T00:00:00,,"Bonar,Cristian",,,,,,,FALSE,FALSE,FALSE,FALSE,FALSE,FALSE,FALSE,FALSE,FALSE,FALSE,FALSE,FALSE,FALSE,FALSE,FALSE,FALSE,FALSE,FALSE,FALSE,FALSE,FALSE,FALSE,FALSE,FALSE,FALSE,FALSE,FALSE,FALSE,FALSE,FALSE,0,,TRUE,TRUE,FALSE,FALSE,0,Nothing about confession or accusation.,FALSE,,FALSE,,FALSE,FALSE,FALSE,FALSE,FALSE,FALSE,FALSE,,,,FALSE,FALSE,FALSE,FALSE,FALSE,FALSE,FALSE,FALSE,FALSE,FALSE,,FALSE,FALSE,FALSE,FALSE,FALSE,FALSE,FALSE,FALSE,FALSE,FALSE,FALSE,FALSE,FALSE,FALSE,FALSE,FALSE,FALSE,,FALSE,FALSE,,,FALSE,FALSE,FALSE,FALSE,FALSE,,,SMD,2001-05-15T17:00:16,jhm,2002-10-08T09:42:31
C/EGD/1443,1443,EGD,-1,A/EGD/1429,23/1/1662,1962-01-23T00:00:00,23/1/1662,1962-01-23T00:00:00,,"Duncan,Bessie",,,,,,,FALSE,FALSE,FALSE,FALSE,FALSE,FALSE,FALSE,FALSE,FALSE,FALSE,FALSE,FALSE,FALSE,FALSE,FALSE,FALSE,FALSE,FALSE,FALSE,FALSE,FALSE,FALSE,FALSE,FALSE,FALSE,FALSE,FALSE,FALSE,FALSE,FALSE,0,,TRUE,TRUE,FALSE,FALSE,0,Nothing about what suspect confessed.,FALSE,,FALSE,,FALSE,FALSE,FALSE,FALSE,FALSE,FALSE,FALSE,,,,FALSE,FALSE,FALSE,FALSE,FALSE,FALSE,FALSE,FALSE,FALSE,FALSE,,FALSE,FALSE,FALSE,FALSE,FALSE,FALSE,FALSE,FALSE,FALSE,FALSE,FALSE,FALSE,FALSE,FALSE,FALSE,FALSE,FALSE,,FALSE,FALSE,,,FALSE,FALSE,FALSE,FALSE,FALSE,,,SMD,2001-05-15T17:00:16,jhm,2002-10-08T09:43:51
C/EGD/1444,1444,EGD,-1,A/EGD/1430,23/1/1662,1962-01-23T00:00:00,23/1/1662,1962-01-23T00:00:00,,"Balfour,Helen",,,,,,,FALSE,FALSE,FALSE,FALSE,FALSE,FALSE,FALSE,FALSE,FALSE,FALSE,FALSE,FALSE,FALSE,FALSE,FALSE,FALSE,FALSE,FALSE,FALSE,FALSE,FALSE,FALSE,FALSE,FALSE,FALSE,FALSE,FALSE,FALSE,FALSE,FALSE,0,,TRUE,TRUE,FALSE,FALSE,0,Nothing about confession or accusations.,FALSE,,FALSE,,FALSE,FALSE,FALSE,FALSE,FALSE,FALSE,FALSE,,,,FALSE,FALSE,FALSE,FALSE,FALSE,FALSE,FALSE,FALSE,FALSE,FALSE,,FALSE,FALSE,FALSE,FALSE,FALSE,FALSE,FALSE,FALSE,FALSE,FALSE,FALSE,FALSE,FALSE,FALSE,FALSE,FALSE,FALSE,,FALSE,FALSE,,,FALSE,FALSE,FALSE,FALSE,FALSE,,,SMD,2001-05-15T17:00:16,jhm,2002-10-08T09:44:49
C/EGD/1445,1445,EGD,-1,A/EGD/1431,23/1/1662,1962-01-23T00:00:00,23/1/1662,1962-01-23T00:00:00,,"Steidman,Cristian",,,,,,,FALSE,FALSE,FALSE,FALSE,FALSE,FALSE,FALSE,FALSE,FALSE,FALSE,FALSE,FALSE,FALSE,FALSE,FALSE,FALSE,FALSE,FALSE,FALSE,FALSE,FALSE,FALSE,FALSE,FALSE,FALSE,FALSE,FALSE,FALSE,FALSE,FALSE,0,,TRUE,TRUE,FALSE,FALSE,0,Nothing about confession or accusations.,FALSE,,FALSE,,FALSE,FALSE,FALSE,FALSE,FALSE,FALSE,FALSE,,,,FALSE,FALSE,FALSE,FALSE,FALSE,FALSE,FALSE,FALSE,FALSE,FALSE,,FALSE,FALSE,FALSE,FALSE,FALSE,FALSE,FALSE,FALSE,FALSE,FALSE,FALSE,FALSE,FALSE,FALSE,FALSE,FALSE,FALSE,,FALSE,FALSE,,,FALSE,FALSE,FALSE,FALSE,FALSE,,,SMD,2001-05-15T17:00:16,jhm,2002-10-08T09:46:15
C/EGD/1446,1446,EGD,-1,A/EGD/1432,23/1/1662,1962-01-23T00:00:00,23/1/1662,1962-01-23T00:00:00,,"Burrell,Jonet",,,,,,,FALSE,FALSE,FALSE,FALSE,FALSE,FALSE,FALSE,FALSE,FALSE,FALSE,FALSE,FALSE,FALSE,FALSE,FALSE,FALSE,FALSE,FALSE,FALSE,FALSE,FALSE,FALSE,FALSE,FALSE,FALSE,FALSE,FALSE,FALSE,FALSE,FALSE,0,,TRUE,TRUE,FALSE,FALSE,0,Nothing about confession or accusation.,FALSE,,FALSE,,FALSE,FALSE,FALSE,FALSE,FALSE,FALSE,FALSE,,,,FALSE,FALSE,FALSE,FALSE,FALSE,FALSE,FALSE,FALSE,FALSE,FALSE,,FALSE,FALSE,FALSE,FALSE,FALSE,FALSE,FALSE,FALSE,FALSE,FALSE,FALSE,FALSE,FALSE,FALSE,FALSE,FALSE,FALSE,,FALSE,FALSE,,,FALSE,FALSE,FALSE,FALSE,FALSE,,,SMD,2001-05-15T17:00:16,jhm,2002-10-08T09:47:05
C/EGD/1447,1447,EGD,-1,A/EGD/1433,23/1/1662,1962-01-23T00:00:00,23/1/1662,1962-01-23T00:00:00,,"Cuthbertson,Christian",,,,,,,FALSE,FALSE,FALSE,FALSE,FALSE,FALSE,FALSE,FALSE,FALSE,FALSE,FALSE,FALSE,FALSE,FALSE,FALSE,FALSE,FALSE,FALSE,FALSE,FALSE,FALSE,FALSE,FALSE,FALSE,FALSE,FALSE,FALSE,FALSE,FALSE,FALSE,0,,TRUE,TRUE,FALSE,FALSE,0,No details of confession or accusations,FALSE,,FALSE,,FALSE,FALSE,FALSE,FALSE,FALSE,FALSE,FALSE,,,,FALSE,FALSE,FALSE,FALSE,FALSE,FALSE,FALSE,FALSE,FALSE,FALSE,,FALSE,FALSE,FALSE,FALSE,FALSE,FALSE,FALSE,FALSE,FALSE,FALSE,FALSE,FALSE,FALSE,FALSE,FALSE,FALSE,FALSE,,FALSE,FALSE,,,FALSE,FALSE,FALSE,FALSE,FALSE,,,SMD,2001-05-15T17:00:16,jhm,2002-10-08T09:47:39
C/EGD/1448,1448,EGD,-1,A/EGD/1434,6/2/1662,1962-02-06T00:00:00,6/2/1662,1962-02-06T00:00:00,,"Soutar,Elizabeth",,,,,,,FALSE,FALSE,FALSE,FALSE,FALSE,TRUE,FALSE,FALSE,FALSE,FALSE,FALSE,FALSE,FALSE,FALSE,FALSE,FALSE,FALSE,FALSE,FALSE,FALSE,FALSE,FALSE,FALSE,FALSE,FALSE,FALSE,FALSE,FALSE,FALSE,FALSE,1,,TRUE,TRUE,FALSE,FALSE,0,No details of confession or accusations but demonic pact included in wording of commission.,FALSE,Pact included in the wording of the commission but no specific details from any other source.,FALSE,,FALSE,FALSE,FALSE,FALSE,FALSE,FALSE,FALSE,,,,FALSE,FALSE,FALSE,FALSE,FALSE,FALSE,FALSE,FALSE,FALSE,FALSE,,FALSE,FALSE,FALSE,FALSE,FALSE,FALSE,FALSE,FALSE,FALSE,FALSE,FALSE,FALSE,FALSE,FALSE,FALSE,FALSE,FALSE,,FALSE,FALSE,,,FALSE,FALSE,FALSE,FALSE,FALSE,,,SMD,2001-05-15T17:00:16,jhm,2002-10-08T09:48:58
C/EGD/1449,1449,EGD,-1,A/EGD/1435,6/2/1662,1962-02-06T00:00:00,6/2/1662,1962-02-06T00:00:00,,"Wishart,Margret",,,,,,,FALSE,FALSE,FALSE,FALSE,FALSE,TRUE,FALSE,FALSE,FALSE,FALSE,FALSE,FALSE,FALSE,FALSE,FALSE,FALSE,FALSE,FALSE,FALSE,FALSE,FALSE,FALSE,FALSE,FALSE,FALSE,FALSE,FALSE,FALSE,FALSE,FALSE,1,,TRUE,TRUE,FALSE,FALSE,0,Demonic pact included as it was included in the wording of the commission but no details from accusation or confession.,FALSE,Pact implied as it was included in the wording of the commission but no details.,FALSE,,FALSE,FALSE,FALSE,FALSE,FALSE,FALSE,FALSE,,,,FALSE,FALSE,FALSE,FALSE,FALSE,FALSE,FALSE,FALSE,FALSE,FALSE,,FALSE,FALSE,FALSE,FALSE,FALSE,FALSE,FALSE,FALSE,FALSE,FALSE,FALSE,FALSE,FALSE,FALSE,FALSE,FALSE,FALSE,,FALSE,FALSE,,,FALSE,FALSE,FALSE,FALSE,FALSE,,,SMD,2001-05-15T17:00:16,jhm,2002-10-08T09:50:05
C/EGD/145,145,EGD,-1,A/EGD/134,27/1/1591,1991-01-27T00:00:00,27/5/1608,2008-05-27T00:00:00,,"Gordoun,Johnne",,,,,,,FALSE,FALSE,FALSE,FALSE,FALSE,FALSE,FALSE,FALSE,FALSE,FALSE,FALSE,FALSE,FALSE,FALSE,FALSE,FALSE,FALSE,TRUE,FALSE,FALSE,FALSE,FALSE,FALSE,FALSE,FALSE,FALSE,FALSE,FALSE,FALSE,FALSE,1,,TRUE,TRUE,FALSE,FALSE,0,"Part of the North Berwick witch hunt.  It involved many people and many accustions about witches meetings, specifically two separate attempts to sink the royal ships.  The first to sink Queen Anne on her way home, second to trouble King James after he went to get her in Denmark.",FALSE,It was said by another accused that he met the devil as a black man.,FALSE,,FALSE,FALSE,FALSE,FALSE,FALSE,FALSE,FALSE,,,The group met the Devil at Beigis' house for drinks.  They cast a cat to the Devil.  They met in the thorns near the iron gate of Seton.  Also did a cat ritual at the gate of Seton.  See Agnes Sampson's case for description of North Berwick meeting (c/egd/63).  At the North Berwick meeting he was supposedly the keeper of the door.  See also Napier (c/egd/103) for more details about the North Berwick meeting.,FALSE,FALSE,FALSE,FALSE,FALSE,FALSE,FALSE,FALSE,FALSE,FALSE,According to others he was involved in rituals with a cat and named it Margaret.,FALSE,FALSE,FALSE,FALSE,FALSE,FALSE,FALSE,FALSE,FALSE,FALSE,FALSE,FALSE,FALSE,FALSE,FALSE,FALSE,FALSE,,FALSE,FALSE,,,FALSE,FALSE,FALSE,FALSE,FALSE,,"Pobably the same guy as Jokkie Gray-meil (c/la/2901), but the two names are both mentioned in Agnes Sampsoune's trial and we don't have enough to merge them.",SMD,2001-05-15T17:00:16,jhm,2002-10-11T10:00:10
C/EGD/1450,1450,EGD,-1,A/EGD/1436,6/2/1662,1962-02-06T00:00:00,6/2/1662,1962-02-06T00:00:00,,"Staig,Jonet",,,,,,,FALSE,FALSE,FALSE,FALSE,FALSE,TRUE,FALSE,FALSE,FALSE,FALSE,FALSE,FALSE,FALSE,FALSE,FALSE,FALSE,FALSE,FALSE,FALSE,FALSE,FALSE,FALSE,FALSE,FALSE,FALSE,FALSE,FALSE,FALSE,FALSE,FALSE,1,,TRUE,TRUE,FALSE,FALSE,0,Demonic pact implied as included in wording of commission but no details from the accusations or confession.,TRUE,Implied demonic pact as it was included in the wording of the commission.,FALSE,,FALSE,FALSE,FALSE,FALSE,FALSE,FALSE,FALSE,,,,FALSE,FALSE,FALSE,FALSE,FALSE,FALSE,FALSE,FALSE,FALSE,FALSE,,FALSE,FALSE,FALSE,FALSE,FALSE,FALSE,FALSE,FALSE,FALSE,FALSE,FALSE,FALSE,FALSE,FALSE,FALSE,FALSE,FALSE,,FALSE,FALSE,,,FALSE,FALSE,FALSE,FALSE,FALSE,,,SMD,2001-05-15T17:00:16,jhm,2002-10-08T09:59:14
C/EGD/1451,1451,EGD,-1,A/EGD/1437,6/2/1662,1962-02-06T00:00:00,6/2/1662,1962-02-06T00:00:00,,"Melivill,Alison",,,,,,,FALSE,FALSE,FALSE,FALSE,FALSE,TRUE,FALSE,FALSE,FALSE,FALSE,FALSE,FALSE,FALSE,FALSE,FALSE,FALSE,FALSE,FALSE,FALSE,FALSE,FALSE,FALSE,FALSE,FALSE,FALSE,FALSE,FALSE,FALSE,FALSE,FALSE,1,,TRUE,TRUE,FALSE,FALSE,0,Demonic pact included in wording of commission but no details from confession or accusations.,FALSE,Implied demonic pact as it was included in the wording of commission.,FALSE,,FALSE,FALSE,FALSE,FALSE,FALSE,FALSE,FALSE,,,,FALSE,FALSE,FALSE,FALSE,FALSE,FALSE,FALSE,FALSE,FALSE,FALSE,,FALSE,FALSE,FALSE,FALSE,FALSE,FALSE,FALSE,FALSE,FALSE,FALSE,FALSE,FALSE,FALSE,FALSE,FALSE,FALSE,FALSE,,FALSE,FALSE,,,FALSE,FALSE,FALSE,FALSE,FALSE,,,SMD,2001-05-15T17:00:16,jhm,2002-10-08T10:02:32
C/EGD/1452,1452,EGD,-1,A/EGD/1438,6/2/1662,1962-02-06T00:00:00,6/2/1662,1962-02-06T00:00:00,,"Mar,Jonat",,,,,,,FALSE,FALSE,FALSE,FALSE,FALSE,TRUE,FALSE,FALSE,FALSE,FALSE,FALSE,FALSE,FALSE,FALSE,FALSE,FALSE,FALSE,FALSE,FALSE,FALSE,FALSE,FALSE,FALSE,FALSE,FALSE,FALSE,FALSE,FALSE,FALSE,FALSE,1,,TRUE,TRUE,FALSE,FALSE,0,Demonic pact implied as included in wording of commission but no other details from confession or accusations.,TRUE,Demonic pact implied because commission included reference to it but no specific details.,FALSE,,FALSE,FALSE,FALSE,FALSE,FALSE,FALSE,FALSE,,,,FALSE,FALSE,FALSE,FALSE,FALSE,FALSE,FALSE,FALSE,FALSE,FALSE,,FALSE,FALSE,FALSE,FALSE,FALSE,FALSE,FALSE,FALSE,FALSE,FALSE,FALSE,FALSE,FALSE,FALSE,FALSE,FALSE,FALSE,,FALSE,FALSE,,,FALSE,FALSE,FALSE,FALSE,FALSE,,,SMD,2001-05-15T17:00:16,jhm,2002-10-08T10:04:25
C/EGD/1453,1453,EGD,-1,A/EGD/1439,6/2/1662,1962-02-06T00:00:00,6/2/1662,1962-02-06T00:00:00,,"Millar,Elspeth",,,,,,,FALSE,FALSE,FALSE,FALSE,FALSE,TRUE,FALSE,FALSE,FALSE,FALSE,FALSE,FALSE,FALSE,FALSE,FALSE,FALSE,FALSE,FALSE,FALSE,FALSE,FALSE,FALSE,FALSE,FALSE,FALSE,FALSE,FALSE,FALSE,FALSE,FALSE,1,,TRUE,TRUE,FALSE,FALSE,0,No details from confession or accusation but demonic pact included in wording of commission.,FALSE,Pact included in wording of commission so demonic pact implied.,FALSE,,FALSE,FALSE,FALSE,FALSE,FALSE,FALSE,FALSE,,,,FALSE,FALSE,FALSE,FALSE,FALSE,FALSE,FALSE,FALSE,FALSE,FALSE,,FALSE,FALSE,FALSE,FALSE,FALSE,FALSE,FALSE,FALSE,FALSE,FALSE,FALSE,FALSE,FALSE,FALSE,FALSE,FALSE,FALSE,,FALSE,FALSE,,,FALSE,FALSE,FALSE,FALSE,FALSE,,,SMD,2001-05-15T17:00:16,jhm,2002-10-08T10:04:48
C/EGD/1454,1454,EGD,-1,A/EGD/1440,1/8/1661,1961-08-01T00:00:00,13/2/1662,1962-02-13T00:00:00,,"Wylie,Margret",,,,,,,FALSE,FALSE,FALSE,FALSE,FALSE,TRUE,FALSE,FALSE,FALSE,FALSE,FALSE,FALSE,FALSE,FALSE,FALSE,FALSE,FALSE,FALSE,FALSE,FALSE,FALSE,FALSE,FALSE,FALSE,FALSE,FALSE,FALSE,FALSE,FALSE,FALSE,1,,TRUE,TRUE,FALSE,FALSE,0,Recorded that accused had confessed to demonic pact but no details.,FALSE,,FALSE,,FALSE,FALSE,FALSE,FALSE,FALSE,FALSE,FALSE,,,,FALSE,FALSE,FALSE,FALSE,FALSE,FALSE,FALSE,FALSE,FALSE,FALSE,,FALSE,FALSE,FALSE,FALSE,FALSE,FALSE,FALSE,FALSE,FALSE,FALSE,FALSE,FALSE,FALSE,FALSE,FALSE,FALSE,FALSE,,FALSE,FALSE,,,FALSE,FALSE,FALSE,FALSE,FALSE,,,SMD,2001-05-15T17:00:16,jhm,2002-10-08T10:09:09
C/EGD/1455,1455,EGD,-1,A/EGD/1441,13/2/1662,1962-02-13T00:00:00,13/2/1662,1962-02-13T00:00:00,,"Wylie,Cristian",,,,,,,FALSE,FALSE,FALSE,FALSE,FALSE,TRUE,FALSE,FALSE,FALSE,FALSE,FALSE,FALSE,FALSE,FALSE,FALSE,FALSE,FALSE,FALSE,FALSE,FALSE,FALSE,FALSE,FALSE,FALSE,FALSE,FALSE,FALSE,FALSE,FALSE,FALSE,1,,TRUE,TRUE,FALSE,FALSE,0,No details of confession but recorded that she confessed to demonic pact.,FALSE,,FALSE,,FALSE,FALSE,FALSE,FALSE,FALSE,FALSE,FALSE,,,,FALSE,FALSE,FALSE,FALSE,FALSE,FALSE,FALSE,FALSE,FALSE,FALSE,,FALSE,FALSE,FALSE,FALSE,FALSE,FALSE,FALSE,FALSE,FALSE,FALSE,FALSE,FALSE,FALSE,FALSE,FALSE,FALSE,FALSE,,FALSE,FALSE,,,FALSE,FALSE,FALSE,FALSE,FALSE,,,SMD,2001-05-15T17:00:16,jhm,2002-10-08T10:09:47
C/EGD/1456,1456,EGD,-1,A/EGD/1442,13/2/1662,1962-02-13T00:00:00,13/2/1662,1962-02-13T00:00:00,,"Elies,George",,,,,,,FALSE,FALSE,FALSE,FALSE,FALSE,FALSE,FALSE,FALSE,FALSE,FALSE,FALSE,FALSE,FALSE,FALSE,FALSE,FALSE,FALSE,FALSE,FALSE,FALSE,FALSE,FALSE,FALSE,FALSE,FALSE,FALSE,FALSE,FALSE,FALSE,FALSE,0,,TRUE,TRUE,FALSE,FALSE,0,No details about confession or accusation.,FALSE,,FALSE,,FALSE,FALSE,FALSE,FALSE,FALSE,FALSE,FALSE,,,,FALSE,FALSE,FALSE,FALSE,FALSE,FALSE,FALSE,FALSE,FALSE,FALSE,,FALSE,FALSE,FALSE,FALSE,FALSE,FALSE,FALSE,FALSE,FALSE,FALSE,FALSE,FALSE,FALSE,FALSE,FALSE,FALSE,FALSE,,FALSE,FALSE,,,FALSE,FALSE,FALSE,FALSE,FALSE,,,SMD,2001-05-15T17:00:16,jhm,2002-10-08T10:11:01
C/EGD/1457,1457,EGD,-1,A/EGD/1443,13/2/1662,1962-02-13T00:00:00,11/1/1666,1966-01-11T00:00:00,,"Howat,Jonet",,,,,,,FALSE,FALSE,FALSE,FALSE,FALSE,FALSE,FALSE,FALSE,FALSE,FALSE,FALSE,FALSE,FALSE,FALSE,FALSE,FALSE,FALSE,FALSE,FALSE,FALSE,FALSE,FALSE,FALSE,FALSE,FALSE,FALSE,FALSE,FALSE,FALSE,FALSE,0,,TRUE,TRUE,FALSE,FALSE,0,No details of accusation or confession.,FALSE,,FALSE,,FALSE,FALSE,FALSE,FALSE,FALSE,FALSE,FALSE,,,,FALSE,FALSE,FALSE,FALSE,FALSE,FALSE,FALSE,FALSE,FALSE,FALSE,,FALSE,FALSE,FALSE,FALSE,FALSE,FALSE,FALSE,FALSE,FALSE,FALSE,FALSE,FALSE,FALSE,FALSE,FALSE,FALSE,FALSE,,FALSE,FALSE,,,FALSE,FALSE,FALSE,FALSE,FALSE,,"We are grateful for some additional information about this case from Fiona Scharlau, archivist, Angus Local Studies Centre.",SMD,2001-05-15T17:00:16,jhm,2002-10-08T10:12:12
C/EGD/1458,1458,EGD,-1,A/EGD/1444,13/2/1662,1962-02-13T00:00:00,13/2/1662,1962-02-13T00:00:00,,"Stout,Jonet",,,,,,,FALSE,FALSE,FALSE,FALSE,FALSE,FALSE,FALSE,FALSE,FALSE,FALSE,FALSE,FALSE,FALSE,FALSE,FALSE,FALSE,FALSE,FALSE,FALSE,FALSE,FALSE,FALSE,FALSE,FALSE,FALSE,FALSE,FALSE,FALSE,FALSE,FALSE,0,,TRUE,TRUE,FALSE,FALSE,0,No details about accusation or confession.,FALSE,,FALSE,,FALSE,FALSE,FALSE,FALSE,FALSE,FALSE,FALSE,,,,FALSE,FALSE,FALSE,FALSE,FALSE,FALSE,FALSE,FALSE,FALSE,FALSE,,FALSE,FALSE,FALSE,FALSE,FALSE,FALSE,FALSE,FALSE,FALSE,FALSE,FALSE,FALSE,FALSE,FALSE,FALSE,FALSE,FALSE,,FALSE,FALSE,,,FALSE,FALSE,FALSE,FALSE,FALSE,,,SMD,2001-05-15T17:00:16,jhm,2002-10-08T10:14:20
C/EGD/1459,1459,EGD,-1,A/EGD/1445,4/3/1662,1962-03-04T00:00:00,4/3/1662,1962-03-04T00:00:00,,"Kirktoun,Margret",,,,,,,FALSE,FALSE,FALSE,FALSE,FALSE,FALSE,FALSE,FALSE,FALSE,FALSE,FALSE,FALSE,FALSE,FALSE,FALSE,FALSE,FALSE,FALSE,FALSE,FALSE,FALSE,FALSE,FALSE,FALSE,FALSE,FALSE,FALSE,FALSE,FALSE,FALSE,0,,TRUE,TRUE,FALSE,FALSE,0,No details about confession or accusations.,FALSE,,FALSE,,FALSE,FALSE,FALSE,FALSE,FALSE,FALSE,FALSE,,,,FALSE,FALSE,FALSE,FALSE,FALSE,FALSE,FALSE,FALSE,FALSE,FALSE,,FALSE,FALSE,FALSE,FALSE,FALSE,FALSE,FALSE,FALSE,FALSE,FALSE,FALSE,FALSE,FALSE,FALSE,FALSE,FALSE,FALSE,,FALSE,FALSE,,,FALSE,FALSE,FALSE,FALSE,FALSE,,,SMD,2001-05-15T17:00:16,jhm,2002-10-08T10:15:50
C/EGD/146,146,EGD,-1,A/EGD/135,27/1/1591,1991-01-27T00:00:00,27/5/1608,2008-05-27T00:00:00,,"Unknown,Ersche Marioun",,,,,,,FALSE,FALSE,FALSE,FALSE,FALSE,FALSE,FALSE,FALSE,FALSE,FALSE,FALSE,FALSE,FALSE,FALSE,FALSE,FALSE,FALSE,TRUE,FALSE,FALSE,FALSE,FALSE,FALSE,FALSE,FALSE,FALSE,FALSE,FALSE,FALSE,FALSE,1,,TRUE,TRUE,FALSE,FALSE,0,"Part of the North Berwick witch hunt.  It involved many people and many accustions about witches meetings, specifically two separate attempts to sink the royal ships.  The first to sink Queen Anne on her way home, second to trouble King James after he went to get her in Denmark.  Also mentioned in the 1608 trial of Beigis Tod.",FALSE,,FALSE,,FALSE,FALSE,FALSE,FALSE,FALSE,FALSE,FALSE,,,"The group met the Devil at Beigis' house for drinks.  They cast a cat to the Devil.  They met in the thorns near the iron gate of Seton and did a ritual with a cat there. Met at the dam at Londniddry. The salt pans meeting happened in 1591, part of the planning for the raising of storms to destroy Queen Anne's ships. The descriptions of the meetings were given by B. Tod, not the accused.",FALSE,FALSE,FALSE,FALSE,FALSE,FALSE,FALSE,FALSE,FALSE,FALSE,"According Beigis Tod, they did rituals with a cat and named it Margaret.  There were also cat rituals in Agnes Sampson's trial.",FALSE,FALSE,FALSE,FALSE,FALSE,FALSE,FALSE,FALSE,FALSE,FALSE,FALSE,FALSE,FALSE,FALSE,FALSE,FALSE,FALSE,,FALSE,FALSE,It was claimed by others that she was involved in trying to sink the royal ships.,,FALSE,FALSE,FALSE,FALSE,FALSE,,,SMD,2001-05-15T17:00:16,LEM,2002-12-05T12:36:06
C/EGD/1460,1460,EGD,-1,A/EGD/1446,4/3/1662,1962-03-04T00:00:00,4/3/1662,1962-03-04T00:00:00,,"Mather,Issobell",,,,,,,FALSE,FALSE,FALSE,FALSE,FALSE,FALSE,FALSE,FALSE,FALSE,FALSE,FALSE,FALSE,FALSE,FALSE,FALSE,FALSE,FALSE,FALSE,FALSE,FALSE,FALSE,FALSE,FALSE,FALSE,FALSE,FALSE,FALSE,FALSE,FALSE,FALSE,0,,TRUE,TRUE,FALSE,FALSE,0,No details from confession or accusation.,FALSE,,FALSE,,FALSE,FALSE,FALSE,FALSE,FALSE,FALSE,FALSE,,,,FALSE,FALSE,FALSE,FALSE,FALSE,FALSE,FALSE,FALSE,FALSE,FALSE,,FALSE,FALSE,FALSE,FALSE,FALSE,FALSE,FALSE,FALSE,FALSE,FALSE,FALSE,FALSE,FALSE,FALSE,FALSE,FALSE,FALSE,,FALSE,FALSE,,,FALSE,FALSE,FALSE,FALSE,FALSE,,,SMD,2001-05-15T17:00:16,jhm,2002-10-08T10:26:13
C/EGD/1679,1679,EGD,-1,A/EGD/1665,19/5/1662,1962-05-19T00:00:00,28/7/1662,1962-07-28T00:00:00,,"Richie,Marjorie",,,,,,,FALSE,FALSE,FALSE,FALSE,FALSE,FALSE,FALSE,FALSE,FALSE,FALSE,FALSE,FALSE,FALSE,FALSE,FALSE,FALSE,FALSE,FALSE,FALSE,FALSE,FALSE,FALSE,FALSE,FALSE,FALSE,FALSE,FALSE,FALSE,FALSE,FALSE,0,,TRUE,TRUE,FALSE,FALSE,0,,FALSE,,FALSE,,FALSE,FALSE,FALSE,FALSE,FALSE,FALSE,FALSE,,,,FALSE,FALSE,FALSE,FALSE,FALSE,FALSE,FALSE,FALSE,FALSE,FALSE,,FALSE,FALSE,FALSE,FALSE,FALSE,FALSE,FALSE,FALSE,FALSE,FALSE,FALSE,FALSE,FALSE,FALSE,FALSE,FALSE,FALSE,,FALSE,FALSE,,,FALSE,FALSE,FALSE,FALSE,FALSE,,,SMD,2001-05-15T17:00:16,LEM,2002-12-05T14:20:13
C/EGD/1680,1680,EGD,-1,A/EGD/1666,28/7/1662,1962-07-28T00:00:00,28/7/1662,1962-07-28T00:00:00,,"Small,Cristian",,,,,,,FALSE,FALSE,FALSE,FALSE,FALSE,FALSE,FALSE,FALSE,FALSE,FALSE,FALSE,FALSE,FALSE,FALSE,FALSE,FALSE,FALSE,FALSE,FALSE,FALSE,FALSE,FALSE,FALSE,FALSE,FALSE,FALSE,FALSE,FALSE,FALSE,FALSE,0,,TRUE,TRUE,FALSE,FALSE,0,,FALSE,,FALSE,,FALSE,FALSE,FALSE,FALSE,FALSE,FALSE,FALSE,,,,FALSE,FALSE,FALSE,FALSE,FALSE,FALSE,FALSE,FALSE,FALSE,FALSE,,FALSE,FALSE,FALSE,FALSE,FALSE,FALSE,FALSE,FALSE,FALSE,FALSE,FALSE,FALSE,FALSE,FALSE,FALSE,FALSE,FALSE,,FALSE,FALSE,,,FALSE,FALSE,FALSE,FALSE,FALSE,,,SMD,2001-05-15T17:00:16,jhm,2002-10-21T16:11:03
C/EGD/1681,1681,EGD,-1,A/EGD/1667,28/7/1662,1962-07-28T00:00:00,28/7/1662,1962-07-28T00:00:00,,"Jonstoun,Elspeth",,,,,,,FALSE,FALSE,FALSE,FALSE,FALSE,FALSE,FALSE,FALSE,FALSE,FALSE,FALSE,FALSE,FALSE,FALSE,FALSE,FALSE,FALSE,FALSE,FALSE,FALSE,FALSE,FALSE,FALSE,FALSE,FALSE,FALSE,FALSE,FALSE,FALSE,FALSE,0,,TRUE,TRUE,FALSE,FALSE,0,,FALSE,,FALSE,,FALSE,FALSE,FALSE,FALSE,FALSE,FALSE,FALSE,,,,FALSE,FALSE,FALSE,FALSE,FALSE,FALSE,FALSE,FALSE,FALSE,FALSE,,FALSE,FALSE,FALSE,FALSE,FALSE,FALSE,FALSE,FALSE,FALSE,FALSE,FALSE,FALSE,FALSE,FALSE,FALSE,FALSE,FALSE,,FALSE,FALSE,,,FALSE,FALSE,FALSE,FALSE,FALSE,,,SMD,2001-05-15T17:00:16,jhm,2002-10-21T16:11:28
C/EGD/1682,1682,EGD,-1,A/EGD/1668,28/7/1662,1962-07-28T00:00:00,28/7/1662,1962-07-28T00:00:00,,"Scott,Marjory",,,,,,,FALSE,FALSE,FALSE,FALSE,FALSE,FALSE,FALSE,FALSE,FALSE,FALSE,FALSE,FALSE,FALSE,FALSE,FALSE,FALSE,FALSE,FALSE,FALSE,FALSE,FALSE,FALSE,FALSE,FALSE,FALSE,FALSE,FALSE,FALSE,FALSE,FALSE,0,,TRUE,TRUE,FALSE,FALSE,0,,FALSE,,FALSE,,FALSE,FALSE,FALSE,FALSE,FALSE,FALSE,FALSE,,,,FALSE,FALSE,FALSE,FALSE,FALSE,FALSE,FALSE,FALSE,FALSE,FALSE,,FALSE,FALSE,FALSE,FALSE,FALSE,FALSE,FALSE,FALSE,FALSE,FALSE,FALSE,FALSE,FALSE,FALSE,FALSE,FALSE,FALSE,,FALSE,FALSE,,,FALSE,FALSE,FALSE,FALSE,FALSE,,,SMD,2001-05-15T17:00:16,LEM,2002-12-05T14:20:28
C/EGD/1683,1683,EGD,-1,A/EGD/1669,28/7/1662,1962-07-28T00:00:00,28/7/1662,1962-07-28T00:00:00,,"Clerk,Agnes",,,,,,,FALSE,FALSE,FALSE,FALSE,FALSE,FALSE,FALSE,FALSE,FALSE,FALSE,FALSE,FALSE,FALSE,FALSE,FALSE,FALSE,FALSE,FALSE,FALSE,FALSE,FALSE,FALSE,FALSE,FALSE,FALSE,FALSE,FALSE,FALSE,FALSE,FALSE,0,,TRUE,TRUE,FALSE,FALSE,0,,FALSE,,FALSE,,FALSE,FALSE,FALSE,FALSE,FALSE,FALSE,FALSE,,,,FALSE,FALSE,FALSE,FALSE,FALSE,FALSE,FALSE,FALSE,FALSE,FALSE,,FALSE,FALSE,FALSE,FALSE,FALSE,FALSE,FALSE,FALSE,FALSE,FALSE,FALSE,FALSE,FALSE,FALSE,FALSE,FALSE,FALSE,,FALSE,FALSE,,,FALSE,FALSE,FALSE,FALSE,FALSE,,,SMD,2001-05-15T17:00:16,jhm,2002-10-21T16:14:15
C/EGD/1684,1684,EGD,-1,A/EGD/1670,1/8/1662,1962-08-01T00:00:00,1/8/1662,1962-08-01T00:00:00,,"Muir,Jonet",,,,,,,FALSE,FALSE,FALSE,FALSE,FALSE,FALSE,FALSE,FALSE,FALSE,FALSE,FALSE,FALSE,FALSE,FALSE,FALSE,FALSE,FALSE,FALSE,FALSE,FALSE,FALSE,FALSE,FALSE,FALSE,FALSE,FALSE,FALSE,FALSE,FALSE,FALSE,0,,TRUE,TRUE,FALSE,FALSE,0,,FALSE,,FALSE,,FALSE,FALSE,FALSE,FALSE,FALSE,FALSE,FALSE,,,,FALSE,FALSE,FALSE,FALSE,FALSE,FALSE,FALSE,FALSE,FALSE,FALSE,,FALSE,FALSE,FALSE,FALSE,FALSE,FALSE,FALSE,FALSE,FALSE,FALSE,FALSE,FALSE,FALSE,FALSE,FALSE,FALSE,FALSE,,FALSE,FALSE,,,FALSE,FALSE,FALSE,FALSE,FALSE,,,SMD,2001-05-15T17:00:16,jhm,2002-10-21T16:15:10
C/EGD/1685,1685,EGD,-1,A/EGD/1671,1/8/1662,1962-08-01T00:00:00,1/8/1662,1962-08-01T00:00:00,,"Holm,Jonet",,,,,,,FALSE,FALSE,FALSE,FALSE,FALSE,FALSE,FALSE,FALSE,FALSE,FALSE,FALSE,FALSE,FALSE,FALSE,FALSE,FALSE,FALSE,FALSE,FALSE,FALSE,FALSE,FALSE,FALSE,FALSE,FALSE,FALSE,FALSE,FALSE,FALSE,FALSE,0,,TRUE,TRUE,FALSE,FALSE,0,,FALSE,,FALSE,,FALSE,FALSE,FALSE,FALSE,FALSE,FALSE,FALSE,,,,FALSE,FALSE,FALSE,FALSE,FALSE,FALSE,FALSE,FALSE,FALSE,FALSE,,FALSE,FALSE,FALSE,FALSE,FALSE,FALSE,FALSE,FALSE,FALSE,FALSE,FALSE,FALSE,FALSE,FALSE,FALSE,FALSE,FALSE,,FALSE,FALSE,,,FALSE,FALSE,FALSE,FALSE,FALSE,,,SMD,2001-05-15T17:00:16,jhm,2002-10-21T16:16:04
C/EGD/1686,1686,EGD,-1,A/EGD/1672,1/8/1662,1962-08-01T00:00:00,1/8/1662,1962-08-01T00:00:00,,"Gibson,Agnes",,,,,,,FALSE,FALSE,FALSE,FALSE,FALSE,FALSE,FALSE,FALSE,FALSE,FALSE,FALSE,FALSE,FALSE,FALSE,FALSE,FALSE,FALSE,FALSE,FALSE,FALSE,FALSE,FALSE,FALSE,FALSE,FALSE,FALSE,FALSE,FALSE,FALSE,FALSE,0,,TRUE,TRUE,FALSE,FALSE,0,,FALSE,,FALSE,,FALSE,FALSE,FALSE,FALSE,FALSE,FALSE,FALSE,,,,FALSE,FALSE,FALSE,FALSE,FALSE,FALSE,FALSE,FALSE,FALSE,FALSE,,FALSE,FALSE,FALSE,FALSE,FALSE,FALSE,FALSE,FALSE,FALSE,FALSE,FALSE,FALSE,FALSE,FALSE,FALSE,FALSE,FALSE,,FALSE,FALSE,,,FALSE,FALSE,FALSE,FALSE,FALSE,,,SMD,2001-05-15T17:00:16,jhm,2002-10-21T16:16:41
C/EGD/1687,1687,EGD,-1,A/EGD/1673,1/8/1662,1962-08-01T00:00:00,1/8/1662,1962-08-01T00:00:00,,"Alexander,Jonet",,,,,,,FALSE,FALSE,FALSE,FALSE,FALSE,FALSE,FALSE,FALSE,FALSE,FALSE,FALSE,FALSE,FALSE,FALSE,FALSE,FALSE,FALSE,FALSE,FALSE,FALSE,FALSE,FALSE,FALSE,FALSE,FALSE,FALSE,FALSE,FALSE,FALSE,FALSE,0,,TRUE,TRUE,FALSE,FALSE,0,,FALSE,,FALSE,,FALSE,FALSE,FALSE,FALSE,FALSE,FALSE,FALSE,,,,FALSE,FALSE,FALSE,FALSE,FALSE,FALSE,FALSE,FALSE,FALSE,FALSE,,FALSE,FALSE,FALSE,FALSE,FALSE,FALSE,FALSE,FALSE,FALSE,FALSE,FALSE,FALSE,FALSE,FALSE,FALSE,FALSE,FALSE,,FALSE,FALSE,,,FALSE,FALSE,FALSE,FALSE,FALSE,,,SMD,2001-05-15T17:00:16,jhm,2002-10-21T16:17:02
C/EGD/1688,1688,EGD,-1,A/EGD/1674,1/8/1662,1962-08-01T00:00:00,1/8/1662,1962-08-01T00:00:00,,"Gray,Vylet",,,,,,,FALSE,FALSE,FALSE,FALSE,FALSE,FALSE,FALSE,FALSE,FALSE,FALSE,FALSE,FALSE,FALSE,FALSE,FALSE,FALSE,FALSE,FALSE,FALSE,FALSE,FALSE,FALSE,FALSE,FALSE,FALSE,FALSE,FALSE,FALSE,FALSE,FALSE,0,,TRUE,TRUE,FALSE,FALSE,0,,FALSE,,FALSE,,FALSE,FALSE,FALSE,FALSE,FALSE,FALSE,FALSE,,,,FALSE,FALSE,FALSE,FALSE,FALSE,FALSE,FALSE,FALSE,FALSE,FALSE,,FALSE,FALSE,FALSE,FALSE,FALSE,FALSE,FALSE,FALSE,FALSE,FALSE,FALSE,FALSE,FALSE,FALSE,FALSE,FALSE,FALSE,,FALSE,FALSE,,,FALSE,FALSE,FALSE,FALSE,FALSE,,,SMD,2001-05-15T17:00:16,jhm,2002-10-21T16:17:35
C/EGD/1689,1689,EGD,-1,A/EGD/1675,1/8/1662,1962-08-01T00:00:00,1/8/1662,1962-08-01T00:00:00,,"Bog,James",,,,,,,FALSE,FALSE,FALSE,FALSE,FALSE,FALSE,FALSE,FALSE,FALSE,FALSE,FALSE,FALSE,FALSE,FALSE,FALSE,FALSE,FALSE,FALSE,FALSE,FALSE,FALSE,FALSE,FALSE,FALSE,FALSE,FALSE,FALSE,FALSE,FALSE,FALSE,0,,TRUE,TRUE,FALSE,FALSE,0,,FALSE,,FALSE,,FALSE,FALSE,FALSE,FALSE,FALSE,FALSE,FALSE,,,,FALSE,FALSE,FALSE,FALSE,FALSE,FALSE,FALSE,FALSE,FALSE,FALSE,,FALSE,FALSE,FALSE,FALSE,FALSE,FALSE,FALSE,FALSE,FALSE,FALSE,FALSE,FALSE,FALSE,FALSE,FALSE,FALSE,FALSE,,FALSE,FALSE,,,FALSE,FALSE,FALSE,FALSE,FALSE,,,SMD,2001-05-15T17:00:16,jhm,2002-10-21T16:18:17
C/EGD/169,169,EGD,-1,A/EGD/158,22/1/1630,2030-01-22T00:00:00,2/4/1631,2031-04-02T00:00:00,41,"Neill,Jon",,,,,,,FALSE,FALSE,FALSE,FALSE,FALSE,TRUE,FALSE,FALSE,FALSE,FALSE,TRUE,TRUE,FALSE,TRUE,FALSE,FALSE,FALSE,TRUE,FALSE,FALSE,FALSE,FALSE,FALSE,FALSE,FALSE,FALSE,FALSE,FALSE,FALSE,FALSE,5,,FALSE,FALSE,FALSE,FALSE,0,"All of his accusations involved folk healing.  Especially transfering disease from a sick person to someone else during a healing ritual.  He seems to have been caught up by Manderston, the witch hunter.  Neill was accused of participating in the supposed plot to kill Sir George Home of Manderston and several other justice officials (a clerk, a bailie and a minister).  He was paid for his services and seems to have been widely consulted, especially for his ability to tell whether a sick person would live or die.",FALSE,,TRUE,,TRUE,FALSE,FALSE,FALSE,FALSE,FALSE,FALSE,,,Was accused of being at several witches' meetings and asking the Devil for the power to kill Manderston and others.,FALSE,FALSE,FALSE,TRUE,FALSE,FALSE,FALSE,FALSE,TRUE,FALSE,"He was also accused of being part of supposed conspiracy to kill Sir George Home of Manderston, using a dead enchanted foil (bird) and a dead man's hand.",TRUE,TRUE,FALSE,FALSE,FALSE,FALSE,FALSE,TRUE,TRUE,FALSE,FALSE,TRUE,FALSE,TRUE,TRUE,FALSE,FALSE,"He had a wide range for curing-all over Berwickshire, Berwick, Grenis (?), Paxton, Foulden, Chirnside.  Accusations sprang from people getting sick and dying after a disease transfer.",FALSE,FALSE,,,FALSE,FALSE,FALSE,FALSE,FALSE,,"Neill fled to England, and King Charles I wrote a letter to his northern justice officials to arrest him and send him back to Scotland for trial.",SMD,2001-05-15T17:00:16,LEM,2002-11-18T15:40:29
C/EGD/1833,1833,EGD,-1,A/EGD/1807,4/5/1650,1950-05-04T00:00:00,4/5/1640,2040-05-04T00:00:00,,"Turnbull,Margaret",,,,,,,FALSE,FALSE,FALSE,FALSE,FALSE,FALSE,FALSE,FALSE,FALSE,FALSE,FALSE,FALSE,FALSE,FALSE,FALSE,FALSE,FALSE,FALSE,FALSE,FALSE,FALSE,FALSE,FALSE,FALSE,FALSE,FALSE,FALSE,FALSE,FALSE,FALSE,0,,TRUE,TRUE,FALSE,FALSE,0,,FALSE,,FALSE,,FALSE,FALSE,FALSE,FALSE,FALSE,FALSE,FALSE,,,,FALSE,FALSE,FALSE,FALSE,FALSE,FALSE,FALSE,FALSE,FALSE,FALSE,,FALSE,FALSE,FALSE,FALSE,FALSE,FALSE,FALSE,FALSE,FALSE,FALSE,FALSE,FALSE,FALSE,FALSE,FALSE,FALSE,FALSE,,FALSE,FALSE,,,FALSE,FALSE,FALSE,FALSE,FALSE,,The project did not check Larner's reference to this printed secondary source as part of the research.,SMD,2001-05-15T17:00:16,jhm,2002-10-22T13:51:56
C/EGD/1834,1834,EGD,-1,A/EGD/1808,7/10/1649,2049-10-07T00:00:00,12/1649,2049-12-01T00:00:00,,"Chisholm,Mary",,,,,,,FALSE,FALSE,FALSE,FALSE,FALSE,TRUE,FALSE,FALSE,FALSE,FALSE,FALSE,FALSE,FALSE,FALSE,FALSE,FALSE,TRUE,TRUE,FALSE,FALSE,FALSE,FALSE,FALSE,FALSE,FALSE,FALSE,FALSE,FALSE,FALSE,FALSE,3,,FALSE,TRUE,FALSE,FALSE,0,Demonic included as she was searched by a pricker,FALSE,,FALSE,,FALSE,FALSE,FALSE,FALSE,FALSE,FALSE,FALSE,,,,FALSE,FALSE,FALSE,FALSE,FALSE,FALSE,FALSE,FALSE,FALSE,FALSE,,FALSE,FALSE,FALSE,FALSE,FALSE,FALSE,FALSE,FALSE,FALSE,FALSE,FALSE,FALSE,FALSE,FALSE,FALSE,FALSE,FALSE,,FALSE,FALSE,,,FALSE,FALSE,FALSE,FALSE,FALSE,,,SMD,2001-05-15T17:00:16,jhm,2002-10-22T13:53:22
C/EGD/1835,1835,EGD,-1,A/EGD/1809,7/5/1650,1950-05-07T00:00:00,7/5/1650,1950-05-07T00:00:00,,"Cunnyngham,Marion",,,,,,,FALSE,FALSE,FALSE,FALSE,FALSE,FALSE,FALSE,FALSE,FALSE,FALSE,FALSE,FALSE,FALSE,FALSE,FALSE,FALSE,FALSE,FALSE,FALSE,FALSE,FALSE,FALSE,FALSE,FALSE,FALSE,FALSE,FALSE,FALSE,FALSE,FALSE,0,,TRUE,TRUE,FALSE,FALSE,0,,FALSE,,FALSE,,FALSE,FALSE,FALSE,FALSE,FALSE,FALSE,FALSE,,,,FALSE,FALSE,FALSE,FALSE,FALSE,FALSE,FALSE,FALSE,FALSE,FALSE,,FALSE,FALSE,FALSE,FALSE,FALSE,FALSE,FALSE,FALSE,FALSE,FALSE,FALSE,FALSE,FALSE,FALSE,FALSE,FALSE,FALSE,,FALSE,FALSE,,,FALSE,FALSE,FALSE,FALSE,FALSE,,The project did not check Larner's reference to this printed secondary source as part of the research.,SMD,2001-05-15T17:00:16,LEM,2002-12-06T12:18:27
C/EGD/1836,1836,EGD,-1,A/EGD/1810,1/5/1650,1950-05-01T00:00:00,1/5/1650,1950-05-01T00:00:00,,"Smelie,Janet",,,,,,,FALSE,FALSE,FALSE,FALSE,FALSE,FALSE,FALSE,FALSE,FALSE,FALSE,FALSE,FALSE,FALSE,FALSE,FALSE,FALSE,FALSE,FALSE,FALSE,FALSE,FALSE,FALSE,FALSE,FALSE,FALSE,FALSE,FALSE,FALSE,FALSE,FALSE,0,,TRUE,TRUE,FALSE,FALSE,0,,FALSE,,FALSE,,FALSE,FALSE,FALSE,FALSE,FALSE,FALSE,FALSE,,,,FALSE,FALSE,FALSE,FALSE,FALSE,FALSE,FALSE,FALSE,FALSE,FALSE,,FALSE,FALSE,FALSE,FALSE,FALSE,FALSE,FALSE,FALSE,FALSE,FALSE,FALSE,FALSE,FALSE,FALSE,FALSE,FALSE,FALSE,,FALSE,FALSE,,,FALSE,FALSE,FALSE,FALSE,FALSE,,,SMD,2001-05-15T17:00:16,jhm,2002-10-22T13:55:34
C/EGD/1837,1837,EGD,0,,,,1650,1950-07-06T00:00:00,,(certain persons),,,,,,6,FALSE,FALSE,FALSE,FALSE,FALSE,FALSE,FALSE,FALSE,FALSE,FALSE,FALSE,FALSE,FALSE,FALSE,FALSE,FALSE,FALSE,FALSE,FALSE,FALSE,FALSE,FALSE,FALSE,FALSE,FALSE,FALSE,FALSE,FALSE,FALSE,FALSE,0,,FALSE,FALSE,FALSE,FALSE,0,,FALSE,,FALSE,,FALSE,FALSE,FALSE,FALSE,FALSE,FALSE,FALSE,,,,FALSE,FALSE,FALSE,FALSE,FALSE,FALSE,FALSE,FALSE,FALSE,FALSE,,FALSE,FALSE,FALSE,FALSE,FALSE,FALSE,FALSE,FALSE,FALSE,FALSE,FALSE,FALSE,FALSE,FALSE,FALSE,FALSE,FALSE,,FALSE,FALSE,,,FALSE,FALSE,FALSE,FALSE,FALSE,,"(certain persons) R Wodrow 'Analeca Scotica' Edinburgh, 1842-3,  Vol 2 P2 p. 72.
Not checked by the project.",SMD,2001-05-15T17:00:16,jhm,2002-10-22T13:58:49
C/EGD/1838,1838,EGD,-1,A/EGD/1811,16/7/1650,1950-07-16T00:00:00,16/7/1650,1950-07-16T00:00:00,,"Hewison,Jonet",,,,,,,FALSE,FALSE,FALSE,FALSE,FALSE,FALSE,FALSE,FALSE,FALSE,FALSE,FALSE,FALSE,FALSE,FALSE,FALSE,FALSE,FALSE,FALSE,FALSE,FALSE,FALSE,FALSE,FALSE,FALSE,FALSE,FALSE,FALSE,FALSE,FALSE,FALSE,0,,TRUE,TRUE,FALSE,FALSE,0,,FALSE,,FALSE,,FALSE,FALSE,FALSE,FALSE,FALSE,FALSE,FALSE,,,,FALSE,FALSE,FALSE,FALSE,FALSE,FALSE,FALSE,FALSE,FALSE,FALSE,,FALSE,FALSE,FALSE,FALSE,FALSE,FALSE,FALSE,FALSE,FALSE,FALSE,FALSE,FALSE,FALSE,FALSE,FALSE,FALSE,FALSE,,FALSE,FALSE,,,FALSE,FALSE,FALSE,FALSE,FALSE,,,SMD,2001-05-15T17:00:16,LEM,2002-12-06T12:11:48
C/EGD/1839,1839,EGD,-1,A/EGD/1812,5/6/1644,2044-06-05T00:00:00,23/10/1650,1950-10-23T00:00:00,,"Grant,William",,,,,,,FALSE,FALSE,FALSE,FALSE,FALSE,FALSE,FALSE,FALSE,FALSE,FALSE,FALSE,FALSE,FALSE,FALSE,FALSE,FALSE,FALSE,FALSE,FALSE,FALSE,FALSE,FALSE,FALSE,FALSE,FALSE,FALSE,FALSE,FALSE,FALSE,FALSE,0,,TRUE,TRUE,FALSE,FALSE,0,,FALSE,,FALSE,,FALSE,FALSE,FALSE,FALSE,FALSE,FALSE,FALSE,,,,FALSE,FALSE,FALSE,FALSE,FALSE,FALSE,FALSE,FALSE,FALSE,FALSE,,FALSE,FALSE,FALSE,FALSE,FALSE,FALSE,FALSE,FALSE,FALSE,FALSE,FALSE,FALSE,FALSE,FALSE,FALSE,FALSE,FALSE,,FALSE,FALSE,,,FALSE,FALSE,FALSE,FALSE,FALSE,,,SMD,2001-05-15T17:00:16,jhm,2002-10-22T14:03:51
C/EGD/184,184,EGD,-1,A/EGD/173,16/10/1643,2043-10-16T00:00:00,29/3/1645,2045-03-29T00:00:00,50,"Clerk,Helene",,,,,,,FALSE,FALSE,FALSE,FALSE,FALSE,TRUE,FALSE,FALSE,FALSE,FALSE,FALSE,FALSE,FALSE,TRUE,FALSE,FALSE,FALSE,FALSE,TRUE,TRUE,FALSE,FALSE,FALSE,FALSE,FALSE,FALSE,FALSE,FALSE,FALSE,FALSE,4,,FALSE,FALSE,FALSE,FALSE,0,Also testified that she (Helen) was cured by a spae wife 20 years before she was investigated.,FALSE,,FALSE,,FALSE,FALSE,FALSE,FALSE,FALSE,FALSE,FALSE,,,,FALSE,FALSE,FALSE,FALSE,FALSE,FALSE,FALSE,FALSE,FALSE,FALSE,Helen was cured by a spae wife of South Leith 20 years ago who was burnt for witchcraft. The spae wife was called Elspeth the spae wife.  She was offered a chopping (chopin) of ale.  And people asked her for their health back.,FALSE,FALSE,FALSE,FALSE,FALSE,FALSE,FALSE,FALSE,FALSE,FALSE,TRUE,TRUE,FALSE,FALSE,FALSE,FALSE,FALSE,"Quarrels with other boatmen regarding her son.  She made threats over unpaid debts, and poor quality of commissioned boots.  Cursed because a man refused to marry her daughter.",TRUE,TRUE,Supposedly raised a storm in Newhaven harbour.  She predicted that there wouldn't be enough salt for the Dunbar herring drove.,,FALSE,FALSE,FALSE,FALSE,FALSE,,,SMD,2001-05-15T17:00:16,jhm,2002-11-13T16:07:06
C/EGD/1840,1840,EGD,-1,A/EGD/1813,1650,1950-06-01T00:00:00,1650,1950-06-01T00:00:00,,"Galloway,Janet",,,,,,,FALSE,FALSE,FALSE,FALSE,FALSE,FALSE,FALSE,FALSE,FALSE,FALSE,FALSE,FALSE,FALSE,FALSE,FALSE,FALSE,FALSE,FALSE,FALSE,FALSE,FALSE,FALSE,FALSE,FALSE,FALSE,FALSE,FALSE,FALSE,FALSE,FALSE,0,,TRUE,TRUE,FALSE,FALSE,0,,FALSE,,FALSE,,FALSE,FALSE,FALSE,FALSE,FALSE,FALSE,FALSE,,,,FALSE,FALSE,FALSE,FALSE,FALSE,FALSE,FALSE,FALSE,FALSE,FALSE,,FALSE,FALSE,FALSE,FALSE,FALSE,FALSE,FALSE,FALSE,FALSE,FALSE,FALSE,FALSE,FALSE,FALSE,FALSE,FALSE,FALSE,,FALSE,FALSE,,,FALSE,FALSE,FALSE,FALSE,FALSE,,The project did not check Larner's reference to this printed secondary source as part of the research.,SMD,2001-05-15T17:00:16,jhm,2002-10-22T14:09:59
C/EGD/1841,1841,EGD,-1,A/EGD/1814,21/3/1650,1950-03-21T00:00:00,21/3/1650,1950-03-21T00:00:00,,"Finlayson,Unknown",,,,,,,FALSE,FALSE,FALSE,FALSE,FALSE,FALSE,FALSE,FALSE,FALSE,FALSE,FALSE,FALSE,FALSE,TRUE,FALSE,FALSE,FALSE,FALSE,FALSE,FALSE,FALSE,FALSE,FALSE,FALSE,FALSE,FALSE,FALSE,FALSE,FALSE,TRUE,2,Sorcery,TRUE,TRUE,FALSE,FALSE,0,,FALSE,,FALSE,,FALSE,FALSE,FALSE,FALSE,FALSE,FALSE,FALSE,,,,FALSE,FALSE,FALSE,FALSE,FALSE,FALSE,FALSE,FALSE,FALSE,FALSE,,FALSE,FALSE,TRUE,FALSE,FALSE,FALSE,FALSE,FALSE,FALSE,FALSE,FALSE,FALSE,FALSE,FALSE,FALSE,FALSE,FALSE,Witness claimed that the accused could harm animals and that she agreed not to so because he had threatened to have her burnt.,FALSE,FALSE,,,FALSE,FALSE,FALSE,FALSE,FALSE,,,SMD,2001-05-15T17:00:16,jhm,2002-11-21T13:51:34
C/EGD/210,210,EGD,-1,A/EGD/199,21/1/1650,1950-01-21T00:00:00,21/1/1650,1950-01-21T00:00:00,,"Paton,Thomas",,,,,,,FALSE,FALSE,FALSE,FALSE,FALSE,FALSE,FALSE,FALSE,FALSE,FALSE,TRUE,TRUE,FALSE,TRUE,FALSE,FALSE,FALSE,FALSE,FALSE,TRUE,FALSE,FALSE,FALSE,FALSE,FALSE,FALSE,FALSE,FALSE,FALSE,FALSE,4,,FALSE,FALSE,FALSE,FALSE,0,He was a healing team with his wife so I have ticked folk healing for his characterisation.  It was their folk healing practice that got them into trouble.,FALSE,,FALSE,,FALSE,FALSE,FALSE,FALSE,FALSE,FALSE,FALSE,,,,FALSE,FALSE,TRUE,FALSE,FALSE,FALSE,FALSE,FALSE,FALSE,FALSE,Told a man to seek the moulles (chilblaines?) of a black cow.  He supposedly spoke words of healing that caused a whole house and bed to shake the sick people recovered.,TRUE,TRUE,FALSE,FALSE,FALSE,FALSE,FALSE,FALSE,FALSE,FALSE,TRUE,TRUE,FALSE,TRUE,TRUE,FALSE,FALSE,"He healed as well as the quarrel, curse misfortune sequence.  He was paid for healing.  Quarrels concerned pasturing sheep and horses, selling and buying.  Their servant said he laid on illnesses, his wife lifted them.",FALSE,FALSE,,,FALSE,FALSE,FALSE,FALSE,FALSE,,Part of a group of 7 investigated by the presbytery of Dumfries on this date.,SMD,2001-05-15T17:00:16,jhm,2002-10-23T16:41:37
C/EGD/2100,2100,EGD,-1,A/EGD/2052,,,,,,"Reid,Margaret",,,,,,,FALSE,FALSE,FALSE,FALSE,FALSE,FALSE,FALSE,FALSE,FALSE,FALSE,FALSE,FALSE,FALSE,FALSE,FALSE,FALSE,FALSE,FALSE,FALSE,FALSE,FALSE,FALSE,FALSE,FALSE,FALSE,FALSE,FALSE,FALSE,FALSE,FALSE,0,,TRUE,TRUE,FALSE,FALSE,0,,FALSE,,FALSE,,FALSE,FALSE,FALSE,FALSE,FALSE,FALSE,FALSE,,,,FALSE,FALSE,FALSE,FALSE,FALSE,FALSE,FALSE,FALSE,FALSE,FALSE,,FALSE,FALSE,FALSE,FALSE,FALSE,FALSE,FALSE,FALSE,FALSE,FALSE,FALSE,FALSE,FALSE,FALSE,FALSE,FALSE,FALSE,,FALSE,FALSE,,,FALSE,FALSE,FALSE,FALSE,FALSE,,The project did not check Larner's reference to this printed secondary source as part of the research.,SMD,2001-05-15T17:00:16,jhm,2002-10-23T16:42:55
C/EGD/2101,2101,EGD,-1,A/EGD/2053,,,,,,"Unknown,Curate of Anstruther",,,,,,,FALSE,FALSE,FALSE,FALSE,FALSE,FALSE,FALSE,FALSE,FALSE,FALSE,FALSE,FALSE,FALSE,FALSE,FALSE,FALSE,FALSE,FALSE,FALSE,FALSE,FALSE,FALSE,FALSE,FALSE,FALSE,FALSE,FALSE,FALSE,FALSE,FALSE,0,,TRUE,TRUE,FALSE,FALSE,0,,FALSE,,FALSE,,FALSE,FALSE,FALSE,FALSE,FALSE,FALSE,FALSE,,,,FALSE,FALSE,FALSE,FALSE,FALSE,FALSE,FALSE,FALSE,FALSE,FALSE,,FALSE,FALSE,FALSE,FALSE,FALSE,FALSE,FALSE,FALSE,FALSE,FALSE,FALSE,FALSE,FALSE,FALSE,FALSE,FALSE,FALSE,,FALSE,FALSE,,,FALSE,FALSE,FALSE,FALSE,FALSE,,The project did not check Larner's reference to this printed secondary source as part of the research.,SMD,2001-05-15T17:00:16,jhm,2002-10-23T16:45:34
C/EGD/2102,2102,EGD,-1,A/EGD/2054,8/1569,1969-08-01T00:00:00,8/1569,1969-08-01T00:00:00,,"Stewart,William",,,,,,,FALSE,FALSE,FALSE,FALSE,FALSE,FALSE,FALSE,FALSE,FALSE,FALSE,FALSE,FALSE,FALSE,FALSE,FALSE,FALSE,FALSE,FALSE,FALSE,FALSE,FALSE,FALSE,FALSE,FALSE,FALSE,FALSE,FALSE,TRUE,FALSE,FALSE,1,,TRUE,TRUE,FALSE,FALSE,0,,FALSE,,FALSE,,FALSE,FALSE,FALSE,FALSE,FALSE,FALSE,FALSE,,,,FALSE,FALSE,FALSE,FALSE,FALSE,FALSE,FALSE,FALSE,FALSE,FALSE,,FALSE,FALSE,FALSE,FALSE,FALSE,FALSE,FALSE,FALSE,FALSE,FALSE,FALSE,FALSE,FALSE,FALSE,FALSE,FALSE,FALSE,,FALSE,FALSE,,,FALSE,FALSE,FALSE,FALSE,FALSE,,,SMD,2001-05-15T17:00:16,jhm,2002-10-23T16:46:35
C/EGD/2103,2103,EGD,-1,A/EGD/2055,25/1/1576,1976-01-25T00:00:00,25/1/1576,1976-01-25T00:00:00,,"Smytht,Mariorye",,,,,,,FALSE,FALSE,FALSE,FALSE,FALSE,FALSE,FALSE,FALSE,FALSE,FALSE,FALSE,FALSE,FALSE,FALSE,FALSE,FALSE,FALSE,FALSE,FALSE,FALSE,FALSE,FALSE,FALSE,FALSE,FALSE,FALSE,FALSE,FALSE,FALSE,FALSE,0,,TRUE,TRUE,FALSE,FALSE,0,,FALSE,,FALSE,,FALSE,FALSE,FALSE,FALSE,FALSE,FALSE,FALSE,,,,FALSE,FALSE,FALSE,FALSE,FALSE,FALSE,FALSE,FALSE,FALSE,FALSE,,FALSE,FALSE,FALSE,FALSE,FALSE,FALSE,FALSE,FALSE,FALSE,FALSE,FALSE,FALSE,FALSE,FALSE,FALSE,FALSE,FALSE,,FALSE,FALSE,,,FALSE,FALSE,FALSE,FALSE,FALSE,,The project did not check Larner's reference to this printed secondary source as part of the research.,SMD,2001-05-15T17:00:16,LEM,2002-12-05T14:21:48
C/EGD/2104,2104,EGD,-1,A/EGD/2056,30/7/1580,1980-07-30T00:00:00,30/7/1580,1980-07-30T00:00:00,,"Gib,Anne",,,,,,,FALSE,FALSE,FALSE,FALSE,FALSE,FALSE,FALSE,FALSE,FALSE,FALSE,FALSE,FALSE,FALSE,FALSE,FALSE,FALSE,FALSE,FALSE,FALSE,FALSE,FALSE,FALSE,FALSE,FALSE,FALSE,FALSE,FALSE,FALSE,FALSE,FALSE,0,,TRUE,TRUE,FALSE,FALSE,0,,FALSE,,FALSE,,FALSE,FALSE,FALSE,FALSE,FALSE,FALSE,FALSE,,,,FALSE,FALSE,FALSE,FALSE,FALSE,FALSE,FALSE,FALSE,FALSE,FALSE,,FALSE,FALSE,FALSE,FALSE,FALSE,FALSE,FALSE,FALSE,FALSE,FALSE,FALSE,FALSE,FALSE,FALSE,FALSE,FALSE,FALSE,,FALSE,FALSE,,,FALSE,FALSE,FALSE,FALSE,FALSE,,,SMD,2001-05-15T17:00:16,jhm,2002-10-23T16:48:19
C/EGD/2105,2105,EGD,-1,A/EGD/2057,26/10/1581,1981-10-26T00:00:00,26/10/1581,1981-10-26T00:00:00,,"Robertsoune,Bessy",,,,,,,FALSE,FALSE,FALSE,FALSE,FALSE,FALSE,FALSE,FALSE,FALSE,FALSE,FALSE,FALSE,FALSE,FALSE,FALSE,FALSE,FALSE,FALSE,FALSE,FALSE,FALSE,FALSE,FALSE,FALSE,FALSE,FALSE,FALSE,FALSE,FALSE,FALSE,0,,TRUE,TRUE,FALSE,FALSE,0,,FALSE,,FALSE,,FALSE,FALSE,FALSE,FALSE,FALSE,FALSE,FALSE,,,,FALSE,FALSE,FALSE,FALSE,FALSE,FALSE,FALSE,FALSE,FALSE,FALSE,,FALSE,FALSE,FALSE,FALSE,FALSE,FALSE,FALSE,FALSE,FALSE,FALSE,FALSE,FALSE,FALSE,FALSE,FALSE,FALSE,FALSE,,FALSE,FALSE,,,FALSE,FALSE,FALSE,FALSE,FALSE,,The project did not check Larner's reference to this printed secondary source as part of the research.,SMD,2001-05-15T17:00:16,jhm,2002-10-23T16:48:52
C/EGD/2106,2106,EGD,-1,A/EGD/2058,9/5/1586,1986-05-09T00:00:00,9/5/1586,1986-05-09T00:00:00,,"Findlaw,James",,,,,,,FALSE,FALSE,TRUE,TRUE,FALSE,FALSE,FALSE,FALSE,FALSE,FALSE,FALSE,FALSE,FALSE,FALSE,FALSE,FALSE,FALSE,FALSE,FALSE,FALSE,FALSE,FALSE,FALSE,FALSE,FALSE,FALSE,FALSE,FALSE,FALSE,FALSE,2,,FALSE,FALSE,FALSE,FALSE,0,They consulted Tibbie Smart,FALSE,,FALSE,,FALSE,FALSE,FALSE,FALSE,FALSE,FALSE,FALSE,,,,FALSE,FALSE,FALSE,FALSE,FALSE,FALSE,FALSE,FALSE,FALSE,FALSE,,FALSE,TRUE,FALSE,FALSE,FALSE,FALSE,FALSE,FALSE,FALSE,FALSE,FALSE,FALSE,FALSE,FALSE,FALSE,FALSE,FALSE,,FALSE,FALSE,,,FALSE,FALSE,FALSE,FALSE,FALSE,,,SMD,2001-05-15T17:00:16,jhm,2002-10-23T16:49:33
C/EGD/2107,2107,EGD,0,,1586,1986-06-01T00:00:00,1586,1986-06-01T00:00:00,,3 unnamed witches,,,,,,3,FALSE,FALSE,FALSE,FALSE,FALSE,FALSE,FALSE,FALSE,FALSE,FALSE,FALSE,FALSE,FALSE,FALSE,FALSE,FALSE,FALSE,FALSE,FALSE,FALSE,FALSE,FALSE,FALSE,FALSE,FALSE,FALSE,FALSE,FALSE,FALSE,FALSE,0,,TRUE,TRUE,FALSE,FALSE,0,,FALSE,,FALSE,,FALSE,FALSE,FALSE,FALSE,FALSE,FALSE,FALSE,,,,FALSE,FALSE,FALSE,FALSE,FALSE,FALSE,FALSE,FALSE,FALSE,FALSE,,FALSE,FALSE,FALSE,FALSE,FALSE,FALSE,FALSE,FALSE,FALSE,FALSE,FALSE,FALSE,FALSE,FALSE,FALSE,FALSE,FALSE,,FALSE,FALSE,,,FALSE,FALSE,FALSE,FALSE,FALSE,,"unnamed witches. See also J G Dalyell 'The Darker Superstition of Scotland' Edinburgh, 1833, p. 373.

The project did not check Larner's reference to this printed secondary source as part of the research.",SMD,2001-05-15T17:00:16,jhm,2002-10-23T16:51:52
C/EGD/2108,2108,EGD,-1,A/EGD/2059,2/11/1589,1989-11-02T00:00:00,2/11/1589,1989-11-02T00:00:00,,"Watson,Cruddal",,,,,,,FALSE,FALSE,FALSE,FALSE,FALSE,FALSE,FALSE,FALSE,FALSE,FALSE,FALSE,FALSE,FALSE,FALSE,FALSE,FALSE,FALSE,FALSE,FALSE,FALSE,FALSE,FALSE,FALSE,FALSE,FALSE,FALSE,FALSE,FALSE,FALSE,FALSE,0,,TRUE,TRUE,FALSE,FALSE,0,,FALSE,,FALSE,,FALSE,FALSE,FALSE,FALSE,FALSE,FALSE,FALSE,,,,FALSE,FALSE,FALSE,FALSE,FALSE,FALSE,FALSE,FALSE,FALSE,FALSE,,FALSE,FALSE,FALSE,FALSE,FALSE,FALSE,FALSE,FALSE,FALSE,FALSE,FALSE,FALSE,FALSE,FALSE,FALSE,FALSE,FALSE,,FALSE,FALSE,,,FALSE,FALSE,FALSE,FALSE,FALSE,,,SMD,2001-05-15T17:00:16,jhm,2002-12-03T12:07:36
C/EGD/296,296,EGD,-1,A/EGD/285,11/5/1658,1958-05-11T00:00:00,1/1/1662,1962-01-01T00:00:00,,"Black,Elizabeth",,,,,,,FALSE,FALSE,FALSE,FALSE,FALSE,FALSE,FALSE,FALSE,FALSE,FALSE,FALSE,FALSE,FALSE,TRUE,FALSE,FALSE,FALSE,TRUE,FALSE,FALSE,FALSE,FALSE,FALSE,FALSE,FALSE,FALSE,FALSE,FALSE,FALSE,FALSE,2,,TRUE,TRUE,FALSE,FALSE,0,,FALSE,,FALSE,,FALSE,FALSE,FALSE,FALSE,FALSE,FALSE,FALSE,,,,FALSE,FALSE,FALSE,FALSE,FALSE,FALSE,FALSE,FALSE,FALSE,FALSE,,TRUE,FALSE,FALSE,FALSE,FALSE,FALSE,FALSE,FALSE,FALSE,FALSE,FALSE,FALSE,FALSE,FALSE,FALSE,FALSE,FALSE,,FALSE,FALSE,,,FALSE,FALSE,FALSE,FALSE,FALSE,,"She was tried twice (with two others).  In her first trial on 23/3/1659 in the circuit court she was found guilty and ordered to be transported.  Until that could be arranged she was to be held in Stirling prison.  Apparently after two years of imprisonment they petitioned privy council, who ordered another trial due to irregularities in the first one.  The second trial was a local one, we don't know the outcome.",SMD,2001-05-15T17:00:16,jhm,2002-11-04T09:20:55
C/EGD/297,297,EGD,-1,A/EGD/286,11/5/1658,1958-05-11T00:00:00,23/6/1658,1958-06-23T00:00:00,45,"Duchill,Margaret",,,,,,,FALSE,FALSE,FALSE,FALSE,TRUE,TRUE,FALSE,FALSE,FALSE,TRUE,FALSE,FALSE,FALSE,TRUE,FALSE,FALSE,FALSE,TRUE,FALSE,FALSE,FALSE,FALSE,FALSE,FALSE,FALSE,FALSE,FALSE,FALSE,FALSE,FALSE,5,,FALSE,FALSE,FALSE,FALSE,0,,FALSE,Claimed the devil was called 'Johne'. He lay on top of her cow and was like a cow.,TRUE,,TRUE,TRUE,FALSE,FALSE,FALSE,TRUE,FALSE,,,Several meetings at various places. Often met at the house of the person who they intended to harm,TRUE,FALSE,FALSE,FALSE,FALSE,TRUE,FALSE,FALSE,FALSE,FALSE,Often met the devil and others at 12 o'clock at night.,TRUE,TRUE,FALSE,TRUE,FALSE,FALSE,FALSE,FALSE,FALSE,FALSE,TRUE,FALSE,FALSE,FALSE,FALSE,FALSE,FALSE,Confessed that she complained to the devil about people who had insulted her or owed the group money and the devil would punish them and kill them. Caused death of people and animals. Took a man and tried to drown him.,TRUE,FALSE,,,FALSE,FALSE,FALSE,FALSE,FALSE,,,SMD,2001-05-15T17:00:16,jhm,2002-11-13T16:15:04
C/EGD/299,299,EGD,-1,A/EGD/288,11/5/1658,1958-05-11T00:00:00,1/1/1662,1962-01-01T00:00:00,,"Black,Kathrin",,,,,,,FALSE,FALSE,FALSE,FALSE,FALSE,TRUE,FALSE,FALSE,FALSE,FALSE,FALSE,FALSE,FALSE,TRUE,FALSE,FALSE,FALSE,TRUE,FALSE,FALSE,FALSE,FALSE,FALSE,FALSE,FALSE,FALSE,FALSE,FALSE,FALSE,FALSE,3,,TRUE,TRUE,FALSE,FALSE,0,Witness statements said that people overheard her talking about the Devil.  But not enough information to make a solid characterisation.,FALSE,Mention of giving her daughter over to the Devil. The circuit court handwritting is difficult to make out.,TRUE,,FALSE,FALSE,FALSE,FALSE,FALSE,FALSE,FALSE,,,,FALSE,FALSE,FALSE,FALSE,FALSE,FALSE,FALSE,FALSE,FALSE,FALSE,,TRUE,FALSE,TRUE,FALSE,FALSE,FALSE,FALSE,FALSE,TRUE,FALSE,FALSE,FALSE,FALSE,FALSE,FALSE,FALSE,FALSE,Accused of malefices.,TRUE,FALSE,,,FALSE,FALSE,FALSE,FALSE,FALSE,,"She was ordered to be released from prison on 28/12/1658 due to ill health (bloody flux).  She was tried twice (with two others).  In her first trial on 23/3/1659 in the circuit court she was found guilty and ordered to be transported.  Until that could be arranged she was to be held in Stirling prison.  Apparently after two years of imprisonment they petitioned privy council, who ordered another trial due to irregularities in the first trial.  The second trial was a local one, we don't know the outcome.",SMD,2001-05-15T17:00:16,jhm,2002-11-04T09:45:13
C/EGD/30,30,EGD,-1,A/EGD/19,4/5/1577,1977-05-04T00:00:00,4/5/1577,1977-05-04T00:00:00,,"Kynimonth,Eduart",,,,,,,FALSE,FALSE,FALSE,FALSE,FALSE,FALSE,FALSE,FALSE,FALSE,FALSE,FALSE,FALSE,FALSE,FALSE,FALSE,FALSE,FALSE,FALSE,FALSE,FALSE,FALSE,FALSE,FALSE,FALSE,FALSE,FALSE,FALSE,FALSE,FALSE,FALSE,0,,TRUE,TRUE,FALSE,FALSE,0,,FALSE,,FALSE,,FALSE,FALSE,FALSE,FALSE,FALSE,FALSE,FALSE,,,,FALSE,FALSE,FALSE,FALSE,FALSE,FALSE,FALSE,FALSE,FALSE,FALSE,,FALSE,FALSE,FALSE,FALSE,FALSE,FALSE,FALSE,FALSE,FALSE,FALSE,FALSE,FALSE,FALSE,FALSE,FALSE,FALSE,FALSE,,FALSE,FALSE,,,FALSE,FALSE,FALSE,FALSE,FALSE,,,SMD,2001-05-15T17:00:16,jhm,2002-11-04T14:45:17
C/EGD/301,301,EGD,-1,A/EGD/290,25/10/1643,2043-10-25T00:00:00,14/1/1658,1958-01-14T00:00:00,,"Beverage,Margaret",,,,,,,FALSE,FALSE,FALSE,FALSE,FALSE,TRUE,FALSE,FALSE,FALSE,FALSE,FALSE,FALSE,FALSE,FALSE,FALSE,FALSE,FALSE,TRUE,FALSE,FALSE,FALSE,FALSE,FALSE,FALSE,FALSE,FALSE,FALSE,FALSE,FALSE,FALSE,2,,TRUE,TRUE,FALSE,FALSE,0,,FALSE,,TRUE,,TRUE,FALSE,FALSE,FALSE,FALSE,TRUE,FALSE,,,,FALSE,FALSE,FALSE,FALSE,FALSE,FALSE,FALSE,FALSE,FALSE,FALSE,,FALSE,FALSE,FALSE,FALSE,FALSE,FALSE,FALSE,FALSE,FALSE,FALSE,FALSE,FALSE,FALSE,FALSE,FALSE,FALSE,FALSE,,FALSE,FALSE,,,FALSE,FALSE,FALSE,FALSE,FALSE,,Notes on her case go from 1643 to 1658.,SMD,2001-05-15T17:00:16,jhm,2002-11-04T12:39:21
C/EGD/302,302,EGD,-1,A/EGD/291,2/2/1658,1958-02-02T00:00:00,6/4/1658,1958-04-06T00:00:00,,"Steil,Janet",,,,,,,FALSE,FALSE,FALSE,FALSE,FALSE,TRUE,FALSE,FALSE,FALSE,FALSE,FALSE,FALSE,FALSE,FALSE,FALSE,FALSE,FALSE,FALSE,FALSE,FALSE,FALSE,FALSE,FALSE,FALSE,FALSE,FALSE,FALSE,FALSE,FALSE,FALSE,1,,TRUE,TRUE,FALSE,FALSE,0,,FALSE,Confessed to being with the Devil.,FALSE,,FALSE,FALSE,FALSE,FALSE,FALSE,FALSE,FALSE,,,,FALSE,FALSE,FALSE,FALSE,FALSE,FALSE,FALSE,FALSE,FALSE,FALSE,,FALSE,FALSE,FALSE,FALSE,FALSE,FALSE,FALSE,FALSE,FALSE,FALSE,FALSE,FALSE,FALSE,FALSE,FALSE,FALSE,FALSE,,FALSE,FALSE,,,FALSE,FALSE,FALSE,FALSE,FALSE,,,SMD,2001-05-15T17:00:16,jhm,2002-11-04T12:45:16
C/EGD/303,303,EGD,-1,A/EGD/292,2/2/1658,1958-02-02T00:00:00,6/4/1658,1958-04-06T00:00:00,10,"Wallas,Unknown",,,,,,,FALSE,FALSE,FALSE,FALSE,FALSE,TRUE,FALSE,FALSE,FALSE,FALSE,FALSE,FALSE,FALSE,FALSE,FALSE,FALSE,FALSE,FALSE,FALSE,FALSE,FALSE,FALSE,FALSE,FALSE,FALSE,FALSE,FALSE,FALSE,FALSE,FALSE,1,,TRUE,TRUE,FALSE,FALSE,0,,FALSE,,TRUE,,TRUE,FALSE,FALSE,FALSE,FALSE,FALSE,FALSE,,,,FALSE,FALSE,FALSE,FALSE,FALSE,FALSE,FALSE,FALSE,FALSE,FALSE,,FALSE,FALSE,FALSE,FALSE,FALSE,FALSE,FALSE,FALSE,FALSE,FALSE,FALSE,FALSE,FALSE,FALSE,FALSE,FALSE,FALSE,,FALSE,FALSE,,,FALSE,FALSE,FALSE,FALSE,FALSE,,,SMD,2001-05-15T17:00:16,jhm,2002-11-21T13:59:14
C/EGD/304,304,EGD,-1,A/EGD/293,23/1/1659,1959-01-23T00:00:00,23/1/1659,1959-01-23T00:00:00,,"Wilsoune,Marrion",,,,,,,FALSE,FALSE,FALSE,FALSE,FALSE,FALSE,FALSE,FALSE,FALSE,FALSE,FALSE,FALSE,FALSE,FALSE,FALSE,FALSE,FALSE,FALSE,FALSE,FALSE,FALSE,FALSE,FALSE,FALSE,FALSE,FALSE,FALSE,FALSE,FALSE,FALSE,0,,TRUE,TRUE,FALSE,FALSE,0,,FALSE,,FALSE,,FALSE,FALSE,FALSE,FALSE,FALSE,FALSE,FALSE,,,,FALSE,FALSE,FALSE,FALSE,FALSE,FALSE,FALSE,FALSE,FALSE,FALSE,,FALSE,FALSE,FALSE,FALSE,FALSE,FALSE,FALSE,FALSE,FALSE,FALSE,FALSE,FALSE,FALSE,FALSE,FALSE,FALSE,FALSE,,FALSE,FALSE,,,FALSE,FALSE,FALSE,FALSE,FALSE,,"Larner et al., 'Source-book' listed this case (#289) as being from JC26/26 C.  However, the 'Survey' looked through this box and did not find the case.  Larner has this case as mentioned as a witch in someone else's trial.  That means we do not have a trial record for this person.",SMD,2001-05-15T17:00:16,jhm,2002-11-04T12:49:03
C/EGD/305,305,EGD,-1,A/EGD/294,23/1/1659,1959-01-23T00:00:00,23/1/1659,1959-01-23T00:00:00,,"Kemp,Isobel",,,,,,,FALSE,FALSE,FALSE,FALSE,FALSE,FALSE,FALSE,FALSE,FALSE,FALSE,FALSE,FALSE,FALSE,FALSE,FALSE,FALSE,FALSE,FALSE,FALSE,FALSE,FALSE,FALSE,FALSE,FALSE,FALSE,FALSE,FALSE,FALSE,FALSE,FALSE,0,,TRUE,TRUE,FALSE,FALSE,0,,FALSE,,FALSE,,FALSE,FALSE,FALSE,FALSE,FALSE,FALSE,FALSE,,,,FALSE,FALSE,FALSE,FALSE,FALSE,FALSE,FALSE,FALSE,FALSE,FALSE,,FALSE,FALSE,FALSE,FALSE,FALSE,FALSE,FALSE,FALSE,FALSE,FALSE,FALSE,FALSE,FALSE,FALSE,FALSE,FALSE,FALSE,,FALSE,FALSE,,,FALSE,FALSE,FALSE,FALSE,FALSE,,"Larner et al., 'Source-book' listed this case (#290) as being from JC26/26 C.  However, the 'Survey' looked through this box and did not find the case.  Larner has this case as mentioned as a witch in someone else's trial.  That means we do not have a trial record for this person.",SMD,2001-05-15T17:00:16,jhm,2002-11-04T12:49:27
C/EGD/307,307,EGD,-1,A/EGD/296,23/6/1658,1958-06-23T00:00:00,23/3/1659,1959-03-23T00:00:00,,"Millar,Janet",,,,,,,FALSE,FALSE,FALSE,FALSE,FALSE,FALSE,FALSE,FALSE,FALSE,FALSE,FALSE,FALSE,FALSE,FALSE,FALSE,FALSE,FALSE,TRUE,FALSE,FALSE,FALSE,FALSE,FALSE,FALSE,FALSE,FALSE,FALSE,FALSE,FALSE,FALSE,1,,TRUE,TRUE,FALSE,FALSE,0,,FALSE,"A man in black was at the food party, but doesn't specify that it was the Devil.",FALSE,,FALSE,FALSE,FALSE,FALSE,FALSE,FALSE,FALSE,,,"A description of a table laid out with 'boylies, beif and bread' at M. Gourley's house.  Janet was offered food but refused.  Doesn't specify that it was a witches meeting.  Suspicious things were seen, a black corbie with a black man.",FALSE,FALSE,FALSE,FALSE,FALSE,FALSE,FALSE,FALSE,FALSE,FALSE,"Confessed to doing something with woollen yarn placed around, the text is unclear.",FALSE,FALSE,FALSE,FALSE,FALSE,FALSE,FALSE,FALSE,FALSE,FALSE,FALSE,FALSE,FALSE,FALSE,FALSE,FALSE,FALSE,,FALSE,FALSE,She was accused of being an accomplice to Gourley's (c/egd/308) firestarting.  She claimed that she and Gourley took 5 burning coals and put them in places of the house that burnt down.,,FALSE,FALSE,FALSE,FALSE,FALSE,,,SMD,2001-05-15T17:00:16,jhm,2002-11-04T14:56:19
C/EGD/480,480,EGD,-1,A/EGD/469,17/4/1662,1962-04-17T00:00:00,17/4/1662,1962-04-17T00:00:00,,"Gulvitas,wife of Richard",,,,,,,FALSE,FALSE,FALSE,FALSE,FALSE,FALSE,FALSE,FALSE,FALSE,FALSE,FALSE,FALSE,FALSE,FALSE,FALSE,FALSE,FALSE,TRUE,FALSE,FALSE,FALSE,FALSE,FALSE,FALSE,FALSE,FALSE,FALSE,FALSE,FALSE,FALSE,1,,TRUE,TRUE,FALSE,FALSE,0,Denounced by James Welch.,FALSE,,FALSE,,FALSE,FALSE,FALSE,FALSE,FALSE,FALSE,FALSE,,,"Was accused by James Welch of being at 3 meetings with the Devil - West Kill of Haddington, Lethair Burn and Kirkyard of Haddington on 5/9/1659, but no details from the accused.",FALSE,FALSE,FALSE,FALSE,FALSE,FALSE,FALSE,FALSE,FALSE,FALSE,,FALSE,FALSE,FALSE,FALSE,FALSE,FALSE,FALSE,FALSE,FALSE,FALSE,FALSE,FALSE,FALSE,FALSE,FALSE,FALSE,FALSE,,FALSE,FALSE,,,FALSE,FALSE,FALSE,FALSE,FALSE,,Part of the large number of people denounced by James Welch.  He was deemed too young to stand trial so he was imprisoned.  But his confession and some of his denunciations were taken seriously by the authorities.,SMD,2001-05-15T17:00:16,jhm,2002-11-07T11:40:00
C/EGD/481,481,EGD,-1,A/EGD/470,17/4/1662,1962-04-17T00:00:00,17/4/1662,1962-04-17T00:00:00,,"Conglitoun,Barbara",,,,,,,FALSE,FALSE,FALSE,FALSE,FALSE,FALSE,FALSE,FALSE,FALSE,FALSE,FALSE,FALSE,FALSE,FALSE,FALSE,FALSE,FALSE,TRUE,FALSE,FALSE,FALSE,FALSE,FALSE,FALSE,FALSE,FALSE,FALSE,FALSE,FALSE,FALSE,1,,TRUE,TRUE,FALSE,FALSE,0,Denounced by James Welch.,FALSE,,FALSE,,FALSE,FALSE,FALSE,FALSE,FALSE,FALSE,FALSE,,,"Was accused by James Welch of being at 3 meetings with the Devil - West Kill of Haddington, Lethair Burn and Kirkyard of Haddington on 5/9/1659. No details from Congilton.",FALSE,FALSE,FALSE,FALSE,FALSE,FALSE,FALSE,FALSE,FALSE,FALSE,,FALSE,FALSE,FALSE,FALSE,FALSE,FALSE,FALSE,FALSE,FALSE,FALSE,FALSE,FALSE,FALSE,FALSE,FALSE,FALSE,FALSE,,FALSE,FALSE,,,FALSE,FALSE,FALSE,FALSE,FALSE,,Part of the large number of people denounced by James Welch.  He was deemed too young to stand trial so he was imprisoned.  But his confession and some of his denunciations were taken seriously by the authorities.,SMD,2001-05-15T17:00:16,jhm,2002-11-07T11:41:08
C/EGD/482,482,EGD,-1,A/EGD/471,17/4/1662,1962-04-17T00:00:00,17/4/1662,1962-04-17T00:00:00,,"Nymmo,Violet",,,,,,,FALSE,FALSE,FALSE,FALSE,FALSE,FALSE,FALSE,FALSE,FALSE,FALSE,FALSE,FALSE,FALSE,FALSE,FALSE,FALSE,FALSE,TRUE,FALSE,FALSE,FALSE,FALSE,FALSE,FALSE,FALSE,FALSE,FALSE,FALSE,FALSE,FALSE,1,,TRUE,TRUE,FALSE,FALSE,0,Denounced by James Welch.,FALSE,,FALSE,,FALSE,FALSE,FALSE,FALSE,FALSE,FALSE,FALSE,,,"Was accused by James Welch of being at 3 meetings with the Devil - West Kill of Haddington, Lethair Burn and Kirkyard of Haddington on 5/9/1659. No details from Nymmo herself.",FALSE,FALSE,FALSE,FALSE,FALSE,FALSE,FALSE,FALSE,FALSE,FALSE,,FALSE,FALSE,FALSE,FALSE,FALSE,FALSE,FALSE,FALSE,FALSE,FALSE,FALSE,FALSE,FALSE,FALSE,FALSE,FALSE,FALSE,,FALSE,FALSE,,,FALSE,FALSE,FALSE,FALSE,FALSE,,Part of the large number of people denounced by James Welch.  He was deemed too young to stand trial so he was imprisoned.  But his confession and some of his denunciations were taken seriously by the authorities.,SMD,2001-05-15T17:00:16,jhm,2002-11-07T11:42:52
C/EGD/483,483,EGD,-1,A/EGD/472,17/4/1662,1962-04-17T00:00:00,17/4/1662,1962-04-17T00:00:00,,"Thomason,Bessie",,,,,,,FALSE,FALSE,FALSE,FALSE,FALSE,FALSE,FALSE,FALSE,FALSE,FALSE,FALSE,FALSE,FALSE,FALSE,FALSE,FALSE,FALSE,TRUE,FALSE,FALSE,FALSE,FALSE,FALSE,FALSE,FALSE,FALSE,FALSE,FALSE,FALSE,FALSE,1,,TRUE,TRUE,FALSE,FALSE,0,Denounced by James Welch.,FALSE,,FALSE,,FALSE,FALSE,FALSE,FALSE,FALSE,FALSE,FALSE,,,"Was accused by James Welch of being at 3 meetings with the Devil - West Kill of Haddington, Lethair Burn and Kirkyard of Haddington on 5/9/1659. Nothing from Thomason.",FALSE,FALSE,FALSE,FALSE,FALSE,FALSE,FALSE,FALSE,FALSE,FALSE,,FALSE,FALSE,FALSE,FALSE,FALSE,FALSE,FALSE,FALSE,FALSE,FALSE,FALSE,FALSE,FALSE,FALSE,FALSE,FALSE,FALSE,,FALSE,FALSE,,,FALSE,FALSE,FALSE,FALSE,FALSE,,Part of the large number of people denounced by James Welch.  He was deemed too young to stand trial so he was imprisoned.  But his confession and some of his denunciations were taken seriously by the authorities.,SMD,2001-05-15T17:00:16,jhm,2002-11-07T11:44:40
C/EGD/485,485,EGD,-1,A/EGD/474,17/4/1662,1962-04-17T00:00:00,17/4/1662,1962-04-17T00:00:00,,"Dykis,Walter",,,,,,,FALSE,FALSE,FALSE,FALSE,FALSE,FALSE,FALSE,FALSE,FALSE,FALSE,FALSE,FALSE,FALSE,FALSE,FALSE,FALSE,FALSE,TRUE,FALSE,FALSE,FALSE,FALSE,FALSE,FALSE,FALSE,FALSE,FALSE,FALSE,FALSE,FALSE,1,,TRUE,TRUE,FALSE,FALSE,0,Denounced by James Welch.,FALSE,,FALSE,,FALSE,FALSE,FALSE,FALSE,FALSE,FALSE,FALSE,,,"Was accused by James Welch of being at 3 meetings with the Devil - West Kill of Haddington, Lethair Burn and Kirkyard of Haddington on 5/9/1659. No details from Dykis.",FALSE,FALSE,FALSE,FALSE,FALSE,FALSE,FALSE,FALSE,FALSE,FALSE,,FALSE,FALSE,FALSE,FALSE,FALSE,FALSE,FALSE,FALSE,FALSE,FALSE,FALSE,FALSE,FALSE,FALSE,FALSE,FALSE,FALSE,,FALSE,FALSE,,,FALSE,FALSE,FALSE,FALSE,FALSE,,Part of the large number of people denounced by James Welch.  He was deemed too young to stand trial so he was imprisoned.  But his confession and some of his denunciations were taken seriously by the authorities.,SMD,2001-05-15T17:00:16,jhm,2002-11-07T11:45:45
C/EGD/486,486,EGD,-1,A/EGD/475,3/5/1661,1961-05-03T00:00:00,17/4/1662,1962-04-17T00:00:00,,"Wilsone,Jonnet",,,,,,,FALSE,FALSE,FALSE,FALSE,FALSE,TRUE,FALSE,FALSE,FALSE,FALSE,FALSE,FALSE,FALSE,FALSE,FALSE,FALSE,FALSE,TRUE,FALSE,FALSE,FALSE,FALSE,FALSE,FALSE,FALSE,FALSE,FALSE,FALSE,FALSE,FALSE,2,,TRUE,TRUE,FALSE,FALSE,0,Denounced by James Welch,FALSE,,FALSE,,FALSE,FALSE,FALSE,FALSE,FALSE,FALSE,FALSE,,,"Accused by James Welch of being at 3 meetings with the Devil - West Kill of Haddington, Lethair Burn and Kirkyard of Haddington on 5/9/1659. No details from Wilsone.",FALSE,FALSE,FALSE,FALSE,FALSE,FALSE,FALSE,FALSE,FALSE,FALSE,,FALSE,FALSE,FALSE,FALSE,FALSE,FALSE,FALSE,FALSE,FALSE,FALSE,FALSE,FALSE,FALSE,FALSE,FALSE,FALSE,FALSE,,FALSE,FALSE,,,FALSE,FALSE,FALSE,FALSE,FALSE,,Part of the large number of people denounced by James Welch.  He was deemed too young to stand trial so he was imprisoned.  But his confession and some of his denunciations were taken seriously by the authorities.,SMD,2001-05-15T17:00:16,jhm,2002-11-07T11:46:40
C/EGD/487,487,EGD,-1,A/EGD/476,17/4/1662,1962-04-17T00:00:00,17/4/1662,1962-04-17T00:00:00,,"Martin,William",,,,,,,FALSE,FALSE,FALSE,FALSE,FALSE,FALSE,FALSE,FALSE,FALSE,FALSE,FALSE,FALSE,FALSE,FALSE,FALSE,FALSE,FALSE,TRUE,FALSE,FALSE,FALSE,FALSE,FALSE,FALSE,FALSE,FALSE,FALSE,FALSE,FALSE,FALSE,1,,TRUE,TRUE,FALSE,FALSE,0,Denounced by James Welch.,FALSE,,FALSE,,FALSE,FALSE,FALSE,FALSE,FALSE,FALSE,FALSE,,,"Was accused by James Welch of being at 3 meetings with the Devil - West Kill of Haddington, Lethair Burn and Kirkyard of Haddington on 5/9/1659. No details from Martin.",FALSE,FALSE,FALSE,FALSE,FALSE,FALSE,FALSE,FALSE,FALSE,FALSE,,FALSE,FALSE,FALSE,FALSE,FALSE,FALSE,FALSE,FALSE,FALSE,FALSE,FALSE,FALSE,FALSE,FALSE,FALSE,FALSE,FALSE,,FALSE,FALSE,,,FALSE,FALSE,FALSE,FALSE,FALSE,,Part of the large number of people denounced by James Welch.  He was deemed too young to stand trial so he was imprisoned.  But his confession and some of his denunciations were taken seriously by the authorities.,SMD,2001-05-15T17:00:16,jhm,2002-11-07T11:47:44
C/EGD/488,488,EGD,-1,A/EGD/477,17/4/1662,1962-04-17T00:00:00,17/4/1662,1962-04-17T00:00:00,,"Dickson,Edward",,,,,,,FALSE,FALSE,FALSE,FALSE,FALSE,FALSE,FALSE,FALSE,FALSE,FALSE,FALSE,FALSE,FALSE,FALSE,FALSE,FALSE,FALSE,TRUE,FALSE,FALSE,FALSE,FALSE,FALSE,FALSE,FALSE,FALSE,FALSE,FALSE,FALSE,FALSE,1,,TRUE,TRUE,FALSE,FALSE,0,Denounced by James Welch.,FALSE,,FALSE,,FALSE,FALSE,FALSE,FALSE,FALSE,FALSE,FALSE,,,"Was accused by James Welch of being at 3 meetings with the Devil - West Kill of Haddington, Lethair Burn and Kirkyard of Haddington on 5/9/1659. Nothing from Dickson.",FALSE,FALSE,FALSE,FALSE,FALSE,FALSE,FALSE,FALSE,FALSE,FALSE,,FALSE,FALSE,FALSE,FALSE,FALSE,FALSE,FALSE,FALSE,FALSE,FALSE,FALSE,FALSE,FALSE,FALSE,FALSE,FALSE,FALSE,,FALSE,FALSE,,,FALSE,FALSE,FALSE,FALSE,FALSE,,Part of the large number of people denounced by James Welch.  He was deemed too young to stand trial so he was imprisoned.  But his confession and some of his denunciations were taken seriously by the authorities.,SMD,2001-05-15T17:00:16,jhm,2002-11-07T11:48:42
C/EGD/489,489,EGD,-1,A/EGD/478,17/4/1662,1962-04-17T00:00:00,17/4/1662,1962-04-17T00:00:00,,"Birks,Helen",,,,,,,FALSE,FALSE,FALSE,FALSE,FALSE,FALSE,FALSE,FALSE,FALSE,FALSE,FALSE,FALSE,FALSE,FALSE,FALSE,FALSE,FALSE,TRUE,FALSE,FALSE,FALSE,FALSE,FALSE,FALSE,FALSE,FALSE,FALSE,FALSE,FALSE,FALSE,1,,TRUE,TRUE,FALSE,FALSE,0,Denounced by James Welch.,FALSE,,FALSE,,FALSE,FALSE,FALSE,FALSE,FALSE,FALSE,FALSE,,,"Was accused by James Welch of being at 3 meetings with the Devil - West Kill of Haddington, Lethair Burn and Kirkyard of Haddington on 5/9/1659. No details from Birks.",FALSE,FALSE,FALSE,FALSE,FALSE,FALSE,FALSE,FALSE,FALSE,FALSE,,FALSE,FALSE,FALSE,FALSE,FALSE,FALSE,FALSE,FALSE,FALSE,FALSE,FALSE,FALSE,FALSE,FALSE,FALSE,FALSE,FALSE,,FALSE,FALSE,,,FALSE,FALSE,FALSE,FALSE,FALSE,,Part of the large number of people denounced by James Welch.  He was deemed too young to stand trial so he was imprisoned.  But his confession and some of his denunciations were taken seriously by the authorities.,SMD,2001-05-15T17:00:16,jhm,2002-11-07T11:49:38
C/EGD/49,49,EGD,-1,A/EGD/38,25/10/1577,1977-10-25T00:00:00,22/7/1590,1990-07-22T00:00:00,,"Roy,Agnes",,,,,,,FALSE,FALSE,FALSE,FALSE,FALSE,FALSE,FALSE,FALSE,FALSE,FALSE,FALSE,FALSE,FALSE,FALSE,FALSE,FALSE,FALSE,TRUE,FALSE,FALSE,FALSE,TRUE,FALSE,TRUE,FALSE,FALSE,FALSE,FALSE,FALSE,FALSE,3,,TRUE,TRUE,FALSE,FALSE,0,"She was part of a large group of known witches and assistants to Lady fowlis' supposed plot to destroy members of her family.  This is a a very standard type of early case where witchcraft was used to alter inheretance of land, titles, and property",FALSE,,FALSE,,FALSE,FALSE,FALSE,FALSE,FALSE,FALSE,FALSE,,,,FALSE,FALSE,FALSE,TRUE,FALSE,FALSE,FALSE,FALSE,TRUE,FALSE,Said by Ross to have used wax/clay images to cause harm.,FALSE,TRUE,FALSE,FALSE,FALSE,FALSE,FALSE,FALSE,FALSE,FALSE,FALSE,FALSE,TRUE,FALSE,FALSE,FALSE,FALSE,,FALSE,FALSE,,,FALSE,FALSE,FALSE,FALSE,FALSE,,,SMD,2001-05-15T17:00:16,LEM,2002-11-07T16:22:37
C/EGD/1266,1266,EGD,-1,A/EGD/1254,13/4/1632,2032-04-13T00:00:00,5/6/1632,2032-06-05T00:00:00,,"Love,Janet",,,,,,,FALSE,FALSE,FALSE,FALSE,FALSE,FALSE,FALSE,FALSE,FALSE,FALSE,FALSE,FALSE,FALSE,FALSE,FALSE,FALSE,FALSE,TRUE,FALSE,FALSE,FALSE,FALSE,FALSE,FALSE,FALSE,FALSE,FALSE,FALSE,FALSE,FALSE,1,,TRUE,TRUE,FALSE,FALSE,0,,FALSE,,FALSE,,FALSE,FALSE,FALSE,FALSE,FALSE,FALSE,FALSE,,,,FALSE,FALSE,FALSE,FALSE,FALSE,FALSE,FALSE,FALSE,FALSE,FALSE,,FALSE,FALSE,FALSE,FALSE,FALSE,FALSE,FALSE,FALSE,FALSE,FALSE,FALSE,FALSE,FALSE,FALSE,FALSE,FALSE,FALSE,,FALSE,FALSE,,,FALSE,FALSE,FALSE,FALSE,FALSE,,,SMD,2001-05-15T17:00:16,jhm,2002-10-03T11:26:19
C/EGD/1267,1267,EGD,0,,23/2/1632,2032-02-23T00:00:00,23/2/1632,2032-02-23T00:00:00,,1 unnamed witch,Gardener's wife,,,,,1,FALSE,FALSE,FALSE,FALSE,FALSE,FALSE,FALSE,FALSE,FALSE,FALSE,FALSE,FALSE,FALSE,FALSE,FALSE,FALSE,FALSE,FALSE,FALSE,FALSE,FALSE,FALSE,FALSE,FALSE,FALSE,FALSE,FALSE,FALSE,FALSE,FALSE,0,,TRUE,TRUE,FALSE,FALSE,0,,FALSE,,FALSE,,FALSE,FALSE,FALSE,FALSE,FALSE,FALSE,FALSE,,,,FALSE,FALSE,FALSE,FALSE,FALSE,FALSE,FALSE,FALSE,FALSE,FALSE,,FALSE,FALSE,FALSE,FALSE,FALSE,FALSE,FALSE,FALSE,FALSE,FALSE,FALSE,FALSE,FALSE,FALSE,FALSE,FALSE,FALSE,,FALSE,FALSE,,,FALSE,FALSE,FALSE,FALSE,FALSE,,"The Gardener's wife was mentioned as being accused of witchcraft by John (james?) Balfour of Corhous, a Witch-pricker, who was summond to appear before the Privy Council to explain his procedures.",SMD,2001-05-15T17:00:16,jhm,2002-10-03T11:28:53
C/EGD/1268,1268,EGD,-1,A/EGD/1256,17/3/1633,2033-03-17T00:00:00,30/5/1633,2033-05-30T00:00:00,,"Layland,Marion",,,,,,,FALSE,TRUE,FALSE,FALSE,FALSE,TRUE,FALSE,FALSE,FALSE,FALSE,FALSE,TRUE,FALSE,TRUE,FALSE,FALSE,FALSE,FALSE,FALSE,TRUE,FALSE,FALSE,FALSE,FALSE,FALSE,TRUE,FALSE,FALSE,FALSE,FALSE,6,,TRUE,TRUE,FALSE,TRUE,1,"Not only was she refused alms followed by a curse, but she also refused to give others alms and then cursed people who did give others alms.",FALSE,,TRUE,,TRUE,FALSE,FALSE,FALSE,FALSE,FALSE,FALSE,,,Her son found her in the house with another witch and the Devil.,FALSE,FALSE,FALSE,TRUE,FALSE,FALSE,FALSE,TRUE,TRUE,FALSE,"Protective magic used to increase people's fishing catch - she washed the unsuccessfull fisherman's cat's feet with the fishing bait water and threw the water out to sea after him.  She removed a bewitchment from someone.  To remove a forspeaking, she took a cup of water, put big salt into it and then spit into it.",TRUE,FALSE,TRUE,TRUE,FALSE,TRUE,FALSE,FALSE,TRUE,TRUE,TRUE,TRUE,FALSE,FALSE,TRUE,FALSE,FALSE,Took away wet nurse's milk in revenge for a quarrel.  Used water to undo forspeaking (ie bewitchment).  Took away cow's milk. Revenge after someone stole Marion's kale.  She struck a man in the back and he lost the power to do his duty towards his wife.,TRUE,FALSE,,,FALSE,FALSE,FALSE,FALSE,FALSE,,,SMD,2001-05-15T17:00:16,jhm,2002-11-13T15:59:07
C/EGD/1269,1269,EGD,-1,A/EGD/1257,17/3/1633,2033-03-17T00:00:00,29/5/1633,2033-05-29T00:00:00,,"Grieve,Katherene",,,,,,,FALSE,FALSE,FALSE,FALSE,FALSE,TRUE,FALSE,FALSE,FALSE,FALSE,FALSE,TRUE,FALSE,TRUE,FALSE,FALSE,FALSE,FALSE,TRUE,TRUE,FALSE,FALSE,FALSE,FALSE,FALSE,FALSE,FALSE,FALSE,FALSE,FALSE,5,,FALSE,FALSE,FALSE,TRUE,1,,FALSE,,TRUE,,FALSE,FALSE,FALSE,FALSE,FALSE,FALSE,FALSE,,,the meeting was witnessed by the son of her co-accused.,FALSE,FALSE,FALSE,FALSE,FALSE,FALSE,FALSE,FALSE,FALSE,FALSE,,TRUE,FALSE,FALSE,FALSE,FALSE,FALSE,FALSE,FALSE,FALSE,FALSE,TRUE,TRUE,FALSE,FALSE,FALSE,TRUE,FALSE,,FALSE,FALSE,,,FALSE,FALSE,FALSE,FALSE,FALSE,,,SMD,2001-05-15T17:00:16,jhm,2002-11-13T15:59:22
C/EGD/127,127,EGD,-1,A/EGD/116,15/12/1594,1994-12-15T00:00:00,15/12/1594,1994-12-15T00:00:00,,"Balfour,Alesoun",,,,,,,FALSE,FALSE,FALSE,FALSE,FALSE,FALSE,FALSE,FALSE,FALSE,FALSE,FALSE,TRUE,FALSE,TRUE,FALSE,FALSE,FALSE,TRUE,FALSE,FALSE,FALSE,TRUE,FALSE,FALSE,FALSE,FALSE,FALSE,FALSE,TRUE,TRUE,6,witch for hire,FALSE,FALSE,FALSE,FALSE,0,"She was hired by a Patrick Stewart to poison his brother.  He was acquitted, she was executed in the locality.  Patrick Stewart tried to kill his brother many times, assault, poison, then with the witch.",FALSE,,FALSE,,FALSE,FALSE,FALSE,FALSE,FALSE,FALSE,FALSE,,,,FALSE,FALSE,FALSE,FALSE,FALSE,FALSE,FALSE,FALSE,FALSE,FALSE,,FALSE,TRUE,FALSE,FALSE,FALSE,FALSE,FALSE,FALSE,FALSE,FALSE,FALSE,FALSE,TRUE,TRUE,TRUE,FALSE,FALSE,She confessed that she was not a witch but was hired to heal the Lady of Stenhous,FALSE,FALSE,,,FALSE,FALSE,FALSE,FALSE,FALSE,,,SMD,2001-05-15T17:00:16,jhm,2002-11-12T14:50:08
C/EGD/1270,1270,EGD,-1,A/EGD/1258,14/12/1633,2033-12-14T00:00:00,4/6/1634,2034-06-04T00:00:00,,"Sinclair,Isabel",,,,,,,FALSE,FALSE,FALSE,FALSE,FALSE,FALSE,FALSE,FALSE,FALSE,FALSE,FALSE,FALSE,FALSE,FALSE,FALSE,FALSE,FALSE,TRUE,FALSE,FALSE,FALSE,FALSE,FALSE,FALSE,FALSE,FALSE,FALSE,FALSE,FALSE,FALSE,1,,TRUE,TRUE,FALSE,FALSE,0,,FALSE,,FALSE,,FALSE,FALSE,FALSE,FALSE,FALSE,FALSE,FALSE,,,,FALSE,FALSE,FALSE,FALSE,FALSE,FALSE,FALSE,FALSE,FALSE,FALSE,,FALSE,FALSE,FALSE,FALSE,FALSE,FALSE,FALSE,FALSE,FALSE,FALSE,FALSE,FALSE,FALSE,FALSE,FALSE,FALSE,FALSE,,FALSE,FALSE,,,FALSE,FALSE,FALSE,FALSE,FALSE,,,SMD,2001-05-15T17:00:16,LEM,2002-10-10T14:21:52
C/EGD/1271,1271,EGD,-1,A/EGD/1259,4/6/1634,2034-06-04T00:00:00,4/6/1634,2034-06-04T00:00:00,,"Smith,Patrick",,,,,,,FALSE,FALSE,FALSE,FALSE,FALSE,FALSE,FALSE,FALSE,FALSE,FALSE,FALSE,FALSE,FALSE,FALSE,FALSE,FALSE,FALSE,TRUE,FALSE,FALSE,FALSE,FALSE,FALSE,FALSE,FALSE,FALSE,FALSE,FALSE,FALSE,FALSE,1,,TRUE,TRUE,FALSE,FALSE,0,,FALSE,,FALSE,,FALSE,FALSE,FALSE,FALSE,FALSE,FALSE,FALSE,,,,FALSE,FALSE,FALSE,FALSE,FALSE,FALSE,FALSE,FALSE,FALSE,FALSE,,FALSE,FALSE,FALSE,FALSE,FALSE,FALSE,FALSE,FALSE,FALSE,FALSE,FALSE,FALSE,FALSE,FALSE,FALSE,FALSE,FALSE,,FALSE,FALSE,,,FALSE,FALSE,FALSE,FALSE,FALSE,,,SMD,2001-05-15T17:00:16,jhm,2002-10-03T11:42:31
C/EGD/1272,1272,EGD,-1,A/EGD/1260,24/3/1629,2029-03-24T00:00:00,24/3/1629,2029-03-24T00:00:00,,"Williamson,Janet",,,,,,,FALSE,FALSE,FALSE,FALSE,FALSE,FALSE,FALSE,FALSE,FALSE,FALSE,FALSE,FALSE,FALSE,TRUE,FALSE,FALSE,FALSE,TRUE,FALSE,FALSE,FALSE,FALSE,FALSE,FALSE,FALSE,FALSE,FALSE,FALSE,FALSE,FALSE,2,,TRUE,TRUE,FALSE,FALSE,0,,FALSE,,FALSE,,FALSE,FALSE,FALSE,FALSE,FALSE,FALSE,FALSE,,,Accused of being at three meetings by another accused witch.,FALSE,FALSE,FALSE,FALSE,FALSE,FALSE,FALSE,FALSE,FALSE,FALSE,,FALSE,FALSE,FALSE,FALSE,FALSE,FALSE,FALSE,FALSE,FALSE,FALSE,FALSE,FALSE,FALSE,FALSE,FALSE,FALSE,FALSE,,FALSE,FALSE,burned a mill; destroyed ships during a herring drove,,FALSE,FALSE,FALSE,FALSE,FALSE,,,SMD,2001-05-15T17:00:16,jhm,2002-10-10T15:34:25
C/EGD/1274,1274,EGD,-1,A/EGD/1262,6/9/1633,2033-09-06T00:00:00,4/6/1634,2034-06-04T00:00:00,,"Mearns,William",,,,,,,FALSE,FALSE,FALSE,FALSE,FALSE,FALSE,FALSE,FALSE,FALSE,FALSE,FALSE,FALSE,FALSE,FALSE,FALSE,FALSE,FALSE,TRUE,FALSE,FALSE,FALSE,FALSE,FALSE,FALSE,FALSE,FALSE,FALSE,FALSE,FALSE,FALSE,1,,TRUE,TRUE,FALSE,FALSE,0,,FALSE,,FALSE,,FALSE,FALSE,FALSE,FALSE,FALSE,FALSE,FALSE,,,,FALSE,FALSE,FALSE,FALSE,FALSE,FALSE,FALSE,FALSE,FALSE,FALSE,,FALSE,FALSE,FALSE,FALSE,FALSE,FALSE,FALSE,FALSE,FALSE,FALSE,FALSE,FALSE,FALSE,FALSE,FALSE,FALSE,FALSE,,FALSE,FALSE,,,FALSE,FALSE,FALSE,FALSE,FALSE,,,SMD,2001-05-15T17:00:16,LEM,2002-10-10T14:13:43
C/EGD/1275,1275,EGD,-1,A/EGD/1263,26/11/1633,2033-11-26T00:00:00,26/11/1633,2033-11-26T00:00:00,,"Wilson,Elspeth",,,,,,,FALSE,FALSE,FALSE,FALSE,FALSE,FALSE,FALSE,FALSE,FALSE,FALSE,FALSE,FALSE,FALSE,FALSE,FALSE,FALSE,FALSE,TRUE,FALSE,FALSE,FALSE,FALSE,FALSE,FALSE,FALSE,FALSE,FALSE,FALSE,FALSE,FALSE,1,,TRUE,TRUE,FALSE,FALSE,0,,FALSE,,FALSE,,FALSE,FALSE,FALSE,FALSE,FALSE,FALSE,FALSE,,,Accused of being at a witches' meeting at Dead Man's burn by an accused witch.,FALSE,FALSE,FALSE,FALSE,FALSE,FALSE,FALSE,FALSE,FALSE,FALSE,,FALSE,FALSE,FALSE,FALSE,FALSE,FALSE,FALSE,FALSE,FALSE,FALSE,FALSE,FALSE,FALSE,FALSE,FALSE,FALSE,FALSE,,FALSE,FALSE,damaged a barn during a witches meeting,,FALSE,FALSE,FALSE,FALSE,FALSE,,,SMD,2001-05-15T17:00:16,jhm,2002-10-10T14:02:56
C/EGD/1276,1276,EGD,-1,A/EGD/1264,27/8/1633,2033-08-27T00:00:00,14/1/1634,2034-01-14T00:00:00,,"Chalmer,Giles",,,,,,,FALSE,FALSE,FALSE,TRUE,FALSE,FALSE,FALSE,FALSE,FALSE,FALSE,FALSE,FALSE,FALSE,FALSE,FALSE,FALSE,FALSE,FALSE,FALSE,FALSE,FALSE,TRUE,FALSE,FALSE,FALSE,FALSE,FALSE,FALSE,FALSE,FALSE,2,,TRUE,TRUE,FALSE,TRUE,1,"They were probably using some minor magic taught to them by John Philip, but they were not directly accused of witchcraft and their accuser had an ulterior motive.",FALSE,,FALSE,,FALSE,FALSE,FALSE,FALSE,FALSE,FALSE,FALSE,,,,FALSE,FALSE,FALSE,FALSE,FALSE,FALSE,FALSE,FALSE,FALSE,FALSE,Used an enchantment to make their oat field more productive than their neighbours.,FALSE,FALSE,FALSE,FALSE,FALSE,FALSE,FALSE,FALSE,FALSE,FALSE,FALSE,FALSE,FALSE,FALSE,FALSE,TRUE,FALSE,They supposedly hired and consorted with John Philip and Walter Baird.  Philip supposedly instructed them in charming beasts.,FALSE,FALSE,,,FALSE,FALSE,FALSE,FALSE,FALSE,,,SMD,2001-05-15T17:00:16,LEM,2002-12-06T14:46:51
C/EGD/1277,1277,EGD,-1,A/EGD/1265,27/8/1633,2033-08-27T00:00:00,14/1/1634,2034-01-14T00:00:00,,"Fraser,George",,,,,,,FALSE,FALSE,FALSE,TRUE,FALSE,FALSE,FALSE,FALSE,FALSE,FALSE,FALSE,FALSE,FALSE,FALSE,FALSE,FALSE,FALSE,FALSE,FALSE,FALSE,FALSE,TRUE,FALSE,FALSE,FALSE,FALSE,FALSE,FALSE,FALSE,FALSE,2,,TRUE,TRUE,FALSE,TRUE,1,"They were probably using some minor magic taught to them by John Philip, but they were not directly accued of witchcraft and their accuser had an alterier motive.",FALSE,,FALSE,,FALSE,FALSE,FALSE,FALSE,FALSE,FALSE,FALSE,,,,FALSE,FALSE,FALSE,FALSE,FALSE,FALSE,FALSE,FALSE,FALSE,FALSE,Used an enchantment to make their oat field more productive than their neighbours.,FALSE,FALSE,FALSE,FALSE,FALSE,FALSE,FALSE,FALSE,FALSE,FALSE,FALSE,FALSE,FALSE,FALSE,FALSE,TRUE,FALSE,They supposedly hired and consorted with John Philip and Walter Baird.  Philip supposedly instructed them in charming beasts.,FALSE,FALSE,,,FALSE,FALSE,FALSE,FALSE,FALSE,,,SMD,2001-05-15T17:00:16,jhm,2002-10-03T11:56:14
C/EGD/1278,1278,EGD,-1,A/EGD/1266,17/6/1640,2040-06-17T00:00:00,22/7/1643,2043-07-22T00:00:00,,"Cragie,Katherine",,,,,,,FALSE,TRUE,FALSE,FALSE,FALSE,FALSE,FALSE,FALSE,FALSE,FALSE,TRUE,TRUE,FALSE,TRUE,FALSE,FALSE,FALSE,FALSE,FALSE,FALSE,FALSE,FALSE,FALSE,FALSE,FALSE,FALSE,FALSE,FALSE,FALSE,FALSE,4,,FALSE,FALSE,FALSE,TRUE,1,"interesting case, two dittays survive in the RPC and she had a unique way of diagnosing disease by discovering which spirit was 'lying upon' her victim and then curing it with the usual stones in water.",FALSE,"Mention of hill spirit, water spirits, and kirk spiritis as a possible cause of disease.  I don't know exactly what this means in terms of non-natural beings?",FALSE,,FALSE,FALSE,FALSE,FALSE,FALSE,FALSE,FALSE,,,,FALSE,FALSE,FALSE,TRUE,FALSE,FALSE,FALSE,TRUE,TRUE,FALSE,She pronounced an illness was due to Kirk spirits.  She put hot stones on the threshold and then into water and used the water to wash a sick person to get rid of the Kirk spirits.  Did the ritual three times.  She was seen doing things around a loch.  Said she could get someone's husband home from sea through a storm.  She was accused of divining the future of when people would die and whether or not they would recover.  She also caused an illness by placing a bundle of grasses with a woman's spinning.,TRUE,FALSE,TRUE,FALSE,FALSE,FALSE,FALSE,FALSE,FALSE,FALSE,TRUE,FALSE,FALSE,TRUE,TRUE,TRUE,FALSE,Caused a huge boil to disfigure a woman's face after she told people about her healing techniques.,FALSE,FALSE,,,FALSE,FALSE,FALSE,FALSE,FALSE,,"The first dittay and report of trial was from 1640, the second in RPC v8 was from 1643.",SMD,2001-05-15T17:00:16,LEM,2002-11-11T12:03:45
C/EGD/1279,1279,EGD,-1,A/EGD/1267,12/10/1643,2043-10-12T00:00:00,25/10/1643,2043-10-25T00:00:00,,"Hutton,Margaret",,,,,,,FALSE,FALSE,FALSE,FALSE,FALSE,FALSE,FALSE,FALSE,FALSE,FALSE,FALSE,FALSE,FALSE,FALSE,FALSE,FALSE,FALSE,FALSE,FALSE,FALSE,FALSE,FALSE,FALSE,FALSE,FALSE,FALSE,FALSE,FALSE,FALSE,FALSE,0,,TRUE,TRUE,FALSE,FALSE,0,,FALSE,,FALSE,,FALSE,FALSE,FALSE,FALSE,FALSE,FALSE,FALSE,,,,FALSE,FALSE,FALSE,FALSE,FALSE,FALSE,FALSE,FALSE,FALSE,FALSE,,FALSE,FALSE,FALSE,FALSE,FALSE,FALSE,FALSE,FALSE,FALSE,FALSE,FALSE,FALSE,FALSE,FALSE,FALSE,FALSE,FALSE,,FALSE,FALSE,,,FALSE,FALSE,FALSE,FALSE,FALSE,,"MacDonald in The Witches of Fife notes that on 28 May 1643 Hutton was denounced to the KS.  MacDonald's list has an end date of 7/111643, but I was unable to find anything of this date in her case.",SMD,2001-05-15T17:00:16,LEM,2002-11-16T12:03:51
C/EGD/128,128,EGD,-1,A/EGD/117,5/10/1596,1996-10-05T00:00:00,30/10/1596,1996-10-30T00:00:00,,"Jollie,Alesoune",,,,,,,FALSE,FALSE,TRUE,TRUE,FALSE,FALSE,FALSE,FALSE,FALSE,FALSE,FALSE,FALSE,FALSE,TRUE,FALSE,FALSE,FALSE,FALSE,FALSE,TRUE,FALSE,FALSE,FALSE,FALSE,FALSE,FALSE,FALSE,FALSE,FALSE,FALSE,4,,FALSE,FALSE,FALSE,FALSE,0,She hired a witch to kill her neighbour in revenge.,FALSE,,FALSE,,FALSE,FALSE,FALSE,FALSE,FALSE,FALSE,FALSE,,,,FALSE,FALSE,FALSE,FALSE,FALSE,FALSE,FALSE,FALSE,FALSE,FALSE,,FALSE,TRUE,FALSE,FALSE,FALSE,FALSE,FALSE,FALSE,FALSE,FALSE,TRUE,FALSE,FALSE,FALSE,FALSE,FALSE,FALSE,,FALSE,FALSE,,,FALSE,FALSE,FALSE,FALSE,FALSE,,,SMD,2001-05-15T17:00:16,jhm,2002-10-03T12:05:36
C/EGD/1280,1280,EGD,-1,A/EGD/1268,10/11/1642,2042-11-10T00:00:00,10/11/1642,2042-11-10T00:00:00,,"Adamsone,Isobel",,,,,,,FALSE,FALSE,FALSE,FALSE,FALSE,FALSE,FALSE,FALSE,FALSE,FALSE,FALSE,FALSE,FALSE,FALSE,FALSE,FALSE,FALSE,FALSE,FALSE,FALSE,FALSE,FALSE,FALSE,FALSE,FALSE,FALSE,FALSE,FALSE,FALSE,FALSE,0,,TRUE,TRUE,FALSE,FALSE,0,,FALSE,,FALSE,,FALSE,FALSE,FALSE,FALSE,FALSE,FALSE,FALSE,,,,FALSE,FALSE,FALSE,FALSE,FALSE,FALSE,FALSE,FALSE,FALSE,FALSE,,FALSE,FALSE,FALSE,FALSE,FALSE,FALSE,FALSE,FALSE,FALSE,FALSE,FALSE,FALSE,FALSE,FALSE,FALSE,FALSE,FALSE,,FALSE,FALSE,,,FALSE,FALSE,FALSE,FALSE,FALSE,,,SMD,2001-05-15T17:00:16,jhm,2002-10-03T12:06:43
C/EGD/1281,1281,EGD,-1,A/EGD/1269,23/4/1642,2042-04-23T00:00:00,15/11/1642,2042-11-15T00:00:00,,"Barbour,Jean",,,,,,,FALSE,FALSE,FALSE,FALSE,FALSE,FALSE,FALSE,FALSE,FALSE,FALSE,FALSE,FALSE,FALSE,FALSE,FALSE,FALSE,FALSE,FALSE,FALSE,FALSE,FALSE,FALSE,FALSE,FALSE,FALSE,FALSE,FALSE,FALSE,FALSE,FALSE,0,,TRUE,TRUE,FALSE,FALSE,0,,FALSE,,FALSE,,FALSE,FALSE,FALSE,FALSE,FALSE,FALSE,FALSE,,,,FALSE,FALSE,FALSE,FALSE,FALSE,FALSE,FALSE,FALSE,FALSE,FALSE,,FALSE,FALSE,FALSE,FALSE,FALSE,FALSE,FALSE,FALSE,FALSE,FALSE,FALSE,FALSE,FALSE,FALSE,FALSE,FALSE,FALSE,,FALSE,FALSE,,,FALSE,FALSE,FALSE,FALSE,FALSE,,,SMD,2001-05-15T17:00:16,jhm,2002-10-03T12:07:28
C/EGD/1282,1282,EGD,-1,A/EGD/1270,9/1/1643,2043-01-09T00:00:00,31/1/1643,2043-01-31T00:00:00,,"Grant,Agnes",,,,,,,FALSE,FALSE,FALSE,FALSE,FALSE,FALSE,FALSE,FALSE,FALSE,FALSE,FALSE,FALSE,FALSE,TRUE,FALSE,FALSE,FALSE,FALSE,FALSE,FALSE,FALSE,FALSE,FALSE,FALSE,FALSE,FALSE,FALSE,FALSE,FALSE,FALSE,1,Murder,TRUE,TRUE,FALSE,FALSE,0,she was accused of killing three nobleman.,FALSE,,FALSE,,FALSE,FALSE,FALSE,FALSE,FALSE,FALSE,FALSE,,,,FALSE,FALSE,FALSE,FALSE,FALSE,FALSE,FALSE,FALSE,FALSE,FALSE,,FALSE,TRUE,FALSE,FALSE,FALSE,FALSE,FALSE,FALSE,FALSE,FALSE,FALSE,FALSE,FALSE,FALSE,FALSE,FALSE,FALSE,,FALSE,FALSE,,,FALSE,FALSE,FALSE,FALSE,FALSE,,,SMD,2001-05-15T17:00:16,LEM,2002-11-12T16:57:55
C/EGD/1283,1283,EGD,-1,A/EGD/1271,24/1/1643,2043-01-24T00:00:00,13/6/1643,2043-06-13T00:00:00,,"Burgess,Katherine",,,,,,,FALSE,FALSE,FALSE,FALSE,FALSE,FALSE,FALSE,FALSE,FALSE,FALSE,FALSE,FALSE,FALSE,FALSE,FALSE,FALSE,FALSE,FALSE,FALSE,FALSE,FALSE,FALSE,FALSE,FALSE,FALSE,FALSE,FALSE,FALSE,FALSE,FALSE,0,,TRUE,TRUE,FALSE,FALSE,0,,FALSE,,FALSE,,FALSE,FALSE,FALSE,FALSE,FALSE,FALSE,FALSE,,,,FALSE,FALSE,FALSE,FALSE,FALSE,FALSE,FALSE,FALSE,FALSE,FALSE,,FALSE,FALSE,FALSE,FALSE,FALSE,FALSE,FALSE,FALSE,FALSE,FALSE,FALSE,FALSE,FALSE,FALSE,FALSE,FALSE,FALSE,,FALSE,FALSE,,,FALSE,FALSE,FALSE,FALSE,FALSE,,,SMD,2001-05-15T17:00:16,LEM,2002-11-13T09:36:01
C/EGD/1284,1284,EGD,-1,A/EGD/1272,14/5/1643,2043-05-14T00:00:00,22/7/1643,2043-07-22T00:00:00,,"Reid,Jonet",,,,,,,FALSE,TRUE,FALSE,FALSE,FALSE,TRUE,FALSE,FALSE,FALSE,FALSE,TRUE,TRUE,FALSE,TRUE,FALSE,FALSE,FALSE,FALSE,FALSE,FALSE,FALSE,FALSE,FALSE,FALSE,FALSE,FALSE,FALSE,FALSE,FALSE,FALSE,5,,FALSE,FALSE,FALSE,TRUE,1,,FALSE,"note that she kept company with the Devil, but no description of when, where or what he looked like.",FALSE,,TRUE,FALSE,FALSE,FALSE,FALSE,FALSE,FALSE,,,,FALSE,FALSE,TRUE,TRUE,FALSE,FALSE,FALSE,TRUE,FALSE,FALSE,"When drying corn with a hot stone she was heard to say 'I am drying this corne to the devill', then the stone broke.  She cured a man who was plagued by the ghost of his dead first wife.  A weird little ritual, she told a man to put a piece of moss on the end of a stick to protect his crops.  A man was troubled by apparitions of his first wife, she told him to go to her grave and charge her to 'ly still'.  Cured the 'boneshaw', maybe boneshot.  She used nine blue stones that she put in water. Cured the hart cake.",FALSE,FALSE,FALSE,FALSE,FALSE,FALSE,FALSE,FALSE,FALSE,FALSE,FALSE,FALSE,FALSE,TRUE,TRUE,TRUE,FALSE,"she was definitely a healer, called a charmer in the record.  She cured impotance with a drink.  Cured Boneshaw, hart cake, ghost troubles,",TRUE,FALSE,,,FALSE,FALSE,FALSE,FALSE,FALSE,,,SMD,2001-05-15T17:00:16,jhm,2002-10-03T12:14:29
C/EGD/1285,1285,EGD,-1,A/EGD/1273,,,1643,2043-07-15T00:00:00,,"Rennie,Husband of Elizabeth",,,,,,,FALSE,FALSE,FALSE,FALSE,FALSE,FALSE,FALSE,FALSE,FALSE,FALSE,FALSE,FALSE,FALSE,FALSE,FALSE,FALSE,FALSE,FALSE,FALSE,FALSE,FALSE,FALSE,FALSE,FALSE,FALSE,FALSE,FALSE,FALSE,FALSE,FALSE,0,,FALSE,FALSE,FALSE,FALSE,0,,FALSE,,FALSE,,FALSE,FALSE,FALSE,FALSE,FALSE,FALSE,FALSE,,,,FALSE,FALSE,FALSE,FALSE,FALSE,FALSE,FALSE,FALSE,FALSE,FALSE,,FALSE,FALSE,FALSE,FALSE,FALSE,FALSE,FALSE,FALSE,FALSE,FALSE,FALSE,FALSE,FALSE,FALSE,FALSE,FALSE,FALSE,,FALSE,FALSE,,,FALSE,FALSE,FALSE,FALSE,FALSE,,,SMD,2001-05-15T17:00:16,jhm,2002-12-06T12:23:17
C/EGD/1286,1286,EGD,-1,A/EGD/1274,7/7/1643,2043-07-07T00:00:00,7/7/1643,2043-07-07T00:00:00,,"Linay,Elspeth",,,,,,,FALSE,FALSE,FALSE,FALSE,FALSE,FALSE,FALSE,FALSE,FALSE,FALSE,FALSE,FALSE,FALSE,FALSE,FALSE,FALSE,FALSE,TRUE,FALSE,FALSE,FALSE,FALSE,FALSE,FALSE,FALSE,FALSE,FALSE,FALSE,FALSE,FALSE,1,,TRUE,TRUE,FALSE,FALSE,0,mentioned as a healer not as a witch,FALSE,,FALSE,,FALSE,FALSE,FALSE,FALSE,FALSE,FALSE,FALSE,,,,FALSE,FALSE,FALSE,FALSE,FALSE,FALSE,FALSE,FALSE,FALSE,FALSE,,FALSE,FALSE,FALSE,FALSE,FALSE,FALSE,FALSE,FALSE,FALSE,FALSE,FALSE,FALSE,FALSE,FALSE,FALSE,FALSE,FALSE,,FALSE,FALSE,,,FALSE,FALSE,FALSE,FALSE,FALSE,,,SMD,2001-05-15T17:00:16,jhm,2002-10-10T12:22:08
C/EGD/1287,1287,EGD,-1,A/EGD/1275,7/7/1643,2043-07-07T00:00:00,7/7/1643,2043-07-07T00:00:00,,"Ranie,Margaret",,,,,,,FALSE,FALSE,FALSE,FALSE,FALSE,FALSE,FALSE,FALSE,FALSE,FALSE,FALSE,FALSE,FALSE,FALSE,FALSE,FALSE,FALSE,TRUE,FALSE,FALSE,FALSE,FALSE,FALSE,FALSE,FALSE,FALSE,FALSE,FALSE,FALSE,FALSE,1,,TRUE,TRUE,FALSE,FALSE,0,she was not denounced as a 'witch' but as a healer,FALSE,,FALSE,,FALSE,FALSE,FALSE,FALSE,FALSE,FALSE,FALSE,,,,FALSE,FALSE,FALSE,FALSE,FALSE,FALSE,FALSE,FALSE,FALSE,FALSE,,FALSE,FALSE,FALSE,FALSE,FALSE,FALSE,FALSE,FALSE,FALSE,FALSE,FALSE,FALSE,FALSE,FALSE,FALSE,FALSE,FALSE,,FALSE,FALSE,,,FALSE,FALSE,FALSE,FALSE,FALSE,,,SMD,2001-05-15T17:00:16,jhm,2002-10-10T12:23:01
C/EGD/1288,1288,EGD,-1,A/EGD/1276,7/7/1643,2043-07-07T00:00:00,7/7/1643,2043-07-07T00:00:00,,"Poock,Christane",,,,,,,FALSE,FALSE,FALSE,FALSE,FALSE,FALSE,FALSE,FALSE,FALSE,FALSE,FALSE,FALSE,FALSE,FALSE,FALSE,FALSE,FALSE,TRUE,FALSE,FALSE,FALSE,FALSE,FALSE,FALSE,FALSE,FALSE,FALSE,FALSE,FALSE,FALSE,1,,TRUE,TRUE,FALSE,FALSE,0,"mentioned as a healer, not as a 'witch'",FALSE,,FALSE,,FALSE,FALSE,FALSE,FALSE,FALSE,FALSE,FALSE,,,,FALSE,FALSE,FALSE,FALSE,FALSE,FALSE,FALSE,FALSE,FALSE,FALSE,,FALSE,FALSE,FALSE,FALSE,FALSE,FALSE,FALSE,FALSE,FALSE,FALSE,FALSE,FALSE,FALSE,FALSE,FALSE,FALSE,FALSE,"mentioned as able to heal the worm, and heal with a plate of meal and blood pudding",FALSE,FALSE,,,FALSE,FALSE,FALSE,FALSE,FALSE,,,SMD,2001-05-15T17:00:16,jhm,2002-10-10T12:21:50
C/EGD/1289,1289,EGD,-1,A/EGD/1277,19/4/1643,2043-04-19T00:00:00,30/11/1643,2043-11-30T00:00:00,39,"Rob,Thomas",,,,,,,FALSE,FALSE,FALSE,FALSE,FALSE,FALSE,FALSE,FALSE,FALSE,FALSE,FALSE,FALSE,FALSE,FALSE,FALSE,FALSE,FALSE,FALSE,FALSE,FALSE,FALSE,FALSE,FALSE,FALSE,FALSE,FALSE,FALSE,FALSE,FALSE,FALSE,0,,TRUE,TRUE,FALSE,FALSE,0,No details of any accusations.,FALSE,,FALSE,,FALSE,FALSE,FALSE,FALSE,FALSE,FALSE,FALSE,,,,FALSE,FALSE,FALSE,FALSE,FALSE,FALSE,FALSE,FALSE,FALSE,FALSE,,FALSE,FALSE,FALSE,FALSE,FALSE,FALSE,FALSE,FALSE,FALSE,FALSE,FALSE,FALSE,FALSE,FALSE,FALSE,FALSE,FALSE,,FALSE,FALSE,,,FALSE,FALSE,FALSE,FALSE,FALSE,,,SMD,2001-05-15T17:00:16,jhm,2002-10-03T12:19:58
C/EGD/129,129,EGD,-1,A/EGD/118,18/11/1596,1996-11-18T00:00:00,27/11/1596,1996-11-27T00:00:00,,"Stewart,Cristian",,,,,,,FALSE,FALSE,FALSE,FALSE,FALSE,TRUE,FALSE,FALSE,FALSE,FALSE,FALSE,FALSE,FALSE,TRUE,FALSE,FALSE,FALSE,FALSE,FALSE,FALSE,FALSE,TRUE,FALSE,FALSE,FALSE,FALSE,FALSE,FALSE,FALSE,FALSE,3,,TRUE,TRUE,FALSE,FALSE,0,This seems to have been a killing of a high ranking person.  She was investigated in the presence of King James VI.,FALSE,,FALSE,,TRUE,FALSE,FALSE,FALSE,FALSE,FALSE,FALSE,,,,FALSE,FALSE,FALSE,TRUE,FALSE,FALSE,FALSE,FALSE,TRUE,FALSE,witchcraft cast by one blak clout with a thing made of iron in it.  She left the clout near a gate where P. Ruthven often walked.  She gave the black clout to the Devil.  She also took P. Ruthven to a loch where she had left he clout.  She claimed that the black clout was made by Katherine Stewart (nik gourdue).  When she was going to be apprehended for his illness she tried to cure him with a herb bath,FALSE,TRUE,FALSE,FALSE,FALSE,FALSE,FALSE,FALSE,TRUE,FALSE,FALSE,FALSE,FALSE,FALSE,FALSE,FALSE,FALSE,tried to cure as well.,FALSE,FALSE,,,FALSE,FALSE,FALSE,FALSE,FALSE,,Accused of killing Patrick Ruthven,SMD,2001-05-15T17:00:16,LEM,2002-12-05T14:19:55
C/EGD/1290,1290,EGD,-1,A/EGD/1278,19/4/1643,2043-04-19T00:00:00,30/11/1643,2043-11-30T00:00:00,39,"Stoddart,Agnes",,,,,,,FALSE,FALSE,FALSE,FALSE,FALSE,FALSE,FALSE,FALSE,FALSE,FALSE,FALSE,FALSE,FALSE,FALSE,FALSE,FALSE,FALSE,FALSE,FALSE,FALSE,FALSE,FALSE,FALSE,FALSE,FALSE,FALSE,FALSE,FALSE,FALSE,FALSE,0,,TRUE,TRUE,FALSE,FALSE,0,No details about their accusations.,FALSE,,FALSE,,FALSE,FALSE,FALSE,FALSE,FALSE,FALSE,FALSE,,,,FALSE,FALSE,FALSE,FALSE,FALSE,FALSE,FALSE,FALSE,FALSE,FALSE,,FALSE,FALSE,FALSE,FALSE,FALSE,FALSE,FALSE,FALSE,FALSE,FALSE,FALSE,FALSE,FALSE,FALSE,FALSE,FALSE,FALSE,,FALSE,FALSE,,,FALSE,FALSE,FALSE,FALSE,FALSE,,,SMD,2001-05-15T17:00:16,jhm,2002-10-03T12:25:33
C/EGD/1291,1291,EGD,-1,A/EGD/1279,19/4/1643,2043-04-19T00:00:00,30/11/1643,2043-11-30T00:00:00,14,"Rob,Jean",,,,,,,FALSE,FALSE,FALSE,FALSE,FALSE,FALSE,FALSE,FALSE,FALSE,FALSE,FALSE,FALSE,FALSE,FALSE,FALSE,FALSE,FALSE,FALSE,FALSE,FALSE,FALSE,FALSE,FALSE,FALSE,FALSE,FALSE,FALSE,FALSE,FALSE,FALSE,0,,TRUE,TRUE,FALSE,FALSE,0,No details about accusations against this family.,FALSE,,FALSE,,FALSE,FALSE,FALSE,FALSE,FALSE,FALSE,FALSE,,,,FALSE,FALSE,FALSE,FALSE,FALSE,FALSE,FALSE,FALSE,FALSE,FALSE,,FALSE,FALSE,FALSE,FALSE,FALSE,FALSE,FALSE,FALSE,FALSE,FALSE,FALSE,FALSE,FALSE,FALSE,FALSE,FALSE,FALSE,,FALSE,FALSE,,,FALSE,FALSE,FALSE,FALSE,FALSE,,,SMD,2001-05-15T17:00:16,jhm,2002-10-03T12:26:42
C/EGD/1292,1292,EGD,0,,,,14/12/1643,2043-12-14T00:00:00,,3 unnamed witches,to try witches in Queensferry,,,,,3,FALSE,FALSE,FALSE,FALSE,FALSE,FALSE,FALSE,FALSE,FALSE,FALSE,FALSE,FALSE,FALSE,FALSE,FALSE,FALSE,FALSE,FALSE,FALSE,FALSE,FALSE,FALSE,FALSE,FALSE,FALSE,FALSE,FALSE,FALSE,FALSE,FALSE,0,,TRUE,TRUE,FALSE,FALSE,0,,FALSE,,FALSE,,FALSE,FALSE,FALSE,FALSE,FALSE,FALSE,FALSE,,,,FALSE,FALSE,FALSE,FALSE,FALSE,FALSE,FALSE,FALSE,FALSE,FALSE,,FALSE,FALSE,FALSE,FALSE,FALSE,FALSE,FALSE,FALSE,FALSE,FALSE,FALSE,FALSE,FALSE,FALSE,FALSE,FALSE,FALSE,,FALSE,FALSE,,,FALSE,FALSE,FALSE,FALSE,FALSE,,"Queensferry, Linlithgow some witches.  The mention states that the commission will not be prejudicial to the Earl of Dunfermline, his right of regality of the lordship of Dunfermline.",SMD,2001-05-15T17:00:16,jhm,2002-10-03T12:27:40
C/EGD/1293,1293,EGD,-1,A/EGD/1281,31/12/1644,2044-12-31T00:00:00,2/1/1645,2045-01-02T00:00:00,,"Lachlane,Jean",,,,,,,FALSE,FALSE,FALSE,FALSE,FALSE,FALSE,FALSE,FALSE,FALSE,FALSE,FALSE,TRUE,FALSE,TRUE,FALSE,FALSE,FALSE,TRUE,FALSE,FALSE,FALSE,FALSE,FALSE,FALSE,FALSE,FALSE,FALSE,FALSE,FALSE,FALSE,3,,TRUE,TRUE,FALSE,TRUE,1,,FALSE,"No description of the demonic pact in her confession, all about healing.",TRUE,,FALSE,FALSE,FALSE,FALSE,FALSE,FALSE,FALSE,,,,FALSE,FALSE,FALSE,FALSE,TRUE,FALSE,FALSE,FALSE,FALSE,FALSE,,FALSE,TRUE,FALSE,FALSE,FALSE,FALSE,FALSE,TRUE,TRUE,FALSE,FALSE,FALSE,FALSE,TRUE,TRUE,TRUE,FALSE,,FALSE,FALSE,,,FALSE,FALSE,FALSE,FALSE,FALSE,,,SMD,2001-05-15T17:00:16,jhm,2002-10-03T12:29:23
C/EGD/1294,1294,EGD,-1,A/EGD/1282,31/12/1644,2044-12-31T00:00:00,31/12/1644,2044-12-31T00:00:00,,"Stewart,Helen",,,,,,,FALSE,FALSE,FALSE,FALSE,FALSE,FALSE,FALSE,FALSE,FALSE,FALSE,FALSE,FALSE,FALSE,FALSE,FALSE,FALSE,FALSE,TRUE,FALSE,FALSE,FALSE,FALSE,FALSE,FALSE,FALSE,FALSE,FALSE,FALSE,FALSE,FALSE,1,,TRUE,TRUE,FALSE,FALSE,0,,FALSE,,FALSE,,FALSE,FALSE,FALSE,FALSE,FALSE,FALSE,FALSE,,,,FALSE,FALSE,FALSE,FALSE,FALSE,FALSE,FALSE,FALSE,FALSE,FALSE,,FALSE,FALSE,FALSE,FALSE,FALSE,FALSE,FALSE,FALSE,FALSE,FALSE,FALSE,FALSE,FALSE,FALSE,FALSE,FALSE,FALSE,,FALSE,FALSE,,,FALSE,FALSE,FALSE,FALSE,FALSE,,,SMD,2001-05-15T17:00:16,jhm,2002-10-03T12:30:04
C/EGD/1295,1295,EGD,-1,A/EGD/1283,6/8/1644,2044-08-06T00:00:00,4/2/1645,2045-02-04T00:00:00,50,"Cunningham,Mary",,,,,,,FALSE,FALSE,FALSE,FALSE,FALSE,FALSE,FALSE,FALSE,FALSE,FALSE,FALSE,FALSE,FALSE,FALSE,FALSE,FALSE,FALSE,TRUE,FALSE,FALSE,FALSE,FALSE,FALSE,FALSE,FALSE,FALSE,FALSE,FALSE,FALSE,FALSE,1,,TRUE,TRUE,FALSE,FALSE,0,She and her daughter were denounced by a witch.,FALSE,,FALSE,,FALSE,FALSE,FALSE,FALSE,FALSE,FALSE,FALSE,,,,FALSE,FALSE,FALSE,FALSE,FALSE,FALSE,FALSE,FALSE,FALSE,FALSE,,FALSE,FALSE,FALSE,FALSE,FALSE,FALSE,FALSE,FALSE,FALSE,FALSE,FALSE,FALSE,FALSE,FALSE,FALSE,FALSE,FALSE,,FALSE,FALSE,,,FALSE,FALSE,FALSE,FALSE,FALSE,,"She was tried twice, first in Culross but was found not proven, so the commissioners asked her to be retried by the lord advocate arguing that the procurator fiscal (local judge) did not have any legal expertise and was not equipped for the trial.  The lord advocate agreed.  The bailies harrased her defence advocate and others who stood up for her.  She claimed that the bailies possessed their lands and yards.  It appears that the Privy Council granted her and her daughter's request of 6/8/1644 for release from prison and investigation of the conduct of the bailies.",SMD,2001-05-15T17:00:16,jhm,2002-10-03T12:31:49
C/EGD/1296,1296,EGD,-1,A/EGD/1284,6/8/1644,2044-08-06T00:00:00,15/8/1644,2044-08-15T00:00:00,,"Erskine,Jonet",,,,,,,FALSE,FALSE,FALSE,FALSE,FALSE,FALSE,FALSE,FALSE,FALSE,FALSE,FALSE,FALSE,FALSE,FALSE,FALSE,FALSE,FALSE,FALSE,FALSE,FALSE,FALSE,FALSE,FALSE,FALSE,FALSE,FALSE,FALSE,FALSE,FALSE,FALSE,0,,TRUE,TRUE,FALSE,FALSE,0,,FALSE,,FALSE,,FALSE,FALSE,FALSE,FALSE,FALSE,FALSE,FALSE,,,,FALSE,FALSE,FALSE,FALSE,FALSE,FALSE,FALSE,FALSE,FALSE,FALSE,,FALSE,FALSE,FALSE,FALSE,FALSE,FALSE,FALSE,FALSE,FALSE,FALSE,FALSE,FALSE,FALSE,FALSE,FALSE,FALSE,FALSE,,FALSE,FALSE,,,FALSE,FALSE,FALSE,FALSE,FALSE,,"She was tried twice, first in Culross but was found not proven, so the commissioners asked her to be retried by the lord advocate arguing that the procurator fiscal (local judge) did not have any legal expertise and was not equipped for the trial.  The lord advocate agreed.  The bailies harrased her defence advocate and others who stood up for her.  She claimed that the bailies possessed their lands and yards.  It appears that the Privy Council granted her and her daughter's request of 6/8/1644 for release from prison and investigation of the conduct of the bailies.",SMD,2001-05-15T17:00:16,jhm,2002-10-03T12:36:49
C/EGD/1297,1297,EGD,-1,A/EGD/1285,1/4/1644,2044-04-01T00:00:00,20/8/1644,2044-08-20T00:00:00,,"Young,Margaret",,,,,,,FALSE,FALSE,FALSE,FALSE,FALSE,FALSE,FALSE,FALSE,FALSE,FALSE,FALSE,FALSE,FALSE,FALSE,FALSE,FALSE,FALSE,TRUE,FALSE,FALSE,FALSE,FALSE,FALSE,FALSE,FALSE,FALSE,FALSE,FALSE,FALSE,FALSE,1,,TRUE,TRUE,FALSE,FALSE,0,"her mother, sister and (?aunt) were all accused of witchcraft, so some sort of family/neighbourhood dispute possible.",FALSE,,FALSE,,FALSE,FALSE,FALSE,FALSE,FALSE,FALSE,FALSE,,,"The meeting was not described by Margaret Young but by another accused witch prior to her execution. Christian Melvill (C/EGD/1298) described how Margaret, her mother and her sister met Melvill with the devil and the two girls were given over to the devil by Hill at the burn.",FALSE,FALSE,FALSE,FALSE,FALSE,FALSE,FALSE,FALSE,FALSE,FALSE,,FALSE,FALSE,FALSE,FALSE,FALSE,FALSE,FALSE,FALSE,FALSE,FALSE,FALSE,FALSE,FALSE,FALSE,FALSE,FALSE,FALSE,,FALSE,FALSE,,,FALSE,FALSE,FALSE,FALSE,FALSE,,,SMD,2001-05-15T17:00:16,jhm,2002-10-10T12:00:10
C/EGD/1298,1298,EGD,-1,A/EGD/1286,10/4/1644,2044-04-10T00:00:00,20/8/1644,2044-08-20T00:00:00,,"Melvill,Christiane",,,,,,,FALSE,FALSE,FALSE,FALSE,FALSE,TRUE,FALSE,FALSE,FALSE,FALSE,FALSE,FALSE,FALSE,FALSE,FALSE,FALSE,FALSE,FALSE,FALSE,FALSE,FALSE,FALSE,FALSE,FALSE,FALSE,FALSE,FALSE,FALSE,FALSE,FALSE,1,,TRUE,TRUE,FALSE,FALSE,0,,FALSE,,TRUE,,TRUE,FALSE,FALSE,FALSE,FALSE,FALSE,FALSE,,,Melvill confessed to meeting the devil where Helen Hill gave her 2 daughters over to the devil.,FALSE,FALSE,FALSE,FALSE,FALSE,FALSE,FALSE,FALSE,FALSE,FALSE,,FALSE,FALSE,FALSE,FALSE,FALSE,FALSE,FALSE,FALSE,FALSE,FALSE,FALSE,FALSE,FALSE,FALSE,FALSE,FALSE,FALSE,,FALSE,FALSE,,,FALSE,FALSE,FALSE,FALSE,FALSE,,,SMD,2001-05-15T17:00:16,jhm,2002-10-03T12:40:31
C/EGD/1299,1299,EGD,-1,A/EGD/1287,7/8/1644,2044-08-07T00:00:00,2/10/1644,2044-10-02T00:00:00,,"Young,Margaret",,,,,,,FALSE,FALSE,FALSE,FALSE,FALSE,FALSE,FALSE,FALSE,FALSE,FALSE,FALSE,FALSE,FALSE,FALSE,FALSE,FALSE,FALSE,TRUE,FALSE,FALSE,FALSE,FALSE,FALSE,FALSE,FALSE,FALSE,FALSE,FALSE,FALSE,FALSE,1,,TRUE,TRUE,FALSE,FALSE,0,,FALSE,,FALSE,,FALSE,FALSE,FALSE,FALSE,FALSE,FALSE,FALSE,,,,FALSE,FALSE,FALSE,FALSE,FALSE,FALSE,FALSE,FALSE,FALSE,FALSE,,FALSE,FALSE,FALSE,FALSE,FALSE,FALSE,FALSE,FALSE,FALSE,FALSE,FALSE,FALSE,FALSE,FALSE,FALSE,FALSE,FALSE,,FALSE,FALSE,,,FALSE,FALSE,FALSE,FALSE,FALSE,,"possibly the same person as Margaret Young, c/jo/3075.",SMD,2001-05-15T17:00:16,jhm,2002-10-03T12:41:10
C/EGD/13,13,EGD,-1,A/EGD/4,12/1649,2049-12-01T00:00:00,12/1649,2049-12-01T00:00:00,,"Bowis,Janet",,,,,,,FALSE,FALSE,FALSE,FALSE,FALSE,FALSE,FALSE,FALSE,FALSE,FALSE,FALSE,FALSE,FALSE,FALSE,FALSE,FALSE,FALSE,FALSE,FALSE,FALSE,FALSE,FALSE,FALSE,FALSE,FALSE,FALSE,FALSE,FALSE,FALSE,FALSE,0,,TRUE,TRUE,FALSE,FALSE,0,,FALSE,,FALSE,,FALSE,FALSE,FALSE,FALSE,FALSE,FALSE,FALSE,,,,FALSE,FALSE,FALSE,FALSE,FALSE,FALSE,FALSE,FALSE,FALSE,FALSE,,FALSE,FALSE,FALSE,FALSE,FALSE,FALSE,FALSE,FALSE,FALSE,FALSE,FALSE,FALSE,FALSE,FALSE,FALSE,FALSE,FALSE,,FALSE,FALSE,,,FALSE,FALSE,FALSE,FALSE,FALSE,,The project did not check Larner's reference to this printed secondary source as part of the research.,SMD,2001-05-15T17:00:16,jhm,2002-10-03T12:42:42
C/EGD/130,130,EGD,-1,A/EGD/119,16/12/1596,1996-12-16T00:00:00,16/12/1596,1996-12-16T00:00:00,,"Grawie,Jonet",,,,,,,FALSE,FALSE,FALSE,FALSE,FALSE,FALSE,FALSE,FALSE,FALSE,FALSE,FALSE,FALSE,FALSE,FALSE,FALSE,FALSE,FALSE,FALSE,FALSE,FALSE,FALSE,FALSE,FALSE,FALSE,FALSE,FALSE,FALSE,FALSE,FALSE,FALSE,0,,TRUE,TRUE,FALSE,FALSE,0,,FALSE,,FALSE,,FALSE,FALSE,FALSE,FALSE,FALSE,FALSE,FALSE,,,,FALSE,FALSE,FALSE,FALSE,FALSE,FALSE,FALSE,FALSE,FALSE,FALSE,,FALSE,FALSE,FALSE,FALSE,FALSE,FALSE,FALSE,FALSE,FALSE,FALSE,FALSE,FALSE,FALSE,FALSE,FALSE,FALSE,FALSE,,FALSE,FALSE,,,FALSE,FALSE,FALSE,FALSE,FALSE,,,SMD,2001-05-15T17:00:16,jhm,2002-10-03T12:43:20
C/EGD/1300,1300,EGD,-1,A/EGD/1288,18/9/1644,2044-09-18T00:00:00,25/2/1645,2045-02-25T00:00:00,,"McKennan,Jonnet",,,,,,,FALSE,FALSE,FALSE,FALSE,FALSE,FALSE,FALSE,FALSE,FALSE,FALSE,FALSE,FALSE,FALSE,FALSE,FALSE,FALSE,FALSE,FALSE,FALSE,FALSE,FALSE,FALSE,FALSE,FALSE,FALSE,FALSE,FALSE,FALSE,FALSE,FALSE,0,,TRUE,TRUE,FALSE,FALSE,0,,FALSE,,FALSE,,FALSE,FALSE,FALSE,FALSE,FALSE,FALSE,FALSE,,,,FALSE,FALSE,FALSE,FALSE,FALSE,FALSE,FALSE,FALSE,FALSE,FALSE,,FALSE,FALSE,FALSE,FALSE,FALSE,FALSE,FALSE,FALSE,FALSE,FALSE,FALSE,FALSE,FALSE,FALSE,FALSE,FALSE,FALSE,,FALSE,FALSE,,,FALSE,FALSE,FALSE,FALSE,FALSE,,,SMD,2001-05-15T17:00:16,jhm,2002-10-03T12:44:41
C/EGD/1301,1301,EGD,-1,A/EGD/1289,18/9/1644,2044-09-18T00:00:00,25/2/1645,2045-02-25T00:00:00,,"Shenan,Marion",,,,,,,FALSE,FALSE,FALSE,FALSE,FALSE,FALSE,FALSE,FALSE,FALSE,FALSE,FALSE,FALSE,FALSE,FALSE,FALSE,FALSE,FALSE,FALSE,FALSE,FALSE,FALSE,FALSE,FALSE,FALSE,FALSE,FALSE,FALSE,FALSE,FALSE,FALSE,0,,TRUE,TRUE,FALSE,FALSE,0,,FALSE,,FALSE,,FALSE,FALSE,FALSE,FALSE,FALSE,FALSE,FALSE,,,,FALSE,FALSE,FALSE,FALSE,FALSE,FALSE,FALSE,FALSE,FALSE,FALSE,,FALSE,FALSE,FALSE,FALSE,FALSE,FALSE,FALSE,FALSE,FALSE,FALSE,FALSE,FALSE,FALSE,FALSE,FALSE,FALSE,FALSE,,FALSE,FALSE,,,FALSE,FALSE,FALSE,FALSE,FALSE,,,SMD,2001-05-15T17:00:16,jhm,2002-10-03T12:46:05
C/EGD/1302,1302,EGD,-1,A/EGD/1290,18/9/1644,2044-09-18T00:00:00,25/2/1645,2045-02-25T00:00:00,,"Russell,Marion",,,,,,,FALSE,FALSE,FALSE,FALSE,FALSE,FALSE,FALSE,FALSE,FALSE,FALSE,FALSE,FALSE,FALSE,FALSE,FALSE,FALSE,FALSE,FALSE,FALSE,FALSE,FALSE,FALSE,FALSE,FALSE,FALSE,FALSE,FALSE,FALSE,FALSE,FALSE,0,,TRUE,TRUE,FALSE,FALSE,0,,FALSE,,FALSE,,FALSE,FALSE,FALSE,FALSE,FALSE,FALSE,FALSE,,,,FALSE,FALSE,FALSE,FALSE,FALSE,FALSE,FALSE,FALSE,FALSE,FALSE,,FALSE,FALSE,FALSE,FALSE,FALSE,FALSE,FALSE,FALSE,FALSE,FALSE,FALSE,FALSE,FALSE,FALSE,FALSE,FALSE,FALSE,,FALSE,FALSE,,,FALSE,FALSE,FALSE,FALSE,FALSE,,,SMD,2001-05-15T17:00:16,jhm,2002-12-06T12:15:40
C/EGD/1303,1303,EGD,-1,A/EGD/1291,18/9/1644,2044-09-18T00:00:00,25/2/1645,2045-02-25T00:00:00,,"Bigham,Isobell",,,,,,,FALSE,FALSE,FALSE,FALSE,FALSE,FALSE,FALSE,FALSE,FALSE,FALSE,FALSE,FALSE,FALSE,FALSE,FALSE,FALSE,FALSE,FALSE,FALSE,FALSE,FALSE,FALSE,FALSE,FALSE,FALSE,FALSE,FALSE,FALSE,FALSE,FALSE,0,,TRUE,TRUE,FALSE,FALSE,0,,FALSE,,FALSE,,FALSE,FALSE,FALSE,FALSE,FALSE,FALSE,FALSE,,,,FALSE,FALSE,FALSE,FALSE,FALSE,FALSE,FALSE,FALSE,FALSE,FALSE,,FALSE,FALSE,FALSE,FALSE,FALSE,FALSE,FALSE,FALSE,FALSE,FALSE,FALSE,FALSE,FALSE,FALSE,FALSE,FALSE,FALSE,,FALSE,FALSE,,,FALSE,FALSE,FALSE,FALSE,FALSE,,,SMD,2001-05-15T17:00:16,jhm,2002-11-13T12:35:11
C/EGD/1304,1304,EGD,-1,A/EGD/1292,18/9/1644,2044-09-18T00:00:00,25/2/1645,2045-02-25T00:00:00,,"Elam,Africk",,,,,,,FALSE,FALSE,FALSE,FALSE,FALSE,FALSE,FALSE,FALSE,FALSE,FALSE,FALSE,FALSE,FALSE,FALSE,FALSE,FALSE,FALSE,FALSE,FALSE,FALSE,FALSE,FALSE,FALSE,FALSE,FALSE,FALSE,FALSE,FALSE,FALSE,FALSE,0,,TRUE,TRUE,FALSE,FALSE,0,,FALSE,,FALSE,,FALSE,FALSE,FALSE,FALSE,FALSE,FALSE,FALSE,,,,FALSE,FALSE,FALSE,FALSE,FALSE,FALSE,FALSE,FALSE,FALSE,FALSE,,FALSE,FALSE,FALSE,FALSE,FALSE,FALSE,FALSE,FALSE,FALSE,FALSE,FALSE,FALSE,FALSE,FALSE,FALSE,FALSE,FALSE,,FALSE,FALSE,,,FALSE,FALSE,FALSE,FALSE,FALSE,,,SMD,2001-05-15T17:00:16,jhm,2002-10-03T12:49:01
C/EGD/1305,1305,EGD,-1,A/EGD/1293,21/11/1644,2044-11-21T00:00:00,21/11/1644,2044-11-21T00:00:00,,"Thomsone,Margaret",,,,,,,FALSE,FALSE,FALSE,FALSE,FALSE,FALSE,FALSE,FALSE,FALSE,FALSE,FALSE,FALSE,FALSE,FALSE,FALSE,FALSE,FALSE,FALSE,FALSE,FALSE,FALSE,FALSE,FALSE,FALSE,FALSE,FALSE,FALSE,FALSE,FALSE,FALSE,0,,TRUE,TRUE,FALSE,FALSE,0,,FALSE,,FALSE,,FALSE,FALSE,FALSE,FALSE,FALSE,FALSE,FALSE,,,,FALSE,FALSE,FALSE,FALSE,FALSE,FALSE,FALSE,FALSE,FALSE,FALSE,,FALSE,FALSE,FALSE,FALSE,FALSE,FALSE,FALSE,FALSE,FALSE,FALSE,FALSE,FALSE,FALSE,FALSE,FALSE,FALSE,FALSE,,FALSE,FALSE,,,FALSE,FALSE,FALSE,FALSE,FALSE,,,SMD,2001-05-15T17:00:16,jhm,2002-10-03T12:49:48
C/EGD/1306,1306,EGD,-1,A/EGD/1294,31/12/1644,2044-12-31T00:00:00,31/12/1644,2044-12-31T00:00:00,,"Lockie,Jonet",,,,,,,FALSE,FALSE,FALSE,FALSE,FALSE,TRUE,FALSE,FALSE,FALSE,FALSE,FALSE,FALSE,FALSE,FALSE,FALSE,FALSE,FALSE,TRUE,FALSE,FALSE,FALSE,FALSE,FALSE,FALSE,FALSE,FALSE,FALSE,FALSE,FALSE,FALSE,2,,TRUE,TRUE,FALSE,FALSE,0,,FALSE,Mentioned meeting the devil as black man in another person's account,FALSE,,FALSE,FALSE,FALSE,FALSE,FALSE,FALSE,FALSE,,,"Accused by another witch that she flew to the meeting, supposedly on a cock, and attending a witches' meeting.",FALSE,FALSE,FALSE,FALSE,FALSE,FALSE,FALSE,FALSE,FALSE,FALSE,,FALSE,FALSE,FALSE,FALSE,FALSE,FALSE,FALSE,FALSE,FALSE,FALSE,FALSE,FALSE,FALSE,FALSE,FALSE,FALSE,FALSE,,FALSE,FALSE,,,FALSE,FALSE,FALSE,FALSE,FALSE,,,SMD,2001-05-15T17:00:16,jhm,2002-11-13T16:00:15
C/EGD/1307,1307,EGD,-1,A/EGD/1295,31/12/1644,2044-12-31T00:00:00,31/12/1644,2044-12-31T00:00:00,,"Pattersone,Maillie",,,,,,,FALSE,FALSE,FALSE,FALSE,FALSE,FALSE,FALSE,FALSE,FALSE,FALSE,FALSE,FALSE,FALSE,FALSE,FALSE,FALSE,FALSE,TRUE,FALSE,FALSE,FALSE,FALSE,FALSE,FALSE,FALSE,FALSE,FALSE,FALSE,FALSE,FALSE,1,,TRUE,TRUE,FALSE,FALSE,0,,FALSE,Mentioned as having met the devil as a black man in another person's confession.,FALSE,,FALSE,FALSE,FALSE,FALSE,FALSE,FALSE,FALSE,,,Accused by another witch of night flying. She supposedly rode on a cat and of attending two meetings at the kirk in Carnwath.,FALSE,FALSE,FALSE,FALSE,FALSE,FALSE,FALSE,FALSE,FALSE,FALSE,,FALSE,FALSE,FALSE,FALSE,FALSE,FALSE,FALSE,FALSE,FALSE,FALSE,FALSE,FALSE,FALSE,FALSE,FALSE,FALSE,FALSE,,FALSE,FALSE,,,FALSE,FALSE,FALSE,FALSE,FALSE,,,SMD,2001-05-15T17:00:16,LEM,2002-12-05T12:55:51
C/EGD/1308,1308,EGD,-1,A/EGD/1296,29/9/1644,2044-09-29T00:00:00,31/12/1644,2044-12-31T00:00:00,,"Watsoun,Margaret",,,,,,,FALSE,FALSE,FALSE,FALSE,FALSE,TRUE,FALSE,FALSE,FALSE,TRUE,FALSE,FALSE,FALSE,TRUE,FALSE,FALSE,FALSE,TRUE,FALSE,TRUE,FALSE,FALSE,FALSE,FALSE,FALSE,FALSE,FALSE,FALSE,FALSE,FALSE,5,,TRUE,TRUE,FALSE,FALSE,0,,FALSE,,TRUE,,TRUE,FALSE,FALSE,FALSE,TRUE,TRUE,FALSE,,,Night flying to the meetings: she supposedly rode on a botell of straw (a bundle of straw).  She was supposedly also possessed by the Devil.,FALSE,FALSE,FALSE,FALSE,TRUE,FALSE,FALSE,FALSE,FALSE,FALSE,,FALSE,FALSE,FALSE,TRUE,FALSE,FALSE,FALSE,FALSE,FALSE,FALSE,FALSE,FALSE,FALSE,FALSE,FALSE,FALSE,FALSE,,FALSE,FALSE,,,FALSE,FALSE,FALSE,FALSE,FALSE,,,SMD,2001-05-15T17:00:16,jhm,2002-10-03T13:55:36
C/EGD/1309,1309,EGD,-1,A/EGD/1297,1/8/1644,2044-08-01T00:00:00,14/11/1644,2044-11-14T00:00:00,,"Reid,Margaret",,,,,,,FALSE,TRUE,FALSE,FALSE,FALSE,TRUE,FALSE,FALSE,FALSE,TRUE,FALSE,TRUE,FALSE,FALSE,FALSE,TRUE,FALSE,TRUE,FALSE,FALSE,FALSE,FALSE,FALSE,FALSE,FALSE,FALSE,FALSE,FALSE,FALSE,FALSE,6,,TRUE,TRUE,FALSE,FALSE,0,,FALSE,,TRUE,,TRUE,FALSE,FALSE,FALSE,FALSE,FALSE,FALSE,,,,TRUE,FALSE,TRUE,TRUE,FALSE,FALSE,FALSE,TRUE,TRUE,FALSE,"She did some compasses around babies accompanied with secret words, withershins with candles around the child birth bed. Used a green hesp at childbed ceremonies. Passed sick child three times round an oak post (tree)",FALSE,FALSE,FALSE,FALSE,FALSE,FALSE,FALSE,FALSE,FALSE,FALSE,FALSE,FALSE,FALSE,FALSE,TRUE,FALSE,TRUE,,FALSE,FALSE,,,FALSE,FALSE,FALSE,FALSE,FALSE,,,SMD,2001-05-15T17:00:16,jhm,2002-12-03T11:57:11
C/EGD/131,131,EGD,-1,A/EGD/120,12/11/1597,1997-11-12T00:00:00,12/11/1597,1997-11-12T00:00:00,,"Stewart,Jonet",,,,,,,FALSE,TRUE,FALSE,FALSE,FALSE,FALSE,FALSE,FALSE,FALSE,FALSE,TRUE,TRUE,FALSE,FALSE,FALSE,FALSE,FALSE,TRUE,FALSE,FALSE,FALSE,FALSE,FALSE,FALSE,FALSE,FALSE,FALSE,FALSE,FALSE,FALSE,4,,FALSE,FALSE,FALSE,FALSE,0,"She was part of a group of four women who appear to have been recognised folk healers who met, taught each other, cured for each other and generally worked together as professionals (the group includes c/egd/136, c/egd/133, c/egd/132, c/egd/131).  There is no mention of the Devil.",FALSE,,TRUE,,FALSE,FALSE,FALSE,FALSE,FALSE,FALSE,FALSE,,,,FALSE,FALSE,TRUE,TRUE,FALSE,FALSE,FALSE,TRUE,TRUE,FALSE,"Used a shirt in south running water for a cure, then she had a smith put a red hot iron in the water with the shirt.  She used a garland of green woodbyne for a cure which she cut into nine pieces and cast into a fire.",TRUE,FALSE,FALSE,FALSE,FALSE,FALSE,FALSE,FALSE,TRUE,FALSE,FALSE,FALSE,FALSE,TRUE,TRUE,FALSE,FALSE,,FALSE,FALSE,,,FALSE,FALSE,FALSE,FALSE,FALSE,,,SMD,2001-05-15T17:00:16,jhm,2002-10-03T13:59:57
C/EGD/1310,1310,EGD,-1,A/EGD/1298,1/8/1644,2044-08-01T00:00:00,31/12/1644,2044-12-31T00:00:00,,"Shaw,Kathren",,,,,,,FALSE,FALSE,FALSE,FALSE,FALSE,TRUE,FALSE,FALSE,FALSE,FALSE,FALSE,FALSE,FALSE,FALSE,FALSE,FALSE,FALSE,TRUE,FALSE,FALSE,FALSE,FALSE,FALSE,FALSE,FALSE,FALSE,FALSE,FALSE,FALSE,FALSE,2,,TRUE,TRUE,FALSE,FALSE,0,,FALSE,"The devil forced her to have sex, she fought but could not resist.",FALSE,,TRUE,FALSE,FALSE,FALSE,FALSE,FALSE,FALSE,,,,FALSE,FALSE,FALSE,FALSE,FALSE,FALSE,FALSE,FALSE,FALSE,FALSE,,FALSE,FALSE,FALSE,FALSE,FALSE,FALSE,FALSE,FALSE,FALSE,FALSE,FALSE,FALSE,FALSE,FALSE,FALSE,FALSE,FALSE,,FALSE,FALSE,,,FALSE,FALSE,FALSE,FALSE,FALSE,,,SMD,2001-05-15T17:00:16,jhm,2002-10-03T14:00:34
C/EGD/1311,1311,EGD,0,,7/6/1649,2049-06-07T00:00:00,7/6/1649,2049-06-07T00:00:00,,1 unnamed witch,,,,,,1,FALSE,FALSE,FALSE,FALSE,FALSE,FALSE,FALSE,FALSE,FALSE,FALSE,FALSE,FALSE,FALSE,FALSE,FALSE,FALSE,FALSE,FALSE,FALSE,FALSE,FALSE,FALSE,FALSE,FALSE,FALSE,FALSE,FALSE,FALSE,FALSE,FALSE,0,,TRUE,TRUE,FALSE,FALSE,0,,FALSE,,FALSE,,FALSE,FALSE,FALSE,FALSE,FALSE,FALSE,FALSE,,,,FALSE,FALSE,FALSE,FALSE,FALSE,FALSE,FALSE,FALSE,FALSE,FALSE,,FALSE,FALSE,FALSE,FALSE,FALSE,FALSE,FALSE,FALSE,FALSE,FALSE,FALSE,FALSE,FALSE,FALSE,FALSE,FALSE,FALSE,,FALSE,FALSE,,,FALSE,FALSE,FALSE,FALSE,FALSE,,"The piper's mother, Haddington.",SMD,2001-05-15T17:00:16,jhm,2002-10-03T14:05:25
C/EGD/1312,1312,EGD,-1,A/EGD/1300,7/6/1649,2049-06-07T00:00:00,7/6/1649,2049-06-07T00:00:00,,"Clarkson,Agnes",,,,,,,FALSE,FALSE,FALSE,FALSE,FALSE,TRUE,FALSE,FALSE,FALSE,FALSE,FALSE,FALSE,FALSE,TRUE,FALSE,FALSE,FALSE,FALSE,FALSE,FALSE,FALSE,FALSE,FALSE,FALSE,FALSE,FALSE,FALSE,FALSE,FALSE,FALSE,2,,TRUE,TRUE,FALSE,FALSE,0,,FALSE,Her house was filled with a black wind and mist when she first refused to join the Devil.  She was questioned as to how she renounced her baptism and she answered that it was really done with the carnal copulation.,TRUE,,TRUE,FALSE,FALSE,FALSE,TRUE,TRUE,FALSE,,,,FALSE,FALSE,FALSE,FALSE,FALSE,FALSE,FALSE,FALSE,FALSE,FALSE,,FALSE,FALSE,FALSE,FALSE,FALSE,FALSE,FALSE,FALSE,FALSE,FALSE,FALSE,FALSE,FALSE,FALSE,FALSE,FALSE,FALSE,sundry malefices alleged but not specified,FALSE,FALSE,,,FALSE,FALSE,FALSE,FALSE,FALSE,,,SMD,2001-05-15T17:00:16,jhm,2002-10-03T14:07:53
C/EGD/1313,1313,EGD,-1,A/EGD/1301,8/6/1649,2049-06-08T00:00:00,8/6/1649,2049-06-08T00:00:00,,"Weir,John",,,,,,,FALSE,FALSE,FALSE,FALSE,FALSE,TRUE,FALSE,FALSE,FALSE,FALSE,FALSE,FALSE,FALSE,FALSE,FALSE,FALSE,FALSE,TRUE,FALSE,FALSE,FALSE,FALSE,FALSE,FALSE,FALSE,FALSE,FALSE,FALSE,FALSE,FALSE,2,,TRUE,TRUE,FALSE,FALSE,0,,FALSE,,FALSE,,FALSE,FALSE,FALSE,FALSE,FALSE,FALSE,FALSE,,,,FALSE,FALSE,FALSE,FALSE,FALSE,FALSE,FALSE,FALSE,FALSE,FALSE,,FALSE,FALSE,FALSE,FALSE,FALSE,FALSE,FALSE,FALSE,FALSE,FALSE,FALSE,FALSE,FALSE,FALSE,FALSE,FALSE,FALSE,,FALSE,FALSE,,,FALSE,FALSE,FALSE,FALSE,FALSE,,,SMD,2001-05-15T17:00:16,jhm,2002-10-03T14:09:44
C/EGD/1315,1315,EGD,-1,A/EGD/1303,9/6/1649,2049-06-09T00:00:00,11/7/1649,2049-07-11T00:00:00,,"Lausone,Helen",,,,,,,FALSE,FALSE,FALSE,FALSE,FALSE,TRUE,FALSE,FALSE,FALSE,FALSE,FALSE,FALSE,FALSE,FALSE,FALSE,FALSE,FALSE,TRUE,FALSE,FALSE,FALSE,FALSE,FALSE,FALSE,FALSE,FALSE,FALSE,FALSE,FALSE,FALSE,2,,TRUE,TRUE,FALSE,FALSE,0,Named by Issobell Murray who confessed to demonic pact and meetings although no details from Lauson's confession.,TRUE,No details about Lauson's relationship with the devil but as Murray gave many details about pact it is likely that it was implied for. Claimed by Murray that the devil appeared as a man.,FALSE,,FALSE,FALSE,FALSE,FALSE,FALSE,FALSE,FALSE,,,It was claimed that she attended meetings at Paiston where there was dancing and others present.,FALSE,FALSE,FALSE,FALSE,FALSE,FALSE,FALSE,FALSE,FALSE,FALSE,,FALSE,FALSE,FALSE,FALSE,FALSE,FALSE,FALSE,FALSE,FALSE,FALSE,FALSE,FALSE,FALSE,FALSE,FALSE,FALSE,FALSE,,FALSE,FALSE,,,FALSE,FALSE,FALSE,FALSE,FALSE,,,SMD,2001-05-15T17:00:16,LEM,2002-10-10T09:33:04
C/EGD/1316,1316,EGD,-1,A/EGD/1304,9/6/1649,2049-06-09T00:00:00,11/7/1649,2049-07-11T00:00:00,,"Purdie,Barbara",,,,,,,FALSE,FALSE,FALSE,FALSE,FALSE,FALSE,FALSE,FALSE,FALSE,FALSE,FALSE,FALSE,FALSE,FALSE,FALSE,FALSE,FALSE,TRUE,FALSE,FALSE,FALSE,FALSE,FALSE,FALSE,FALSE,FALSE,FALSE,FALSE,FALSE,FALSE,1,,TRUE,TRUE,FALSE,FALSE,0,Named by Issobell Murray whose confession give details about activities. No details from Purdie's confession. Murray confessed to demonic pact but no details about Purdie's relationship with the devil.,TRUE,No details about Purdie's relationship with the devil but by her association with Murray and attendance at meetings then some form of pact implied by presbytery. Murray claimed the devil appeared as a man.,FALSE,,FALSE,FALSE,FALSE,FALSE,FALSE,FALSE,FALSE,,,"Details in Issobell Murray's confession about meetings around the time of Pasche. Meetings were at the Butter dam, the loch and a house yard in Paiston. Murray confessed to demonic pact but there are no details about Purdie's confession.",FALSE,FALSE,FALSE,FALSE,FALSE,FALSE,FALSE,FALSE,FALSE,FALSE,,FALSE,FALSE,FALSE,FALSE,FALSE,FALSE,FALSE,FALSE,FALSE,FALSE,FALSE,FALSE,FALSE,FALSE,FALSE,FALSE,FALSE,,FALSE,FALSE,,,FALSE,FALSE,FALSE,FALSE,FALSE,,,SMD,2001-05-15T17:00:16,LEM,2002-10-10T10:02:37
C/EGD/1317,1317,EGD,-1,A/EGD/1305,9/6/1649,2049-06-09T00:00:00,12/6/1649,2049-06-12T00:00:00,,"Hog,Margaret",,,,,,,FALSE,FALSE,FALSE,FALSE,FALSE,FALSE,FALSE,FALSE,FALSE,FALSE,FALSE,FALSE,FALSE,FALSE,FALSE,FALSE,FALSE,TRUE,FALSE,FALSE,FALSE,FALSE,FALSE,FALSE,FALSE,FALSE,FALSE,FALSE,FALSE,FALSE,1,,TRUE,TRUE,FALSE,FALSE,0,,FALSE,,FALSE,,FALSE,FALSE,FALSE,FALSE,FALSE,FALSE,FALSE,,,,FALSE,FALSE,FALSE,FALSE,FALSE,FALSE,FALSE,FALSE,FALSE,FALSE,,FALSE,FALSE,FALSE,FALSE,FALSE,FALSE,FALSE,FALSE,FALSE,FALSE,FALSE,FALSE,FALSE,FALSE,FALSE,FALSE,FALSE,,FALSE,FALSE,,,FALSE,FALSE,FALSE,FALSE,FALSE,,,SMD,2001-05-15T17:00:16,LEM,2002-10-10T10:52:15
C/EGD/1318,1318,EGD,-1,A/EGD/1306,8/6/1649,2049-06-08T00:00:00,25/7/1649,2049-07-25T00:00:00,,"Bartilman,Margaret",,,,,,,FALSE,FALSE,FALSE,FALSE,FALSE,FALSE,FALSE,FALSE,FALSE,FALSE,FALSE,FALSE,FALSE,FALSE,FALSE,FALSE,FALSE,TRUE,FALSE,FALSE,FALSE,FALSE,FALSE,FALSE,FALSE,FALSE,FALSE,FALSE,FALSE,FALSE,1,,TRUE,TRUE,FALSE,FALSE,0,,FALSE,,FALSE,,FALSE,FALSE,FALSE,FALSE,FALSE,FALSE,FALSE,,,"Details about meetings at the Butter dam and the loch at Paiston in Issobell Murray's confession, nothing from Bartilman's own confession.",FALSE,FALSE,FALSE,FALSE,FALSE,FALSE,FALSE,FALSE,FALSE,FALSE,"Meetings held around Pasche, first week or week after, either 1 a.m. or 10 o'clock at night.",FALSE,FALSE,FALSE,FALSE,FALSE,FALSE,FALSE,FALSE,FALSE,FALSE,FALSE,FALSE,FALSE,FALSE,FALSE,FALSE,FALSE,,FALSE,FALSE,,,FALSE,FALSE,FALSE,FALSE,FALSE,,,SMD,2001-05-15T17:00:16,jhm,2002-10-03T14:36:06
C/EGD/1319,1319,EGD,-1,A/EGD/1307,8/6/1649,2049-06-08T00:00:00,8/6/1649,2049-06-08T00:00:00,,"Russell,Margaret",,,,,,,FALSE,FALSE,FALSE,FALSE,FALSE,FALSE,FALSE,FALSE,FALSE,FALSE,FALSE,FALSE,FALSE,FALSE,FALSE,FALSE,FALSE,TRUE,FALSE,FALSE,FALSE,FALSE,FALSE,FALSE,FALSE,FALSE,FALSE,FALSE,FALSE,FALSE,1,,TRUE,TRUE,FALSE,FALSE,0,,FALSE,,FALSE,,FALSE,FALSE,FALSE,FALSE,FALSE,FALSE,FALSE,,,It was claimed by another person she attended meetings at a house.,FALSE,FALSE,FALSE,FALSE,FALSE,FALSE,FALSE,FALSE,FALSE,FALSE,,FALSE,FALSE,FALSE,FALSE,FALSE,FALSE,FALSE,FALSE,FALSE,FALSE,FALSE,FALSE,FALSE,FALSE,FALSE,FALSE,FALSE,,FALSE,FALSE,,,FALSE,FALSE,FALSE,FALSE,FALSE,,,SMD,2001-05-15T17:00:16,jhm,2002-12-06T12:15:53
C/EGD/132,132,EGD,-1,A/EGD/121,12/11/1597,1997-11-12T00:00:00,12/11/1597,1997-11-12T00:00:00,,"Lewinstoun,Christian",,,,,,,FALSE,FALSE,FALSE,FALSE,FALSE,FALSE,FALSE,FALSE,FALSE,TRUE,TRUE,TRUE,FALSE,TRUE,FALSE,FALSE,FALSE,TRUE,FALSE,FALSE,FALSE,FALSE,FALSE,FALSE,FALSE,FALSE,FALSE,FALSE,FALSE,FALSE,5,,FALSE,FALSE,FALSE,FALSE,0,"She was part of a group of four women who appear to have been recognised folk healers who met, taught each other, cured for each other and generally worked together as professionals (the group includes c/egd/136, c/egd/133, c/egd/132, c/egd/131).  There is no mention of the Devil.",FALSE,,TRUE,,FALSE,FALSE,FALSE,FALSE,FALSE,FALSE,FALSE,,,,TRUE,FALSE,TRUE,TRUE,FALSE,FALSE,FALSE,FALSE,TRUE,FALSE,"Her daughter was taken away by the fairies and she learned witchcraft and taught it to Lewinstoun.  She found a bunch of bewitched items in their wall and cast them into a fire.  For knowledge of the sex of a baby, power received from the fairy-folk.  She was consulted by Saidler for cures.  She could heal named diseases",TRUE,FALSE,FALSE,FALSE,FALSE,FALSE,FALSE,FALSE,TRUE,TRUE,FALSE,FALSE,FALSE,TRUE,TRUE,FALSE,FALSE,"She supposedly worked with Christian Sadler.  A man approached her 'as ane wyfe woman, haifing knaulege in the foirsaid airt [witchcraft].'  ie she was a wise woman, or a healer.",TRUE,FALSE,,,FALSE,FALSE,FALSE,FALSE,FALSE,,,SMD,2001-05-15T17:00:16,jhm,2002-11-13T15:49:09
C/EGD/1320,1320,EGD,-1,A/EGD/1308,8/6/1649,2049-06-08T00:00:00,8/6/1649,2049-06-08T00:00:00,,"Adamsone,Marjorie",,,,,,,FALSE,FALSE,FALSE,FALSE,FALSE,FALSE,FALSE,FALSE,FALSE,FALSE,FALSE,FALSE,FALSE,FALSE,FALSE,FALSE,FALSE,TRUE,FALSE,FALSE,FALSE,FALSE,FALSE,FALSE,FALSE,FALSE,FALSE,FALSE,FALSE,FALSE,1,,TRUE,TRUE,FALSE,FALSE,0,,FALSE,,FALSE,,FALSE,FALSE,FALSE,FALSE,FALSE,FALSE,FALSE,,,Claimed by another person that she attended meetings at a house.,FALSE,FALSE,FALSE,FALSE,FALSE,FALSE,FALSE,FALSE,FALSE,FALSE,,FALSE,FALSE,FALSE,FALSE,FALSE,FALSE,FALSE,FALSE,FALSE,FALSE,FALSE,FALSE,FALSE,FALSE,FALSE,FALSE,FALSE,,FALSE,FALSE,,,FALSE,FALSE,FALSE,FALSE,FALSE,,,SMD,2001-05-15T17:00:16,jhm,2002-10-10T12:07:08
C/EGD/1321,1321,EGD,-1,A/EGD/1309,,,8/6/1649,2049-06-08T00:00:00,,"Richesone,Marion",,,,,,,FALSE,FALSE,FALSE,FALSE,FALSE,FALSE,FALSE,FALSE,FALSE,FALSE,FALSE,FALSE,FALSE,FALSE,FALSE,FALSE,FALSE,TRUE,FALSE,FALSE,FALSE,FALSE,FALSE,FALSE,FALSE,FALSE,FALSE,FALSE,FALSE,FALSE,1,,TRUE,TRUE,FALSE,FALSE,0,,FALSE,,FALSE,,FALSE,FALSE,FALSE,FALSE,FALSE,FALSE,FALSE,,,Claimed by Agnes Hunter that she attended meetings at a house.,FALSE,FALSE,FALSE,FALSE,FALSE,FALSE,FALSE,FALSE,FALSE,FALSE,,FALSE,FALSE,FALSE,FALSE,FALSE,FALSE,FALSE,FALSE,FALSE,FALSE,FALSE,FALSE,FALSE,FALSE,FALSE,FALSE,FALSE,,FALSE,FALSE,,,FALSE,FALSE,FALSE,FALSE,FALSE,,,SMD,2001-05-15T17:00:16,jhm,2002-12-06T12:24:01
C/EGD/1322,1322,EGD,-1,A/EGD/1310,8/6/1649,2049-06-08T00:00:00,21/6/1649,2049-06-21T00:00:00,,"Hunter,Agnes",,,,,,,FALSE,FALSE,FALSE,FALSE,FALSE,TRUE,FALSE,FALSE,FALSE,TRUE,FALSE,FALSE,FALSE,FALSE,FALSE,FALSE,FALSE,TRUE,FALSE,FALSE,FALSE,FALSE,FALSE,FALSE,FALSE,FALSE,FALSE,FALSE,FALSE,FALSE,3,,TRUE,TRUE,FALSE,FALSE,0,,FALSE,she found him cold during sex.,TRUE,,TRUE,FALSE,FALSE,FALSE,TRUE,FALSE,FALSE,,,,TRUE,FALSE,FALSE,FALSE,FALSE,FALSE,FALSE,FALSE,FALSE,FALSE,,FALSE,FALSE,FALSE,FALSE,FALSE,FALSE,FALSE,FALSE,FALSE,FALSE,FALSE,FALSE,FALSE,FALSE,FALSE,FALSE,FALSE,,FALSE,FALSE,,,FALSE,FALSE,FALSE,FALSE,FALSE,,,SMD,2001-05-15T17:00:16,jhm,2002-11-13T16:21:44
C/EGD/1323,1323,EGD,-1,A/EGD/1311,8/6/1649,2049-06-08T00:00:00,2/7/1649,2049-07-02T00:00:00,35,"Dicksone,Margaret",,,,,,,FALSE,FALSE,FALSE,FALSE,TRUE,TRUE,FALSE,FALSE,FALSE,TRUE,FALSE,TRUE,FALSE,FALSE,FALSE,FALSE,FALSE,TRUE,FALSE,FALSE,FALSE,FALSE,FALSE,FALSE,FALSE,FALSE,FALSE,FALSE,FALSE,FALSE,5,,FALSE,FALSE,FALSE,FALSE,0,Named by other witch but confessed to demonic pact and named others.,FALSE,She asked the devil for 'her reward' which he had promised. He refused and said she would it get when the others got theirs.,TRUE,,TRUE,FALSE,FALSE,FALSE,FALSE,TRUE,FALSE,,,,TRUE,FALSE,FALSE,FALSE,FALSE,FALSE,FALSE,FALSE,FALSE,FALSE,,FALSE,FALSE,FALSE,FALSE,FALSE,FALSE,FALSE,FALSE,FALSE,FALSE,FALSE,FALSE,FALSE,FALSE,TRUE,FALSE,FALSE,Confessed that Issobell Johnstone had come to her to ask advice about curing her child using south running water. Dickson asked the 'devil' about this and he advised her in its us.,FALSE,FALSE,,,FALSE,FALSE,FALSE,FALSE,FALSE,,,SMD,2001-05-15T17:00:16,jhm,2002-11-13T16:16:14
C/EGD/1324,1324,EGD,-1,A/EGD/1312,8/6/1649,2049-06-08T00:00:00,2/7/1649,2049-07-02T00:00:00,,"Murray,Issobell",,,,,,,FALSE,TRUE,FALSE,FALSE,TRUE,TRUE,FALSE,FALSE,FALSE,FALSE,FALSE,FALSE,FALSE,FALSE,FALSE,FALSE,FALSE,TRUE,FALSE,FALSE,FALSE,FALSE,FALSE,FALSE,FALSE,FALSE,FALSE,FALSE,FALSE,FALSE,4,,FALSE,TRUE,FALSE,FALSE,0,Named by another witch but confessed to demonic pact. From her confession and those of the others there also seems to have been some unorthodox religious elements associated with Easter practices.,FALSE,Confessed she had been a servant of the devil since the previous Easter (Pasche).,TRUE,,TRUE,FALSE,FALSE,TRUE,FALSE,TRUE,TRUE,,,Met during the first week of Pasche at or about one hour after midnight. Another meeting was week after Pasche at 10 o'clock at night. Another meeting was at 'Butter dam' location not known,FALSE,FALSE,FALSE,FALSE,FALSE,TRUE,FALSE,TRUE,FALSE,FALSE,,FALSE,FALSE,FALSE,FALSE,FALSE,FALSE,FALSE,FALSE,FALSE,FALSE,FALSE,FALSE,FALSE,FALSE,FALSE,FALSE,FALSE,,FALSE,FALSE,,,FALSE,FALSE,FALSE,FALSE,FALSE,,,SMD,2001-05-15T17:00:16,jhm,2002-10-03T14:42:42
C/EGD/1325,1325,EGD,-1,A/EGD/1313,8/6/1649,2049-06-08T00:00:00,8/6/1649,2049-06-08T00:00:00,,"Staig,Margaret",,,,,,,FALSE,FALSE,FALSE,FALSE,FALSE,FALSE,FALSE,FALSE,FALSE,FALSE,FALSE,FALSE,FALSE,FALSE,FALSE,FALSE,FALSE,TRUE,FALSE,FALSE,FALSE,FALSE,FALSE,FALSE,FALSE,FALSE,FALSE,FALSE,FALSE,FALSE,1,,TRUE,TRUE,FALSE,FALSE,0,,FALSE,,FALSE,,FALSE,FALSE,FALSE,FALSE,FALSE,FALSE,FALSE,,,Hunter claimed she attended meetings at a house.,FALSE,FALSE,FALSE,FALSE,FALSE,FALSE,FALSE,FALSE,FALSE,FALSE,,FALSE,FALSE,FALSE,FALSE,FALSE,FALSE,FALSE,FALSE,FALSE,FALSE,FALSE,FALSE,FALSE,FALSE,FALSE,FALSE,FALSE,,FALSE,FALSE,,,FALSE,FALSE,FALSE,FALSE,FALSE,,,SMD,2001-05-15T17:00:16,jhm,2002-10-03T14:43:47
C/EGD/1326,1326,EGD,-1,A/EGD/1314,7/6/1649,2049-06-07T00:00:00,2/7/1649,2049-07-02T00:00:00,,"Halieburton,Manie",,,,,,,FALSE,FALSE,FALSE,FALSE,FALSE,TRUE,FALSE,FALSE,FALSE,FALSE,FALSE,FALSE,FALSE,FALSE,FALSE,FALSE,FALSE,TRUE,FALSE,FALSE,FALSE,FALSE,FALSE,FALSE,FALSE,FALSE,FALSE,FALSE,FALSE,FALSE,2,,TRUE,TRUE,FALSE,FALSE,0,,FALSE,Claimed by another person to have met the devil as a black man with a staff.,FALSE,,FALSE,FALSE,FALSE,FALSE,FALSE,FALSE,FALSE,,,Claimed by another person that she attended meetings on the green at Dirleton castle.,FALSE,FALSE,FALSE,FALSE,FALSE,FALSE,FALSE,FALSE,FALSE,FALSE,,FALSE,FALSE,FALSE,FALSE,FALSE,FALSE,FALSE,FALSE,FALSE,FALSE,FALSE,FALSE,FALSE,FALSE,FALSE,FALSE,FALSE,,FALSE,FALSE,,,FALSE,FALSE,FALSE,FALSE,FALSE,,,SMD,2001-05-15T17:00:16,jhm,2002-10-03T14:47:20
C/EGD/1327,1327,EGD,-1,A/EGD/1315,7/6/1649,2049-06-07T00:00:00,20/6/1649,2049-06-20T00:00:00,,"Hogge,Bessie",,,,,,,FALSE,FALSE,FALSE,FALSE,FALSE,TRUE,FALSE,FALSE,FALSE,FALSE,FALSE,FALSE,FALSE,FALSE,FALSE,FALSE,FALSE,TRUE,FALSE,FALSE,FALSE,FALSE,FALSE,FALSE,FALSE,FALSE,FALSE,FALSE,FALSE,FALSE,2,,TRUE,TRUE,FALSE,FALSE,0,Very little information recorded although Agnes Clarkson describes Hogge and others attending meetings. No details of Hogge's confession.,FALSE,,FALSE,,FALSE,FALSE,FALSE,FALSE,TRUE,TRUE,FALSE,,,,FALSE,FALSE,FALSE,FALSE,FALSE,FALSE,FALSE,FALSE,FALSE,FALSE,,FALSE,FALSE,FALSE,FALSE,FALSE,FALSE,FALSE,FALSE,FALSE,FALSE,FALSE,FALSE,FALSE,FALSE,FALSE,FALSE,FALSE,,FALSE,FALSE,,,FALSE,FALSE,FALSE,FALSE,FALSE,,,SMD,2001-05-15T17:00:16,LEM,2002-10-10T15:03:15
C/EGD/1328,1328,EGD,-1,A/EGD/1316,20/6/1649,2049-06-20T00:00:00,2/7/1649,2049-07-02T00:00:00,43,"Watsone,Patrik",,,,,,,FALSE,FALSE,FALSE,FALSE,FALSE,TRUE,FALSE,FALSE,FALSE,FALSE,FALSE,FALSE,FALSE,FALSE,FALSE,FALSE,FALSE,TRUE,FALSE,FALSE,FALSE,FALSE,FALSE,FALSE,FALSE,FALSE,FALSE,FALSE,FALSE,FALSE,2,,TRUE,TRUE,FALSE,FALSE,0,Implicated by Agnes Clarkson as having attended meetings,FALSE,Clarkson claimed he met the devil as a black man with a staff.,TRUE,,TRUE,FALSE,FALSE,FALSE,TRUE,TRUE,FALSE,,,Clarkson claimed he attended meetings at the green at Dirleton castle.,FALSE,FALSE,FALSE,FALSE,FALSE,FALSE,FALSE,FALSE,FALSE,FALSE,,FALSE,FALSE,FALSE,FALSE,FALSE,FALSE,FALSE,FALSE,FALSE,FALSE,FALSE,FALSE,FALSE,FALSE,FALSE,FALSE,FALSE,,FALSE,FALSE,,,FALSE,FALSE,FALSE,FALSE,FALSE,,,SMD,2001-05-15T17:00:16,jhm,2002-10-03T14:55:04
C/EGD/1329,1329,EGD,-1,A/EGD/1317,2/7/1649,2049-07-02T00:00:00,5/7/1649,2049-07-05T00:00:00,,"Broune,Issobell",,,,,,,FALSE,FALSE,FALSE,FALSE,FALSE,TRUE,FALSE,FALSE,FALSE,FALSE,FALSE,FALSE,FALSE,FALSE,FALSE,FALSE,FALSE,TRUE,FALSE,FALSE,FALSE,FALSE,FALSE,FALSE,FALSE,FALSE,FALSE,FALSE,FALSE,FALSE,2,,TRUE,TRUE,FALSE,FALSE,0,,FALSE,He offered her money if she made a pact.,TRUE,,TRUE,FALSE,FALSE,FALSE,FALSE,FALSE,FALSE,,,,FALSE,FALSE,FALSE,FALSE,FALSE,FALSE,FALSE,FALSE,FALSE,FALSE,,FALSE,FALSE,FALSE,FALSE,FALSE,FALSE,FALSE,FALSE,FALSE,FALSE,FALSE,FALSE,FALSE,FALSE,FALSE,FALSE,FALSE,,FALSE,FALSE,,,FALSE,FALSE,FALSE,FALSE,FALSE,,,SMD,2001-05-15T17:00:16,jhm,2002-10-03T14:57:31
C/EGD/133,133,EGD,-1,A/EGD/122,12/11/1597,1997-11-12T00:00:00,12/11/1597,1997-11-12T00:00:00,,"Saidler,Christian",,,,,,,FALSE,FALSE,FALSE,FALSE,FALSE,FALSE,FALSE,FALSE,FALSE,FALSE,TRUE,TRUE,FALSE,TRUE,FALSE,FALSE,FALSE,TRUE,FALSE,FALSE,FALSE,FALSE,FALSE,FALSE,FALSE,FALSE,FALSE,FALSE,FALSE,FALSE,4,,FALSE,FALSE,FALSE,FALSE,0,"She was part of a group of four women who appear to have been recognised folk healers who met, taught each other, cured for each other and generally worked together as professionals (the group includes c/egd/136, c/egd/133, c/egd/132, c/egd/131).  There is no mention of the Devil.",FALSE,,TRUE,,FALSE,FALSE,FALSE,FALSE,FALSE,FALSE,FALSE,,,,FALSE,FALSE,FALSE,TRUE,FALSE,FALSE,FALSE,FALSE,TRUE,FALSE,"A cure involved drinking a mixture of wort and butter.  She was to bath in woodbine and roset hett - a combination of plants.  She took the blood of a red cock, and baked a bannock with it.  Then she took one of her patients shirt and dipped it into a well.  Saidler believed that one of her patients was being bewitched by Jonet Stewart, she tried to counteract the magic, failed and told her patient to beg for the forgiveness of Stewart.  When she couldn't do a cure, she sent for Levingstone for cures.  She used Quick-silver.",TRUE,FALSE,FALSE,FALSE,FALSE,FALSE,FALSE,FALSE,TRUE,TRUE,FALSE,FALSE,FALSE,TRUE,TRUE,FALSE,FALSE,Claimed to be able to cure leprosy and that she learned the cure from her dad.  Was consulted as a healer.  She believed that Jonet Stewart had laid a bewitchment on one of her paitients.  She worked with Cristian Levingston.,TRUE,FALSE,,,FALSE,FALSE,FALSE,FALSE,FALSE,,,SMD,2001-05-15T17:00:16,jhm,2002-12-06T12:15:09
C/EGD/1330,1330,EGD,-1,A/EGD/1318,8/7/1649,2049-07-08T00:00:00,8/7/1649,2049-07-08T00:00:00,,"Robison,Marion",,,,,,,FALSE,FALSE,FALSE,FALSE,FALSE,FALSE,FALSE,FALSE,FALSE,FALSE,FALSE,FALSE,FALSE,FALSE,FALSE,FALSE,FALSE,TRUE,FALSE,FALSE,FALSE,FALSE,FALSE,FALSE,FALSE,FALSE,FALSE,FALSE,FALSE,FALSE,1,,TRUE,TRUE,FALSE,FALSE,0,,FALSE,,FALSE,,FALSE,FALSE,FALSE,FALSE,FALSE,FALSE,FALSE,,,,FALSE,FALSE,FALSE,FALSE,FALSE,FALSE,FALSE,FALSE,FALSE,FALSE,,FALSE,TRUE,FALSE,FALSE,FALSE,FALSE,FALSE,FALSE,FALSE,FALSE,FALSE,FALSE,FALSE,FALSE,FALSE,FALSE,FALSE,,FALSE,FALSE,,,FALSE,FALSE,FALSE,FALSE,FALSE,,,SMD,2001-05-15T17:00:16,LEM,2002-10-10T11:53:20
C/EGD/1331,1331,EGD,-1,A/EGD/1319,8/7/1649,2049-07-08T00:00:00,14/9/1649,2049-09-14T00:00:00,,"Young,Beatrix",,,,,,,FALSE,FALSE,FALSE,FALSE,FALSE,FALSE,FALSE,FALSE,FALSE,FALSE,FALSE,FALSE,FALSE,FALSE,FALSE,FALSE,FALSE,TRUE,FALSE,FALSE,FALSE,FALSE,FALSE,FALSE,FALSE,FALSE,FALSE,FALSE,FALSE,FALSE,1,,TRUE,TRUE,FALSE,FALSE,0,,FALSE,,FALSE,,FALSE,FALSE,FALSE,FALSE,FALSE,FALSE,FALSE,,,Meetings at the river mouth at Eyemouth and the yard of the Laird of Wedderburn's house described in someone else's confession.,FALSE,FALSE,FALSE,FALSE,FALSE,FALSE,FALSE,FALSE,FALSE,FALSE,,FALSE,TRUE,FALSE,FALSE,FALSE,FALSE,FALSE,FALSE,FALSE,FALSE,FALSE,FALSE,FALSE,FALSE,FALSE,FALSE,FALSE,,FALSE,FALSE,,,FALSE,FALSE,FALSE,FALSE,FALSE,,,SMD,2001-05-15T17:00:16,LEM,2002-10-28T14:46:45
C/EGD/1332,1332,EGD,-1,A/EGD/1320,8/7/1649,2049-07-08T00:00:00,8/7/1649,2049-07-08T00:00:00,,"Cairnes,Alisone",,,,,,,FALSE,FALSE,FALSE,FALSE,FALSE,FALSE,FALSE,FALSE,FALSE,FALSE,FALSE,FALSE,FALSE,FALSE,FALSE,FALSE,FALSE,TRUE,FALSE,FALSE,FALSE,FALSE,FALSE,FALSE,FALSE,FALSE,FALSE,FALSE,FALSE,FALSE,1,,TRUE,TRUE,FALSE,FALSE,0,,FALSE,,FALSE,,FALSE,FALSE,FALSE,FALSE,FALSE,TRUE,FALSE,,,Meetings at the river mouth at Eyemouth and the yard of the Laird of Wedderburn's house described in someone else's confession.,FALSE,FALSE,FALSE,FALSE,FALSE,FALSE,FALSE,FALSE,FALSE,FALSE,Margaret Dobson confessed that Alisone's heart had died and was stone.,FALSE,TRUE,FALSE,FALSE,FALSE,FALSE,FALSE,FALSE,FALSE,FALSE,FALSE,FALSE,FALSE,FALSE,FALSE,FALSE,FALSE,,FALSE,FALSE,,,FALSE,FALSE,FALSE,FALSE,FALSE,,,SMD,2001-05-15T17:00:16,jhm,2002-10-10T12:02:55
C/EGD/1333,1333,EGD,-1,A/EGD/1321,8/7/1649,2049-07-08T00:00:00,8/7/1649,2049-07-08T00:00:00,,"Tailzear,Helen",,,,,,,FALSE,FALSE,FALSE,FALSE,FALSE,TRUE,FALSE,FALSE,FALSE,FALSE,FALSE,FALSE,FALSE,FALSE,FALSE,FALSE,FALSE,TRUE,FALSE,FALSE,FALSE,FALSE,FALSE,FALSE,FALSE,FALSE,FALSE,FALSE,FALSE,FALSE,2,,TRUE,TRUE,FALSE,FALSE,0,,FALSE,,TRUE,,FALSE,FALSE,FALSE,FALSE,FALSE,TRUE,FALSE,,,,FALSE,FALSE,FALSE,FALSE,FALSE,FALSE,FALSE,FALSE,FALSE,FALSE,,FALSE,FALSE,FALSE,FALSE,FALSE,FALSE,FALSE,FALSE,FALSE,FALSE,FALSE,FALSE,FALSE,FALSE,FALSE,FALSE,FALSE,,FALSE,FALSE,,,FALSE,FALSE,FALSE,FALSE,FALSE,,,SMD,2001-05-15T17:00:16,jhm,2002-10-03T15:08:10
C/EGD/1334,1334,EGD,-1,A/EGD/1322,8/7/1649,2049-07-08T00:00:00,8/7/1649,2049-07-08T00:00:00,,"Dobson,Margaret",,,,,,,FALSE,FALSE,FALSE,FALSE,FALSE,TRUE,FALSE,FALSE,FALSE,TRUE,FALSE,FALSE,FALSE,TRUE,FALSE,FALSE,FALSE,FALSE,FALSE,FALSE,FALSE,FALSE,FALSE,FALSE,FALSE,FALSE,FALSE,FALSE,FALSE,FALSE,3,,TRUE,TRUE,FALSE,FALSE,0,,FALSE,,TRUE,,FALSE,TRUE,FALSE,FALSE,FALSE,TRUE,FALSE,,,meeting at 12:00am,FALSE,FALSE,FALSE,FALSE,FALSE,FALSE,FALSE,FALSE,FALSE,FALSE,,FALSE,TRUE,FALSE,FALSE,FALSE,FALSE,FALSE,FALSE,FALSE,FALSE,FALSE,FALSE,FALSE,FALSE,FALSE,FALSE,FALSE,,FALSE,FALSE,,,FALSE,FALSE,FALSE,FALSE,FALSE,,,SMD,2001-05-15T17:00:16,jhm,2002-10-03T15:11:42
C/EGD/1335,1335,EGD,-1,A/EGD/1323,8/6/1649,2049-06-08T00:00:00,12/6/1649,2049-06-12T00:00:00,,"Anderson,Grissell",,,,,,,FALSE,FALSE,FALSE,FALSE,FALSE,FALSE,FALSE,FALSE,FALSE,FALSE,FALSE,FALSE,FALSE,FALSE,FALSE,FALSE,FALSE,TRUE,FALSE,FALSE,FALSE,FALSE,FALSE,FALSE,FALSE,FALSE,FALSE,FALSE,FALSE,FALSE,1,,TRUE,TRUE,FALSE,FALSE,0,,FALSE,,FALSE,,FALSE,FALSE,FALSE,FALSE,FALSE,FALSE,FALSE,,,accused of being at a witches' meeting,FALSE,FALSE,FALSE,FALSE,FALSE,FALSE,FALSE,FALSE,FALSE,FALSE,,FALSE,FALSE,FALSE,FALSE,FALSE,FALSE,FALSE,FALSE,FALSE,FALSE,FALSE,FALSE,FALSE,FALSE,FALSE,FALSE,FALSE,,FALSE,FALSE,,,FALSE,FALSE,FALSE,FALSE,FALSE,,,SMD,2001-05-15T17:00:16,jhm,2002-10-10T12:19:53
C/EGD/1336,1336,EGD,-1,A/EGD/1324,8/6/1649,2049-06-08T00:00:00,12/6/1649,2049-06-12T00:00:00,,"Dicksone,John",,,,,,,FALSE,FALSE,FALSE,FALSE,FALSE,FALSE,FALSE,FALSE,FALSE,FALSE,FALSE,FALSE,FALSE,FALSE,FALSE,FALSE,FALSE,TRUE,FALSE,FALSE,FALSE,FALSE,FALSE,FALSE,FALSE,FALSE,FALSE,FALSE,FALSE,FALSE,1,,TRUE,TRUE,FALSE,FALSE,0,,FALSE,,FALSE,,FALSE,FALSE,FALSE,FALSE,FALSE,FALSE,FALSE,,,,FALSE,FALSE,FALSE,FALSE,FALSE,FALSE,FALSE,FALSE,FALSE,FALSE,,FALSE,FALSE,FALSE,FALSE,FALSE,FALSE,FALSE,FALSE,FALSE,FALSE,FALSE,FALSE,FALSE,FALSE,FALSE,FALSE,FALSE,,FALSE,FALSE,,,FALSE,FALSE,FALSE,FALSE,FALSE,,,SMD,2001-05-15T17:00:16,jhm,2002-10-10T12:04:27
C/EGD/1337,1337,EGD,-1,A/EGD/1325,13/7/1649,2049-07-13T00:00:00,25/7/1649,2049-07-25T00:00:00,,"Robertson,Margarit",,,,,,,FALSE,FALSE,FALSE,FALSE,FALSE,FALSE,FALSE,FALSE,FALSE,FALSE,FALSE,FALSE,FALSE,FALSE,FALSE,FALSE,FALSE,TRUE,FALSE,FALSE,FALSE,FALSE,FALSE,FALSE,FALSE,FALSE,FALSE,FALSE,FALSE,FALSE,1,,TRUE,TRUE,FALSE,FALSE,0,Named by Margaret Veitch/Vaith who described Robertson meeting the devil but no details from Robertson's own confession.,FALSE,Because the other confessing witch described Robertson as having met the devil it is likely the church implied there was some form of demonic pact.,FALSE,,FALSE,FALSE,FALSE,FALSE,FALSE,FALSE,FALSE,,,Meeting with the devil described by Margaret Veitch as having been at the 'Byrilaw' - the birlaw court.,FALSE,FALSE,FALSE,FALSE,FALSE,FALSE,FALSE,FALSE,FALSE,FALSE,,FALSE,FALSE,FALSE,FALSE,FALSE,FALSE,FALSE,FALSE,FALSE,FALSE,FALSE,FALSE,FALSE,FALSE,FALSE,FALSE,FALSE,,FALSE,FALSE,,,FALSE,FALSE,FALSE,FALSE,FALSE,,,SMD,2001-05-15T17:00:16,LEM,2002-10-10T11:53:45
C/EGD/1338,1338,EGD,-1,A/EGD/1326,13/7/1649,2049-07-13T00:00:00,18/7/1649,2049-07-18T00:00:00,,"Vaith,Margrat",,,,,,,FALSE,FALSE,FALSE,FALSE,FALSE,TRUE,FALSE,FALSE,FALSE,FALSE,FALSE,FALSE,FALSE,FALSE,FALSE,FALSE,FALSE,FALSE,FALSE,FALSE,FALSE,FALSE,FALSE,FALSE,FALSE,FALSE,FALSE,FALSE,FALSE,FALSE,1,,TRUE,TRUE,FALSE,FALSE,0,,FALSE,He wanted to lie with her.  She thought his nature was cold.,FALSE,,FALSE,FALSE,FALSE,FALSE,FALSE,FALSE,FALSE,,,,FALSE,FALSE,FALSE,FALSE,FALSE,FALSE,FALSE,FALSE,FALSE,FALSE,,FALSE,FALSE,FALSE,FALSE,FALSE,FALSE,FALSE,FALSE,FALSE,FALSE,FALSE,FALSE,FALSE,FALSE,FALSE,FALSE,FALSE,,FALSE,FALSE,,,FALSE,FALSE,FALSE,FALSE,FALSE,,,SMD,2001-05-15T17:00:16,jhm,2002-10-03T15:24:23
C/EGD/1339,1339,EGD,-1,A/EGD/1327,14/7/1649,2049-07-14T00:00:00,15/10/1649,2049-10-15T00:00:00,,"Gauld,Mauld",,,,,,,FALSE,FALSE,FALSE,FALSE,FALSE,FALSE,FALSE,FALSE,FALSE,FALSE,FALSE,FALSE,FALSE,TRUE,FALSE,FALSE,FALSE,FALSE,TRUE,TRUE,FALSE,FALSE,FALSE,FALSE,FALSE,FALSE,FALSE,FALSE,FALSE,FALSE,3,,FALSE,FALSE,FALSE,TRUE,1,"This one is a good example of neighbourhood dispute because it has witness depositions about quarrels, curses, harm from the neighbours' point of view.  The witnesses against her are craftsmen, burgesses and their wives.",FALSE,,FALSE,,FALSE,FALSE,FALSE,FALSE,FALSE,FALSE,FALSE,,,,FALSE,FALSE,FALSE,TRUE,FALSE,FALSE,FALSE,FALSE,TRUE,FALSE,The victim said he wanted to drink with the supect and then he did drink with suspect and he got better.  Her servant said that she had a 'piece of clay formed be hir to the liknes of a mans priwie members doing quhat is abominable to think or speik of'.  This was tried in front of the kirk session.  She was witnessed spinning a sieve.,TRUE,TRUE,FALSE,FALSE,FALSE,TRUE,FALSE,FALSE,FALSE,FALSE,TRUE,TRUE,FALSE,FALSE,FALSE,FALSE,FALSE,A witness desired to drink with her because he feared her evil.  She threatened her neighbours and they got sick.  Scolding and flyting.  She bragged about the malefices 'thair was never ane wrongit her bot sho gat her hart sythit on them'.,TRUE,FALSE,revenge for a family taking a house over her head.,,FALSE,FALSE,FALSE,FALSE,FALSE,,"has interrogatory, evidence of Church instigation of the whole thing.",SMD,2001-05-15T17:00:16,jhm,2002-10-03T15:28:13
C/EGD/134,134,EGD,-1,A/EGD/123,12/11/1597,1997-11-12T00:00:00,12/11/1597,1997-11-12T00:00:00,,"Damiet,John",,,,,,,FALSE,FALSE,FALSE,FALSE,FALSE,FALSE,FALSE,FALSE,FALSE,FALSE,FALSE,FALSE,FALSE,FALSE,FALSE,FALSE,FALSE,TRUE,FALSE,FALSE,FALSE,FALSE,FALSE,FALSE,FALSE,FALSE,FALSE,FALSE,FALSE,FALSE,1,,TRUE,TRUE,FALSE,FALSE,0,,FALSE,,FALSE,,FALSE,FALSE,FALSE,FALSE,FALSE,FALSE,FALSE,,,,FALSE,FALSE,FALSE,FALSE,FALSE,FALSE,FALSE,FALSE,FALSE,FALSE,,FALSE,FALSE,FALSE,FALSE,FALSE,FALSE,FALSE,FALSE,FALSE,FALSE,FALSE,FALSE,FALSE,FALSE,FALSE,FALSE,FALSE,,FALSE,FALSE,,,FALSE,FALSE,FALSE,FALSE,FALSE,,,SMD,2001-05-15T17:00:16,LEM,2002-10-10T16:19:54
C/EGD/1340,1340,EGD,-1,A/EGD/1328,27/9/1649,2049-09-27T00:00:00,27/9/1649,2049-09-27T00:00:00,,"Watersoun,Agnes",,,,,,,FALSE,FALSE,FALSE,FALSE,FALSE,FALSE,FALSE,FALSE,FALSE,FALSE,FALSE,FALSE,FALSE,FALSE,FALSE,FALSE,FALSE,FALSE,FALSE,FALSE,FALSE,FALSE,FALSE,FALSE,FALSE,FALSE,FALSE,FALSE,FALSE,FALSE,0,,TRUE,TRUE,FALSE,FALSE,0,,FALSE,,FALSE,,FALSE,FALSE,FALSE,FALSE,FALSE,FALSE,FALSE,,,,FALSE,FALSE,FALSE,FALSE,FALSE,FALSE,FALSE,FALSE,FALSE,FALSE,,FALSE,FALSE,FALSE,FALSE,FALSE,FALSE,FALSE,FALSE,FALSE,FALSE,FALSE,FALSE,FALSE,FALSE,FALSE,FALSE,FALSE,,FALSE,FALSE,,,FALSE,FALSE,FALSE,FALSE,FALSE,,,SMD,2001-05-15T17:00:16,jhm,2002-10-03T15:30:24
C/EGD/1341,1341,EGD,-1,A/EGD/1329,27/9/1649,2049-09-27T00:00:00,27/9/1649,2049-09-27T00:00:00,,"Ronaldsone,Elspeth",,,,,,,FALSE,FALSE,FALSE,FALSE,FALSE,FALSE,FALSE,FALSE,FALSE,FALSE,FALSE,FALSE,FALSE,FALSE,FALSE,FALSE,FALSE,FALSE,FALSE,FALSE,FALSE,FALSE,FALSE,FALSE,FALSE,FALSE,FALSE,FALSE,FALSE,FALSE,0,,TRUE,TRUE,FALSE,FALSE,0,,FALSE,,FALSE,,FALSE,FALSE,FALSE,FALSE,FALSE,FALSE,FALSE,,,,FALSE,FALSE,FALSE,FALSE,FALSE,FALSE,FALSE,FALSE,FALSE,FALSE,,FALSE,FALSE,FALSE,FALSE,FALSE,FALSE,FALSE,FALSE,FALSE,FALSE,FALSE,FALSE,FALSE,FALSE,FALSE,FALSE,FALSE,,FALSE,FALSE,,,FALSE,FALSE,FALSE,FALSE,FALSE,,,SMD,2001-05-15T17:00:16,jhm,2002-10-03T15:31:31
C/EGD/1342,1342,EGD,-1,A/EGD/1330,23/9/1649,2049-09-23T00:00:00,27/9/1649,2049-09-27T00:00:00,,"Murray,Jonet",,,,,,,FALSE,FALSE,FALSE,FALSE,FALSE,FALSE,FALSE,FALSE,FALSE,FALSE,FALSE,FALSE,FALSE,FALSE,FALSE,FALSE,FALSE,FALSE,FALSE,FALSE,FALSE,FALSE,FALSE,FALSE,FALSE,FALSE,FALSE,FALSE,FALSE,FALSE,0,,TRUE,TRUE,FALSE,FALSE,0,,FALSE,,FALSE,,FALSE,FALSE,FALSE,FALSE,FALSE,FALSE,FALSE,,,,FALSE,FALSE,FALSE,FALSE,FALSE,FALSE,FALSE,FALSE,FALSE,FALSE,,FALSE,FALSE,FALSE,FALSE,FALSE,FALSE,FALSE,FALSE,FALSE,FALSE,FALSE,FALSE,FALSE,FALSE,FALSE,FALSE,FALSE,,FALSE,FALSE,,,FALSE,FALSE,FALSE,FALSE,FALSE,,,SMD,2001-05-15T17:00:16,jhm,2002-10-03T15:32:04
C/EGD/1343,1343,EGD,-1,A/EGD/1331,1649,2049-06-01T00:00:00,2/6/1661,1961-06-02T00:00:00,,"Lawsone,Elizabeth",,,,,,,FALSE,FALSE,FALSE,FALSE,FALSE,FALSE,FALSE,FALSE,FALSE,FALSE,FALSE,FALSE,FALSE,FALSE,FALSE,FALSE,FALSE,TRUE,FALSE,FALSE,FALSE,FALSE,FALSE,FALSE,FALSE,FALSE,FALSE,FALSE,FALSE,FALSE,1,,TRUE,TRUE,FALSE,FALSE,0,,FALSE,,FALSE,,FALSE,FALSE,FALSE,FALSE,FALSE,FALSE,FALSE,,,"four meetings at the black burn, the Kirkland burn, the moor at Pilmure and the great yard of Blause, described by other confessing witches",FALSE,FALSE,FALSE,FALSE,FALSE,FALSE,FALSE,FALSE,FALSE,FALSE,,FALSE,FALSE,FALSE,FALSE,FALSE,FALSE,FALSE,FALSE,FALSE,FALSE,FALSE,FALSE,FALSE,FALSE,FALSE,FALSE,FALSE,,FALSE,FALSE,,,FALSE,FALSE,FALSE,FALSE,FALSE,,,SMD,2001-05-15T17:00:16,jhm,2002-10-10T09:10:46
C/EGD/1344,1344,EGD,-1,A/EGD/1332,1649,2049-06-01T00:00:00,29/5/1661,1961-05-29T00:00:00,,"Ritchardsone,Issobell",,,,,,,FALSE,FALSE,FALSE,FALSE,FALSE,FALSE,FALSE,FALSE,FALSE,FALSE,FALSE,FALSE,FALSE,FALSE,FALSE,FALSE,FALSE,TRUE,FALSE,FALSE,FALSE,FALSE,FALSE,FALSE,FALSE,FALSE,FALSE,FALSE,FALSE,FALSE,1,,TRUE,TRUE,FALSE,FALSE,0,,FALSE,,FALSE,,FALSE,FALSE,FALSE,FALSE,FALSE,FALSE,FALSE,,,"Meetings at the black burn of Bolton, the moor at Pilmure and Baigbiemure mentioned by another confessing witch.",FALSE,FALSE,FALSE,FALSE,FALSE,FALSE,FALSE,FALSE,FALSE,FALSE,,FALSE,FALSE,FALSE,FALSE,FALSE,FALSE,FALSE,FALSE,FALSE,FALSE,FALSE,FALSE,FALSE,FALSE,FALSE,FALSE,FALSE,,FALSE,FALSE,,,FALSE,FALSE,FALSE,FALSE,FALSE,,,SMD,2001-05-15T17:00:16,jhm,2002-10-10T09:12:02
C/EGD/1346,1346,EGD,-1,A/EGD/1334,1649,2049-06-01T00:00:00,1649,2049-06-01T00:00:00,,"Murray,Agnes",,,,,,,FALSE,FALSE,FALSE,FALSE,FALSE,FALSE,FALSE,FALSE,FALSE,FALSE,FALSE,FALSE,FALSE,FALSE,FALSE,FALSE,FALSE,TRUE,FALSE,FALSE,FALSE,FALSE,FALSE,FALSE,FALSE,FALSE,FALSE,FALSE,FALSE,FALSE,1,,TRUE,TRUE,FALSE,FALSE,0,,FALSE,,FALSE,,FALSE,FALSE,FALSE,FALSE,FALSE,FALSE,FALSE,,,,FALSE,FALSE,FALSE,FALSE,FALSE,FALSE,FALSE,FALSE,FALSE,FALSE,,FALSE,FALSE,FALSE,FALSE,FALSE,FALSE,FALSE,FALSE,FALSE,FALSE,FALSE,FALSE,FALSE,FALSE,FALSE,FALSE,FALSE,,FALSE,FALSE,,,FALSE,FALSE,FALSE,FALSE,FALSE,,,SMD,2001-05-15T17:00:16,jhm,2002-10-07T12:41:15
C/EGD/1347,1347,EGD,-1,A/EGD/1335,1649,2049-06-01T00:00:00,30/5/1661,1961-05-30T00:00:00,,"Deanes,Jeane",,,,,,,FALSE,FALSE,FALSE,FALSE,FALSE,FALSE,FALSE,FALSE,FALSE,FALSE,FALSE,FALSE,FALSE,FALSE,FALSE,FALSE,FALSE,TRUE,FALSE,FALSE,FALSE,FALSE,FALSE,FALSE,FALSE,FALSE,FALSE,FALSE,FALSE,FALSE,1,,TRUE,TRUE,FALSE,FALSE,0,,FALSE,,FALSE,,FALSE,FALSE,FALSE,FALSE,FALSE,TRUE,FALSE,,,"Three meetings at the black burn, the haugh at Samuelston and the moor at Baigbiemure, descibed by other accused witches, not by Deanes herself.",FALSE,FALSE,FALSE,FALSE,FALSE,FALSE,FALSE,FALSE,FALSE,FALSE,,FALSE,FALSE,FALSE,FALSE,FALSE,FALSE,FALSE,FALSE,FALSE,FALSE,FALSE,FALSE,FALSE,FALSE,FALSE,FALSE,FALSE,,FALSE,FALSE,,,FALSE,FALSE,FALSE,FALSE,FALSE,,,SMD,2001-05-15T17:00:16,LEM,2002-10-10T10:11:40
C/EGD/1348,1348,EGD,-1,A/EGD/1336,1649,2049-06-01T00:00:00,1649,2049-06-01T00:00:00,,"Bathcat,Begis",,,,,,,FALSE,FALSE,FALSE,FALSE,FALSE,FALSE,FALSE,FALSE,FALSE,FALSE,FALSE,FALSE,FALSE,FALSE,FALSE,FALSE,FALSE,TRUE,FALSE,FALSE,FALSE,FALSE,FALSE,FALSE,FALSE,FALSE,FALSE,FALSE,FALSE,FALSE,1,,TRUE,TRUE,FALSE,FALSE,0,,FALSE,,FALSE,,FALSE,FALSE,FALSE,FALSE,FALSE,FALSE,FALSE,,,,FALSE,FALSE,FALSE,FALSE,FALSE,FALSE,FALSE,FALSE,FALSE,FALSE,,FALSE,FALSE,FALSE,FALSE,FALSE,FALSE,FALSE,FALSE,FALSE,FALSE,FALSE,FALSE,FALSE,FALSE,FALSE,FALSE,FALSE,,FALSE,FALSE,,,FALSE,FALSE,FALSE,FALSE,FALSE,,,SMD,2001-05-15T17:00:16,jhm,2002-10-03T15:43:03
C/EGD/1349,1349,EGD,-1,A/EGD/1337,1649,2049-06-01T00:00:00,1649,2049-06-01T00:00:00,,"Haliburton,Euphame",,,,,,,FALSE,FALSE,FALSE,FALSE,FALSE,FALSE,FALSE,FALSE,FALSE,FALSE,FALSE,FALSE,FALSE,FALSE,FALSE,FALSE,FALSE,TRUE,FALSE,FALSE,FALSE,FALSE,FALSE,FALSE,FALSE,FALSE,FALSE,FALSE,FALSE,FALSE,1,,TRUE,TRUE,FALSE,FALSE,0,,FALSE,,FALSE,,FALSE,FALSE,FALSE,FALSE,FALSE,FALSE,FALSE,,,,FALSE,FALSE,FALSE,FALSE,FALSE,FALSE,FALSE,FALSE,FALSE,FALSE,,FALSE,FALSE,FALSE,FALSE,FALSE,FALSE,FALSE,FALSE,FALSE,FALSE,FALSE,FALSE,FALSE,FALSE,FALSE,FALSE,FALSE,,FALSE,FALSE,,,FALSE,FALSE,FALSE,FALSE,FALSE,,,SMD,2001-05-15T17:00:16,LEM,2002-12-05T12:29:52
C/EGD/135,135,EGD,-1,A/EGD/124,12/11/1597,1997-11-12T00:00:00,12/11/1597,1997-11-12T00:00:00,,"Clark,Michael",,,,,,,FALSE,FALSE,FALSE,FALSE,FALSE,FALSE,FALSE,FALSE,FALSE,FALSE,FALSE,FALSE,FALSE,FALSE,FALSE,FALSE,FALSE,TRUE,FALSE,FALSE,FALSE,FALSE,FALSE,FALSE,FALSE,FALSE,FALSE,FALSE,FALSE,FALSE,1,,TRUE,TRUE,FALSE,FALSE,0,,FALSE,,FALSE,,FALSE,FALSE,FALSE,FALSE,FALSE,FALSE,FALSE,,,,FALSE,FALSE,FALSE,FALSE,FALSE,FALSE,FALSE,FALSE,FALSE,FALSE,He was consulted by Jonet Stewart to affect a cure with a red hot iron.,FALSE,FALSE,FALSE,FALSE,FALSE,FALSE,FALSE,FALSE,FALSE,FALSE,FALSE,FALSE,FALSE,FALSE,FALSE,FALSE,FALSE,,FALSE,FALSE,,,FALSE,FALSE,FALSE,FALSE,FALSE,,,SMD,2001-05-15T17:00:16,LEM,2002-10-11T10:04:44
C/EGD/1350,1350,EGD,-1,A/EGD/1338,1649,2049-06-01T00:00:00,1649,2049-06-01T00:00:00,,"Hutson,Marion",,,,,,,FALSE,FALSE,FALSE,FALSE,FALSE,FALSE,FALSE,FALSE,FALSE,FALSE,FALSE,FALSE,FALSE,FALSE,FALSE,FALSE,FALSE,TRUE,FALSE,FALSE,FALSE,FALSE,FALSE,FALSE,FALSE,FALSE,FALSE,FALSE,FALSE,FALSE,1,,TRUE,TRUE,FALSE,FALSE,0,,FALSE,,FALSE,,FALSE,FALSE,FALSE,FALSE,FALSE,FALSE,FALSE,,,,FALSE,FALSE,FALSE,FALSE,FALSE,FALSE,FALSE,FALSE,FALSE,FALSE,,FALSE,FALSE,FALSE,FALSE,FALSE,FALSE,FALSE,FALSE,FALSE,FALSE,FALSE,FALSE,FALSE,FALSE,FALSE,FALSE,FALSE,,FALSE,FALSE,,,FALSE,FALSE,FALSE,FALSE,FALSE,,,SMD,2001-05-15T17:00:16,jhm,2002-10-03T15:47:00
C/EGD/1351,1351,EGD,-1,A/EGD/1339,1649,2049-06-01T00:00:00,1649,2049-06-01T00:00:00,,"Hutson,Issobell",,,,,,,FALSE,FALSE,FALSE,FALSE,FALSE,FALSE,FALSE,FALSE,FALSE,FALSE,FALSE,FALSE,FALSE,FALSE,FALSE,FALSE,FALSE,TRUE,FALSE,FALSE,FALSE,FALSE,FALSE,FALSE,FALSE,FALSE,FALSE,FALSE,FALSE,FALSE,1,,TRUE,TRUE,FALSE,FALSE,0,,FALSE,,FALSE,,FALSE,FALSE,FALSE,FALSE,FALSE,FALSE,FALSE,,,,FALSE,FALSE,FALSE,FALSE,FALSE,FALSE,FALSE,FALSE,FALSE,FALSE,,FALSE,FALSE,FALSE,FALSE,FALSE,FALSE,FALSE,FALSE,FALSE,FALSE,FALSE,FALSE,FALSE,FALSE,FALSE,FALSE,FALSE,,FALSE,FALSE,,,FALSE,FALSE,FALSE,FALSE,FALSE,,,SMD,2001-05-15T17:00:16,jhm,2002-10-03T15:47:35
C/EGD/1352,1352,EGD,-1,A/EGD/1340,1649,2049-06-01T00:00:00,1649,2049-06-01T00:00:00,,"Hutson,George",,,,,,,FALSE,FALSE,FALSE,FALSE,FALSE,FALSE,FALSE,FALSE,FALSE,FALSE,FALSE,FALSE,FALSE,FALSE,FALSE,FALSE,FALSE,TRUE,FALSE,FALSE,FALSE,FALSE,FALSE,FALSE,FALSE,FALSE,FALSE,FALSE,FALSE,FALSE,1,,TRUE,TRUE,FALSE,FALSE,0,,FALSE,,FALSE,,FALSE,FALSE,FALSE,FALSE,FALSE,FALSE,FALSE,,,,FALSE,FALSE,FALSE,FALSE,FALSE,FALSE,FALSE,FALSE,FALSE,FALSE,,FALSE,FALSE,FALSE,FALSE,FALSE,FALSE,FALSE,FALSE,FALSE,FALSE,FALSE,FALSE,FALSE,FALSE,FALSE,FALSE,FALSE,,FALSE,FALSE,,,FALSE,FALSE,FALSE,FALSE,FALSE,,,SMD,2001-05-15T17:00:16,jhm,2002-10-03T15:48:06
C/EGD/1353,1353,EGD,-1,A/EGD/1341,1649,2049-06-01T00:00:00,1649,2049-06-01T00:00:00,,"Wilson,Isobel",,,,,,,FALSE,FALSE,FALSE,FALSE,FALSE,FALSE,FALSE,FALSE,FALSE,FALSE,FALSE,FALSE,FALSE,FALSE,FALSE,FALSE,FALSE,FALSE,FALSE,FALSE,FALSE,FALSE,FALSE,FALSE,FALSE,FALSE,FALSE,FALSE,FALSE,FALSE,0,,TRUE,TRUE,FALSE,FALSE,0,,FALSE,,FALSE,,FALSE,FALSE,FALSE,FALSE,FALSE,FALSE,FALSE,,,,FALSE,FALSE,FALSE,FALSE,FALSE,FALSE,FALSE,FALSE,FALSE,FALSE,,FALSE,FALSE,FALSE,FALSE,FALSE,FALSE,FALSE,FALSE,FALSE,FALSE,FALSE,FALSE,FALSE,FALSE,FALSE,FALSE,FALSE,,FALSE,FALSE,,,FALSE,FALSE,FALSE,FALSE,FALSE,,,SMD,2001-05-15T17:00:16,jhm,2002-10-03T15:48:48
C/EGD/1354,1354,EGD,-1,A/EGD/1342,1649,2049-06-01T00:00:00,29/5/1661,1961-05-29T00:00:00,,"Baillie,Elspeth",,,,,,,FALSE,FALSE,FALSE,FALSE,FALSE,FALSE,FALSE,FALSE,FALSE,FALSE,FALSE,FALSE,FALSE,FALSE,FALSE,FALSE,FALSE,TRUE,FALSE,FALSE,FALSE,FALSE,FALSE,FALSE,FALSE,FALSE,FALSE,FALSE,FALSE,FALSE,1,,TRUE,TRUE,FALSE,FALSE,0,,FALSE,,FALSE,,FALSE,FALSE,FALSE,FALSE,FALSE,FALSE,FALSE,,,"Meetings at the black burn of Bolton, the moor at Baigbiemure and Pilmure described by another accused witch",FALSE,FALSE,FALSE,FALSE,FALSE,FALSE,FALSE,FALSE,FALSE,FALSE,,FALSE,FALSE,FALSE,FALSE,FALSE,FALSE,FALSE,FALSE,FALSE,FALSE,FALSE,FALSE,FALSE,FALSE,FALSE,FALSE,FALSE,,FALSE,FALSE,,,FALSE,FALSE,FALSE,FALSE,FALSE,,,SMD,2001-05-15T17:00:16,LEM,2002-10-10T10:06:01
C/EGD/1355,1355,EGD,-1,A/EGD/1343,1649,2049-06-01T00:00:00,30/5/1661,1961-05-30T00:00:00,,"Deanes,Helene",,,,,,,FALSE,FALSE,FALSE,FALSE,FALSE,FALSE,FALSE,FALSE,FALSE,FALSE,FALSE,FALSE,FALSE,FALSE,FALSE,FALSE,FALSE,TRUE,FALSE,FALSE,FALSE,FALSE,FALSE,FALSE,FALSE,FALSE,FALSE,FALSE,FALSE,FALSE,1,,TRUE,TRUE,FALSE,FALSE,0,Petition to parliament from Earl of Haddington. He claimed that witchcraft was increasing in his lands and had imprisoned some of the suspects. He also claimed that two of them were accused of robbery as well.,FALSE,,FALSE,,FALSE,FALSE,FALSE,FALSE,FALSE,FALSE,FALSE,,,meeting described by another accused witch,FALSE,FALSE,FALSE,FALSE,FALSE,FALSE,FALSE,FALSE,FALSE,FALSE,,FALSE,FALSE,FALSE,FALSE,FALSE,FALSE,FALSE,FALSE,FALSE,FALSE,FALSE,FALSE,FALSE,FALSE,FALSE,FALSE,FALSE,,FALSE,FALSE,,,FALSE,FALSE,FALSE,FALSE,FALSE,,,SMD,2001-05-15T17:00:16,LEM,2002-10-10T10:12:08
C/EGD/1356,1356,EGD,-1,A/EGD/1344,1649,2049-06-01T00:00:00,9/5/1661,1961-05-09T00:00:00,,"Cairnes,Issobell",,,,,,,FALSE,FALSE,FALSE,FALSE,FALSE,FALSE,FALSE,FALSE,FALSE,FALSE,FALSE,FALSE,FALSE,FALSE,FALSE,FALSE,FALSE,TRUE,FALSE,FALSE,FALSE,FALSE,FALSE,FALSE,FALSE,FALSE,FALSE,FALSE,FALSE,FALSE,1,,TRUE,TRUE,FALSE,FALSE,0,,FALSE,,FALSE,,FALSE,FALSE,FALSE,FALSE,FALSE,FALSE,FALSE,,,,FALSE,FALSE,FALSE,FALSE,FALSE,FALSE,FALSE,FALSE,FALSE,FALSE,,FALSE,FALSE,FALSE,FALSE,FALSE,FALSE,FALSE,FALSE,FALSE,FALSE,FALSE,FALSE,FALSE,FALSE,FALSE,FALSE,FALSE,,FALSE,FALSE,,,FALSE,FALSE,FALSE,FALSE,FALSE,,,SMD,2001-05-15T17:00:16,jhm,2002-10-03T15:54:18
C/EGD/1357,1357,EGD,-1,A/EGD/1345,1649,2049-06-01T00:00:00,1649,2049-06-01T00:00:00,,"Sharpe,Helen",,,,,,,FALSE,FALSE,FALSE,FALSE,FALSE,FALSE,FALSE,FALSE,FALSE,FALSE,FALSE,FALSE,FALSE,FALSE,FALSE,FALSE,FALSE,TRUE,FALSE,FALSE,FALSE,FALSE,FALSE,FALSE,FALSE,FALSE,FALSE,FALSE,FALSE,FALSE,1,,TRUE,TRUE,FALSE,FALSE,0,,FALSE,,FALSE,,FALSE,FALSE,FALSE,FALSE,FALSE,FALSE,FALSE,,,,FALSE,FALSE,FALSE,FALSE,FALSE,FALSE,FALSE,FALSE,FALSE,FALSE,,FALSE,FALSE,FALSE,FALSE,FALSE,FALSE,FALSE,FALSE,FALSE,FALSE,FALSE,FALSE,FALSE,FALSE,FALSE,FALSE,FALSE,,FALSE,FALSE,,,FALSE,FALSE,FALSE,FALSE,FALSE,,,SMD,2001-05-15T17:00:16,jhm,2002-10-03T15:56:09
C/EGD/1358,1358,EGD,-1,A/EGD/1346,1649,2049-06-01T00:00:00,1649,2049-06-01T00:00:00,,"Harlaw,Adam",,,,,,,FALSE,FALSE,FALSE,FALSE,FALSE,FALSE,FALSE,FALSE,FALSE,FALSE,FALSE,FALSE,FALSE,FALSE,FALSE,FALSE,FALSE,TRUE,FALSE,FALSE,FALSE,FALSE,FALSE,FALSE,FALSE,FALSE,FALSE,FALSE,FALSE,FALSE,1,,TRUE,TRUE,FALSE,FALSE,0,,FALSE,,FALSE,,FALSE,FALSE,FALSE,FALSE,FALSE,FALSE,FALSE,,,,FALSE,FALSE,FALSE,FALSE,FALSE,FALSE,FALSE,FALSE,FALSE,FALSE,,FALSE,FALSE,FALSE,FALSE,FALSE,FALSE,FALSE,FALSE,FALSE,FALSE,FALSE,FALSE,FALSE,FALSE,FALSE,FALSE,FALSE,,FALSE,FALSE,,,FALSE,FALSE,FALSE,FALSE,FALSE,,,SMD,2001-05-15T17:00:16,jhm,2002-10-03T15:56:50
C/EGD/1359,1359,EGD,-1,A/EGD/1347,1649,2049-06-01T00:00:00,1649,2049-06-01T00:00:00,,"Wast,Jonet",,,,,,,FALSE,FALSE,FALSE,FALSE,FALSE,FALSE,FALSE,FALSE,FALSE,FALSE,FALSE,FALSE,FALSE,FALSE,FALSE,FALSE,FALSE,TRUE,FALSE,FALSE,FALSE,FALSE,FALSE,FALSE,FALSE,FALSE,FALSE,FALSE,FALSE,FALSE,1,,TRUE,TRUE,FALSE,FALSE,0,,FALSE,,FALSE,,FALSE,FALSE,FALSE,FALSE,FALSE,FALSE,FALSE,,,,FALSE,FALSE,FALSE,FALSE,FALSE,FALSE,FALSE,FALSE,FALSE,FALSE,,FALSE,FALSE,FALSE,FALSE,FALSE,FALSE,FALSE,FALSE,FALSE,FALSE,FALSE,FALSE,FALSE,FALSE,FALSE,FALSE,FALSE,,FALSE,FALSE,,,FALSE,FALSE,FALSE,FALSE,FALSE,,,SMD,2001-05-15T17:00:16,jhm,2002-10-03T15:57:36
C/EGD/136,136,EGD,-1,A/EGD/125,19/5/1597,1997-05-19T00:00:00,15/8/1598,1998-08-15T00:00:00,,"Aiken,Bessie",,,,,,,FALSE,TRUE,FALSE,FALSE,FALSE,FALSE,FALSE,FALSE,FALSE,FALSE,TRUE,TRUE,FALSE,FALSE,FALSE,FALSE,FALSE,TRUE,FALSE,FALSE,FALSE,FALSE,FALSE,FALSE,FALSE,FALSE,FALSE,FALSE,FALSE,FALSE,4,,FALSE,FALSE,FALSE,FALSE,0,"She was part of a group of four women who appear to have been recognised folk healers who met, taught each other, cured for each other and generally worked together as professionals (the group includes c/egd/136, c/egd/133, c/egd/132, c/egd/131).  There is no mention of the Devil.",FALSE,,TRUE,,FALSE,FALSE,FALSE,FALSE,FALSE,FALSE,FALSE,,,,FALSE,FALSE,TRUE,TRUE,FALSE,FALSE,FALSE,TRUE,TRUE,FALSE,Greed wood (fairies?).  Use of circles.  Use of red nettles to cure a pain in the loins.  Use of fresh butter as a salve.  Used salt water for cures.  Washed people.  She roasted four or five kittens and used the drippings to rub a sick person.,FALSE,FALSE,FALSE,FALSE,FALSE,FALSE,FALSE,FALSE,FALSE,FALSE,FALSE,FALSE,FALSE,TRUE,TRUE,FALSE,FALSE,Learned some of her art from Jonet Stewart.,FALSE,FALSE,,,FALSE,FALSE,FALSE,FALSE,FALSE,,,SMD,2001-05-15T17:00:16,jhm,2002-10-03T16:01:34
C/EGD/1360,1360,EGD,-1,A/EGD/1348,26/2/1650,1950-02-26T00:00:00,26/2/1650,1950-02-26T00:00:00,,"Craufurd,Jeane",,,,,,,FALSE,FALSE,FALSE,FALSE,FALSE,FALSE,FALSE,FALSE,FALSE,FALSE,FALSE,FALSE,FALSE,FALSE,FALSE,FALSE,FALSE,TRUE,FALSE,FALSE,FALSE,FALSE,FALSE,FALSE,FALSE,FALSE,FALSE,FALSE,FALSE,FALSE,1,,TRUE,TRUE,FALSE,FALSE,0,,FALSE,,FALSE,,FALSE,FALSE,FALSE,FALSE,FALSE,FALSE,FALSE,,,,FALSE,FALSE,FALSE,FALSE,FALSE,FALSE,FALSE,FALSE,FALSE,FALSE,,FALSE,FALSE,FALSE,FALSE,FALSE,FALSE,FALSE,FALSE,FALSE,FALSE,FALSE,FALSE,FALSE,FALSE,FALSE,FALSE,FALSE,,FALSE,FALSE,,,FALSE,FALSE,FALSE,FALSE,FALSE,,,SMD,2001-05-15T17:00:16,jhm,2002-10-03T16:01:49
C/EGD/1361,1361,EGD,-1,A/EGD/1349,26/2/1650,1950-02-26T00:00:00,26/2/1650,1950-02-26T00:00:00,,"Bargans,Unknown",,,,,,,FALSE,FALSE,FALSE,FALSE,FALSE,FALSE,FALSE,FALSE,FALSE,FALSE,FALSE,FALSE,FALSE,FALSE,FALSE,FALSE,FALSE,TRUE,FALSE,FALSE,FALSE,FALSE,FALSE,FALSE,FALSE,FALSE,FALSE,FALSE,FALSE,FALSE,1,,TRUE,TRUE,FALSE,FALSE,0,,FALSE,,FALSE,,FALSE,FALSE,FALSE,FALSE,FALSE,FALSE,FALSE,,,,FALSE,FALSE,FALSE,FALSE,FALSE,FALSE,FALSE,FALSE,FALSE,FALSE,,FALSE,FALSE,FALSE,FALSE,FALSE,FALSE,FALSE,FALSE,FALSE,FALSE,FALSE,FALSE,FALSE,FALSE,FALSE,FALSE,FALSE,,FALSE,FALSE,,,FALSE,FALSE,FALSE,FALSE,FALSE,,,SMD,2001-05-15T17:00:16,LEM,2002-12-05T12:22:16
C/EGD/1362,1362,EGD,-1,A/EGD/1350,26/3/1650,1950-03-26T00:00:00,26/2/1650,1950-02-26T00:00:00,,"Mountgomerie,Jeanat",,,,,,,FALSE,FALSE,FALSE,FALSE,FALSE,FALSE,FALSE,FALSE,FALSE,FALSE,FALSE,FALSE,FALSE,FALSE,FALSE,FALSE,FALSE,TRUE,FALSE,FALSE,FALSE,FALSE,FALSE,FALSE,FALSE,FALSE,FALSE,FALSE,FALSE,FALSE,1,,TRUE,TRUE,FALSE,FALSE,0,,FALSE,,FALSE,,FALSE,FALSE,FALSE,FALSE,FALSE,FALSE,FALSE,,,,FALSE,FALSE,FALSE,FALSE,FALSE,FALSE,FALSE,FALSE,FALSE,FALSE,,FALSE,FALSE,FALSE,FALSE,FALSE,FALSE,FALSE,FALSE,FALSE,FALSE,FALSE,FALSE,FALSE,FALSE,FALSE,FALSE,FALSE,,FALSE,FALSE,,,FALSE,FALSE,FALSE,FALSE,FALSE,,,SMD,2001-05-15T17:00:16,LEM,2002-10-10T12:16:44
C/EGD/1363,1363,EGD,-1,A/EGD/1351,26/2/1650,1950-02-26T00:00:00,26/2/1650,1950-02-26T00:00:00,,"Lich (or Leich),Thomas",,,,,,,FALSE,FALSE,FALSE,FALSE,FALSE,FALSE,FALSE,FALSE,FALSE,FALSE,FALSE,FALSE,FALSE,FALSE,FALSE,FALSE,FALSE,TRUE,FALSE,FALSE,FALSE,FALSE,FALSE,FALSE,FALSE,FALSE,FALSE,FALSE,FALSE,FALSE,1,,TRUE,TRUE,FALSE,FALSE,0,,FALSE,,FALSE,,FALSE,FALSE,FALSE,FALSE,FALSE,FALSE,FALSE,,,accused of being at a witches' meeting by another accused witch.,FALSE,FALSE,FALSE,FALSE,FALSE,FALSE,FALSE,FALSE,FALSE,FALSE,,FALSE,FALSE,FALSE,FALSE,FALSE,FALSE,FALSE,FALSE,FALSE,FALSE,FALSE,FALSE,FALSE,FALSE,FALSE,FALSE,FALSE,,FALSE,FALSE,,,FALSE,FALSE,FALSE,FALSE,FALSE,,,SMD,2001-05-15T17:00:16,LEM,2002-10-10T12:16:26
C/EGD/1364,1364,EGD,-1,A/EGD/1352,26/2/1650,1950-02-26T00:00:00,29/6/1650,1950-06-29T00:00:00,35,"Finlasoun,Margaret",,,,,,,FALSE,FALSE,FALSE,FALSE,FALSE,FALSE,FALSE,FALSE,FALSE,TRUE,FALSE,FALSE,FALSE,TRUE,FALSE,FALSE,FALSE,TRUE,TRUE,TRUE,FALSE,FALSE,FALSE,FALSE,FALSE,FALSE,FALSE,FALSE,FALSE,FALSE,5,,FALSE,FALSE,FALSE,FALSE,0,"This one was all about neighbourhood disputes about land, buying, selling, child minding.  She was implicated by two other witches",FALSE,,TRUE,,TRUE,FALSE,FALSE,FALSE,FALSE,FALSE,FALSE,,,,FALSE,FALSE,FALSE,TRUE,FALSE,TRUE,FALSE,FALSE,TRUE,FALSE,Green threads.  Someone found a pouch of thread and lead in their yard and assumed she had put it there to bewitch them.  Mention of appeasement with ale.,TRUE,TRUE,TRUE,TRUE,FALSE,FALSE,FALSE,TRUE,FALSE,FALSE,TRUE,TRUE,FALSE,FALSE,FALSE,FALSE,FALSE,She supposedly took away a mother's milk to fulfill a curse.  She seemed to take her anger out on her near neighbours and servants who dissatisfied her.,TRUE,FALSE,,,FALSE,FALSE,FALSE,FALSE,FALSE,,,SMD,2001-05-15T17:00:16,jhm,2002-10-03T16:07:14
C/EGD/1365,1365,EGD,-1,A/EGD/1353,1660,1960-06-01T00:00:00,1660,1960-06-01T00:00:00,,"Keltie,Margaret",,,,,,,FALSE,FALSE,FALSE,FALSE,FALSE,FALSE,FALSE,FALSE,FALSE,FALSE,FALSE,FALSE,FALSE,FALSE,FALSE,FALSE,FALSE,FALSE,FALSE,FALSE,FALSE,FALSE,FALSE,FALSE,FALSE,FALSE,FALSE,FALSE,FALSE,FALSE,0,,TRUE,TRUE,FALSE,FALSE,0,,FALSE,,FALSE,,FALSE,FALSE,FALSE,FALSE,FALSE,FALSE,FALSE,,,,FALSE,FALSE,FALSE,FALSE,FALSE,FALSE,FALSE,FALSE,FALSE,FALSE,,FALSE,FALSE,FALSE,FALSE,FALSE,FALSE,FALSE,FALSE,FALSE,FALSE,FALSE,FALSE,FALSE,FALSE,FALSE,FALSE,FALSE,,FALSE,FALSE,,,FALSE,FALSE,FALSE,FALSE,FALSE,,The project did not check Larner's reference to this printed secondary source as part of the research.,SMD,2001-05-15T17:00:16,jhm,2002-10-03T16:07:51
C/EGD/1366,1366,EGD,0,,,,1661,1961-04-24T00:00:00,,(three or four witches),,,,,,3,FALSE,FALSE,FALSE,FALSE,FALSE,FALSE,FALSE,FALSE,FALSE,FALSE,FALSE,FALSE,FALSE,FALSE,FALSE,FALSE,FALSE,FALSE,FALSE,FALSE,FALSE,FALSE,FALSE,FALSE,FALSE,FALSE,FALSE,FALSE,FALSE,FALSE,0,,TRUE,TRUE,FALSE,FALSE,0,,FALSE,,FALSE,,FALSE,FALSE,FALSE,FALSE,FALSE,FALSE,FALSE,,,,FALSE,FALSE,FALSE,FALSE,FALSE,FALSE,FALSE,FALSE,FALSE,FALSE,,FALSE,FALSE,FALSE,FALSE,FALSE,FALSE,FALSE,FALSE,FALSE,FALSE,FALSE,FALSE,FALSE,FALSE,FALSE,FALSE,FALSE,,FALSE,FALSE,,,FALSE,FALSE,FALSE,FALSE,FALSE,,(three or four witches),SMD,2001-05-15T17:00:16,jhm,2002-10-03T16:08:34
C/EGD/1367,1367,EGD,-1,A/EGD/1354,28/5/1661,1961-05-28T00:00:00,31/5/1661,1961-05-31T00:00:00,,"Todrig,Bessie",,,,,,,FALSE,FALSE,FALSE,FALSE,TRUE,TRUE,FALSE,FALSE,FALSE,FALSE,FALSE,FALSE,FALSE,FALSE,FALSE,FALSE,FALSE,TRUE,FALSE,FALSE,FALSE,FALSE,FALSE,FALSE,FALSE,FALSE,FALSE,FALSE,FALSE,FALSE,3,,FALSE,FALSE,FALSE,FALSE,0,,FALSE,,TRUE,,TRUE,FALSE,FALSE,FALSE,FALSE,FALSE,FALSE,,,,FALSE,FALSE,FALSE,FALSE,FALSE,FALSE,FALSE,FALSE,FALSE,FALSE,Devil came to her own house at Martinmas.,FALSE,FALSE,FALSE,FALSE,FALSE,FALSE,FALSE,FALSE,FALSE,FALSE,FALSE,FALSE,FALSE,FALSE,FALSE,FALSE,FALSE,,FALSE,FALSE,,,FALSE,FALSE,FALSE,FALSE,FALSE,,,SMD,2001-05-15T17:00:16,jhm,2002-10-03T16:15:35
C/EGD/1368,1368,EGD,-1,A/EGD/1355,29/5/1661,1961-05-29T00:00:00,31/5/1661,1961-05-31T00:00:00,,"Dawsoun,Bessie",,,,,,,FALSE,FALSE,FALSE,FALSE,TRUE,TRUE,FALSE,FALSE,FALSE,FALSE,FALSE,FALSE,FALSE,FALSE,FALSE,FALSE,FALSE,TRUE,FALSE,FALSE,FALSE,FALSE,FALSE,FALSE,FALSE,FALSE,FALSE,FALSE,FALSE,FALSE,3,,FALSE,FALSE,FALSE,FALSE,0,Named by Bessie Todrig,FALSE,,TRUE,,TRUE,FALSE,FALSE,FALSE,FALSE,FALSE,FALSE,,,,FALSE,FALSE,FALSE,FALSE,FALSE,FALSE,FALSE,FALSE,FALSE,FALSE,,FALSE,FALSE,FALSE,FALSE,FALSE,FALSE,FALSE,FALSE,FALSE,FALSE,FALSE,FALSE,FALSE,FALSE,FALSE,FALSE,FALSE,,FALSE,FALSE,,,FALSE,FALSE,FALSE,FALSE,FALSE,,,SMD,2001-05-15T17:00:16,jhm,2002-10-03T16:17:35
C/EGD/137,137,EGD,-1,A/EGD/126,21/7/1603,2003-07-21T00:00:00,21/7/1603,2003-07-21T00:00:00,38,"Reid,James",,,,,,,FALSE,TRUE,FALSE,FALSE,FALSE,TRUE,FALSE,FALSE,FALSE,FALSE,TRUE,TRUE,FALSE,TRUE,FALSE,FALSE,FALSE,FALSE,FALSE,FALSE,FALSE,FALSE,FALSE,FALSE,FALSE,FALSE,FALSE,FALSE,FALSE,FALSE,5,,FALSE,FALSE,FALSE,FALSE,0,"Reid was consulted by the Chrysties to destroy David Libbertoun a burgess baxter in Edinburgh.  I think Reid was hired to remove a bewitchment, he seemed to be taking off lots of illnesses in the Chrystie household, and guideing the attack on D. Libberton for the Chrystie's not himself.",TRUE,"Doesn't specify a demonic pact.  Just said that he learned the craft (of healing) from the devil his master, that he consulted with the Devil and that the Devil gave him 'thrie penneis at ane tyme'.",TRUE,,TRUE,FALSE,FALSE,FALSE,FALSE,FALSE,FALSE,,,,FALSE,FALSE,FALSE,TRUE,FALSE,FALSE,FALSE,TRUE,TRUE,FALSE,"He used south running water.  Used raw flesh with nine notches on it to bewitch someone, by putting it under their door (this could have been an unwitching ceremony?).",TRUE,FALSE,TRUE,FALSE,FALSE,FALSE,FALSE,FALSE,FALSE,FALSE,FALSE,FALSE,FALSE,TRUE,TRUE,FALSE,FALSE,,TRUE,FALSE,,,FALSE,FALSE,FALSE,FALSE,FALSE,,,SMD,2001-05-15T17:00:16,jhm,2002-11-13T15:57:38
C/EGD/1370,1370,EGD,-1,A/EGD/1357,29/5/1661,1961-05-29T00:00:00,2/6/1661,1961-06-02T00:00:00,,"Bowar,Margaret",,,,,,,FALSE,FALSE,FALSE,FALSE,FALSE,FALSE,FALSE,FALSE,FALSE,FALSE,FALSE,FALSE,FALSE,FALSE,FALSE,FALSE,FALSE,TRUE,FALSE,FALSE,FALSE,FALSE,FALSE,FALSE,FALSE,FALSE,FALSE,FALSE,FALSE,FALSE,1,,TRUE,TRUE,FALSE,FALSE,0,,FALSE,,FALSE,,FALSE,FALSE,FALSE,FALSE,FALSE,FALSE,FALSE,,,Meeting on moor described by other accused witches.,FALSE,FALSE,FALSE,FALSE,FALSE,FALSE,FALSE,FALSE,FALSE,FALSE,,FALSE,FALSE,FALSE,FALSE,FALSE,FALSE,FALSE,FALSE,FALSE,FALSE,FALSE,FALSE,FALSE,FALSE,FALSE,FALSE,FALSE,,FALSE,FALSE,,,FALSE,FALSE,FALSE,FALSE,FALSE,,,SMD,2001-05-15T17:00:16,jhm,2002-10-10T09:12:39
C/EGD/1371,1371,EGD,-1,A/EGD/1358,30/5/1661,1961-05-30T00:00:00,30/5/1661,1961-05-30T00:00:00,,"Maislet,Margaret",,,,,,,FALSE,FALSE,FALSE,FALSE,FALSE,FALSE,FALSE,FALSE,FALSE,FALSE,FALSE,FALSE,FALSE,FALSE,FALSE,FALSE,FALSE,TRUE,FALSE,FALSE,FALSE,FALSE,FALSE,FALSE,FALSE,FALSE,FALSE,FALSE,FALSE,FALSE,1,,TRUE,TRUE,FALSE,FALSE,0,,FALSE,,FALSE,,FALSE,FALSE,FALSE,FALSE,FALSE,TRUE,FALSE,,,Three meetings at the black burn of Bolton and the moor at Baigbienure and Pilmure described by another accused witch,FALSE,FALSE,FALSE,FALSE,FALSE,FALSE,FALSE,FALSE,FALSE,FALSE,,FALSE,FALSE,FALSE,FALSE,FALSE,FALSE,FALSE,FALSE,FALSE,FALSE,FALSE,FALSE,FALSE,FALSE,FALSE,FALSE,FALSE,,FALSE,FALSE,,,FALSE,FALSE,FALSE,FALSE,FALSE,,,SMD,2001-05-15T17:00:16,LEM,2002-10-10T10:13:36
C/EGD/1372,1372,EGD,-1,A/EGD/1359,29/5/1661,1961-05-29T00:00:00,31/5/1661,1961-05-31T00:00:00,,"Baigbie,Jonet",,,,,,,FALSE,FALSE,FALSE,FALSE,TRUE,TRUE,FALSE,FALSE,FALSE,FALSE,FALSE,FALSE,FALSE,FALSE,FALSE,FALSE,FALSE,TRUE,FALSE,FALSE,FALSE,FALSE,FALSE,FALSE,FALSE,FALSE,FALSE,FALSE,FALSE,FALSE,3,,FALSE,FALSE,FALSE,FALSE,0,Named by Bessie Todrig.,FALSE,,TRUE,,TRUE,FALSE,FALSE,FALSE,FALSE,TRUE,FALSE,,,,FALSE,FALSE,FALSE,FALSE,FALSE,FALSE,FALSE,FALSE,FALSE,FALSE,,FALSE,FALSE,FALSE,FALSE,FALSE,FALSE,FALSE,FALSE,FALSE,FALSE,FALSE,FALSE,FALSE,FALSE,FALSE,FALSE,FALSE,,FALSE,FALSE,,,FALSE,FALSE,FALSE,FALSE,FALSE,,,SMD,2001-05-15T17:00:16,LEM,2002-06-11T22:00:27
C/EGD/1373,1373,EGD,-1,A/EGD/1360,31/5/1661,1961-05-31T00:00:00,7/6/1661,1961-06-07T00:00:00,,"Smith,Issobell",,,,,,,FALSE,FALSE,FALSE,FALSE,TRUE,TRUE,FALSE,FALSE,FALSE,TRUE,FALSE,FALSE,FALSE,FALSE,FALSE,FALSE,FALSE,TRUE,FALSE,FALSE,FALSE,FALSE,FALSE,FALSE,FALSE,FALSE,FALSE,FALSE,FALSE,FALSE,4,,FALSE,FALSE,FALSE,FALSE,0,Mostly demonic but mentioned man in green as well so fairies also ticked as secondary.,FALSE,"Asked about copulation, did not give any details but confirmed that she did the same as the others. Added detail about sex and name at later date when she confirmed her confession.",TRUE,,TRUE,FALSE,FALSE,FALSE,FALSE,FALSE,FALSE,,,,FALSE,FALSE,FALSE,FALSE,FALSE,FALSE,FALSE,FALSE,FALSE,FALSE,Mentioned a man in green clothes in her confession.,FALSE,FALSE,FALSE,FALSE,FALSE,FALSE,FALSE,FALSE,FALSE,FALSE,FALSE,FALSE,FALSE,FALSE,FALSE,FALSE,FALSE,,FALSE,FALSE,,,FALSE,FALSE,FALSE,FALSE,FALSE,,,SMD,2001-05-15T17:00:16,jhm,2002-09-30T16:51:19
C/EGD/1374,1374,EGD,-1,A/EGD/1361,2/6/1661,1961-06-02T00:00:00,14/11/1661,1961-11-14T00:00:00,,"Kemp,Anna",,,,,,,FALSE,FALSE,FALSE,FALSE,TRUE,TRUE,FALSE,FALSE,FALSE,FALSE,FALSE,FALSE,FALSE,FALSE,FALSE,FALSE,FALSE,TRUE,FALSE,FALSE,FALSE,FALSE,FALSE,FALSE,FALSE,FALSE,FALSE,FALSE,FALSE,FALSE,3,,FALSE,FALSE,FALSE,FALSE,0,,FALSE,,TRUE,,TRUE,FALSE,FALSE,FALSE,FALSE,FALSE,FALSE,,,,FALSE,FALSE,FALSE,FALSE,FALSE,FALSE,FALSE,FALSE,FALSE,FALSE,,FALSE,FALSE,FALSE,FALSE,FALSE,FALSE,FALSE,FALSE,FALSE,FALSE,FALSE,FALSE,FALSE,FALSE,FALSE,FALSE,FALSE,,FALSE,FALSE,,,FALSE,FALSE,FALSE,FALSE,FALSE,,,SMD,2001-05-15T17:00:16,jhm,2002-09-30T16:43:17
C/EGD/1375,1375,EGD,-1,A/EGD/1362,30/5/1661,1961-05-30T00:00:00,14/11/1661,1961-11-14T00:00:00,,"Ker,Margaret",,,,,,,FALSE,FALSE,FALSE,FALSE,TRUE,TRUE,FALSE,FALSE,FALSE,FALSE,FALSE,FALSE,FALSE,FALSE,FALSE,FALSE,FALSE,TRUE,FALSE,FALSE,FALSE,FALSE,FALSE,FALSE,FALSE,FALSE,FALSE,FALSE,FALSE,FALSE,3,,FALSE,FALSE,FALSE,FALSE,0,,FALSE,,TRUE,,TRUE,FALSE,FALSE,FALSE,FALSE,TRUE,FALSE,,,,FALSE,FALSE,FALSE,FALSE,FALSE,FALSE,FALSE,FALSE,FALSE,FALSE,,FALSE,FALSE,FALSE,FALSE,FALSE,FALSE,FALSE,FALSE,FALSE,FALSE,FALSE,FALSE,FALSE,FALSE,FALSE,FALSE,FALSE,,FALSE,FALSE,,,FALSE,FALSE,FALSE,FALSE,FALSE,,,SMD,2001-05-15T17:00:16,jhm,2002-09-30T16:52:04
C/EGD/1376,1376,EGD,-1,A/EGD/1363,6/9/1661,1961-09-06T00:00:00,6/9/1661,1961-09-06T00:00:00,,"Nisbitt,Margret",,,,,,,FALSE,FALSE,FALSE,FALSE,FALSE,TRUE,FALSE,FALSE,FALSE,FALSE,FALSE,FALSE,FALSE,FALSE,FALSE,FALSE,FALSE,FALSE,FALSE,FALSE,FALSE,FALSE,FALSE,FALSE,FALSE,FALSE,FALSE,FALSE,FALSE,FALSE,1,,TRUE,TRUE,FALSE,FALSE,0,Recorded as having confessed to demonic pact and renunication of baptism,FALSE,,FALSE,,FALSE,FALSE,FALSE,FALSE,FALSE,FALSE,FALSE,,,,FALSE,FALSE,FALSE,FALSE,FALSE,FALSE,FALSE,FALSE,FALSE,FALSE,,FALSE,FALSE,FALSE,FALSE,FALSE,FALSE,FALSE,FALSE,FALSE,FALSE,FALSE,FALSE,FALSE,FALSE,FALSE,FALSE,FALSE,,FALSE,FALSE,,,FALSE,FALSE,FALSE,FALSE,FALSE,,,SMD,2001-05-15T17:00:16,jhm,2002-10-07T12:47:13
C/EGD/1377,1377,EGD,-1,A/EGD/1364,7/6/1661,1961-06-07T00:00:00,25/7/1661,1961-07-25T00:00:00,,"Jonstoune,Issobell",,,,,,,FALSE,FALSE,FALSE,FALSE,FALSE,TRUE,FALSE,FALSE,FALSE,FALSE,FALSE,FALSE,FALSE,FALSE,FALSE,FALSE,FALSE,FALSE,FALSE,FALSE,FALSE,FALSE,FALSE,FALSE,FALSE,FALSE,FALSE,FALSE,FALSE,FALSE,1,,TRUE,TRUE,FALSE,FALSE,0,,FALSE,,FALSE,,FALSE,FALSE,FALSE,FALSE,FALSE,FALSE,FALSE,,,,FALSE,FALSE,FALSE,FALSE,FALSE,FALSE,FALSE,FALSE,FALSE,FALSE,,FALSE,FALSE,FALSE,FALSE,FALSE,FALSE,FALSE,FALSE,FALSE,FALSE,FALSE,FALSE,FALSE,FALSE,FALSE,FALSE,FALSE,,FALSE,FALSE,,,FALSE,FALSE,FALSE,FALSE,FALSE,,,SMD,2001-05-15T17:00:16,jhm,2002-10-03T16:36:27
C/EGD/1378,1378,EGD,0,,1/8/1661,1961-08-01T00:00:00,1/8/1661,1961-08-01T00:00:00,,3 unnamed witches,Privy Council,,,,,3,FALSE,FALSE,FALSE,FALSE,FALSE,FALSE,FALSE,FALSE,FALSE,FALSE,FALSE,FALSE,FALSE,FALSE,FALSE,FALSE,FALSE,FALSE,FALSE,FALSE,FALSE,FALSE,FALSE,FALSE,FALSE,FALSE,FALSE,FALSE,FALSE,FALSE,0,,TRUE,TRUE,FALSE,FALSE,0,,FALSE,,FALSE,,FALSE,FALSE,FALSE,FALSE,FALSE,FALSE,FALSE,,,,FALSE,FALSE,FALSE,FALSE,FALSE,FALSE,FALSE,FALSE,FALSE,FALSE,,FALSE,FALSE,FALSE,FALSE,FALSE,FALSE,FALSE,FALSE,FALSE,FALSE,FALSE,FALSE,FALSE,FALSE,FALSE,FALSE,FALSE,,FALSE,FALSE,,,FALSE,FALSE,FALSE,FALSE,FALSE,,"'a great many persons' from Duddingston and Liberton but no number specified, taken to indicate no less than 3.  The PC granted a commission of Justiciary to try them. And the PC recorded that the un-named accused were imprisoned and had confessed to witchcraft.",SMD,2001-05-15T17:00:16,LEM,2003-03-13T11:43:00
C/EGD/1379,1379,EGD,-1,A/EGD/1365,22/7/1658,1958-07-22T00:00:00,1/1/1662,1962-01-01T00:00:00,,"Crockett,Isobell (Elspeth)",,,,,,,FALSE,FALSE,FALSE,FALSE,FALSE,TRUE,FALSE,FALSE,FALSE,FALSE,FALSE,FALSE,FALSE,TRUE,FALSE,FALSE,FALSE,TRUE,FALSE,FALSE,FALSE,FALSE,FALSE,FALSE,FALSE,FALSE,FALSE,FALSE,FALSE,FALSE,3,,TRUE,TRUE,FALSE,FALSE,0,,FALSE,,FALSE,,FALSE,FALSE,FALSE,FALSE,FALSE,FALSE,FALSE,,,Other accused claimed she was present at meetings. No statement from Crockett.,FALSE,FALSE,FALSE,FALSE,FALSE,FALSE,FALSE,FALSE,FALSE,FALSE,,FALSE,FALSE,FALSE,FALSE,FALSE,FALSE,FALSE,FALSE,FALSE,FALSE,FALSE,FALSE,FALSE,FALSE,FALSE,FALSE,FALSE,,FALSE,FALSE,,,FALSE,FALSE,FALSE,FALSE,FALSE,,"She was tried twice (with two others).  In her first trial on 23/3/1659 in the circuit court she was found guilty and ordered to be transported.  Until that could be arranged she was to be held in Stirling prison.  Apparently after two years of imprisonment they petitioned privy council, who ordered another trial due to irregularities.  The second trial was a local one, we don't know the outcome.",SMD,2001-05-15T17:00:16,jhm,2002-10-03T16:39:26
C/EGD/138,138,EGD,-1,A/EGD/127,23/7/1605,2005-07-23T00:00:00,23/7/1605,2005-07-23T00:00:00,,"Duncane,Margaret",,,,,,,FALSE,FALSE,FALSE,FALSE,FALSE,FALSE,FALSE,FALSE,FALSE,FALSE,FALSE,FALSE,FALSE,FALSE,FALSE,FALSE,FALSE,TRUE,FALSE,FALSE,FALSE,FALSE,FALSE,FALSE,FALSE,FALSE,FALSE,FALSE,FALSE,FALSE,1,,TRUE,TRUE,FALSE,FALSE,0,,FALSE,"According to P. Lowrie, she was presented with a hairbelt in the shape of a devil's claw by Helena McBurnie, the 'devilish spirit woman'.",FALSE,,FALSE,FALSE,FALSE,FALSE,FALSE,FALSE,FALSE,,,"Devil's meetings at the top of Lowdon Hill, the kirkyard and kirk and the shore described by P. Lowrie.",FALSE,FALSE,FALSE,FALSE,FALSE,FALSE,FALSE,FALSE,TRUE,FALSE,She was presented with a hairbelt (in the shape of a Devil's claw) from the spirit woman Helena McBurnie according to P. Lowrie.,FALSE,FALSE,FALSE,FALSE,FALSE,FALSE,FALSE,FALSE,FALSE,FALSE,FALSE,FALSE,FALSE,FALSE,FALSE,FALSE,FALSE,,FALSE,FALSE,,,FALSE,FALSE,FALSE,FALSE,FALSE,,,SMD,2001-05-15T17:00:16,LEM,2002-10-11T09:59:57
C/EGD/1380,1380,EGD,-1,A/EGD/1366,6/9/1661,1961-09-06T00:00:00,6/9/1661,1961-09-06T00:00:00,,"Getgood,Jean",,,,,,,FALSE,FALSE,FALSE,FALSE,FALSE,TRUE,FALSE,FALSE,FALSE,FALSE,FALSE,FALSE,FALSE,FALSE,FALSE,FALSE,FALSE,FALSE,FALSE,FALSE,FALSE,FALSE,FALSE,FALSE,FALSE,FALSE,FALSE,FALSE,FALSE,FALSE,1,,TRUE,TRUE,FALSE,FALSE,0,may have confessed to demonic pact and renunciation of baptism,FALSE,,FALSE,,FALSE,FALSE,FALSE,FALSE,FALSE,FALSE,FALSE,,,,FALSE,FALSE,FALSE,FALSE,FALSE,FALSE,FALSE,FALSE,FALSE,FALSE,,FALSE,FALSE,FALSE,FALSE,FALSE,FALSE,FALSE,FALSE,FALSE,FALSE,FALSE,FALSE,FALSE,FALSE,FALSE,FALSE,FALSE,,FALSE,FALSE,,,FALSE,FALSE,FALSE,FALSE,FALSE,,,SMD,2001-05-15T17:00:16,jhm,2002-10-03T16:43:42
C/EGD/1381,1381,EGD,-1,A/EGD/1367,6/9/1661,1961-09-06T00:00:00,6/9/1661,1961-09-06T00:00:00,,"Huntar,Jean",,,,,,,FALSE,FALSE,FALSE,FALSE,FALSE,TRUE,FALSE,FALSE,FALSE,FALSE,FALSE,FALSE,FALSE,FALSE,FALSE,FALSE,FALSE,FALSE,FALSE,FALSE,FALSE,FALSE,FALSE,FALSE,FALSE,FALSE,FALSE,FALSE,FALSE,FALSE,1,,TRUE,TRUE,FALSE,FALSE,0,may have confessed to pact,FALSE,,FALSE,,FALSE,FALSE,FALSE,FALSE,FALSE,FALSE,FALSE,,,,FALSE,FALSE,FALSE,FALSE,FALSE,FALSE,FALSE,FALSE,FALSE,FALSE,,FALSE,FALSE,FALSE,FALSE,FALSE,FALSE,FALSE,FALSE,FALSE,FALSE,FALSE,FALSE,FALSE,FALSE,FALSE,FALSE,FALSE,,FALSE,FALSE,,,FALSE,FALSE,FALSE,FALSE,FALSE,,,SMD,2001-05-15T17:00:16,LEM,2002-09-17T15:13:11
C/EGD/1382,1382,EGD,-1,A/EGD/1368,6/9/1661,1961-09-06T00:00:00,6/9/1661,1961-09-06T00:00:00,,"Yester,Elspeth",,,,,,,FALSE,FALSE,FALSE,FALSE,FALSE,TRUE,FALSE,FALSE,FALSE,FALSE,FALSE,FALSE,FALSE,FALSE,FALSE,FALSE,FALSE,FALSE,FALSE,FALSE,FALSE,FALSE,FALSE,FALSE,FALSE,FALSE,FALSE,FALSE,FALSE,FALSE,1,,TRUE,TRUE,FALSE,FALSE,0,recorded as having confessed to demonic pact and renunciation of baptism,FALSE,,FALSE,,FALSE,FALSE,FALSE,FALSE,FALSE,FALSE,FALSE,,,,FALSE,FALSE,FALSE,FALSE,FALSE,FALSE,FALSE,FALSE,FALSE,FALSE,,FALSE,FALSE,FALSE,FALSE,FALSE,FALSE,FALSE,FALSE,FALSE,FALSE,FALSE,FALSE,FALSE,FALSE,FALSE,FALSE,FALSE,,FALSE,FALSE,,,FALSE,FALSE,FALSE,FALSE,FALSE,,,SMD,2001-05-15T17:00:16,jhm,2002-10-03T16:46:38
C/EGD/1383,1383,EGD,-1,A/EGD/1369,6/9/1661,1961-09-06T00:00:00,6/9/1661,1961-09-06T00:00:00,,"Jonstoun,James",,,,,,,FALSE,FALSE,FALSE,FALSE,FALSE,TRUE,FALSE,FALSE,FALSE,FALSE,FALSE,FALSE,FALSE,FALSE,FALSE,FALSE,FALSE,FALSE,FALSE,FALSE,FALSE,FALSE,FALSE,FALSE,FALSE,FALSE,FALSE,FALSE,FALSE,FALSE,1,,TRUE,TRUE,FALSE,FALSE,0,recorded as having confessed to demonic pact and renunciation of baptism,FALSE,,FALSE,,FALSE,FALSE,FALSE,FALSE,FALSE,FALSE,FALSE,,,,FALSE,FALSE,FALSE,FALSE,FALSE,FALSE,FALSE,FALSE,FALSE,FALSE,,FALSE,FALSE,FALSE,FALSE,FALSE,FALSE,FALSE,FALSE,FALSE,FALSE,FALSE,FALSE,FALSE,FALSE,FALSE,FALSE,FALSE,,FALSE,FALSE,,,FALSE,FALSE,FALSE,FALSE,FALSE,,,SMD,2001-05-15T17:00:16,jhm,2002-10-07T12:47:49
C/EGD/1384,1384,EGD,-1,A/EGD/1370,6/9/1661,1961-09-06T00:00:00,6/9/1661,1961-09-06T00:00:00,,"Watson,George",,,,,,,FALSE,FALSE,FALSE,FALSE,FALSE,TRUE,FALSE,FALSE,FALSE,FALSE,FALSE,FALSE,FALSE,FALSE,FALSE,FALSE,FALSE,FALSE,FALSE,FALSE,FALSE,FALSE,FALSE,FALSE,FALSE,FALSE,FALSE,FALSE,FALSE,FALSE,1,,TRUE,TRUE,FALSE,FALSE,0,recorded as having confessed to demonic pact and renunciation of baptism,FALSE,,FALSE,,FALSE,FALSE,FALSE,FALSE,FALSE,FALSE,FALSE,,,,FALSE,FALSE,FALSE,FALSE,FALSE,FALSE,FALSE,FALSE,FALSE,FALSE,,FALSE,FALSE,FALSE,FALSE,FALSE,FALSE,FALSE,FALSE,FALSE,FALSE,FALSE,FALSE,FALSE,FALSE,FALSE,FALSE,FALSE,,FALSE,FALSE,,,FALSE,FALSE,FALSE,FALSE,FALSE,,,SMD,2001-05-15T17:00:16,jhm,2002-10-07T12:50:44
C/EGD/1385,1385,EGD,-1,A/EGD/1371,6/9/1661,1961-09-06T00:00:00,6/9/1661,1961-09-06T00:00:00,,"Elleot,Margaret",,,,,,,FALSE,FALSE,FALSE,FALSE,FALSE,TRUE,FALSE,FALSE,FALSE,FALSE,FALSE,FALSE,FALSE,FALSE,FALSE,FALSE,FALSE,FALSE,FALSE,FALSE,FALSE,FALSE,FALSE,FALSE,FALSE,FALSE,FALSE,FALSE,FALSE,FALSE,1,,TRUE,TRUE,FALSE,FALSE,0,reported to have confessed demonic pact.,FALSE,,FALSE,,FALSE,FALSE,FALSE,FALSE,FALSE,FALSE,FALSE,,,,FALSE,FALSE,FALSE,FALSE,FALSE,FALSE,FALSE,FALSE,FALSE,FALSE,,FALSE,FALSE,FALSE,FALSE,FALSE,FALSE,FALSE,FALSE,FALSE,FALSE,FALSE,FALSE,FALSE,FALSE,FALSE,FALSE,FALSE,,FALSE,FALSE,,,FALSE,FALSE,FALSE,FALSE,FALSE,,,SMD,2001-05-15T17:00:16,jhm,2002-10-07T12:52:11
C/EGD/1386,1386,EGD,-1,A/EGD/1372,6/9/1661,1961-09-06T00:00:00,6/9/1661,1961-09-06T00:00:00,,"Moffatt,Margret",,,,,,,FALSE,FALSE,FALSE,FALSE,FALSE,TRUE,FALSE,FALSE,FALSE,FALSE,FALSE,FALSE,FALSE,FALSE,FALSE,FALSE,FALSE,FALSE,FALSE,FALSE,FALSE,FALSE,FALSE,FALSE,FALSE,FALSE,FALSE,FALSE,FALSE,FALSE,1,,TRUE,TRUE,FALSE,FALSE,0,recorded as having confessed pact.,FALSE,,FALSE,,FALSE,FALSE,FALSE,FALSE,FALSE,FALSE,FALSE,,,,FALSE,FALSE,FALSE,FALSE,FALSE,FALSE,FALSE,FALSE,FALSE,FALSE,,FALSE,FALSE,FALSE,FALSE,FALSE,FALSE,FALSE,FALSE,FALSE,FALSE,FALSE,FALSE,FALSE,FALSE,FALSE,FALSE,FALSE,,FALSE,FALSE,,,FALSE,FALSE,FALSE,FALSE,FALSE,,,SMD,2001-05-15T17:00:16,jhm,2001-09-10T14:32:48
C/EGD/1387,1387,EGD,-1,A/EGD/1373,19/11/1661,1961-11-19T00:00:00,19/11/1661,1961-11-19T00:00:00,,"Grinlaw,Elspeth",,,,,,,FALSE,FALSE,FALSE,FALSE,FALSE,TRUE,FALSE,FALSE,FALSE,FALSE,FALSE,FALSE,FALSE,FALSE,FALSE,FALSE,FALSE,FALSE,FALSE,FALSE,FALSE,FALSE,FALSE,FALSE,FALSE,FALSE,FALSE,FALSE,FALSE,FALSE,1,,TRUE,TRUE,FALSE,FALSE,0,recorded as having confessed to pact etc.,FALSE,,FALSE,,FALSE,FALSE,FALSE,FALSE,FALSE,FALSE,FALSE,,,,FALSE,FALSE,FALSE,FALSE,FALSE,FALSE,FALSE,FALSE,FALSE,FALSE,,FALSE,FALSE,FALSE,FALSE,FALSE,FALSE,FALSE,FALSE,FALSE,FALSE,FALSE,FALSE,FALSE,FALSE,FALSE,FALSE,FALSE,,FALSE,FALSE,,,FALSE,FALSE,FALSE,FALSE,FALSE,,,SMD,2001-05-15T17:00:16,jhm,2002-10-07T12:53:43
C/EGD/1388,1388,EGD,-1,A/EGD/1374,6/9/1661,1961-09-06T00:00:00,6/9/1661,1961-09-06T00:00:00,,"Bathgate,Issobell",,,,,,,FALSE,FALSE,FALSE,FALSE,FALSE,TRUE,FALSE,FALSE,FALSE,FALSE,FALSE,FALSE,FALSE,FALSE,FALSE,FALSE,FALSE,FALSE,FALSE,FALSE,FALSE,FALSE,FALSE,FALSE,FALSE,FALSE,FALSE,FALSE,FALSE,FALSE,1,,TRUE,TRUE,FALSE,FALSE,0,recorded as having confessed to pact and renunciation of baptism,FALSE,,FALSE,,FALSE,FALSE,FALSE,FALSE,FALSE,FALSE,FALSE,,,,FALSE,FALSE,FALSE,FALSE,FALSE,FALSE,FALSE,FALSE,FALSE,FALSE,,FALSE,FALSE,FALSE,FALSE,FALSE,FALSE,FALSE,FALSE,FALSE,FALSE,FALSE,FALSE,FALSE,FALSE,FALSE,FALSE,FALSE,,FALSE,FALSE,,,FALSE,FALSE,FALSE,FALSE,FALSE,,,SMD,2001-05-15T17:00:16,jhm,2002-10-07T12:54:24
C/EGD/1389,1389,EGD,-1,A/EGD/1375,6/9/1661,1961-09-06T00:00:00,6/9/1661,1961-09-06T00:00:00,,"Bartan,Margret",,,,,,,FALSE,FALSE,FALSE,FALSE,FALSE,TRUE,FALSE,FALSE,FALSE,FALSE,FALSE,FALSE,FALSE,FALSE,FALSE,FALSE,FALSE,FALSE,FALSE,FALSE,FALSE,FALSE,FALSE,FALSE,FALSE,FALSE,FALSE,FALSE,FALSE,FALSE,1,,TRUE,TRUE,FALSE,FALSE,0,recorded as having confessed to pact and renunciation of baptism,FALSE,,FALSE,,FALSE,FALSE,FALSE,FALSE,FALSE,FALSE,FALSE,,,,FALSE,FALSE,FALSE,FALSE,FALSE,FALSE,FALSE,FALSE,FALSE,FALSE,,FALSE,FALSE,FALSE,FALSE,FALSE,FALSE,FALSE,FALSE,FALSE,FALSE,FALSE,FALSE,FALSE,FALSE,FALSE,FALSE,FALSE,,FALSE,FALSE,,,FALSE,FALSE,FALSE,FALSE,FALSE,,,SMD,2001-05-15T17:00:16,jhm,2002-10-07T12:56:44
C/EGD/139,139,EGD,-1,A/EGD/128,3/1/1602,2002-01-03T00:00:00,20/5/1604,2004-05-20T00:00:00,,"McTeir,Katherine",,,,,,,FALSE,FALSE,FALSE,FALSE,FALSE,FALSE,FALSE,FALSE,FALSE,FALSE,FALSE,TRUE,FALSE,TRUE,FALSE,FALSE,FALSE,FALSE,FALSE,TRUE,FALSE,FALSE,FALSE,FALSE,FALSE,FALSE,FALSE,FALSE,FALSE,FALSE,3,,TRUE,TRUE,FALSE,FALSE,0,Kirk session discussed healing and quarrels but Patrick Lowrie mentioned demonic material.,FALSE,"Was presented with a hairbelt in the shape of a devil's claw by Helena McBurnie, the 'devilish spirit woman' according to P. Lowrie.",FALSE,,FALSE,FALSE,FALSE,FALSE,FALSE,FALSE,FALSE,,,"Devil's meetings which McTeir was said to have attended were at the top of Lowdon Hill, the kirk and kirkyard and the shore were described by P. Lowrie.",FALSE,FALSE,FALSE,FALSE,FALSE,FALSE,FALSE,FALSE,FALSE,FALSE,"She was presented with a hairbelt (in the shape of a Devil's claw) from the spirit woman Helena McBurnie and used part of a corpse in a ritual, according to P. Lowrie.  Supposedly used a stone for her 'adois'  She provided herbs to combat P. Lowrie's bewitching.  Carried out rituals at Hallowe'en and Whitsun.",FALSE,FALSE,FALSE,FALSE,FALSE,FALSE,FALSE,FALSE,FALSE,FALSE,TRUE,TRUE,FALSE,FALSE,FALSE,TRUE,FALSE,Seems to be small-scale healing of animals (in the Kirk session records).,FALSE,FALSE,,,FALSE,FALSE,FALSE,FALSE,FALSE,,,SMD,2001-05-15T17:00:16,LEM,2002-12-05T14:20:03
C/EGD/1390,1390,EGD,-1,A/EGD/1376,29/7/1661,1961-07-29T00:00:00,6/9/1661,1961-09-06T00:00:00,,"Halliburtonn,Elspeth",,,,,,,FALSE,FALSE,FALSE,FALSE,FALSE,TRUE,FALSE,FALSE,FALSE,FALSE,FALSE,FALSE,FALSE,FALSE,FALSE,FALSE,FALSE,TRUE,FALSE,FALSE,FALSE,FALSE,FALSE,FALSE,FALSE,FALSE,FALSE,FALSE,FALSE,FALSE,2,,TRUE,TRUE,FALSE,FALSE,0,may have confessed to demonic pact and renunciation of baptism,FALSE,,TRUE,,TRUE,FALSE,FALSE,FALSE,FALSE,FALSE,FALSE,,,,FALSE,FALSE,FALSE,FALSE,FALSE,FALSE,FALSE,FALSE,FALSE,FALSE,,FALSE,FALSE,FALSE,FALSE,FALSE,FALSE,FALSE,FALSE,FALSE,FALSE,FALSE,FALSE,FALSE,FALSE,FALSE,FALSE,FALSE,,FALSE,FALSE,,,FALSE,FALSE,FALSE,FALSE,FALSE,,,SMD,2001-05-15T17:00:16,LEM,2002-12-05T12:57:10
C/EGD/1392,1392,EGD,-1,A/EGD/1378,29/7/1661,1961-07-29T00:00:00,6/9/1661,1961-09-06T00:00:00,,"Hog,William",,,,,,,FALSE,FALSE,FALSE,FALSE,FALSE,TRUE,FALSE,FALSE,FALSE,FALSE,FALSE,FALSE,FALSE,FALSE,FALSE,FALSE,FALSE,FALSE,FALSE,FALSE,FALSE,FALSE,FALSE,FALSE,FALSE,FALSE,FALSE,FALSE,FALSE,FALSE,1,,TRUE,TRUE,FALSE,FALSE,0,may have confessed to demonic pact and renunciation of baptism,FALSE,,FALSE,,FALSE,FALSE,FALSE,FALSE,FALSE,FALSE,FALSE,,,,FALSE,FALSE,FALSE,FALSE,FALSE,FALSE,FALSE,FALSE,FALSE,FALSE,,FALSE,FALSE,FALSE,FALSE,FALSE,FALSE,FALSE,FALSE,FALSE,FALSE,FALSE,FALSE,FALSE,FALSE,FALSE,FALSE,FALSE,,FALSE,FALSE,,,FALSE,FALSE,FALSE,FALSE,FALSE,,,SMD,2001-05-15T17:00:16,jhm,2002-10-07T13:08:54
C/EGD/1393,1393,EGD,-1,A/EGD/1379,6/9/1661,1961-09-06T00:00:00,6/9/1661,1961-09-06T00:00:00,,"Harlaw,Jon",,,,,,,FALSE,FALSE,FALSE,FALSE,FALSE,TRUE,FALSE,FALSE,FALSE,FALSE,FALSE,FALSE,FALSE,FALSE,FALSE,FALSE,FALSE,FALSE,FALSE,FALSE,FALSE,FALSE,FALSE,FALSE,FALSE,FALSE,FALSE,FALSE,FALSE,FALSE,1,,TRUE,TRUE,FALSE,FALSE,0,may have confessed to demonic pact and renunciation of baptism,FALSE,,FALSE,,FALSE,FALSE,FALSE,FALSE,FALSE,FALSE,FALSE,,,,FALSE,FALSE,FALSE,FALSE,FALSE,FALSE,FALSE,FALSE,FALSE,FALSE,,FALSE,FALSE,FALSE,FALSE,FALSE,FALSE,FALSE,FALSE,FALSE,FALSE,FALSE,FALSE,FALSE,FALSE,FALSE,FALSE,FALSE,,FALSE,FALSE,,,FALSE,FALSE,FALSE,FALSE,FALSE,,,SMD,2001-05-15T17:00:16,jhm,2002-10-07T13:54:47
C/EGD/1394,1394,EGD,-1,A/EGD/1380,6/9/1661,1961-09-06T00:00:00,6/9/1661,1961-09-06T00:00:00,,"Jonstoun,Katherin",,,,,,,FALSE,FALSE,FALSE,FALSE,FALSE,TRUE,FALSE,FALSE,FALSE,FALSE,FALSE,FALSE,FALSE,FALSE,FALSE,FALSE,FALSE,FALSE,FALSE,FALSE,FALSE,FALSE,FALSE,FALSE,FALSE,FALSE,FALSE,FALSE,FALSE,FALSE,1,,TRUE,TRUE,FALSE,FALSE,0,may have confessed to demonic pact and renunication of baptism,FALSE,,FALSE,,FALSE,FALSE,FALSE,FALSE,FALSE,FALSE,FALSE,,,,FALSE,FALSE,FALSE,FALSE,FALSE,FALSE,FALSE,FALSE,FALSE,FALSE,,FALSE,FALSE,FALSE,FALSE,FALSE,FALSE,FALSE,FALSE,FALSE,FALSE,FALSE,FALSE,FALSE,FALSE,FALSE,FALSE,FALSE,,FALSE,FALSE,,,FALSE,FALSE,FALSE,FALSE,FALSE,,,SMD,2001-05-15T17:00:16,jhm,2002-10-07T13:56:52
C/EGD/1395,1395,EGD,-1,A/EGD/1381,6/9/1661,1961-09-06T00:00:00,6/9/1661,1961-09-06T00:00:00,,"Turnbull,Bessie",,,,,,,FALSE,FALSE,FALSE,FALSE,FALSE,TRUE,FALSE,FALSE,FALSE,FALSE,FALSE,FALSE,FALSE,FALSE,FALSE,FALSE,FALSE,FALSE,FALSE,FALSE,FALSE,FALSE,FALSE,FALSE,FALSE,FALSE,FALSE,FALSE,FALSE,FALSE,1,,TRUE,TRUE,FALSE,FALSE,0,may have confessed to pact and renunciation of baptism,FALSE,,FALSE,,FALSE,FALSE,FALSE,FALSE,FALSE,FALSE,FALSE,,,,FALSE,FALSE,FALSE,FALSE,FALSE,FALSE,FALSE,FALSE,FALSE,FALSE,,FALSE,FALSE,FALSE,FALSE,FALSE,FALSE,FALSE,FALSE,FALSE,FALSE,FALSE,FALSE,FALSE,FALSE,FALSE,FALSE,FALSE,,FALSE,FALSE,,,FALSE,FALSE,FALSE,FALSE,FALSE,,,SMD,2001-05-15T17:00:16,jhm,2002-10-07T13:57:55
C/EGD/1396,1396,EGD,-1,A/EGD/1382,6/9/1661,1961-09-06T00:00:00,6/9/1661,1961-09-06T00:00:00,,"Hawie,Margret",,,,,,,FALSE,FALSE,FALSE,FALSE,FALSE,TRUE,FALSE,FALSE,FALSE,FALSE,FALSE,FALSE,FALSE,FALSE,FALSE,FALSE,FALSE,FALSE,FALSE,FALSE,FALSE,FALSE,FALSE,FALSE,FALSE,FALSE,FALSE,FALSE,FALSE,FALSE,1,,TRUE,TRUE,FALSE,FALSE,0,may have confessed to pact and renunciation of baptism,FALSE,,FALSE,,FALSE,FALSE,FALSE,FALSE,FALSE,FALSE,FALSE,,,,FALSE,FALSE,FALSE,FALSE,FALSE,FALSE,FALSE,FALSE,FALSE,FALSE,,FALSE,FALSE,FALSE,FALSE,FALSE,FALSE,FALSE,FALSE,FALSE,FALSE,FALSE,FALSE,FALSE,FALSE,FALSE,FALSE,FALSE,,FALSE,FALSE,,,FALSE,FALSE,FALSE,FALSE,FALSE,,,SMD,2001-05-15T17:00:16,jhm,2002-10-07T13:58:53
C/EGD/1397,1397,EGD,-1,A/EGD/1383,6/9/1661,1961-09-06T00:00:00,6/9/1661,1961-09-06T00:00:00,,"Knox,Jean",,,,,,,FALSE,FALSE,FALSE,FALSE,FALSE,TRUE,FALSE,FALSE,FALSE,FALSE,FALSE,FALSE,FALSE,FALSE,FALSE,FALSE,FALSE,FALSE,FALSE,FALSE,FALSE,FALSE,FALSE,FALSE,FALSE,FALSE,FALSE,FALSE,FALSE,FALSE,1,,TRUE,TRUE,FALSE,FALSE,0,may have confessed to pact and renunciation of baptism,FALSE,,FALSE,,FALSE,FALSE,FALSE,FALSE,FALSE,FALSE,FALSE,,,,FALSE,FALSE,FALSE,FALSE,FALSE,FALSE,FALSE,FALSE,FALSE,FALSE,,FALSE,FALSE,FALSE,FALSE,FALSE,FALSE,FALSE,FALSE,FALSE,FALSE,FALSE,FALSE,FALSE,FALSE,FALSE,FALSE,FALSE,,FALSE,FALSE,,,FALSE,FALSE,FALSE,FALSE,FALSE,,,SMD,2001-05-15T17:00:16,jhm,2002-10-08T08:22:46
C/EGD/1398,1398,EGD,-1,A/EGD/1384,12/7/1661,1961-07-12T00:00:00,18/9/1661,1961-09-18T00:00:00,,"Huntar,Kathrin",,,,,,,FALSE,FALSE,FALSE,FALSE,FALSE,TRUE,FALSE,FALSE,FALSE,FALSE,FALSE,FALSE,FALSE,FALSE,FALSE,FALSE,FALSE,TRUE,FALSE,FALSE,FALSE,FALSE,FALSE,FALSE,FALSE,FALSE,FALSE,FALSE,FALSE,FALSE,2,,TRUE,TRUE,FALSE,FALSE,0,she seems not to have been tried due to being 'grossely ignorant'.,FALSE,She promised to be a good servant,FALSE,,FALSE,FALSE,FALSE,FALSE,FALSE,FALSE,FALSE,,,,FALSE,FALSE,FALSE,FALSE,FALSE,FALSE,FALSE,FALSE,FALSE,FALSE,,FALSE,FALSE,FALSE,FALSE,FALSE,FALSE,FALSE,FALSE,FALSE,FALSE,FALSE,FALSE,FALSE,FALSE,FALSE,FALSE,FALSE,,FALSE,FALSE,,,FALSE,FALSE,FALSE,FALSE,FALSE,,,SMD,2001-05-15T17:00:16,jhm,2002-10-07T14:28:21
C/EGD/1399,1399,EGD,-1,A/EGD/1385,2/10/1661,1961-10-02T00:00:00,14/11/1661,1961-11-14T00:00:00,,"Lumsdeall,George",,,,,,,FALSE,FALSE,FALSE,FALSE,FALSE,FALSE,FALSE,FALSE,FALSE,FALSE,FALSE,FALSE,FALSE,FALSE,FALSE,FALSE,FALSE,FALSE,FALSE,FALSE,FALSE,FALSE,FALSE,FALSE,FALSE,FALSE,FALSE,FALSE,FALSE,FALSE,0,,TRUE,TRUE,FALSE,FALSE,0,No details about accusations or confession,FALSE,,FALSE,,FALSE,FALSE,FALSE,FALSE,FALSE,FALSE,FALSE,,,,FALSE,FALSE,FALSE,FALSE,FALSE,FALSE,FALSE,FALSE,FALSE,FALSE,,FALSE,FALSE,FALSE,FALSE,FALSE,FALSE,FALSE,FALSE,FALSE,FALSE,FALSE,FALSE,FALSE,FALSE,FALSE,FALSE,FALSE,,FALSE,FALSE,,,FALSE,FALSE,FALSE,FALSE,FALSE,,,SMD,2001-05-15T17:00:16,LEM,2002-12-06T12:08:52
C/EGD/14,14,EGD,0,,,,1649,2049-12-15T00:00:00,,(many witches),,,,,,15,FALSE,FALSE,FALSE,FALSE,FALSE,FALSE,FALSE,FALSE,FALSE,FALSE,FALSE,FALSE,FALSE,FALSE,FALSE,FALSE,FALSE,FALSE,FALSE,FALSE,FALSE,FALSE,FALSE,FALSE,FALSE,FALSE,FALSE,FALSE,FALSE,FALSE,0,,FALSE,FALSE,FALSE,FALSE,0,,FALSE,,FALSE,,FALSE,FALSE,FALSE,FALSE,FALSE,FALSE,FALSE,,,,FALSE,FALSE,FALSE,FALSE,FALSE,FALSE,FALSE,FALSE,FALSE,FALSE,,FALSE,FALSE,FALSE,FALSE,FALSE,FALSE,FALSE,FALSE,FALSE,FALSE,FALSE,FALSE,FALSE,FALSE,FALSE,FALSE,FALSE,,FALSE,FALSE,,,FALSE,FALSE,FALSE,FALSE,FALSE,,"(many witches) Balfour, J 'Historical Works' (Edinburgh, 1824)  V3 pp. 433-434.

This secondary work cited by Larner was not checked by the project.",SMD,2001-05-15T17:00:16,jhm,2002-10-07T14:33:56
C/EGD/140,140,EGD,-1,A/EGD/129,28/7/1603,2003-07-28T00:00:00,23/7/1605,2005-07-23T00:00:00,48,"Lowrie,Patrik",,,,,,,FALSE,FALSE,FALSE,TRUE,FALSE,TRUE,FALSE,FALSE,FALSE,FALSE,TRUE,TRUE,FALSE,TRUE,FALSE,FALSE,FALSE,FALSE,FALSE,FALSE,FALSE,FALSE,FALSE,FALSE,FALSE,FALSE,FALSE,FALSE,FALSE,FALSE,5,,FALSE,FALSE,FALSE,FALSE,0,,FALSE,Exhumed bodies from a grave yard,TRUE,,TRUE,FALSE,FALSE,FALSE,FALSE,FALSE,FALSE,,,,FALSE,FALSE,FALSE,TRUE,FALSE,FALSE,FALSE,FALSE,TRUE,FALSE,He was presented with a hairbelt (in the shape of a Devil's claw) from the spirit woman Helena McBurnie.  He was accused of damaging cows milk on Beltane.,TRUE,FALSE,TRUE,FALSE,FALSE,FALSE,FALSE,TRUE,TRUE,FALSE,FALSE,FALSE,FALSE,TRUE,TRUE,TRUE,FALSE,Struck someone blind,TRUE,FALSE,Turned milk to blood,,FALSE,FALSE,FALSE,FALSE,FALSE,,"His master and baron pursued him as the holder of a commission, along with the bailie who was supposedly after his goods.  Check on dates of trial, etc. the sequence doesn't seem to match up.",SMD,2001-05-15T17:00:16,jhm,2002-10-07T14:43:02
C/EGD/1401,1401,EGD,-1,A/EGD/1387,7/11/1661,1961-11-07T00:00:00,7/11/1661,1961-11-07T00:00:00,25,"Curry,Jonet",,,,,,,FALSE,FALSE,FALSE,FALSE,FALSE,TRUE,FALSE,FALSE,FALSE,FALSE,FALSE,FALSE,FALSE,FALSE,FALSE,FALSE,FALSE,FALSE,FALSE,FALSE,FALSE,FALSE,FALSE,FALSE,FALSE,FALSE,FALSE,FALSE,FALSE,FALSE,1,,TRUE,TRUE,FALSE,FALSE,0,"Commission includes reference to demonic pact, renunciation ot baptism but no specific details,",FALSE,,FALSE,,FALSE,FALSE,FALSE,FALSE,FALSE,FALSE,FALSE,,,,FALSE,FALSE,FALSE,FALSE,FALSE,FALSE,FALSE,FALSE,FALSE,FALSE,,FALSE,FALSE,FALSE,FALSE,FALSE,FALSE,FALSE,FALSE,FALSE,FALSE,FALSE,FALSE,FALSE,FALSE,FALSE,FALSE,FALSE,,FALSE,FALSE,,,FALSE,FALSE,FALSE,FALSE,FALSE,,,SMD,2001-05-15T17:00:16,jhm,2002-10-08T08:27:50
C/EGD/1402,1402,EGD,-1,A/EGD/1388,7/11/1661,1961-11-07T00:00:00,7/11/1661,1961-11-07T00:00:00,50,"Walker,Margret",,,,,,,FALSE,FALSE,FALSE,FALSE,FALSE,TRUE,FALSE,FALSE,FALSE,FALSE,FALSE,FALSE,FALSE,FALSE,FALSE,FALSE,FALSE,FALSE,FALSE,FALSE,FALSE,FALSE,FALSE,FALSE,FALSE,FALSE,FALSE,FALSE,FALSE,FALSE,1,,TRUE,TRUE,FALSE,FALSE,0,Commission included reference to demonic pact and renunciation of baptism but no specific details from confession.,FALSE,,FALSE,,FALSE,FALSE,FALSE,FALSE,FALSE,FALSE,FALSE,,,,FALSE,FALSE,FALSE,FALSE,FALSE,FALSE,FALSE,FALSE,FALSE,FALSE,,FALSE,FALSE,FALSE,FALSE,FALSE,FALSE,FALSE,FALSE,FALSE,FALSE,FALSE,FALSE,FALSE,FALSE,FALSE,FALSE,FALSE,,FALSE,FALSE,,,FALSE,FALSE,FALSE,FALSE,FALSE,,,SMD,2001-05-15T17:00:16,jhm,2002-10-07T14:54:18
C/EGD/1403,1403,EGD,-1,A/EGD/1389,7/11/1661,1961-11-07T00:00:00,7/11/1661,1961-11-07T00:00:00,,"Syrie,Issobell",,,,,,,FALSE,FALSE,FALSE,FALSE,FALSE,TRUE,FALSE,FALSE,FALSE,FALSE,FALSE,FALSE,FALSE,FALSE,FALSE,FALSE,FALSE,FALSE,FALSE,FALSE,FALSE,FALSE,FALSE,FALSE,FALSE,FALSE,FALSE,FALSE,FALSE,FALSE,1,,TRUE,TRUE,FALSE,FALSE,0,Demonic pact and renunciation of baptism included in commission but no details from confession.,FALSE,,FALSE,,FALSE,FALSE,FALSE,FALSE,FALSE,FALSE,FALSE,,,,FALSE,FALSE,FALSE,FALSE,FALSE,FALSE,FALSE,FALSE,FALSE,FALSE,,FALSE,FALSE,FALSE,FALSE,FALSE,FALSE,FALSE,FALSE,FALSE,FALSE,FALSE,FALSE,FALSE,FALSE,FALSE,FALSE,FALSE,,FALSE,FALSE,,,FALSE,FALSE,FALSE,FALSE,FALSE,,,SMD,2001-05-15T17:00:16,jhm,2002-10-07T14:54:46
C/EGD/1404,1404,EGD,-1,A/EGD/1390,7/11/1661,1961-11-07T00:00:00,7/11/1661,1961-11-07T00:00:00,,"Belshes,Helen",,,,,,,FALSE,FALSE,FALSE,FALSE,FALSE,TRUE,FALSE,FALSE,FALSE,FALSE,FALSE,FALSE,FALSE,FALSE,FALSE,FALSE,FALSE,FALSE,FALSE,FALSE,FALSE,FALSE,FALSE,FALSE,FALSE,FALSE,FALSE,FALSE,FALSE,FALSE,1,,TRUE,TRUE,FALSE,FALSE,0,recorded as having confessed to demonic pact and renunciation of baptism,FALSE,,FALSE,,FALSE,FALSE,FALSE,FALSE,FALSE,FALSE,FALSE,,,,FALSE,FALSE,FALSE,FALSE,FALSE,FALSE,FALSE,FALSE,FALSE,FALSE,,FALSE,FALSE,FALSE,FALSE,FALSE,FALSE,FALSE,FALSE,FALSE,FALSE,FALSE,FALSE,FALSE,FALSE,FALSE,FALSE,FALSE,,FALSE,FALSE,,,FALSE,FALSE,FALSE,FALSE,FALSE,,,SMD,2001-05-15T17:00:16,jhm,2002-10-07T14:57:13
C/EGD/1405,1405,EGD,-1,A/EGD/1391,7/11/1661,1961-11-07T00:00:00,7/11/1661,1961-11-07T00:00:00,,"Hood,Barbara",,,,,,,FALSE,FALSE,FALSE,FALSE,FALSE,TRUE,FALSE,FALSE,FALSE,FALSE,FALSE,FALSE,FALSE,FALSE,FALSE,FALSE,FALSE,FALSE,FALSE,FALSE,FALSE,FALSE,FALSE,FALSE,FALSE,FALSE,FALSE,FALSE,FALSE,FALSE,1,,TRUE,TRUE,FALSE,FALSE,0,Recorded as having confessed to demonic pact and renunciation of baptism,FALSE,,FALSE,,FALSE,FALSE,FALSE,FALSE,FALSE,FALSE,FALSE,,,,FALSE,FALSE,FALSE,FALSE,FALSE,FALSE,FALSE,FALSE,FALSE,FALSE,,FALSE,FALSE,FALSE,FALSE,FALSE,FALSE,FALSE,FALSE,FALSE,FALSE,FALSE,FALSE,FALSE,FALSE,FALSE,FALSE,FALSE,,FALSE,FALSE,,,FALSE,FALSE,FALSE,FALSE,FALSE,,,SMD,2001-05-15T17:00:16,jhm,2002-10-07T14:57:42
C/EGD/1406,1406,EGD,-1,A/EGD/1392,9/1661,1961-09-01T00:00:00,2/4/1662,1962-04-02T00:00:00,50,"Robertson,Adam",,,,,,,FALSE,FALSE,FALSE,FALSE,FALSE,FALSE,FALSE,FALSE,FALSE,FALSE,FALSE,FALSE,FALSE,FALSE,FALSE,FALSE,FALSE,FALSE,FALSE,FALSE,FALSE,FALSE,FALSE,FALSE,FALSE,FALSE,FALSE,FALSE,FALSE,FALSE,0,,TRUE,TRUE,FALSE,FALSE,0,,FALSE,,FALSE,,FALSE,FALSE,FALSE,FALSE,FALSE,FALSE,FALSE,,,,FALSE,FALSE,FALSE,FALSE,FALSE,FALSE,FALSE,FALSE,FALSE,FALSE,,FALSE,FALSE,FALSE,FALSE,FALSE,FALSE,FALSE,FALSE,FALSE,FALSE,FALSE,FALSE,FALSE,FALSE,FALSE,FALSE,FALSE,,FALSE,FALSE,,,FALSE,FALSE,FALSE,FALSE,FALSE,,,SMD,2001-05-15T17:00:16,jhm,2002-11-13T12:12:37
C/EGD/1407,1407,EGD,-1,A/EGD/1393,7/11/1661,1961-11-07T00:00:00,8/12/1661,1961-12-08T00:00:00,,"Brikinrig,Helen",,,,,,,FALSE,FALSE,FALSE,FALSE,FALSE,FALSE,FALSE,FALSE,FALSE,FALSE,FALSE,FALSE,FALSE,TRUE,FALSE,FALSE,FALSE,FALSE,FALSE,FALSE,FALSE,FALSE,FALSE,FALSE,FALSE,FALSE,FALSE,FALSE,FALSE,FALSE,1,,TRUE,TRUE,FALSE,FALSE,0,Maleficium implied as the commission for justiciary ordered that evidence of malefice was required.,FALSE,,FALSE,,FALSE,FALSE,FALSE,FALSE,FALSE,FALSE,FALSE,,,,FALSE,FALSE,FALSE,FALSE,FALSE,FALSE,FALSE,FALSE,FALSE,FALSE,,FALSE,FALSE,FALSE,FALSE,FALSE,FALSE,FALSE,FALSE,FALSE,FALSE,FALSE,FALSE,FALSE,FALSE,FALSE,FALSE,FALSE,,FALSE,FALSE,,,FALSE,FALSE,FALSE,FALSE,FALSE,,,SMD,2001-05-15T17:00:16,LEM,2002-12-06T12:26:00
C/EGD/1408,1408,EGD,-1,A/EGD/1394,24/4/1661,1961-04-24T00:00:00,8/12/1661,1961-12-08T00:00:00,,"Adair,Eupham",,,,,,,FALSE,FALSE,FALSE,FALSE,FALSE,TRUE,FALSE,FALSE,FALSE,FALSE,FALSE,TRUE,FALSE,TRUE,FALSE,FALSE,FALSE,FALSE,FALSE,FALSE,FALSE,FALSE,FALSE,FALSE,FALSE,FALSE,FALSE,FALSE,FALSE,FALSE,3,,TRUE,TRUE,FALSE,FALSE,0,"commission states that she is to confess to demonic pact, renunciation of baptism or malefice but presbytery records no details apart from the first entry which states that her 'crime' was charming rather than witchcraft.",FALSE,,FALSE,,FALSE,FALSE,FALSE,FALSE,FALSE,FALSE,FALSE,,,,FALSE,FALSE,FALSE,FALSE,FALSE,FALSE,FALSE,FALSE,FALSE,FALSE,,FALSE,FALSE,FALSE,FALSE,FALSE,FALSE,FALSE,FALSE,FALSE,FALSE,FALSE,FALSE,FALSE,FALSE,FALSE,FALSE,FALSE,,FALSE,FALSE,,,FALSE,FALSE,FALSE,FALSE,FALSE,,,SMD,2001-05-15T17:00:16,LEM,2002-12-05T12:30:09
C/EGD/1409,1409,EGD,-1,A/EGD/1395,19/11/1661,1961-11-19T00:00:00,19/11/1661,1961-11-19T00:00:00,,"Key,Kathrin",,,,,,,FALSE,FALSE,FALSE,FALSE,FALSE,TRUE,FALSE,FALSE,FALSE,FALSE,FALSE,FALSE,FALSE,FALSE,FALSE,FALSE,FALSE,FALSE,FALSE,FALSE,FALSE,FALSE,FALSE,FALSE,FALSE,FALSE,FALSE,FALSE,FALSE,FALSE,1,,TRUE,TRUE,FALSE,FALSE,0,recorded as having confessed to demonic pact etc. but no details.,FALSE,,FALSE,,FALSE,FALSE,FALSE,FALSE,FALSE,FALSE,FALSE,,,,FALSE,FALSE,FALSE,FALSE,FALSE,FALSE,FALSE,FALSE,FALSE,FALSE,,FALSE,FALSE,FALSE,FALSE,FALSE,FALSE,FALSE,FALSE,FALSE,FALSE,FALSE,FALSE,FALSE,FALSE,FALSE,FALSE,FALSE,,FALSE,FALSE,,,FALSE,FALSE,FALSE,FALSE,FALSE,,,SMD,2001-05-15T17:00:16,jhm,2002-10-08T14:13:38
C/EGD/141,141,EGD,-1,A/EGD/130,10/3/1607,2007-03-10T00:00:00,10/3/1607,2007-03-10T00:00:00,,"Griersoune,Issobel",,,,,,,FALSE,FALSE,FALSE,FALSE,FALSE,TRUE,FALSE,FALSE,FALSE,FALSE,FALSE,TRUE,FALSE,TRUE,FALSE,FALSE,FALSE,FALSE,TRUE,TRUE,FALSE,FALSE,FALSE,FALSE,FALSE,FALSE,FALSE,FALSE,FALSE,FALSE,5,,FALSE,FALSE,FALSE,FALSE,0,She was described by all the accusers of having an evil will and malice against the victims.  There were disputes over debt and other neighbourhood issues.,FALSE,"The Devil in the likeness of a black cat in the company of a bunch of other black cats went to a house to do harm.  She was accused of sending the Devil to do her bidding.  In one case, when a victim saw the Devil in her shape he called her name out and she disappeared.",FALSE,,FALSE,FALSE,FALSE,FALSE,FALSE,FALSE,FALSE,,,,FALSE,FALSE,FALSE,TRUE,FALSE,TRUE,FALSE,FALSE,TRUE,FALSE,"Peole made up with her over drinks, and a strange poor woman turned up asking for meat, and announced that the accuser was bewitched.  I read her as a community healer who diagnosed the situation, but the accuser was either hiding the fact that they hired her or hiding her identity.",TRUE,TRUE,FALSE,FALSE,FALSE,FALSE,FALSE,FALSE,TRUE,FALSE,TRUE,TRUE,FALSE,FALSE,TRUE,FALSE,FALSE,"She 'pisched upon Margaret' when in spirit form.   She engaged in colourful cursing.  One man was in debt to her, she cursed him - he remembered this when he was sick.  He paid the debt  asked for help for his sickness three times and recovered.",TRUE,FALSE,"The last item involved a sickness that was removed by drinking ale, then recast with loads of curses when the cured woman called her a witch in public.  There were also a couple of instances of appeasement.",,FALSE,FALSE,FALSE,FALSE,FALSE,,,SMD,2001-05-15T17:00:16,LEM,2002-11-11T13:01:31
C/EGD/1410,1410,EGD,-1,A/EGD/1396,19/11/1661,1961-11-19T00:00:00,19/11/1661,1961-11-19T00:00:00,,"Liddell,Margret",,,,,,,FALSE,FALSE,FALSE,FALSE,FALSE,TRUE,FALSE,FALSE,FALSE,FALSE,FALSE,FALSE,FALSE,FALSE,FALSE,FALSE,FALSE,FALSE,FALSE,FALSE,FALSE,FALSE,FALSE,FALSE,FALSE,FALSE,FALSE,FALSE,FALSE,FALSE,1,,TRUE,TRUE,FALSE,FALSE,0,recorded as having confessed to pact etc. but no details.,FALSE,,FALSE,,FALSE,FALSE,FALSE,FALSE,FALSE,FALSE,FALSE,,,,FALSE,FALSE,FALSE,FALSE,FALSE,FALSE,FALSE,FALSE,FALSE,FALSE,,FALSE,FALSE,FALSE,FALSE,FALSE,FALSE,FALSE,FALSE,FALSE,FALSE,FALSE,FALSE,FALSE,FALSE,FALSE,FALSE,FALSE,,FALSE,FALSE,,,FALSE,FALSE,FALSE,FALSE,FALSE,,,SMD,2001-05-15T17:00:16,jhm,2002-10-08T08:43:17
C/EGD/1411,1411,EGD,-1,A/EGD/1397,17/12/1661,1961-12-17T00:00:00,17/12/1661,1961-12-17T00:00:00,,"Cothall,Helen",,,,,,,FALSE,FALSE,FALSE,FALSE,FALSE,FALSE,FALSE,FALSE,FALSE,FALSE,FALSE,FALSE,FALSE,FALSE,FALSE,FALSE,FALSE,FALSE,FALSE,FALSE,FALSE,FALSE,FALSE,FALSE,FALSE,FALSE,FALSE,FALSE,FALSE,FALSE,0,,TRUE,TRUE,FALSE,FALSE,0,PC recorded that the accused had confessed to witchcraft but no details.,FALSE,,FALSE,,FALSE,FALSE,FALSE,FALSE,FALSE,FALSE,FALSE,,,,FALSE,FALSE,FALSE,FALSE,FALSE,FALSE,FALSE,FALSE,FALSE,FALSE,,FALSE,FALSE,FALSE,FALSE,FALSE,FALSE,FALSE,FALSE,FALSE,FALSE,FALSE,FALSE,FALSE,FALSE,FALSE,FALSE,FALSE,,FALSE,FALSE,,,FALSE,FALSE,FALSE,FALSE,FALSE,,,SMD,2001-05-15T17:00:16,jhm,2002-10-08T08:45:31
C/EGD/1412,1412,EGD,-1,A/EGD/1398,17/12/1661,1961-12-17T00:00:00,17/12/1661,1961-12-17T00:00:00,,"Guthery,Helen",,,,,,,FALSE,FALSE,FALSE,FALSE,FALSE,FALSE,FALSE,FALSE,FALSE,FALSE,FALSE,FALSE,FALSE,FALSE,FALSE,FALSE,FALSE,FALSE,FALSE,FALSE,FALSE,FALSE,FALSE,FALSE,FALSE,FALSE,FALSE,FALSE,FALSE,FALSE,0,,TRUE,TRUE,FALSE,FALSE,0,PC recorded that the accused had confessed to witchcraft but no details.,FALSE,,FALSE,,FALSE,FALSE,FALSE,FALSE,FALSE,FALSE,FALSE,,,,FALSE,FALSE,FALSE,FALSE,FALSE,FALSE,FALSE,FALSE,FALSE,FALSE,,FALSE,FALSE,FALSE,FALSE,FALSE,FALSE,FALSE,FALSE,FALSE,FALSE,FALSE,FALSE,FALSE,FALSE,FALSE,FALSE,FALSE,,FALSE,FALSE,,,FALSE,FALSE,FALSE,FALSE,FALSE,,,SMD,2001-05-15T17:00:16,jhm,2002-10-08T08:46:09
C/EGD/1413,1413,EGD,-1,A/EGD/1399,17/12/1661,1961-12-17T00:00:00,17/12/1661,1961-12-17T00:00:00,,"Smith,Issobell",,,,,,,FALSE,FALSE,FALSE,FALSE,FALSE,FALSE,FALSE,FALSE,FALSE,FALSE,FALSE,FALSE,FALSE,FALSE,FALSE,FALSE,FALSE,FALSE,FALSE,FALSE,FALSE,FALSE,FALSE,FALSE,FALSE,FALSE,FALSE,FALSE,FALSE,FALSE,0,,TRUE,TRUE,FALSE,FALSE,0,PC recorded that the accused had confessed to witchcraft but no details.,FALSE,,FALSE,,FALSE,FALSE,FALSE,FALSE,FALSE,FALSE,FALSE,,,,FALSE,FALSE,FALSE,FALSE,FALSE,FALSE,FALSE,FALSE,FALSE,FALSE,,FALSE,FALSE,FALSE,FALSE,FALSE,FALSE,FALSE,FALSE,FALSE,FALSE,FALSE,FALSE,FALSE,FALSE,FALSE,FALSE,FALSE,,FALSE,FALSE,,,FALSE,FALSE,FALSE,FALSE,FALSE,,,SMD,2001-05-15T17:00:16,jhm,2002-10-08T08:49:10
C/EGD/1414,1414,EGD,-1,A/EGD/1400,17/12/1661,1961-12-17T00:00:00,17/12/1661,1961-12-17T00:00:00,,"Gutherie,Elspeth",,,,,,,FALSE,FALSE,FALSE,FALSE,FALSE,FALSE,FALSE,FALSE,FALSE,FALSE,FALSE,FALSE,FALSE,FALSE,FALSE,FALSE,FALSE,FALSE,FALSE,FALSE,FALSE,FALSE,FALSE,FALSE,FALSE,FALSE,FALSE,FALSE,FALSE,FALSE,0,,TRUE,TRUE,FALSE,FALSE,0,PC recorded that the accused had confessed to witchcraft but no details.,FALSE,,FALSE,,FALSE,FALSE,FALSE,FALSE,FALSE,FALSE,FALSE,,,,FALSE,FALSE,FALSE,FALSE,FALSE,FALSE,FALSE,FALSE,FALSE,FALSE,,FALSE,FALSE,FALSE,FALSE,FALSE,FALSE,FALSE,FALSE,FALSE,FALSE,FALSE,FALSE,FALSE,FALSE,FALSE,FALSE,FALSE,,FALSE,FALSE,,,FALSE,FALSE,FALSE,FALSE,FALSE,,,SMD,2001-05-15T17:00:16,jhm,2002-10-08T08:49:48
C/EGD/1415,1415,EGD,-1,A/EGD/1401,9/1/1662,1962-01-09T00:00:00,1/4/1662,1962-04-01T00:00:00,,"Dron,Margaret",,,,,,,FALSE,FALSE,FALSE,FALSE,FALSE,TRUE,FALSE,FALSE,FALSE,FALSE,FALSE,FALSE,FALSE,FALSE,FALSE,FALSE,FALSE,FALSE,FALSE,FALSE,FALSE,FALSE,FALSE,FALSE,FALSE,FALSE,FALSE,FALSE,FALSE,FALSE,1,,TRUE,TRUE,FALSE,FALSE,0,Commission included reference to pact etc but no details from confession.,FALSE,,FALSE,,FALSE,FALSE,FALSE,FALSE,FALSE,FALSE,FALSE,,,,FALSE,FALSE,FALSE,FALSE,FALSE,FALSE,FALSE,FALSE,FALSE,FALSE,,FALSE,FALSE,FALSE,FALSE,FALSE,FALSE,FALSE,FALSE,FALSE,FALSE,FALSE,FALSE,FALSE,FALSE,FALSE,FALSE,FALSE,,FALSE,FALSE,,,FALSE,FALSE,FALSE,FALSE,FALSE,,,SMD,2001-05-15T17:00:16,jhm,2002-10-08T08:52:14
C/EGD/1416,1416,EGD,-1,A/EGD/1402,13/2/1662,1962-02-13T00:00:00,13/2/1662,1962-02-13T00:00:00,,"Boig,Jon",,,,,,,FALSE,FALSE,FALSE,FALSE,FALSE,FALSE,FALSE,FALSE,FALSE,FALSE,FALSE,FALSE,FALSE,FALSE,FALSE,FALSE,FALSE,FALSE,FALSE,FALSE,FALSE,FALSE,FALSE,FALSE,FALSE,FALSE,FALSE,FALSE,FALSE,FALSE,0,,TRUE,TRUE,FALSE,FALSE,0,No details about accusation or confession.,FALSE,,FALSE,,FALSE,FALSE,FALSE,FALSE,FALSE,FALSE,FALSE,,,,FALSE,FALSE,FALSE,FALSE,FALSE,FALSE,FALSE,FALSE,FALSE,FALSE,,FALSE,FALSE,FALSE,FALSE,FALSE,FALSE,FALSE,FALSE,FALSE,FALSE,FALSE,FALSE,FALSE,FALSE,FALSE,FALSE,FALSE,,FALSE,FALSE,,,FALSE,FALSE,FALSE,FALSE,FALSE,,,SMD,2001-05-15T17:00:16,jhm,2002-10-08T08:53:06
C/EGD/1417,1417,EGD,-1,A/EGD/1403,13/2/1662,1962-02-13T00:00:00,13/2/1662,1962-02-13T00:00:00,,"Morison,Jonet",,,,,,,FALSE,FALSE,FALSE,FALSE,FALSE,FALSE,FALSE,FALSE,FALSE,FALSE,FALSE,FALSE,FALSE,FALSE,FALSE,FALSE,FALSE,FALSE,FALSE,FALSE,FALSE,FALSE,FALSE,FALSE,FALSE,FALSE,FALSE,FALSE,FALSE,FALSE,0,,TRUE,TRUE,FALSE,FALSE,0,no details about confession or accusations.,FALSE,,FALSE,,FALSE,FALSE,FALSE,FALSE,FALSE,FALSE,FALSE,,,,FALSE,FALSE,FALSE,FALSE,FALSE,FALSE,FALSE,FALSE,FALSE,FALSE,,FALSE,FALSE,FALSE,FALSE,FALSE,FALSE,FALSE,FALSE,FALSE,FALSE,FALSE,FALSE,FALSE,FALSE,FALSE,FALSE,FALSE,,FALSE,FALSE,,,FALSE,FALSE,FALSE,FALSE,FALSE,,,SMD,2001-05-15T17:00:16,jhm,2002-10-08T08:53:54
C/EGD/1418,1418,EGD,-1,A/EGD/1404,13/2/1662,1962-02-13T00:00:00,13/2/1662,1962-02-13T00:00:00,,"Lyon,Beatrix",,,,,,,FALSE,FALSE,FALSE,FALSE,FALSE,FALSE,FALSE,FALSE,FALSE,FALSE,FALSE,FALSE,FALSE,FALSE,FALSE,FALSE,FALSE,FALSE,FALSE,FALSE,FALSE,FALSE,FALSE,FALSE,FALSE,FALSE,FALSE,FALSE,FALSE,FALSE,0,,TRUE,TRUE,FALSE,FALSE,0,No details about confession or accusations.,FALSE,,FALSE,,FALSE,FALSE,FALSE,FALSE,FALSE,FALSE,FALSE,,,,FALSE,FALSE,FALSE,FALSE,FALSE,FALSE,FALSE,FALSE,FALSE,FALSE,,FALSE,FALSE,FALSE,FALSE,FALSE,FALSE,FALSE,FALSE,FALSE,FALSE,FALSE,FALSE,FALSE,FALSE,FALSE,FALSE,FALSE,,FALSE,FALSE,,,FALSE,FALSE,FALSE,FALSE,FALSE,,,SMD,2001-05-15T17:00:16,jhm,2002-10-08T08:54:47
C/EGD/1419,1419,EGD,-1,A/EGD/1405,16/1/1662,1962-01-16T00:00:00,1/4/1662,1962-04-01T00:00:00,,"Marshall,Issobell",,,,,,,FALSE,FALSE,FALSE,FALSE,FALSE,FALSE,FALSE,FALSE,FALSE,FALSE,FALSE,FALSE,FALSE,FALSE,FALSE,FALSE,FALSE,FALSE,FALSE,FALSE,FALSE,FALSE,FALSE,FALSE,FALSE,FALSE,FALSE,FALSE,FALSE,FALSE,0,,TRUE,TRUE,FALSE,FALSE,0,no details of confession or accusation,FALSE,,FALSE,,FALSE,FALSE,FALSE,FALSE,FALSE,FALSE,FALSE,,,,FALSE,FALSE,FALSE,FALSE,FALSE,FALSE,FALSE,FALSE,FALSE,FALSE,,FALSE,FALSE,FALSE,FALSE,FALSE,FALSE,FALSE,FALSE,FALSE,FALSE,FALSE,FALSE,FALSE,FALSE,FALSE,FALSE,FALSE,,FALSE,FALSE,,,FALSE,FALSE,FALSE,FALSE,FALSE,,,SMD,2001-05-15T17:00:16,jhm,2002-10-08T08:55:28
C/EGD/142,142,EGD,-1,A/EGD/131,3/9/1607,2007-09-03T00:00:00,18/12/1607,2007-12-18T00:00:00,61,"Patersoune,Bartie",,,,,,,FALSE,TRUE,FALSE,FALSE,FALSE,FALSE,FALSE,FALSE,FALSE,TRUE,TRUE,TRUE,FALSE,TRUE,FALSE,FALSE,FALSE,FALSE,FALSE,FALSE,FALSE,FALSE,FALSE,FALSE,FALSE,FALSE,FALSE,FALSE,FALSE,FALSE,5,,FALSE,FALSE,FALSE,FALSE,0,,FALSE,,FALSE,,FALSE,FALSE,FALSE,FALSE,FALSE,FALSE,FALSE,,,,TRUE,TRUE,TRUE,TRUE,FALSE,FALSE,FALSE,TRUE,TRUE,FALSE,"His patients had to repeat words.  He prescribed drinks and salves.  Patient had to go on his knees three nights in a row, three times a night to ask Jesus for his health.  He used Loch water from the Dow-Loche beside Drumlanrig.  Lots of charms in the name of the 'father, son and holy ghost'.  Pre-Reformation type religious ritual. The giving of remedies was done in the context of drinking ale at the pub, where a local woman was slandered for being a witch and causing an illness that Bartie healed.  He told the man to ask for his health from the woman.  JC26/5/2 has drawings of tables with Latin words laid out that I think Bartie used.  This document has lots of drawings and weird symbols, he could have been accused of learned magical practices.  He used letters and writings for healing.  A remedy for all women involved grinding almonds mixing them with egg whites and putting on their face.  For bleeding at the ???? -write letters on a knife and kill a beast. Lots of specific cures with specific letters and rituals",FALSE,TRUE,FALSE,FALSE,FALSE,FALSE,FALSE,FALSE,FALSE,TRUE,FALSE,FALSE,TRUE,TRUE,TRUE,TRUE,FALSE,Pretending to give medicine but really giving out poisonous drinks.,FALSE,FALSE,,,FALSE,FALSE,FALSE,FALSE,FALSE,,,SMD,2001-05-15T17:00:16,jhm,2002-11-13T16:19:56
C/EGD/1420,1420,EGD,-1,A/EGD/1406,16/1/1662,1962-01-16T00:00:00,1/4/1662,1962-04-01T00:00:00,,"McKessock,Issobell",,,,,,,FALSE,FALSE,FALSE,FALSE,FALSE,FALSE,FALSE,FALSE,FALSE,FALSE,FALSE,FALSE,FALSE,FALSE,FALSE,FALSE,FALSE,FALSE,FALSE,FALSE,FALSE,FALSE,FALSE,FALSE,FALSE,FALSE,FALSE,FALSE,FALSE,FALSE,0,,TRUE,TRUE,FALSE,FALSE,0,No details of confession or accusations.,FALSE,,FALSE,,FALSE,FALSE,FALSE,FALSE,FALSE,FALSE,FALSE,,,,FALSE,FALSE,FALSE,FALSE,FALSE,FALSE,FALSE,FALSE,FALSE,FALSE,,FALSE,FALSE,FALSE,FALSE,FALSE,FALSE,FALSE,FALSE,FALSE,FALSE,FALSE,FALSE,FALSE,FALSE,FALSE,FALSE,FALSE,,FALSE,FALSE,,,FALSE,FALSE,FALSE,FALSE,FALSE,,,SMD,2001-05-15T17:00:16,jhm,2002-10-08T09:07:28
C/EGD/1421,1421,EGD,-1,A/EGD/1407,16/1/1662,1962-01-16T00:00:00,1/4/1662,1962-04-01T00:00:00,,"Hougan,Eupham",,,,,,,FALSE,FALSE,FALSE,FALSE,FALSE,FALSE,FALSE,FALSE,FALSE,FALSE,FALSE,FALSE,FALSE,FALSE,FALSE,FALSE,FALSE,FALSE,FALSE,FALSE,FALSE,FALSE,FALSE,FALSE,FALSE,FALSE,FALSE,FALSE,FALSE,FALSE,0,,TRUE,TRUE,FALSE,FALSE,0,commission records that she had confessed to witchcraft but no details.,FALSE,,FALSE,,FALSE,FALSE,FALSE,FALSE,FALSE,FALSE,FALSE,,,,FALSE,FALSE,FALSE,FALSE,FALSE,FALSE,FALSE,FALSE,FALSE,FALSE,,FALSE,FALSE,FALSE,FALSE,FALSE,FALSE,FALSE,FALSE,FALSE,FALSE,FALSE,FALSE,FALSE,FALSE,FALSE,FALSE,FALSE,,FALSE,FALSE,,,FALSE,FALSE,FALSE,FALSE,FALSE,,,SMD,2001-05-15T17:00:16,LEM,2002-12-05T12:30:29
C/EGD/1422,1422,EGD,-1,A/EGD/1408,23/1/1662,1962-01-23T00:00:00,23/1/1662,1962-01-23T00:00:00,,"Lauson,Margaret",,,,,,,FALSE,FALSE,FALSE,FALSE,FALSE,FALSE,FALSE,FALSE,FALSE,FALSE,FALSE,FALSE,FALSE,FALSE,FALSE,FALSE,FALSE,FALSE,FALSE,FALSE,FALSE,FALSE,FALSE,FALSE,FALSE,FALSE,FALSE,FALSE,FALSE,FALSE,0,,TRUE,TRUE,FALSE,FALSE,0,Nothing about confession or accusations.,FALSE,,FALSE,,FALSE,FALSE,FALSE,FALSE,FALSE,FALSE,FALSE,,,,FALSE,FALSE,FALSE,FALSE,FALSE,FALSE,FALSE,FALSE,FALSE,FALSE,,FALSE,FALSE,FALSE,FALSE,FALSE,FALSE,FALSE,FALSE,FALSE,FALSE,FALSE,FALSE,FALSE,FALSE,FALSE,FALSE,FALSE,,FALSE,FALSE,,,FALSE,FALSE,FALSE,FALSE,FALSE,,,SMD,2001-05-15T17:00:16,jhm,2002-10-08T09:18:02
C/EGD/1423,1423,EGD,-1,A/EGD/1409,23/1/1662,1962-01-23T00:00:00,23/1/1662,1962-01-23T00:00:00,,"Cowan,William",,,,,,,FALSE,FALSE,FALSE,FALSE,FALSE,TRUE,FALSE,FALSE,FALSE,FALSE,FALSE,FALSE,FALSE,FALSE,FALSE,FALSE,FALSE,FALSE,FALSE,FALSE,FALSE,FALSE,FALSE,FALSE,FALSE,FALSE,FALSE,FALSE,FALSE,FALSE,1,,TRUE,TRUE,FALSE,FALSE,0,"Nothing about confession or accusation, but reference to demonic pact included in commission.",FALSE,Implied demonic pact: reference made to entering into paction in the commission but no details of what this intailed.,FALSE,,FALSE,FALSE,FALSE,FALSE,FALSE,FALSE,FALSE,,,,FALSE,FALSE,FALSE,FALSE,FALSE,FALSE,FALSE,FALSE,FALSE,FALSE,,FALSE,FALSE,FALSE,FALSE,FALSE,FALSE,FALSE,FALSE,FALSE,FALSE,FALSE,FALSE,FALSE,FALSE,FALSE,FALSE,FALSE,,FALSE,FALSE,,,FALSE,FALSE,FALSE,FALSE,FALSE,,,SMD,2001-05-15T17:00:16,jhm,2002-10-08T09:18:35
C/EGD/1424,1424,EGD,-1,A/EGD/1410,23/1/1662,1962-01-23T00:00:00,23/1/1662,1962-01-23T00:00:00,,"Murray,James",,,,,,,FALSE,FALSE,FALSE,FALSE,FALSE,TRUE,FALSE,FALSE,FALSE,FALSE,FALSE,FALSE,FALSE,FALSE,FALSE,FALSE,FALSE,FALSE,FALSE,FALSE,FALSE,FALSE,FALSE,FALSE,FALSE,FALSE,FALSE,FALSE,FALSE,FALSE,1,,TRUE,TRUE,FALSE,FALSE,0,No details from confession or accusations but demonic pact included in wording of commission.,FALSE,Pact implied as it was included in the wording of the commission but no specific details of what it entailed.,FALSE,,FALSE,FALSE,FALSE,FALSE,FALSE,FALSE,FALSE,,,,FALSE,FALSE,FALSE,FALSE,FALSE,FALSE,FALSE,FALSE,FALSE,FALSE,,FALSE,FALSE,FALSE,FALSE,FALSE,FALSE,FALSE,FALSE,FALSE,FALSE,FALSE,FALSE,FALSE,FALSE,FALSE,FALSE,FALSE,,FALSE,FALSE,,,FALSE,FALSE,FALSE,FALSE,FALSE,,,SMD,2001-05-15T17:00:16,jhm,2002-10-08T09:19:20
C/EGD/1425,1425,EGD,-1,A/EGD/1411,23/1/1662,1962-01-23T00:00:00,23/1/1662,1962-01-23T00:00:00,,"Crystie,Jonet",,,,,,,FALSE,FALSE,FALSE,FALSE,FALSE,FALSE,FALSE,FALSE,FALSE,FALSE,FALSE,FALSE,FALSE,FALSE,FALSE,FALSE,FALSE,FALSE,FALSE,FALSE,FALSE,FALSE,FALSE,FALSE,FALSE,FALSE,FALSE,FALSE,FALSE,FALSE,0,,TRUE,TRUE,FALSE,FALSE,0,no details of confession or accusations,FALSE,,FALSE,,FALSE,FALSE,FALSE,FALSE,FALSE,FALSE,FALSE,,,,FALSE,FALSE,FALSE,FALSE,FALSE,FALSE,FALSE,FALSE,FALSE,FALSE,,FALSE,FALSE,FALSE,FALSE,FALSE,FALSE,FALSE,FALSE,FALSE,FALSE,FALSE,FALSE,FALSE,FALSE,FALSE,FALSE,FALSE,,FALSE,FALSE,,,FALSE,FALSE,FALSE,FALSE,FALSE,,,SMD,2001-05-15T17:00:16,jhm,2002-10-08T09:20:36
C/EGD/1426,1426,EGD,-1,A/EGD/1412,23/1/1662,1962-01-23T00:00:00,23/1/1662,1962-01-23T00:00:00,,"Mathie,Margaret",,,,,,,FALSE,FALSE,FALSE,FALSE,FALSE,FALSE,FALSE,FALSE,FALSE,FALSE,FALSE,FALSE,FALSE,FALSE,FALSE,FALSE,FALSE,FALSE,FALSE,FALSE,FALSE,FALSE,FALSE,FALSE,FALSE,FALSE,FALSE,FALSE,FALSE,FALSE,0,,TRUE,TRUE,FALSE,FALSE,0,no details from confession or accusation,FALSE,,FALSE,,FALSE,FALSE,FALSE,FALSE,FALSE,FALSE,FALSE,,,,FALSE,FALSE,FALSE,FALSE,FALSE,FALSE,FALSE,FALSE,FALSE,FALSE,,FALSE,FALSE,FALSE,FALSE,FALSE,FALSE,FALSE,FALSE,FALSE,FALSE,FALSE,FALSE,FALSE,FALSE,FALSE,FALSE,FALSE,,FALSE,FALSE,,,FALSE,FALSE,FALSE,FALSE,FALSE,,,SMD,2001-05-15T17:00:16,jhm,2002-10-08T09:20:53
C/EGD/1427,1427,EGD,-1,A/EGD/1413,23/1/1662,1962-01-23T00:00:00,23/1/1662,1962-01-23T00:00:00,,"Dougleish,Jon",,,,,,,FALSE,FALSE,FALSE,FALSE,FALSE,FALSE,FALSE,FALSE,FALSE,FALSE,FALSE,FALSE,FALSE,FALSE,FALSE,FALSE,FALSE,FALSE,FALSE,FALSE,FALSE,FALSE,FALSE,FALSE,FALSE,FALSE,FALSE,FALSE,FALSE,FALSE,0,,TRUE,TRUE,FALSE,FALSE,0,Nothing about confession or accusations.,FALSE,,FALSE,,FALSE,FALSE,FALSE,FALSE,FALSE,FALSE,FALSE,,,,FALSE,FALSE,FALSE,FALSE,FALSE,FALSE,FALSE,FALSE,FALSE,FALSE,,FALSE,FALSE,FALSE,FALSE,FALSE,FALSE,FALSE,FALSE,FALSE,FALSE,FALSE,FALSE,FALSE,FALSE,FALSE,FALSE,FALSE,,FALSE,FALSE,,,FALSE,FALSE,FALSE,FALSE,FALSE,,,SMD,2001-05-15T17:00:16,jhm,2001-09-24T09:44:24
C/EGD/1428,1428,EGD,-1,A/EGD/1414,23/1/1662,1962-01-23T00:00:00,23/1/1662,1962-01-23T00:00:00,,"Edward,Jonet",,,,,,,FALSE,FALSE,FALSE,FALSE,FALSE,FALSE,FALSE,FALSE,FALSE,FALSE,FALSE,FALSE,FALSE,FALSE,FALSE,FALSE,FALSE,FALSE,FALSE,FALSE,FALSE,FALSE,FALSE,FALSE,FALSE,FALSE,FALSE,FALSE,FALSE,FALSE,0,,TRUE,TRUE,FALSE,FALSE,0,Nothing about confession or accusation.,FALSE,,FALSE,,FALSE,FALSE,FALSE,FALSE,FALSE,FALSE,FALSE,,,,FALSE,FALSE,FALSE,FALSE,FALSE,FALSE,FALSE,FALSE,FALSE,FALSE,,FALSE,FALSE,FALSE,FALSE,FALSE,FALSE,FALSE,FALSE,FALSE,FALSE,FALSE,FALSE,FALSE,FALSE,FALSE,FALSE,FALSE,,FALSE,FALSE,,,FALSE,FALSE,FALSE,FALSE,FALSE,,,SMD,2001-05-15T17:00:16,jhm,2002-10-08T09:21:59
C/EGD/1429,1429,EGD,-1,A/EGD/1415,23/1/1662,1962-01-23T00:00:00,23/1/1662,1962-01-23T00:00:00,,"Dryburgh,Margret",,,,,,,FALSE,FALSE,FALSE,FALSE,FALSE,FALSE,FALSE,FALSE,FALSE,FALSE,FALSE,FALSE,FALSE,FALSE,FALSE,FALSE,FALSE,FALSE,FALSE,FALSE,FALSE,FALSE,FALSE,FALSE,FALSE,FALSE,FALSE,FALSE,FALSE,FALSE,0,,TRUE,TRUE,FALSE,FALSE,0,Nothing about accusations or confession.,FALSE,,FALSE,,FALSE,FALSE,FALSE,FALSE,FALSE,FALSE,FALSE,,,,FALSE,FALSE,FALSE,FALSE,FALSE,FALSE,FALSE,FALSE,FALSE,FALSE,,FALSE,FALSE,FALSE,FALSE,FALSE,FALSE,FALSE,FALSE,FALSE,FALSE,FALSE,FALSE,FALSE,FALSE,FALSE,FALSE,FALSE,,FALSE,FALSE,,,FALSE,FALSE,FALSE,FALSE,FALSE,,,SMD,2001-05-15T17:00:16,jhm,2002-10-08T09:22:33
C/EGD/1430,1430,EGD,-1,A/EGD/1416,23/1/1662,1962-01-23T00:00:00,23/1/1662,1962-01-23T00:00:00,,"Young,Elspeth",,,,,,,FALSE,FALSE,FALSE,FALSE,FALSE,FALSE,FALSE,FALSE,FALSE,FALSE,FALSE,FALSE,FALSE,FALSE,FALSE,FALSE,FALSE,FALSE,FALSE,FALSE,FALSE,FALSE,FALSE,FALSE,FALSE,FALSE,FALSE,FALSE,FALSE,FALSE,0,,TRUE,TRUE,FALSE,FALSE,0,no details about confession or accusation,FALSE,,FALSE,,FALSE,FALSE,FALSE,FALSE,FALSE,FALSE,FALSE,,,,FALSE,FALSE,FALSE,FALSE,FALSE,FALSE,FALSE,FALSE,FALSE,FALSE,,FALSE,FALSE,FALSE,FALSE,FALSE,FALSE,FALSE,FALSE,FALSE,FALSE,FALSE,FALSE,FALSE,FALSE,FALSE,FALSE,FALSE,,FALSE,FALSE,,,FALSE,FALSE,FALSE,FALSE,FALSE,,,SMD,2001-05-15T17:00:16,jhm,2002-10-08T09:23:06
C/EGD/1431,1431,EGD,-1,A/EGD/1417,23/1/1662,1962-01-23T00:00:00,23/1/1662,1962-01-23T00:00:00,,"Bell,Margret",,,,,,,FALSE,FALSE,FALSE,FALSE,FALSE,FALSE,FALSE,FALSE,FALSE,FALSE,FALSE,FALSE,FALSE,FALSE,FALSE,FALSE,FALSE,FALSE,FALSE,FALSE,FALSE,FALSE,FALSE,FALSE,FALSE,FALSE,FALSE,FALSE,FALSE,FALSE,0,,TRUE,TRUE,FALSE,FALSE,0,Nothing about confession or accusations.,FALSE,,FALSE,,FALSE,FALSE,FALSE,FALSE,FALSE,FALSE,FALSE,,,,FALSE,FALSE,FALSE,FALSE,FALSE,FALSE,FALSE,FALSE,FALSE,FALSE,,FALSE,FALSE,FALSE,FALSE,FALSE,FALSE,FALSE,FALSE,FALSE,FALSE,FALSE,FALSE,FALSE,FALSE,FALSE,FALSE,FALSE,,FALSE,FALSE,,,FALSE,FALSE,FALSE,FALSE,FALSE,,,SMD,2001-05-15T17:00:16,jhm,2002-10-08T09:23:46
C/EGD/1432,1432,EGD,-1,A/EGD/1418,23/1/1662,1962-01-23T00:00:00,23/1/1662,1962-01-23T00:00:00,,"Bruce,Elspeth",,,,,,,FALSE,FALSE,FALSE,FALSE,FALSE,FALSE,FALSE,FALSE,FALSE,FALSE,FALSE,FALSE,FALSE,FALSE,FALSE,FALSE,FALSE,FALSE,FALSE,FALSE,FALSE,FALSE,FALSE,FALSE,FALSE,FALSE,FALSE,FALSE,FALSE,FALSE,0,,TRUE,TRUE,FALSE,FALSE,0,Nothing about confession or accusation.,FALSE,,FALSE,,FALSE,FALSE,FALSE,FALSE,FALSE,FALSE,FALSE,,,,FALSE,FALSE,FALSE,FALSE,FALSE,FALSE,FALSE,FALSE,FALSE,FALSE,,FALSE,FALSE,FALSE,FALSE,FALSE,FALSE,FALSE,FALSE,FALSE,FALSE,FALSE,FALSE,FALSE,FALSE,FALSE,FALSE,FALSE,,FALSE,FALSE,,,FALSE,FALSE,FALSE,FALSE,FALSE,,,SMD,2001-05-15T17:00:16,jhm,2002-10-08T09:24:23
C/EGD/1433,1433,EGD,-1,A/EGD/1419,23/1/1662,1962-01-23T00:00:00,23/1/1662,1962-01-23T00:00:00,,"Seatoun,Elspeth",,,,,,,FALSE,FALSE,FALSE,FALSE,FALSE,FALSE,FALSE,FALSE,FALSE,FALSE,FALSE,FALSE,FALSE,FALSE,FALSE,FALSE,FALSE,FALSE,FALSE,FALSE,FALSE,FALSE,FALSE,FALSE,FALSE,FALSE,FALSE,FALSE,FALSE,FALSE,0,,TRUE,TRUE,FALSE,FALSE,0,No details about confession or accusations.,FALSE,,FALSE,,FALSE,FALSE,FALSE,FALSE,FALSE,FALSE,FALSE,,,,FALSE,FALSE,FALSE,FALSE,FALSE,FALSE,FALSE,FALSE,FALSE,FALSE,,FALSE,FALSE,FALSE,FALSE,FALSE,FALSE,FALSE,FALSE,FALSE,FALSE,FALSE,FALSE,FALSE,FALSE,FALSE,FALSE,FALSE,,FALSE,FALSE,,,FALSE,FALSE,FALSE,FALSE,FALSE,,,SMD,2001-05-15T17:00:16,jhm,2002-10-08T09:25:25
C/EGD/1434,1434,EGD,-1,A/EGD/1420,23/1/1662,1962-01-23T00:00:00,23/1/1662,1962-01-23T00:00:00,,"Gray,Christian",,,,,,,FALSE,FALSE,FALSE,FALSE,FALSE,FALSE,FALSE,FALSE,FALSE,FALSE,FALSE,FALSE,FALSE,FALSE,FALSE,FALSE,FALSE,FALSE,FALSE,FALSE,FALSE,FALSE,FALSE,FALSE,FALSE,FALSE,FALSE,FALSE,FALSE,FALSE,0,,TRUE,TRUE,FALSE,FALSE,0,No details about confession or accusations.,FALSE,,FALSE,,FALSE,FALSE,FALSE,FALSE,FALSE,FALSE,FALSE,,,,FALSE,FALSE,FALSE,FALSE,FALSE,FALSE,FALSE,FALSE,FALSE,FALSE,,FALSE,FALSE,FALSE,FALSE,FALSE,FALSE,FALSE,FALSE,FALSE,FALSE,FALSE,FALSE,FALSE,FALSE,FALSE,FALSE,FALSE,,FALSE,FALSE,,,FALSE,FALSE,FALSE,FALSE,FALSE,,,SMD,2001-05-15T17:00:16,jhm,2002-10-08T09:27:02
C/EGD/1435,1435,EGD,-1,A/EGD/1421,23/1/1662,1962-01-23T00:00:00,23/1/1662,1962-01-23T00:00:00,,"Broune,Agnes",,,,,,,FALSE,FALSE,FALSE,FALSE,FALSE,FALSE,FALSE,FALSE,FALSE,FALSE,FALSE,FALSE,FALSE,FALSE,FALSE,FALSE,FALSE,FALSE,FALSE,FALSE,FALSE,FALSE,FALSE,FALSE,FALSE,FALSE,FALSE,FALSE,FALSE,FALSE,0,,TRUE,TRUE,FALSE,FALSE,0,No details about accusations or confession.,FALSE,,FALSE,,FALSE,FALSE,FALSE,FALSE,FALSE,FALSE,FALSE,,,,FALSE,FALSE,FALSE,FALSE,FALSE,FALSE,FALSE,FALSE,FALSE,FALSE,,FALSE,FALSE,FALSE,FALSE,FALSE,FALSE,FALSE,FALSE,FALSE,FALSE,FALSE,FALSE,FALSE,FALSE,FALSE,FALSE,FALSE,,FALSE,FALSE,,,FALSE,FALSE,FALSE,FALSE,FALSE,,,SMD,2001-05-15T17:00:16,jhm,2002-10-08T09:28:06
C/EGD/1436,1436,EGD,-1,A/EGD/1422,23/1/1662,1962-01-23T00:00:00,23/1/1662,1962-01-23T00:00:00,,"Broune,Jon",,,,,,,FALSE,FALSE,FALSE,FALSE,FALSE,FALSE,FALSE,FALSE,FALSE,FALSE,FALSE,FALSE,FALSE,FALSE,FALSE,FALSE,FALSE,FALSE,FALSE,FALSE,FALSE,FALSE,FALSE,FALSE,FALSE,FALSE,FALSE,FALSE,FALSE,FALSE,0,,TRUE,TRUE,FALSE,FALSE,0,Nothing about confession or accusations.,FALSE,,FALSE,,FALSE,FALSE,FALSE,FALSE,FALSE,FALSE,FALSE,,,,FALSE,FALSE,FALSE,FALSE,FALSE,FALSE,FALSE,FALSE,FALSE,FALSE,,FALSE,FALSE,FALSE,FALSE,FALSE,FALSE,FALSE,FALSE,FALSE,FALSE,FALSE,FALSE,FALSE,FALSE,FALSE,FALSE,FALSE,,FALSE,FALSE,,,FALSE,FALSE,FALSE,FALSE,FALSE,,,SMD,2001-05-15T17:00:16,jhm,2001-09-24T12:05:40
C/EGD/1437,1437,EGD,-1,A/EGD/1423,23/1/1662,1962-01-23T00:00:00,23/1/1662,1962-01-23T00:00:00,,"Simson,Christian",,,,,,,FALSE,FALSE,FALSE,FALSE,FALSE,TRUE,FALSE,FALSE,FALSE,FALSE,FALSE,FALSE,FALSE,FALSE,FALSE,FALSE,FALSE,FALSE,FALSE,FALSE,FALSE,FALSE,FALSE,FALSE,FALSE,FALSE,FALSE,FALSE,FALSE,FALSE,1,,TRUE,TRUE,FALSE,FALSE,0,No details from confession or accusation but reference made to entering paction in the commission.,FALSE,Demonic pact implied because it was mentioned in the wording of the commission.,FALSE,,FALSE,FALSE,FALSE,FALSE,FALSE,FALSE,FALSE,,,,FALSE,FALSE,FALSE,FALSE,FALSE,FALSE,FALSE,FALSE,FALSE,FALSE,,FALSE,FALSE,FALSE,FALSE,FALSE,FALSE,FALSE,FALSE,FALSE,FALSE,FALSE,FALSE,FALSE,FALSE,FALSE,FALSE,FALSE,,FALSE,FALSE,,,FALSE,FALSE,FALSE,FALSE,FALSE,,,SMD,2001-05-15T17:00:16,jhm,2002-10-08T09:29:40
C/EGD/1438,1438,EGD,-1,A/EGD/1424,23/1/1662,1962-01-23T00:00:00,23/1/1662,1962-01-23T00:00:00,,"Wentoun,Helen",,,,,,,FALSE,FALSE,FALSE,FALSE,FALSE,FALSE,FALSE,FALSE,FALSE,FALSE,FALSE,FALSE,FALSE,FALSE,FALSE,FALSE,FALSE,FALSE,FALSE,FALSE,FALSE,FALSE,FALSE,FALSE,FALSE,FALSE,FALSE,FALSE,FALSE,FALSE,0,,TRUE,TRUE,FALSE,FALSE,0,Nothing about confession or accusations.,FALSE,,FALSE,,FALSE,FALSE,FALSE,FALSE,FALSE,FALSE,FALSE,,,,FALSE,FALSE,FALSE,FALSE,FALSE,FALSE,FALSE,FALSE,FALSE,FALSE,,FALSE,FALSE,FALSE,FALSE,FALSE,FALSE,FALSE,FALSE,FALSE,FALSE,FALSE,FALSE,FALSE,FALSE,FALSE,FALSE,FALSE,,FALSE,FALSE,,,FALSE,FALSE,FALSE,FALSE,FALSE,,,SMD,2001-05-15T17:00:16,jhm,2002-10-08T09:30:33
C/EGD/1439,1439,EGD,-1,A/EGD/1425,23/1/1662,1962-01-23T00:00:00,23/1/1662,1962-01-23T00:00:00,,"Page,Issobell",,,,,,,FALSE,FALSE,FALSE,FALSE,FALSE,FALSE,FALSE,FALSE,FALSE,FALSE,FALSE,FALSE,FALSE,FALSE,FALSE,FALSE,FALSE,FALSE,FALSE,FALSE,FALSE,FALSE,FALSE,FALSE,FALSE,FALSE,FALSE,FALSE,FALSE,FALSE,0,,TRUE,TRUE,FALSE,FALSE,0,Nothing about confession or accustions.,FALSE,,FALSE,,FALSE,FALSE,FALSE,FALSE,FALSE,FALSE,FALSE,,,,FALSE,FALSE,FALSE,FALSE,FALSE,FALSE,FALSE,FALSE,FALSE,FALSE,,FALSE,FALSE,FALSE,FALSE,FALSE,FALSE,FALSE,FALSE,FALSE,FALSE,FALSE,FALSE,FALSE,FALSE,FALSE,FALSE,FALSE,,FALSE,FALSE,,,FALSE,FALSE,FALSE,FALSE,FALSE,,,SMD,2001-05-15T17:00:16,jhm,2002-10-08T09:31:42
C/EGD/144,144,EGD,-1,A/EGD/133,27/5/1608,2008-05-27T00:00:00,27/5/1608,2008-05-27T00:00:00,,"Tod,Cristiane",,,,,,,FALSE,FALSE,FALSE,FALSE,FALSE,FALSE,FALSE,FALSE,FALSE,FALSE,FALSE,FALSE,FALSE,FALSE,FALSE,FALSE,FALSE,TRUE,FALSE,FALSE,FALSE,FALSE,FALSE,FALSE,FALSE,FALSE,FALSE,FALSE,FALSE,FALSE,1,,TRUE,TRUE,FALSE,FALSE,0,,FALSE,"She was taken to the Devil by her sister.  Cristiane was initially afraid, but was reassured that they were going to see her sister.",FALSE,,FALSE,FALSE,FALSE,FALSE,FALSE,FALSE,FALSE,,,"The group met the Devil at Beigis' house for drinks.  They cast a cat to the Devil.  They met in the thorns near the iron gate of Seton and at the dam at Longniddry.  Also did a cat ritual at the gate of Seton.  Meetings described in B. Tod's documents, not by Cristiane herself.",FALSE,FALSE,FALSE,FALSE,FALSE,FALSE,FALSE,FALSE,FALSE,FALSE,"According to her sister Beigis Tod, they did rituals with a cat and named it Margaret.",FALSE,FALSE,FALSE,FALSE,FALSE,FALSE,FALSE,FALSE,FALSE,FALSE,FALSE,FALSE,FALSE,FALSE,FALSE,FALSE,FALSE,,FALSE,FALSE,,,FALSE,FALSE,FALSE,FALSE,FALSE,,,SMD,2001-05-15T17:00:16,LEM,2002-10-11T10:02:35
C/EGD/1461,1461,EGD,-1,A/EGD/1447,4/3/1662,1962-03-04T00:00:00,4/3/1662,1962-03-04T00:00:00,,"Proffit,Bessie",,,,,,,FALSE,FALSE,FALSE,FALSE,FALSE,TRUE,FALSE,FALSE,FALSE,FALSE,FALSE,FALSE,FALSE,FALSE,FALSE,FALSE,FALSE,FALSE,FALSE,FALSE,FALSE,FALSE,FALSE,FALSE,FALSE,FALSE,FALSE,FALSE,FALSE,FALSE,1,,TRUE,TRUE,FALSE,FALSE,0,Demonic pact confessed but no other details,FALSE,"Claimed that she had confessed to demonic pact, but no details.",FALSE,,FALSE,FALSE,FALSE,FALSE,FALSE,FALSE,FALSE,,,,FALSE,FALSE,FALSE,FALSE,FALSE,FALSE,FALSE,FALSE,FALSE,FALSE,,FALSE,FALSE,FALSE,FALSE,FALSE,FALSE,FALSE,FALSE,FALSE,FALSE,FALSE,FALSE,FALSE,FALSE,FALSE,FALSE,FALSE,,FALSE,FALSE,,,FALSE,FALSE,FALSE,FALSE,FALSE,,,SMD,2001-05-15T17:00:16,jhm,2002-10-08T10:27:56
C/EGD/1462,1462,EGD,-1,A/EGD/1448,4/3/1662,1962-03-04T00:00:00,4/3/1662,1962-03-04T00:00:00,,"Blyth,Elspeth",,,,,,,FALSE,FALSE,FALSE,FALSE,FALSE,TRUE,FALSE,FALSE,FALSE,FALSE,FALSE,FALSE,FALSE,FALSE,FALSE,FALSE,FALSE,FALSE,FALSE,FALSE,FALSE,FALSE,FALSE,FALSE,FALSE,FALSE,FALSE,FALSE,FALSE,FALSE,1,,TRUE,TRUE,FALSE,FALSE,0,Demonic pact confessed but no other details.,FALSE,Demonic pact confessed but no details.,FALSE,,FALSE,FALSE,FALSE,FALSE,FALSE,FALSE,FALSE,,,,FALSE,FALSE,FALSE,FALSE,FALSE,FALSE,FALSE,FALSE,FALSE,FALSE,,FALSE,FALSE,FALSE,FALSE,FALSE,FALSE,FALSE,FALSE,FALSE,FALSE,FALSE,FALSE,FALSE,FALSE,FALSE,FALSE,FALSE,,FALSE,FALSE,,,FALSE,FALSE,FALSE,FALSE,FALSE,,,SMD,2001-05-15T17:00:16,jhm,2002-10-08T10:29:36
C/EGD/1463,1463,EGD,-1,A/EGD/1449,4/3/1662,1962-03-04T00:00:00,4/3/1662,1962-03-04T00:00:00,,"Edingtoun,Margret",,,,,,,FALSE,FALSE,FALSE,FALSE,FALSE,TRUE,FALSE,FALSE,FALSE,FALSE,FALSE,FALSE,FALSE,FALSE,FALSE,FALSE,FALSE,FALSE,FALSE,FALSE,FALSE,FALSE,FALSE,FALSE,FALSE,FALSE,FALSE,FALSE,FALSE,FALSE,1,,TRUE,TRUE,FALSE,FALSE,0,Demonic pact confessed but no details,FALSE,Demonic pact but no details.,FALSE,,FALSE,FALSE,FALSE,FALSE,FALSE,FALSE,FALSE,,,,FALSE,FALSE,FALSE,FALSE,FALSE,FALSE,FALSE,FALSE,FALSE,FALSE,,FALSE,FALSE,FALSE,FALSE,FALSE,FALSE,FALSE,FALSE,FALSE,FALSE,FALSE,FALSE,FALSE,FALSE,FALSE,FALSE,FALSE,,FALSE,FALSE,,,FALSE,FALSE,FALSE,FALSE,FALSE,,,SMD,2001-05-15T17:00:16,jhm,2002-10-08T10:30:52
C/EGD/1464,1464,EGD,-1,A/EGD/1450,4/3/1662,1962-03-04T00:00:00,4/3/1662,1962-03-04T00:00:00,,"Wight,Hellen",,,,,,,FALSE,FALSE,FALSE,FALSE,FALSE,TRUE,FALSE,FALSE,FALSE,FALSE,FALSE,FALSE,FALSE,FALSE,FALSE,FALSE,FALSE,FALSE,FALSE,FALSE,FALSE,FALSE,FALSE,FALSE,FALSE,FALSE,FALSE,FALSE,FALSE,FALSE,1,,TRUE,TRUE,FALSE,FALSE,0,Demonic pact confessed but no details,FALSE,Demonic pact confessed but no details.,FALSE,,FALSE,FALSE,FALSE,FALSE,FALSE,FALSE,FALSE,,,,FALSE,FALSE,FALSE,FALSE,FALSE,FALSE,FALSE,FALSE,FALSE,FALSE,,FALSE,FALSE,FALSE,FALSE,FALSE,FALSE,FALSE,FALSE,FALSE,FALSE,FALSE,FALSE,FALSE,FALSE,FALSE,FALSE,FALSE,,FALSE,FALSE,,,FALSE,FALSE,FALSE,FALSE,FALSE,,,SMD,2001-05-15T17:00:16,jhm,2002-10-08T10:31:58
C/EGD/1465,1465,EGD,-1,A/EGD/1451,4/3/1662,1962-03-04T00:00:00,4/3/1662,1962-03-04T00:00:00,,"Robison,Margret",,,,,,,FALSE,FALSE,FALSE,FALSE,FALSE,TRUE,FALSE,FALSE,FALSE,FALSE,FALSE,FALSE,FALSE,FALSE,FALSE,FALSE,FALSE,FALSE,FALSE,FALSE,FALSE,FALSE,FALSE,FALSE,FALSE,FALSE,FALSE,FALSE,FALSE,FALSE,1,,TRUE,TRUE,FALSE,FALSE,0,Demonic pact confessed but no details.,FALSE,Demonic pact confessed but no details.,FALSE,,FALSE,FALSE,FALSE,FALSE,FALSE,FALSE,FALSE,,,,FALSE,FALSE,FALSE,FALSE,FALSE,FALSE,FALSE,FALSE,FALSE,FALSE,,FALSE,FALSE,FALSE,FALSE,FALSE,FALSE,FALSE,FALSE,FALSE,FALSE,FALSE,FALSE,FALSE,FALSE,FALSE,FALSE,FALSE,,FALSE,FALSE,,,FALSE,FALSE,FALSE,FALSE,FALSE,,,SMD,2001-05-15T17:00:16,jhm,2002-10-08T10:32:42
C/EGD/1466,1466,EGD,-1,A/EGD/1452,4/3/1662,1962-03-04T00:00:00,4/3/1662,1962-03-04T00:00:00,,"Burnett,Mareon",,,,,,,FALSE,FALSE,FALSE,FALSE,FALSE,TRUE,FALSE,FALSE,FALSE,FALSE,FALSE,FALSE,FALSE,FALSE,FALSE,FALSE,FALSE,FALSE,FALSE,FALSE,FALSE,FALSE,FALSE,FALSE,FALSE,FALSE,FALSE,FALSE,FALSE,FALSE,1,,TRUE,TRUE,FALSE,FALSE,0,Demonic pact confessed but no details.,FALSE,Demonic pact confessed but no details.,FALSE,,FALSE,FALSE,FALSE,FALSE,FALSE,FALSE,FALSE,,,,FALSE,FALSE,FALSE,FALSE,FALSE,FALSE,FALSE,FALSE,FALSE,FALSE,,FALSE,FALSE,FALSE,FALSE,FALSE,FALSE,FALSE,FALSE,FALSE,FALSE,FALSE,FALSE,FALSE,FALSE,FALSE,FALSE,FALSE,,FALSE,FALSE,,,FALSE,FALSE,FALSE,FALSE,FALSE,,,SMD,2001-05-15T17:00:16,jhm,2002-10-08T10:33:34
C/EGD/1467,1467,EGD,-1,A/EGD/1453,4/3/1662,1962-03-04T00:00:00,4/3/1662,1962-03-04T00:00:00,,"Bell,Elspeth",,,,,,,FALSE,FALSE,FALSE,FALSE,FALSE,TRUE,FALSE,FALSE,FALSE,FALSE,FALSE,FALSE,FALSE,FALSE,FALSE,FALSE,FALSE,FALSE,FALSE,FALSE,FALSE,FALSE,FALSE,FALSE,FALSE,FALSE,FALSE,FALSE,FALSE,FALSE,1,,TRUE,TRUE,FALSE,FALSE,0,Confessed to demonic pact but no other details.,FALSE,Demonic pact confessed but no details,FALSE,,FALSE,FALSE,FALSE,FALSE,FALSE,FALSE,FALSE,,,,FALSE,FALSE,FALSE,FALSE,FALSE,FALSE,FALSE,FALSE,FALSE,FALSE,,FALSE,FALSE,FALSE,FALSE,FALSE,FALSE,FALSE,FALSE,FALSE,FALSE,FALSE,FALSE,FALSE,FALSE,FALSE,FALSE,FALSE,,FALSE,FALSE,,,FALSE,FALSE,FALSE,FALSE,FALSE,,,SMD,2001-05-15T17:00:16,jhm,2002-10-08T10:34:11
C/EGD/1468,1468,EGD,-1,A/EGD/1454,4/3/1662,1962-03-04T00:00:00,4/3/1662,1962-03-04T00:00:00,,"Jonstoun,Margret",,,,,,,FALSE,FALSE,FALSE,FALSE,FALSE,TRUE,FALSE,FALSE,FALSE,FALSE,FALSE,FALSE,FALSE,FALSE,FALSE,FALSE,FALSE,FALSE,FALSE,FALSE,FALSE,FALSE,FALSE,FALSE,FALSE,FALSE,FALSE,FALSE,FALSE,FALSE,1,,TRUE,TRUE,FALSE,FALSE,0,Confessed to demonic pact but no details.,FALSE,Demonic pact confessed but no details.,FALSE,,FALSE,FALSE,FALSE,FALSE,FALSE,FALSE,FALSE,,,,FALSE,FALSE,FALSE,FALSE,FALSE,FALSE,FALSE,FALSE,FALSE,FALSE,,FALSE,FALSE,FALSE,FALSE,FALSE,FALSE,FALSE,FALSE,FALSE,FALSE,FALSE,FALSE,FALSE,FALSE,FALSE,FALSE,FALSE,,FALSE,FALSE,,,FALSE,FALSE,FALSE,FALSE,FALSE,,,SMD,2001-05-15T17:00:16,jhm,2002-10-08T10:34:55
C/EGD/1469,1469,EGD,-1,A/EGD/1455,4/3/1662,1962-03-04T00:00:00,4/3/1662,1962-03-04T00:00:00,,"Hay,Elspeth",,,,,,,FALSE,FALSE,FALSE,FALSE,FALSE,TRUE,FALSE,FALSE,FALSE,FALSE,FALSE,FALSE,FALSE,FALSE,FALSE,FALSE,FALSE,FALSE,FALSE,FALSE,FALSE,FALSE,FALSE,FALSE,FALSE,FALSE,FALSE,FALSE,FALSE,FALSE,1,,TRUE,TRUE,FALSE,FALSE,0,Confessed to demonic pact but no details.,FALSE,Demonic pact confessed but no details.,FALSE,,FALSE,FALSE,FALSE,FALSE,FALSE,FALSE,FALSE,,,,FALSE,FALSE,FALSE,FALSE,FALSE,FALSE,FALSE,FALSE,FALSE,FALSE,,FALSE,FALSE,FALSE,FALSE,FALSE,FALSE,FALSE,FALSE,FALSE,FALSE,FALSE,FALSE,FALSE,FALSE,FALSE,FALSE,FALSE,,FALSE,FALSE,,,FALSE,FALSE,FALSE,FALSE,FALSE,,,SMD,2001-05-15T17:00:16,jhm,2002-10-08T10:35:52
C/EGD/147,147,EGD,-1,A/EGD/136,27/1/1591,1991-01-27T00:00:00,27/5/1608,2008-05-27T00:00:00,39,"Tod,Beigis",,,,,,,FALSE,TRUE,FALSE,FALSE,FALSE,TRUE,FALSE,FALSE,FALSE,TRUE,FALSE,FALSE,FALSE,TRUE,FALSE,FALSE,FALSE,TRUE,FALSE,TRUE,FALSE,FALSE,FALSE,FALSE,FALSE,FALSE,FALSE,TRUE,FALSE,FALSE,7,,TRUE,TRUE,FALSE,FALSE,0,"The treason charge and bein and implicated by another witch happened in 1591.  Part of the North Berwick witch hunt.  It involved many people and many accustions about witches meetings, specifically two separate attempts to sink the royal ships.  The first to sink Queen Anne on her way home, second to trouble King James after he went to get her in Denmark.  I think her original accusation stemmed from this episode.",FALSE,,TRUE,,TRUE,TRUE,FALSE,FALSE,FALSE,FALSE,FALSE,,,The group met the Devil at Beigis' house for drinks. They met in the thorns near the iron gate of Seton. Also did a cat ritual at the gate of Seton and cast ot to the Devil.  Was accused of meeting at the Salt pans in 1591 as part of the North Berwick hunt.,FALSE,FALSE,TRUE,TRUE,FALSE,FALSE,FALSE,TRUE,TRUE,FALSE,They did rituals with a cat and named it Margaret.,TRUE,TRUE,FALSE,FALSE,FALSE,FALSE,FALSE,FALSE,TRUE,FALSE,TRUE,TRUE,FALSE,FALSE,FALSE,FALSE,FALSE,,TRUE,TRUE,,,FALSE,FALSE,FALSE,FALSE,FALSE,,,SMD,2001-05-15T17:00:16,LEM,2002-11-11T13:01:42
C/EGD/1470,1470,EGD,-1,A/EGD/1456,4/3/1662,1962-03-04T00:00:00,4/3/1662,1962-03-04T00:00:00,,"Lauson,Jonet",,,,,,,FALSE,FALSE,FALSE,FALSE,FALSE,TRUE,FALSE,FALSE,FALSE,FALSE,FALSE,FALSE,FALSE,FALSE,FALSE,FALSE,FALSE,FALSE,FALSE,FALSE,FALSE,FALSE,FALSE,FALSE,FALSE,FALSE,FALSE,FALSE,FALSE,FALSE,1,,TRUE,TRUE,FALSE,FALSE,0,"Demonic included as she may have confessed to it, but no details.",FALSE,,FALSE,,FALSE,FALSE,FALSE,FALSE,FALSE,FALSE,FALSE,,,,FALSE,FALSE,FALSE,FALSE,FALSE,FALSE,FALSE,FALSE,FALSE,FALSE,,FALSE,FALSE,FALSE,FALSE,FALSE,FALSE,FALSE,FALSE,FALSE,FALSE,FALSE,FALSE,FALSE,FALSE,FALSE,FALSE,FALSE,,FALSE,FALSE,,,FALSE,FALSE,FALSE,FALSE,FALSE,,,SMD,2001-05-15T17:00:16,jhm,2002-10-08T10:51:14
C/EGD/1471,1471,EGD,-1,A/EGD/1457,4/3/1662,1962-03-04T00:00:00,4/3/1662,1962-03-04T00:00:00,,"Lausoun,Issobell",,,,,,,FALSE,FALSE,FALSE,FALSE,FALSE,TRUE,FALSE,FALSE,FALSE,FALSE,FALSE,FALSE,FALSE,FALSE,FALSE,FALSE,FALSE,FALSE,FALSE,FALSE,FALSE,FALSE,FALSE,FALSE,FALSE,FALSE,FALSE,FALSE,FALSE,FALSE,1,,TRUE,TRUE,FALSE,FALSE,0,Demonic included as some of the others confessed to pact and it was likely to have been implied in her case.,FALSE,,FALSE,,FALSE,FALSE,FALSE,FALSE,FALSE,FALSE,FALSE,,,,FALSE,FALSE,FALSE,FALSE,FALSE,FALSE,FALSE,FALSE,FALSE,FALSE,,FALSE,FALSE,FALSE,FALSE,FALSE,FALSE,FALSE,FALSE,FALSE,FALSE,FALSE,FALSE,FALSE,FALSE,FALSE,FALSE,FALSE,,FALSE,FALSE,,,FALSE,FALSE,FALSE,FALSE,FALSE,,,SMD,2001-05-15T17:00:16,jhm,2002-10-08T10:51:02
C/EGD/1472,1472,EGD,-1,A/EGD/1458,1/4/1662,1962-04-01T00:00:00,1/4/1662,1962-04-01T00:00:00,,"Gray,Unknown",,,,,,,FALSE,FALSE,FALSE,FALSE,FALSE,FALSE,FALSE,FALSE,FALSE,FALSE,FALSE,FALSE,FALSE,FALSE,FALSE,FALSE,FALSE,FALSE,FALSE,FALSE,FALSE,FALSE,FALSE,FALSE,FALSE,FALSE,FALSE,FALSE,FALSE,FALSE,0,,TRUE,TRUE,FALSE,FALSE,0,,FALSE,,FALSE,,FALSE,FALSE,FALSE,FALSE,FALSE,FALSE,FALSE,,,,FALSE,FALSE,FALSE,FALSE,FALSE,FALSE,FALSE,FALSE,FALSE,FALSE,,FALSE,FALSE,FALSE,FALSE,FALSE,FALSE,FALSE,FALSE,FALSE,FALSE,FALSE,FALSE,FALSE,FALSE,FALSE,FALSE,FALSE,,FALSE,FALSE,,,FALSE,FALSE,FALSE,FALSE,FALSE,,,SMD,2001-05-15T17:00:16,jhm,2002-11-21T13:50:04
C/EGD/1473,1473,EGD,-1,A/EGD/1459,1/4/1662,1962-04-01T00:00:00,1/4/1662,1962-04-01T00:00:00,,"Scrogges,Jonet",,,,,,,FALSE,FALSE,FALSE,FALSE,FALSE,FALSE,FALSE,FALSE,FALSE,FALSE,FALSE,FALSE,FALSE,FALSE,FALSE,FALSE,FALSE,FALSE,FALSE,FALSE,FALSE,FALSE,FALSE,FALSE,FALSE,FALSE,FALSE,FALSE,FALSE,FALSE,0,,TRUE,TRUE,FALSE,FALSE,0,,FALSE,,FALSE,,FALSE,FALSE,FALSE,FALSE,FALSE,FALSE,FALSE,,,,FALSE,FALSE,FALSE,FALSE,FALSE,FALSE,FALSE,FALSE,FALSE,FALSE,,FALSE,FALSE,FALSE,FALSE,FALSE,FALSE,FALSE,FALSE,FALSE,FALSE,FALSE,FALSE,FALSE,FALSE,FALSE,FALSE,FALSE,,FALSE,FALSE,,,FALSE,FALSE,FALSE,FALSE,FALSE,,,SMD,2001-05-15T17:00:16,jhm,2002-10-08T10:54:06
C/EGD/1474,1474,EGD,-1,A/EGD/1460,14/4/1662,1962-04-14T00:00:00,10/7/1662,1962-07-10T00:00:00,,"Braidheid,Jonet",,,,,,,FALSE,FALSE,FALSE,FALSE,TRUE,TRUE,FALSE,FALSE,FALSE,TRUE,FALSE,FALSE,FALSE,TRUE,FALSE,FALSE,FALSE,FALSE,FALSE,FALSE,FALSE,FALSE,FALSE,FALSE,FALSE,FALSE,FALSE,FALSE,FALSE,FALSE,4,,FALSE,FALSE,FALSE,FALSE,0,She named over 44 people of being at a witches' meeting including her husband and mother-in-law.,FALSE,The Devil sucked her blood out of the spot where she was marked.  [possible vampire?].  He spouted it out of his mouth and sprinkled it over her head to baptise her 'Christian'.  She said he was as cold as spring well water inside of her.  The Devil gave her money which turned red and saw her repeatedly.  He paid her after sex.,TRUE,,TRUE,TRUE,FALSE,FALSE,TRUE,FALSE,FALSE,,,"She confessed to a large meeting in the kirk of Nairn at night.  The Devil was sitting in the reader's desk with a book.  The Devil called all their names out of a book and her husband, who was the officer, called them at the door.  Her husband and another woman held her up to the Devil.  They took meat and corn from people to eat.  They filled a sheep's bag with cooked meat to kill and destroy the Laird of Park and Lochloy.",TRUE,FALSE,FALSE,TRUE,FALSE,FALSE,FALSE,FALSE,TRUE,FALSE,Used dog flesh and sheep flesh to make drugs (enchanted charms).  They left cooked flesh bits sprinkled all over the gates and property of two Lairds from the area (Park and Lochloy) in an attempt to destroy them and their posterity.  They also made a picture of clay of the Laird of Park.  They prayed to the Devil and burned the image.,FALSE,TRUE,TRUE,TRUE,FALSE,FALSE,FALSE,FALSE,FALSE,FALSE,FALSE,FALSE,FALSE,FALSE,FALSE,FALSE,FALSE,Took away corn and killed animals and the proprietor.  Did collective maleficium to kill and destroy local lairds.,TRUE,FALSE,,,FALSE,FALSE,FALSE,FALSE,FALSE,,,SMD,2001-05-15T17:00:16,jhm,2002-10-08T10:59:41
C/EGD/1475,1475,EGD,-1,A/EGD/1461,1/4/1662,1962-04-01T00:00:00,1/4/1662,1962-04-01T00:00:00,,"Vallandge,Cristian",,,,,,,FALSE,FALSE,FALSE,FALSE,FALSE,FALSE,FALSE,FALSE,FALSE,FALSE,FALSE,FALSE,FALSE,FALSE,FALSE,FALSE,FALSE,FALSE,FALSE,FALSE,FALSE,FALSE,FALSE,FALSE,FALSE,FALSE,FALSE,FALSE,FALSE,FALSE,0,,TRUE,TRUE,FALSE,FALSE,0,,FALSE,,FALSE,,FALSE,FALSE,FALSE,FALSE,FALSE,FALSE,FALSE,,,,FALSE,FALSE,FALSE,FALSE,FALSE,FALSE,FALSE,FALSE,FALSE,FALSE,,FALSE,FALSE,FALSE,FALSE,FALSE,FALSE,FALSE,FALSE,FALSE,FALSE,FALSE,FALSE,FALSE,FALSE,FALSE,FALSE,FALSE,,FALSE,FALSE,,,FALSE,FALSE,FALSE,FALSE,FALSE,,,SMD,2001-05-15T17:00:16,jhm,2002-10-08T11:00:20
C/EGD/1476,1476,EGD,-1,A/EGD/1462,1/4/1662,1962-04-01T00:00:00,1/4/1662,1962-04-01T00:00:00,,"Tod,Elspeth",,,,,,,FALSE,FALSE,FALSE,FALSE,FALSE,FALSE,FALSE,FALSE,FALSE,FALSE,FALSE,FALSE,FALSE,FALSE,FALSE,FALSE,FALSE,FALSE,FALSE,FALSE,FALSE,FALSE,FALSE,FALSE,FALSE,FALSE,FALSE,FALSE,FALSE,FALSE,0,,TRUE,TRUE,FALSE,FALSE,0,,FALSE,,FALSE,,FALSE,FALSE,FALSE,FALSE,FALSE,FALSE,FALSE,,,,FALSE,FALSE,FALSE,FALSE,FALSE,FALSE,FALSE,FALSE,FALSE,FALSE,,FALSE,FALSE,FALSE,FALSE,FALSE,FALSE,FALSE,FALSE,FALSE,FALSE,FALSE,FALSE,FALSE,FALSE,FALSE,FALSE,FALSE,,FALSE,FALSE,,,FALSE,FALSE,FALSE,FALSE,FALSE,,,SMD,2001-05-15T17:00:16,jhm,2002-10-08T11:01:28
C/EGD/1477,1477,EGD,-1,A/EGD/1463,1/4/1662,1962-04-01T00:00:00,1/4/1662,1962-04-01T00:00:00,,"Bowar,Kathrin",,,,,,,FALSE,FALSE,FALSE,FALSE,FALSE,FALSE,FALSE,FALSE,FALSE,FALSE,FALSE,FALSE,FALSE,FALSE,FALSE,FALSE,FALSE,FALSE,FALSE,FALSE,FALSE,FALSE,FALSE,FALSE,FALSE,FALSE,FALSE,FALSE,FALSE,FALSE,0,,TRUE,TRUE,FALSE,FALSE,0,,FALSE,,FALSE,,FALSE,FALSE,FALSE,FALSE,FALSE,FALSE,FALSE,,,,FALSE,FALSE,FALSE,FALSE,FALSE,FALSE,FALSE,FALSE,FALSE,FALSE,,FALSE,FALSE,FALSE,FALSE,FALSE,FALSE,FALSE,FALSE,FALSE,FALSE,FALSE,FALSE,FALSE,FALSE,FALSE,FALSE,FALSE,,FALSE,FALSE,,,FALSE,FALSE,FALSE,FALSE,FALSE,,,SMD,2001-05-15T17:00:16,jhm,2002-10-08T11:15:42
C/EGD/1478,1478,EGD,-1,A/EGD/1464,2/4/1662,1962-04-02T00:00:00,2/4/1662,1962-04-02T00:00:00,,"Simson,Bessie",,,,,,,FALSE,FALSE,FALSE,FALSE,FALSE,FALSE,FALSE,FALSE,FALSE,FALSE,FALSE,FALSE,FALSE,FALSE,FALSE,FALSE,FALSE,FALSE,FALSE,FALSE,FALSE,FALSE,FALSE,FALSE,FALSE,FALSE,FALSE,FALSE,FALSE,FALSE,0,,TRUE,TRUE,FALSE,FALSE,0,,FALSE,,FALSE,,FALSE,FALSE,FALSE,FALSE,FALSE,FALSE,FALSE,,,,FALSE,FALSE,FALSE,FALSE,FALSE,FALSE,FALSE,FALSE,FALSE,FALSE,,FALSE,FALSE,FALSE,FALSE,FALSE,FALSE,FALSE,FALSE,FALSE,FALSE,FALSE,FALSE,FALSE,FALSE,FALSE,FALSE,FALSE,,FALSE,FALSE,,,FALSE,FALSE,FALSE,FALSE,FALSE,,,SMD,2001-05-15T17:00:16,jhm,2002-10-08T11:18:28
C/EGD/1479,1479,EGD,-1,A/EGD/1465,2/4/1662,1962-04-02T00:00:00,2/4/1662,1962-04-02T00:00:00,,"Blak,Kathrin",,,,,,,FALSE,FALSE,FALSE,FALSE,FALSE,FALSE,FALSE,FALSE,FALSE,FALSE,FALSE,FALSE,FALSE,FALSE,FALSE,FALSE,FALSE,FALSE,FALSE,FALSE,FALSE,FALSE,FALSE,FALSE,FALSE,FALSE,FALSE,FALSE,FALSE,FALSE,0,,TRUE,TRUE,FALSE,FALSE,0,,FALSE,,FALSE,,FALSE,FALSE,FALSE,FALSE,FALSE,FALSE,FALSE,,,,FALSE,FALSE,FALSE,FALSE,FALSE,FALSE,FALSE,FALSE,FALSE,FALSE,,FALSE,FALSE,FALSE,FALSE,FALSE,FALSE,FALSE,FALSE,FALSE,FALSE,FALSE,FALSE,FALSE,FALSE,FALSE,FALSE,FALSE,,FALSE,FALSE,,,FALSE,FALSE,FALSE,FALSE,FALSE,,,SMD,2001-05-15T17:00:16,jhm,2001-10-04T10:46:35
C/EGD/148,148,EGD,-1,A/EGD/137,9/11/1609,2009-11-09T00:00:00,1/2/1610,2010-02-01T00:00:00,,"Mure,James",,,,,,,FALSE,FALSE,FALSE,FALSE,FALSE,FALSE,FALSE,FALSE,FALSE,FALSE,FALSE,FALSE,FALSE,FALSE,FALSE,FALSE,FALSE,FALSE,FALSE,FALSE,FALSE,FALSE,FALSE,FALSE,FALSE,FALSE,FALSE,FALSE,TRUE,TRUE,2,enchanted drink,FALSE,FALSE,FALSE,FALSE,0,He was accused of giving Margaret witch an enchanted drink.  He was charged with taking away her will with a drink.,FALSE,,FALSE,,FALSE,FALSE,FALSE,FALSE,FALSE,FALSE,FALSE,,,,FALSE,FALSE,FALSE,FALSE,FALSE,FALSE,FALSE,FALSE,FALSE,FALSE,Accused of giving a woman an enchanted drink in order to bewitch her.,FALSE,FALSE,FALSE,FALSE,FALSE,FALSE,FALSE,FALSE,FALSE,FALSE,FALSE,FALSE,FALSE,FALSE,FALSE,FALSE,FALSE,,FALSE,FALSE,,,FALSE,FALSE,FALSE,FALSE,FALSE,,,SMD,2001-05-15T17:00:16,jhm,2002-10-08T11:22:45
C/EGD/1480,1480,EGD,-1,A/EGD/1466,2/4/1662,1962-04-02T00:00:00,2/4/1662,1962-04-02T00:00:00,,"Anderson,Elspeth",,,,,,,FALSE,FALSE,FALSE,FALSE,FALSE,FALSE,FALSE,FALSE,FALSE,FALSE,FALSE,FALSE,FALSE,FALSE,FALSE,FALSE,FALSE,FALSE,FALSE,FALSE,FALSE,FALSE,FALSE,FALSE,FALSE,FALSE,FALSE,FALSE,FALSE,FALSE,0,,TRUE,TRUE,FALSE,FALSE,0,,FALSE,,FALSE,,FALSE,FALSE,FALSE,FALSE,FALSE,FALSE,FALSE,,,,FALSE,FALSE,FALSE,FALSE,FALSE,FALSE,FALSE,FALSE,FALSE,FALSE,,FALSE,FALSE,FALSE,FALSE,FALSE,FALSE,FALSE,FALSE,FALSE,FALSE,FALSE,FALSE,FALSE,FALSE,FALSE,FALSE,FALSE,,FALSE,FALSE,,,FALSE,FALSE,FALSE,FALSE,FALSE,,,SMD,2001-05-15T17:00:16,jhm,2002-10-08T11:23:14
C/EGD/1481,1481,EGD,-1,A/EGD/1467,3/4/1662,1962-04-03T00:00:00,3/4/1662,1962-04-03T00:00:00,,"Rutherford,Isabel",,,,,,,FALSE,FALSE,FALSE,FALSE,FALSE,FALSE,FALSE,FALSE,FALSE,FALSE,FALSE,FALSE,FALSE,FALSE,FALSE,FALSE,FALSE,FALSE,FALSE,FALSE,FALSE,FALSE,FALSE,FALSE,FALSE,FALSE,FALSE,FALSE,FALSE,FALSE,0,,TRUE,TRUE,FALSE,FALSE,0,,FALSE,,FALSE,,FALSE,FALSE,FALSE,FALSE,FALSE,FALSE,FALSE,,,,FALSE,FALSE,FALSE,FALSE,FALSE,FALSE,FALSE,FALSE,FALSE,FALSE,,FALSE,FALSE,FALSE,FALSE,FALSE,FALSE,FALSE,FALSE,FALSE,FALSE,FALSE,FALSE,FALSE,FALSE,FALSE,FALSE,FALSE,,FALSE,FALSE,,,FALSE,FALSE,FALSE,FALSE,FALSE,,The project did not check Larner's reference to this printed secondary source as part of the research.,SMD,2001-05-15T17:00:16,jhm,2002-10-08T11:26:21
C/EGD/1482,1482,EGD,-1,A/EGD/1468,3/4/1662,1962-04-03T00:00:00,3/4/1662,1962-04-03T00:00:00,,"Hendersone,Bessie",,,,,,,FALSE,FALSE,FALSE,FALSE,FALSE,FALSE,FALSE,FALSE,FALSE,FALSE,FALSE,FALSE,FALSE,FALSE,FALSE,FALSE,FALSE,FALSE,FALSE,FALSE,FALSE,FALSE,FALSE,FALSE,FALSE,FALSE,FALSE,FALSE,FALSE,FALSE,0,,TRUE,TRUE,FALSE,FALSE,0,,FALSE,,FALSE,,FALSE,FALSE,FALSE,FALSE,FALSE,FALSE,FALSE,,,,FALSE,FALSE,FALSE,FALSE,FALSE,FALSE,FALSE,FALSE,FALSE,FALSE,,FALSE,FALSE,FALSE,FALSE,FALSE,FALSE,FALSE,FALSE,FALSE,FALSE,FALSE,FALSE,FALSE,FALSE,FALSE,FALSE,FALSE,,FALSE,FALSE,,,FALSE,FALSE,FALSE,FALSE,FALSE,,The project did not check Larner's reference to this printed secondary source as part of the research.,SMD,2001-05-15T17:00:16,jhm,2002-10-08T11:27:24
C/EGD/1483,1483,EGD,-1,A/EGD/1469,3/4/1662,1962-04-03T00:00:00,3/4/1662,1962-04-03T00:00:00,,"Murie,Agnes",,,,,,,FALSE,FALSE,FALSE,FALSE,FALSE,FALSE,FALSE,FALSE,FALSE,FALSE,FALSE,FALSE,FALSE,FALSE,FALSE,FALSE,FALSE,FALSE,FALSE,FALSE,FALSE,FALSE,FALSE,FALSE,FALSE,FALSE,FALSE,FALSE,FALSE,FALSE,0,,TRUE,TRUE,FALSE,FALSE,0,,FALSE,,FALSE,,FALSE,FALSE,FALSE,FALSE,FALSE,FALSE,FALSE,,,,FALSE,FALSE,FALSE,FALSE,FALSE,FALSE,FALSE,FALSE,FALSE,FALSE,,FALSE,FALSE,FALSE,FALSE,FALSE,FALSE,FALSE,FALSE,FALSE,FALSE,FALSE,FALSE,FALSE,FALSE,FALSE,FALSE,FALSE,,FALSE,FALSE,,,FALSE,FALSE,FALSE,FALSE,FALSE,,The project did not check Larner's reference to this printed secondary source as part of the research.,SMD,2001-05-15T17:00:16,jhm,2002-10-08T11:27:58
C/EGD/1484,1484,EGD,-1,A/EGD/1470,23/4/1662,1962-04-23T00:00:00,5/5/1662,1962-05-05T00:00:00,,"Paton,Janet",,,,,,,FALSE,FALSE,FALSE,FALSE,FALSE,FALSE,FALSE,FALSE,FALSE,FALSE,FALSE,FALSE,FALSE,FALSE,FALSE,FALSE,FALSE,FALSE,FALSE,FALSE,FALSE,FALSE,FALSE,FALSE,FALSE,FALSE,FALSE,FALSE,FALSE,FALSE,0,,TRUE,TRUE,FALSE,FALSE,0,,FALSE,,FALSE,,FALSE,FALSE,FALSE,FALSE,FALSE,FALSE,FALSE,,,,FALSE,FALSE,FALSE,FALSE,FALSE,FALSE,FALSE,FALSE,FALSE,FALSE,,FALSE,FALSE,FALSE,FALSE,FALSE,FALSE,FALSE,FALSE,FALSE,FALSE,FALSE,FALSE,FALSE,FALSE,FALSE,FALSE,FALSE,,FALSE,FALSE,,,FALSE,FALSE,FALSE,FALSE,FALSE,,The project did not check Larner's reference to this printed secondary source as part of the research.,SMD,2001-05-15T17:00:16,jhm,2002-10-08T11:28:19
C/EGD/1485,1485,EGD,-1,A/EGD/1471,23/4/1662,1962-04-23T00:00:00,23/4/1662,1962-04-23T00:00:00,,"Lister,Margaret",,,,,,,FALSE,FALSE,FALSE,FALSE,FALSE,FALSE,FALSE,FALSE,FALSE,FALSE,FALSE,FALSE,FALSE,FALSE,FALSE,FALSE,FALSE,FALSE,FALSE,FALSE,FALSE,FALSE,FALSE,FALSE,FALSE,FALSE,FALSE,FALSE,FALSE,FALSE,0,,TRUE,TRUE,FALSE,FALSE,0,,FALSE,,FALSE,,FALSE,FALSE,FALSE,FALSE,FALSE,FALSE,FALSE,,,,FALSE,FALSE,FALSE,FALSE,FALSE,FALSE,FALSE,FALSE,FALSE,FALSE,,FALSE,FALSE,FALSE,FALSE,FALSE,FALSE,FALSE,FALSE,FALSE,FALSE,FALSE,FALSE,FALSE,FALSE,FALSE,FALSE,FALSE,,FALSE,FALSE,,,FALSE,FALSE,FALSE,FALSE,FALSE,,The project did not check Larner's reference to this printed secondary source as part of the research.,SMD,2001-05-15T17:00:16,jhm,2002-10-08T11:28:36
C/EGD/1486,1486,EGD,-1,A/EGD/1472,23/4/1662,1962-04-23T00:00:00,23/4/1662,1962-04-23T00:00:00,,"Neil,Bessie",,,,,,,FALSE,FALSE,FALSE,FALSE,FALSE,FALSE,FALSE,FALSE,FALSE,FALSE,FALSE,FALSE,FALSE,FALSE,FALSE,FALSE,FALSE,FALSE,FALSE,FALSE,FALSE,FALSE,FALSE,FALSE,FALSE,FALSE,FALSE,FALSE,FALSE,FALSE,0,,TRUE,TRUE,FALSE,FALSE,0,,FALSE,,FALSE,,FALSE,FALSE,FALSE,FALSE,FALSE,FALSE,FALSE,,,,FALSE,FALSE,FALSE,FALSE,FALSE,FALSE,FALSE,FALSE,FALSE,FALSE,,FALSE,FALSE,FALSE,FALSE,FALSE,FALSE,FALSE,FALSE,FALSE,FALSE,FALSE,FALSE,FALSE,FALSE,FALSE,FALSE,FALSE,,FALSE,FALSE,,,FALSE,FALSE,FALSE,FALSE,FALSE,,The project did not check Larner's reference to this printed secondary source as part of the research.,SMD,2001-05-15T17:00:16,jhm,2002-10-08T11:29:10
C/EGD/1487,1487,EGD,-1,A/EGD/1473,23/4/1662,1962-04-23T00:00:00,23/4/1662,1962-04-23T00:00:00,,"Wilson,Robert",,,,,,,FALSE,FALSE,FALSE,FALSE,FALSE,FALSE,FALSE,FALSE,FALSE,FALSE,FALSE,FALSE,FALSE,FALSE,FALSE,FALSE,FALSE,FALSE,FALSE,FALSE,FALSE,FALSE,FALSE,FALSE,FALSE,FALSE,FALSE,FALSE,FALSE,FALSE,0,,TRUE,TRUE,FALSE,FALSE,0,,FALSE,,FALSE,,FALSE,FALSE,FALSE,FALSE,FALSE,FALSE,FALSE,,,,FALSE,FALSE,FALSE,FALSE,FALSE,FALSE,FALSE,FALSE,FALSE,FALSE,,FALSE,FALSE,FALSE,FALSE,FALSE,FALSE,FALSE,FALSE,FALSE,FALSE,FALSE,FALSE,FALSE,FALSE,FALSE,FALSE,FALSE,,FALSE,FALSE,,,FALSE,FALSE,FALSE,FALSE,FALSE,,The project did not check Larner's reference to this printed secondary source as part of the research.,SMD,2001-05-15T17:00:16,jhm,2002-10-08T11:29:30
C/EGD/1488,1488,EGD,-1,A/EGD/1474,23/4/1662,1962-04-23T00:00:00,23/4/1662,1962-04-23T00:00:00,,"Pittendreich,Agnes",,,,,,,FALSE,FALSE,FALSE,FALSE,FALSE,FALSE,FALSE,FALSE,FALSE,FALSE,FALSE,FALSE,FALSE,FALSE,FALSE,FALSE,FALSE,FALSE,FALSE,FALSE,FALSE,FALSE,FALSE,FALSE,FALSE,FALSE,FALSE,FALSE,FALSE,FALSE,0,,TRUE,TRUE,FALSE,FALSE,0,,FALSE,,FALSE,,FALSE,FALSE,FALSE,FALSE,FALSE,FALSE,FALSE,,,,FALSE,FALSE,FALSE,FALSE,FALSE,FALSE,FALSE,FALSE,FALSE,FALSE,,FALSE,FALSE,FALSE,FALSE,FALSE,FALSE,FALSE,FALSE,FALSE,FALSE,FALSE,FALSE,FALSE,FALSE,FALSE,FALSE,FALSE,,FALSE,FALSE,,,FALSE,FALSE,FALSE,FALSE,FALSE,,The project did not check Larner's reference to this printed secondary source as part of the research.,SMD,2001-05-15T17:00:16,jhm,2002-10-08T11:30:17
C/EGD/1489,1489,EGD,-1,A/EGD/1475,23/4/1662,1962-04-23T00:00:00,23/4/1662,1962-04-23T00:00:00,,"Bruch,Agnes",,,,,,,FALSE,FALSE,FALSE,FALSE,FALSE,FALSE,FALSE,FALSE,FALSE,FALSE,FALSE,FALSE,FALSE,FALSE,FALSE,FALSE,FALSE,FALSE,FALSE,FALSE,FALSE,FALSE,FALSE,FALSE,FALSE,FALSE,FALSE,FALSE,FALSE,FALSE,0,,TRUE,TRUE,FALSE,FALSE,0,,FALSE,,FALSE,,FALSE,FALSE,FALSE,FALSE,FALSE,FALSE,FALSE,,,,FALSE,FALSE,FALSE,FALSE,FALSE,FALSE,FALSE,FALSE,FALSE,FALSE,,FALSE,FALSE,FALSE,FALSE,FALSE,FALSE,FALSE,FALSE,FALSE,FALSE,FALSE,FALSE,FALSE,FALSE,FALSE,FALSE,FALSE,,FALSE,FALSE,,,FALSE,FALSE,FALSE,FALSE,FALSE,,The project did not check Larner's reference to this printed secondary source as part of the research.,SMD,2001-05-15T17:00:16,jhm,2002-10-08T11:31:08
C/EGD/149,149,EGD,-1,A/EGD/138,7/9/1610,2010-09-07T00:00:00,7/9/1610,2010-09-07T00:00:00,,"Gairdner,Grissel",,,,,,,FALSE,TRUE,FALSE,FALSE,FALSE,FALSE,FALSE,FALSE,FALSE,FALSE,FALSE,FALSE,FALSE,TRUE,FALSE,FALSE,FALSE,FALSE,FALSE,FALSE,FALSE,FALSE,FALSE,FALSE,FALSE,FALSE,FALSE,FALSE,FALSE,FALSE,2,,TRUE,TRUE,FALSE,FALSE,0,,FALSE,,FALSE,,FALSE,FALSE,FALSE,FALSE,FALSE,FALSE,FALSE,,,,FALSE,FALSE,TRUE,FALSE,FALSE,FALSE,FALSE,TRUE,FALSE,FALSE,She called her words 'prayeris',TRUE,FALSE,TRUE,FALSE,FALSE,FALSE,FALSE,FALSE,FALSE,FALSE,FALSE,FALSE,FALSE,FALSE,FALSE,FALSE,FALSE,The illnesses she was accused of casting resulted in great fury and madness.,FALSE,FALSE,,,FALSE,FALSE,FALSE,FALSE,FALSE,,,SMD,2001-05-15T17:00:16,LEM,2002-11-11T11:46:24
C/EGD/1490,1490,EGD,-1,A/EGD/1476,5/5/1662,1962-05-05T00:00:00,5/5/1662,1962-05-05T00:00:00,,"Huggon,Margaret",,,,,,,FALSE,FALSE,FALSE,FALSE,FALSE,FALSE,FALSE,FALSE,FALSE,FALSE,FALSE,FALSE,FALSE,FALSE,FALSE,FALSE,FALSE,FALSE,FALSE,FALSE,FALSE,FALSE,FALSE,FALSE,FALSE,FALSE,FALSE,FALSE,FALSE,FALSE,0,,TRUE,TRUE,FALSE,FALSE,0,,FALSE,,FALSE,,FALSE,FALSE,FALSE,FALSE,FALSE,FALSE,FALSE,,,,FALSE,FALSE,FALSE,FALSE,FALSE,FALSE,FALSE,FALSE,FALSE,FALSE,,FALSE,FALSE,FALSE,FALSE,FALSE,FALSE,FALSE,FALSE,FALSE,FALSE,FALSE,FALSE,FALSE,FALSE,FALSE,FALSE,FALSE,,FALSE,FALSE,,,FALSE,FALSE,FALSE,FALSE,FALSE,,The project did not check Larner's reference to this printed secondary source as part of the research.,SMD,2001-05-15T17:00:16,jhm,2002-10-08T11:34:38
C/EGD/1491,1491,EGD,-1,A/EGD/1477,7/5/1662,1962-05-07T00:00:00,28/7/1662,1962-07-28T00:00:00,,"Anderson,Issobell",,,,,,,FALSE,FALSE,FALSE,FALSE,FALSE,FALSE,FALSE,FALSE,FALSE,FALSE,FALSE,FALSE,FALSE,FALSE,FALSE,FALSE,FALSE,FALSE,FALSE,FALSE,FALSE,FALSE,FALSE,FALSE,FALSE,FALSE,FALSE,FALSE,FALSE,FALSE,0,,TRUE,TRUE,FALSE,FALSE,0,,FALSE,,FALSE,,FALSE,FALSE,FALSE,FALSE,FALSE,FALSE,FALSE,,,,FALSE,FALSE,FALSE,FALSE,FALSE,FALSE,FALSE,FALSE,FALSE,FALSE,,FALSE,FALSE,FALSE,FALSE,FALSE,FALSE,FALSE,FALSE,FALSE,FALSE,FALSE,FALSE,FALSE,FALSE,FALSE,FALSE,FALSE,,FALSE,FALSE,,,FALSE,FALSE,FALSE,FALSE,FALSE,,,SMD,2001-05-15T17:00:16,jhm,2002-10-08T11:35:02
C/EGD/1492,1492,EGD,-1,A/EGD/1478,7/5/1662,1962-05-07T00:00:00,28/7/1662,1962-07-28T00:00:00,,"Hopkirk,Helen",,,,,,,FALSE,FALSE,FALSE,FALSE,FALSE,FALSE,FALSE,FALSE,FALSE,FALSE,FALSE,FALSE,FALSE,FALSE,FALSE,FALSE,FALSE,FALSE,FALSE,FALSE,FALSE,FALSE,FALSE,FALSE,FALSE,FALSE,FALSE,FALSE,FALSE,FALSE,0,,TRUE,TRUE,FALSE,FALSE,0,,FALSE,,FALSE,,FALSE,FALSE,FALSE,FALSE,FALSE,FALSE,FALSE,,,,FALSE,FALSE,FALSE,FALSE,FALSE,FALSE,FALSE,FALSE,FALSE,FALSE,,FALSE,FALSE,FALSE,FALSE,FALSE,FALSE,FALSE,FALSE,FALSE,FALSE,FALSE,FALSE,FALSE,FALSE,FALSE,FALSE,FALSE,,FALSE,FALSE,,,FALSE,FALSE,FALSE,FALSE,FALSE,,,SMD,2001-05-15T17:00:16,jhm,2002-10-08T11:36:29
C/EGD/1493,1493,EGD,-1,A/EGD/1479,7/5/1662,1962-05-07T00:00:00,7/5/1662,1962-05-07T00:00:00,,"Letch,Margret",,,,,,,FALSE,FALSE,FALSE,FALSE,FALSE,FALSE,FALSE,FALSE,FALSE,FALSE,FALSE,FALSE,FALSE,FALSE,FALSE,FALSE,FALSE,FALSE,FALSE,FALSE,FALSE,FALSE,FALSE,FALSE,FALSE,FALSE,FALSE,FALSE,FALSE,FALSE,0,,TRUE,TRUE,FALSE,FALSE,0,,FALSE,,FALSE,,FALSE,FALSE,FALSE,FALSE,FALSE,FALSE,FALSE,,,,FALSE,FALSE,FALSE,FALSE,FALSE,FALSE,FALSE,FALSE,FALSE,FALSE,,FALSE,FALSE,FALSE,FALSE,FALSE,FALSE,FALSE,FALSE,FALSE,FALSE,FALSE,FALSE,FALSE,FALSE,FALSE,FALSE,FALSE,,FALSE,FALSE,,,FALSE,FALSE,FALSE,FALSE,FALSE,,,SMD,2001-05-15T17:00:16,jhm,2002-10-08T11:37:29
C/EGD/1494,1494,EGD,-1,A/EGD/1480,7/5/1662,1962-05-07T00:00:00,7/5/1662,1962-05-07T00:00:00,,"Hynman,Jonet",,,,,,,FALSE,FALSE,FALSE,FALSE,FALSE,FALSE,FALSE,FALSE,FALSE,FALSE,FALSE,FALSE,FALSE,FALSE,FALSE,FALSE,FALSE,FALSE,FALSE,FALSE,FALSE,FALSE,FALSE,FALSE,FALSE,FALSE,FALSE,FALSE,FALSE,FALSE,0,,TRUE,TRUE,FALSE,FALSE,0,,FALSE,,FALSE,,FALSE,FALSE,FALSE,FALSE,FALSE,FALSE,FALSE,,,,FALSE,FALSE,FALSE,FALSE,FALSE,FALSE,FALSE,FALSE,FALSE,FALSE,,FALSE,FALSE,FALSE,FALSE,FALSE,FALSE,FALSE,FALSE,FALSE,FALSE,FALSE,FALSE,FALSE,FALSE,FALSE,FALSE,FALSE,,FALSE,FALSE,,,FALSE,FALSE,FALSE,FALSE,FALSE,,,SMD,2001-05-15T17:00:16,jhm,2002-10-08T11:38:27
C/EGD/1495,1495,EGD,-1,A/EGD/1481,7/5/1662,1962-05-07T00:00:00,7/5/1662,1962-05-07T00:00:00,,"Scott,Kathrin",,,,,,,FALSE,FALSE,FALSE,FALSE,FALSE,FALSE,FALSE,FALSE,FALSE,FALSE,FALSE,FALSE,FALSE,FALSE,FALSE,FALSE,FALSE,FALSE,FALSE,FALSE,FALSE,FALSE,FALSE,FALSE,FALSE,FALSE,FALSE,FALSE,FALSE,FALSE,0,,TRUE,TRUE,FALSE,FALSE,0,,FALSE,,FALSE,,FALSE,FALSE,FALSE,FALSE,FALSE,FALSE,FALSE,,,,FALSE,FALSE,FALSE,FALSE,FALSE,FALSE,FALSE,FALSE,FALSE,FALSE,,FALSE,FALSE,FALSE,FALSE,FALSE,FALSE,FALSE,FALSE,FALSE,FALSE,FALSE,FALSE,FALSE,FALSE,FALSE,FALSE,FALSE,,FALSE,FALSE,,,FALSE,FALSE,FALSE,FALSE,FALSE,,,SMD,2001-05-15T17:00:16,jhm,2002-10-08T11:38:54
C/EGD/1496,1496,EGD,-1,A/EGD/1482,7/5/1662,1962-05-07T00:00:00,7/5/1662,1962-05-07T00:00:00,,"Lawmont,Mary",,,,,,,FALSE,FALSE,FALSE,FALSE,FALSE,FALSE,FALSE,FALSE,FALSE,FALSE,FALSE,FALSE,FALSE,FALSE,FALSE,FALSE,FALSE,FALSE,FALSE,FALSE,FALSE,FALSE,FALSE,FALSE,FALSE,FALSE,FALSE,FALSE,FALSE,FALSE,0,,TRUE,TRUE,FALSE,FALSE,0,,FALSE,,FALSE,,FALSE,FALSE,FALSE,FALSE,FALSE,FALSE,FALSE,,,,FALSE,FALSE,FALSE,FALSE,FALSE,FALSE,FALSE,FALSE,FALSE,FALSE,,FALSE,FALSE,FALSE,FALSE,FALSE,FALSE,FALSE,FALSE,FALSE,FALSE,FALSE,FALSE,FALSE,FALSE,FALSE,FALSE,FALSE,,FALSE,FALSE,,,FALSE,FALSE,FALSE,FALSE,FALSE,,,SMD,2001-05-15T17:00:16,jhm,2002-10-08T11:39:53
C/EGD/1497,1497,EGD,-1,A/EGD/1483,7/5/1662,1962-05-07T00:00:00,7/5/1662,1962-05-07T00:00:00,,"Annand,Jonnet",,,,,,,FALSE,FALSE,FALSE,FALSE,FALSE,FALSE,FALSE,FALSE,FALSE,FALSE,FALSE,FALSE,FALSE,FALSE,FALSE,FALSE,FALSE,FALSE,FALSE,FALSE,FALSE,FALSE,FALSE,FALSE,FALSE,FALSE,FALSE,FALSE,FALSE,FALSE,0,,TRUE,TRUE,FALSE,FALSE,0,,FALSE,,FALSE,,FALSE,FALSE,FALSE,FALSE,FALSE,FALSE,FALSE,,,,FALSE,FALSE,FALSE,FALSE,FALSE,FALSE,FALSE,FALSE,FALSE,FALSE,,FALSE,FALSE,FALSE,FALSE,FALSE,FALSE,FALSE,FALSE,FALSE,FALSE,FALSE,FALSE,FALSE,FALSE,FALSE,FALSE,FALSE,,FALSE,FALSE,,,FALSE,FALSE,FALSE,FALSE,FALSE,,,SMD,2001-05-15T17:00:16,jhm,2002-10-08T11:41:16
C/EGD/1498,1498,EGD,-1,A/EGD/1484,7/5/1662,1962-05-07T00:00:00,7/5/1662,1962-05-07T00:00:00,,"Clow,Elizabeth",,,,,,,FALSE,FALSE,FALSE,FALSE,FALSE,FALSE,FALSE,FALSE,FALSE,FALSE,FALSE,FALSE,FALSE,FALSE,FALSE,FALSE,FALSE,FALSE,FALSE,FALSE,FALSE,FALSE,FALSE,FALSE,FALSE,FALSE,FALSE,FALSE,FALSE,FALSE,0,,TRUE,TRUE,FALSE,FALSE,0,,FALSE,,FALSE,,FALSE,FALSE,FALSE,FALSE,FALSE,FALSE,FALSE,,,,FALSE,FALSE,FALSE,FALSE,FALSE,FALSE,FALSE,FALSE,FALSE,FALSE,,FALSE,FALSE,FALSE,FALSE,FALSE,FALSE,FALSE,FALSE,FALSE,FALSE,FALSE,FALSE,FALSE,FALSE,FALSE,FALSE,FALSE,,FALSE,FALSE,,,FALSE,FALSE,FALSE,FALSE,FALSE,,,SMD,2001-05-15T17:00:16,jhm,2002-10-08T11:42:19
C/EGD/1499,1499,EGD,-1,A/EGD/1485,7/5/1662,1962-05-07T00:00:00,7/5/1662,1962-05-07T00:00:00,,"Innes,Barbara",,,,,,,FALSE,FALSE,FALSE,FALSE,FALSE,FALSE,FALSE,FALSE,FALSE,FALSE,FALSE,FALSE,FALSE,FALSE,FALSE,FALSE,FALSE,FALSE,FALSE,FALSE,FALSE,FALSE,FALSE,FALSE,FALSE,FALSE,FALSE,FALSE,FALSE,FALSE,0,,TRUE,TRUE,FALSE,FALSE,0,,FALSE,,FALSE,,FALSE,FALSE,FALSE,FALSE,FALSE,FALSE,FALSE,,,,FALSE,FALSE,FALSE,FALSE,FALSE,FALSE,FALSE,FALSE,FALSE,FALSE,,FALSE,FALSE,FALSE,FALSE,FALSE,FALSE,FALSE,FALSE,FALSE,FALSE,FALSE,FALSE,FALSE,FALSE,FALSE,FALSE,FALSE,,FALSE,FALSE,,,FALSE,FALSE,FALSE,FALSE,FALSE,,,SMD,2001-05-15T17:00:16,LEM,2002-11-12T16:58:52
C/EGD/15,15,EGD,0,,18/5/1650,1950-05-18T00:00:00,18/5/1650,1950-05-18T00:00:00,,3 unnamed witches,,,,,,3,FALSE,FALSE,FALSE,FALSE,FALSE,FALSE,FALSE,FALSE,FALSE,FALSE,FALSE,FALSE,FALSE,FALSE,FALSE,FALSE,FALSE,FALSE,FALSE,FALSE,FALSE,FALSE,FALSE,FALSE,FALSE,FALSE,FALSE,FALSE,FALSE,FALSE,0,,TRUE,TRUE,FALSE,FALSE,0,,FALSE,,FALSE,,FALSE,FALSE,FALSE,FALSE,FALSE,FALSE,FALSE,,,,FALSE,FALSE,FALSE,FALSE,FALSE,FALSE,FALSE,FALSE,FALSE,FALSE,,FALSE,FALSE,FALSE,FALSE,FALSE,FALSE,FALSE,FALSE,FALSE,FALSE,FALSE,FALSE,FALSE,FALSE,FALSE,FALSE,FALSE,,FALSE,FALSE,,,FALSE,FALSE,FALSE,FALSE,FALSE,,Certain persons from Ayr,SMD,2001-05-15T17:00:16,jhm,2002-10-08T11:43:22
C/EGD/150,150,EGD,-1,A/EGD/139,1611,2011-06-01T00:00:00,1611,2011-06-01T00:00:00,,"Tailyeor,Marioun",,,,,,,FALSE,FALSE,FALSE,FALSE,FALSE,FALSE,FALSE,FALSE,FALSE,FALSE,FALSE,FALSE,FALSE,FALSE,FALSE,FALSE,FALSE,FALSE,FALSE,FALSE,FALSE,FALSE,FALSE,FALSE,FALSE,FALSE,FALSE,FALSE,FALSE,FALSE,0,,TRUE,TRUE,FALSE,FALSE,0,,FALSE,,FALSE,,FALSE,FALSE,FALSE,FALSE,FALSE,FALSE,FALSE,,,,FALSE,FALSE,FALSE,FALSE,FALSE,FALSE,FALSE,FALSE,FALSE,FALSE,,TRUE,TRUE,FALSE,FALSE,FALSE,FALSE,FALSE,FALSE,FALSE,FALSE,FALSE,FALSE,FALSE,FALSE,FALSE,FALSE,FALSE,,FALSE,FALSE,,Also accused of having sex (and a baby) with her sister's husband.,FALSE,FALSE,FALSE,FALSE,FALSE,,,SMD,2001-05-15T17:00:16,jhm,2002-10-08T11:50:33
C/EGD/1500,1500,EGD,-1,A/EGD/1486,7/5/1662,1962-05-07T00:00:00,7/5/1662,1962-05-07T00:00:00,,"Kellie,Margret",,,,,,,FALSE,FALSE,FALSE,FALSE,FALSE,FALSE,FALSE,FALSE,FALSE,FALSE,FALSE,FALSE,FALSE,FALSE,FALSE,FALSE,FALSE,FALSE,FALSE,FALSE,FALSE,FALSE,FALSE,FALSE,FALSE,FALSE,FALSE,FALSE,FALSE,FALSE,0,,TRUE,TRUE,FALSE,FALSE,0,,FALSE,,FALSE,,FALSE,FALSE,FALSE,FALSE,FALSE,FALSE,FALSE,,,,FALSE,FALSE,FALSE,FALSE,FALSE,FALSE,FALSE,FALSE,FALSE,FALSE,,FALSE,FALSE,FALSE,FALSE,FALSE,FALSE,FALSE,FALSE,FALSE,FALSE,FALSE,FALSE,FALSE,FALSE,FALSE,FALSE,FALSE,,FALSE,FALSE,,,FALSE,FALSE,FALSE,FALSE,FALSE,,,SMD,2001-05-15T17:00:16,LEM,2002-11-12T16:59:11
C/EGD/1501,1501,EGD,-1,A/EGD/1487,7/5/1662,1962-05-07T00:00:00,7/5/1662,1962-05-07T00:00:00,,"Simson,Issobell",,,,,,,FALSE,FALSE,FALSE,FALSE,FALSE,FALSE,FALSE,FALSE,FALSE,FALSE,FALSE,FALSE,FALSE,FALSE,FALSE,FALSE,FALSE,FALSE,FALSE,FALSE,FALSE,FALSE,FALSE,FALSE,FALSE,FALSE,FALSE,FALSE,FALSE,FALSE,0,,TRUE,TRUE,FALSE,FALSE,0,,FALSE,,FALSE,,FALSE,FALSE,FALSE,FALSE,FALSE,FALSE,FALSE,,,,FALSE,FALSE,FALSE,FALSE,FALSE,FALSE,FALSE,FALSE,FALSE,FALSE,,FALSE,FALSE,FALSE,FALSE,FALSE,FALSE,FALSE,FALSE,FALSE,FALSE,FALSE,FALSE,FALSE,FALSE,FALSE,FALSE,FALSE,,FALSE,FALSE,,,FALSE,FALSE,FALSE,FALSE,FALSE,,,SMD,2001-05-15T17:00:16,jhm,2002-10-08T11:52:47
C/EGD/1502,1502,EGD,-1,A/EGD/1488,7/5/1662,1962-05-07T00:00:00,7/5/1662,1962-05-07T00:00:00,,"Elder,Issobell",,,,,,,FALSE,FALSE,FALSE,FALSE,FALSE,FALSE,FALSE,FALSE,FALSE,FALSE,FALSE,FALSE,FALSE,FALSE,FALSE,FALSE,FALSE,FALSE,FALSE,FALSE,FALSE,FALSE,FALSE,FALSE,FALSE,FALSE,FALSE,FALSE,FALSE,FALSE,0,,TRUE,TRUE,FALSE,FALSE,0,,FALSE,,FALSE,,FALSE,FALSE,FALSE,FALSE,FALSE,FALSE,FALSE,,,,FALSE,FALSE,FALSE,FALSE,FALSE,FALSE,FALSE,FALSE,FALSE,FALSE,,FALSE,FALSE,FALSE,FALSE,FALSE,FALSE,FALSE,FALSE,FALSE,FALSE,FALSE,FALSE,FALSE,FALSE,FALSE,FALSE,FALSE,,FALSE,FALSE,,,FALSE,FALSE,FALSE,FALSE,FALSE,,,SMD,2001-05-15T17:00:16,jhm,2002-10-08T11:53:20
C/EGD/1503,1503,EGD,-1,A/EGD/1489,7/5/1662,1962-05-07T00:00:00,7/5/1662,1962-05-07T00:00:00,,"Gilchrist,Mary Nein Jon Vic",,,,,,,FALSE,FALSE,FALSE,FALSE,FALSE,FALSE,FALSE,FALSE,FALSE,FALSE,FALSE,FALSE,FALSE,FALSE,FALSE,FALSE,FALSE,FALSE,FALSE,FALSE,FALSE,FALSE,FALSE,FALSE,FALSE,FALSE,FALSE,FALSE,FALSE,FALSE,0,,TRUE,TRUE,FALSE,FALSE,0,,FALSE,,FALSE,,FALSE,FALSE,FALSE,FALSE,FALSE,FALSE,FALSE,,,,FALSE,FALSE,FALSE,FALSE,FALSE,FALSE,FALSE,FALSE,FALSE,FALSE,,FALSE,FALSE,FALSE,FALSE,FALSE,FALSE,FALSE,FALSE,FALSE,FALSE,FALSE,FALSE,FALSE,FALSE,FALSE,FALSE,FALSE,,FALSE,FALSE,,,FALSE,FALSE,FALSE,FALSE,FALSE,,,SMD,2001-05-15T17:00:16,jhm,2002-10-08T11:55:20
C/EGD/1504,1504,EGD,-1,A/EGD/1490,7/5/1662,1962-05-07T00:00:00,7/5/1662,1962-05-07T00:00:00,,"More,Jonet Neill Donald Vic William Vic",,,,,,,FALSE,FALSE,FALSE,FALSE,FALSE,FALSE,FALSE,FALSE,FALSE,FALSE,FALSE,FALSE,FALSE,FALSE,FALSE,FALSE,FALSE,FALSE,FALSE,FALSE,FALSE,FALSE,FALSE,FALSE,FALSE,FALSE,FALSE,FALSE,FALSE,FALSE,0,,TRUE,TRUE,FALSE,FALSE,0,,FALSE,,FALSE,,FALSE,FALSE,FALSE,FALSE,FALSE,FALSE,FALSE,,,,FALSE,FALSE,FALSE,FALSE,FALSE,FALSE,FALSE,FALSE,FALSE,FALSE,,FALSE,FALSE,FALSE,FALSE,FALSE,FALSE,FALSE,FALSE,FALSE,FALSE,FALSE,FALSE,FALSE,FALSE,FALSE,FALSE,FALSE,,FALSE,FALSE,,,FALSE,FALSE,FALSE,FALSE,FALSE,,,SMD,2001-05-15T17:00:16,jhm,2002-10-08T11:55:09
C/EGD/1505,1505,EGD,-1,A/EGD/1491,7/5/1662,1962-05-07T00:00:00,7/5/1662,1962-05-07T00:00:00,,"Oig,Agnes Nein Donald",,,,,,,FALSE,FALSE,FALSE,FALSE,FALSE,FALSE,FALSE,FALSE,FALSE,FALSE,FALSE,FALSE,FALSE,FALSE,FALSE,FALSE,FALSE,FALSE,FALSE,FALSE,FALSE,FALSE,FALSE,FALSE,FALSE,FALSE,FALSE,FALSE,FALSE,FALSE,0,,TRUE,TRUE,FALSE,FALSE,0,,FALSE,,FALSE,,FALSE,FALSE,FALSE,FALSE,FALSE,FALSE,FALSE,,,,FALSE,FALSE,FALSE,FALSE,FALSE,FALSE,FALSE,FALSE,FALSE,FALSE,,FALSE,FALSE,FALSE,FALSE,FALSE,FALSE,FALSE,FALSE,FALSE,FALSE,FALSE,FALSE,FALSE,FALSE,FALSE,FALSE,FALSE,,FALSE,FALSE,,,FALSE,FALSE,FALSE,FALSE,FALSE,,,SMD,2001-05-15T17:00:16,jhm,2002-10-08T11:55:59
C/EGD/1506,1506,EGD,-1,A/EGD/1492,7/5/1662,1962-05-07T00:00:00,28/7/1662,1962-07-28T00:00:00,,"Airth,Jonet",,,,,,,FALSE,FALSE,FALSE,FALSE,FALSE,FALSE,FALSE,FALSE,FALSE,FALSE,FALSE,FALSE,FALSE,FALSE,FALSE,FALSE,FALSE,FALSE,FALSE,FALSE,FALSE,FALSE,FALSE,FALSE,FALSE,FALSE,FALSE,FALSE,FALSE,FALSE,0,,TRUE,TRUE,FALSE,FALSE,0,,FALSE,,FALSE,,FALSE,FALSE,FALSE,FALSE,FALSE,FALSE,FALSE,,,,FALSE,FALSE,FALSE,FALSE,FALSE,FALSE,FALSE,FALSE,FALSE,FALSE,,FALSE,FALSE,FALSE,FALSE,FALSE,FALSE,FALSE,FALSE,FALSE,FALSE,FALSE,FALSE,FALSE,FALSE,FALSE,FALSE,FALSE,,FALSE,FALSE,,,FALSE,FALSE,FALSE,FALSE,FALSE,,,SMD,2001-05-15T17:00:16,jhm,2002-10-08T11:56:40
C/EGD/1507,1507,EGD,-1,A/EGD/1493,7/5/1662,1962-05-07T00:00:00,28/7/1662,1962-07-28T00:00:00,,"Crose,Margrat",,,,,,,FALSE,FALSE,FALSE,FALSE,FALSE,FALSE,FALSE,FALSE,FALSE,FALSE,FALSE,FALSE,FALSE,FALSE,FALSE,FALSE,FALSE,FALSE,FALSE,FALSE,FALSE,FALSE,FALSE,FALSE,FALSE,FALSE,FALSE,FALSE,FALSE,FALSE,0,,TRUE,TRUE,FALSE,FALSE,0,,FALSE,,FALSE,,FALSE,FALSE,FALSE,FALSE,FALSE,FALSE,FALSE,,,,FALSE,FALSE,FALSE,FALSE,FALSE,FALSE,FALSE,FALSE,FALSE,FALSE,,FALSE,FALSE,FALSE,FALSE,FALSE,FALSE,FALSE,FALSE,FALSE,FALSE,FALSE,FALSE,FALSE,FALSE,FALSE,FALSE,FALSE,,FALSE,FALSE,,,FALSE,FALSE,FALSE,FALSE,FALSE,,,SMD,2001-05-15T17:00:16,jhm,2002-10-08T11:57:49
C/EGD/1508,1508,EGD,-1,A/EGD/1494,7/5/1662,1962-05-07T00:00:00,28/7/1662,1962-07-28T00:00:00,,"Ilson,Helen",,,,,,,FALSE,FALSE,FALSE,FALSE,FALSE,FALSE,FALSE,FALSE,FALSE,FALSE,FALSE,FALSE,FALSE,FALSE,FALSE,FALSE,FALSE,FALSE,FALSE,FALSE,FALSE,FALSE,FALSE,FALSE,FALSE,FALSE,FALSE,FALSE,FALSE,FALSE,0,,TRUE,TRUE,FALSE,FALSE,0,,FALSE,,FALSE,,FALSE,FALSE,FALSE,FALSE,FALSE,FALSE,FALSE,,,,FALSE,FALSE,FALSE,FALSE,FALSE,FALSE,FALSE,FALSE,FALSE,FALSE,,FALSE,FALSE,FALSE,FALSE,FALSE,FALSE,FALSE,FALSE,FALSE,FALSE,FALSE,FALSE,FALSE,FALSE,FALSE,FALSE,FALSE,,FALSE,FALSE,,,FALSE,FALSE,FALSE,FALSE,FALSE,,,SMD,2001-05-15T17:00:16,jhm,2002-10-08T11:59:30
C/EGD/1509,1509,EGD,-1,A/EGD/1495,7/5/1662,1962-05-07T00:00:00,7/5/1662,1962-05-07T00:00:00,,"Goold,Issobell",,,,,,,FALSE,FALSE,FALSE,FALSE,FALSE,FALSE,FALSE,FALSE,FALSE,FALSE,FALSE,FALSE,FALSE,FALSE,FALSE,FALSE,FALSE,FALSE,FALSE,FALSE,FALSE,FALSE,FALSE,FALSE,FALSE,FALSE,FALSE,FALSE,FALSE,FALSE,0,,TRUE,TRUE,FALSE,FALSE,0,,FALSE,,FALSE,,FALSE,FALSE,FALSE,FALSE,FALSE,FALSE,FALSE,,,,FALSE,FALSE,FALSE,FALSE,FALSE,FALSE,FALSE,FALSE,FALSE,FALSE,,FALSE,FALSE,FALSE,FALSE,FALSE,FALSE,FALSE,FALSE,FALSE,FALSE,FALSE,FALSE,FALSE,FALSE,FALSE,FALSE,FALSE,,FALSE,FALSE,,,FALSE,FALSE,FALSE,FALSE,FALSE,,,SMD,2001-05-15T17:00:16,jhm,2002-10-08T12:00:43
C/EGD/151,151,EGD,-1,A/EGD/140,1/12/1613,2013-12-01T00:00:00,1/12/1613,2013-12-01T00:00:00,,"Irving,Jonet",,,,,,,FALSE,FALSE,FALSE,TRUE,FALSE,FALSE,FALSE,FALSE,FALSE,FALSE,FALSE,FALSE,FALSE,TRUE,FALSE,FALSE,FALSE,TRUE,FALSE,FALSE,FALSE,TRUE,FALSE,TRUE,FALSE,FALSE,FALSE,FALSE,FALSE,FALSE,5,,TRUE,TRUE,FALSE,FALSE,0,"This person, with 6 others, was charged with using witchcraft, consulting witches, and poisoning to kill John and Alexander Erskine, sons to the late David Erskine in Logy.  I suspect this is a dynastic struggle, since the only listed commissioner for this group trial was Johnne Erskine, 7th Earl of Mar.",FALSE,,FALSE,,FALSE,FALSE,FALSE,FALSE,FALSE,FALSE,FALSE,,,,FALSE,FALSE,FALSE,FALSE,FALSE,FALSE,FALSE,FALSE,FALSE,FALSE,,FALSE,FALSE,FALSE,FALSE,FALSE,FALSE,FALSE,FALSE,FALSE,FALSE,FALSE,FALSE,FALSE,FALSE,FALSE,FALSE,FALSE,,FALSE,FALSE,,,FALSE,FALSE,FALSE,FALSE,FALSE,,,SMD,2001-05-15T17:00:16,LEM,2002-10-10T14:49:38
C/EGD/1510,1510,EGD,-1,A/EGD/1496,7/5/1662,1962-05-07T00:00:00,28/7/1662,1962-07-28T00:00:00,,"Toyes,Jonet",,,,,,,FALSE,FALSE,FALSE,FALSE,FALSE,FALSE,FALSE,FALSE,FALSE,FALSE,FALSE,FALSE,FALSE,FALSE,FALSE,FALSE,FALSE,FALSE,FALSE,FALSE,FALSE,FALSE,FALSE,FALSE,FALSE,FALSE,FALSE,FALSE,FALSE,FALSE,0,,TRUE,TRUE,FALSE,FALSE,0,,FALSE,,FALSE,,FALSE,FALSE,FALSE,FALSE,FALSE,FALSE,FALSE,,,,FALSE,FALSE,FALSE,FALSE,FALSE,FALSE,FALSE,FALSE,FALSE,FALSE,,FALSE,FALSE,FALSE,FALSE,FALSE,FALSE,FALSE,FALSE,FALSE,FALSE,FALSE,FALSE,FALSE,FALSE,FALSE,FALSE,FALSE,,FALSE,FALSE,,,FALSE,FALSE,FALSE,FALSE,FALSE,,,SMD,2001-05-15T17:00:16,jhm,2002-10-08T12:04:54
C/EGD/1511,1511,EGD,-1,A/EGD/1497,7/5/1662,1962-05-07T00:00:00,7/5/1662,1962-05-07T00:00:00,,"Law,Anna",,,,,,,FALSE,FALSE,FALSE,FALSE,FALSE,FALSE,FALSE,FALSE,FALSE,FALSE,FALSE,FALSE,FALSE,FALSE,FALSE,FALSE,FALSE,FALSE,FALSE,FALSE,FALSE,FALSE,FALSE,FALSE,FALSE,FALSE,FALSE,FALSE,FALSE,FALSE,0,,TRUE,TRUE,FALSE,FALSE,0,,FALSE,,FALSE,,FALSE,FALSE,FALSE,FALSE,FALSE,FALSE,FALSE,,,,FALSE,FALSE,FALSE,FALSE,FALSE,FALSE,FALSE,FALSE,FALSE,FALSE,,FALSE,FALSE,FALSE,FALSE,FALSE,FALSE,FALSE,FALSE,FALSE,FALSE,FALSE,FALSE,FALSE,FALSE,FALSE,FALSE,FALSE,,FALSE,FALSE,,,FALSE,FALSE,FALSE,FALSE,FALSE,,,SMD,2001-05-15T17:00:16,jhm,2002-10-08T12:06:26
C/EGD/1512,1512,EGD,-1,A/EGD/1498,7/5/1662,1962-05-07T00:00:00,28/7/1662,1962-07-28T00:00:00,,"Reid,Elspeth",,,,,,,FALSE,FALSE,FALSE,FALSE,FALSE,FALSE,FALSE,FALSE,FALSE,FALSE,FALSE,FALSE,FALSE,FALSE,FALSE,FALSE,FALSE,FALSE,FALSE,FALSE,FALSE,FALSE,FALSE,FALSE,FALSE,FALSE,FALSE,FALSE,FALSE,FALSE,0,,TRUE,TRUE,FALSE,FALSE,0,,FALSE,,FALSE,,FALSE,FALSE,FALSE,FALSE,FALSE,FALSE,FALSE,,,,FALSE,FALSE,FALSE,FALSE,FALSE,FALSE,FALSE,FALSE,FALSE,FALSE,,FALSE,FALSE,FALSE,FALSE,FALSE,FALSE,FALSE,FALSE,FALSE,FALSE,FALSE,FALSE,FALSE,FALSE,FALSE,FALSE,FALSE,,FALSE,FALSE,,,FALSE,FALSE,FALSE,FALSE,FALSE,,,SMD,2001-05-15T17:00:16,jhm,2002-10-08T12:08:49
C/EGD/1513,1513,EGD,-1,A/EGD/1499,7/5/1662,1962-05-07T00:00:00,28/7/1662,1962-07-28T00:00:00,,"McKendley,Issobell",,,,,,,FALSE,FALSE,FALSE,FALSE,FALSE,FALSE,FALSE,FALSE,FALSE,FALSE,FALSE,FALSE,FALSE,FALSE,FALSE,FALSE,FALSE,FALSE,FALSE,FALSE,FALSE,FALSE,FALSE,FALSE,FALSE,FALSE,FALSE,FALSE,FALSE,FALSE,0,,TRUE,TRUE,FALSE,FALSE,0,,FALSE,,FALSE,,FALSE,FALSE,FALSE,FALSE,FALSE,FALSE,FALSE,,,,FALSE,FALSE,FALSE,FALSE,FALSE,FALSE,FALSE,FALSE,FALSE,FALSE,,FALSE,FALSE,FALSE,FALSE,FALSE,FALSE,FALSE,FALSE,FALSE,FALSE,FALSE,FALSE,FALSE,FALSE,FALSE,FALSE,FALSE,,FALSE,FALSE,,,FALSE,FALSE,FALSE,FALSE,FALSE,,,SMD,2001-05-15T17:00:16,jhm,2002-10-08T12:10:27
C/EGD/1514,1514,EGD,-1,A/EGD/1500,7/5/1662,1962-05-07T00:00:00,7/5/1662,1962-05-07T00:00:00,,"Ramsay,Agnes",,,,,,,FALSE,FALSE,FALSE,FALSE,FALSE,FALSE,FALSE,FALSE,FALSE,FALSE,FALSE,FALSE,FALSE,FALSE,FALSE,FALSE,FALSE,FALSE,FALSE,FALSE,FALSE,FALSE,FALSE,FALSE,FALSE,FALSE,FALSE,FALSE,FALSE,FALSE,0,,TRUE,TRUE,FALSE,FALSE,0,,FALSE,,FALSE,,FALSE,FALSE,FALSE,FALSE,FALSE,FALSE,FALSE,,,,FALSE,FALSE,FALSE,FALSE,FALSE,FALSE,FALSE,FALSE,FALSE,FALSE,,FALSE,FALSE,FALSE,FALSE,FALSE,FALSE,FALSE,FALSE,FALSE,FALSE,FALSE,FALSE,FALSE,FALSE,FALSE,FALSE,FALSE,,FALSE,FALSE,,,FALSE,FALSE,FALSE,FALSE,FALSE,,,SMD,2001-05-15T17:00:16,jhm,2002-10-08T12:11:16
C/EGD/1515,1515,EGD,-1,A/EGD/1501,7/5/1662,1962-05-07T00:00:00,7/5/1662,1962-05-07T00:00:00,,"Bining,Jonet",,,,,,,FALSE,FALSE,FALSE,FALSE,FALSE,FALSE,FALSE,FALSE,FALSE,FALSE,FALSE,FALSE,FALSE,FALSE,FALSE,FALSE,FALSE,FALSE,FALSE,FALSE,FALSE,FALSE,FALSE,FALSE,FALSE,FALSE,FALSE,FALSE,FALSE,FALSE,0,,TRUE,TRUE,FALSE,FALSE,0,,FALSE,,FALSE,,FALSE,FALSE,FALSE,FALSE,FALSE,FALSE,FALSE,,,,FALSE,FALSE,FALSE,FALSE,FALSE,FALSE,FALSE,FALSE,FALSE,FALSE,,FALSE,FALSE,FALSE,FALSE,FALSE,FALSE,FALSE,FALSE,FALSE,FALSE,FALSE,FALSE,FALSE,FALSE,FALSE,FALSE,FALSE,,FALSE,FALSE,,,FALSE,FALSE,FALSE,FALSE,FALSE,,,SMD,2001-05-15T17:00:16,jhm,2002-10-08T12:12:08
C/EGD/1516,1516,EGD,-1,A/EGD/1502,7/5/1662,1962-05-07T00:00:00,28/7/1662,1962-07-28T00:00:00,,"Young,Jonet",,,,,,,FALSE,FALSE,FALSE,FALSE,FALSE,FALSE,FALSE,FALSE,FALSE,FALSE,FALSE,FALSE,FALSE,FALSE,FALSE,FALSE,FALSE,FALSE,FALSE,FALSE,FALSE,FALSE,FALSE,FALSE,FALSE,FALSE,FALSE,FALSE,FALSE,FALSE,0,,TRUE,TRUE,FALSE,FALSE,0,,FALSE,,FALSE,,FALSE,FALSE,FALSE,FALSE,FALSE,FALSE,FALSE,,,,FALSE,FALSE,FALSE,FALSE,FALSE,FALSE,FALSE,FALSE,FALSE,FALSE,,FALSE,FALSE,FALSE,FALSE,FALSE,FALSE,FALSE,FALSE,FALSE,FALSE,FALSE,FALSE,FALSE,FALSE,FALSE,FALSE,FALSE,,FALSE,FALSE,,,FALSE,FALSE,FALSE,FALSE,FALSE,,,SMD,2001-05-15T17:00:16,jhm,2002-10-08T12:12:38
C/EGD/1517,1517,EGD,-1,A/EGD/1503,7/5/1662,1962-05-07T00:00:00,7/5/1662,1962-05-07T00:00:00,,"Allan,Jonet",,,,,,,FALSE,FALSE,FALSE,FALSE,FALSE,FALSE,FALSE,FALSE,FALSE,FALSE,FALSE,FALSE,FALSE,FALSE,FALSE,FALSE,FALSE,FALSE,FALSE,FALSE,FALSE,FALSE,FALSE,FALSE,FALSE,FALSE,FALSE,FALSE,FALSE,FALSE,0,,TRUE,TRUE,FALSE,FALSE,0,,FALSE,,FALSE,,FALSE,FALSE,FALSE,FALSE,FALSE,FALSE,FALSE,,,,FALSE,FALSE,FALSE,FALSE,FALSE,FALSE,FALSE,FALSE,FALSE,FALSE,,FALSE,FALSE,FALSE,FALSE,FALSE,FALSE,FALSE,FALSE,FALSE,FALSE,FALSE,FALSE,FALSE,FALSE,FALSE,FALSE,FALSE,,FALSE,FALSE,,,FALSE,FALSE,FALSE,FALSE,FALSE,,,SMD,2001-05-15T17:00:16,jhm,2002-10-08T12:13:21
C/EGD/1518,1518,EGD,-1,A/EGD/1504,7/5/1662,1962-05-07T00:00:00,28/7/1662,1962-07-28T00:00:00,,"Martin,Jonet",,,,,,,FALSE,FALSE,FALSE,FALSE,FALSE,FALSE,FALSE,FALSE,FALSE,FALSE,FALSE,FALSE,FALSE,FALSE,FALSE,FALSE,FALSE,FALSE,FALSE,FALSE,FALSE,FALSE,FALSE,FALSE,FALSE,FALSE,FALSE,FALSE,FALSE,FALSE,0,,TRUE,TRUE,FALSE,FALSE,0,,FALSE,,FALSE,,FALSE,FALSE,FALSE,FALSE,FALSE,FALSE,FALSE,,,,FALSE,FALSE,FALSE,FALSE,FALSE,FALSE,FALSE,FALSE,FALSE,FALSE,,FALSE,FALSE,FALSE,FALSE,FALSE,FALSE,FALSE,FALSE,FALSE,FALSE,FALSE,FALSE,FALSE,FALSE,FALSE,FALSE,FALSE,,FALSE,FALSE,,,FALSE,FALSE,FALSE,FALSE,FALSE,,,SMD,2001-05-15T17:00:16,jhm,2002-10-08T12:13:50
C/EGD/1519,1519,EGD,-1,A/EGD/1505,7/5/1662,1962-05-07T00:00:00,7/5/1662,1962-05-07T00:00:00,,"Robe,Jonet",,,,,,,FALSE,FALSE,FALSE,FALSE,FALSE,FALSE,FALSE,FALSE,FALSE,FALSE,FALSE,FALSE,FALSE,FALSE,FALSE,FALSE,FALSE,FALSE,FALSE,FALSE,FALSE,FALSE,FALSE,FALSE,FALSE,FALSE,FALSE,FALSE,FALSE,FALSE,0,,TRUE,TRUE,FALSE,FALSE,0,,FALSE,,FALSE,,FALSE,FALSE,FALSE,FALSE,FALSE,FALSE,FALSE,,,,FALSE,FALSE,FALSE,FALSE,FALSE,FALSE,FALSE,FALSE,FALSE,FALSE,,FALSE,FALSE,FALSE,FALSE,FALSE,FALSE,FALSE,FALSE,FALSE,FALSE,FALSE,FALSE,FALSE,FALSE,FALSE,FALSE,FALSE,,FALSE,FALSE,,,FALSE,FALSE,FALSE,FALSE,FALSE,,,SMD,2001-05-15T17:00:16,jhm,2002-10-08T12:14:51
C/EGD/152,152,EGD,-1,A/EGD/141,30/10/1613,2013-10-30T00:00:00,1/12/1613,2013-12-01T00:00:00,,"Erskine,Robert",,,,,,,FALSE,FALSE,FALSE,TRUE,FALSE,FALSE,FALSE,FALSE,FALSE,FALSE,FALSE,FALSE,FALSE,TRUE,FALSE,FALSE,FALSE,FALSE,FALSE,FALSE,TRUE,TRUE,FALSE,TRUE,FALSE,FALSE,FALSE,FALSE,FALSE,FALSE,5,,FALSE,FALSE,FALSE,FALSE,0,He and his sisters were accused of killing their nephews in order to inherent his dead elder brother's land and title of Laird of Dun.  They hired a witch.,FALSE,,FALSE,,FALSE,FALSE,FALSE,FALSE,FALSE,FALSE,FALSE,,,,FALSE,FALSE,FALSE,FALSE,FALSE,FALSE,FALSE,FALSE,FALSE,FALSE,He used poison obtained by his sisters from a witch to poison his nephews.,TRUE,TRUE,FALSE,FALSE,FALSE,FALSE,FALSE,FALSE,FALSE,FALSE,FALSE,FALSE,FALSE,FALSE,FALSE,FALSE,FALSE,,FALSE,FALSE,,,FALSE,FALSE,FALSE,FALSE,FALSE,,,SMD,2001-05-15T17:00:16,jhm,2002-10-08T12:39:27
C/EGD/1520,1520,EGD,-1,A/EGD/1506,7/5/1662,1962-05-07T00:00:00,28/7/1662,1962-07-28T00:00:00,,"Dumbar,Jean",,,,,,,FALSE,FALSE,FALSE,FALSE,FALSE,FALSE,FALSE,FALSE,FALSE,FALSE,FALSE,FALSE,FALSE,FALSE,FALSE,FALSE,FALSE,FALSE,FALSE,FALSE,FALSE,FALSE,FALSE,FALSE,FALSE,FALSE,FALSE,FALSE,FALSE,FALSE,0,,TRUE,TRUE,FALSE,FALSE,0,,FALSE,,FALSE,,FALSE,FALSE,FALSE,FALSE,FALSE,FALSE,FALSE,,,,FALSE,FALSE,FALSE,FALSE,FALSE,FALSE,FALSE,FALSE,FALSE,FALSE,,FALSE,FALSE,FALSE,FALSE,FALSE,FALSE,FALSE,FALSE,FALSE,FALSE,FALSE,FALSE,FALSE,FALSE,FALSE,FALSE,FALSE,,FALSE,FALSE,,,FALSE,FALSE,FALSE,FALSE,FALSE,,,SMD,2001-05-15T17:00:16,jhm,2002-10-08T12:23:24
C/EGD/1521,1521,EGD,-1,A/EGD/1507,7/5/1662,1962-05-07T00:00:00,7/5/1662,1962-05-07T00:00:00,,"Crauford,Jonet",,,,,,,FALSE,FALSE,FALSE,FALSE,FALSE,FALSE,FALSE,FALSE,FALSE,FALSE,FALSE,FALSE,FALSE,FALSE,FALSE,FALSE,FALSE,FALSE,FALSE,FALSE,FALSE,FALSE,FALSE,FALSE,FALSE,FALSE,FALSE,FALSE,FALSE,FALSE,0,,TRUE,TRUE,FALSE,FALSE,0,,FALSE,,FALSE,,FALSE,FALSE,FALSE,FALSE,FALSE,FALSE,FALSE,,,,FALSE,FALSE,FALSE,FALSE,FALSE,FALSE,FALSE,FALSE,FALSE,FALSE,,FALSE,FALSE,FALSE,FALSE,FALSE,FALSE,FALSE,FALSE,FALSE,FALSE,FALSE,FALSE,FALSE,FALSE,FALSE,FALSE,FALSE,,FALSE,FALSE,,,FALSE,FALSE,FALSE,FALSE,FALSE,,,SMD,2001-05-15T17:00:16,jhm,2002-10-08T12:24:35
C/EGD/1522,1522,EGD,-1,A/EGD/1508,7/5/1662,1962-05-07T00:00:00,7/5/1662,1962-05-07T00:00:00,,"Duff,Margret",,,,,,,FALSE,FALSE,FALSE,FALSE,FALSE,FALSE,FALSE,FALSE,FALSE,FALSE,FALSE,FALSE,FALSE,FALSE,FALSE,FALSE,FALSE,FALSE,FALSE,FALSE,FALSE,FALSE,FALSE,FALSE,FALSE,FALSE,FALSE,FALSE,FALSE,FALSE,0,,TRUE,TRUE,FALSE,FALSE,0,,FALSE,,FALSE,,FALSE,FALSE,FALSE,FALSE,FALSE,FALSE,FALSE,,,,FALSE,FALSE,FALSE,FALSE,FALSE,FALSE,FALSE,FALSE,FALSE,FALSE,,FALSE,FALSE,FALSE,FALSE,FALSE,FALSE,FALSE,FALSE,FALSE,FALSE,FALSE,FALSE,FALSE,FALSE,FALSE,FALSE,FALSE,,FALSE,FALSE,,,FALSE,FALSE,FALSE,FALSE,FALSE,,,SMD,2001-05-15T17:00:16,jhm,2002-10-08T12:26:19
C/EGD/1523,1523,EGD,-1,A/EGD/1509,7/5/1662,1962-05-07T00:00:00,7/5/1662,1962-05-07T00:00:00,,"King,Jean",,,,,,,FALSE,FALSE,FALSE,FALSE,FALSE,FALSE,FALSE,FALSE,FALSE,FALSE,FALSE,FALSE,FALSE,FALSE,FALSE,FALSE,FALSE,FALSE,FALSE,FALSE,FALSE,FALSE,FALSE,FALSE,FALSE,FALSE,FALSE,FALSE,FALSE,FALSE,0,,TRUE,TRUE,FALSE,FALSE,0,,FALSE,,FALSE,,FALSE,FALSE,FALSE,FALSE,FALSE,FALSE,FALSE,,,,FALSE,FALSE,FALSE,FALSE,FALSE,FALSE,FALSE,FALSE,FALSE,FALSE,,FALSE,FALSE,FALSE,FALSE,FALSE,FALSE,FALSE,FALSE,FALSE,FALSE,FALSE,FALSE,FALSE,FALSE,FALSE,FALSE,FALSE,,FALSE,FALSE,,,FALSE,FALSE,FALSE,FALSE,FALSE,,,SMD,2001-05-15T17:00:16,jhm,2002-10-08T12:27:04
C/EGD/1525,1525,EGD,-1,A/EGD/1511,7/5/1662,1962-05-07T00:00:00,7/5/1662,1962-05-07T00:00:00,,"Rankin,Margret",,,,,,,FALSE,FALSE,FALSE,FALSE,FALSE,FALSE,FALSE,FALSE,FALSE,FALSE,FALSE,FALSE,FALSE,FALSE,FALSE,FALSE,FALSE,FALSE,FALSE,FALSE,FALSE,FALSE,FALSE,FALSE,FALSE,FALSE,FALSE,FALSE,FALSE,FALSE,0,,TRUE,TRUE,FALSE,FALSE,0,,FALSE,,FALSE,,FALSE,FALSE,FALSE,FALSE,FALSE,FALSE,FALSE,,,,FALSE,FALSE,FALSE,FALSE,FALSE,FALSE,FALSE,FALSE,FALSE,FALSE,,FALSE,FALSE,FALSE,FALSE,FALSE,FALSE,FALSE,FALSE,FALSE,FALSE,FALSE,FALSE,FALSE,FALSE,FALSE,FALSE,FALSE,,FALSE,FALSE,,,FALSE,FALSE,FALSE,FALSE,FALSE,,,SMD,2001-05-15T17:00:16,jhm,2002-10-08T12:27:50
C/EGD/1526,1526,EGD,-1,A/EGD/1512,28/1/1662,1962-01-28T00:00:00,28/1/1662,1962-01-28T00:00:00,,"McNickell,Margret",,,,,,,FALSE,FALSE,FALSE,FALSE,FALSE,FALSE,FALSE,FALSE,FALSE,FALSE,FALSE,FALSE,FALSE,FALSE,FALSE,FALSE,FALSE,TRUE,FALSE,FALSE,FALSE,FALSE,FALSE,FALSE,FALSE,FALSE,FALSE,FALSE,FALSE,FALSE,1,,TRUE,TRUE,FALSE,FALSE,0,,FALSE,,FALSE,,FALSE,FALSE,FALSE,FALSE,FALSE,FALSE,FALSE,,,,FALSE,FALSE,FALSE,FALSE,FALSE,FALSE,FALSE,FALSE,FALSE,FALSE,,FALSE,FALSE,FALSE,FALSE,FALSE,FALSE,FALSE,FALSE,FALSE,FALSE,FALSE,FALSE,FALSE,FALSE,FALSE,FALSE,FALSE,,FALSE,FALSE,,,FALSE,FALSE,FALSE,FALSE,FALSE,,,SMD,2001-05-15T17:00:16,jhm,2002-10-10T11:02:32
C/EGD/1527,1527,EGD,-1,A/EGD/1513,21/1/1662,1962-01-21T00:00:00,21/2/1662,1962-02-21T00:00:00,,"NcNicol,Issobell",,,,,,,FALSE,TRUE,FALSE,FALSE,FALSE,TRUE,FALSE,FALSE,FALSE,FALSE,FALSE,FALSE,TRUE,TRUE,FALSE,FALSE,FALSE,TRUE,FALSE,FALSE,FALSE,FALSE,FALSE,FALSE,FALSE,FALSE,FALSE,FALSE,FALSE,FALSE,5,,FALSE,FALSE,FALSE,FALSE,0,,FALSE,,TRUE,,TRUE,FALSE,FALSE,FALSE,FALSE,FALSE,FALSE,,,Met the devil in her own house when she was brewing aqua vita. Also met him with others.,FALSE,FALSE,FALSE,FALSE,FALSE,FALSE,FALSE,TRUE,FALSE,FALSE,,FALSE,TRUE,FALSE,FALSE,FALSE,FALSE,FALSE,FALSE,FALSE,FALSE,FALSE,FALSE,FALSE,FALSE,FALSE,FALSE,FALSE,Witnessed claimed that NcNicol threatened harm after she had been insulted - a man had put a paper on her face. His children died after their faces had turned black.,FALSE,FALSE,,,FALSE,FALSE,FALSE,FALSE,FALSE,,,SMD,2001-05-15T17:00:16,LEM,2002-11-11T11:54:58
C/EGD/1529,1529,EGD,-1,A/EGD/1515,7/5/1662,1962-05-07T00:00:00,7/5/1662,1962-05-07T00:00:00,,"McIllvein,Margret",,,,,,,FALSE,FALSE,FALSE,FALSE,FALSE,FALSE,FALSE,FALSE,FALSE,FALSE,FALSE,FALSE,FALSE,FALSE,FALSE,FALSE,FALSE,FALSE,FALSE,FALSE,FALSE,FALSE,FALSE,FALSE,FALSE,FALSE,FALSE,FALSE,FALSE,FALSE,0,,TRUE,TRUE,FALSE,FALSE,0,,FALSE,,FALSE,,FALSE,FALSE,FALSE,FALSE,FALSE,FALSE,FALSE,,,,FALSE,FALSE,FALSE,FALSE,FALSE,FALSE,FALSE,FALSE,FALSE,FALSE,,FALSE,FALSE,FALSE,FALSE,FALSE,FALSE,FALSE,FALSE,FALSE,FALSE,FALSE,FALSE,FALSE,FALSE,FALSE,FALSE,FALSE,,FALSE,FALSE,,,FALSE,FALSE,FALSE,FALSE,FALSE,,,SMD,2001-05-15T17:00:16,jhm,2002-10-08T12:34:56
C/EGD/153,153,EGD,-1,A/EGD/142,1/12/1613,2013-12-01T00:00:00,22/6/1614,2014-06-22T00:00:00,,"Erskine,Annas",,,,,,,FALSE,FALSE,FALSE,TRUE,FALSE,FALSE,FALSE,FALSE,FALSE,FALSE,FALSE,FALSE,FALSE,TRUE,FALSE,FALSE,FALSE,FALSE,FALSE,FALSE,TRUE,TRUE,FALSE,TRUE,FALSE,FALSE,FALSE,FALSE,FALSE,FALSE,5,,FALSE,FALSE,FALSE,FALSE,0,"This person, along with 6 others, was charged with using witchcraft, consulting witches, and poisoning to kill John and Alexander Erskine, sons to the late David Erskine in Logie.  I suspect this is a dynastic struggle, especially since the only listed commissioner for this group trial was Johnne Erskine, 7th Earl of Mar.",FALSE,,FALSE,,FALSE,FALSE,FALSE,FALSE,FALSE,FALSE,FALSE,,,,FALSE,FALSE,FALSE,FALSE,FALSE,FALSE,FALSE,FALSE,FALSE,FALSE,,TRUE,TRUE,FALSE,FALSE,FALSE,FALSE,FALSE,FALSE,FALSE,FALSE,FALSE,FALSE,FALSE,FALSE,FALSE,FALSE,FALSE,Accused of trying to poison her nephews. Consulted witches.,FALSE,FALSE,,,FALSE,FALSE,FALSE,FALSE,FALSE,,,SMD,2001-05-15T17:00:16,jhm,2002-10-08T12:44:40
C/EGD/1530,1530,EGD,-1,A/EGD/1516,7/5/1662,1962-05-07T00:00:00,7/5/1662,1962-05-07T00:00:00,,"McCan,Issobell",,,,,,,FALSE,FALSE,FALSE,FALSE,FALSE,FALSE,FALSE,FALSE,FALSE,FALSE,FALSE,FALSE,FALSE,FALSE,FALSE,FALSE,FALSE,FALSE,FALSE,FALSE,FALSE,FALSE,FALSE,FALSE,FALSE,FALSE,FALSE,FALSE,FALSE,FALSE,0,,TRUE,TRUE,FALSE,FALSE,0,,FALSE,,FALSE,,FALSE,FALSE,FALSE,FALSE,FALSE,FALSE,FALSE,,,,FALSE,FALSE,FALSE,FALSE,FALSE,FALSE,FALSE,FALSE,FALSE,FALSE,,FALSE,FALSE,FALSE,FALSE,FALSE,FALSE,FALSE,FALSE,FALSE,FALSE,FALSE,FALSE,FALSE,FALSE,FALSE,FALSE,FALSE,,FALSE,FALSE,,,FALSE,FALSE,FALSE,FALSE,FALSE,,,SMD,2001-05-15T17:00:16,jhm,2002-10-08T12:45:39
C/EGD/1532,1532,EGD,-1,A/EGD/1518,7/5/1662,1962-05-07T00:00:00,7/5/1662,1962-05-07T00:00:00,,"Edison,Margret",,,,,,,FALSE,FALSE,FALSE,FALSE,FALSE,FALSE,FALSE,FALSE,FALSE,FALSE,FALSE,FALSE,FALSE,FALSE,FALSE,FALSE,FALSE,FALSE,FALSE,FALSE,FALSE,FALSE,FALSE,FALSE,FALSE,FALSE,FALSE,FALSE,FALSE,FALSE,0,,TRUE,TRUE,FALSE,FALSE,0,,FALSE,,FALSE,,FALSE,FALSE,FALSE,FALSE,FALSE,FALSE,FALSE,,,,FALSE,FALSE,FALSE,FALSE,FALSE,FALSE,FALSE,FALSE,FALSE,FALSE,,FALSE,FALSE,FALSE,FALSE,FALSE,FALSE,FALSE,FALSE,FALSE,FALSE,FALSE,FALSE,FALSE,FALSE,FALSE,FALSE,FALSE,,FALSE,FALSE,,,FALSE,FALSE,FALSE,FALSE,FALSE,,,SMD,2001-05-15T17:00:16,jhm,2002-10-08T14:16:04
C/EGD/1533,1533,EGD,-1,A/EGD/1519,26/1/1662,1962-01-26T00:00:00,14/2/1662,1962-02-14T00:00:00,29,"NcLevin,Margaret",,,,,,,FALSE,TRUE,FALSE,FALSE,FALSE,TRUE,FALSE,FALSE,FALSE,FALSE,FALSE,TRUE,TRUE,TRUE,FALSE,FALSE,FALSE,FALSE,FALSE,FALSE,FALSE,FALSE,FALSE,FALSE,FALSE,FALSE,FALSE,FALSE,FALSE,FALSE,5,,FALSE,FALSE,FALSE,FALSE,0,"There is quite a lot of detail from NcLevin's confessions. She named at least 20 or more other people who attended meetings. The objective for these meetings would appear to have been malefice, particularly killing children and adults.",FALSE,She refused his advances initially but the the devil hurt the middle finger of her right hand - he almost cut it off - which was very painful. Also her right leg was hurt. She then agreed to make a covenant with him in return for his healing her injuries.,TRUE,,TRUE,FALSE,FALSE,FALSE,FALSE,TRUE,FALSE,,,A group carried a corpse on a beirtree. NcLevin appears to have named various people who attended different meetings.,FALSE,FALSE,TRUE,TRUE,FALSE,FALSE,FALSE,TRUE,TRUE,FALSE,"Said she knew charms to cure the evil eye, wristing or brising (?) and the glaick. These involved rituals and charms spoken in Gaelic. She used water, a curchif (handkerchief or scarf), herbs. To cure the glaik she would take the person (child) to the place where the herb grew, avoiding seeing any other person. Picks up the herb through a broch (brooch) takes it home and seiths (sains?/bless) it on the fire. Thsi she would give as a drink, three times.",TRUE,TRUE,FALSE,FALSE,FALSE,FALSE,FALSE,FALSE,FALSE,TRUE,FALSE,FALSE,FALSE,FALSE,TRUE,TRUE,FALSE,"Said they took the life of a child when they went to Scoulage. Also confessed to other killings on different occasions, and they all seem to have been children. Asked to remove a bewitchment",TRUE,TRUE,"Claimed the devil took her under his arm out to a boat. She was then to pull out the mast, but the boat did not sink because God intervened. Also said she raised a storm by throwing a stone in the sea.",,FALSE,FALSE,FALSE,FALSE,FALSE,,,SMD,2001-05-15T17:00:16,jhm,2002-10-08T14:28:09
C/EGD/1534,1534,EGD,-1,A/EGD/1520,29/1/1662,1962-01-29T00:00:00,29/1/1662,1962-01-29T00:00:00,,"McAllexander,Wife of Soirle",,,,,,,FALSE,FALSE,FALSE,FALSE,FALSE,FALSE,FALSE,FALSE,FALSE,FALSE,FALSE,FALSE,FALSE,FALSE,FALSE,FALSE,FALSE,TRUE,FALSE,FALSE,FALSE,FALSE,FALSE,FALSE,FALSE,FALSE,FALSE,FALSE,FALSE,FALSE,1,,TRUE,TRUE,FALSE,FALSE,0,,FALSE,,FALSE,,FALSE,FALSE,FALSE,FALSE,FALSE,FALSE,FALSE,,,,FALSE,FALSE,FALSE,FALSE,FALSE,FALSE,FALSE,FALSE,FALSE,FALSE,,FALSE,FALSE,FALSE,FALSE,FALSE,FALSE,FALSE,FALSE,FALSE,FALSE,FALSE,FALSE,FALSE,FALSE,FALSE,FALSE,FALSE,,FALSE,FALSE,,,FALSE,FALSE,FALSE,FALSE,FALSE,,,SMD,2001-05-15T17:00:16,jhm,2002-10-10T11:17:45
C/EGD/1535,1535,EGD,-1,A/EGD/1521,16/1/1662,1962-01-16T00:00:00,14/2/1662,1962-02-14T00:00:00,,"McNeill,Jonat",,,,,,,FALSE,FALSE,FALSE,FALSE,FALSE,FALSE,FALSE,FALSE,FALSE,FALSE,FALSE,FALSE,FALSE,FALSE,FALSE,FALSE,FALSE,TRUE,FALSE,FALSE,FALSE,FALSE,FALSE,FALSE,FALSE,FALSE,FALSE,FALSE,FALSE,FALSE,1,,TRUE,TRUE,FALSE,FALSE,0,,FALSE,,FALSE,,FALSE,FALSE,FALSE,FALSE,FALSE,FALSE,FALSE,,,,FALSE,FALSE,FALSE,FALSE,FALSE,FALSE,FALSE,FALSE,FALSE,FALSE,,FALSE,FALSE,FALSE,FALSE,FALSE,FALSE,FALSE,FALSE,FALSE,FALSE,FALSE,FALSE,FALSE,FALSE,FALSE,FALSE,FALSE,It was claimed that she healed a child but there are no details recorded from McNeill herself.,FALSE,FALSE,,,FALSE,FALSE,FALSE,FALSE,FALSE,,,SMD,2001-05-15T17:00:16,jhm,2002-10-10T11:01:32
C/EGD/1536,1536,EGD,-1,A/EGD/1522,28/1/1662,1962-01-28T00:00:00,28/1/1662,1962-01-28T00:00:00,,"Stewart,Daughter of black Heu",,,,,,,FALSE,FALSE,FALSE,FALSE,FALSE,FALSE,FALSE,FALSE,FALSE,FALSE,FALSE,FALSE,FALSE,FALSE,FALSE,FALSE,FALSE,TRUE,FALSE,FALSE,FALSE,FALSE,FALSE,FALSE,FALSE,FALSE,FALSE,FALSE,FALSE,FALSE,1,,TRUE,TRUE,FALSE,FALSE,0,,FALSE,,FALSE,,FALSE,FALSE,FALSE,FALSE,FALSE,FALSE,FALSE,,,,FALSE,FALSE,FALSE,FALSE,FALSE,FALSE,FALSE,FALSE,FALSE,FALSE,,FALSE,FALSE,FALSE,FALSE,FALSE,FALSE,FALSE,FALSE,FALSE,FALSE,FALSE,FALSE,FALSE,FALSE,FALSE,FALSE,FALSE,,FALSE,FALSE,,,FALSE,FALSE,FALSE,FALSE,FALSE,,,SMD,2001-05-15T17:00:16,jhm,2002-10-10T11:06:28
C/EGD/1537,1537,EGD,-1,A/EGD/1523,28/1/1662,1962-01-28T00:00:00,28/1/1662,1962-01-28T00:00:00,,"Stewart,Marie",,,,,,,FALSE,FALSE,FALSE,FALSE,FALSE,FALSE,FALSE,FALSE,FALSE,FALSE,FALSE,FALSE,FALSE,FALSE,FALSE,FALSE,FALSE,TRUE,FALSE,FALSE,FALSE,FALSE,FALSE,FALSE,FALSE,FALSE,FALSE,FALSE,FALSE,FALSE,1,,TRUE,TRUE,FALSE,FALSE,0,,FALSE,,FALSE,,FALSE,FALSE,FALSE,FALSE,FALSE,FALSE,FALSE,,,,FALSE,FALSE,FALSE,FALSE,FALSE,FALSE,FALSE,FALSE,FALSE,FALSE,,FALSE,FALSE,FALSE,FALSE,FALSE,FALSE,FALSE,FALSE,FALSE,FALSE,FALSE,FALSE,FALSE,FALSE,FALSE,FALSE,FALSE,,FALSE,FALSE,,,FALSE,FALSE,FALSE,FALSE,FALSE,,,SMD,2001-05-15T17:00:16,jhm,2002-10-10T11:06:07
C/EGD/1538,1538,EGD,-1,A/EGD/1524,28/1/1662,1962-01-28T00:00:00,28/1/1662,1962-01-28T00:00:00,,"Heyman,Annie",,,,,,,FALSE,FALSE,FALSE,FALSE,FALSE,FALSE,FALSE,FALSE,FALSE,FALSE,FALSE,FALSE,FALSE,FALSE,FALSE,FALSE,FALSE,TRUE,FALSE,FALSE,FALSE,FALSE,FALSE,FALSE,FALSE,FALSE,FALSE,FALSE,FALSE,FALSE,1,,TRUE,TRUE,FALSE,FALSE,0,,FALSE,,FALSE,,FALSE,FALSE,FALSE,FALSE,FALSE,FALSE,FALSE,,,,FALSE,FALSE,FALSE,FALSE,FALSE,FALSE,FALSE,FALSE,FALSE,FALSE,,FALSE,FALSE,FALSE,FALSE,FALSE,FALSE,FALSE,FALSE,FALSE,FALSE,FALSE,FALSE,FALSE,FALSE,FALSE,FALSE,FALSE,,FALSE,FALSE,,,FALSE,FALSE,FALSE,FALSE,FALSE,,,SMD,2001-05-15T17:00:16,jhm,2002-10-10T11:03:06
C/EGD/1539,1539,EGD,-1,A/EGD/1525,28/1/1662,1962-01-28T00:00:00,28/1/1662,1962-01-28T00:00:00,,"McIllmartin,Daughter of Alexander",,,,,,,FALSE,FALSE,FALSE,FALSE,FALSE,FALSE,FALSE,FALSE,FALSE,FALSE,FALSE,FALSE,FALSE,FALSE,FALSE,FALSE,FALSE,TRUE,FALSE,FALSE,FALSE,FALSE,FALSE,FALSE,FALSE,FALSE,FALSE,FALSE,FALSE,FALSE,1,,TRUE,TRUE,FALSE,FALSE,0,Claimed by another confessing woman that she attended witches meetings.,FALSE,,FALSE,,FALSE,FALSE,FALSE,FALSE,FALSE,FALSE,FALSE,,,"Claimed by Margret NcLevin that she attended witches' meetings, but no details from accused.",FALSE,FALSE,FALSE,FALSE,FALSE,FALSE,FALSE,FALSE,FALSE,FALSE,,FALSE,FALSE,FALSE,FALSE,FALSE,FALSE,FALSE,FALSE,FALSE,FALSE,FALSE,FALSE,FALSE,FALSE,FALSE,FALSE,FALSE,,FALSE,FALSE,,,FALSE,FALSE,FALSE,FALSE,FALSE,,,SMD,2001-05-15T17:00:16,jhm,2002-10-10T11:17:38
C/EGD/154,154,EGD,-1,A/EGD/143,1/12/1613,2013-12-01T00:00:00,22/6/1614,2014-06-22T00:00:00,,"Erskine,Issobell",,,,,,,FALSE,FALSE,FALSE,TRUE,FALSE,FALSE,FALSE,FALSE,FALSE,FALSE,FALSE,FALSE,FALSE,TRUE,FALSE,FALSE,FALSE,FALSE,FALSE,FALSE,TRUE,TRUE,FALSE,TRUE,FALSE,FALSE,FALSE,FALSE,FALSE,FALSE,5,,FALSE,FALSE,FALSE,FALSE,0,"This person, with 6 others, was charged with using witchcraft, consulting witches, and poisoning to kill John and Alexander Erskine sons to the late David Erskind in Logy.  I suspect this is a dynastic struggle, especially since the only listed commissioner for this group trial was Johnne Erskine, 7th Earl of Mar.",FALSE,,FALSE,,FALSE,FALSE,FALSE,FALSE,FALSE,FALSE,FALSE,,,,FALSE,FALSE,FALSE,FALSE,FALSE,FALSE,FALSE,FALSE,FALSE,FALSE,,TRUE,TRUE,FALSE,FALSE,FALSE,FALSE,FALSE,FALSE,FALSE,FALSE,FALSE,FALSE,FALSE,FALSE,FALSE,FALSE,FALSE,Accused of trying to poison her nephews.,FALSE,FALSE,,,FALSE,FALSE,FALSE,FALSE,FALSE,,,SMD,2001-05-15T17:00:16,LEM,2002-12-06T12:13:24
C/EGD/1540,1540,EGD,-1,A/EGD/1526,28/1/1662,1962-01-28T00:00:00,28/1/1662,1962-01-28T00:00:00,,"Frissell,Eldest son of Katharine Moor",,,,,,,FALSE,FALSE,FALSE,FALSE,FALSE,FALSE,FALSE,FALSE,FALSE,FALSE,FALSE,FALSE,FALSE,FALSE,FALSE,FALSE,FALSE,TRUE,FALSE,FALSE,FALSE,FALSE,FALSE,FALSE,FALSE,FALSE,FALSE,FALSE,FALSE,FALSE,1,,TRUE,TRUE,FALSE,FALSE,0,,FALSE,,FALSE,,FALSE,FALSE,FALSE,FALSE,FALSE,FALSE,FALSE,,,,FALSE,FALSE,FALSE,FALSE,FALSE,FALSE,FALSE,FALSE,FALSE,FALSE,,FALSE,FALSE,FALSE,FALSE,FALSE,FALSE,FALSE,FALSE,FALSE,FALSE,FALSE,FALSE,FALSE,FALSE,FALSE,FALSE,FALSE,,FALSE,FALSE,,,FALSE,FALSE,FALSE,FALSE,FALSE,,,SMD,2001-05-15T17:00:16,jhm,2002-10-10T11:04:23
C/EGD/1541,1541,EGD,-1,A/EGD/1527,16/1/1662,1962-01-16T00:00:00,5/2/1662,1962-02-05T00:00:00,,"Moore,Katharine",,,,,,,FALSE,FALSE,FALSE,FALSE,FALSE,FALSE,FALSE,FALSE,FALSE,FALSE,FALSE,FALSE,FALSE,FALSE,FALSE,FALSE,FALSE,TRUE,FALSE,FALSE,FALSE,FALSE,FALSE,FALSE,FALSE,FALSE,FALSE,FALSE,FALSE,FALSE,1,,TRUE,TRUE,FALSE,FALSE,0,,FALSE,,FALSE,,FALSE,FALSE,FALSE,FALSE,FALSE,FALSE,FALSE,,,,FALSE,FALSE,FALSE,FALSE,FALSE,FALSE,FALSE,FALSE,FALSE,FALSE,,FALSE,FALSE,FALSE,FALSE,FALSE,FALSE,FALSE,FALSE,FALSE,FALSE,FALSE,FALSE,FALSE,FALSE,FALSE,FALSE,FALSE,,FALSE,FALSE,,,FALSE,FALSE,FALSE,FALSE,FALSE,,,SMD,2001-05-15T17:00:16,jhm,2002-12-06T12:27:37
C/EGD/1542,1542,EGD,-1,A/EGD/1528,23/1/1662,1962-01-23T00:00:00,28/1/1662,1962-01-28T00:00:00,,"Ballantyne,Cirstine",,,,,,,FALSE,FALSE,FALSE,FALSE,FALSE,FALSE,FALSE,FALSE,FALSE,FALSE,FALSE,FALSE,FALSE,FALSE,FALSE,FALSE,FALSE,TRUE,FALSE,FALSE,FALSE,FALSE,FALSE,FALSE,FALSE,FALSE,FALSE,FALSE,FALSE,FALSE,1,,TRUE,TRUE,FALSE,FALSE,0,,FALSE,,FALSE,,FALSE,FALSE,FALSE,FALSE,FALSE,FALSE,FALSE,,,,FALSE,FALSE,FALSE,FALSE,FALSE,FALSE,FALSE,FALSE,FALSE,FALSE,,FALSE,FALSE,FALSE,FALSE,FALSE,FALSE,FALSE,FALSE,FALSE,FALSE,FALSE,FALSE,FALSE,FALSE,FALSE,FALSE,FALSE,,FALSE,FALSE,,,FALSE,FALSE,FALSE,FALSE,FALSE,,,SMD,2001-05-15T17:00:16,jhm,2002-10-10T10:59:07
C/EGD/1543,1543,EGD,-1,A/EGD/1529,28/1/1662,1962-01-28T00:00:00,26/3/1662,1962-03-26T00:00:00,,"Frissell,Kathrine",,,,,,,FALSE,FALSE,FALSE,FALSE,FALSE,FALSE,FALSE,FALSE,FALSE,FALSE,FALSE,FALSE,FALSE,FALSE,FALSE,FALSE,FALSE,TRUE,FALSE,FALSE,FALSE,FALSE,FALSE,FALSE,FALSE,FALSE,FALSE,FALSE,FALSE,FALSE,1,,TRUE,TRUE,FALSE,FALSE,0,,FALSE,,FALSE,,FALSE,FALSE,FALSE,FALSE,FALSE,FALSE,FALSE,,,,FALSE,FALSE,FALSE,FALSE,FALSE,FALSE,FALSE,FALSE,FALSE,FALSE,,FALSE,FALSE,FALSE,FALSE,FALSE,FALSE,FALSE,FALSE,FALSE,FALSE,FALSE,FALSE,FALSE,FALSE,FALSE,FALSE,FALSE,,FALSE,FALSE,,,FALSE,FALSE,FALSE,FALSE,FALSE,,,SMD,2001-05-15T17:00:16,jhm,2002-10-10T11:03:14
C/EGD/1544,1544,EGD,-1,A/EGD/1530,28/1/1662,1962-01-28T00:00:00,7/5/1662,1962-05-07T00:00:00,,"McIllmartine,Jonet",,,,,,,FALSE,FALSE,FALSE,FALSE,FALSE,TRUE,FALSE,FALSE,FALSE,FALSE,FALSE,FALSE,FALSE,TRUE,FALSE,FALSE,FALSE,TRUE,FALSE,FALSE,FALSE,FALSE,FALSE,FALSE,FALSE,FALSE,FALSE,FALSE,FALSE,FALSE,3,,TRUE,TRUE,FALSE,FALSE,0,Confessed to pact and named several others.,FALSE,Appears to have confessed to pact.,FALSE,,FALSE,FALSE,FALSE,FALSE,FALSE,FALSE,FALSE,,,,FALSE,FALSE,FALSE,FALSE,FALSE,FALSE,FALSE,FALSE,FALSE,FALSE,,FALSE,FALSE,FALSE,FALSE,FALSE,FALSE,FALSE,FALSE,FALSE,FALSE,FALSE,FALSE,FALSE,FALSE,FALSE,FALSE,FALSE,,FALSE,FALSE,,,FALSE,FALSE,FALSE,FALSE,FALSE,,,SMD,2001-05-15T17:00:16,LEM,2002-10-10T11:03:01
C/EGD/1545,1545,EGD,-1,A/EGD/1531,24/6/1649,2049-06-24T00:00:00,26/3/1662,1962-03-26T00:00:00,,"McKaw,Issobell More",,,,,,,FALSE,FALSE,FALSE,TRUE,FALSE,FALSE,FALSE,FALSE,FALSE,FALSE,FALSE,FALSE,FALSE,FALSE,FALSE,FALSE,FALSE,FALSE,FALSE,FALSE,FALSE,FALSE,FALSE,FALSE,FALSE,FALSE,FALSE,FALSE,FALSE,FALSE,1,,FALSE,TRUE,TRUE,TRUE,2,,FALSE,,FALSE,,FALSE,FALSE,FALSE,FALSE,FALSE,FALSE,FALSE,,,,FALSE,FALSE,FALSE,TRUE,FALSE,FALSE,FALSE,FALSE,TRUE,FALSE,This involved a group of people who confessed to turning the riddle - sieve. McKaw said it was to get some silver for her mother although it is not clear if this silver had been lost. Kirk session were troubled by the case but did not indicate it was witchcraft.,FALSE,FALSE,FALSE,FALSE,FALSE,FALSE,FALSE,FALSE,FALSE,FALSE,FALSE,FALSE,FALSE,FALSE,FALSE,FALSE,FALSE,,FALSE,FALSE,,,FALSE,FALSE,FALSE,FALSE,FALSE,,,SMD,2001-05-15T17:00:16,jhm,2002-10-08T15:28:17
C/EGD/1546,1546,EGD,-1,A/EGD/1532,28/1/1662,1962-01-28T00:00:00,28/1/1662,1962-01-28T00:00:00,,"McKaw,Patrick",,,,,,,FALSE,FALSE,FALSE,FALSE,FALSE,FALSE,FALSE,FALSE,FALSE,FALSE,FALSE,FALSE,FALSE,FALSE,FALSE,FALSE,FALSE,TRUE,FALSE,FALSE,FALSE,FALSE,FALSE,FALSE,FALSE,FALSE,FALSE,FALSE,FALSE,FALSE,1,,TRUE,TRUE,FALSE,FALSE,0,,FALSE,,FALSE,,FALSE,FALSE,FALSE,FALSE,FALSE,FALSE,FALSE,,,,FALSE,FALSE,FALSE,FALSE,FALSE,FALSE,FALSE,FALSE,FALSE,FALSE,,FALSE,FALSE,FALSE,FALSE,FALSE,FALSE,FALSE,FALSE,FALSE,FALSE,FALSE,FALSE,FALSE,FALSE,FALSE,FALSE,FALSE,,FALSE,FALSE,,,FALSE,FALSE,FALSE,FALSE,FALSE,,,SMD,2001-05-15T17:00:16,jhm,2002-10-10T11:03:46
C/EGD/1547,1547,EGD,-1,A/EGD/1533,28/1/1662,1962-01-28T00:00:00,28/1/1662,1962-01-28T00:00:00,,"Cristell,Kathrine",,,,,,,FALSE,FALSE,FALSE,FALSE,FALSE,FALSE,FALSE,FALSE,FALSE,FALSE,FALSE,FALSE,FALSE,FALSE,FALSE,FALSE,FALSE,TRUE,FALSE,FALSE,FALSE,FALSE,FALSE,FALSE,FALSE,FALSE,FALSE,FALSE,FALSE,FALSE,1,,TRUE,TRUE,FALSE,FALSE,0,,FALSE,,FALSE,,FALSE,FALSE,FALSE,FALSE,FALSE,FALSE,FALSE,,,,FALSE,FALSE,FALSE,FALSE,FALSE,FALSE,FALSE,FALSE,FALSE,FALSE,,FALSE,FALSE,FALSE,FALSE,FALSE,FALSE,FALSE,FALSE,FALSE,FALSE,FALSE,FALSE,FALSE,FALSE,FALSE,FALSE,FALSE,,FALSE,FALSE,,,FALSE,FALSE,FALSE,FALSE,FALSE,,,SMD,2001-05-15T17:00:16,jhm,2002-10-10T11:04:01
C/EGD/1548,1548,EGD,-1,A/EGD/1534,22/1/1662,1962-01-22T00:00:00,28/1/1662,1962-01-28T00:00:00,,"McConachie,Jonat",,,,,,,FALSE,FALSE,FALSE,FALSE,FALSE,FALSE,FALSE,FALSE,FALSE,FALSE,FALSE,FALSE,FALSE,FALSE,FALSE,FALSE,FALSE,TRUE,FALSE,FALSE,FALSE,FALSE,FALSE,FALSE,FALSE,FALSE,FALSE,FALSE,FALSE,FALSE,1,,TRUE,TRUE,FALSE,FALSE,0,,FALSE,,FALSE,,FALSE,FALSE,FALSE,FALSE,FALSE,FALSE,FALSE,,,,FALSE,FALSE,FALSE,FALSE,FALSE,FALSE,FALSE,FALSE,FALSE,FALSE,,FALSE,FALSE,FALSE,FALSE,FALSE,FALSE,FALSE,FALSE,FALSE,FALSE,FALSE,FALSE,FALSE,FALSE,FALSE,FALSE,FALSE,,FALSE,FALSE,,,FALSE,FALSE,FALSE,FALSE,FALSE,,,SMD,2001-05-15T17:00:16,jhm,2002-10-10T10:58:48
C/EGD/1549,1549,EGD,-1,A/EGD/1535,22/1/1662,1962-01-22T00:00:00,14/2/1662,1962-02-14T00:00:00,,"Gely,John",,,,,,,FALSE,FALSE,FALSE,FALSE,FALSE,FALSE,FALSE,FALSE,FALSE,FALSE,FALSE,FALSE,FALSE,FALSE,FALSE,FALSE,FALSE,TRUE,FALSE,FALSE,FALSE,FALSE,FALSE,FALSE,FALSE,FALSE,FALSE,FALSE,FALSE,FALSE,1,,TRUE,TRUE,FALSE,FALSE,0,,FALSE,,FALSE,,FALSE,FALSE,FALSE,FALSE,FALSE,FALSE,FALSE,,,,FALSE,FALSE,FALSE,FALSE,FALSE,FALSE,FALSE,FALSE,FALSE,FALSE,,FALSE,FALSE,FALSE,FALSE,FALSE,FALSE,FALSE,FALSE,FALSE,FALSE,FALSE,FALSE,FALSE,FALSE,FALSE,FALSE,FALSE,,FALSE,FALSE,,,FALSE,FALSE,FALSE,FALSE,FALSE,,,SMD,2001-05-15T17:00:16,LEM,2002-10-10T10:58:15
C/EGD/1550,1550,EGD,-1,A/EGD/1536,29/1/1662,1962-01-29T00:00:00,29/1/1662,1962-01-29T00:00:00,,"Stewart,Kathrine",,,,,,,FALSE,FALSE,FALSE,FALSE,FALSE,FALSE,FALSE,FALSE,FALSE,FALSE,FALSE,FALSE,FALSE,FALSE,FALSE,FALSE,FALSE,TRUE,FALSE,FALSE,FALSE,FALSE,FALSE,FALSE,FALSE,FALSE,FALSE,FALSE,FALSE,FALSE,1,,TRUE,TRUE,FALSE,FALSE,0,,FALSE,,FALSE,,FALSE,FALSE,FALSE,FALSE,FALSE,FALSE,FALSE,,,,FALSE,FALSE,FALSE,FALSE,FALSE,FALSE,FALSE,FALSE,FALSE,FALSE,,FALSE,FALSE,FALSE,FALSE,FALSE,FALSE,FALSE,FALSE,FALSE,FALSE,FALSE,FALSE,FALSE,FALSE,FALSE,FALSE,FALSE,,FALSE,FALSE,,,FALSE,FALSE,FALSE,FALSE,FALSE,,,SMD,2001-05-15T17:00:16,jhm,2002-10-10T11:18:14
C/EGD/1551,1551,EGD,-1,A/EGD/1537,19/5/1662,1962-05-19T00:00:00,19/5/1662,1962-05-19T00:00:00,,"Blyth,Isobell",,,,,,,FALSE,FALSE,FALSE,FALSE,FALSE,FALSE,FALSE,FALSE,FALSE,FALSE,FALSE,FALSE,FALSE,FALSE,FALSE,FALSE,FALSE,FALSE,FALSE,FALSE,FALSE,FALSE,FALSE,FALSE,FALSE,FALSE,FALSE,FALSE,FALSE,FALSE,0,,TRUE,TRUE,FALSE,FALSE,0,,FALSE,,FALSE,,FALSE,FALSE,FALSE,FALSE,FALSE,FALSE,FALSE,,,,FALSE,FALSE,FALSE,FALSE,FALSE,FALSE,FALSE,FALSE,FALSE,FALSE,,FALSE,FALSE,FALSE,FALSE,FALSE,FALSE,FALSE,FALSE,FALSE,FALSE,FALSE,FALSE,FALSE,FALSE,FALSE,FALSE,FALSE,,FALSE,FALSE,,,FALSE,FALSE,FALSE,FALSE,FALSE,,,SMD,2001-05-15T17:00:16,jhm,2002-10-08T15:35:47
C/EGD/1552,1552,EGD,-1,A/EGD/1538,19/5/1662,1962-05-19T00:00:00,10/7/1662,1962-07-10T00:00:00,,"Grieve,Jon",,,,,,,FALSE,FALSE,FALSE,FALSE,FALSE,FALSE,FALSE,FALSE,FALSE,FALSE,FALSE,FALSE,FALSE,FALSE,FALSE,FALSE,FALSE,FALSE,FALSE,FALSE,FALSE,FALSE,FALSE,FALSE,FALSE,FALSE,FALSE,FALSE,FALSE,FALSE,0,,TRUE,TRUE,FALSE,FALSE,0,,FALSE,,FALSE,,FALSE,FALSE,FALSE,FALSE,FALSE,FALSE,FALSE,,,,FALSE,FALSE,FALSE,FALSE,FALSE,FALSE,FALSE,FALSE,FALSE,FALSE,,FALSE,FALSE,FALSE,FALSE,FALSE,FALSE,FALSE,FALSE,FALSE,FALSE,FALSE,FALSE,FALSE,FALSE,FALSE,FALSE,FALSE,,FALSE,FALSE,,,FALSE,FALSE,FALSE,FALSE,FALSE,,,SMD,2001-05-15T17:00:16,jhm,2002-10-08T15:36:49
C/EGD/1553,1553,EGD,-1,A/EGD/1539,19/5/1662,1962-05-19T00:00:00,19/5/1662,1962-05-19T00:00:00,,"Scoby,Kathrin",,,,,,,FALSE,FALSE,FALSE,FALSE,FALSE,FALSE,FALSE,FALSE,FALSE,FALSE,FALSE,FALSE,FALSE,FALSE,FALSE,FALSE,FALSE,FALSE,FALSE,FALSE,FALSE,FALSE,FALSE,FALSE,FALSE,FALSE,FALSE,FALSE,FALSE,FALSE,0,,TRUE,TRUE,FALSE,FALSE,0,,FALSE,,FALSE,,FALSE,FALSE,FALSE,FALSE,FALSE,FALSE,FALSE,,,,FALSE,FALSE,FALSE,FALSE,FALSE,FALSE,FALSE,FALSE,FALSE,FALSE,,FALSE,FALSE,FALSE,FALSE,FALSE,FALSE,FALSE,FALSE,FALSE,FALSE,FALSE,FALSE,FALSE,FALSE,FALSE,FALSE,FALSE,,FALSE,FALSE,,,FALSE,FALSE,FALSE,FALSE,FALSE,,,SMD,2001-05-15T17:00:16,jhm,2002-10-08T15:37:56
C/EGD/1554,1554,EGD,-1,A/EGD/1540,19/5/1662,1962-05-19T00:00:00,19/5/1662,1962-05-19T00:00:00,,"Gilivory,Jonet",,,,,,,FALSE,FALSE,FALSE,FALSE,FALSE,FALSE,FALSE,FALSE,FALSE,FALSE,FALSE,FALSE,FALSE,FALSE,FALSE,FALSE,FALSE,FALSE,FALSE,FALSE,FALSE,FALSE,FALSE,FALSE,FALSE,FALSE,FALSE,FALSE,FALSE,FALSE,0,,TRUE,TRUE,FALSE,FALSE,0,,FALSE,,FALSE,,FALSE,FALSE,FALSE,FALSE,FALSE,FALSE,FALSE,,,,FALSE,FALSE,FALSE,FALSE,FALSE,FALSE,FALSE,FALSE,FALSE,FALSE,,FALSE,FALSE,FALSE,FALSE,FALSE,FALSE,FALSE,FALSE,FALSE,FALSE,FALSE,FALSE,FALSE,FALSE,FALSE,FALSE,FALSE,,FALSE,FALSE,,,FALSE,FALSE,FALSE,FALSE,FALSE,,,SMD,2001-05-15T17:00:16,jhm,2002-10-08T15:38:55
C/EGD/1555,1555,EGD,-1,A/EGD/1541,19/5/1662,1962-05-19T00:00:00,16/9/1662,1962-09-16T00:00:00,,"Robison,Masie",,,,,,,FALSE,FALSE,FALSE,FALSE,FALSE,TRUE,FALSE,FALSE,FALSE,FALSE,FALSE,FALSE,FALSE,FALSE,FALSE,FALSE,FALSE,FALSE,FALSE,FALSE,FALSE,FALSE,FALSE,FALSE,FALSE,FALSE,FALSE,FALSE,FALSE,FALSE,1,,TRUE,TRUE,FALSE,FALSE,0,Recorded as having confessed to pact and renunciation of baptism but no details from confession or accusation,FALSE,It was claimed that she confessed to pact but no details.,FALSE,,FALSE,FALSE,FALSE,FALSE,FALSE,FALSE,FALSE,,,,FALSE,FALSE,FALSE,FALSE,FALSE,FALSE,FALSE,FALSE,FALSE,FALSE,,FALSE,FALSE,FALSE,FALSE,FALSE,FALSE,FALSE,FALSE,FALSE,FALSE,FALSE,FALSE,FALSE,FALSE,FALSE,FALSE,FALSE,,FALSE,FALSE,,,FALSE,FALSE,FALSE,FALSE,FALSE,,,SMD,2001-05-15T17:00:16,jhm,2002-10-18T12:01:58
C/EGD/1556,1556,EGD,-1,A/EGD/1542,19/5/1662,1962-05-19T00:00:00,10/7/1662,1962-07-10T00:00:00,,"Wauch,Agnes",,,,,,,FALSE,FALSE,FALSE,FALSE,FALSE,FALSE,FALSE,FALSE,FALSE,FALSE,FALSE,FALSE,FALSE,FALSE,FALSE,FALSE,FALSE,FALSE,FALSE,FALSE,FALSE,FALSE,FALSE,FALSE,FALSE,FALSE,FALSE,FALSE,FALSE,FALSE,0,,TRUE,TRUE,FALSE,FALSE,0,,FALSE,,FALSE,,FALSE,FALSE,FALSE,FALSE,FALSE,FALSE,FALSE,,,,FALSE,FALSE,FALSE,FALSE,FALSE,FALSE,FALSE,FALSE,FALSE,FALSE,,FALSE,FALSE,FALSE,FALSE,FALSE,FALSE,FALSE,FALSE,FALSE,FALSE,FALSE,FALSE,FALSE,FALSE,FALSE,FALSE,FALSE,,FALSE,FALSE,,,FALSE,FALSE,FALSE,FALSE,FALSE,,,SMD,2001-05-15T17:00:16,jhm,2002-10-08T15:41:49
C/EGD/1557,1557,EGD,-1,A/EGD/1543,19/5/1662,1962-05-19T00:00:00,8/8/1662,1962-08-08T00:00:00,,"Hay,John",,,,,,,FALSE,FALSE,FALSE,FALSE,FALSE,FALSE,FALSE,FALSE,FALSE,FALSE,FALSE,FALSE,FALSE,FALSE,FALSE,FALSE,FALSE,FALSE,FALSE,FALSE,FALSE,FALSE,FALSE,FALSE,FALSE,FALSE,FALSE,FALSE,FALSE,FALSE,0,,TRUE,TRUE,FALSE,FALSE,0,,FALSE,,FALSE,,FALSE,FALSE,FALSE,FALSE,FALSE,FALSE,FALSE,,,,FALSE,FALSE,FALSE,FALSE,FALSE,FALSE,FALSE,FALSE,FALSE,FALSE,,FALSE,FALSE,FALSE,FALSE,FALSE,FALSE,FALSE,FALSE,FALSE,FALSE,FALSE,FALSE,FALSE,FALSE,FALSE,FALSE,FALSE,,FALSE,FALSE,,,FALSE,FALSE,FALSE,FALSE,FALSE,,,SMD,2001-05-15T17:00:16,jhm,2002-10-08T15:42:46
C/EGD/1558,1558,EGD,-1,A/EGD/1544,13/4/1662,1962-04-13T00:00:00,10/7/1662,1962-07-10T00:00:00,,"Gowdie,Issobell",,,,,,,FALSE,TRUE,FALSE,FALSE,TRUE,TRUE,FALSE,FALSE,FALSE,TRUE,FALSE,TRUE,FALSE,TRUE,FALSE,FALSE,FALSE,FALSE,FALSE,FALSE,FALSE,FALSE,FALSE,FALSE,FALSE,FALSE,FALSE,FALSE,FALSE,FALSE,6,,FALSE,FALSE,FALSE,TRUE,1,"The commission does not give any information about accusations.  Her confessions in Pitcairn are too detailed to be able to put all the information in this case.  Anyone interested in her case should consult the printed documents!  This case could be the source for many of our modern ideas about witches (covens of 13, riding broomsticks, shape-changing, and lurid witches' meetings).  But is should be remembered that this case is not typical of most Scottish witchcraft cases.",FALSE,"She met the Devil in the Kirk of Auldearn. He was at the reader's desk with a black book in his hand.  He baptised her with blood he sucked out of her Devil's mark, spouted it in her hand and sprinkled it over her head.  His nature was cold.  She said that each witch had a spirit to wait on them.  One woman's was named 'swein' and was clothed in grass-green.  The text has detailed descriptions of people's spirits.  Her spirit was called 'The read reiver' and was dressed in black.  The Devil baptised her as 'Janet'.  The Devil's member was great and long.  She said that younger women had greater pleasure in sex with the Devil than with their own husbands.  The Devil beat them at meetings.  The Devil gave them money that turned into horse dung.",TRUE,,TRUE,TRUE,TRUE,FALSE,FALSE,TRUE,FALSE,,,"At Nairn she claimed that she and two others raised an unchristened child and used it to make a potion (see folk culture section for details).  She talked about covens and claimed to have 13 people in her coven.  Her coven danced on a hill with another coven.  At one meeting she yoked a plough of paddocks (toads).  They used this to take the fruit of the land.  The officer of her coven was man.  They often stole food from people.  She described taking grain and animals and leaving empty husks (later developed in fairylore).  Described flying on straw (corn straw, wild straw).  They did a ritual with a thread with three knots in a dye-house, they took away the dye and turned it all black.  She said that each coven of 13 had an officer (who is male) and a maiden (who is female).  The Devil took the maiden over the dyk.",TRUE,TRUE,TRUE,TRUE,FALSE,TRUE,FALSE,TRUE,TRUE,FALSE,"She confessed to mixing the body of an unchristened child with nail trimmings, grain and cole-wort and chopping it all up very small and used it to take away the fruit of a man's corn.  Described night flight and flying on straw and a broom.  Said she used shot to send a soul to heaven but the body remained on earth.  She met the Queen of Fairy in the downie-hill and was given meat.  In the fairy hill she saw elf-bulls.  Took away milk using a tether (could restore milk by cutting the tether).  Did all this in the Devil's name.  She made an image of the Laird of Park to destroy his children (with others).  Detailed description of how the image was made.  Nearly the same description given by Janet Braidheid of the wax image!  She confessed to shape-changing with others- she was a kea (jackdaw) and the others were a cat and a hare.  They tied a thread with three knots and did something widdershins.  They raised the wind with a wet cloth and a beetle and specific words.  Their spirits can raise the wind.  She linked the elves and the Devil by saying that the Devil gave elves instructions on how to use and make elfshot and that they fire the shot in the Devil's name.  Special ritual described for shape-changing.  Had different words for each animal (cat, hare, crow, horse.  She lists different verbal charms to use for healing various ailments (bone-shaw, fevers).  For her first 'voyage' she went to the plough lands and shot a man and they made a potion by boiling ingredients and saying words they learned from the Devil.",TRUE,TRUE,TRUE,FALSE,FALSE,FALSE,FALSE,FALSE,FALSE,FALSE,FALSE,FALSE,FALSE,FALSE,TRUE,FALSE,FALSE,"She took away cow's milk by using a tether.  She also took away ale.  Words used o cure boneshaw and fevers,",TRUE,TRUE,Raised the wind with a wet cloth wet and a beetle in water.,,FALSE,FALSE,FALSE,FALSE,FALSE,,,SMD,2001-05-15T17:00:16,jhm,2002-10-18T12:23:31
C/EGD/1559,1559,EGD,-1,A/EGD/1545,12/6/1662,1962-06-12T00:00:00,12/6/1662,1962-06-12T00:00:00,,"McKenzie,Margret",,,,,,,FALSE,FALSE,FALSE,FALSE,FALSE,FALSE,FALSE,FALSE,FALSE,FALSE,FALSE,FALSE,FALSE,FALSE,FALSE,FALSE,FALSE,FALSE,FALSE,FALSE,FALSE,FALSE,FALSE,FALSE,FALSE,FALSE,FALSE,FALSE,FALSE,FALSE,0,,TRUE,TRUE,FALSE,FALSE,0,No details of confession.,FALSE,,FALSE,,FALSE,FALSE,FALSE,FALSE,FALSE,FALSE,FALSE,,,,FALSE,FALSE,FALSE,FALSE,FALSE,FALSE,FALSE,FALSE,FALSE,FALSE,,FALSE,FALSE,FALSE,FALSE,FALSE,FALSE,FALSE,FALSE,FALSE,FALSE,FALSE,FALSE,FALSE,FALSE,FALSE,FALSE,FALSE,,FALSE,FALSE,,,FALSE,FALSE,FALSE,FALSE,FALSE,,,SMD,2001-05-15T17:00:16,LEM,2002-12-04T14:25:26
C/EGD/156,156,EGD,-1,A/EGD/145,19/2/1622,2022-02-19T00:00:00,22/3/1622,2022-03-22T00:00:00,34,"Wallace,Margaret",,,,,,,FALSE,FALSE,FALSE,TRUE,FALSE,FALSE,FALSE,FALSE,FALSE,FALSE,FALSE,TRUE,FALSE,TRUE,FALSE,FALSE,FALSE,TRUE,TRUE,TRUE,FALSE,FALSE,FALSE,FALSE,FALSE,FALSE,FALSE,FALSE,FALSE,FALSE,6,,FALSE,FALSE,FALSE,FALSE,0,"The main protagonist in terms of healing was her associate, Christiane Grahame.  The reasons for accusations against M. Wallace seem to have been related to her quarrels and her husband's business.  She was mainly accused by other burgesses of roughly the same social and economic standing.",FALSE,,TRUE,,FALSE,FALSE,FALSE,FALSE,FALSE,FALSE,FALSE,,,,FALSE,FALSE,FALSE,FALSE,FALSE,FALSE,FALSE,FALSE,FALSE,FALSE,,TRUE,TRUE,FALSE,FALSE,FALSE,FALSE,TRUE,FALSE,TRUE,FALSE,TRUE,TRUE,FALSE,FALSE,FALSE,FALSE,FALSE,,FALSE,FALSE,,,TRUE,FALSE,TRUE,TRUE,FALSE,No words or deeds; admits to blasphemy,,SMD,2001-05-15T17:00:16,jhm,2002-10-18T12:33:15
C/EGD/1560,1560,EGD,-1,A/EGD/1546,12/6/1662,1962-06-12T00:00:00,12/6/1662,1962-06-12T00:00:00,,"McGillivorich,Agnes",,,,,,,FALSE,FALSE,FALSE,FALSE,FALSE,FALSE,FALSE,FALSE,FALSE,FALSE,FALSE,FALSE,FALSE,FALSE,FALSE,FALSE,FALSE,FALSE,FALSE,FALSE,FALSE,FALSE,FALSE,FALSE,FALSE,FALSE,FALSE,FALSE,FALSE,FALSE,0,,TRUE,TRUE,FALSE,FALSE,0,No details from confession.,FALSE,,FALSE,,FALSE,FALSE,FALSE,FALSE,FALSE,FALSE,FALSE,,,,FALSE,FALSE,FALSE,FALSE,FALSE,FALSE,FALSE,FALSE,FALSE,FALSE,,FALSE,FALSE,FALSE,FALSE,FALSE,FALSE,FALSE,FALSE,FALSE,FALSE,FALSE,FALSE,FALSE,FALSE,FALSE,FALSE,FALSE,,FALSE,FALSE,,,FALSE,FALSE,FALSE,FALSE,FALSE,,,SMD,2001-05-15T17:00:16,jhm,2002-10-18T12:34:58
C/EGD/1561,1561,EGD,-1,A/EGD/1547,12/6/1662,1962-06-12T00:00:00,12/6/1662,1962-06-12T00:00:00,,"Vane,Agnes Nic Ean",,,,,,,FALSE,FALSE,FALSE,FALSE,FALSE,FALSE,FALSE,FALSE,FALSE,FALSE,FALSE,FALSE,FALSE,FALSE,FALSE,FALSE,FALSE,FALSE,FALSE,FALSE,FALSE,FALSE,FALSE,FALSE,FALSE,FALSE,FALSE,FALSE,FALSE,FALSE,0,,TRUE,TRUE,FALSE,FALSE,0,No details of confession.,FALSE,,FALSE,,FALSE,FALSE,FALSE,FALSE,FALSE,FALSE,FALSE,,,,FALSE,FALSE,FALSE,FALSE,FALSE,FALSE,FALSE,FALSE,FALSE,FALSE,,FALSE,FALSE,FALSE,FALSE,FALSE,FALSE,FALSE,FALSE,FALSE,FALSE,FALSE,FALSE,FALSE,FALSE,FALSE,FALSE,FALSE,,FALSE,FALSE,,,FALSE,FALSE,FALSE,FALSE,FALSE,,,SMD,2001-05-15T17:00:16,jhm,2002-10-18T12:36:35
C/EGD/1562,1562,EGD,-1,A/EGD/1548,10/1/1662,1962-01-10T00:00:00,16/9/1662,1962-09-16T00:00:00,,"Guthrie,Elizabeth",,,,,,,FALSE,FALSE,FALSE,FALSE,FALSE,FALSE,FALSE,FALSE,FALSE,FALSE,FALSE,FALSE,FALSE,FALSE,FALSE,FALSE,FALSE,FALSE,FALSE,FALSE,FALSE,FALSE,FALSE,FALSE,FALSE,FALSE,FALSE,FALSE,FALSE,FALSE,0,,TRUE,TRUE,FALSE,FALSE,0,,FALSE,,FALSE,,FALSE,FALSE,FALSE,FALSE,FALSE,FALSE,FALSE,,,,FALSE,FALSE,FALSE,FALSE,FALSE,FALSE,FALSE,FALSE,FALSE,FALSE,,FALSE,FALSE,FALSE,FALSE,FALSE,FALSE,FALSE,FALSE,FALSE,FALSE,FALSE,FALSE,FALSE,FALSE,FALSE,FALSE,FALSE,,FALSE,FALSE,,,FALSE,FALSE,FALSE,FALSE,FALSE,,,SMD,2001-05-15T17:00:16,jhm,2002-10-18T12:37:14
